Comment ID,Comment Text,Comment Score,Comment Depth,Created Timestamp,Author,Edited,Semantic Label,Semantic Label 2,Semantic Label 3,Major_Semantic
crvo8wz,Buy bottled water,-8,0,1433448028.0,,False,neutral,neutral,neutral,neutral
crv2rqg,"https://twitter.com/redditindia/status/606348623257833472

People can retweet this tweet to other journalists and publications. ",205,1,1433399832.0,Envia,False,neutral,neutral,neutral,neutral
crv4csq,They know about it bro already... But big firms exploited them for sure..,-16,1,1433405959.0,piratekhan,False,negative,negative,neutral,negative
crvbcwp,What did scroll.in do?,-4,1,1433427749.0,pdinc,False,neutral,neutral,neutral,neutral
crv37qb,"I unfortunately work a full time job away from my village. I can get access to anything / anybody in the village though. My uncle has been tracking these deaths and can provide precise details. Your ideas are sound, but it would require time and money. Money I can spare, time not so much. ",106,1,1433401391.0,UnileverCancerFactor,False,negative,negative,neutral,negative
crvafj1,I'm working on a website which is designed to provide space to put together this kind of material and analysis. Its in beta at the moment but I've started [an article](http://wikirate.org/Unilever+Pollution_Toxics) and will start putting together all the information prople are providing on this post. Its a wiki type site so anyone can edit.,8,1,1433426017.0,Milllss,False,neutral,neutral,neutral,neutral
crve0xq,"A sound idea , indeed. It's great to say ' 2 paise' btw. take a bow.",2,1,1433432248.0,MaddingMumbaikar,False,positive,positive,positive,positive
crvcrth,"what would be the end result of the ""fight"" for this?

closure of the factory? they might make one elsewhere.

efforts towards removal of the contamination? how will THAT go?

re-imbursement/rehabilitation?

my mind is fucked right now... how to deal withthis?",3,1,1433430188.0,,False,negative,negative,negative,negative
crv38mq,"I know, I have read about this fairly extensively, but I always come  back to a 5% cancer mortality rate. Like my grandmom died of breast cancer at the age of 64, 3 neighboring houses have collectively lost 5 more people (3 women, 2 men) all of them in their 60's, not a single bad habit, and very healthy when they got cancer.

",19,1,1433401478.0,UnileverCancerFactor,False,negative,negative,neutral,negative
crvfml9,"But several mercuric compounds (methyl mercury ,mercuric chloride) possibly can. We need to check if those compounds are involved. ",2,1,1433434787.0,,False,neutral,neutral,neutral,neutral
crv7u2o,"Mercury is a huge environmental hazard, when we use mercury in our lab we have to follow a ton of procedures to handle it safely.",0,1,1433420016.0,qwerty2016,False,negative,neutral,neutral,neutral
crvdrnm,"I can only agree with you. Maybe it's some other pollutant, but there is not one other chemical based industry in a 50 km radius. There is a sugar plant that has been in operation since 1970, but it is about 20km's down stream from my village. ",2,1,1433431836.0,UnileverCancerFactor,False,neutral,neutral,negative,neutral
crw15ut,"Why do you assume that the pollutant is mercury?
It can be any of the chemicals used in the process of getting mercury out of the raw ore.
And on top of it some of those chemicals might be quoted as trade secrets.
",2,1,1433471116.0,fattuhero,False,negative,negative,neutral,negative
crv9c57,I'll add that Vice and RT are media outlets that may be interested in this story.,34,1,1433423772.0,pamtar,False,neutral,positive,neutral,neutral
crv4fxy,"Hijacking your comment for visibility

Dated: 17th May, 2015 - http://www.thenewsminute.com/article/years-after-shut-down-no-justice-sight-workers-hul-factory-kodaikanal

Dated: 31st July, 2010 - http://www.tehelka.com/one-gram-mercury-can-kill-a-25-acre-lake-a-plant-has-leached-mercury-for-10-years-into-kodai/",28,1,1433406333.0,CuriousFin,False,neutral,negative,negative,negative
crv460g,"Perhaps if the crooks know the name of the village, they'll do anything they can to cover it up before media/gov gets to them? They should not have any forewarning ",36,1,1433405149.0,mygrapefruit,False,negative,negative,neutral,negative
crv838m,"The word you are looking for is negligent, not negligible.  They are opposites.

They both come from the root word, neglect.

Negligible means capable of being neglected, or ignored.

Negligent means the act of neglecting something, being careless.",22,1,1433420710.0,,False,negative,negative,negative,negative
crvdvtq,Greenpeace was on it and it has now been banned along with few other NGO's. Not pointing any fingers but when dissenting voices are being silenced then it could be us on the chopping block someday.,10,1,1433432018.0,InternetOfficer,False,negative,negative,negative,negative
crx00et,I think the media would at least want to know the name of the village. But they probably would want to know more than that. Mercury does not causes cancer so that's not the story.,2,1,1433545240.0,,False,neutral,neutral,neutral,neutral
crvctay,Hot damn ,11,1,1433430260.0,batatavada,False,negative,negative,negative,negative
crv4mut,">it appears that there is a legal case going on against HUL in the high court , with some high profile lawyers fighting against HUL , so that's that

I think this is specific to Kodai and the worker union. It would be great if they could throw in my village as defendants.",25,1,1433407182.0,UnileverCancerFactor,False,neutral,neutral,neutral,neutral
crv97du,"Very sad state in Punjab. Govt refuses to even acknowledge the problem. I wonder why our own countrymen didn't get suspicious and when someone from outside the country raises a red flag, govt denies and tries to coverup. 

http://en.wikipedia.org/wiki/Uranium_poisoning_in_Punjab

",6,1,1433423476.0,Atharvan,False,negative,negative,negative,negative
crv2h50,Kerala and pesticides - same story.,14,1,1433398854.0,,False,negative,neutral,negative,negative
crva1nl,Fish is not a regular in our diet. A bunch of those who dIed were vegetarian.,6,1,1433425259.0,UnileverCancerFactor,False,neutral,neutral,negative,neutral
crw9ies,"Wow way to to go to dump a bunch of classic prejudices in this thread. Especially on fraternities. Thank you for your completely useless contribution.

- It happened before 2001
- It was done by Unilever Hindustan, which it only owns for 67,5%. Most likely management in the Netherlands had no knowledge of this factory. Unilever has tens of thousands production sites all across the globe.
- Not a lot of Leiden graduates end up at Unilever at all because Leiden has no business/economics faculty.
- These things are usually done by a local factory manager, not actual corporate policy or something. Although good corporate policy polices these kind of things. But we are talking about pre-2001.




",0,1,1433492180.0,,False,negative,negative,negative,negative
crw5gbl,Do it. Or you can be passive aggressive and just post it on your timeline.,1,1,1433479366.0,svmk1987,False,neutral,negative,neutral,neutral
crv4o72,"I understand my post is not very scientific, but there is something wrong, a spate of Cancer deaths in a village that really didn't suffer from them in the past is just plain weird.",15,1,1433407346.0,UnileverCancerFactor,False,negative,negative,negative,negative
crv3d0e,There's so much grey to every story - nothing is so black and white. ,39,1,1433401916.0,D_D_DUDE,False,negative,neutral,neutral,neutral
crvhqv4,"This sub, like the rest of India I guess, delivers when you write it off and disappoints when you start to love it. ",9,1,1433438070.0,Paranoid__Android,False,positive,neutral,positive,positive
crw90ud,5% in five years. There IS a difference.,0,1,1433490179.0,kozinc,False,neutral,neutral,neutral,neutral
crv7fxi,"oh, I am not even thinking of suing them. I want this to get some attention, and then we could look at testing. 

Fully agree with you that there could be something else that is causing it, simple causation / correlation leads me to think it is this Mercury factory.

I could tell you though, my maternal side has had zero instances of cancer before and after my Granny passed. We are talking 5 gens at least. We are paranoid though, so all female members in my moms side get themselves tested for various cancers (papsmears and all) every year like clockwork.

About the genetic dispossession, this I would doubt as the caste structure in my village was very entrenched till 1960. Very little intermingling, I would go as far as to say it would be nil even.",6,1,1433418840.0,UnileverCancerFactor,False,neutral,neutral,neutral,neutral
crv7n4b,"I realise it costs money to goto court, but I can help u get represented pro bono",3,1,1433419457.0,marakiri,False,neutral,neutral,neutral,neutral
crw8oyz,"do not post emails in public, send a PM to user",2,1,1433488884.0,AwkwardDev,False,neutral,neutral,neutral,neutral
crwh2er,If there's mercury deposits there's probably other carcinogenic shit in the water like chlorinated solvents or btex,1,1,1433515151.0,,False,negative,negative,negative,negative
crwi7rc,"Just to clarify, this is done for water filtration purposes. How thorough the process is in this particular case would require a chemist's expertise before being implemented widely.",2,1,1433517093.0,an0mn0mn0m,False,neutral,neutral,positive,neutral
crvar1m,"Ohh man, the shrooms! Yumm",1,1,1433426628.0,crazyfreak316,False,positive,positive,positive,positive
crv5a0f,Yes it does.,-3,1,1433410107.0,,False,neutral,neutral,neutral,neutral
crv9bx2,"Watch out for Table salt since it contains chloride and sodium two poisonous elements that can kill a person./s

Thimerosal=/=Mercury, learning a bit of chemistry and biology will do wonders for understanding how the world works around us. Spreading bullshit YouTube videos will not help any.",4,1,1433423758.0,,False,negative,negative,negative,negative
crv8rye,This sub did help with the net neutrality fight in India. ,23,1,1433422477.0,,False,positive,positive,neutral,positive
crvgh9n,real people with cancer matter more than dear viraat hindu leader modiji's feels. get over it. ,11,1,1433436122.0,tejmuk,False,negative,negative,negative,negative
crv2t5y,"Thank you. I will send out this link to Rajeev C and Tatagata. 

Hope some NGO or media outlet is interested enough to investigate further.",132,2,1433399969.0,UnileverCancerFactor,False,neutral,positive,positive,positive
crv6qn7,Not a constructive answer. I'm sure they realize this and know the odds are against them hence the plea on reddit. Let's be solution oriented vs being Brostradamus.,25,2,1433416425.0,Sohailian,False,negative,negative,negative,negative
crv771w,"As a law student who is about to get some free time soon, I guess I can help. I can try to fetch the research papers and do the stuff. Perhaps also try to get some professors' help regarding legal steps we can take.
I'm busy till this weekend though. Please send me a message if you think I could help.",125,2,1433418044.0,patanahi,False,neutral,neutral,neutral,neutral
crvc00t,[deleted],27,2,1433428871.0,,1557240644.0,neutral,neutral,negative,neutral
crv76zg,I think testing the water and contacting the government and NGO is the first step. And it shouldn't take that long to do. The reporting on it can be another project.,14,2,1433418037.0,,False,neutral,neutral,neutral,neutral
crv89v2,"I have ask the time in the world. I'm young and retired. Tell me tasks, send me shooting.",15,2,1433421203.0,whowantslunch,False,neutral,neutral,neutral,neutral
crvj7g8,"If Unilever is the owner of the factory you can sue them in US courts and force them to pay damages to you and your village including ongoing health costs (monitoring for cancer, treatment of cancer, etc). I am no lawyer, but I believe you can negotiate an arrangement where you wouldn't have to pay an upfront retainer fee and the firm could take its fees from the awarded settlement. ",3,2,1433440305.0,Impudicity2001,False,neutral,negative,negative,negative
crve1v1,"Best case scenario the end result would be compensation for those affected, renewed clean-up efforts and more generally increased caution by companies in relation to their waste disposal procedures. According to [this article](http://www.thenewsminute.com/article/years-after-shut-down-no-justice-sight-workers-hul-factory-kodaikanal) (posted by someone here) workers in the factory have never been compensated for the ill-effects they are suffering.",7,2,1433432290.0,Milllss,False,negative,negative,neutral,negative
crv604g,"It is possible there is some other carciogenic there, maybe it is not mercury. 

Blaming it on mercury when it doesn't cause cancer, will weaken your case against HLL. ",43,2,1433413426.0,strategyanalyst,False,negative,negative,neutral,negative
crv3lq3,"There are genetic factors which affects the probability of a person getting cancer.

Lot more people are dying of cancer today than other causes because most other diseases are treatable. 

There's also been a  spurt in cancer rates since the 90s in countries like the UK ... 

http://www.cancerresearchuk.org/health-professional/cancer-statistics/incidence#heading-Zero

(Not trying to defend/justify Unilever, just pointing out there are other factors in play too.)
",13,2,1433402826.0,,False,negative,negative,negative,negative
crv8l95,"I understand your arguments, but you should probably expect that you won't be taken seriously if you're blaming mercury for cancer rates.",6,2,1433422017.0,Juffin,False,negative,negative,negative,negative
crv8h1v,People of old age dying of cancer is extremely common. I'm not saying it isn't the plant but just because cancer is prevalent doesn't mean it is.,7,2,1433421720.0,,False,negative,negative,negative,negative
crwkwmd,"5% mortality rate due to cancer is...abnormally low.  .05% is *insanely* low.  

If this is actually true (how are you getting this number), it is simply because the people of your village have long been dying earlier, of other things, before cancer has a chance to claim them.

My guess is, the people of your village are living longer as they begin to gain access to better food/medicine over time, and thus, cancer is simply taking a larger and larger share of the deaths.

Something is going to kill people eventually.  If it isn't other things, cancer will rise on the list.",1,2,1433521372.0,jt004c,False,negative,negative,negative,negative
crwnwwb,"You have to use the age-adjusted incidence of cancer, not just the total rate.  If your village is older on average than the rest of india, then you would expect a much higher cancer mortality rate.  Villages having an older average population is not unusual, as many younger people seek their fortunes in the cities today, rather than sticking around in rural areas.

People in their 60s dying of cancer is not unusual, and it's definitely not expected at a rate of .05%.  Once you get over 60 years old, your expected rate of cancer diagnosis is 2-4% PER YEAR.  HALF of all people will get cancer in their lifetimes, and 1/6th of people will die of it (in western nations). 

Usually cancer clusters are spotted by their effects on children or young people (less than 50 years old).  Cancers in those groups are relatively rare, so even a few cases can trigger an investigation.",1,2,1433525929.0,czyivn,False,neutral,negative,neutral,neutral
crvh735,"Nope, that is not confirmed. At least it can't cause the high number of cases being reported by OP",2,2,1433437226.0,strategyanalyst,False,negative,negative,neutral,negative
crvcyd9,"Hazardous doesn't mean it's a carcinogen though. However, if they are mining for mercury or something in the area this may be related. Also, have death rates increased or diagnoses of cancer increased since 2000 in this village or both? ",7,2,1433430503.0,Stephan_Volle,False,negative,negative,neutral,negative
crwc6ol,"Reread my post, third point. I don't see how trade secrets apply here - either a specific carcinogenic compound is environmentally detectable or it isn't. There are commercially available kits that test for a wide range potentially hazardous compounds.",3,2,1433503699.0,sqrt7744,False,neutral,neutral,neutral,neutral
crv9otd,"RT is not a serious news organization though. (Sure, Vice can also be criticized, but at least they aren't the propaganda outlet of a single government.)",26,2,1433424523.0,WrongPeninsula,False,negative,negative,negative,negative
crv8ddx,"Well if the ""crooks"" are browsing reddit he's already given enough information on the situation in the first paragraph of the OP to out the town.",27,2,1433421466.0,,False,negative,neutral,neutral,neutral
crwel8u,"Different, but not opposites",3,2,1433510390.0,IKilledLauraPalmer,False,neutral,neutral,neutral,neutral
crvfh5w,I think the first time ever that /r/India reaches the first page of /r/all. Let alone be the top post,9,2,1433434550.0,,False,neutral,neutral,positive,neutral
crw7t5o,Isn't everyone's frontpage different? So one a post on one person's front page might not be the same for another. How does this work?,1,2,1433485729.0,mesid,False,neutral,neutral,neutral,neutral
crv796r,"FYI your village wouldn't be defendants, but plaintiffs. HUL are the defendants in this case.",29,2,1433418239.0,akkahwoop,False,neutral,negative,neutral,neutral
crv5b5j,"if you are in twitter , could you msg Gayatri Jayaraman
@Gayatri__J  , her dad is over there helping them out , he could probably give your villagers a hearing, hes there in kodai it seems",2,2,1433410254.0,mprem,False,neutral,neutral,neutral,neutral
crvhcc9,I live in that area and drink that water every day. ಥ_ಥ,3,2,1433437443.0,,False,neutral,neutral,neutral,neutral
crvfp54,you mean endosulfan? ,2,2,1433434906.0,,False,neutral,neutral,neutral,neutral
crvaa1f,What sort of cancer was most common? ,4,2,1433425725.0,NotAnotherDecoy,False,neutral,neutral,negative,neutral
crwcbyi,"Another thing that may explain the cancer deaths along with what Aditya1311 says below is improved diagnostics, e.g. better medical care nearby (e.g. new hospital equipment). It would very anomalous for your village to not have suffered from cancer in the past, since on average 1/5 people gets some form of cancer during their lives. If the life expectancy of your village has increased significantly then we would also expect to see more cancers either way.",5,2,1433504218.0,sqrt7744,False,neutral,neutral,neutral,neutral
crv7n53,"No, it really isn't. Cancer occurrence rates are going up worldwide as life expectancy increases (just a correlation). It's possible that with modern medicine people are able to live to an age where cancer takes them (in general you see cancer in old people rather than the young, usually because most carcinogens need sustained regular exposure to cause the disease). 

In your case, information like the following would be helpful:

1. How old were the people who died of cancer, in general? If you see this happening with 20-30 yr old people it's scary, and to a lesser extent with 30-50 yr old people. 

2. What kind of cancer did they suffer from? Some cancers (like aplastic anaemia) are directly linked to particular cancers (i.e. benzene).

3. Did the affected have any particular habits that set them apart from the rest of the village?
",4,2,1433419459.0,Aditya1311,False,neutral,neutral,neutral,neutral
crv4e4y,"Exactly, this is the white part and people only consider the black parts, Take this into account to make a grey informed opinion.",24,2,1433406117.0,platinumgus18,False,neutral,neutral,neutral,neutral
crv3qhv,"But when it came to those fighting for the environment, they said it was all black.",14,2,1433403359.0,gcs8,False,neutral,negative,negative,negative
crvhrvb,What's grey about mercury poisoning?,2,2,1433438112.0,slyweazal,False,negative,negative,negative,negative
crwiptg,"Also it wouldn't really help them if they are eating things that live and drink in/from the river. 

But it's Just an idea. 

I have more:

They could filter the water then use that to start an aquaponics system to get uncontaminated food. 

They could build a larger filtration system by harnessing the flow of the river to raise water to the top of a gravity fed filter. Like in olden days. 

Ok, so just two ideas and maybe they're as unpractical as the first but whatever. I'm trying. ",1,2,1433517901.0,,False,negative,neutral,neutral,neutral
crvin5r,I don't know what you are trying to say. Are you saying science is wrong and thiomersal is not good for you ?,-2,2,1433439426.0,dukey,False,negative,negative,negative,negative
crv4e8y,Yo! A publication has contacted us. Sending you their information over PM. To contact them via your IRL email would be my recommendation. Keep us informed of the developments. ,99,3,1433406131.0,Envia,False,neutral,neutral,neutral,neutral
crvcr6s,"Hi OP, just messaged you. 

we're running a small wiki, but we're specialised in these sorts of things. We started an [article](http://wikirate.org/Unilever+Pollution_Toxics) and could collect information as it emerges to build a clear overview

The wiki accepts multiple source types: pdfs, excel sheets, links to urls. I can start a project page to keep everyone informed if it's helpful?",27,3,1433430156.0,vishkap,False,neutral,neutral,neutral,neutral
crv789s,"Public scrutiny is the one thing politicians fear the most. With the spotlight on them and major public outcry on this issue, they're under pressure to act. ",6,3,1433418155.0,akkahwoop,False,negative,negative,negative,negative
crvf1ii,"Just like the atomic bombings of Japan led  them to a lot of valuable research in health effects of radiation poisoning, the Minamata disaster brought lots of lessons about mercury contamination.  ",14,3,1433433853.0,Triviaandwordplay,False,neutral,neutral,neutral,neutral
crvhmb7,This whole thing is fucking awesome.,8,3,1433437877.0,Paranoid__Android,False,positive,positive,positive,positive
crv8c5l,"I can get the water samples and have them tested. Just tell l me where they have to be sent. If it's the same village, i know people who can get this shit started.",9,3,1433421376.0,whowantslunch,False,neutral,negative,negative,negative
crw7tmi,You can sue a dutch company operating in India in the US? I have my doubts about that.,3,3,1433485773.0,Geenst,False,negative,negative,negative,negative
crv7doz,"I am just a layperson here. Like I said, this requires a lot more investigation. But one thing is for sure, there has been a spike in morbidity (by crazy levels) on account of cancer and it has been since ~ 1998-2000 at best.

I personally know 2 people who died of cancer - my Grandmom and a person who worked on our farms - she was pretty much a family member - one died of Breast cancer, the other of lung (no chewing tobacco habit also). Just my neighboring houses alone can count another 5 in all. My street alone would have 10-12 cancer deaths. Not sure what is causing it, but it is not a natural thing.",23,3,1433418644.0,UnileverCancerFactor,False,neutral,negative,negative,negative
crweifj,"Mercury (II) chloride has been shown to cause cancer, I don't see how that particular compound would be involved in thermometer manufacture though.

It's more than possible, of course, that the cancer is being caused by another chemical - if the plant is willing to dump mercury, I guarantee they're dumping everything else they can get away with too.",3,3,1433510214.0,,False,negative,negative,negative,negative
crvfnau,still doesn't explain the 5% cancer related mortality rate. ,4,3,1433434819.0,,False,negative,negative,neutral,negative
crwdf9l,"Whats more, since everyone dies of *something*, getting better medical treatment will actually increase the rate of cancer deaths, since people who otherwise would have been killed by communicable disease now live long enough to die of cancer.",1,3,1433507564.0,Emberwake,False,negative,negative,positive,negative
crvhaed,"> Nope, that is not confirmed

Yes it is confirmed in [several studies](http://www.inchem.org/documents/iarc/vol58/mono58-3.html) that mercuric compounds can SIGNIFICANTLY increase cancer risks. 

>There is sufficient evidence in experimental animals for the carcinogenicity of methylmercury chloride.

Edit: those are old studies though, but reliable source. ",0,3,1433437363.0,,False,neutral,neutral,positive,neutral
crvfopc,but carcinogenic means carcinogenic. A lot of mercury based compounds are carcinogenic. It's very likely that those were involved..,2,3,1433434884.0,,False,negative,negative,neutral,negative
cs1dmyc,"I understand what you are saying. I just wanted to point out that saying that mercury itself does not cause cancer dilutes the fact that there are numerous potentially harmful chemicals used during manufacturing. 
If I am not wrong then any step in manufacturing can be a trade secret.",1,3,1433905632.0,fattuhero,False,neutral,neutral,negative,neutral
crv9t0y,"I agree, RT is mostly a joke. Still, there's no such thing as bad publicity. ",10,3,1433424767.0,pamtar,False,neutral,neutral,negative,neutral
crwiqob,What... Vice has majored in propaganda.. ,1,3,1433517940.0,helacocksucker,False,negative,negative,neutral,negative
crvkfgk,The ISRO AMA was the first iirc. ,10,3,1433442184.0,brownboy13,False,neutral,neutral,neutral,neutral
crw9qqg,/r/all,2,3,1433493175.0,batatavada,False,neutral,neutral,neutral,neutral
crv79mg,"Sorry, IANAL. Vague understanding of law at best.",21,3,1433418280.0,UnileverCancerFactor,False,negative,negative,negative,negative
crvj6cl,Are those tears of uranium? ,2,3,1433440260.0,general_landur,False,neutral,neutral,negative,neutral
crvg1e3,Yep.,1,3,1433435437.0,,False,neutral,neutral,neutral,neutral
