Comment ID,Comment Text,Comment Score,Comment Depth,Created Timestamp,Author,Edited,Semantic Label,Semantic Label 2,Semantic Label 3,Major_Semantic
crv236r,"Tweet to our [Ministry of Environment, Forests & Climate Change](https://twitter.com/moefcc) & [Shri Prakash Javadekar](https://twitter.com/PrakashJavdekar) .

Ask mods. They might help.


**Edit:** [Telephone Directory of the Ministry of Environment, Forests & Climate Change](http://envfor.nic.in/about-ministry/telephone-directory-officers-moef)

Retweet this - [Reddit India 250 cancer deaths..](https://twitter.com/redditindia/status/606348623257833472)

More links

1. [PMO India](https://twitter.com/PMOIndia) & [Shri Narendra Modi](https://twitter.com/narendramodi)

2. [Guardian](https://twitter.com/guardian)

3. [DNA India](https://twitter.com/dna)

4. [NYT](https://twitter.com/nytimes)

5. [BBC World](https://twitter.com/bbcworld)


",1023,0,1433397659.0,,1433427936.0,neutral,neutral,neutral,neutral
crv31b4,"Do you have a test report of water sample testing for high mercury? If not, please collect some samples and get it tested. You can get some NGO to sponsor that if you cannot afford it.

Please compile some research papers/studies on the correlation between high mercury content and cancer.

Prepare one dossier with sample testing report and your research. Send it to government. Recruit NGOs to fight your cause based on these solid facts. Publish it on a blog post, link it from reddit and twitter etc. My 2 paise.",176,0,1433400757.0,altindian,False,neutral,neutral,neutral,neutral
crv330z,"Mercury is a dangeorus poison which can have serious harmful effects, but it is not confirmed as possible cause of cancer. 

As per EPA mercury is not known to cause cancer, but we don't know that for sure. 

http://www.epa.gov/mercury/effects.htm ",61,0,1433400923.0,strategyanalyst,False,negative,neutral,neutral,neutral
crvc85c,"- Mercury doesn't really cause cancer.
- Cancer isn't a single disease. What cancers are we talking about specifically?
- Problem might not be the mercury at all, but some other pollutant.
- 250 Cancer deaths isn't necessarily a lot. What's the age of the population? On average, every fifth person (about 20%) will get some form of cancer (in western Europe). In India the number is probably a lot lower due to infant mortality and high mortality rates due to treatable conditions (infectious diseases / trauma), so a high cancer morbidity/mortality in your village could, for example, correlate with a high average age and paradoxically a particularly safe area to live...

Source: I'm a radio-oncologist.",22,0,1433429264.0,sqrt7744,1433430581.0,neutral,neutral,negative,neutral
crv37zw,"1. Send this reddit link to Prakash Javadekar, PM Modi and the Min of Environment & Forestry (already been mentioned by another redditor here)

2. Additionally, also send this to Vox Media, BBC, NYT & The Guardian. These people are more serious than the Indian media which can be bought off by big Corporate money (not joking!) 

The Guardian is the most serious of all. They are known for their investigative journalism. 

Good luck!!",206,0,1433401414.0,neurothym,False,neutral,positive,neutral,neutral
crv2sug,A little more details and this story can be transferred to a webpage/blog-post. This would then allow everyone to link back to that webpage. Gives easier visibility,43,0,1433399939.0,ghazal_listener,False,neutral,positive,neutral,neutral
crv5cum,"get in touch with Chemists Without Borders and Engineers Without Borders. Both are working on arsenic testing and filtering in Bangladesh, a lot of the tech should be applicable to other heavy metals.",19,0,1433410472.0,cromlyngames,False,neutral,neutral,neutral,neutral
crv2zgn,"It is about time we show this companies that India will not tolerate this kind of negligible behaviour towards health of the anyone. This needs to be on Front Page.

PS: why don't you name your village? this will help get it into the media quick.",96,0,1433400576.0,dhavalhirdhav,False,negative,negative,negative,negative
crv36qz,"All you media lurkers here please pick this up. 

Try making a blog post and possibly a video that can go viral.. This needs a lot of visibility. 

Once there is a bit of traction, email /tweet to HUL guys.. ",68,0,1433401294.0,batatavada,False,positive,neutral,neutral,neutral
crv8z6j,"
Hey /u/UnileverCancerFactor,


This is now the top post on reddit. It will be recorded at /r/topredditposts with all the other top posts.",33,0,1433422951.0,topredditpostsbot,False,neutral,positive,neutral,neutral
crv3aei,"guys i got a reply from the senior editor of india today

Gayatri Jayaraman ‏@Gayatri__J  3m3 minutes ago
Gayatri Jayaraman retweeted maria prem
yes my hometown is Kodai. My father has been helping the villagers. you could speak to him if you want.  



edit: it appears that there is a legal case going on against HUL in the high court , with some high profile lawyers fighting against HUL , so thats that

",41,0,1433401653.0,mprem,1433402461.0,neutral,neutral,neutral,neutral
crv2fu2,Punjab and pesticides - same story.,29,0,1433398743.0,Detective_Moochwala,False,neutral,neutral,negative,neutral
crv2xzh,"Contact media, keep sending pings by people over there to them till you hear back, it only works if they think it's catastrophic or popular. ",11,0,1433400431.0,shivdas,False,negative,neutral,neutral,neutral
crvbbtm,"I highly doubt it is Mercury that is contributing to these higher rates of cancer. In isolated population enclaves, such as your village, it is not uncommon for cancer mortality rates to spike to 5,10, even 15% in some periods. This is simply due to genetic predisposition to cancer. Don't know how closely they look at genetic markers in India, but it maybe useful to look at the genetic background of all those people that have been dying of cancer to see if there is a commonality, which is what my guess would be. ",10,0,1433427694.0,jamesmds,False,negative,negative,neutral,negative
crv34pv,"This wont lead to any action unless picked up by Western media. We need to get this seen by someone in NYT or HP. Unilever would hate Western media questioning them. From my side, I will try and connect you to my personal media connects. ",32,0,1433401090.0,cp_redd_it,False,negative,neutral,positive,neutral
crv42up,"The only people fighting the good fight in cases like these are the people affected or concerned citizena like OP, who dont have a loud enough voice, or NGOs who are hated on this sub. We have to give this the voice it deserves. In addition to all the media also share this to the logical indian page on fb. They do a good job highlighting such topics. Media reporting this is only gonna get shot down by this sub calling them presstitutes or something, and western media called trying to malign india's growth story. ",18,0,1433404775.0,doc_two_thirty,False,negative,neutral,neutral,neutral
crva0ck,"There's not much of a link between mercury and cancer. I'd stay away from those fish, though, as the current levels are definitely high enough to cause neurotoxicity and to be a serious teratogen (Google Minimata disease). For the love of god, tell pregnant women in particular not to eat those fish.",10,0,1433425185.0,NotAnotherDecoy,False,negative,negative,negative,negative
crvbs4w,">The fifth in our series of articles on Global Compact companies examines Unilever's response when caught dumping toxic mercury waste from a thermometer factory in Southern India earlier this year. The Anglo-Dutch company recently closed the factory. Community members, however, allege that the multinational has downplayed the dangers of mercury and misled the public in an attempt to cover up the truth. Indian journalist Nityanand Jayaraman reports for CorpWatch.

I'm not shocked.

I'm Dutch, I know what kind of people end up working at high positions in Unilever. They're narcissistic rich kids who studied in Leiden, go to the same fraternity and make sure to hand each other nice jobs after graduation.

We in the first world own the world's giant corporations and export the dirty jobs that render the local environment uninhabitable to the third world.

I kind of feel like opening linkedin and sending some of these guys some links to this post to see what their company does.",28,0,1433428486.0,TheMilkweed,1433429113.0,negative,negative,negative,negative
crv4h5j,Mercury as such is not known to cause cancer - compounds like mercuric chloride are possible carcinogens though. Check if these reports are testing for elemental mercury or for mercuric chloride as well.,19,0,1433406474.0,Aditya1311,False,neutral,neutral,neutral,neutral
crv52ic,"Crosspost this to /r/worldnews as well. You never know, it might catch on.",10,0,1433409163.0,,False,neutral,neutral,neutral,neutral
crv3ew4,I mailed this story - linking this Reddit post - to Gawker media. ,10,0,1433402107.0,N1H1L,False,neutral,neutral,neutral,neutral
crv35as,">A shitton of Mercury was found onsite and Greenpeace and other NGO's have been on the case.

Keep this in mind the next time you people say NGOs are against davalapment in the nation.",68,0,1433401150.0,platinumgus18,False,neutral,neutral,negative,neutral
crv90ee,This is some Erin Brokovich level shit man. Spreading this through my network! MNCs should not get away with these things.,10,0,1433423029.0,mighty_bitch,False,negative,negative,negative,negative
crv2ofp,"I remember Padmini swaminathan talk about this issue and about how she was looking at the number of people who were afflicted by cancer and how many of them were women and and widows who had taken on the jobs after the men in the family succumbed to Cancer.

Major Edit : You could get in touch with Medico Friend Circle too, they are a bunch of medicos who had in the past dealt with Bhopal survivors too. ",9,0,1433399517.0,dosachutney,1433413484.0,neutral,neutral,negative,neutral
crvacaf,"When I saw this post first time, I was quiet sure that this will get ignored in our usual randia drama. 

But now I feel like this sub has some potential.",10,0,1433425848.0,Luttappy,False,neutral,neutral,neutral,neutral
crvh8ji,Head of TOI is a close family member. I will send this to him. ,8,0,1433437285.0,theroyalalastor,False,neutral,neutral,positive,neutral
crvahn4,"Look the only way to help your village is to draw a direct line between cancer caused to HLL operation. These will be production methods and waste disposal. You will need to get a group of people that can help collect, categorize and test samples collected.  This will take time so be ready for a long fight. After you have conclusive proof of these data you have collected and it points to HLL then proceed . it may also be possible your data may point to a completely different source of these cancer. 

So, first get your data. Secondly establish the correct link between the source and effect. Thirdly don't make accusation over social media without doing the first two steps. You can open your self to legal litigation for a organization that can afford to tie you up in the court system before you even start. So, best of luck. ",5,0,1433426129.0,pking3,False,neutral,neutral,neutral,neutral
crvakw1,"> my tiny village of around 5,000 people has seen about 250 cancer deaths in just the past 5 years. That is a 5% mortality rate just from cancer. India has by comparision a 0.05% mortality rate. In other words my village has a 8500% greater mortality rate from cancer as compared the nation at large. 

I don't understand your numbers. 250 over 5 years would be 50 deaths per year for 5000 people or 1% per year. And you're saying 5% (over 5 years) is 8500% greater than 0.05%.

In any case, I don't think that the Indian death rate for cancer could be as low as 0.05% unless the people were normally dying young from other diseases. Since cancer isn't easily curable, if large amounts of the population live into old age, 1/3 of them are going to die of cancer, which would give a much higher number than 0.05% per year.",6,0,1433426295.0,waterandsewerbill,False,negative,negative,neutral,negative
crv37eh,"have tweeted and retweeted , get the word out",3,0,1433401360.0,mprem,False,neutral,neutral,neutral,neutral
crv87ig,"Palani, i know the little town at the foothills. I've lived there too. Good bless the people.",3,0,1433421028.0,whowantslunch,False,positive,positive,positive,positive
crv8tqc,"Can I ask if the mercury is in the form of methyl mercury? If that is the case, there is a way to estimate concentrations very accurately if needed.

This paper talks about the method:
http://pubs.acs.org/doi/abs/10.1021/ac500517h
",3,0,1433422594.0,K_in_Oz,False,neutral,neutral,neutral,neutral
crvbtwg,"Harmful substances to developing a cancer is cadmium, lead, radioactive waste. Mercury I do not think a direct causative agent of cancer. Famous in mercury poisoning is Minamata disease in Japan, it is a disease that affects the human nervous.
http://www.youtube.com/watch?v=ihFkyPv1jtU",3,0,1433428571.0,uefaroma,False,negative,negative,negative,negative
crw8t7c,Nearly 5000 upvotes ??,3,0,1433489332.0,Ahnl,False,neutral,neutral,neutral,neutral
crv8x6c,"While super terrible, mercury doesn't cause cancer. Moreover, dying of cancer is associated with not dying of other causes..so you need to identify unusual and early presentation of cancer. In the US, cancer is the second most common cause of death (about 30%), basically because people live longer these days.",2,0,1433422823.0,Whatisaskizzerixany,False,negative,negative,negative,negative
crvbmgg,"Mercury poisoning is (was?) a big issue in Canada too

Here is a news item on same
http://www.theglobeandmail.com/news/politics/two-ontario-first-nations-still-plagued-by-mercury-poisoning-report/article4230507/

Here is a research paper on same

https://www.mcgill.ca/msr/msr-volume-4/mercury-poisoning-grassy-narrows",5,0,1433428209.0,mp256,False,neutral,neutral,negative,neutral
crvctdp,"5% is super low rate of cancer-especially if they are over 50. If anything, it would seem to prevent cancer. You need to check your numbers. ",5,0,1433430263.0,Pancakesandvodka,False,neutral,neutral,neutral,neutral
crv2ehk,"Mods could you share this on twitter ?

Preferably after verification of the facts (via PM maybe?)",5,0,1433398626.0,ymmajjet,False,neutral,neutral,neutral,neutral
crv7d6k,5% cancer mortality rate seems extremely low. Could it be that people in your village live longer on average than the average Indian? That could make them more likely to die of cancer in old/older age instead of viruses and such. Men have a 45% cancer rate in the West probably because we live longer. It could also be a random effect or genetic dispossessions in a huge village family. I would strongly recommend you test the water and then write all the names of the dead down. And also their family lines and where they lived. Right now we can't say for certain what causes it. And suing the company responsible for it requires better proof. We can't rule out a second source of pollution either without more tests of the water and the ground.,5,0,1433418602.0,,False,negative,negative,neutral,negative
crv3zhk,"Please try contacting MC mehta or Center for public interest litigation

http://www.commoncause.in


http://mcmef.org/mcmehta.html",6,0,1433404381.0,daftmatrix,1433405334.0,neutral,neutral,neutral,neutral
crvdi40,How on Earth did this get 4.5k upvotes? It's not even on r/bestof,5,0,1433431413.0,HsRada,False,negative,negative,negative,negative
crv7kbj,"Take it to the supreme court, get it to the media. Ill try n get u in touch with an NGO who can do some groundwork, n then get a court order shutting down the factory. 

Its not as easy as that, but you've got to do something. Well done on taking up the issue, let's back this up!",2,0,1433419221.0,marakiri,False,neutral,positive,positive,positive
crva0dg,"If you want to do something against their business practices, and / or drive them forcefully out of town, hit me up with a plan of their facvilities and what you know of their operation as detailled as you can. (PM me.)

The bigger they are, the harder a little sand in the wheels hits them. ",2,0,1433425187.0,Meistermalkav,False,negative,neutral,positive,neutral
crvbi23,Also report here http://www.corporatewatch.org.uk/company-profiles/unilever-corporate-crimes,2,0,1433427994.0,innovator116,False,neutral,neutral,negative,neutral
crvcwc0,[Mercury Poisoning- The Minamata Story - YouTube](https://youtu.be/ihFkyPv1jtU),2,0,1433430406.0,kurehajime,False,neutral,neutral,neutral,neutral
crvfcq9,"this?
http://en.wikipedia.org/wiki/Minamata_disease",2,0,1433434354.0,nuta_unagi,False,neutral,neutral,neutral,neutral
crw80n9,[removed],2,0,1433486415.0,,False,neutral,neutral,negative,neutral
crv8stl,"Good Job OP. We got your back.

I'm just gonna tweet outthis thing coz I'm a nobody., How about the hashtag #PoisoningPonds?",3,0,1433422532.0,The_0bserver,False,positive,positive,positive,positive
crv5fwh,Are they shadowbanned? I can't visit their user profile. ,4,0,1433410872.0,ThatFag,False,negative,negative,neutral,negative
crvae0f,"This is incredible response from r/india.., i hope your issue gets resolved ASAP., gets traction from all the media.,",2,0,1433425937.0,uday11,False,positive,positive,positive,positive
crvdltt,Tweet to Erin Brockovich too. https://twitter.com/erinbrockovich,2,0,1433431579.0,krzy32,False,neutral,neutral,neutral,neutral
crvarsz,"Good for you bro, standing up against a huge company as one person is never easy, but the truth always shines brightest.",1,0,1433426670.0,ctjwa,False,positive,positive,positive,positive
crvihg1,I hope this gets picked up by the media soon,1,0,1433439189.0,qwerty2016,False,neutral,positive,positive,positive
crvihih,"All I can do is share on WhatsApp & other social medias.
Good luck.",1,0,1433439191.0,SensehacK,False,neutral,positive,positive,positive
crvjbn3,"Do you have any link for posting it on the Facebook? I don't have Twitter account so would glad to help spread the word on the Facebook or other medium.

Let's fight this together.",1,0,1433440480.0,,False,neutral,positive,positive,positive
crvlbd5,Holy shit. well done OP. ,1,0,1433443522.0,,False,positive,positive,neutral,positive
crvmg6f,You should maybe start an online petition on change.org to garner more support for this cause. I believe you have a very strong reason here to take action.,1,0,1433445270.0,rraoind,False,positive,positive,positive,positive
crvnpe1,"
The media isn't the only solution to your problem, what you have to do is move to the Courts and fight a battle that you might not want to get yourself involved in. The easiest way is to approach an NGO that will help you go along with your claim.  DO NOT APPROACH GREENPEACE BECAUSE AT THE MOMENT THEY ARE CASH STRAPPED AND CANNOT HELP YOU. 

To prove the poisoning, the first thing that you must do is to send the water out for independent testing. The tests willl come out to be positive for mercury. You have to ensure that this test is not in any way biased. 

Go to a legal NGO that will help fight your claim. The easiest one that I know of is called the Human Rights Law Network (http://www.hrln.org/hrln/). There are other NGOs such as Lawyers Collective also that you can approach that will help fight the case *pro bono*. 

Lastly, yes, the media will help you fight your battle but you must realise that the media also has its limitations and will not help you beyond a point. The pressure that you can put on the corporates by approaching the Courts is much much higher. Insist on filing a PIL in the High Court or the Supreme Court and it will definitely get reported by the media then. You must act asap, though. 

All the best in this battle. It is one that many have fought and won. (Read all the MC Mehta cases, for example) The Courts are sympathetic towards pollution claims, these days. I hope your case gets heard. ",1,0,1433447194.0,doublebassed,False,negative,negative,neutral,negative
crvz59t,"I really, really hope you get the help you need. Pollution pisses me off and I don't know how to help you. I'm grateful I see others pointing you where you need to go. I also won't buy that brand anymore. That's all I have to help, though. :(",1,0,1433467375.0,Shaeos,False,negative,negative,negative,negative
crw0muf,"Neodymium magnets suspended in the water near the distribution outlets. Mercury is magnetic so this may work, i dont have a degree in chemistry and science wasnt my best subject but just an idea... dont know how good it would worj",1,0,1433470143.0,jmac530,False,neutral,neutral,neutral,neutral
crw8e8b,What an evil corporation.,1,0,1433487701.0,diaop,False,negative,negative,negative,negative
crwd3j9,Your leaders won't get the message until their casualties at least equal yours.,1,0,1433506657.0,TiredPaedo,False,negative,negative,neutral,negative
crwex3o,"[Mercury does not cause cancer](http://www.epa.gov/mercury/effects.htm) 

>No human data indicate that exposure to any form of mercury causes cancer, but the human data currently available are very limited. Mercuric chloride has caused increases in several types of tumors in rats and mice, and methylmercury has caused kidney tumors in male mice. Scientists only observed these health effects at extremely high doses, above levels that produced other effects. When EPA revised its Cancer Guidelines in 2005, the Agency concluded that neither inorganic mercury nor methylmercury from environmental exposures are likely to cause cancer in humans. 

It certainly causes health problems but not cancer as far as we can tell.  

",1,0,1433511098.0,,False,neutral,neutral,negative,neutral
crwgt2s,"Without knowing how the water is collected, Burn some trees into charcoal and run the water through it prior to use. Layering sand and gravel in a container can achieve the same effect, probably could do both. 

Sadly, once the Mercury has entered the environment, short of major rehab it's gonna be hard to anything but avoid it. 


While it might really suck, this is a time for you and your community to innovate a solution on your own to the direct problem. Even if you get those responsible to admit it, it's not gonna help you guys if you're still drinking contaminated water. ",1,0,1433514708.0,,False,neutral,negative,negative,negative
crwhx4b,"Is $500 USD enough for one person in rural india to survive on per year? That's 32,000 rupee per year in India in rural area... is that enough for say, a kid to survive on? So for example, if a single mother of 2 children (3 people total) had  96,000 rupee per year, is that enoug to survive on?",1,0,1433516598.0,,False,neutral,neutral,neutral,neutral
crwzw0z,Why are you not telling us the name of the village so that we can help you?,1,0,1433545014.0,,False,negative,negative,neutral,negative
cs701r3,"Dear UnileverCancerFactor: I was among the small team that uncovered the Unilever's mercury dump in Moonjikal and behind the factory in Pambar Shola in 2001. This campaign has not been in Greenpeace's radar since 2003. However, the ex-mercury workers association along with the Community Environmental Monitoring program of The Other Media has been keeping the campaign alive. What you say is shocking and deserves to be investigated. If the waters from Pambar River are indeed reaching the Varaha, and if people in your village are consumers of river fish, the likelihood of mercury reaching them certainly merits enquiry. You may want to visit our website: kodaimercury.org. I'd be very very keen to look into it and help. If you wish to contact me by email, pl do so -- nity682@gmail.com",1,0,1434354253.0,UnileverMercuryFever,False,neutral,neutral,negative,neutral
csjc9av,"UPDATE: There is a report on The Hindu.

http://www.thehindu.com/news/national/tamil-nadu/high-levels-of-toxic-mercury-in-vicinity-of-closed-thermometer-factory-ngo/article7356052.ece",1,0,1435323361.0,jmjjohn,False,neutral,neutral,negative,neutral
crv4xxf,"highly unfortunate. 
",1,0,1433408584.0,,False,negative,negative,negative,negative
crv4rdk,"Fuck HLL, destroying the only place i know in india where shrooms are easily available. ",0,0,1433407752.0,woah--dude,False,negative,negative,negative,negative
crv9kae,"Come on reddit it's time to do our part. Lurkers, come out of hiding and let's help spread the word! ",1,0,1433424257.0,AssortedNuts,False,positive,positive,negative,positive
crv3x9q,"This reminds me of the year 2000 Hollywood movie 'Erin Brockovic' for which Julia Roberts won an Oscar playing the environmental campaigner whose efforts won a historic anti-pollution court battle against a power company is based on a true story similar to your village-water contamination by a big company & people dying from cancer, plz watch it.",0,0,1433404129.0,phelpme2,False,neutral,neutral,negative,neutral
crv7kds,The US news media ran a piece telling people mercury was good for them -> https://www.youtube.com/watch?v=20IhxCzeuDU#t=8s,-4,0,1433419226.0,dukey,False,neutral,neutral,neutral,neutral
crv859t,"Good luck man, India doesn't strike me as the type of country where you can accomplish anything with foreign social media.",-16,0,1433420863.0,guatemalianrhino,False,neutral,neutral,positive,neutral
crwb47h,Glad that shits out of 'MURICA. ,-5,0,1433499452.0,ManFlavored,False,negative,negative,neutral,negative
crvarhf,[deleted],-10,0,1433426653.0,,1433427020.0,neutral,neutral,negative,neutral
crv37ef,[removed],-1,0,1433401360.0,,1433426974.0,neutral,neutral,negative,neutral
cucovp7,Quit being a little bitch and shut the fuck u. Clean your shitty house.,-1,0,1440324656.0,Pixelated_Fudge,False,negative,negative,negative,negative
crv91j6,"I don't have time to read this right now, but one thing I've been frustrated by recently is how hard it is to find out that CBD oil can help treat people with cancer.

Wish you the best of luck!",-9,0,1433423102.0,BadBoy04,False,negative,negative,neutral,negative
