Comment ID,Comment Text,Comment Score,Comment Depth,Created Timestamp,Author,Edited,Semantic Label,Semantic Label 2,Semantic Label 3,Major_Semantic
crwhm9q,There is also the problem of manifestation; a carcinogen causing one cancer (like asbestos causing mesothelioma in the lung) doesn't cause unrelated cancer (breast cancer). Then there is the problem of exposure duration and a focal point with spread of a cause on top of regular exposure to the environment. The timing is rapid-too rapid really for most things. Are fish and wildlife showing up dead and disfigured? What about the people who work at the plant and get high exposure? I don't think it means much if elderly people are the ones getting sick. ,1,7,1433516094.0,Pancakesandvodka,False,negative,negative,negative,negative
crwn7v0,"Like I said:

**in**

**rats**

**and**

**mice**.

Is that really such a difficult concept for you?",0,7,1433524886.0,,False,neutral,negative,neutral,neutral
crwe0ft,">even 'suspected'

Said who? Wikipedia? Nice.
 FFS stop sharing wiki links as conclusive proof. 

http://www.jstor.org/stable/40966102?seq=1#page_scan_tab_contents

From the previous link there is **sufficient evidence that Methyl Mercuric compounds can cause cancer in animals**",1,7,1433509055.0,,False,negative,negative,neutral,negative
crwi6vp,"Okay now I see what you're saying. Sorry about the previous comment.

I think they just act as a repository for govts. So it's not required by them to cite..I don't know it's outdated anyway.

[This paper] (http://www.jstor.org/stable/40966102?Search=yes&resultItemClick=true&searchText=mercury&searchText=carcinogen&searchUri=%2Faction%2FdoBasicSearch%3FQuery%3Dmercury%2Bcarcinogen%26amp%3Bprq%3Dmercury%2Bpoisoning%26amp%3Bgroup%3Dnone%26amp%3Bfc%3Doff%26amp%3Bso%3Drel%26amp%3Bhp%3D25%26amp%3Bacc%3Doff%26amp%3Bwc%3Don&seq=1#page_scan_tab_contents) might have more references. The paper is cited else where. I haven't read through it though.

But the bottom line being, it's not unfounded to assume methyl mercury compounds can cause cancer. 
",1,7,1433517051.0,,False,neutral,neutral,negative,neutral
crvrj5p,"Mercury=/=Thimerosal. Why can't you seem to be able to understand this simple fact. Stop conflating the two chemicals as they are not the same. Also dose makes the poison. 
It is a statistical correlation between thimerosal and tic disorder not a causal relationship. We do not link Autism with the increased consumption of organic food yet they share a statistical correlation. Untill you or someone who actually knows an actual fuck about science can provide a causation then it is nothing but a correlation. ",0,7,1433453157.0,,False,negative,negative,negative,negative
crwob2v,"Humans are not Mice ! 

I know some people get suprised by it, but it's true. Weird, right ? 

Also, listen to people who do this stuff for living ( IARC) and when they classify something as 'possibly carciogenic' rather than 'confirmed' then maybe listen to them. Coffee and Mercury are in the same list, in terms of classification as carciogenic. ",1,8,1433526524.0,strategyanalyst,False,neutral,neutral,negative,neutral
crwgs60,"Yes, the same link also says there is **'insufficient evidence' that it can cause cancer in Humans.**

Which means that it is 'possible'. We call it probable if there was even a single scientific study which says that there is a link between the two. 

Wiki link is a just a list given by IARC. ",1,8,1433514661.0,strategyanalyst,False,neutral,negative,neutral,neutral
crwii45,"But what type of cancer? And it what dosage? The report only notes renal cancer, and we have no idea whether this is the type of cancer found in these people, whether the rates are any different than the poulation average, and whether the dosage required to produce tumours was even remotely similar to those that might be presented by OP. We don't even know if there is methylmercury present where OP is. Methyl mercury requires very specific environmental conditions to form.

It's possible there may be a link, but making blanket statements about mercury and cancer are not accurate.",1,8,1433517560.0,Gastronomicus,False,negative,negative,neutral,negative
crvtls9,"Yes you are correct thimerosal is not elemental mercury, but that doesn't mean it is not toxic. The toxicity has been proven in animal studies. It is toxic down to the nano-grams, which is almost unheard of for any kind of poison. This is why it's used as an anti-bacterial agent, because it kills everything it touches. If you use the EPAs limits for methyl mercury (there are no standards for ethyl because it's never been tested on people), kids are getting far more than the allowed dosages. But again, other than saving a few dollars, there is no reason to lace shots with mercury anymore. But if you have a flu or tetanus shot, you will be getting a bolus dose.",-2,8,1433456731.0,dukey,False,negative,negative,neutral,negative
crwgxs9,Which only means there are not enough studies conducted on humans who were exposed to those chemicals for long durations...and you'd have found that if you had at least skimmed through the abstract of the paper in the last Link.,1,9,1433514938.0,,False,negative,negative,neutral,negative
crvv2f5,"Awwwww!  It is so adorable when you are so over-dramatic and embarrass yourself, dukey!  It's even more adorable when you use medical terminology improperly.  

>there is no reason to lace shots with mercury anymore.  

Lace?  How adorably dramatic!  The vaccines are not laced with mercury.  They contain thimerosal, which is made up of ethyl-mercury and a thiol group.  What you're saying is as ridiculous as saying ""you're eating chloride"" when you're actually talking about table salt.  Now, if you had actually ever taken a chemistry course, you'd understand how ridiculous you sound.

>you will be getting a bolus dose.

Do you even know what a bolus is, dukey?  A bolus is a dose given to raise the levels of a medication in the system to a therapeutic level.  Now, since thimerosal is not a medication, the amount in thimerosal is not a bolus.
",1,9,1433459410.0,,False,negative,negative,negative,negative
crwh3l8,"So you accept the point that mercury is not 'confirmed' as a potential carciogenic ? 

Remember one of the reasons it is not investigated in scientific reports is that before it will cause cancer, mercury exposure will kill you off . Mercury is an extremely dangerous compound -

http://en.wikipedia.org/wiki/Mercury_poisoning ",1,1,1433515205.0,strategyanalyst,False,negative,negative,negative,negative
crwadwj,"How sweet you showed up to defend mercury again. Bolus also means to have a large single dose.

> What you're saying is as ridiculous as saying ""you're eating chloride"" when you're actually talking about table salt.

The comparison is stupid, and you know it. If thimerosal was so harmless, it would be useless as a vaccine preservative. Your arguments are getting weak and substantially more pathetic, it's like you aren't even trying anymore. What next are you going to come out with dihydrogen monoxide again ?",0,1,1433496108.0,dukey,False,neutral,negative,negative,negative
crwh9p2,"Yes elemental Mercury is definitely not a carcinogen. I totally agree with that.

But elemental Mercury can react as a part of a manufacturing process/naturally to form these compounds. That's what I've been saying so long.

The thing is lot of factory workers are exposed to these compounds anyway..",1,2,1433515498.0,,False,neutral,neutral,positive,neutral
crwbvz8,"You're not getting a large single dose of thimerosal, the dose you get is very small.

It's a very good comparison and the fact you think it's stupid shows how little you truly understand chemistry.  I'm glad you remembered that Thimerosal is a preservative but I guess you forgot that salt is a very good preservative as well, eh Dukey?  



",0,2,1433502613.0,,False,negative,negative,neutral,negative
crwhfj0,"Yes and it will cause mercury poisoning which will make them crazy, blind and dead. But I think OP's village cancer is due to some other compund or reason. ",1,3,1433515779.0,strategyanalyst,False,negative,negative,negative,negative
crwciwo,The difference is your body actually needs salt. Thimerosal is just a poison. Nice try though. ,0,3,1433504866.0,dukey,False,negative,negative,neutral,negative
crwe3dk,"Just because your body does not need something does not make it toxic.  

As usual, you fail miss the point, I thought you would have been able to tease it out, but I guess I over estimated your intelligence.  The salt example shows you that when you take two toxic elements and bond them together their properties change, sometimes they are no longer toxics sometimes they become inert and sometimes they become more toxic.  To educate you on chemistry, salt is made up of chloride and sodium, two toxic chemicals.  The same for thimerosal, when bonded to a thiol group, the amount of Hg is non-toxic.  Toxicity is dose dependent.  The safety of thimerosal has been established by over 70 years of use and numerous VALID scientific studies published since the Wakefield fraud.

When the only sub that takes you seriously, Dukey, is /r/conspiracy your credibility is sorely hurt.  ;-)",2,4,1433509251.0,,False,negative,negative,neutral,negative
crwefys,"The difference is, which you totally fail to understand, is that thiomersal is profoundly toxic. That is why it works as a preservative, because it kills everything it touches. If it didn't it would be a pretty terrible choice. Animals studies clearly demonstrate toxicity. Human studies simply don't exist.",0,5,1433510058.0,dukey,False,negative,negative,negative,negative
crwfi7q,"Salt is also highly toxic, especially for the kidneys.  Water is also highly toxic...at high doses.  Everything is toxic at a certain dose because toxicity is dose dependent.  As I have pointed out to you before, human studies will not be conducted for thimerosal because it is an adjuvant and serves no medicinal purpose.  Adjuvants are studied when the medication or treatment is studied.  Any toxicity from thimerosal would have been evident in the clinical trials performed on the vaccines themselves.  To spend limited resources on studying adjuvants individually is wholly ridiculous because studies spend limited resources.  ",1,6,1433512296.0,,False,negative,negative,negative,negative
crwhxov,">  Water is also highly toxic...at high doses.

Lol here we go again. Water is required for life, as is salt. They have a biological role to play. Yes it's true if you can go to extremes and push levels to dangerous levels. This is a long, long way away from a mercury based compound which is toxic in the parts per billion range. Find a study where they put thiomersal in a petri dish with cells and they don't die. 

>studies will not be conducted for thimerosal because it is an adjuvant 

It is not an adjuvant, you really have no idea what the hell you are talking about. It's only there to save money, which is frankly disgusting. If you can't even get your facts straight, why even bother debating. Pathetic.

",-1,7,1433516624.0,dukey,False,negative,negative,neutral,negative
crwzh0v,"Sure, thimerosal is not necessary for life, but it doesn't mean that it is toxic in the doses found in vaccines.  

You are correct, thimerosal is a preventative, not an adjuvant.  Regardless, the argument is the same - it's a preservative and the safety is tested along with the safety of the vaccine as a whole.  


Unlike you, I am man enough to admit when I'm wrong.  Are you man enough to admit you lied (not it is a lie because you've been corrected before) when you stated Poul Thorsen is wanted for medics fraud?  

>It is not an adjuvant, you really have no idea what the hell you are talking about. It's only there to save money, which is frankly disgusting. If you can't even get your facts straight, why even bother debating. Pathetic

That's a bold statement coming from the guy that is shadow banned from /r/health and who is only taken seriously in /r/conspiracy.  I'm glad I could continue to use you as a tool to show the outright lack of intelligence and dishonesty found in the vaccine denial movement",1,8,1433544250.0,,False,neutral,neutral,neutral,neutral
crx1l8v,"You are just a useful idiot for big pharma, pushing their propaganda. Defending companies that are proven year after year to be corrupt. And have to pay enormous fines because they keep get caught engaging in illegal activity. As for studies on thiomersal, no one has ever looked at the cumulate effect of all the mercury kids get. It doesn't exist. Also most of the vaccine studies compare against .. wait for it, other vaccines, not even a placebo. Or sometimes they compare against vaccine adjuvants, instead of a placebo. This isn't even science. Yet this is the total nonsense you defend, and hide behind. ",-1,9,1433548301.0,dukey,False,negative,negative,negative,negative
crxj1zi,"Not at all, I just have the educational background and intelligence to be able to understand and interpret scientific studies...and to weed out junk studies (like the ones in the list you provided).  

You never answered my question: are you man enough to admit that you outright lies when you said Poul Thorssen was wanted for medical fraud and that he's not the lead author of the Danish studies?  You knew full well that he is wanted for financial fraud and and lied in order to push you /r/conspiracy agenda.  Are you man enough admit that, Dukey?  I doubt it because you are a paid poster from /r/conspiracy.  

There is a reason you were shadow banned from /r/health...and contrary to what you probably believe it's not because the mods are shills.  That sub is pretty liberal in what is considered health information so for you to have been shadow banned there is pretty telling!  ",1,1,1433601074.0,,False,neutral,negative,negative,negative
crxjlmy,"> are you man enough to admit that you outright lies when you said Poul Thorssen was wanted for medical fraud

He made the OIG top 10 list for healthcare related fraud. In his case he was embezzling the money, instead of it being used for research. But whatever, the study was fatally flawed anyway. If you want to call this a 'lie' so be it. Imagine if a study came out that showed a connection to autism, and it was headed by people like that. It would be destroyed by the media, and rightfully so. 

As for being shadow banned, well done sir. But it's trivial to create another account for posting, so it's a non issue.

>Not at all, I just have the educational background and intelligence to be able to understand and interpret scientific studies...and to weed out junk studies (like the ones in the list you provided). 

Hilarious. No you don't. You just read study that fit your viewpoint, and basically reject everything else as  junk science or 'anti-vax' propaganda, or some other ridiculous excuse. If you were so clever at weeding out junk science you would be embarrassed at how the Danish studies were done, and the methodology that was used. ",-1,2,1433602407.0,dukey,False,negative,negative,negative,negative
crxlxn7,"Keep shilling yourself for Robert F. Kennedy, Jr.  I'm sure he is paying you a good chunk of change for your...""services.""

>He made the OIG top 10 list for healthcare related fraud.

Not at all.  Since you didn't even read the OIG page, here is exactly what it says regarding his crimes:

[""**1)** From approximately February 2004 until February 2010, Poul Thorsen executed a scheme to steal grant money awarded by the Centers for Disease Control and Prevention (CDC). CDC had awarded grant money to Denmark for research involving infant disabilities, autism, genetic disorders, and fetal alcohol syndrome. CDC awarded the grant to fund studies of the relationship between autism and the exposure to vaccines, the relationship between cerebral palsy and infection during pregnancy, and the relationship between developmental outcomes and fetal alcohol exposure. 
**2)** Thorsen worked as a visiting scientist at CDC, Division of Birth Defects and Developmental Disabilities, before the grant was awarded. 
**3)**The initial grant was awarded to the Danish Medical Research Council. In approximately 2007, a second grant was awarded to the Danish Agency for Science, Technology, and Innovation. Both agencies are governmental agencies in Denmark. The research was done by the Aarhaus University and Odense University Hospital in Denmark.
**4)** Thorsen allegedly diverted over $1 million of the CDC grant money to his own personal bank account. Thorsen submitted fraudulent invoices on CDC letterhead to medical facilities assisting in the research for reimbursement of work allegedly covered by the grants. The invoices were addressed to Aarhaus University and Sahlgrenska University Hospital. The fact that the invoices were on CDC letterhead made it appear that CDC was requesting the money from Aarhaus University and Sahlgrenska University Hospital although the bank account listed on the invoices belonged to Thorsen.
**5)** **In April 2011, Thorsen was indicted on 22 counts of Wire Fraud and Money Laundering. **
**6)** According to bank account records, Thorsen purchased a home in Atlanta, a Harley Davidson motorcycle, an Audi automobile, and a Honda SUV with funds that he received from the CDC grants. 
**7)** Thorsen is currently in Denmark and is awaiting extradition to the United States.""](https://oig.hhs.gov/fraud/fugitives/profiles.asp)

As you can see the fraud is financial in nature, not medical or healthcare in nature.  **Again you expose your intellectual dishonesty, Dukey.**  Stomping your feet like the petulant three year old that you are and claiming over and over again that it is a case of medical and healthcare fraud does not make it so.  But I am not bothered in the slightest by educating you over and over again.  It's not a problem because you are an excellent tool to expose not only the lack of scientific understanding and intelligence of the vaccine denial movement but also that it will blatantly lie and twist the facts to suit it's whims. 

>You just read study that fit your viewpoint, and basically reject everything else as junk science or 'anti-vax' propaganda, or some other ridiculous excuse.

I actually read as many of the vaccine studies as I can find.  The ones that support the anti-view are almost always low in population (for example the Wakefield paper had a very low population) and funded by anti-vaccination groups such as the Dwoskin Family Foundation and the Katelyn Fox Foundation.

>If you were so clever at weeding out junk science you would be embarrassed at how the Danish studies were done, and the methodology that was used.

Being clever has nothing to do with it.  It's about having even just a little bit of intelligence - something you sorely lack.  And the Danish studies have been backed up by many other studies, from **reputable** sources.  Previously I provided you a link of dozens of studies from the AAP website.  I assume you are too much of a coward to review them.  Not a problem, this is a public forum in which your ignorance is continually exposed.


",1,3,1433607610.0,,1433608417.0,neutral,negative,negative,negative
crxor01,"This is why the study was flawed -> http://i.imgur.com/XYq3j5C.png

The Poul Thorsen nonsense was just icing of the cake.  I look forward to your debunking of that info.",0,4,1433613416.0,dukey,False,negative,negative,negative,negative
crymris,"An imgured photocopy with no citation and no context?  And you must rely on others to make your arguments for you?  This clearly shows your lack of intelligence and education.  It seems as though I've been educating a high school freshman.  How embarrassing for you, my friend.",1,5,1433702887.0,,1433727709.0,negative,negative,negative,negative
crzagdc,"I love the way you just totally glossed over the details of the article, which are in fact easily verifiable. So at least two things happened during this study. 1) A change in autism diagnostic criteria. 2) They changed the sample pool of kids they were counting cases from. Any one of these things should have totally invalidated the study. Yet if this is the kind of science you are standing behind as proof of safety you pro-pharma people are in real trouble. Also as someone who is a self proclaimed champion at sniffing out junk science, this should be a major embarrassment.",0,6,1433756374.0,dukey,False,negative,negative,neutral,negative
crzvsdd,"So, you can't provide a source for the photocopied imgur page, my friend?  I didn't think you would and you did not disappoint.  
No bother, it's an excerpt from David Kirby's book - David Kirby who is a journalist rather than a scientist.  No wonder you quoted him, basic biology and chemistry fly over your head so you would go to a source that doesn't understand science or how to review scientific literature.  Now I understand why you backed out in cowardice when asked to site the source of the photocopy.  You two have something in common there, my friend.

I'm not out to change your mind, only to make others realize how undereducated people like you are.  So far, I've done a very good job, but most of the credit goes to you, my friend.  You make yourself look entirely foolish every time you post on this topic, so thanks for doing most of my work for me.  Anyone can see you're an avid poster in /r/conspiracy so anyone with half a brain and the intelligence of a three year old will dismiss what you say based only on that, my friend.  ;-)",1,7,1433799146.0,,1433799579.0,negative,negative,neutral,negative
cs0gnva,"> So, you can't provide a source for the photocopied imgur page, my friend?

Sure I can, I made it lol. But still interesting you can't debunk the points. You just go back to name calling and calling people uneducated, whilst congratulating yourself at what a wonderful job you are doing. It's quite hilarious really.",0,8,1433849058.0,dukey,False,negative,negative,positive,negative
