Comment ID,Comment Text,Comment Score,Comment Depth,Created Timestamp,Author,Edited,Semantic Label,Semantic Label 2,Semantic Label 3,Major_Semantic
d574cga,"Yeah, I live in California, and I've even seen my own town's maintenance crews do some real shitty concrete work. 

In a way it was worse than what's posted, because it was on every major street in my town. 

Someone had this idea to put concrete slabs in streets at every single exit from business parking lots. 

Within a couple of years, they all had to be ripped up. All of the slabs busted up into cobbles.  ",30,3,1468187429.0,factbasedorGTFO,False,negative,negative,negative,negative
d5703ug,No. Dissatisfaction with the political establishment.,37,3,1468180955.0,bunny369,False,neutral,negative,negative,negative
d56r39m,"The Taj Mahal was completed in 1653.

Would you like yours in red or gold color?",47,3,1468166701.0,ihsw,False,neutral,neutral,neutral,neutral
d56y47i,"Look at it from another angle. If a flight of stairs lasts 500 years, then one can safely say that it has been over-designed. That could be because of he lack of know-how or he absence of technology that allows a modern engineer to tailor his products to whatever specifications are desired. 

Over-design is never a good thing. It costs resources that could have been better spent elsewhere, and and it also costs time and money to modify/dismantle/demolish once it ceases to be of use. One of the very few cases it makes sense is in an object that is likely to see war, and has to withstand what the enemy can throw at it. So forts were obviously ""over-designed"" so that they could take attacks from projectile weapons and still stay standing. But a temple... not so much.

This is, of course, no excuse for shitty workmanship that sees infra degrade in less than three years.

",10,3,1468177927.0,Bernard_Woolley,False,negative,negative,negative,negative
d57dif1,"It can be easily produced, a lot easier in fact, but it still take effort. For this specific example of the stairs, 500 years ago they had to be painstakingly cut as solid blocks of stone from the earth, transported to the location, and carefully placed, all of which would require a fairly large workforce and weeks or months to complete. These days all you would need is a cement truck to pour the properly mixed concrete and then leave it to dry, all of which would be accomplished in a week or so. But concrete isn't magic, it still has to be properly made, it seems in this case the contractor used some low quality leftover concrete thinking the client (government) wouldn't have it tested before pouring. ",2,3,1468203150.0,485075,False,neutral,neutral,neutral,neutral
d56rul3,"Not necessarily. The knowledge and materials might not exist any more, or if they do, they might be astronomically expensive. We can look at amazing structures built centuries ago and understand how they work and how they were built, but that's only part of the picture.",0,3,1468167984.0,space_keeper,False,neutral,neutral,neutral,neutral
d56r869,"You're not getting the point of the bias. If you're seeing something that's 500 years old, it had to be well built to survive 500 years. There was probably a lot of shitty stuff built 500 years ago, which simply didn't survive till today.  


On another note: I don't think a lot of those points you mentioned justify that govt should have good infra built. We have a high GDP and growth because of some rich industrialists.. so what.",68,3,1468166929.0,svmk1987,False,negative,negative,negative,negative
d56yjc4,"Nope, that's exactly whats unsurprising. With current tech and finance it's possible to build more and more infrastructure. Obviously some of that infra will be high quality, some will be cheapo low quality. I'm sure 500 years from now some really well built infrastructure form our times will survive and people will marvel 'wah kya build quality hoti thi 21st century mein'",2,3,1468178586.0,v0lta_7,False,neutral,neutral,positive,neutral
d56t5o6,Do we need modern buildings to last thousands of years? Not many people in the modern world would want to live in a house built in 3000BCE.,3,3,1468170057.0,argenticake,False,negative,negative,neutral,negative
d56wb4a,"Concrete can last longer than that of made well.

The steps where I work are post ww2 terrazo work. At least fifty years old and the only wear is a slight dip in the middle of each which is just testament to what kind of a hammering they take in. I've only ever seen it on solid stone steps before.",3,3,1468175065.0,Brave_Horatius,1468175266.0,neutral,neutral,positive,neutral
d57dob6,"This is not an inherent problem with concrete, the Roman's used concrete thousands of years ago for their structures which still stand today. And obviously most concrete structures made last for decades, not 3 years, otherwise all our buildings would be rebuilt every 3 years or so. This is a problem with the operation, either the contractors incorrectly mixed the concrete or knowingly used left over low quality concrete knowing it wouldn't be tested. ",1,3,1468203435.0,485075,False,negative,negative,negative,negative
d57l35m,Cut stone is also of finite quantity and is expensive as fuck.,1,3,1468218489.0,,False,negative,negative,negative,negative
d5700ap,Might not always be possible to use the kind of construction materials and techniques used in building these long lasting stairs. ,2,3,1468180809.0,v0lta_7,False,neutral,neutral,neutral,neutral
d577oqp,"Solid, cut from bedrock, probably 4 billion years in the making stone slabs vs. tiles stuck to concrete. The new stuff has no chance.",3,3,1468192941.0,secard13,False,neutral,neutral,neutral,neutral
d56sktx,Just because there is a /s tag doesn't make it funny though.,3,3,1468169168.0,,False,negative,negative,neutral,negative
d56rdul,"> This doesn't need an /s tag, does it?

You never know!

",0,3,1468167192.0,,False,neutral,neutral,neutral,neutral
d56vlt0,He's talking about world population.,9,3,1468173929.0,randomnm,False,neutral,neutral,neutral,neutral
d573fee,[removed],-4,3,1468186079.0,,False,neutral,neutral,negative,neutral
d57ln5x,Maje hain bhai,1,3,1468219992.0,,False,neutral,neutral,neutral,neutral
d56w414,"Just agree with him bro, I think he's got a gun.",15,3,1468174750.0,Obi_Wanka_noobie,False,neutral,neutral,positive,neutral
d573idr,"Its directed towards the content stealers, not you. ",7,3,1468186207.0,NotherLevel,False,negative,negative,neutral,negative
d570xld,[deleted],15,3,1468182236.0,,1502648581.0,neutral,neutral,negative,neutral
d56p446,"Completely different, you could have capitalist monarchy (umm, britain?) or a democratic socialism (russia? lolz)..",8,3,1468163204.0,PlainClothesmanBalee,False,neutral,neutral,neutral,neutral
d575l4i,"[Last time I checked, Chicago is near the US](https://np.reddit.com/r/SouthJersey/comments/4olkia/is_it_just_me_or_is_philadelphia_area_especially/d4dm1fv). You should probably consider your post history before trying to save face. ",6,3,1468189395.0,stash0606,1468189806.0,neutral,neutral,neutral,neutral
d56ykgh,[http://imgur.com/On6692b](http://imgur.com/On6692b),39,4,1468178634.0,Adolf-____-Hitler,False,neutral,neutral,neutral,neutral
d57ljrg,फ से ... फग्गोट ,12,4,1468219725.0,rofex,False,neutral,neutral,neutral,neutral
d571fr2,[deleted],3,4,1468183035.0,,False,neutral,neutral,negative,neutral
d5l24xn,"On a more serious note...are those Indian students? I have read articles about how in the last decade there were illegal schools run by foreigners making clueless students speak racist shit without ever knowing what they are doing.

Or was this a genuine comedy?",1,4,1469115553.0,,False,negative,negative,negative,negative
d56znpz,"This IS my primary account. I discovered reddit less than 24 hours ago. 

Why is that so hard to believe?! You were all also new someday! ",-15,4,1468180286.0,Shivaji_Maharaj,False,positive,positive,neutral,positive
d56z551,"Shrimant, you don't need to waste time in replying to these insignificant attacks. We need to make a move towards Delhi. This is the right time to strike the Mughals.
Har Har Mahadev. ",9,4,1468179494.0,shadilal_gharjode,False,negative,negative,positive,negative
d56z2t9,[deleted],3,4,1468179394.0,,1688358823.0,neutral,neutral,negative,neutral
d56zt83,"I realize that, but some people wait on their user name to be relevant for a year or more, and that's the shit I like.",3,4,1468180512.0,SoberFuck,False,negative,negative,neutral,negative
d57cbff,"And you're exactly right, in India the engineer just happens to be the contractor's wife's cousin, and when the contract is for some steps and not a rocket ship, he might not have as much of a moral dilemma  choosing his relationships over the public good. ",18,4,1468201074.0,485075,False,neutral,neutral,positive,neutral
d57g2s3,"Unfortunately, it's when the contract is missing key features or something isn't written into the plans when things fall down.

So don't blame the lowest bidder, blame that newbie Lieutenant who isn't familiar with job specific features and didn't have the balls to ask for help.",2,4,1468207647.0,fitzydog,False,negative,negative,negative,negative
d57hygu,"This is the most naive comment I've read in a very, very long time.

As an illustration of why, if NASA has people who are qualified to scrutinize the hell out of their contractors, then they would have *those* people doing the engineering.

That something conforms to spec is a paper requirement, hardly an assurance that things were done right.

Also, when the people who actually build the stuff are working under unreasonable resources and time constraints, quality goes down no matter how good the blueprints look. Funny enough, this often happens when the engineers have take too long on their phase of the project.",0,4,1468211241.0,overh,False,negative,negative,negative,negative
d574yzd,Nope. Here in Finland the lowest bidder really gets the job. Which then results in going over the budget and delays. ,20,4,1468188417.0,xuflonex,False,negative,negative,neutral,negative
d574fhn,"Hell yeah, I know from experience in the States that sometimes it's not what you know, it's who you know that gets you government contracts. ",3,4,1468187559.0,factbasedorGTFO,False,positive,neutral,neutral,neutral
d56nzxu,Oh yes. And the fact that most companies are hand-in-glove when it comes to sharing govt projects makes it even better.,5,4,1468160976.0,kabuliwallah,False,positive,positive,positive,positive
d56tvzj,"
>All these people

Many. Huge. But not all. Some do honest to God work.
",3,4,1468171212.0,ribiy,False,neutral,neutral,neutral,neutral
d577rfz,"I've had to fight the good-ol-boys club too.  We had a big job that had several contractors handing the same kind of work across facilities, one got in that we had questioned if the people pushing for us to use him were *sure* that he was going to be able to handle it.  They insisted.

Well, he couldn't.  We required BISCI compliance and industry standards.  We get to a jobsite and they don't even know how to install a wire manager, they're trying to use the patch cable wire manager to organize the horizontal cable that's punched-down on the back of the patch panel.  They weren't pulling cable in with any logical order, they were pulling all and terminating all then testing to label where it went, so a 6-port wallplate would have random cable numbers on it, and not even in numeric order.  They didn't even have a proper certification tester and wanted to give us test results that were handwritten even though the standards docs requires use of a Level 4 tester and electronic notes in that test-equipment vendor's native format.

The sad thing was even with all of this what it finally took to kick them off was their spending enough to exhaust the contingency fund set aside without asking, and then asking for more money on top of it.  I think that they were denied the contingency money seeing as how it required asking for it on-paper and required our signing-off on-paper, were kicked off the job, and then were essentially backcharged for all labor costs they'd billed as we had to redo it.  We didn't backcharge for materials because a lot of it was reusable but we probably could have gotten a few thousand for cabling back as they pulled some cables so short that they had to be repulled.

I really hate it when this kind of stupidity happens.  Guy could have just kept his nice little moves/adds/changes business instead of trying to pursue the big jobs and he still would have made a nice living, but he had to get greedy without knowing what he was doing.",2,4,1468193074.0,Donkey__Xote,False,negative,negative,neutral,negative
d57juaz,Transparency... we Indians seen to be culturally allergic to it,5,4,1468215384.0,workerb33,1468240338.0,negative,negative,negative,negative
d58b8r9,"We don't. 

If a site is truly important, the plans are protected. Some information can be redacted, for example during a school project I picked up the plans for my local train station, the whereabouts of the safes (there are banks in the train station) was not shown. And you show ID when you pick them up. ",2,4,1468268278.0,HonzaSchmonza,False,neutral,neutral,neutral,neutral
d577dzw,Do you live in Ojai? That same thing happened there a few years back.,8,4,1468192417.0,non_sequential,False,neutral,neutral,neutral,neutral
d577wdb,Reddit's favorite ,2,4,1468193312.0,duelingdelbene,False,neutral,positive,positive,positive
d56renv,"Yes, I do think if a crazy dictator of India decides to honour his dead wife, it better be better than the Taj Mahal.

Sure it's beautiful and all that, but if we had we were ruled by a king rn I'd really wager he would do better for his queen.",39,4,1468167230.0,ostrish,False,negative,negative,positive,negative
d56rf3q,"I'm sure that India would struggle today to build a black one nearly as good, for that price on the opposite side of the river.   Maybe a facade.",9,4,1468167252.0,JTRIG_trainee,False,negative,neutral,positive,neutral
d56uq79,Are there many people in India who believe the theory that the Taj Mahal was originally an ancient Hindu temple? ,3,4,1468172532.0,,False,neutral,neutral,neutral,neutral
d57cxz4,"But has it been over-designed, it's still being used by people instead of having been torn down and replaced by a futuristic escalator or something, so by detention it can't be over-designed. ",5,4,1468202169.0,485075,False,neutral,neutral,neutral,neutral
d57kz3a,"It is not over designing, it is quite simply the materials used. Stone and Granite which is what was chiefly used is super fucking expensive, I mean imagine building an all granite...clinic and then scale it up to something like the [https://en.wikipedia.org/wiki/Brihadeeswarar_Temple](https://en.wikipedia.org/wiki/Brihadeeswarar_Temple) which would be say... a modern hospital. The cost alone would run into near ruinous expenses. The temple is said to weigh a total of 60k tons, all of it granite, I can't even begin to imagine how much just the structure would cost.

Is it built to last? Sure, but is it practical to compare it with modern buildings? No.

Ofc, like you say, no excuse for shitty workmanship and corruption drive contracts.",3,4,1468218194.0,,False,negative,neutral,negative,negative
d56rd0x,Yes I think what /u/spikyraccoon is saying is that after 500 years of progress our worst should be better or comparable to their best. ,52,4,1468167152.0,ostrish,False,neutral,neutral,neutral,neutral
d56rdoy,Are there any examples of contemporary stairs that will last 500 years?,7,4,1468167184.0,JTRIG_trainee,False,neutral,neutral,neutral,neutral
d56rc94,You're not getting the tragedy.,6,4,1468167117.0,OstensiblyOriginal,False,negative,negative,negative,negative
d56vazq,"But that fucking thing didn't even last 5 years!

I think its shit then.
",8,4,1468173441.0,helloHansa,False,negative,negative,negative,negative
d56vapj,I would. That would be so fucking cool.,3,4,1468173429.0,ivankaismaiwaifu,False,positive,positive,positive,positive
d56zcxm,[I understand.](http://memesvault.com/wp-content/uploads/Okay-Crying-Meme-15.jpg),3,4,1468179823.0,Idonthavearedditname,False,neutral,neutral,negative,neutral
d57pe7j,I know that.,0,4,1468232850.0,,False,neutral,neutral,neutral,neutral
d573v73,And shoot innocent people.,-5,4,1468186706.0,Obi_Wanka_noobie,False,negative,negative,neutral,negative
d56wrlf,This just in.  Shots fired... ,3,4,1468175786.0,-kljasd-,False,neutral,negative,neutral,neutral
d57iqns,"Most of my Indian friends live there, we take via Skype and when we game together ",2,4,1468212890.0,Tabnam,False,neutral,neutral,neutral,neutral
d56pgz8,"Britain is a constitutional monarchy, it's government works exactly the same as India. The elected government can decide to implement socialist policies if it wants.",3,4,1468163872.0,,False,neutral,neutral,neutral,neutral
d56pk64,"Britain isn't a monarchy at all. The Royal family has no power, only the king/queen has any say at all. And even then, the Queen currently choses to not do anything so that it's basically a republic.",1,4,1468164036.0,massif_gains,False,neutral,negative,neutral,neutral
d56wcsb,"Russia isn't democratic.

There are no true democratic countries in the world. No country actually gives individual representation: where **every** individual's rights are recognized and protected by the state.

One of the most significant reasons why socialism hasn't worked very well in the past isn't because it's ineffective but because socialist states are economically boycotted (embargoes) or physically assaulted (war) by fascist states. They're under constant attack by competing states.

Though one could argue socialist states have weak defensive skills and ideology. Which is important.

Very important. In fact so far weak defense has been the *only* reason socialism has not succeeded.

Pacifists reject defense. But defense is a basic survival skill. It's necessary for human survival.

Socialist states need to accept and practice effective pacifist defense skills and technology, or bullies will simply crush them into compliance.",1,4,1468175139.0,hyene,False,negative,negative,negative,negative
d57tv11,Im not trying to 'save face'.  You still haven't said ANYthing that negates India's rape culture.  But you'll downvote like a little bitch because you can't actually argue against it.  There is no argument.,2,4,1468244218.0,Zooshooter,False,negative,negative,negative,negative
d576m3u,http://imgur.com/pXI7hfd,16,5,1468191080.0,,False,neutral,neutral,neutral,neutral
d57m2vu,You are EVERYWHERE!,1,5,1468221278.0,bojackarcher,False,positive,positive,positive,positive
d5730y5,"Reddit.com
",20,5,1468185512.0,,False,neutral,neutral,neutral,neutral
da8mrzt,That looks like one of them lol.,1,5,1479676995.0,ktr0n3,False,neutral,neutral,neutral,neutral
d57ghm9,"The way you're commenting (like a typical randian)  shows that you clearly didn't 'discover' reddit less than 24 hours ago.People don't just 'discover' reddit and start posting this many comments right away with in a span of 24 hours. At least you've waited 3 hours to post that reply, I appreciate your effort. Hope you're satisfied with that karma! ",2,5,1468208400.0,wewillalldiesomeday,False,negative,negative,positive,negative
d570dxr,"Dude, just let it go. You're embarrassing yourself.",7,5,1468181372.0,Obi_Wanka_noobie,False,negative,negative,negative,negative
d5785ah,> If,1,5,1468193742.0,Gordon_ramaswamy,False,neutral,neutral,neutral,neutral
d56zss2,isn't his account older than this post though?,2,5,1468180495.0,Infernal2,False,neutral,neutral,neutral,neutral
d56zosp,"Not ""kinda"", he did.",0,5,1468180331.0,SoberFuck,False,neutral,negative,neutral,neutral
d571v3s,When has your username ever been relevant?,1,5,1468183709.0,quantum-mechanic,False,neutral,neutral,neutral,neutral
d570a9t,"That's deep, mate. That's deep. ",-2,5,1468181219.0,shadilal_gharjode,False,neutral,positive,neutral,neutral
d57l1y6,why can't his wife's cousin do a proper job? then you get relationships and public good,5,5,1468218404.0,Fig1024,False,negative,negative,neutral,negative
d57iq5b,You think engineering something is equivalent to engineering it from ground up? You crazy brother,1,5,1468212859.0,,False,negative,negative,neutral,negative
d57k1wq,"In most cases where the job goes to the lowest bidder it's already pre-determined who will get to be the lowest ""bidder"". 

Either by the bidders amongst each other (very common practice), or by leaking the competing bids.",5,5,1468215891.0,,False,neutral,neutral,neutral,neutral
d57a1i3,[deleted],7,5,1468197084.0,,1589250888.0,neutral,neutral,negative,neutral
d57kbse,"Well, Finland, Norway, Denmakr etc etc don't really count.
",2,5,1468216555.0,,False,neutral,negative,neutral,neutral
d578yhf,"sometimes?  people are already picked before the RFW goes out... it's just a formality now.
",3,5,1468195180.0,CANT_ARGUE_DAT_LOGIC,False,neutral,neutral,neutral,neutral
d56o1k9,Not just that but There are companies which are created for specifically this process just so politicians sons and daughters can earn money.,10,5,1468161068.0,hd-86,False,negative,negative,negative,negative
d56vszb,Still their names appear in Panama Papers.,3,5,1468174254.0,DudeOnSteroids,False,neutral,neutral,neutral,neutral
d57kzop,Of course. We love to poke our nose into other people affairs.,2,5,1468218237.0,freedomIndia,False,negative,negative,positive,negative
d5aaqjw,Okay. Thank you for clarifying. ,1,5,1468392623.0,EJERommel,False,positive,positive,positive,positive
d577fk1,"Lancaster, Ca. 

They also gave decorating crosswalks ago, and that was as big a failure as what's posted. 

One of my sister's live in La Conchita. ",9,5,1468192495.0,factbasedorGTFO,False,negative,negative,negative,negative
d57o0ek,was it all those renovations they did at the big park in town?,1,5,1468227739.0,,False,neutral,neutral,neutral,neutral
d56v4e6,"Why just the dead wife? The Sardar Patel Statue to ""honour"" unity of India is quiet an achievement.",10,5,1468173148.0,spikyraccoon,False,neutral,neutral,neutral,neutral
d570zdd,"As many as people believe that the world is flat or the world is hollow. Different folks, different strokes man.",5,5,1468182315.0,,False,negative,neutral,neutral,neutral
d57wkfv,"Exactly, overdesign forced by the absence of modern technology. Not wrong for its time, but not a standard we should follow in this day and age either. Buildings today are built to last about 50-100 years and no more. ",1,5,1468248620.0,Bernard_Woolley,False,negative,negative,negative,negative
d56zphv,"This isnt how the real world works. 
We arent going to build literally everything better, all the time, compared to something built hundreds of years ago inspite of all the modern engineering advances.

With that said Im not defending this example of awful construction quality by the OP.",3,5,1468180361.0,sratra,False,negative,negative,negative,negative
d56u448,"That's not how civilization works. Society does not develop along a linear path of objective improvement. It simply changes and evolves. It hasn't ***been*** 500 years of progress, it's been 500 years of change. Yes, our technology has improved, but our society is in many respects utterly alien to society 500 years ago. It's comparing apples and oranges.",14,5,1468171565.0,DouglasHufferton,False,negative,negative,neutral,negative
d56sxhx,"Why should that be the case? Some of the stuff people build, regardless of the age at which its built, is legendary. Some stuff is just built to get the job done. ",1,5,1468169711.0,svmk1987,False,neutral,neutral,neutral,neutral
d56smj6,Give it 500 years and we'll get to see this same meme updated for future times.,14,5,1468169243.0,aj3x,False,neutral,neutral,positive,neutral
d56xpmf,"Dry stone walling techniques would hold up just as well today as they did then.  Cement locks everything together and is very easy to work with, but it does not age as well.  It's just that the cost of cutting/transporting blocks of stone these days is generally non-viable.  ",3,5,1468177279.0,piceaglauca,False,neutral,neutral,neutral,neutral
d56u9tz,Kind of hard to know when 500 years have not yet passed since January 1st 2016.,0,5,1468171814.0,cherrytrix,False,neutral,neutral,negative,neutral
d57lclx,"> contemporary stairs that will last 500 years

Stairs today are designed to not last 500 years. 
Since design is a science now, we can calculate and build accordingly.
Stuff that is overengineered to last 500 years is too expensive and gets ignored, by intent. Stuff that is shoddier or not designed right may break down.  

Today we can build dams that are designed to last hundreds to [thousands](http://zidbits.com/2013/05/how-long-will-the-hoover-dam-last/) of years.

We have projects to[ build stuff](http://longnow.org/clock/) for 10,000 years",1,5,1468219181.0,barath_s,False,neutral,neutral,neutral,neutral
d5yi43w,"I'm sorry, happy cake day.",1,5,1469985924.0,,False,positive,positive,neutral,positive
d570m74,Am I dead? ,1,5,1468181727.0,,False,neutral,negative,negative,negative
d56popo,"I know that guys, just couldnt think of a single monarchy, let alone a capitalist one.",1,5,1468164266.0,PlainClothesmanBalee,False,negative,negative,neutral,negative
d56tfua,"> it's government works exactly the same as India

Except that there is an old hag still sitting in her inherited palace, hoarding stolen collections from around the world and living on free money.",1,5,1468170503.0,,False,negative,negative,negative,negative
d56xe6o,"Umm, I think that's a big claim.

Which country waged this literal or economic war on Venezuela?",1,5,1468176782.0,PlainClothesmanBalee,False,negative,neutral,negative,negative
d5743lh,"Unless reddit is showing it wrong, his account is actually 3 hours older than the OPs post.

Which makes me wonder if that is OP on a different account and he set this entire thing up.",3,6,1468187051.0,Zinki_M,False,negative,negative,neutral,negative
