Comment ID,Comment Text,Comment Score,Comment Depth,Created Timestamp,Author,Edited,Semantic Label,Semantic Label 2,Semantic Label 3,Major_Semantic
d57010b,He has the gift of foresight.,1,6,1468180836.0,Wizzad,False,positive,positive,positive,positive
d57094f,"Maybe he had some other plans. 

",1,6,1468181171.0,Obi_Wanka_noobie,False,neutral,neutral,neutral,neutral
d570kn9,Thanks,1,6,1468181659.0,SoberFuck,False,positive,positive,positive,positive
d57ms5p,"Because the only reason he got the job was because he's the wife's cousin, not for any merit.",10,6,1468223504.0,485075,False,negative,negative,negative,negative
d57lhti,"Finland is really cool and interesting, but is a rounding error for scale.

The entire country has a population (5.6m) less than any one of India's metro areas.  

The fact that they have built several world spanning companies (Angry birds, nokia etc) make it notable.",7,6,1468219571.0,barath_s,False,neutral,negative,positive,neutral
d57l0zg,Reddit has such a boner for these countries ,1,6,1468218333.0,facedawg,False,negative,neutral,positive,neutral
d577w3z,"I guess it's a California thing huh?

Edit: I had a couple friends die in that landslide in La Conchita ten years ago. I haven't thought about that place in years. Beautiful area.",5,6,1468193300.0,non_sequential,1468193499.0,negative,neutral,positive,neutral
d57zkw0,"I was thinking of the weird concrete islands they put on the roads. They were completely in the way and started breaking down in months. Thankfully, they took them out.",1,6,1468252870.0,non_sequential,False,negative,negative,neutral,negative
d56uobk,"Are you saying in terms of engineering, architecture and design.. we haven't progressed tremendously in the last 500 years? Come on.",17,6,1468172450.0,spikyraccoon,False,neutral,negative,neutral,neutral
d57a228,"You need to remember that 500 years ago they benefited from local technology, while today the whole world benefits from the whole world's advances in technology. The fact is, whoever designed those steps done goofed up and used the wrong materials.",1,6,1468197111.0,salgat,False,neutral,neutral,neutral,neutral
d56wxo2,">Some stuff is just built to get the job done.

I don't get your point. The failure of getting the job done is exactly what this post is about.",1,6,1468176055.0,dashanan,False,negative,negative,negative,negative
d57n7kb,! Remind me 500 years. ,3,6,1468224926.0,Vendril,False,neutral,neutral,neutral,neutral
d56y5yk,"Still, I doubt you can show any examples of contemporary stairs that lasted 500 years.",2,6,1468178004.0,JTRIG_trainee,False,negative,negative,negative,negative
d56q40c,Saudi Arabia.,1,6,1468165025.0,,False,neutral,neutral,neutral,neutral
d56r66r,"Vatican, Saudi Arabia, UAE, Liechtenstein, Monaco. ",1,6,1468166835.0,,False,neutral,neutral,neutral,neutral
d573in2,"The US forced a trade embargo on Cuba, and the USSR.

Canada ignored the trade embargo on Cuba. We are one of the only countries that did so. Everyone kowtowed to America.",1,6,1468186218.0,hyene,False,neutral,neutral,negative,neutral
d578ogx,I'm pretty sure OP is doing some double dipping on multiple accounts. It's kind of pathetic.,1,7,1468194686.0,ShibaHook,False,negative,negative,negative,negative
d57nu2s,To be fair they're pretty great.,3,7,1468227108.0,xuflonex,False,positive,positive,positive,positive
d5791w0,"On the flip side California is bigger than most countries and wealthier, so a lot of engineering research is done there. 

I doubt any area is more ready for an earthquake than So Cal. There's still some prone to earthquake stuff, but for the most part I think it's impressive. 

Putting steel jackets around all suspect concrete bridge supports was a massive undertaking that got completed in a relatively short amount of time. The new construction methods now used that are based on lessons learned is interesting. 

Yeah, my sister is within 3 houses of the end of the landslide. 

",3,7,1468195352.0,factbasedorGTFO,False,positive,positive,positive,positive
d58enio,hm I must've missed that. haven't been to Ojai since November tbh,1,7,1468272945.0,,False,negative,neutral,negative,negative
d56vazm,"He's saying that our worst can still be pretty fucking bad, regardless of which year it is from. ",40,7,1468173441.0,siamond,False,negative,negative,negative,negative
d56w91w,"People haven't is the point. There were probably steps built back then that didn't last five years too and for the same reasons as today, corruption and shoddy workmanship.",3,7,1468174970.0,Brave_Horatius,False,negative,negative,negative,negative
d57046r,"No offense but you are missing the point. Allow me answer your question to him. He is NOT saying we haven't progressed. He is saying its not actually a fair comparison in this case. 

Think about it. Is *every single* thing that is built in the modern world going to be better lasting than ancient buildings that were specifically built to last and endure? 

For a fair understanding of advances look up how we have thought up much better ways of engineering super long lasting structures compared to the engineering methods that would have been used in olden times.

P.S Dont mistake mine or /u/douglashufferton 's comments as a defense of the shitty job done by the Maharashtra govt.

Using correct logic to judge *anything* seriously should be a matter of principle for everyone in my opinion.

",5,7,1468180969.0,sratra,False,neutral,neutral,positive,neutral
d57l00a,"It is not over designing, it is quite simply the materials used. Stone and Granite which is what was chiefly used is super fucking expensive, I mean imagine building an all granite...clinic and then scale it up to something like the [https://en.wikipedia.org/wiki/Brihadeeswarar_Temple](https://en.wikipedia.org/wiki/Brihadeeswarar_Temple) which would be say... a modern hospital. The cost alone would run into near ruinous expenses. The temple is said to weigh a total of 60k tons, all of it granite, I can't even begin to imagine how much just the structure would cost.

Is it built to last? Sure, but is it practical to compare it with modern buildings? No.

Ofc, like you say, no excuse for shitty workmanship and corruption drive contracts.",2,7,1468218260.0,,False,negative,neutral,negative,negative
d56z66d,"No. I stated that our technology has improved. What I'm saying is that humans, and our activity, does not objectively progress as time goes on. It simply adapts to the needs of the time. It is societal evolution, and just like biological evolution, it is neither good nor bad, it just is. 

Example; we can build the tallest buildings ever constructed now. Our technology and society allows and demands it (economy of space, etc.). However these same buildings will not last the test of time; they are designed to be efficient and sturdy while actively maintained. The modern skylines of the world's cities would quickly crumble if they were no longer maintained. *Very* few modern structures would survive in any recognizable form for ~2,000 years without constant upkeep. Important structures for many years were designed to survive with as little upkeep as possible; they were designed to be monumental and to last. The societal factors that influenced these design philosophies are different than the societal factors that influence modern design.

Also, as other people have stated. There is also a selection bias as well as basic human nature.",2,7,1468179536.0,DouglasHufferton,False,neutral,neutral,positive,neutral
d575swh,"There are stairs that move under your feet. I would call that tremendous progress.
",1,7,1468189744.0,Juanfro,False,positive,positive,positive,positive
d57gw3e,What we mean is that these few steps don't qualify as a pinnacle of our engineering and architecture talent. ,1,7,1468209152.0,svmk1987,False,negative,negative,neutral,negative
d570xfj,"> contemporary   
> lasted   
   
I don't get this, but [the Romanian Parliament](https://en.wikipedia.org/wiki/Palace_of_the_Parliament) should easily last about 300-400 years if humans are still around and no one blows it up by then. Wouldn't you agree? ",3,7,1468182229.0,,False,neutral,neutral,neutral,neutral
d5748vf,"Yes, I understand what happened to Cuba. Also USSR just couldn't keep up with the USA on military and space expenditures, USA had a much bigger population and GDP.

But this doesnt describe venezuela's current demise. Their Government's anti-free market fixed price for food items has resulted in all private companies which supplied food to leave. The country is in a terrible demise because of govt's stupidity and not a war on communism",1,7,1468187274.0,PlainClothesmanBalee,False,negative,negative,negative,negative
d579r3w,"Yeah, for sure. I went through the Northridge quake and I'm sure it could have been way worse. As it was, we were out of power for a couple days and phones were down as well. Several buildings collapsed or were severely damaged. My friend lived at the epicenter and there was huge crack going down the face of his 20 plus story apartment building. He had to evacuate. It was pretty crazy. 

Does your sister happen to know Jimmy Wallet? He was a casual friend of mine that lost his wife and children to the landslide. Super cool family. They were total hippies and we would hang out, play music and smoke pot back in the day. It's a small community so I'm sure if she was around then she would at least recognize them.",3,8,1468196584.0,non_sequential,False,negative,negative,negative,negative
d58hnjp,"Oh this was almost ten years ago. Something like that. Just another one of city councils partially thought out ideas. They basically put 3'x5' cement islands in the streets a couple of feet from the curb. 

People kept running into them when turning and doing serious damage to their cars and the islands. Or on bikes and getting injured. One lady even flipped her car on the corner of Matilija and Montgomery by Chaparral.That's when they pulled them out. 

I worked for the city for 4 years and was amazed at the ideas they would throw funding at. Not all bad though. It's part of the reason Ojai is so ""quirky"".",1,8,1468277438.0,non_sequential,False,neutral,negative,neutral,neutral
d56vcxa,Fair enough.,10,8,1468173532.0,spikyraccoon,False,neutral,positive,positive,positive
d56x9eo,And I think the point of this post is that worst of today's time architecture is found in India.,4,8,1468176569.0,adngalaxy,False,negative,negative,negative,negative
d571vag,"> What I'm saying is that humans, and our activity, **does not objectively progress** as time goes on. It simply adapts to the needs of the time. It is **societal evolution**, and just like biological evolution, it is neither good nor bad, it just is.

You're literally word-vomiting now. The social reality today is *objectively* the best in human history, whether it is number of wars, diseases, how long each life last on average, crime etc. It's all at all-historic lows. 

BTW, when you use the term ""sociatal evolution"" that is a phrase about human society, not just buildings, so don't try to worm yourself out now.",-2,8,1468183717.0,,False,neutral,neutral,neutral,neutral
d57aj7b,"My sis moved there right after the slide. I just took some images the other day and thought about posting them. I forgot to image the sign they put up for everyone that enters. It's a big sign warning that it's a geological hazard area. 

I experienced the Sylmar quake when I was 9, and I was surprised to see how much damage the Northridge quake did. 

The same damn overpasses that had to be rebuilt after the Sylmar quake fell down in the Northridge quake. Lessons weren't learned for some reason. 

Everyone remembers the hippie guy that lost his family. I don't know what happened to him, I always forget to ask when I'm over there. 

Fricken took forever for them to finish their only access to the beach after Cal Trans tore it up. Some of the community members fucked with Cal Trans in a fight over access. 

Cal Trans finished the tunnel, but didn't want to open to the community until another phase of the project was completed. Cal Trans kept blocking the tunnel, and some dude in the community kept unblocking the tunnel. 

They tried welding a steel door over the entrance and blocking it with a giant boulder. It's all done now, pretty cool. 

Now you don't have to crouch through the tunnel, and there's bicycle access to it from the beach side of the freeway. 

After they finished the tunnel, they had to do the bicycle access, which was a lot more work. ",6,9,1468197943.0,factbasedorGTFO,False,neutral,negative,negative,negative
d58i00h,"oh wow a while ago.

I live up north a few hours and they just did the same thing with the medians to our downtown area. luckily it's good concrete work but man everyone is pissed off about not being able to turn anymore on the main streets. not to mention how the median bulges out into the bike lane at cross walks so bikes have to swerve out into the road now.",1,9,1468277965.0,,False,negative,negative,neutral,negative
d57l255,"No, if anything you are tilting at windmills.

What he is saying is simple, HUmanity has advanced, our building techniques have advanced immeasurably, but our design philosophies are different. Just this line alone should have been a clue for you,

> The modern skylines of the world's cities would quickly crumble if they were no longer maintained. Very few modern structures would survive in any recognizable form for ~2,000 years without constant upkeep.",2,9,1468218418.0,,False,neutral,neutral,neutral,neutral
d573526,"Jesus, who decided to piss in your cornflakes this morning? Not only have you misread me completely, you've decided to be a cunt about it too.

The improvement in quality of life is an excellent example of how society has evolved to best care for itself. It is an example of how our technological abilities have objectively progressed.

We can progress, objectively, on a technological level. Technology, now, is objectively better than older technology. In turn this has provided contemporary society with luxuries never before seen in human history. 

Our technological ability is not an indicator of a more developed society. Humans are fundamentally the same as always. We are as capable of cruelty as we were in the sixteenth century. 

People incorrectly believe our technological and scientific ability is an indication of a more-enlightened, progressive society. They see societal change as a straight line of progressive improvement because that is generally what is seen in technology and science. That's not how humans work.

So, maybe next time, before trying to insult someone because you don't understand them, take a minute and think. 

Or don't. It's the internet. 
",0,9,1468185644.0,DouglasHufferton,1468188429.0,negative,positive,positive,positive
d57chcx,"Heh, I always assume I'm talking with a twenty year old on Reddit. I forget that some of us ""adults"" are around as well. Sylmar huh? I wasn't alive just yet but my older siblings have talked about that one. I have heard that the Northridge quake was a larger magnitude than reported for various reasons. I don't necessarily believe that, but it was definitely intense.

That's awesome people still remember Jimmy and family. That was tragic. I occasionally think about them and how him and his daughter are doing. 

I remember the beach access drama. Glad to hear it's been resolved. I grew up in Ventura/Ojai since 1980 and moved away in 2009. I saw a lot of changes in that time frame and I've heard there has been a ton of growth between Oxnard, Thousand Oaks, Camarillo up to Santa Barbara since I've left. Thanks for chatting with me. Almost feels like I'm talking to a friend from back home!",2,1,1468201366.0,non_sequential,False,neutral,neutral,neutral,neutral
d58jqqk,"Yeah, I'm getting old! It sounds like your town has built the same type of thing. What's your connection to Ojai, if you don't mind me asking? It's such a small community that we are bound to have friends in common.",1,1,1468280716.0,non_sequential,False,neutral,neutral,neutral,neutral
d57cs7t,"Looks like a lot of the agricultural area in Oxnard is going to be developed. A lot of strawberry farmers have bailed or announced that they're quitting. http://abc7.com/business/hundreds-of-strawberry-farmers-to-lose-jobs-in-oxnard/1388828/

Best place in the States to live as far as average weather. Sorry you had to leave it behind. ",1,2,1468201896.0,factbasedorGTFO,False,neutral,positive,negative,neutral
d58k1nt,my grandma lives there and we visit a few times a year,1,2,1468281224.0,,False,neutral,neutral,neutral,neutral
d57d25w,"Oh, I didn't have to leave it behind.  I just wanted a change of pace and have been living in a cabin on a lake in western Montana. Then moved to a small island in the Caribbean where the weather is amazing. 

But I do miss my hometown and plan on visiting next month if I can. I've always thought that the best part of California starts in Ventura and heads north. 

That's too bad about the strawberry farms. I have good memories of stopping at the stands on the way out to the beaches in Malibu. ",2,3,1468202367.0,non_sequential,False,positive,positive,neutral,positive
d58ker9,"Awesome, it's a beautiful place. I've been gone since 2009 and definitely miss it at times. If you haven't already been, I recommend hiking up to the Punch Bowls to go swimming. It's an awesome spot with three different natural pools and a bunch of different jumps. At the very top are a handful of natural waterslides. 

",2,3,1468281827.0,non_sequential,False,positive,positive,positive,positive
d58lo19,ooh I was actually planning a trip to Ojai and the surrounding area later this month. I'll definitely make an effort to check it out. Thanks!,2,4,1468283834.0,,False,positive,positive,positive,positive
d58pm7h,"I'm jealous. I found some directions for you: the [Punch bowl Directions](http://www.oocities.org/troop484.geo/camping/echofalls.html)

 And a video so you can get an idea of how awesome it is: [Punch bowl Video](https://youtu.be/aXAKU0Yd7S0)

 It's not my video, but it shows the jumps and slides. I hope you make it and have a blast!",2,5,1468290219.0,non_sequential,False,positive,positive,positive,positive
d58pzto,oh man that looks incredible. thank you so much,2,6,1468290824.0,,False,positive,positive,positive,positive
