Comment ID,Comment Text,Comment Score,Comment Depth,Created Timestamp,Author,Edited,Semantic Label,Semantic Label 2,Semantic Label 3,Major_Semantic
d56lmtb,This whole tragedy could've been averted if Shivaji had built 3 extra steps.,1938,0,1468155407.0,Anon_id_43576999,False,negative,negative,negative,negative
d56mfp2,I'm guessing Shivaji didn't hand out the contracts for building his forts to the lowest bidder. ,610,0,1468157519.0,ironmenon,False,neutral,neutral,neutral,neutral
d56uv66,"Wow, something from /r/India with 2000+ votes.  Intriguing.",231,0,1468172748.0,sidcool1234,False,positive,positive,positive,positive
d573wp7,"Lot of posters here don't seem to have a clue about recent and older Indian construction techniques. 

The Shivaji stairs were hand carved out of stone using chisel and hammer. It probably took one mason 4-5 days to hew one stone. The same can be easily done today, by hand, but most people would not want to pay that kind of money. You could get the stone cut by machine. You wouldn't need much cement or lime once the stone is squared and cut-just the joints between.

You can produce the same lime as was used in the construction of Ancient Delhi, or the many forts, quite easily. But it takes a lot of labor and effort.

The 2013 stairs took about a day to build and the main reason for the cement flaking off is probably the cement to sand ratio was off. Typical correct ratio would be 5:1 or 6:1 sand to cement. The contractor may have stolen cement and may have used 8:1. And people walking on it before it was set.

Edit 1-Also the cement may not have been kept cool and hydrated with water during curing. ",45,0,1468186766.0,,1468188147.0,neutral,negative,neutral,neutral
d56ujf2,[Survivor Bias](https://www.youtube.com/watch?v=_Qd3erAPI9w),73,0,1468172231.0,HumanWithCauses,False,neutral,neutral,negative,neutral
d56t0mv,"This is absolute truth.

I kid you not, I have been to enormous amount of historical structures around India. That is what I used to do during studies and beyond. Almost all of them have a durability that will put any modern Indian construction to shame. Not just stairs, but anything from buttresses, roofs, fences (yes, stone ones) and the strength of walls themselves. And I am not even talking about forts (who would be intentionally be made of large blocks of fired clay and stone), but the usual buildings.

Heck, Fatehpur Sikri has a better fountain than what our governments build in gardens, if they do so at all.

It is a crying shame our government is not even able to build up to the standards of North Korea. PWD and ilk are the laziest and most incompetent organizations ever. Can't even hire trained quasi-literate labourers or learn to build a fucking staircase.

The tragedy is, India has some of the most beautiful historical architecture on earth...compare this to how we build things now.",40,0,1468169842.0,,1469115862.0,positive,positive,positive,positive
d56lc61,"""Corruption"" - Upper steps at Raigad fourth built by Chhatrapati Shivaji in 1656; lower steps by Maharashtra govt in 2013

This is true for many things. i.e. if you know king of gondal built pools and roads which are in today's day and age still remains intact and municipality built roads are gone in 2 years. And they look good too :(",184,0,1468154567.0,hd-86,False,negative,negative,neutral,negative
d56nuhp,It's not corruption as much as cluelessness. The edges of steps should be either rounded like [this](http://c8.alamy.com/comp/ARY3BR/bright-and-colourful-subway-underpass-steps-with-tiled-pattern-design-ARY3BR.jpg) or metal coated like [this](http://www.elitetiling.net/wp-content/uploads/2010/11/Fiveways-Corner-Subway-Southbound-Steps.jpg). I've observed skywalks steps in Bangalore are metal coated and they have been very sturdy and durable. ,79,0,1468160663.0,Adhvaga,False,neutral,neutral,positive,neutral
d56t1vc,"It does make one good point, I think.

Modern day politicians have a horizon of expectations for their policies to produce results that lasts for the duration of their term in office, at maximum.
They want their electorate to see marked improvement in quality of life within 5 years of election, so they can be associated with the achievements.

The problem is this system does not incentivize a perspective on development that extends into the long-term. Investments are not made that sacrifice a little bit now to receive more for future generations.

That's not to say every staircase should be built to last millenia or longer. We are working with finite resources and every investment has an opportunity cost. Stonework is expensive. Sometimes it might be better to put a little less into A when investing the difference into B gives you more bang for your buck.

",9,0,1468169894.0,artashii,1468219891.0,neutral,positive,neutral,neutral
d56nin2,"Taj Mahal also comes to mind.    
ooh wait.. i read news recently we have found ways to modify its color by polluting the air around it",35,0,1468159967.0,hans_landa_unchained,False,neutral,negative,neutral,neutral
d56r7zr,"Sort of a world problem - we build the cheapest thing that works...not the best thing. One of our, many, many, issues...",14,0,1468166920.0,,False,negative,negative,negative,negative
d56o9sz,1656 had far fewer assholes in general.,32,0,1468161537.0,serialposter,False,negative,negative,negative,negative
d56unje,"I don't think things are much different in the west. For one example, steel-reinforced concrete that has been pervasive in a lot of modern architecture is proving to have serious, unanticipated decay problems. Meanwhile, the Romans had a vastly superior formula for concrete, and we still haven't fully understood their methods.",6,0,1468172416.0,Tiresias3000,1468172660.0,negative,negative,neutral,negative
d578ow0,"BC .. /r/all mai agaya r/india

Namaste /r/all",12,0,1468194707.0,VerifiedMod,False,neutral,neutral,neutral,neutral
d56wdwz,I would love to see ALL of India. I find myself very fascinated with it.,4,0,1468175189.0,,1468195387.0,positive,positive,positive,positive
d56y5pk,Confirmation bias. We don't see the construction that didn't survive because it didn't survive.,9,0,1468177992.0,Xunae,False,negative,negative,negative,negative
d5729an,"If the contractors feared for their life if the steps fell apart then they would have built better steps.

You mess up the King's fort you will get killed or atleast shunned by your circle at the least.",3,0,1468184318.0,slamdunk6662003,1468334976.0,negative,negative,neutral,negative
d56t282,"One is solid stone, and the other is cement/concrete with tiled surfaces.  

I can't tell if you're serious, or just shit-posting. ",14,0,1468169909.0,akmjolnir,False,negative,negative,negative,negative
d5751xt,This basically describes the whole of Rome these days.,2,0,1468188549.0,,False,neutral,neutral,neutral,neutral
d576rmg,This is friggin' awesome. Modernity can go take a long walk off a short pier sometimes.,2,0,1468191343.0,Vranak,False,positive,positive,positive,positive
d57dr9g,"You can do this with literally every country. Pyramids built in 2360 BC, dilapidated house built in 1970: Tragedy of Egypt. 
Castle built in 1060, derelict factory built in 1940: Tragedy of England.",2,0,1468203574.0,TurdFurgison,False,negative,negative,negative,negative
d57rp7o,"Do realize that with an equal amount of pedestrian traffic, Shivaji's steps wouldn't have looked as they do in the picture.",2,0,1468239680.0,johnVanDijk,False,neutral,neutral,neutral,neutral
d58h1r2,"We all know the way thing have gone, and how deep rooted corruption is, but we cannot hold corruption accountable for our own stupidity. Before sharing things like this to create a sensation, one should take a close look at what one is sharing. 

Considering the picture is authentic, we must note that the one made in the times of Shivaji was made of blocks of **stone**, whereas the ones made in our time is made of **some sort of tile, a mere replica of stone**. In our time, we have learned the way to copy a design, mimic nature in it and make it better or more beautiful, but when it comes to copying the strength, we are far behind nature. This is true to everything in our life. We are more for image and less concerned about identity. About which Guy Debord wrote: 

***""Images detached from every aspect of life merge into a common stream, and the former unity of life is lost forever. Apprehended in a partial way, reality unfolds in a new generality as a pseudo­world apart, solely as an object of contemplation. The tendency toward the specialization of images­ of ­the world finds its highest expression in the world of the autonomous image, where deceit deceives itself. The spectacle in its generality is a concrete inversion of life, and, as such, the autonomous movement of non­life. ""***


",2,0,1468276503.0,bikramksingh,False,negative,negative,negative,negative
d56nig7,Thats just because Indians have better diets and are heavier today,9,0,1468159956.0,,False,neutral,neutral,neutral,neutral
d56twnl,"Oh man, this is such a telling picture. It's almost poetic in the description of our current state. We have gutter mice as leadership; rodents with petty greed, their limited ambition and subterranean vision. ",2,0,1468171242.0,freddledgruntbugly,False,negative,negative,neutral,negative
d56w1cm,"Tragedy of The Modern World. Everything today is done more cheaply than in the past. My 1950 house was built to last 15 years, still stands in excellent shape and is far better than a new house, construction and materials-wise.",2,0,1468174631.0,wodha,False,positive,negative,positive,positive
d573f1v,Which bastards were in the power in 2013 in Maharashtra?,2,0,1468186064.0,pchampn,False,negative,negative,negative,negative
d5761k4,"survivorship bias - things that have lasted longer give the observer the biased impression that things from that previous era last long. It is not evidence of anything unless the survivability of all the things designed in that era is known.
",2,0,1468190134.0,pythonicusMinimus,False,neutral,neutral,negative,neutral
d578grr,"This post has made it to 5,000 up votes and has been posted on the twitter account @Reddit5000!
						
To see the tweet, check here: https://twitter.com/Reddit5000/status/752287562962604032

^You ^can ^find ^all ^5,000 ^posts ^here: ^https://twitter.com/Reddit5000

^, ^7,500 ^posts ^here: ^https://twitter.com/Reddit7500

^,And ^10,000 ^posts ^here: ^https://twitter.com/Reddit10000
						
^(I'm a bot, don't worry about supporting me (I don't cost much)^), ^(but you can support )[^charity](http://freethoughtpedia.com/wiki/Secular_charities) ^and [^science!](http://www.sens.org/)",2,0,1468194307.0,Reddit2Trend,False,neutral,neutral,neutral,neutral
d56tf7y,They just don't make stuff like they used to,1,0,1468170475.0,steadydabbin,False,negative,negative,neutral,negative
d573clu,"It's a worldwide epidemic, can't get a guy to give a fuck about his job when you don't even pay enough to make ends meet.",1,0,1468185962.0,,False,negative,negative,negative,negative
d574050,Reminds me of Quebec. ,1,0,1468186909.0,CountFaqula,False,neutral,neutral,neutral,neutral
d57g5mh,crazy what cheap labour can do ,1,0,1468207787.0,,False,negative,negative,negative,negative
d57qf0a,"Oh look, something about India on the front page. 
*opens*
Same old shit. ",1,0,1468236193.0,thunder_ganesh,False,negative,negative,negative,negative
d57qt2n,One word: [Jugaad](https://www.google.com/webhp?sourceid=chrome-instant&rlz=1C1LENP_enUS503US503&ion=1&espv=2&ie=UTF-8#q=Jugaad),1,0,1468237340.0,User_Name13,False,neutral,neutral,neutral,neutral
datb7ps,Great example of survivor bias. You can't compare the best of the past with the worst of the present.,1,0,1480950287.0,arjunk97_xdd,False,negative,negative,positive,negative
dbgmumq,So very Pakistan.,1,0,1482324187.0,mjaKiani,False,negative,neutral,positive,neutral
dbs23wq,This post suddenly has all the more reason to trend these days...,1,0,1483062487.0,ready_redditor,False,neutral,neutral,negative,neutral
d56x7ng,Wow this just exploded. My message box is exploding too. It seems this is trending in r/all. Thanks for the up votes guys.,-5,0,1468176493.0,hd-86,False,positive,positive,neutral,positive
d56q7i6,How is this a non-political post as the flair indicates?,1,0,1468165196.0,tiorzol,False,neutral,neutral,negative,neutral
d572on6,Acid rain man...,0,0,1468184996.0,,False,negative,neutral,neutral,neutral
d56zv5i,I haven't seen a positive thing about India on the internet in at least a year ,-7,0,1468180593.0,Tabnam,False,negative,negative,negative,negative
d56mths,"Shivaji had his stuff built by his royal workers. He exercised control over them and thus ensured best quality of work.

Today the work is given to the private contractor who bids the lowest. No wonder shit breaks so quickly.

This is why capitalism is a failed system and socialism rules.",-15,0,1468158421.0,testastretta2,False,neutral,negative,neutral,neutral
d56qhyr,[removed],-18,0,1468165703.0,,False,neutral,neutral,negative,neutral
d56qwib,I feel like people are not allowed to actually go up the ancient steps in order to preserve them. They would most likely be trampled and eroded in the same way as the modern steps when hundreds of thousands of worshipers come to visit.,-5,0,1468166385.0,binthewin,False,negative,negative,negative,negative
d56plvd,"Gee, it's almost as if they're made from different materials that age differently.

The idiots that built this should have known that tile and concrete construction wouldn't have lasted in a wet environment. That's hardly a tragedy. Juxtaposing it next to solid stones and calling it ""tragedy"" is just ridiculous",-10,0,1468164121.0,massif_gains,False,negative,negative,negative,negative
d577z9h,In my head all these comments are being spoken to me by Apu. ,-8,0,1468193449.0,yum_raw_carrots,False,neutral,neutral,neutral,neutral
d571i98,I don't understand,-1,0,1468183142.0,Ikeepforgetmypasswor,False,negative,negative,negative,negative
d56z94t,Which one is being used more frequently? One is probably a heritage site with 10-20k visitors a year. The other one probably has a thousand per day. Unfair comparison.,-2,0,1468179660.0,,False,neutral,neutral,neutral,neutral
d56yiu1,[removed],-5,0,1468178565.0,,1474257787.0,neutral,neutral,negative,neutral
d56xgix,[removed],-4,0,1468176885.0,,False,neutral,neutral,negative,neutral
d56t3y9,Sorry for that ,552,1,1468169983.0,Shivaji_Maharaj,False,negative,negative,negative,negative
d57k8k3,"If you look closely you can actually see the three steps that were already built in stone. It became so bad that the now government thought it necessary to cover it with tiles. Op, needs to get his shit straight.",4,1,1468216335.0,the_quiescent_whiner,False,negative,negative,negative,negative
d56quko,brilliant,16,1,1468166294.0,,False,positive,positive,positive,positive
d56ugu0,"Yes, he was the best Mason in all the land",3,1,1468172115.0,993300,False,positive,positive,positive,positive
d56yojo,of if he had been reincarnated a few dozen times? ,1,1,1468178801.0,10gags,False,neutral,neutral,neutral,neutral
d572s0j,Looks like 3 extra steps were built but then later tiled over. ,1,1,1468185144.0,dainternets,False,neutral,neutral,neutral,neutral
d7zjowv,"Hahahaha, excellent!",1,1,1474673823.0,ThatFag,False,positive,positive,positive,positive
d56t65i,">I'm guessing Shivaji didn't hand out the contracts for building his forts to ~~the lowest bidder.~~ a subordinate's chachaji's son who charges 100 rupees for the job and siphons off 90 to himself, chachaji and the subordinate in 30-30-30 ratio. 

FTFY",77,1,1468170078.0,og_m4,False,neutral,neutral,positive,neutral
d56muqz,"Do you really believe in lowest bidder thing? some of the government projects ballpark are more than three times of normal private company.

",181,1,1468158503.0,hd-86,False,negative,neutral,neutral,neutral
d56n568,Lowest bidder would be a step in the right direction. The contract goes to the guy who give him the most kickbacks...,20,1,1468159156.0,,False,neutral,neutral,neutral,neutral
d56xrxh,"My cousin gets all my contracts for around the lowest price!

The real money is in work order changes anyways!",2,1,1468177380.0,Decyde,False,positive,neutral,positive,positive
d56ov6m,Tender is better than the construction mafia taking over with even shittyest level of quality ,1,1,1468162727.0,,False,negative,negative,negative,negative
d573hc4,Low cast slaves work better than government contractors.,0,1,1468186162.0,DRLavigne,False,neutral,positive,negative,neutral
d56vzlp,Wonder what made this post go so high? It's hitting /r/all. ,63,1,1468174552.0,Dylanjosh,False,neutral,neutral,neutral,neutral
d578pa3,It's more than 5000 now.,2,1,1468194726.0,hd-86,False,neutral,neutral,positive,neutral
dap5f2b,"Bogus films
",1,1,1480689872.0,bakeandjake,False,neutral,negative,negative,negative
d57jo4q,More than 5k now. ,0,1,1468214984.0,prince147,False,neutral,neutral,positive,neutral
d57gf97,"Don't forget the water to cement ratio. Over watering cement will create a very weak mix. 

You are looking fire around 40% water to cement by weight and 1:4 or 1:5 cement:sand.",6,1,1468208278.0,oxblood87,False,neutral,neutral,neutral,neutral
d5799hi,Cool video,6,1,1468195726.0,this12344,False,positive,positive,positive,positive
d578zg7,What is wrong with his camera? It is making my eyes hurt.,0,1,1468195229.0,DubstepLies,False,negative,negative,negative,negative
d56xt1p,[deleted],-7,1,1468177432.0,,False,neutral,neutral,negative,neutral
d575n73,Built for cost versus built for quality. It can be especially glaring when shoddy repair work is done over good craftsmanship. Especially some temples where broken detailed stonework gets fixed with some rough plasterwork.,5,1,1468189488.0,Ifriendzonecats,False,negative,negative,neutral,negative
d56nhwt,Selection bias. The ancient remnants which we're able to see today are those which were extremely well built. Stairs we build today might or might not be well built. ,314,1,1468159925.0,v0lta_7,False,neutral,neutral,neutral,neutral
d56q82a,"You guys just don't get it. This is not corruption, this is an economic master-stroke.

Do you realize how many jobs are being created for repairing and maintaining broken infrastructure? There is a multi-billion dollar industry for repairing stairs, it is creating thousands of jobs, boosting our GDP and stimulating our economy.

If Shiva Ji understood this, he would have created stairs which requires regular repairs.",13,1,1468165224.0,Hindu-Nationalist,False,neutral,positive,negative,neutral
d56wv3w,"Notice this in western NY.  Every time they repave the roads they seem to wear out faster.  Must be great money in repaving, for both the companies that do it and the politicians that authorize it.",4,1,1468175945.0,JBlitzen,False,neutral,neutral,neutral,neutral
d56s5em,"I get the over all idea, and I don't deny that corruption in public building project isn't endemic but...but the materials and techniques used in ancient periods would be ruinous in our times. Stone cut structures, all granite buildings etc etc would take forever to build and cost a fucking fortune. ",-1,1,1468168487.0,,False,negative,negative,negative,negative
d56re9f,"It's not much cluelessness as much as ""we don't give a shit. The stairs are done as per the contract""",87,1,1468167211.0,svmk1987,False,negative,negative,neutral,negative
d56ta91,"The thing is, Indians have forgotten the art of even the most basic levels of proper construction work, or what materials to use for them.

You would be lucky if the government manages to build a small concrete hovel that even looks like a hovel, let alone anything more than that. Clueless, illiterate smelly-arse Netas and babus decide and build everything here.",2,1,1468170257.0,,False,negative,negative,negative,negative
d56sik6,"It is still corruption, in that, the contracts are given to the lowest bidder, lowest fora reason, not knowing that edges need to be rounded. The good contractors would know to round those corners.",5,1,1468169068.0,gologologolo,False,negative,negative,negative,negative
d56tvqa,Nice observation. ,1,1,1468171201.0,,False,positive,positive,positive,positive
d570adf,Yea but the top stairs edges are not rounded.,1,1,1468181223.0,gordianus1,False,neutral,neutral,neutral,neutral
d570jwp,[deleted],1,1,1468181627.0,,False,neutral,neutral,negative,neutral
d56u6hg,"I dont think you know what you are talking about. The edges of the stairs CAN and have been built to be of sharp edges, as shown in the  [top part of the picture here](http://i.imgur.com/sgzTMyR.jpg) ",0,1,1468171670.0,princessvaginaalpha,False,neutral,neutral,neutral,neutral
d56oibl,"Pollution? noooo
Western media is brainwashing, our ex-MOEF minister Javedkar says that...",6,1,1468162016.0,Raghavcm,False,negative,negative,negative,negative
d56wq24,"Why should the Indians care what some stupid fucker says? 

^^^/s",9,1,1468175721.0,-kljasd-,False,negative,negative,negative,negative
d56ohll,"yabsolutely! The population in 1656 was ~500 million, now the population is 7+ billion. Assuming everyone has/had 1 asshole on average, the assholes today outnumbers  the assholes of 1656 by 14 to 1.",71,1,1468161976.0,Idonthavearedditname,False,negative,negative,negative,negative
d57gtuc,"There is a very nice paper out there that outlines their mix and methodology. 

We couldn't figure it out and had to rely on dumb luck to find it written down. 

They made a very water lean mix which allows for a high strength. They made this with just active lime and volcanic pozzolan. Then they pounded it into forms around rock for filler. Time consuming but very effective. 

Today we just use random native rock and sand with Portland cement and maybe some fly ash etc. We go to 40 w/c ratio which is probably more water the they used, but allows the concrete to flow and slump without pounding it into place. We do all this because we can build many more things much faster with much less labour. 

Edit: http://www.romanconcrete.com/docs/spillway/spillway.htm not the original but it's a start. ",3,1,1468209031.0,oxblood87,False,positive,positive,positive,positive
d56xcsm,That's actually super interesting ,1,1,1468176719.0,darther_mauler,False,positive,positive,positive,positive
d578s7q,Yeah my phone is blasting because of r/all,7,1,1468194869.0,hd-86,False,neutral,positive,neutral,neutral
d56xrqv,ok  but where is Indina?,3,1,1468177373.0,itspaulryan,False,neutral,neutral,neutral,neutral
d57b4yo,"[okay, here it is](http://www.mapsofworld.com/india/maps/india-map.gif)",1,1,1468199011.0,klesmez,False,neutral,neutral,neutral,neutral
d56v997,"Probably a little of both. That said, there's also the fact that modern society relies on ""quick"" processes to build things instead of going to an insanely expensive craftsmen/house and asking them to take close to a lifetime for a few big projects. Add corruption to the mix, and the already limited lifetime of ""quick"" gets even shorter. ",11,1,1468173364.0,SOL-Cantus,False,negative,negative,neutral,negative
d571ouo,Let's not forget that one set probably has a few hundred people walk on it a day. The other would probably have *thousands.* Wear and tear is a real thing. ,0,1,1468183432.0,,False,neutral,neutral,neutral,neutral
d56u9pb,[removed],-6,1,1468171809.0,,False,neutral,neutral,negative,neutral
d56oar4,Yes. That's why I am glad these people are restricted from using those upper steps.,25,1,1468161591.0,spikyraccoon,False,neutral,neutral,positive,neutral
d57lo2d,Bhai survivor bias post hai. Politics mat ghusao.,6,1,1468220064.0,,False,negative,neutral,negative,negative
d572of8,"Whatsapp, Facebook....its fucking everywhere now. Kal paper mein bhi a jayega bc. Mumbai mirror. Dekh le",0,1,1468184986.0,NotherLevel,False,negative,negative,negative,negative
d5704um,Yeah. But i think that's just because the media only publicize the negative or wierd stuff. India is progressing fast. At least my city is,9,1,1468180995.0,Divc09,False,neutral,neutral,positive,neutral
d5761lq,Any news out of ISRO is pretty positive. ,3,1,1468190136.0,Radius86,False,positive,positive,positive,positive
d572u6f,what about the world's first solar powered airport (cochin airport) being in india? ,3,1,1468185240.0,wankelgnome,False,neutral,neutral,neutral,neutral
d572jtg,>Positive ,2,1,1468184782.0,,False,neutral,positive,positive,positive
d5716uk,[deleted],-1,1,1468182648.0,,1468185973.0,neutral,neutral,negative,neutral
d56njlp,"You mean monarchy, not socialism",11,1,1468160026.0,,False,neutral,neutral,negative,neutral
d56mxfv,"I have already told its peoples assumption that most contracts are lower valued. sometimes government projects are 3x than if private company would have built. 

it just happens to be 20 or 30% goes to officers and party chanda.",3,1,1468158668.0,hd-86,False,negative,neutral,neutral,neutral
d56q1gr,"At best, you weakened the case for capitalism. You still did not prove that socialism would have produced better results. In this case, a better set of steps.",1,1,1468164901.0,nomnommish,False,negative,negative,neutral,negative
d56rg6g,"Contracts can be framed with minimum requirements of quality and durability, and enforced strictly. That's how other capitalist countries have good infra built by private contractors. ",1,1,1468167303.0,svmk1987,False,neutral,positive,neutral,neutral
d56xlbl,"Capitalism is individualistic , it always pertains to a person's selfish ideology rather than how it affects society as a whole.",0,1,1468177092.0,GoldPisseR,False,negative,neutral,negative,negative
d56rslg,needs more guns and a bunch of school kids,13,1,1468167893.0,Obi_Wanka_noobie,False,negative,negative,neutral,negative
d56rgzb,"Definitely agree, I mean, what's with the white line through the middle of the picture? Obviously it's meant to stop people walking up the stairs right?",9,1,1468167340.0,OstensiblyOriginal,False,neutral,neutral,neutral,neutral
