Comment ID,Comment Text,Comment Score,Comment Depth,Created Timestamp,Author,Edited,Semantic Label,Semantic Label 2,Semantic Label 3,Major_Semantic
d570s1u,It's the same site and set of stairs. The new bit is a small extension.,8,1,1468181985.0,isnotmad,False,neutral,neutral,neutral,neutral
d56z72j,[removed],1,1,1468179574.0,,False,neutral,neutral,negative,neutral
d56yi5l,"This comment has been overwritten by an open source script to protect this user&apos;s privacy.  It was created to help protect users from doxing, stalking, harassment, and profiling for the purposes of censorship. 

   If you would also like to protect yourself, add the Chrome extension [TamperMonkey](https://chrome.google.com/webstore/detail/tampermonkey/dhdgffkkebhmkfjojejmpbldmpobfkfo), or the Firefox extension [GreaseMonkey](https://addons.mozilla.org/en-us/firefox/addon/greasemonkey/) and add [this open source script](https://greasyfork.org/en/scripts/10380-reddit-overwrite).   

 Then simply click on your username on Reddit, go to the comments tab, scroll down as far as possible (hint:use [RES](http://www.redditenhancementsuite.com/)), and hit the new OVERWRITE button at the top.",4,1,1468178536.0,Sol-_-lLonely,1471087237.0,neutral,neutral,negative,neutral
d56ujk1,"Account was just created, this guy is a phony",597,2,1468172236.0,SoberFuck,False,negative,negative,negative,negative
d56ubow,[deleted],9,2,1468171894.0,,1476127577.0,neutral,neutral,negative,neutral
d56u1fl,"It's ok, dude. Just don't forget this in your next incarnation, ok?",0,2,1468171451.0,BornAndRaisedInIndia,False,positive,neutral,neutral,neutral
d56nf9t,"I wasn't being serious, the lowest bidder thing is a joke at how governments function now. eg Alan Shepard (the US astronaut) had a famous quote: ""It's a very sobering feeling to be up in space and realize that one's safety factor was determined by the lowest bidder on a government contract.""

In places like India, the common belief is they go out to companies with the right connections. There is a well thought out process behind both sets of steps- one set was build by a man who was in a war and needed fortifications that would need minimal amount of repair and maintenance, the other by a contractor who needs to give out contracts 2 years to his cousin's wife's company. ",256,2,1468159770.0,ironmenon,False,negative,neutral,neutral,neutral
d56njcd,"No tender is clean. It's often created, mapped, prepared and executed by the company and middleman willing to shell out the most to the bureaucrats and politicians. As simple. 

A sample process: 

1. Minister comes into power and cracks knuckles with closest aides. 
1. Consultants go around identifying companies who can reciprocate favours while possessing the ability to act as if something spectacular is happening.
1. Either the central idea of what the new project has to be is already present (based on a central/state govt commitment) or a new project proposed by said company and consultant will be approved by ministers in charge. 
1. By now, you understand that it is already pre-decided who is going to win the project and who is going to get paid for it.
1. Govt might assign the project management to one of other organisations like ECIL, BEL, NIC for eg.
1. Company allocates resources for working with govt officials or project officials (in case of consulting orgs) making technical and commercial specifications in-line with their own credentials. 
1. Companies lock in the project with manufacturers/OEMs/distributors to avail best prices automatically disqualifying the other companies on a purely commercial basis. The other companies only stand a chance now if their services components are very low and/or they don't add decent margins to the product sale. 
1. Based on the org and commercial size, it's either an open or a closed tender. The release of the RFP, tender and paper ads are managed by the company so as to attract the least number of eyes. 
1. Tender process comes into play - Product + % Margin (Topline), 2-4% for distributors, extremely overpriced services component (bottomline) + 15-20% cut for others involved + Taxes. To the govt that's already anywhere between 40 to 50% above market costs plus a mandatory 3-5% for the consulting organisations. 
1. Company gets favoured bureaucrats on executive committee by flexing financial muscle.
1. Company gets other prospectives disqualified either on compliance/price/qualification criteria. 
1. Company wins contract. Takes 50-90% of the payment as advance, in accordance with the tender they helped create.
1. Company goes back to manufacturers and arm-twists them into giving better price since they now have the PO in hand. 
1. Company doles out payouts. Ministers, middlemen and bureaucrats are now out of the picture.  
1. Company does whatever the fuck they want - under-deliver in quality, delay the project indefinitely, absolutely fucking whatever. 
1. Company parts with an extra 1-2% to random guys from consulting orgs for acceptance tests, finance processing, etc.
1. All iz well. 


If the company actually finishes the work with quality and timelines in mind, with just a 50% additional cost, that's your absolute best case scenario. Things have gone and often still go WAY HIGHER.",57,2,1468160009.0,kabuliwallah,1468160287.0,neutral,neutral,negative,neutral
d56xg7m,"> Do you really believe in lowest bidder thing? some of the government projects ballpark are more than three times of normal private company.

I do believe in lowest-bidder, but that's because I've seen how procurement works.

Due to past abuses and legislation, government entity sets rules for how procurement works.  These rules are usually an attempt to reduce abuse, and are reactionary to previous abuse.  These rules may cover things like ability to deliver in a timely fashion, materials quality or consistency, ability to follow licensing rules or insurance bonding, workplace safety, fair wage standards for employees (often called prevailing wage), and other things.  Sometimes depending on the nature of the work or the goods, other rules will also be added.  Once the rules are written (often called a Request For Quote (RFQ) or Request For Proposal (RFP)) then companies are publicly invited to submit proposals to be the chosen vendor, often the exclusive vendor, for whatever time period is described in the solicitation.

Companies will evaluate the solicitation and determine if they meet it, or could meet it, or if they want to try to meet it even if they really don't know if they can or not.  Companies then send in the submissions, which are reviewed by the purchasing agents for the government entity.  Those purchasing agents sometimes have the authority to make the decision even if they're not personally knowledgeable about the business at-hand, other times they'll consult with the agency that is responsible for it, and in yet other cases the agency will decide, and the purchasing agent merely signs-off on the deal.

Now, the tricky part is if the RFQ/RFP was really written right or not, if the evaluation of the submission was done right and caught any deficiencies, and if the government as the buyer enforces the terms of the agreement when deficiencies are discovered.

If a particular vendor doesn't really know what they're doing but somehow manages to put together a submission that looks good on paper and undercuts everyone else then they may be chosen, after all, why would the purchasing agent spend more for the same result?  Trouble is since people often want to think the best of others they are not suitably skeptical, they do not reject proposals that are nonviable, and the company awarded the job ends up with some problem attempting to fulfill it.  That problem could be an inability to deliver on-time, an inability to meet a volume-count, an inability to maintain quality in the work, etc.

I've personally had to deal with this, I've inspected contractor work and rejected it enough that at times I'm known as the East German Judge.  If I find something that doesn't match our standards disclosed at the start I'm not going to pass it, and honestly I don't care if the vendor loses money by having to pay their employees to redo the work.  As far as I'm concerned it's the company's job to hire one good PM that actually would talk to me at the outset to confirm the standard to which the work is expected and would want to check the work as the project proceeds to stop problems while they're small.  It's not my responsibility to structure their company.

Based on what I've found it's clear that some vendors in the past were allowed to do bad work.  As far as I'm concerned that's not acceptable now, I don't care if the whole building is messed up, the new work will be done right even if it's the only work done right.

So looking at this stair job, it's likely that the government picked the wrong materials or trusted the vendor to pick the materials, and has failed to enforce any sort of warranty on the work.  The vendor's bond should be pulled and the job given to someone else to fix it or replace it outright.  Given how it doesn't match the character of what's already there, rip it out and start over with something that looks like it belongs.",11,2,1468176869.0,Donkey__Xote,False,neutral,neutral,neutral,neutral
d56wtl4,"Here in Sweden the government works with ""offentlig upphandling"" which translates to public procurement. So if a public function is getting built, hospital, a bridge or a library, that kind of stuff this is what happens. First the local authorities do the drawings, stipulate quality checks, schedule expected maintenance and all the rest of it. They then have a plan for the project including all these documents, probably around 1000 pages. This plan is then offered publicly for any company that wants to have a go. This plan is circulated among construction companies and the one who offers the lowest bid, wins the contract. Because it's funded with taxpayers money, all of these documents and transactions are publicly available though usually it's just the newspapers skimming through them and writing a piece if they find anything suspicious. ",14,2,1468175877.0,HonzaSchmonza,False,neutral,neutral,neutral,neutral
d57h8dl,I didn't know that. Wouldn't have guessed three times.,1,2,1468209802.0,piezod,False,neutral,neutral,neutral,neutral
d57i4tl,You have almost no context on this issue at all.,1,2,1468211604.0,furtivepigmyso,False,negative,negative,neutral,negative
d56xgku,It's relatable to a wide audience. Most can relate to governments using cheapest labor for shotty infrastructure.,97,2,1468176888.0,treycartier91,False,neutral,neutral,neutral,neutral
d56wc1j,[deleted],43,2,1468175105.0,,1620834236.0,neutral,neutral,negative,neutral
d57fv8b,Reddit changed the algorithm for what goes to the /r/all ,4,2,1468207268.0,belltoller,False,neutral,neutral,neutral,neutral
d56x4td,One step at a time.,5,2,1468176371.0,d_smogh,False,positive,positive,neutral,positive
d57tpug,"> It's hitting /r/all.

What ranking would get a post the /r/all tag?",2,2,1468243950.0,oh-just-another-guy,False,neutral,neutral,neutral,neutral
d572odv,We get to point and laugh at incompetent government officials *and* the entire country of India all in one go. ,0,2,1468184985.0,,False,negative,negative,negative,negative
d57198p,Maybe it was bestof'd.,0,2,1468182751.0,,False,neutral,neutral,neutral,neutral
d57482m,For sure Reddit has some sort of  algorithm that bumps submissions to r/all if they're getting a lot of attention.  ,0,2,1468187240.0,factbasedorGTFO,False,neutral,neutral,negative,neutral
d579q3h,"Looks like hes using a high fov and a different projection method.

Here are some examples so you can see what that means.

https://github.com/shaunlebron/blinky

https://www.youtube.com/watch?v=jQOJ3yCK8pI",3,2,1468196535.0,ExperimentalDJ,False,neutral,neutral,neutral,neutral
d57870l,... wat?,2,2,1468193826.0,Jaz_the_Nagai,False,neutral,neutral,neutral,neutral
d56owcb,I'd like to think the best in 1656 is easily reproduced nearly 500 years later. ,99,2,1468162791.0,raptorraptor,False,neutral,positive,positive,positive
d56nzjl,"> Stairs we build today might or might not be well built.

With current technology, infrastructure, GDP, investments, distribution and growth rate.. That's exactly what's Tragic.",112,2,1468160953.0,spikyraccoon,False,negative,negative,neutral,negative
d56phiq,Survivor bias to be exact.,15,2,1468163899.0,KarlKastor,False,negative,negative,negative,negative
d56sy8i,[deleted],5,2,1468169742.0,,False,neutral,neutral,negative,neutral
d56zfa8,"Good thing we have all these incredibly old structures that held up to show us how to make better stairs.

hmm",2,2,1468179925.0,Katnipz,False,positive,positive,neutral,positive
d56x9qa,"How does one ""well built"" stairs?
   
I'm no contractor or architect but what does the original steps have that these new ones lack?",1,2,1468176583.0,kingssman,False,neutral,neutral,neutral,neutral
d56nnn3,[removed],0,2,1468160268.0,,1551907073.0,neutral,neutral,negative,neutral
d57l7nv,"> Do you realize how many jobs are being created for repairing and maintaining broken infrastructure? There is a multi-billion dollar industry for repairing stairs, it is creating thousands of jobs, boosting our GDP and stimulating our economy.

This is just causing inflation.
 
Jobs and money in the hands of people- Yes.

Goods delivered which can create or contribute to revenue- No

Money supply increases, goods doesn't. 

It's like paying people to dig a pit and fill it up again. Sure, jobs, employment, stimulus etc. But, huge inflation. ",2,2,1468218820.0,EJERommel,False,neutral,neutral,negative,neutral
d56w0ns,Please add `/s`. ,-3,2,1468174599.0,ThisIs_MyName,False,neutral,neutral,neutral,neutral
d5718lm,"[Also its been made from paver blocks](http://betontiles.com/images/paving-tiles-images/floor%20tiles/zigzagpaver.jpg), which (if anyone has been to the west coast of India) is infamous for being completely ineffective in [withstanding rains](http://www.mid-day.com/articles/why-bmc-should-avoid-using-paver-blocks-on-mumbai-roads/239758) which the West coast sees a lot of. But [they're learning](http://www.mid-day.com/articles/mumbai-after-saying-no-new-paver-blocks-bmc-to-uproot-old-ones-too/17405171) that paver blocks suck very slowly.     
These guys literally took 15 years to learn something 20 million people had been saying since day 1: paver blocks suck. Using them as staircases suck, especially when quality of construction is as it is poor, a lot of people walk on them and it rains a lot.    
",10,2,1468182723.0,,False,negative,neutral,negative,negative
d570ogt,"The problem is an overall lack of education in the country imo. The engineer in charge of the project simply doesn't know how to do it. It isn't corruption as much as it's incompetency and it's pervasive in every single industry in India, from software to engineering to management.",11,2,1468181824.0,WagwanKenobi,False,negative,negative,negative,negative
d56vrbd,"> The thing is, Indians have forgotten the art

FTFY

That was just enough ;)",-4,2,1468174176.0,,False,neutral,neutral,neutral,neutral
d56sqk1,Lowest bidder isn't corruption.  Corruption is your wife's brother starting his own stair making company as soon as this contract comes up and you making sure he gets the contract.,24,2,1468169420.0,,False,negative,negative,neutral,negative
d570i7h,They don't have to be rounded. They are rocks. ,3,2,1468181554.0,Adhvaga,False,neutral,positive,positive,positive
d570q8n,The 1600's steps are built in rocks and they're handling so well because they are rocks and not cement and tiles. ,3,2,1468181903.0,Adhvaga,False,positive,positive,positive,positive
d56usaz,"The top part was built in rocks. Now we use bricks, cement and tiles which are a lot more brittle. ",6,2,1468172624.0,Adhvaga,False,neutral,neutral,neutral,neutral
d570mpw,"OP knows what he is talking about. Tiling with sharp edges or without proper trimmings is not only bad workmanship, but won't even pass building regulations in many countries.

Stone are different, they are a solid monolith. ",1,2,1468181749.0,isnotmad,False,negative,negative,neutral,negative
d56s7tc,Where did he say that?,11,2,1468168594.0,,False,neutral,neutral,neutral,neutral
d56pjdg,/r/theydidthemath,26,2,1468163995.0,redweddingsareawesom,False,neutral,neutral,neutral,neutral
d56tc81,"The actual population of India at the end of Emperor Shah Jahan's reign was around 150 million though. That said I get what you are saying.

EDIT: Lol, why are randians always so salty and hostile?",-2,2,1468170346.0,,1468232868.0,neutral,neutral,negative,neutral
d56yib0,[deleted],-5,2,1468178543.0,,False,neutral,neutral,negative,neutral
d578trg,haha woh meeti meeti karma enjoy kar,5,2,1468194946.0,VerifiedMod,False,positive,positive,positive,positive
d56ybj1,"20.5937° N, 78.9629° E",1,2,1468178263.0,,1468178879.0,neutral,neutral,neutral,neutral
d57gbaq,What about the wear and tear of 350 extra years?,1,2,1468208074.0,oxblood87,False,neutral,neutral,negative,neutral
d56ue8s,Hi /r/all,8,2,1468172004.0,,False,neutral,neutral,neutral,neutral
d56zky6,This is /r/india lmao,3,2,1468180171.0,RastaSauce,False,neutral,neutral,negative,neutral
d570b1f,"You're in the wrong sub, mate. ",2,2,1468181250.0,a_random_individual,False,negative,negative,negative,negative
d56sr7i,They don't get that far.,18,2,1468169447.0,mrkugelblitz,False,negative,neutral,neutral,neutral
d5850pq,"> survivor bias

It could be; however, so often Modern India has suffered from shoddy infrastructure due to corruption that this posting is representative, even though it may not be accurate.

Btw, as suspected, it was [Congress government in 2013](https://en.wikipedia.org/wiki/List_of_Chief_Ministers_of_Maharashtra) and they really messed things up in India.",3,2,1468260064.0,pchampn,False,negative,negative,negative,negative
d572yw9,Wow why so much hate bro?,2,2,1468185434.0,hd-86,False,negative,negative,negative,negative
d570icm,"Really? All my Indian friends say the opposite. The consensus seems to be there was a lot of growth and potential ten years ago, but bad decisions and corruption squandered what chance there was of India becoming a major economic power. ",-4,2,1468181560.0,Tabnam,False,negative,negative,negative,negative
d5777rx,"Western liberals will at least look at and try to understand how racism influences the western image of India, conservatives will just use India as a scapegoat. ""Liberals think sexism in America is bad?  They should see how they treat women in India "" etc ",6,2,1468192111.0,Kraken_Greyjoy,False,negative,negative,negative,negative
d56no2i,The two arent mutually exclusive.,-8,2,1468160296.0,testastretta2,False,neutral,neutral,neutral,neutral
d56rwfi,"MURICA, FUCK YEAH",-12,2,1468168073.0,Knight-of-Black,False,negative,positive,negative,negative
d56ze4z,[removed],1,2,1468179877.0,,1474257783.0,neutral,neutral,negative,neutral
d5745iu,"You jump to the assumption I'm from the US.  That doesn't negate India's rape culture and, honestly, unless you're implying that I am a rapist, I fail to see how your point even matters.",-8,2,1468187132.0,Zooshooter,1468187593.0,negative,negative,negative,negative
d56usm3,[OP!](http://m.imgur.com/56UOncW?r),97,3,1468172637.0,FecesInYourFaces,False,neutral,neutral,neutral,neutral
d56zblp,"OP 

http://youtu.be/2YYNPnql9YI",30,3,1468179767.0,,False,neutral,neutral,neutral,neutral
d57dneg,3 hours before this post though!,12,3,1468203392.0,Romo_is_GOAT,False,neutral,neutral,neutral,neutral
d56uwjz,What a stupid!,6,3,1468172808.0,poopellar,False,negative,negative,negative,negative
d5718gi,Good to see that reddit is again thriving with its wit. Keep it going. We need more Tenali Raman and Birbals.,8,3,1468182718.0,Kulcha_diva,False,positive,positive,positive,positive
d56wuiy,"I mean if it was just created, that's too much for some karma that won't even be added to your primary account. Gotta applaud him lol. And I don't even get off my couch to turn the AC on...",5,3,1468175919.0,Gordon_ramaswamy,False,negative,neutral,neutral,neutral
d57ga2h,"Wait. But right now the original comment is 14 hours old, the reply 10 hours old, but the account is 18 hours old according to the Reddit app. What's up with that?",1,3,1468208010.0,,False,neutral,neutral,negative,neutral
d56wlus,Nope. I'm gonna stay. I didn't create my account just for this comment. ,-19,3,1468175535.0,Shivaji_Maharaj,False,negative,neutral,neutral,neutral
d56yrjf,I don't think anybody (mis)took him for the real one.,-1,3,1468178926.0,shadilal_gharjode,False,negative,neutral,negative,negative
d572nwx,I'm taking back my upvote. ,0,3,1468184965.0,,False,neutral,neutral,neutral,neutral
d573kcr,so what,0,3,1468186294.0,,False,neutral,neutral,neutral,neutral
d56zoju,Shiv Sena sux,7,3,1468180321.0,Shivaji_Maharaj,False,negative,negative,positive,negative
d57by1l,"Doesn't matter if it goes to the lowest bidder. The lowest and the highest bidder all have to conform to the specs they are bidding on. So ultimately the responsibility comes down to the engineers, who have to approve the items being used in a project.
 
I work in the HVAC industry and am heavily involved in the tendering process. The job always goes to the lowest bidder, that is the law. But it is upto me to make sure the project is carried out as  per drawings, or I withhold the payments until they do. I understand things in India may work differently, but I am just commenting on the astronauts quotation. I am certain NASA engineers would scrutinize the hell out of their contractors. ",24,3,1468200428.0,immsk,False,neutral,neutral,neutral,neutral
d572iad,"> In places like India, the common belief is they go out to companies with the right connections. 

This applies to any country anywhere. If you think Western countries are any different, you're just deluding yourself. The main difference is how hard it is to circumvent basic quality and safety standards.",35,3,1468184715.0,,False,neutral,neutral,negative,neutral
d57kpy8,">In places like India, the common belief is they go out to companies with the right connections. 

In most large economies, heck, in most economies outside of a few European ones, this is how it operates.

[KBR got more contracts in Iraq than maybe all Indian cronies combined ever](http://www.ibtimes.com/winner-most-iraq-war-contracts-kbr-395-billion-decade-1135905), KBR is as crony as it gets.",3,3,1468217542.0,,False,neutral,neutral,negative,neutral
d56x4q9,Work like these are done by the lowest bidding PWD contractor and not multi-national companies.,-1,3,1468176367.0,osanam,False,negative,neutral,neutral,neutral
d575slw,Kind of a stupid thought. It's the lowest bidder among all who can meet all of the safety standards and requirements they require. They aren't necessarily going to get more safety out of spending more if they do not force the company to comply with higher standards. The government shouldn't be suckered in by goldilocks pricing.,0,3,1468189730.0,sethboy66,False,negative,negative,neutral,negative
d56nyjf,OR You create special committee of companies called preferred vendors and give them projects without any procedures. this has happened and as i write is currently happening in almost all departments of state governments.,22,3,1468160895.0,hd-86,False,neutral,neutral,neutral,neutral
d57a4yi,I wonder if this also applies to Middle Eastern countries. ,1,3,1468197245.0,frmango1,False,neutral,neutral,neutral,neutral
d56og5x,">  

All these people who own flats in powai, bandra, BKC, SANTRACRUZ... real 420 GUYS",1,3,1468161897.0,Raghavcm,False,neutral,neutral,neutral,neutral
d57be46,take a UP vote dear sir ,1,3,1468199469.0,mabie,False,neutral,neutral,negative,neutral
d57938i,"First real post on Reddit I've seen today.
Surprised it's not downvoted.  Kids on reddit usually downvote truths because it doesn't align with their visions of utopia.
",0,3,1468195417.0,CANT_ARGUE_DAT_LOGIC,False,negative,neutral,neutral,neutral
d5774nk,"great writeup.  I'm in engineering for a public agency (irrigation) and I've been really learning a ton recently about public procurement -- in fact just went through the bid opening of an RFQ not too long ago.   I love your talk about inspecting contractor work and denying substandard work.  The inspector where I work that's been there for a good awhile now has a reputation for his attention to detail and willingness to turn things away if they don't meet our clearly stated requirements.  The contractors don't mess with him.  On a recent project he turned away multiple concrete trucks that didn't meet requirements. 

 Apparently before he was here there was a distinct ""old boys club"" culture in the company and in it's relationship with certain contractors.  People with close ties to those on the board of directors or other management would get preferential treatment and do substandard work.  Continually to this day we have to deal with maintenance and other quality issues due to those oversights decades ago.  

I'm still fairly new to all of this public agency laws/regulations stuff, but it's been a very enlightening experience so far. 

",1,3,1468191960.0,MechanicalEnginuity,False,positive,positive,positive,positive
d576cj0,"That will NEVER happen in india. How do you think even the lowest politician is able to drive an SUV and own property.
",6,3,1468190639.0,freedomIndia,False,negative,negative,negative,negative
d57l1d2,"How do you ensure, that people with malafide intentions, don't stumble upon these plans, and then use it to perpetrate horrendous acts? 

For example, if these plans are publicly circulated, then any random asshole thinking of blowing up a bridge will have all the information he needs about the weak points etc, making his job that much easier? 
",2,3,1468218360.0,EJERommel,False,negative,negative,negative,negative
