Comment ID,Comment Text,Comment Score,Comment Depth,Created Timestamp,Author,Edited,Semantic Label,Semantic Label 2,Semantic Label 3,Major_Semantic
e0fkc17,Post this in r/pewdiepiesubmissions ,1,0,1528639374.0,Garrick17,False,neutral,neutral,neutral,neutral
e0fkg1w,"Ekta Kapoor: 1
Spider-Man: 0",1,0,1528639519.0,cacheifyouCan,False,neutral,neutral,neutral,neutral
e0fkix0,Redefining Newton's law of gravity.,1,0,1528639622.0,Blenderpride,False,neutral,neutral,neutral,neutral
e0fkjk7,This looks more like a YouTube poop,1,0,1528639645.0,salamandan,False,negative,negative,neutral,negative
e0fkjx7,GRAVITY MACHINE 🅱️ROKE,1,0,1528639659.0,thiccc_commie,False,neutral,neutral,neutral,neutral
e0fkp3v,I feel like most movies or shows I see come out of India have this weird inability to grasp how much time should pass between things.,1,0,1528639845.0,PHD_Memer,False,negative,negative,negative,negative
e0fkwl6,There’s no way they’re really like this 😂 that was incredible ,1,0,1528640108.0,xnce,False,positive,positive,positive,positive
e0fkwt3,"I am Barry Allen, the fastest man alive. I was busy with family, that's when I opened my world to new possibilities. The gravity went astray and I am the only one fast enough to stop it! I am.. The Flash! ",1,0,1528640116.0,,False,positive,positive,positive,positive
e0fl7vh,#Nice catch,1,0,1528640505.0,,False,positive,positive,positive,positive
e0fl8oz,This is incorrect because most soap operas don't have the budget to make someone fall,1,0,1528640532.0,bronzecarrot,False,negative,negative,neutral,negative
e0flbmx,Indian soaps. Where g= 0.98 m/s^2,1,0,1528640632.0,Badonkadoc,False,neutral,neutral,neutral,neutral
e0flbn3,I don’t remember many Indian sprinters at the olympics ,1,0,1528640632.0,BjParkes,False,neutral,neutral,neutral,neutral
e0flnks,Which animu is this? ,1,0,1528641039.0,ourLordAI,False,neutral,neutral,neutral,neutral
e0flwgf,"Good thing she floats to the ground like a feather, giving everyone time to look and make many facial expressions. Most of the time no one notices until after they hit the ground.",1,0,1528641334.0,InKainWeTrust,False,positive,positive,positive,positive
e0fly32,Even the scene from inception took shorter than this!,1,0,1528641388.0,slipperySquidd,1529665246.0,negative,negative,negative,negative
e0fmgyk,Man that was frustrating as hell to watch ,1,0,1528642000.0,CommunistCappie,False,negative,negative,negative,negative
e0fmx3i,Pewdiepie needs to see this gem 😂,1,0,1528642522.0,Rushes99,False,positive,positive,neutral,positive
e0fn6sb,r/noisygifs,1,0,1528642832.0,camrylong,False,neutral,neutral,neutral,neutral
e0fn79e,r/gifsthatkeepongiving,1,0,1528642847.0,utlor,False,neutral,neutral,neutral,neutral
e0fnmay,[Wolfsheim](https://youtu.be/9V_oJcBlI9E?t=1m32s) did it first.,1,0,1528643322.0,blarch,False,neutral,neutral,neutral,neutral
e0fnozp,I love the girl who frowns her nose at the end. She doesn't know acting one bit. She looks cute. Also an essence. haha,1,0,1528643406.0,dear_twitter,False,positive,positive,positive,positive
e0fntjn,Bullshit ,1,0,1528643551.0,waqar2255,False,negative,negative,negative,negative
e0fo435,Sir Issac Newton must be rolling in his grave,1,0,1528643874.0,bstumpm4w,False,negative,negative,neutral,negative
e0fo4sf,Me saving myself from failing this year like....,1,0,1528643896.0,Shoziwankanobi,False,neutral,neutral,negative,neutral
e0fojlz,"Run, Omar, Run!",1,0,1528644350.0,jigg4,False,positive,neutral,neutral,neutral
e0foug7,Why is everyone super pale,1,0,1528644679.0,msmissy00,False,negative,negative,negative,negative
e0foyrs,Fuck the flash this guys the true speed demon,1,0,1528644808.0,Abhishreknado,False,negative,negative,negative,negative
e0fozdh,India has different gravity than rest of us. Thats all. ,1,0,1528644825.0,,False,neutral,neutral,neutral,neutral
e0fp4zl,But what is the story here? Who’s the falling girl? Who’s the guy who saved him? Who’s the evil girl in the background? Why did she try to kill her? What’s happening?,1,0,1528644997.0,Jai137,False,negative,neutral,negative,negative
e0fpake,"It's like India has all of the tools to make movies, but doesn't quite know how to use them.",1,0,1528645166.0,beezofaneditor,False,negative,negative,neutral,negative
e0fpc1j, I wonder if Sweden’s weapon of mass destruction is just pewdiepie roasting the targeted country ,1,0,1528645207.0,SubSonicFrog,False,negative,negative,negative,negative
e0fpyxs,"Almost as many cuts as the fence jumping scene in taken 3. 

Almost. ",1,0,1528645901.0,,False,negative,negative,negative,negative
e0fqc7j,I thought this was r/PewdiepieSubmissions for a second,1,0,1528646287.0,sorrikkai7,False,neutral,neutral,negative,neutral
e0fqhz5,I almost died watching this,1,0,1528646458.0,grav3d1gger,False,negative,negative,negative,negative
e0fqqk0,r/pewdiepiesubmissions,1,0,1528646710.0,littlevoice04,False,neutral,neutral,neutral,neutral
e0fqu6b,I hated every second of this,1,0,1528646815.0,chiefkeeffan954,False,negative,negative,negative,negative
e0fr54m,That was painful...,1,0,1528647132.0,Pvvn,False,negative,negative,negative,negative
e0fr5wc,Thankfully she took the feather fall feat,1,0,1528647155.0,Baxter_Baron,False,positive,positive,positive,positive
e0frg31,I love Bakemonogatari,1,0,1528647450.0,sleepycoffins,False,positive,positive,positive,positive
e0frqd6,r/pewdiepiesubmissions,1,0,1528647742.0,K-Bills,False,neutral,neutral,neutral,neutral
e0fs5o9,I was invested ,1,0,1528648177.0,NuclearSpawn,False,neutral,neutral,positive,neutral
e0fsao4,He took forever to reach her.,1,0,1528648319.0,random_guy2018,False,negative,negative,neutral,negative
e0fsh0x,"Love this, which serial. Wanna watch.",1,0,1528648498.0,freddyfernando,False,positive,positive,positive,positive
e0ft3pg,She got some serious air time there ,1,0,1528649133.0,aprabhu86,False,neutral,neutral,negative,neutral
e0fxyii,Fuck is this the most upvoted post in randia?,1,0,1528654086.0,rudshire,False,negative,negative,negative,negative
e0g0k21,What TV show is this?,1,0,1528656711.0,,False,neutral,neutral,neutral,neutral
e0g0x93,"All y’all talkin about how that man ran super fast, are we just gonna forget about how that woman fell? Look at the beginning of that video! This dumbass literally put her back against those stairs and did a backflip over the railing! ",1,0,1528657085.0,2themax9,False,negative,negative,negative,negative
e0g138s,It is depressing how accurate this is.,1,0,1528657250.0,Nranjan1928,False,negative,negative,negative,negative
e0g2abl,Such fine actors put sir Anthony Hopkins to shame,1,0,1528658454.0,darthsid22,False,positive,positive,negative,positive
e0g2bhx,Can anyone provide video link? I wanna hear the stupid dramatic music that must've been played throughout the scene ,1,0,1528658487.0,AnotherSimpleton,False,negative,negative,negative,negative
e0g2mcu,Well that was intense,1,0,1528658801.0,freeze123901,False,positive,positive,positive,positive
e0g2rxi,r/madlads,1,0,1528658958.0,FancyFannypack19,False,neutral,neutral,neutral,neutral
e0g37q9,Pewdiepie should do this one! ,1,0,1528659404.0,kirarpit,False,positive,positive,positive,positive
e0g4ynv,"I thought this was going to loop and never end. 
",1,0,1528661156.0,iamtheju,False,negative,negative,negative,negative
e0g57pm,Now why isn’t that Indian boy playing receiver in the NFL?,1,0,1528661416.0,Everlast7,False,neutral,neutral,neutral,neutral
e0g9gde,Bc.,1,0,1528665705.0,MajFuckwarsinghRana,False,neutral,neutral,neutral,neutral
e0gdeca,It’s Illuminati 😂,1,0,1528669603.0,azik_grump,False,neutral,negative,positive,neutral
e0gdnci,"I'VE BEEN FALLING, FOR 30 MINUTES. -Loki, Thor:Ragnarok",1,0,1528669859.0,Crowload,False,neutral,neutral,neutral,neutral
e0gk92d,Indians deserve better.,1,0,1528677296.0,thediscussion,False,negative,positive,positive,positive
e0gmtgp,Replace boy with bhai. This scene alone will earn 20 crore. ,1,0,1528680345.0,akahorizon,False,neutral,neutral,positive,neutral
e0grybc,I like how the obvious disappointment from that lady goes unnoticed( ͡° ͜ʖ ͡°).,1,0,1528685975.0,maestro4ev,False,negative,negative,neutral,negative
e0gsgov,Dafaq did i just watched,1,0,1528686476.0,bigganya,False,negative,negative,neutral,negative
e0gtez8,damn physics,1,0,1528687470.0,carneirojohnson,False,negative,negative,negative,negative
e0gthyu,"What are you saying? It's called ""Living each second to the fullest""",1,0,1528687559.0,rrrocky777,False,neutral,positive,neutral,neutral
e0gtiw7,"Indian soaps have this typical 'look' on every face, so you can identify the evil one even when watching a 20 sec video.
This one is an example :P",1,0,1528687588.0,carneirojohnson,False,negative,neutral,neutral,neutral
e0gw858,It was filmed at moon guys.,1,0,1528690784.0,singularity_12000,False,neutral,neutral,neutral,neutral
e0gwwl6,When you get your elven monk to level 20,1,0,1528691681.0,,False,neutral,neutral,neutral,neutral
e0gxtuy,It's even better with sound,1,0,1528693091.0,AAAEA_,False,positive,positive,positive,positive
e0h17j8,They must have locked the video editor (newbie) in a room and told him to do whatever he wants.,1,0,1528698438.0,keep_flyin,False,neutral,neutral,neutral,neutral
e0h1v4m,Cocaine is one helluva drug!,1,0,1528699610.0,senju_bandit,False,negative,negative,negative,negative
e0h28nv,r/indiacasual,1,0,1528700300.0,raoolp,False,neutral,neutral,neutral,neutral
e0h2xdb,I was just waiting for everything to pause as the colours changed and a “To be Continued...” appeared in the corner.,1,0,1528701614.0,Pacificbobcat,False,neutral,neutral,neutral,neutral
e0hfv1n,"Why didn't the people around him grew older, he must have travelled faster than light.
Fuck!!",1,0,1528724407.0,zombiess1997,False,negative,negative,negative,negative
e79qgyp,[deleted],1,0,1538829521.0,,False,neutral,neutral,negative,neutral
e0f74i3,OP post this on /r/PewdiepieSubmissions.,3,0,1528613169.0,ByteThis,False,neutral,neutral,neutral,neutral
e0fgi4s,"Indian entertainment is so objectively awful. Like is it on purpose or what?

I really don’t think anyone could watch this in a serious manner and think it’s good unless it’s bad on purpose.",1,0,1528633634.0,moldykobold,False,negative,negative,negative,negative
e0f30js,That was awesome. ,1,0,1528606476.0,wadia23,False,positive,positive,positive,positive
e0f55zm,"Were you looking for the laws of physic to apply? I’m sorry, we in Bollywood now. ",1,0,1528609687.0,kmas_2006,False,neutral,negative,negative,negative
e0f69xt,Somebody share this to PewDiePie!!,1,0,1528611611.0,Kishor_Sonawane,False,neutral,positive,neutral,neutral
e0f6kgq,"Saas bahu serial: Gravity fucking up relativity

r/facepalm",1,0,1528612138.0,pratik_mullick,False,negative,negative,negative,negative
e0f6rep,I laughed way too much seeing this.,1,0,1528612483.0,FraudMallu,False,positive,positive,negative,positive
e0f74qg,Oh yeah... Such Johnny Bravo,1,0,1528613182.0,jgenius07,False,positive,positive,positive,positive
e0f7bv3,Desi quicksilver!!!,1,0,1528613564.0,EndlessDesire,False,neutral,neutral,neutral,neutral
e0f8mhq,After this I think I'm supporting Pewdiepie... Earlier I thought he was just over reacting. Now i know what he is talking...,1,0,1528616203.0,whoisthis3737,False,neutral,neutral,neutral,neutral
e0fael6,"Legend has it, she is still falling. ",1,0,1528620164.0,ShreeCuriosity,False,neutral,neutral,neutral,neutral
e0fe1jo,*Clap* MEME *Clap* REVIEW,1,0,1528628760.0,limberwisk,False,neutral,neutral,positive,neutral
e0f7ijk,no bOOb press?!!,-1,0,1528613931.0,ayandon,False,negative,negative,neutral,negative
e0fbjqq,[deleted],0,0,1528622858.0,,False,neutral,neutral,negative,neutral
e0f3b2g,That's completely practically possible. \^/s,0,0,1528606901.0,iluvindia,False,positive,positive,positive,positive
e0fekuf,Why in gods name are all the people so white?  ,0,0,1528629929.0,ultrazonagepwnage,False,negative,negative,negative,negative
e0fi0ld,"Was gonna comment that its straight out of cheesy southern action movies, realized this was r/India and everyone already knows that. ",0,0,1528636087.0,csoulr666,False,negative,neutral,negative,negative
e0fgia7,They can easily make a full episode by making her fall off a 15 story building,-1,0,1528633641.0,The_Best_Taker,False,neutral,negative,neutral,neutral
e0fc06f,Pewdiepie did nothing wrong! ,0,0,1528623941.0,,False,positive,positive,positive,positive
e0fcc32,R/piewdiepiesubmissions,0,0,1528624756.0,,False,neutral,neutral,neutral,neutral
e0fcnhz,"Hold your pitchforks folks. I am sure there's an explanation somewhere in the vedas, duly researched by our acharyas of RSS.",0,0,1528625532.0,OneMillionFireFlies,False,neutral,neutral,neutral,neutral
e0g37lq,"Apparently those who thumb down this comment don't see the fact that I'm making light, excuse the pun, of the fact that Bollywood rarely makes movies for mass consumption with people who's skin color makes up much of the sub-continents skin tone. I worked among hundreds of Indians in the Silicon Valley for years and of course, lived by then too. I rarely if ever saw anyone this light. But those whose snowflake feelings get hurt just by the mention of this fact are unable to see anything but offense when it is mentioned. Those Indians I knew were well aware of the fact I mentioned here. Yes, some movies figured darker skin tones, but the vast majority of overseas productions and soap operas did not reflect the population in their movies and TV shows. ",0,0,1528659401.0,Grover70,False,negative,negative,negative,negative
e0fgpw0,"Is it me, or do all the actors have a healthy dose of British in them? ",-5,0,1528634001.0,ErroneousJester,False,neutral,positive,neutral,neutral
e0f9ba3,"How dumb does one have to be to actually appreciate a show like this? I for one like to watch western shows that require atleast an IQ of over 120; bbt, r&m and sometimes CSI.. 

🕴",-4,0,1528617679.0,rand0m0mg,False,negative,negative,negative,negative
e0f7zj9,PewDiePie approves this,-1,0,1528614879.0,NerdFantasy,False,neutral,positive,positive,positive
e0f9fd7,I have never seen someone fuck Physics this way 😭😭,-1,0,1528617925.0,,False,negative,negative,negative,negative
e0fdt0o,"67,520,000 Rupee Man",-1,0,1528628223.0,Psyiote,False,neutral,neutral,positive,neutral
e0fesbs,Indian women make me happy in the pants.,-1,0,1528630367.0,,False,positive,positive,positive,positive
e0ffmeo,Why is everyone so white?,-1,0,1528632028.0,kwz,False,negative,negative,negative,negative
e0ffrqr,This is why shows from Pakistan are better,-1,0,1528632308.0,OneLessFool,False,positive,positive,negative,positive
e0fil08,I was expecting them to break into dance at the end... DISSAPOINTED!!!!,-1,0,1528636927.0,frankly47,False,negative,negative,negative,negative
e0fj7z8,Why don’t more Indian chicks do porn?,-1,0,1528637823.0,FlumpStew,False,neutral,neutral,neutral,neutral
e0fjhqu,Indian filmmaking is so ridiculous and bad.,-1,0,1528638193.0,Pillagerguy,False,negative,negative,negative,negative
e0flk5x,This is aweful.,-1,0,1528640923.0,Sephonik,False,negative,negative,neutral,negative
e0fem2z,"If the math on the acceleration is correct, then he should sign up for Grand Prix and NASCAR.

Akon- I own a white Lamborghini

Rowan Atkinson - I own a red F1 McClaren 

Indians - We have a brown soap opera star ",-3,0,1528630001.0,,False,neutral,neutral,neutral,neutral
e0fkc8v,My boss is Indian and I've dealt with a lot of Indian costumers. These people don't look Indian.,-5,0,1528639381.0,casemodz,False,negative,negative,negative,negative
e0fecg8,World power by 2020.,-8,0,1528629424.0,kuzana,False,neutral,positive,positive,positive
e0fi2dd,[removed],-11,0,1528636162.0,,False,neutral,neutral,negative,neutral
e0f3o21,[deleted],802,1,1528607449.0,,False,neutral,neutral,negative,neutral
e0fiand,Surprised she didn't give birth that fall was so long.,119,1,1528636504.0,121jiggawatts,False,negative,negative,positive,negative
e0fecv1,Nothing would have happened even if there was no one to catch.,9,1,1528629449.0,AalsiHu,False,negative,neutral,neutral,neutral
e0fypor,Red says hello ,1,1,1528654839.0,bored_imp,False,positive,neutral,neutral,neutral
e0fz57a,why?,1,1,1528655272.0,DietVicodin,False,neutral,neutral,neutral,neutral
e0gs6ou,Holy fudge the upvotes on this post !!!! ,1,1,1528686202.0,daddan_pahalwaan,False,negative,positive,neutral,neutral
e0fdz81,I could see that as a Monty Python sketch.,336,1,1528628613.0,Lockhartsaint,False,neutral,positive,neutral,neutral
e0ff6wl,I thought he was gonna knock good laptop out of the way or something.,14,1,1528631191.0,OnePunchFan8,False,negative,negative,positive,negative
e0ff6v7,"You forget, the time can be slowed or accelerated for a particular individual without affecting physics.",8,1,1528631189.0,,False,neutral,neutral,neutral,neutral
e0fll9r,I came here to comment this! I'm not disappointed. ,2,1,1528640960.0,AzzidReign,False,positive,positive,positive,positive
e0gjah3,"Look up ""Ramarajan Matrix fight"" on youtube. this is nothin ! :D",1,1,1528676183.0,tronvasi,False,neutral,positive,neutral,neutral
e0f5uoh,[deleted],1391,1,1528610858.0,,False,neutral,neutral,negative,neutral
e0f940t,Love makes you do crazy things,130,1,1528617237.0,lordvigm,False,positive,positive,positive,positive
e0faekd,Flash will hang his boots and start rearing sheep if he sees this. ,41,1,1528620162.0,dummy_roxx,False,negative,negative,neutral,negative
e0fa0gs,[deleted],76,1,1528619272.0,,False,neutral,neutral,negative,neutral
e0faybf,And she still had a much softer landing than hitting the floor at 1g,47,1,1528621443.0,sja28,False,neutral,neutral,neutral,neutral
e0fcjeg,"Ignoring that, she seemed to start falling again at times",15,1,1528625260.0,qwerty11235813213455,False,neutral,neutral,negative,neutral
e0fdly5,MUI = Master Ultra Indian,11,1,1528627770.0,evr487,False,neutral,neutral,positive,neutral
e0fcvnj,Damn IITians alway bringing stupid things like physics and logic and common sense into entertainment /s,6,1,1528626069.0,,False,negative,negative,negative,negative
e0ffkcy,[deleted],8,1,1528631921.0,,1588430999.0,neutral,neutral,negative,neutral
e0fdp7u,Indian Soap opra hero's are all at terminal celocity always. Its just that the dont have any interest in Olympics,4,1,1528627979.0,anirudh-design,False,negative,negative,negative,negative
e0fex1u,Speedforce.,3,1,1528630638.0,,False,neutral,neutral,positive,neutral
e0fgw0o,"3g is the effective acceleration. If you see carefully, during the last two or three seconds, his acceleration was like 10g.",3,1,1528634287.0,recw,False,neutral,neutral,neutral,neutral
e0fa8vy,"Ey, no physics",2,1,1528619805.0,Siriacus,False,neutral,neutral,negative,neutral
e0fdrzz,You mean you don't accelerate with 30 m/s^2 ?,2,1,1528628155.0,Tintenlampe,False,neutral,neutral,neutral,neutral
e0fi1jy,Dat 0-60 tho,2,1,1528636128.0,Linus696,False,neutral,neutral,neutral,neutral
e0fidcv,No it's fine because she also fell 3 times the fall height.,2,1,1528636618.0,Kingme121,False,neutral,neutral,neutral,neutral
e0fiysf,Goes so fast he passes out due to the lack of blood reaching his brain,2,1,1528637470.0,20171245,False,negative,negative,negative,negative
e0fjs3r,Plot twist : he is Barry Allen ,2,1,1528638602.0,bindhast,False,neutral,neutral,neutral,neutral
e0flfdn,this clearly does not happen on earth gravity.,2,1,1528640762.0,,False,negative,neutral,negative,negative
e0fpn38,How could anyone watch this in real time (during broadcasts)?,2,1,1528645545.0,GingerGuerrilla,False,neutral,negative,neutral,neutral
e0fb2e6,r/theydidthemath,5,1,1528621708.0,jdeepankur,False,neutral,neutral,neutral,neutral
e0faxu0,Get out...,1,1,1528621406.0,Eggslaws,False,neutral,negative,neutral,neutral
e0fizud,r/theydidthemath,1,1,1528637511.0,Satanus1998,False,neutral,neutral,neutral,neutral
e0fppdq,"> fastest car

Pshaw, it's merely half as fast as a funny car and not nearly as fast a top fuel racer. Assuming he weighs 140 lbs he's only putting out a few hundred horsepower and maybe 100-150 joules. ",1,1,1528645615.0,WYBJO,False,negative,neutral,positive,neutral
e0fype9,r/TheyDidTheMath,1,1,1528654831.0,neoArmstrongCannon90,False,neutral,neutral,neutral,neutral
e0zn5w4,What about the deceleration cause he stopped to catch the woman I presume,1,1,1529504307.0,ShanksMaurya,False,neutral,neutral,neutral,neutral
e0f6o36,His acceleration should be root 3 times g. ,-8,1,1528612318.0,banarun,False,neutral,neutral,positive,neutral
e0fcovl,"Yeah...she's like, ""Damn!...I knew I couldn't count on gravity!""",416,1,1528625626.0,commandek,False,negative,negative,negative,negative
e0fdwz2,"American raised Bangladeshi here. I always used to catch a glimpse of these shows when my aunties would be crowded around the tv to watch them. There always seems to be a cunning evil in law, like a mother in law or sister in law. Is this pretty much the case for most Indian soaps?",171,1,1528628472.0,talldrseuss,False,neutral,neutral,neutral,neutral
e0fs986,And the cunning lady is always hot.  And she never suffers for her wrongdoings ever.  In the end she just says 'sorry' and the good lady forgives her.  These serials kinda make me want to be bad.,33,1,1528648280.0,sidcool1234,False,negative,negative,negative,negative
e0fkbpc,She probably wanted to marry that guy because of some benefit to the family. Seems like what the evil character in soaps usually does.,15,1,1528639362.0,JapaneseStudentHaru,False,negative,neutral,neutral,neutral
e0fecab,Almost always the evil lady will be talking in English. ,15,1,1528629415.0,,False,negative,negative,negative,negative
e0fkcmj,I need her name for school homework,4,1,1528639394.0,cowarrior1,False,neutral,neutral,neutral,neutral
e0fxbh5,"> Always a cunning lady in every show.

Now you know where cunnilingus originates from.",2,1,1528653444.0,ocean_of_spunk,False,neutral,neutral,positive,neutral
e0f77tw,"Everyone is talking about that guy's speed. But, how did he see her falling? At one point, he comes into the frame running from behind a wall. Can he also see through the wall?",917,1,1528613344.0,Monsultant,False,neutral,neutral,neutral,neutral
e0f2zvz,Indian Prince of Persia?,151,1,1528606447.0,moddedberg2,False,neutral,neutral,neutral,neutral
e0f69ib,The new Flash episodes are of Indian soap opera level. The show has gone to shit.,109,1,1528611589.0,,False,negative,negative,negative,negative
e0fadp0,Barely Allen.,22,1,1528620107.0,bronzodiaknight,False,neutral,neutral,positive,neutral
e0f7zvf,Enter Flashtime (2018),3,1,1528614899.0,,False,neutral,neutral,neutral,neutral
e0fb8b6,My names Rajid and I'm the fastest man alive. ,7,1,1528622093.0,Jimboujee,False,positive,positive,positive,positive
e0g53te,"It seems like every director in India was taught the only way to create suspense is with fast cuts. There's plenty of other ways, and they don't have to shift the viewers attention every single time.",2,1,1528661303.0,Smirking_Like_Larry,False,negative,negative,positive,negative
e0f6zpn,Beat me to it!,2,1,1528612911.0,Morning_Person_,False,neutral,neutral,positive,neutral
e0frv1e,Bari Allen,1,1,1528647876.0,ApostateAardwolf,False,neutral,neutral,neutral,neutral
e0f9ufn,[deleted],120,1,1528618884.0,,1544440281.0,neutral,neutral,negative,neutral
e0f8hju,Main pichle aadhe ghante se gir Rahi hoon,49,1,1528615919.0,SandhuG,False,neutral,neutral,neutral,neutral
e0fewk3,"Yeah, etika kapoor don't give a fuck about physics laws.",14,1,1528630611.0,Appu_46,False,negative,negative,negative,negative
e0fe19a,*Etika.,7,1,1528628741.0,,False,neutral,neutral,neutral,neutral
e0fh562,"oh boy, those were some words!",0,1,1528634711.0,winged_owl,False,positive,negative,neutral,neutral
e0f90rq,"Got a few more words to edit there, bud

Edit: he did it! ",62,1,1528617041.0,ultiman00b,1528637749.0,positive,positive,neutral,positive
e0f76d1,caught* her,16,1,1528613267.0,givafux,False,neutral,neutral,neutral,neutral
e0fc2q4,">Everything is right with this scene

FTFY",3,1,1528624112.0,ZoomJet,False,positive,positive,positive,positive
e0fgw39,The laws of Physics in India is not the same as the rest of the world.,3,1,1528634290.0,xeno325,False,neutral,neutral,neutral,neutral
e0fnfh3,That's what lost you? Not the part where she takes a full minute to fall what looks like 15 feet?,3,1,1528643107.0,SoldierZulu,False,negative,negative,negative,negative
e0fegee,Definitely saw some suspension cables there,2,1,1528629660.0,kartwose,False,neutral,neutral,neutral,neutral
e0fkzwk,The[ laws of physics](https://youtu.be/i4iDWXstrWY) don't work in Bollywood.,2,1,1528640225.0,azurleaf,False,negative,negative,negative,negative
e0fwr1y,"Well, it appears they're in some alternate reality where the acceleration of gravity is significantly slower, so maybe they weigh a lot less, too.  :V",1,1,1528652878.0,IsilZha,False,positive,neutral,neutral,neutral
e0g03j9,That's the power of love. Or melodrama.,1,1,1528656247.0,ChuckBravo,False,positive,positive,positive,positive
e0j7yzv,"Or she weighs [5kg, like an anime character](https://www.youtube.com/watch?v=mjFAaKZtM-E)",1,1,1528796549.0,0l01o1ol0,False,neutral,neutral,neutral,neutral
e0fa2js,John mayer would like to have a word with you,73,1,1528619403.0,batatavada,False,neutral,neutral,neutral,neutral
e0f7cz5,"Hahaha... that’s funny! Because gravity is a myth! 

^/s",14,1,1528613626.0,This--Ali2,False,positive,positive,positive,positive
e0fjxxn,"In India, the vast population has more mass than the Earth. So it has different gravity to the rest of the planet.",2,1,1528638837.0,Highw4ySt4r,False,neutral,neutral,neutral,neutral
e0fbfbz,"From what I've seen of Indian tv and movies, they have a different set of laws regarding physics. ",3,1,1528622559.0,BureaucratDog,False,neutral,neutral,neutral,neutral
e0fklb4,A full minute to fall 15 feet?  Sounds realistic to me.,1,1,1528639710.0,TheUnbamboozled,False,neutral,neutral,positive,neutral
e0fl2kp,Cut the shit slow möbius ,1,1,1528640318.0,Taylosaurus,False,negative,negative,negative,negative
