Comment ID,Comment Text,Comment Score,Comment Depth,Created Timestamp,Author,Edited,Semantic Label,Semantic Label 2,Semantic Label 3,Major_Semantic
e0f3g57,Not surprised at all that the falling woman is pregnant. ,3008,0,1528607114.0,that_70_show_fan,False,negative,negative,negative,negative
e0f4yda,I almost thought he got there too soon and was going to slide underneath her.,1168,0,1528609359.0,FriesWithThat,False,neutral,neutral,neutral,neutral
e0f4v9v,"It seems he crossed at least 3 times more than the fall height. So, his acceleration was about 3g, faster than the fastest car.",3579,0,1528609230.0,bikbar,False,neutral,neutral,positive,neutral
e0f74uk,Love how there's that one lady who's disappointed that she didn't die (at about the 53rd second) Always a cunning lady in every show.,960,0,1528613188.0,i_reddit_now,False,positive,positive,positive,positive
e0f2vpf,Indian Flash?,1274,0,1528606281.0,ppatra,False,neutral,neutral,positive,neutral
e0f3l1u,[deleted],730,0,1528607323.0,,False,neutral,neutral,negative,neutral
e0f5ys8,"she must be like 60 kg and he caught her like a soft ball.

every thing is wrong with this scene.

Edit : lots of words.",648,0,1528611059.0,Ded-Futiya,1528691428.0,negative,negative,negative,negative
e0f45o7,"Oh god, Gravity is on drugs again",773,0,1528608195.0,,False,negative,negative,negative,negative
e0f4s4c,Why do all the houses in these soaps look the same? They don't even look realistic.,629,0,1528609101.0,daidalos5,False,negative,negative,negative,negative
e0f7ojh,I laughed at the evil female character. She was like ‘damn there goes away my best idea’ ,227,0,1528614268.0,,False,negative,negative,negative,negative
e0f3yki,Run Barry Run,98,0,1528607903.0,architkhandelwal47,False,neutral,neutral,neutral,neutral
e0f7302,"I've been falling, for 30 minutes!",81,0,1528613086.0,mr_r0b0t_1337,False,negative,negative,negative,negative
e0f696b,And then the girl falls in love with the guy. The end. ,76,0,1528611572.0,chantaje333,False,neutral,neutral,positive,neutral
e0f882y,"OK, lets do some math here:

Height of ceiling h \~6.6 m (Indian homes have have about 10' per floor. assuming this from the 2nd floor)

Time to reach ground =  **√** 2\*h/g (g=9.8)

=1.16s

I am assuming he had to run a distance of 15m to get to her

Speed=15/1.16=12.93m/s = 46.5 km/h

Current word record by Usain Bolt is of 44.72 km/h

This is assuming he reaches her when she hits the ground, not even midway.",181,0,1528615372.0,Beertard,False,neutral,neutral,neutral,neutral
e0f3f0g,[deleted],503,0,1528607068.0,,1555063053.0,neutral,neutral,negative,neutral
e0f7u1u,##The physics lesson we didn't know we needed. ,42,0,1528614575.0,masterofxo,False,neutral,negative,neutral,neutral
e0f3nhi,He ran more than a mile.,83,0,1528607426.0,Lenovojunk,False,neutral,neutral,neutral,neutral
e0fafye,And turns out she was a rich heiress who's mom died and dad was in the mob. And he was some poor guy who accidentally found his way to this party. Also all his family is dead (because of the mob) except for his little sibling who he has to support on his waiter/delivery man/some other shitty low paying job.,36,0,1528620251.0,GryfferinGirl,1528692026.0,negative,negative,negative,negative
e0f3z0q,This should be shown at the Cannes Film Festival,33,0,1528607920.0,meemboy,False,neutral,neutral,neutral,neutral
e0f4xzn,What sort of a complete retard trips backwards over the handrail. My head hurts.,151,0,1528609343.0,Lombdi,False,negative,negative,negative,negative
e0f7v8s,He might as well have stopped on the way for some snacks.,20,0,1528614643.0,,False,neutral,neutral,neutral,neutral
e0f70ar,Can anyone explain the appeal or reason for these shows. My Indian family in America eats this shit up and I cannot fathom why. These shows are SO bad,104,0,1528612942.0,PradleyBitts,False,negative,negative,negative,negative
e0f3bhz,"Clearly, the makers missed all the physics classes in school.",63,0,1528606918.0,apoorva63,1528607370.0,negative,negative,negative,negative
e0f3uit,this beats inception van sequence,65,0,1528607726.0,,False,neutral,neutral,neutral,neutral
e0f7qbc,"But no, *Piediepie, the firangi we hired from Colaba*, was WRONG to criticise Indian TV shows

We are the freaking best and all our shows are extremely educational too. 

Our production and research teams **develop new laws of physics everyday and our special effects are Oscar-winning.**


Yours faithfully, 

Ekta Kapoor",61,0,1528614365.0,masterofxo,1528614890.0,positive,positive,positive,positive
e0f74gd,Kyo cancer dere ho subah subah?,85,0,1528613166.0,,False,neutral,neutral,negative,neutral
e0f5ouh,I died a little bit inside.,40,0,1528610573.0,failinonestepatatime,False,negative,negative,negative,negative
e0f7prw,"Saala ghar ke cockroach, chuhe aur chipkaliyon ka reaction kidhar hai?",14,0,1528614334.0,_FooL_,False,negative,neutral,negative,negative
e0f82fu,"Bhai tu kaun hai! Luks like d firang junior editors we hire from reddit when we Create Paris in arey:) he will find his dopplegangers in kasam se only;)

/s

I have no idea what she said ",15,0,1528615049.0,troll9025,False,neutral,neutral,negative,neutral
e0f7cdh,[deleted],10,0,1528613593.0,,False,neutral,neutral,negative,neutral
e0f6xuh,Wonder how many more decades they will ruin the generations. Shit content.,7,0,1528612815.0,Hionmoon,False,negative,negative,negative,negative
e0fc21k,"Plot twist, the house is in the space. ",10,0,1528624065.0,,False,neutral,neutral,negative,neutral
e0fcryg,Sad we had some really good shows In the 90s then Ekta Kapoor happened.,9,0,1528625834.0,shobhit_23,False,negative,negative,negative,negative
e0f6710,clear demonstration of theory of relativity...learn something ppl ¯\\_(ツ)_/¯,8,0,1528611463.0,mskonline,False,neutral,neutral,neutral,neutral
e0f6ofp,"So realistic, the way he saved her. Touched my heart. 

/s",7,0,1528612336.0,AyushYash,False,positive,positive,positive,positive
e0f6e7r,I was falling for 30 minutes!!,14,0,1528611823.0,,False,neutral,neutral,negative,neutral
e0faxln,"Has direct line of sight, rounds a corner.",7,0,1528621391.0,YddishMcSquidish,False,neutral,neutral,neutral,neutral
e0fb2hs,Need a man like that! ❤,7,0,1528621714.0,DumplingSama,False,positive,neutral,neutral,neutral
e0fe5rz,I was hoping he would just slide past her... I am disappointed,6,0,1528629021.0,,False,negative,negative,negative,negative
e0fgssf,Bullshit she would be falling for weeks I tell you,8,0,1528634138.0,voidyman,False,negative,negative,negative,negative
e0fh5by,"He judged it well. Must have been swirling in the air. Such catches are always difficult. He showed good awareness of where the boundary was and had good composure to complete the catch under the immense pressure of the gazing eyes of the crowd. 


PS: I was happy he didn't go for the reverse cup. Shit technique TBH.",7,0,1528634719.0,logicperson,False,positive,positive,neutral,positive
e0fhuag,I can hear every single sound effect used in this scene.,7,0,1528635819.0,Bowserwolf1,False,neutral,neutral,positive,neutral
e0fkiv1,Am I the only one whose brain was actively trying to manafacture and add the typical Indian soap opera sound effects to the gif. ,8,0,1528639621.0,,False,neutral,neutral,neutral,neutral
e0f6s24,"I don’t understand how stupid are the actors. I mean wouldn’t any one of them raise some objection? Even the idiot running to catch the girl should’ve thought to himself, “this isn’t possible, none of this makes sense”. Then the editors, wouldn’t they also be like,”Guys need to really re write this script, this is just too stupid”. 

But it still makes it to the final cut. I want to talk to anyone who was part of this set. I want answers",97,0,1528612517.0,illumenaughty_420,False,negative,negative,negative,negative
e0f3mmp,[removed],114,0,1528607390.0,,False,neutral,neutral,negative,neutral
e0fh8e4,r/nonononoyes,5,0,1528634860.0,CelestialSiphon,False,neutral,negative,neutral,neutral
e0fhofy,I wonder did the crew laughed the whole time they were editing this scene. ,5,0,1528635567.0,rdznh,False,neutral,neutral,neutral,neutral
e0fse89,I see they’re just like Mexican soap operas and only cast very light skinned people.,7,0,1528648419.0,jesusper_99,False,negative,negative,neutral,negative
e0f6ze1,what the fuck was that?,4,0,1528612894.0,yal_sik,False,negative,negative,negative,negative
e0f7jiy,Arey bhai bhai bhai bhai bhai bhai!,6,0,1528613986.0,immortalizeboi,False,neutral,neutral,positive,neutral
e0f7u85,"They don't even try. This is what irks me the most. 

The shows haven't changed a bit since ages. Say anything about the Bollywood but often they try at least. ",5,0,1528614585.0,anon2812,False,negative,negative,negative,negative
e0f7wn6,Gravity works differently on this planet.,5,0,1528614720.0,sudhygocool,False,neutral,neutral,neutral,neutral
e0fcnip,"She is falling in slow Motion, end of debate.",5,0,1528625533.0,nitishanand99,False,neutral,negative,neutral,neutral
e0fgtl6,India's answer to DC's Flash,5,0,1528634175.0,adevgun,False,neutral,neutral,neutral,neutral
e0f60ck,[deleted],12,0,1528611137.0,,False,neutral,neutral,negative,neutral
e0fhamx,This is similar to Mexican soap operas in that most actors are of lighter skin than the average citizen...,9,0,1528634959.0,peterpayne,False,neutral,neutral,neutral,neutral
e0fagtp,By the time he would've looked over she would've already have DROPPED.,4,0,1528620306.0,GryfferinGirl,False,neutral,negative,neutral,neutral
e0fghod,"No disrespect, this is really good, but it could have used some special effects and more editing. ",4,0,1528633612.0,nickvocal,False,positive,positive,positive,positive
e0fgq63,Should have made that a two-parter ,3,0,1528634014.0,shanster925,False,neutral,neutral,positive,neutral
e0fgsiq,"Haters it's real and from a documentary about a culture of indian men saving pregnant women from falling in slow motion , it's an old indian tradition . ",4,0,1528634125.0,mike_dec,False,neutral,neutral,negative,neutral
e0fgy48,"The essence?

This scene isn’t special - any 60 second section of any Indian soap opera could claim exactly the same thing.

In fact the number quick cuts for expression of emotion was rather low, I didn’t feel like I was having a seizure.",4,0,1528634385.0,raftsa,False,negative,negative,negative,negative
e0fh3oj,Lmao this is anime levels of ridiculous ness,4,0,1528634642.0,silversonic99,False,negative,negative,negative,negative
e0fh6nq,That was hilariously painful to watch.,5,0,1528634781.0,,False,negative,negative,negative,negative
e0fha3g,This is the cause why Thanos wipe out half of the universe,5,0,1528634934.0,Sachincypher,False,negative,negative,negative,negative
e0fhj0t,Wow she was floating for a long time ,3,0,1528635330.0,,False,positive,positive,neutral,positive
e0fhkz1,"I'm surprised they didn't cut it 10 seconds early and say ""to be continued...""!",4,0,1528635418.0,slowpoison,False,negative,negative,positive,negative
e0fhmxy,Even the women is wondering wtf just happened.,4,0,1528635501.0,MercilessIndie,False,negative,negative,negative,negative
e0fhs8y,I half expected her to explode when he caught her,3,0,1528635734.0,,False,negative,neutral,negative,negative
e0fhyju,All the vfx in one shot!!!,5,0,1528636000.0,riyaxo,False,positive,positive,positive,positive
e0fima0,I’m with the bitch who got pissed when she didn’t die,5,0,1528636978.0,LayValley,False,negative,negative,negative,negative
e0fkk2e,This makes me want to actually watch indian soap operas now.,4,0,1528639664.0,killmenowtoholdpeace,False,positive,neutral,neutral,neutral
e0fkyxo,That one girl finally passes gas while everyone is distracted,4,0,1528640192.0,,False,neutral,neutral,negative,neutral
e0fm0w9,There wasn't a shot of ever family members from 60 different angles..,4,0,1528641482.0,aa11zz,False,neutral,neutral,negative,neutral
e0f4t3e,r/BollywoodRealism,21,0,1528609141.0,,False,neutral,neutral,negative,neutral
e0f73e5,"The power of christ compels you!! 
The power of christ compels you!! 
The power of christ compels you!! 
",5,0,1528613106.0,yadu4992,False,positive,positive,neutral,positive
e0f6hoj,"Are you attempting to make all redditors brain dead?
Please kill me already.",3,0,1528611997.0,tryingtoknowbetter,False,negative,negative,negative,negative
e0f7lb0,That gave me anxiety ,3,0,1528614086.0,gaurichitre,False,negative,negative,neutral,negative
e0f7rol,Aaaaaaaaaaaand it's out!! ☝️,3,0,1528614442.0,bennyman32,False,positive,neutral,positive,positive
e0fdaac,Days of our lives is far better soap opera than Ekta kapoor serial. ,3,0,1528627008.0,,False,positive,positive,negative,positive
e0fdm6l,"Damn, was expecting 'Continued Next Week' just before the catch",3,0,1528627784.0,tugboattomp,False,negative,neutral,neutral,neutral
e0fdndg,Orginal video anyone?,3,0,1528627864.0,,False,neutral,neutral,neutral,neutral
e0ffbaf,Obviously would have been faster just to walk down the stairs.,3,0,1528631433.0,Fargin,False,neutral,neutral,neutral,neutral
e0fftuw,IPL fielding gone too far. ,3,0,1528632415.0,vouwrfract,False,negative,negative,negative,negative
e0fghe3,The rate she was falling he could have just walked and made it in time,3,0,1528633598.0,Georgioies,False,neutral,neutral,neutral,neutral
e0fgpei,Meanwhile my grandma nearly had a heart attack lol,3,0,1528633979.0,s0nicDwerp,False,negative,neutral,negative,negative
e0fgq1m,That fall took longer than most DBZ fights,3,0,1528634008.0,Dadgame,False,neutral,neutral,neutral,neutral
e0fgsn4,Is she still falling? ,3,0,1528634131.0,south_butt,False,neutral,neutral,neutral,neutral
e0fgyhd,I misread the title as Indian *space* opera. Watched the whole thing but like zero tungsten rounds accelerated to a decent fraction of *c*.,3,0,1528634401.0,Taste_the__Rainbow,False,neutral,neutral,neutral,neutral
e0fh117,Man...I am hooked,3,0,1528634522.0,,False,positive,positive,positive,positive
e0fh6je,I think there’s a subreddit for just these kinds of shows/movies ,3,0,1528634775.0,colonel_walter_kurtz,False,neutral,neutral,neutral,neutral
e0fh8my,Is she falling in slow motion ? 😂,3,0,1528634872.0,,False,neutral,neutral,neutral,neutral
e0fhbja,Disappointed that no one broke out into song.,3,0,1528634999.0,,False,negative,negative,negative,negative
e0fhcpc,Finally somebody defeated gravity!,3,0,1528635052.0,poonddetatte,False,positive,positive,neutral,positive
e0fhdnh,"Okay. I need to know who they all are, what the story is, why that other chick was disappointed she made it, and if that guy is Indian Flash. ",3,0,1528635094.0,DialSquare84,False,neutral,neutral,negative,neutral
e0fhgd8,It's an Indian Hugh Jackman,3,0,1528635212.0,,False,neutral,neutral,neutral,neutral
e0fhrdf,Hahahaha!!!!!!,3,0,1528635696.0,Arcadeassassin,False,positive,positive,positive,positive
e0fis2l,"Lol I don't even have words to describe this shit 
And Ekta Kapoor throws tantrum at pwediepie 
What does she expect with this kind of crap😂😂",3,0,1528637209.0,giligili142,False,negative,negative,negative,negative
e0fj2uy,Lucky for them the woman was falling in slowmotion,3,0,1528637625.0,,False,neutral,positive,neutral,neutral
e0fktqf,Those were the most tense 45 seconds of my entire life.,3,0,1528640008.0,unkinected,False,negative,negative,negative,negative
e0fkz3v,Pure cancer of last stage. You won't survive watching this shit.,3,0,1528640198.0,alammuneer,False,negative,negative,negative,negative
e0fnanr,"Feels like watching an anime battle, except there's no flashbacks explaining the entirety of how the guy learns how to slide like that",3,0,1528642953.0,utlor,False,neutral,neutral,neutral,neutral
e0fo9hg,Thx god that she just fell from second floor！if the director let she fall from 10th floor，i could see her caught before ipad running out of power,3,0,1528644040.0,hdl46,False,neutral,neutral,negative,neutral
e0fplfo,That woman is slower than internet explorer,3,0,1528645498.0,theguy2108,False,negative,negative,negative,negative
e0fqig0,"Newton must have died million deaths during this 1 minute video!
",3,0,1528646471.0,aliveHere,False,negative,negative,negative,negative
e0fwmh9,Did they discover the zoom feature in this scene? ,3,0,1528652748.0,PatientKangaroo,False,neutral,neutral,neutral,neutral
e0fzqrr,Kya fielding hai! Jonty Rhodes bhi sharma jave.,3,0,1528655888.0,aashay8,False,neutral,neutral,positive,neutral
e0fzyut,that was as painful to watch as painful as the fall would have been,3,0,1528656116.0,KAYZEEARE,False,negative,negative,negative,negative
e0faz1l,[removed],16,0,1528621490.0,,False,neutral,neutral,negative,neutral
e0fhh4t,I have been falling for 30 MINUTES!!!,4,0,1528635247.0,charliebravo93,False,neutral,neutral,negative,neutral
e0fjoep,And that right there is why I have a thing for Indian guys. ,2,0,1528638447.0,RoboticsChick,False,positive,positive,neutral,positive
e0fj04s,"You know, I work in tech with a pretty significant number of people from India. Whenever I see clips of Indian tv/movies all the actors seem significantly lighter skinned than any of the people I work with. I'm pretty ignorant of how things in India work. Is this an actual thing or is it my imagination?",3,0,1528637522.0,WNW3,False,neutral,negative,positive,neutral
e0f63b9,I hope youre ready for Indian tv starlets to harass you on twitter,2,0,1528611280.0,Nethervex,False,negative,neutral,positive,neutral
e0f7c4c,"And then gravity lost

Sad death",2,0,1528613579.0,,False,negative,negative,negative,negative
e0f7c5k,More air time than Michael Jordan,2,0,1528613581.0,GaaraSama,False,neutral,neutral,positive,neutral
e0f7dgv,The woman needs to learn how to take a back bump from WWE.,2,0,1528613652.0,manoflogan,False,neutral,neutral,neutral,neutral
e0f7lnt,Hahaha.... This is quite common in the serials. R.I.P. Physics.,2,0,1528614105.0,,False,positive,positive,positive,positive
e0f7v0t,"Hahahahaahahahaha , pewdiepie ",2,0,1528614629.0,numerator9,False,positive,positive,positive,positive
e0f80i9,0/10 episode did not end just before the catch,2,0,1528614934.0,kpjoshi,False,negative,negative,neutral,negative
e0f82h6,Gravity gayi gaa*d marane,2,0,1528615051.0,aaditya_gada,False,neutral,neutral,neutral,neutral
e0f8l99,Cringe af. ,2,0,1528616132.0,iamrajatkr,False,negative,negative,negative,negative
e0f8zbq,Utha le re baba,2,0,1528616953.0,CommonMBAMan,False,neutral,neutral,negative,neutral
e0f9afa,"And to think there will be an Indian aunty going ""awww...."" when the weirdly super quick guy catches the woman that fools gravity",2,0,1528617627.0,dank_schon,False,negative,neutral,neutral,neutral
e0fasnu,"It's simple. He's a Speedster. Oh, so it's cool when Firangi TV does it but not our Modiji's Make In India TV? AUNTY-NASHANAL kahinka.",2,0,1528621064.0,ScientistRickSanchez,False,neutral,negative,positive,neutral
e0fd8ya,"Behenchod, I came visited randia to avoid such shit in home TV. What the fuck!!",2,0,1528626922.0,,False,negative,negative,negative,negative
e0fdf9t,Well the show is Kaleerein on Zee Tv. Ep no.81. The girl Aditi Sharma is hot af !!,2,0,1528627334.0,NiceChokra,False,positive,positive,positive,positive
e0fehmt,"If he transformed into Atlas and opened a portal and made her land safely onto his hands, even that would have been more plausible.",2,0,1528629737.0,,False,neutral,neutral,positive,neutral
e0fev03,"Two men fell from a roof. They both fell from the roof of a five-storey newly erected building. Seemingly a school. They had moved down the roof in a sitting position to the very edge and at that point started to fall. Their fall was noticed first of all by Ida Markovna. She was standing at her window in the building opposite and was blowing her nose into a tumbler. And suddenly she caught sight of someone starting to fall from the roof of the building opposite. Peering out, Ida Markovna saw what was an entire twosome starting to fall at once. Completely losing her head, Ida Markovna tore off her shift and hurriedly began to rub the misted-over windowpane, the better to make out who was falling from the roof out there. However, twigging that, perhaps, those falling might, from their vantage point, be able to glimpse her naked -- and goodness only knew what they might think of her -- Ida Markovna jumped back from the window and hid behind the wicker tripod on which there had at one time stood a pot plant.  

At this juncture, those falling from the roof were sighted by another personage who lived in the same building as Ida Markovna, only two floors below. This personage was also called Ida Markovna. She happened at the time to be sitting with her feet up on the window-sill and was sewing a button on her slipper. Looking out of the window, she had caught sight of those falling from the roof. Ida Markovna yelped and, leaping up from the window-sill, hastily began opening the window, so as to get a better view when those falling from the roof should strike the ground. But the window would not open. Ida Markovna remembered that she had nailed the window from beneath and rushed to the stove, in which she kept her tools: four hammers, a chisel and pincers. Grabbing the pincers, Ida Markovna again ran up to the window and pulled out the nail. Now the window was easily flung open. Ida Markovna leaned out of the window and saw those who had fallen from the roof whistling towards the ground.  

On the street a smallish crowd had already gathered. Whistles were already blowing and a diminutive militiaman was unhurriedly approaching the location of the anticipated event. A big-nosed caretaker bustled about, shoving people and explaining that those falling from the roof could smite the heads of those gathered below. By this time, both Ida Markovnas -- the one in a dress and the other naked -- having leaned out of their windows, were squealing and kicking their legs about. And so, finally, arms spread and eyes agape, those who had fallen from the roof struck the ground. 
Just as on occasion we, falling from heights we have attained, may strike the dreary cage of our future.

\- Daniil Ivánovich Kharms",2,0,1528630520.0,KKlear,False,neutral,neutral,negative,neutral
e0ff3g2,"Absurd physics, aneurism editing, and shitty acting aside, what is the target demographic for this? ",2,0,1528630999.0,April_Fabb,False,negative,negative,negative,negative
e0fgsy3,WingARDium LeviOsah,2,0,1528634145.0,Scorpio124,False,neutral,neutral,neutral,neutral
e0fgvhr,Six million rupee man. ,2,0,1528634263.0,,False,neutral,neutral,positive,neutral
e0fh8up,He is accelerating faster than 9.81m/s^2 he must be the flash,2,0,1528634881.0,BABarracus,False,neutral,positive,positive,positive
e0fhlfw,"Haha, more like a .mov than jif. Seemed like an eternity.",2,0,1528635438.0,abhi_ik,False,neutral,neutral,neutral,neutral
e0fhofc,When the editing is so on point that gravity and time warp.,2,0,1528635566.0,cutelly,False,positive,positive,positive,positive
e0fj7hi,"So... lots of suspense and drama capped by a totally obvious ending you could have seen coming from 5 miles away? 
  
P.S.  
In order to fall like that wouldn't someone have had to drop or throw the woman off the balcony/staircase???",2,0,1528637804.0,istarian,False,negative,negative,negative,negative
e0fltvy,"I remember this show! The whole series is as bizarre as this. It's called ""Jamai Raja"" ",2,0,1528641250.0,Adam__S,False,neutral,neutral,negative,neutral
e0fmyz4,Legend says she’s still falling. ,2,0,1528642581.0,cylrax,False,neutral,neutral,neutral,neutral
e0fnank,Fuck Ekta Kapoor,2,0,1528642953.0,Bankai1986,False,negative,negative,negative,negative
e0fpx7m,This guy coudve saved HR from Savitar ,2,0,1528645850.0,Dazza1910,False,neutral,neutral,positive,neutral
e0fs735,These are made because there is a public demand for them.  Sad reality.,2,0,1528648219.0,sidcool1234,False,negative,negative,negative,negative
e0fu3ho,One can sadly still hear this GIF.,2,0,1528650151.0,DaShrubman,False,negative,negative,negative,negative
e0fwth4,It’s the Indian flash! ⚡️,2,0,1528652947.0,horosory,False,positive,neutral,positive,positive
e0fx2bx,Successfully killed 5 brain cells of mine.,2,0,1528653191.0,pratyush997,False,negative,negative,negative,negative
e0fywby,Indian quiksilver ?,2,0,1528655025.0,yuvashankar,False,neutral,neutral,neutral,neutral
e0g681p,This is gold. 👌😂,2,0,1528662449.0,Dibbyo123,False,positive,positive,positive,positive
e0gsr95,Mavshi chi gaand.,2,0,1528686773.0,thetuxracer,False,neutral,neutral,positive,neutral
e0h5wsi,Posting this to the pewdiepie subreddit.,2,0,1528707972.0,TheFrogSplash,False,neutral,neutral,neutral,neutral
e55i654,"and people still watch Kubrick's movies, smh",2,0,1535719453.0,PrashnaChinha,False,negative,negative,neutral,negative
e0f6u2q,[deleted],14,0,1528612620.0,,False,neutral,neutral,negative,neutral
e0f71u0,Etika Kapoor triggered. ,3,0,1528613024.0,ByteThis,False,neutral,negative,negative,negative
e0f7704,What's so funny? I dont get it? Its just a super hero show....,2,0,1528613301.0,ByteThis,False,negative,negative,positive,negative
e0fbyok,She would've reached the bottom faster if she had just walked down the stairs. ,3,0,1528623845.0,skilg,False,neutral,neutral,neutral,neutral
e0f7cvp,r/pewdiepie bhai tu le le,6,0,1528613620.0,NotTryingToConYou,False,neutral,neutral,negative,neutral
e0f7t56,Any dedicated subreddit for indian daily soap opera?,2,0,1528614526.0,AalsiHu,False,neutral,neutral,neutral,neutral
e0fgzc7,Why Indian actors don’t look like Indian in  America (confusion),2,0,1528634441.0,linkerxhunter,False,neutral,neutral,negative,neutral
e0fi48t,Then they start dancing and singing out of no where ,2,0,1528636242.0,clwu,False,neutral,neutral,neutral,neutral
e0fj3is,And the best and brightest physics students in the US are all Indian. Hmm. ,2,0,1528637650.0,,False,neutral,neutral,positive,neutral
e0fnpt7,"Damn! 13k likes😨... Well deserved 😂

Its on r/all!?  WOW. ",2,0,1528643431.0,SDG_96,1528643739.0,positive,positive,positive,positive
