Comment ID,Comment Text,Comment Score,Comment Depth,Created Timestamp,Author,Edited,Semantic Label,Semantic Label 2,Semantic Label 3,Major_Semantic
e0g8ec9,Highest voted post on whole r/india sub! __/\__,2,0,1528664649.0,haseen-sapne,False,positive,positive,positive,positive
e0f7aif,Bollywood needs education. Physics should be top priority. Lol.,2,0,1528613490.0,iamgube,False,neutral,neutral,positive,neutral
e0f4p5i,"Bhai Pewdiepie ka.subreddit se repost lar rahe ho , woh bhi worse quality main 😂",0,0,1528608977.0,Hail_Kronos,False,negative,negative,negative,negative
e0f6i2h,saw first on 9gag,1,0,1528612017.0,smandar,False,neutral,neutral,neutral,neutral
e0f7hee,Send this to Pewds,1,0,1528613869.0,19yearoldMale,False,neutral,neutral,neutral,neutral
e0f80oo,Someone please do the math.,1,0,1528614946.0,Yieldway17,False,neutral,neutral,neutral,neutral
e0f81hp,I love the over the top editing though,1,0,1528614993.0,Scdsco,False,positive,positive,positive,positive
e0f99fe,"She took so long to fall, my mobile screen went idle and the gif restarted. Now I'll never know the exciting conclusion!!!",1,0,1528617566.0,babyspinachcan,False,negative,negative,negative,negative
e0f9c5r,Somone tell Pewdiepie to react to this. ,1,0,1528617730.0,C-GradeVillain,False,neutral,neutral,negative,neutral
e0f9cwr,Well that's dramatic,1,0,1528617776.0,,False,negative,neutral,neutral,neutral
e0f9gbq,Proud to be Indian ,1,0,1528617986.0,newshiba,False,positive,positive,positive,positive
e0f9o4o,Indian Bakemonogatari?,1,0,1528618479.0,Seifersythe,False,neutral,neutral,neutral,neutral
e0fa27j,This looked like a very long infomercial for some chronic back pain medication. ,1,0,1528619381.0,ezract,False,negative,negative,neutral,negative
e0fa4hl,No sax scene ?? :/,1,0,1528619528.0,,False,negative,negative,neutral,negative
e0fa5kz,The Wachowskis just orgasmed watching this. ,1,0,1528619595.0,Darth_Matter07,False,neutral,positive,negative,neutral
e0fa5wg,That’s how I catch in Cricket! Unnecessary drama! ,1,0,1528619616.0,yesvee619,False,negative,neutral,neutral,neutral
e0fa7aj,The reversals gave me retinal cancer.,1,0,1528619705.0,cusser_nova,False,negative,negative,neutral,negative
e0fa9st,The woman gravity forgot.,1,0,1528619862.0,VtotheS,False,neutral,neutral,negative,neutral
e0faggl,Fucking hell man,1,0,1528620285.0,neo_t10,False,negative,negative,negative,negative
e0fat6l,Anyone have a link to the original video?,1,0,1528621098.0,waynerooney501,False,neutral,neutral,neutral,neutral
e0fawqb,How the heck she fall backwards on a stair rail that's thick enough to NOT intentionally fall over? Idk how I found this gif btw ,1,0,1528621333.0,milkyberries,False,negative,negative,neutral,negative
e0fb5p0,Do people watch this garbage? ,1,0,1528621919.0,KingAliReshad,False,negative,negative,neutral,negative
e0fb79c,Is ko Indian Cricket Team mein bhejo.,1,0,1528622023.0,,False,neutral,neutral,neutral,neutral
e0fb9ts,I though it was a looping gif at first with how long it took her to fall.,1,0,1528622191.0,Optional_Happiness,False,neutral,neutral,negative,neutral
e0fbbjo,And this is why I don't watch Indian Tv shows Anymore.,1,0,1528622304.0,son_of_Khaos,False,negative,negative,negative,negative
e0fbhyj,"Who's the villain woman who's happy to see the other woman fall?

She's purty.",1,0,1528622737.0,lakshman_karan,False,neutral,neutral,positive,neutral
e0fbj01,When did Richard Hammond start doing Indian soaps?!,1,0,1528622806.0,flovmand,False,neutral,neutral,neutral,neutral
e0fblt3,The best reality tv show ever,1,0,1528622992.0,shadowst17,False,positive,positive,positive,positive
e0fbmk9,"BC that guy should run in Olympics for India.

",1,0,1528623040.0,Abhidivine,False,neutral,neutral,neutral,neutral
e0fbmkv,So many flash backs I thought I was having some.,1,0,1528623041.0,variationoo,False,neutral,neutral,neutral,neutral
e0fbmyk,This is some special kind of annoying.,1,0,1528623066.0,NopeRopeRepellant,False,negative,negative,positive,negative
e0fbna1,Was she falling from burj khalifa.? ,1,0,1528623085.0,devilmojo,False,neutral,neutral,neutral,neutral
e0fbnmc,Bollywood ,1,0,1528623108.0,,False,neutral,neutral,neutral,neutral
e0fbnuu,Well it sucked me in. I wanna watch more,1,0,1528623124.0,BlondeAussieGirl1990,False,positive,negative,negative,negative
e0fbome,I WAS FALLING FOR 30 MINUTES!,1,0,1528623172.0,Lazylions,False,neutral,neutral,negative,neutral
e0fbqe3,"My name is barry allen, i'm the fastest man alive",1,0,1528623292.0,deathescaped,False,positive,positive,positive,positive
e0fbu1p,I do believe that is not how gravity works India ,1,0,1528623536.0,GhostlyXi,False,negative,neutral,neutral,neutral
e0fbu9h,r/theydidthemath,1,0,1528623552.0,,False,neutral,neutral,neutral,neutral
e0fbxu1,So cute <3 <3 <3,1,0,1528623790.0,PrashnaChinha,False,positive,positive,positive,positive
e0fc1ob,Didn't end in cliffhanger? Now I'm surprised.,1,0,1528624040.0,themedits,False,neutral,positive,positive,positive
e0fc3on,Only haters will say it's fake.,1,0,1528624176.0,RE6008,False,negative,negative,neutral,negative
e0fc422,I love how while she is still moving in slow motion he’s able to run in real time lol ,1,0,1528624205.0,d0gwater,False,positive,positive,positive,positive
e0fc6n7,Man she's lucky she friends with a speedster ,1,0,1528624384.0,Shanewallis12345,False,positive,positive,positive,positive
e0fc6zm,I’m pretty sure he saw that through tat least two walls,1,0,1528624408.0,Phillyboishowdown,False,neutral,neutral,neutral,neutral
e0fcdg3,"The woman is pregnant and the super villain wants the kid to die. 

",1,0,1528624852.0,Mercwithabeard,False,negative,negative,negative,negative
e0fcgkm,Why didn't the bitch explode into Half Life esque Gore giblets?,1,0,1528625065.0,tankbuster95,False,negative,negative,negative,negative
e0fcgls,I srsly don't know if this is real or a parody,1,0,1528625067.0,NicoNoFace,False,negative,negative,negative,negative
e0fcgzt,r/nonononoyes,1,0,1528625094.0,ankurchachra,False,neutral,negative,neutral,neutral
e0fchm4,I smell ekta kapoor,1,0,1528625138.0,Zeus_Strike,False,neutral,neutral,negative,neutral
e0fcif1,That was never ending. (Figuratively speaking for the fun nazis lurking).,1,0,1528625192.0,,False,neutral,negative,negative,negative
e0fcjjn,Indian spider man? Is that you.,1,0,1528625270.0,viralpanda,False,neutral,neutral,neutral,neutral
e0fcjlf,surely this is a joke? a parody? ...please?,1,0,1528625273.0,GroovingPict,False,negative,negative,negative,negative
e0fcjye,Next time on dragonball z...,1,0,1528625297.0,youvegatobekittenme,False,neutral,neutral,neutral,neutral
e0fcjzm,r/funny,1,0,1528625300.0,drrreammer,False,neutral,positive,negative,neutral
e0fck9p,Noone mentioned the old dudes eye? It was green.,1,0,1528625316.0,Obnubilate,False,neutral,neutral,neutral,neutral
e0fclc0,"“Hey boss what kind of special effects do you want for this fall scene?”

“Fucking all of them”",1,0,1528625387.0,DestinyMonsterSearch,False,negative,negative,negative,negative
e0fclhb,"Goddamn, the suspense! Phew~!",1,0,1528625397.0,,False,positive,negative,negative,negative
e0fco63,"Does anyone know what show this is?
",1,0,1528625577.0,,False,neutral,neutral,neutral,neutral
e0fcs2y,THE FLOW OF TIME ITSELF IS CONVOLUTED,1,0,1528625842.0,Sundatroll,False,neutral,neutral,neutral,neutral
e0fcsfq,r/pewdiepiesubmissions is leaking.,1,0,1528625865.0,kitizl,False,negative,neutral,negative,negative
e0fcsr2,India cricket team should learn how to do fielding from this legend.,1,0,1528625885.0,Zeus_Strike,False,neutral,positive,neutral,neutral
e0fcvuw,I didn't see a musical part,1,0,1528626082.0,dkyguy1995,False,neutral,neutral,neutral,neutral
e0fcxr9,Longest GIF I have ever seen,1,0,1528626201.0,ChubbsBone,False,neutral,neutral,positive,neutral
e0fcz8a,r/gifsthatdontendtoosoon,1,0,1528626299.0,SishirChetri,False,neutral,neutral,neutral,neutral
e0fczna,The no of cuts are enough to cause an instant seizure.,1,0,1528626328.0,GoldPisseR,False,negative,negative,positive,negative
e0fd01h,"As an Indian, this is a r/noisygif",1,0,1528626350.0,Zaekr211,False,negative,neutral,negative,negative
e0fd0xk,That knee slide is worthy of Steven Gerrard. Amazing stuff,1,0,1528626411.0,winterdragonsucks,False,positive,positive,positive,positive
e0fd2sm,How much do the video editors get paid?,1,0,1528626530.0,BhaveshShaha,False,neutral,neutral,negative,neutral
e0fd75i,What did she trip on? Soap?,1,0,1528626810.0,UnintresstedChicken,False,neutral,neutral,neutral,neutral
e0fdac0,hahaha.. what a slide - Hero Hero,1,0,1528627011.0,raagsong2,False,positive,positive,positive,positive
e0fdaz1,Sauce??,1,0,1528627054.0,SL3ND3RM4N316,False,neutral,neutral,negative,neutral
e0fdc6g,TIL India is on the moon.,1,0,1528627133.0,michaelrohansmith,False,positive,neutral,neutral,neutral
e0fddgh,That would put Newton to shame. ,1,0,1528627216.0,spez666,False,negative,negative,negative,negative
e0fde3w,Huh. Never knew India was on the moon... You learn something new every day I guess,1,0,1528627257.0,Donsdeks,False,neutral,neutral,neutral,neutral
e0fdext,This is nothing ,1,0,1528627312.0,adityasharma001,False,neutral,negative,negative,negative
e0fdful,Kinda reminds me of [Monty Python.](https://youtu.be/fFufoOgCMW8),1,0,1528627371.0,AntiCharmQuirk,False,neutral,neutral,neutral,neutral
e0fdg87,Would have been hilarious if the clip ended with him missing to catch her fall...,1,0,1528627394.0,,False,neutral,neutral,neutral,neutral
e0fdgjw,I need to watch this show,1,0,1528627414.0,,False,neutral,positive,neutral,neutral
e0fdh9f,Legend has it she is still falling to this day.,1,0,1528627459.0,PrettyPup358647,False,neutral,neutral,neutral,neutral
e0fdhkq,Tell me this was a joke ,1,0,1528627479.0,hippieintheward,False,negative,neutral,negative,negative
e0fdhkv,"This GIF is incomplete. Just before he catches her, the episode will end and then it'll start next day/week after 10 minutes of prime time ads. Then it'll repeat everything from the start and then he will catch her.",1,0,1528627480.0,,False,neutral,neutral,neutral,neutral
e0fdkmg,My name is Barry Allen and I am the fastest man alive...,1,0,1528627683.0,Kian0707,False,positive,positive,positive,positive
e0fdkzg,"Non-Indian here. Is there any way to watch these shows online? Can you download them using torrents? If you can, what are they called?

I have got to see more of this.",1,0,1528627706.0,,False,neutral,neutral,neutral,neutral
e0fdqtv,"Which show? Never watched it before, and the channel seems new to me",1,0,1528628080.0,WPHero,False,neutral,neutral,neutral,neutral
e0fdwl1,"""Sorry, no time now; I will be busy falling for the next half hour...""",1,0,1528628445.0,Odys,False,negative,negative,negative,negative
e0fdxp8,"Nice catch! 

P.s \- You're selected buddy. Tomorrow 5am sharp.",1,0,1528628518.0,HolaQuackQuack,False,positive,positive,positive,positive
e0fdyat,There's always a vamp character. ,1,0,1528628556.0,svmk1987,False,neutral,neutral,neutral,neutral
e0fdyqw,Inspired by dragon ball z.,1,0,1528628583.0,soundjohnnytom,False,positive,positive,positive,positive
e0fdzxm,[/r/PewdiepieSubmissions/](https://www.reddit.com/r/PewdiepieSubmissions/),1,0,1528628657.0,doomlord12,False,neutral,neutral,neutral,neutral
e0fe1g2,How long was that gif actually because it seemed to last a lifetime,1,0,1528628754.0,thehazy_daisy,False,neutral,neutral,neutral,neutral
e0fe4ee,"your move, Clark Kent",1,0,1528628935.0,quitthebu11,False,neutral,neutral,neutral,neutral
e0fe7s9,I bet that other girl pushed her but he ruined her plan. Somehow she got down stairs to stand with the others in time to watch her fall.  ,1,0,1528629145.0,confuseum,False,negative,negative,negative,negative
e0fe87v,Indian soap opera > Gravity ,1,0,1528629171.0,handmeapj,False,neutral,neutral,neutral,neutral
e0fe8c7,"He Could Beat ""HUSAIN BOLT"" easily😂😂😂",1,0,1528629179.0,,False,neutral,positive,positive,positive
e0fe967,I am offended.,1,0,1528629229.0,Toulalan,False,negative,negative,negative,negative
e0fee6j,I would watch this. Is it ln netflix?,1,0,1528629530.0,Leak3030,False,positive,positive,neutral,positive
e0fef23,holy shit that editing was like being hungover,1,0,1528629581.0,,False,negative,negative,negative,negative
e0fef4i,Indian soaps are basically anime.,1,0,1528629585.0,Roskal,False,neutral,negative,neutral,neutral
e0fehgc,Why is everybody so white?,1,0,1528629726.0,MFNoire,False,negative,negative,negative,negative
e0fehig,"Run Barry, run!",1,0,1528629730.0,SeijiDominic,False,positive,neutral,neutral,neutral
e0fejqc,I’m the guy and the girl is the passing grade for my finals,1,0,1528629863.0,tooteefootee,False,neutral,neutral,neutral,neutral
e0feltt,How's that? ,1,0,1528629987.0,harshagarwal8,False,neutral,neutral,neutral,neutral
e0felv4,How can indian soaps be this bad ? ,1,0,1528629988.0,eWill95,False,negative,negative,negative,negative
e0fempz,Someone should cut out all the reaction shots and just clip her falling so we can count the times she falls past the stay railings,1,0,1528630039.0,pointless56,False,neutral,neutral,neutral,neutral
e0feneh,Clearly the guy is superman!,1,0,1528630079.0,blueflamerkiddo,False,positive,positive,neutral,positive
e0fep3o,"honestly, though how do these directors not see how unintentionally funny this is",1,0,1528630182.0,tooteefootee,False,negative,neutral,negative,negative
e0fepdn,So can anyone tell me the name of this show? And a link to the clip with sound? I have to send this to my mom and dad. They used to watch these when I was in high school (we live in America). ,1,0,1528630199.0,TeslaModelE,False,neutral,neutral,neutral,neutral
e0feq9u,indian soap operas bending time and space as usual.,1,0,1528630252.0,TitaniumGoldAlloyMan,False,neutral,negative,negative,negative
e0fes3v,Indian flash,1,0,1528630355.0,killaonthalose,False,neutral,neutral,positive,neutral
e0feulz,"Girl was falling long enough for Goku to get his spirit bomb off, Jesus christ",1,0,1528630499.0,Aumne,False,negative,neutral,negative,negative
e0fev6c,I can’t be the only one that saw that fallout symbol on the wall?,1,0,1528630531.0,Leocooper77,False,neutral,neutral,negative,neutral
e0fevg3,WTF that eye\-roll lol!,1,0,1528630547.0,vanilla_frontpage,False,negative,neutral,negative,negative
e0fevpa,My name is Barry Allen and I am the fastest man alive,1,0,1528630562.0,wildpants123,False,positive,positive,positive,positive
e0fevsc,**Next time on the gift shop sketch**,1,0,1528630567.0,blopo7,False,neutral,neutral,neutral,neutral
e0few04,The fact that these guys can keep a straight face during the scene proves that Indian soap opera actors are the best in the world. ,1,0,1528630579.0,kingofthefryingpan,False,positive,positive,positive,positive
e0few4a,😂,1,0,1528630585.0,Berhane-A,False,neutral,neutral,neutral,neutral
e0fey3h,Some day India is going to take over as the cultural center of the world simply because of how many people they have. Prepare for it.,1,0,1528630699.0,Daedalus871,False,positive,positive,neutral,positive
e0fey89,"He looks like Indian Hugh Jackman.

Balvaanarine? Atulvarine?",1,0,1528630707.0,,False,neutral,neutral,neutral,neutral
e0fez77,How can someone watch this ,1,0,1528630760.0,,False,negative,negative,neutral,negative
e0fezlo,when you want to pad the video so you can have ads,1,0,1528630784.0,Lavendrina,False,neutral,neutral,neutral,neutral
e0fezq4,CinemaSins has denied to do Indian soap operas because the video file would be too big.,1,0,1528630790.0,jmumme43,False,negative,negative,neutral,negative
e0ff0on,Latin soaps best soaps ,1,0,1528630845.0,,False,positive,positive,positive,positive
e0ff2b4,I'm glad Indian Hugh Jackman was able to save her.,1,0,1528630936.0,GumdropsandIceCream,False,positive,positive,positive,positive
e0ff6i8,The catch sequence suggests the falling damsel    has similar mass to my empty wallet,1,0,1528631169.0,TempestNite,False,neutral,neutral,neutral,neutral
e0ff7ys,Bollywood sure knows the true value of totally waaaaaayyyyy over the top. ,1,0,1528631252.0,bluewing,False,neutral,positive,positive,positive
e0ff8im,Mumbai Walker Ranger,1,0,1528631282.0,flippantenthusiast11,False,neutral,neutral,positive,neutral
e0ffb88,Wow.,1,0,1528631429.0,,False,positive,positive,positive,positive
e0ffcaq,*Mmm whatcha saaay*,1,0,1528631489.0,amycd,False,neutral,neutral,positive,neutral
e0ffi79,wew flash!,1,0,1528631809.0,Piece0fCake,False,neutral,neutral,positive,neutral
e0ffjwb,She fell from the 1st floor or the 100th floor? Or i think gravity works a bit differently for her. ,1,0,1528631898.0,Death_Ma5ter,False,neutral,neutral,neutral,neutral
e0ffkpj,That evil one is cute af,1,0,1528631939.0,,False,positive,positive,positive,positive
e0ffm9z, Can only imagine what the editing timeline for one of these shows must be like. ,1,0,1528632021.0,,False,neutral,neutral,neutral,neutral
e0ffmw2,Needs more cowbell. ,1,0,1528632054.0,texasradioandthebigb,False,neutral,neutral,neutral,neutral
e0ffnpw,"Oh god, this was exactly like waiting for Planet Namek to explode. ",1,0,1528632097.0,Kallasilya,False,negative,negative,negative,negative
e0ffnv4,Should have watched the gift with popcorns... So much emotions,1,0,1528632104.0,Leviathn_Doom,False,neutral,neutral,negative,neutral
e0ffosl,myy braien seized ,1,0,1528632153.0,5nurp5,False,neutral,negative,negative,negative
e0ffqah,Someone call PewDiePie,1,0,1528632233.0,ksinghparth,False,neutral,neutral,neutral,neutral
e0ffr8y,Sex doesn’t last as long as it took this bitch to fall.,1,0,1528632282.0,,False,negative,negative,negative,negative
e0ffuoe,"Somebody tweet this to Pewdiepie!
",1,0,1528632456.0,,False,neutral,neutral,neutral,neutral
e0ffvkk,I could watch this 100 times. Are they all this way?? I should get into Indian soaps,1,0,1528632502.0,Boydle,False,positive,positive,neutral,positive
e0ffw7a,"Why is it that from the soap opera to our movies to our commercials every fucking thing is made around these rishte naate and fucking piyaaaar. bc ye tel khao rishton main mithas lao, ye hajme ki goli khao bc poore mohalle main pyar ki sugandh failao...why don't somebody for god sake get rid of these stupid directors and producers. what have we done to our tv why there is no nukkad, lifeline, kathasagar, kashish, ghutan.",1,0,1528632534.0,,False,negative,negative,negative,negative
e0ffx4d,My name is Barry Allen and I'm the fastest man alive,1,0,1528632582.0,Bottle-Top-Bill,False,positive,positive,positive,positive
e0ffxs5,jeez that felt like an hour ,1,0,1528632616.0,hypmoden,False,negative,neutral,negative,negative
e0ffyk1,I don't think she was pregnant when she started falling...but time moves differently in Indian soaps....,1,0,1528632656.0,10dulkar,False,neutral,neutral,neutral,neutral
e0fg48k,Lasted for 3 episodes this scene!,1,0,1528632948.0,sergiodionisio,False,neutral,neutral,positive,neutral
e0fg4xk,Desi Barry Allen,1,0,1528632984.0,fuadm70,False,neutral,neutral,negative,neutral
e0fg5gw,redifining g ,1,0,1528633012.0,khateebxtreme,False,neutral,neutral,neutral,neutral
e0fg6pm,This show looks like heaps of fun.  India just seems to just have a knack for really goofy comedy that barely tries to play it straight.,1,0,1528633072.0,flashmedallion,False,positive,positive,negative,positive
e0fg6tq,How fast must he have had to move to do that?,1,0,1528633077.0,Indigoh,False,neutral,neutral,neutral,neutral
e0fg7nm,That one lady looking so fed up with the other ladys shit had me rolling.,1,0,1528633115.0,,False,negative,negative,negative,negative
e0fg9v7,Indian soap opera = The Matrix,1,0,1528633224.0,nononotonono,False,neutral,neutral,neutral,neutral
e0fgaai,"So true.
",1,0,1528633245.0,,False,positive,positive,positive,positive
e0fgboc,This is so inaccurate. They would never show the ending before going for a break.,1,0,1528633315.0,Ayrane,False,negative,negative,negative,negative
e0fgc6b,And here I thought the Spanish telenovelas were dramatic,1,0,1528633339.0,Papito208,False,negative,negative,negative,negative
e0fgfy9,I fucking need source for this. I need to hear the sound. ,1,0,1528633525.0,TurbinePro,False,negative,negative,negative,negative
e0fghyi,"“Chosen one!”
“Im coming”

“Chosen one”
“Im coming”",1,0,1528633626.0,cruzazulfan007,False,neutral,positive,positive,positive
e0fgirl,Now I see where Nolan got the idea for Inception's bridge scene.,1,0,1528633664.0,WholesomeAsshole,False,neutral,neutral,neutral,neutral
e0fgjfe,That. Was. AWESOME!!!,1,0,1528633697.0,oof46,False,positive,positive,positive,positive
e0fgkb4,Damn it’s a good thing Indian Mac studied his martial arts with so much dedication.,1,0,1528633738.0,JoetheLobster,False,positive,positive,positive,positive
e0fgl5b,https://youtu.be/K2-f2PAma0o,1,0,1528633777.0,onyxcommander,False,neutral,neutral,neutral,neutral
e0fgnr7,This was pretty hard to watch. In America we would have had 3 commercials during. Especially on TBS...,1,0,1528633902.0,starrpamph,False,negative,negative,negative,negative
e0fi3js,I feel much more stupid now...or many more stupid..!?...F.. There you go,1,0,1528636212.0,The_sirkim,False,negative,negative,negative,negative
e0fiagq,The editing reminds me of stuff i used to do in high school.,1,0,1528636497.0,,False,neutral,neutral,neutral,neutral
e0fiasc,Source?,1,0,1528636510.0,Darksider123,False,neutral,neutral,neutral,neutral
e0fibom,Holy shit. Bollywood x10.,1,0,1528636548.0,honestlyluke,False,positive,positive,negative,positive
e0ficpt,Are they indian? ,1,0,1528636591.0,pm_your_pantsu,False,neutral,neutral,neutral,neutral
e0fidhm,Don't you think she looks like Mahi Gill?,1,0,1528636622.0,,False,neutral,neutral,neutral,neutral
e0fifpb,It's because India is closer to the centre of the Earth and thus they have less acceleration due to gravity. In an ealer episode she made a deal with the devil to make her slow down so she doesn't fall over. The devil tricked her so she actually slows down and now this happens. ,1,0,1528636711.0,SpiritWolf2K,False,neutral,neutral,neutral,neutral
e0figuc," Can hear these scenes 
",1,0,1528636756.0,RobinAdonys,False,neutral,neutral,neutral,neutral
e0fik17,"It makes sense now.  I watched it 3x. Then I put it on 8x speed. Everyone now moves at normal speeds, except the man. Even she falls at a normal rate...This leaves only one conclusion, the man, is the Indian Flash and the scene was slowed down to trick us.",1,0,1528636887.0,,False,neutral,neutral,neutral,neutral
e0fim4j,Bollywood is the 8th wonder of the world,1,0,1528636972.0,Shooeytv,False,positive,positive,positive,positive
e0fin5z,"You all dont know about ekta kapoor,she launched flash on her daily soaps way before than the tv series #INDIANnolan ",1,0,1528637015.0,,False,neutral,neutral,neutral,neutral
e0fitgb,/r/gifsthatkeepongiving ,1,0,1528637260.0,immunition,False,neutral,positive,neutral,neutral
e0fitzj,"So... what you're saying is, there's a high turnover for Indian editors because they're constantly killing themselves?",1,0,1528637281.0,stilesjp,False,negative,negative,negative,negative
e0fivww,New speedster for Flash season 5!!! ,1,0,1528637357.0,RB_FingerMagic,False,positive,positive,positive,positive
e0fixm1,The man that time forgot ,1,0,1528637423.0,Psychomaniac13,False,neutral,neutral,negative,neutral
e0fj250,[So he was trapped in an Indian soap opera the whole time.](https://78.media.tumblr.com/a7da3e5e70bbd8c8d7b930918e1b9475/tumblr_oz0moiYner1wr9nfno1_500.gif),1,0,1528637597.0,WhitmanPriceHaddad,False,neutral,negative,negative,negative
e0fj510,Holy shit am I gonna have to start watching Indian soaps?  Because that was great.,1,0,1528637708.0,,False,positive,positive,positive,positive
e0fj6um,Is this real or is a parody?,1,0,1528637779.0,Hurinfan,False,negative,neutral,negative,negative
e0fj70y,And Peter couldn't catch Gwen?,1,0,1528637786.0,EZMickey,False,negative,neutral,neutral,neutral
e0fj71m,That was the dragon ball z fight of the century.,1,0,1528637786.0,TinFoilWizardHat,False,positive,positive,neutral,positive
e0fj9nc,I love how all these Indian Soap Operas use those iMovie transitions then zoom on each person 30 times per second. ,1,0,1528637887.0,,False,positive,positive,positive,positive
e0fjepj,Is this what it's like to experience a stroke?,1,0,1528638076.0,Grrrumple,False,neutral,neutral,neutral,neutral
e0fjg3g,This guy V.A.T.S,1,0,1528638130.0,soldaderyan,False,neutral,negative,negative,negative
e0fjjur,It went on so long I was bored. She was falling 10ft ffs! ,1,0,1528638274.0,yIdontunderstand,False,negative,negative,negative,negative
e0fjnps,There goes gravity,1,0,1528638420.0,cthulhuazathoth,False,negative,neutral,neutral,neutral
e0fjqce,Why hasn’t MST3K or Riff Trax covered soap operas??? Telenovelas are almost as bad...depending on the telenovela.,1,0,1528638543.0,raydavis1776,False,negative,negative,negative,negative
e0fjukd,"Me: “Wut?”
Her: Thud!!
Me: “Oh”",1,0,1528638704.0,Merky600,False,neutral,neutral,negative,neutral
e0fjv96,Maybe the flowy dress slowed her down. Like a lot... ,1,0,1528638732.0,bjdabomb91,False,neutral,neutral,negative,neutral
e0fjyxv,I genuinely looked away for like a minute and he still hadn’t made it to her ,1,0,1528638877.0,Chappygbr,False,negative,negative,negative,negative
e0fjz24,"The lead actor right now

I am fast as fuck boii.",1,0,1528638881.0,Abhi_sama,False,positive,positive,negative,positive
e0fk17u,The power slide at the end gave me flashbacks to Tenacious D and the Pick of Destiny,1,0,1528638968.0,DanTopTier,False,neutral,neutral,neutral,neutral
e0fk5au,*how can she fall??*,1,0,1528639126.0,Redplushie,False,negative,negative,neutral,negative
e0fk6i7,I'm pretty sure that this is how Gwen Stacey died. ,1,0,1528639171.0,shewy92,False,negative,negative,negative,negative
e0fk73y,Convenient that she kept rewinding herself until he had time to get there!,1,0,1528639193.0,,False,neutral,neutral,neutral,neutral
e0fk88m,Someone needs to shorten this by a second and submit it to r/gifsthatendtoosoon,1,0,1528639236.0,Bubufixxer,False,negative,neutral,neutral,neutral
