Comment ID,Comment Text,Comment Score,Comment Depth,Created Timestamp,Author,Edited,Semantic Label,Semantic Label 2,Semantic Label 3,Major_Semantic
flu27bn,">my college.

Thanks that was very informative.",1,1,1585493529.0,bootyannihilator,False,positive,positive,positive,positive
flt4jal,Can you tell the store name?,165,1,1585459024.0,sharan480,False,neutral,neutral,neutral,neutral
flti4a7,"Action has been taken against them

https://twitter.com/mysurumemes/status/1244191809758089216?s=21",65,1,1585473867.0,sec_c_square,False,neutral,neutral,neutral,neutral
fltr33a,Horrible situation that the NE people are confused with people of Chinese origin due to similar facial features. They are unaware that such people are also a part of India. Diversity must be taught in schools.,15,1,1585484388.0,tipofmytail,False,negative,negative,negative,negative
fltisnp,Well you guys elected parasites like Tejasvi Surya. This is nothing. Whole state is fucked.,30,1,1585474694.0,munna_jazbaati,False,negative,negative,negative,negative
fltg7yx,Not everyone? Everyone else there were mute spectators watching this unfold!  I think people like you are really rare rest are all racist and unapologetic to the core.,2,1,1585471516.0,makky115,False,negative,negative,negative,negative
fltm2g7,Don't lie most of them are even worse.,1,1,1585478722.0,pratyush369,False,negative,negative,negative,negative
flt4chn,Guys pls help NE students n people!!,207,1,1585458860.0,sharan480,False,positive,neutral,neutral,neutral
flt12j7,It was bound to happen with NE Indian folks. People are seeing it today but incidences like these have been happening for years.,222,1,1585456129.0,indi_n0rd,False,negative,neutral,neutral,neutral
flt83z8,"Shame on that store' person for such a discrimination/ignorance.

Shame on the people who stood mute watching this happen.

They are as much Indian as the store' employee is and to make it clear, the store should not have denied services to anybody. Hope they realize this soon and behave responsibility.",32,1,1585462397.0,amNoSaint,False,negative,negative,negative,negative
flt7cgp,Most people sadly do not understand. At the same time I don't think it should have mattered even if the person was Chinese.,24,1,1585461645.0,itsnobs,False,negative,negative,negative,negative
flt3t9e,"Meanwhile, in Mizoram, the local task forces (comprising of volunteers) have been giving out foodstuff free of cost to non-Mizo daily wage earners (mainly from donations from the people). I don’t see that news being reported. Free transportation arrangements have also been made to those wishing to leave the state (although many are choosing not to go back to their home states).",94,1,1585458394.0,tetea_t,False,neutral,neutral,neutral,neutral
fltjbee,"This was my thinking too.
A Chinese bloke living in my friend's apartment building was almost evicted by the society's management, long before quarantine even began. The guy hasn't traveled outside the city in over 4 months. He lost access to the common areas of the society, and was asked to take the ~~lift~~ stairs to the 9th floor. Here's the best part - This happened in Guwahati.  Yeah, NE people face racism everywhere in India, and dish it out in equal proportions. We Indians are racists extraordinaire.",8,1,1585475337.0,talkaboom,1585476264.0,negative,negative,negative,negative
flt1gif,😠😠😠,16,1,1585456446.0,whocoulditbe__,False,negative,neutral,neutral,neutral
flt3v2g,What can you expect from illiterate dumbasses.,17,1,1585458438.0,Imperial_Suprio,False,negative,negative,negative,negative
fltr26j,So many Chinese people are allowed everywhere and we are not allowing our own countrymen,1,1,1585484361.0,Spideyocd,False,negative,negative,negative,negative
flt11dn,[deleted],-99,1,1585456103.0,,1585461009.0,neutral,neutral,negative,neutral
fltvjcq,"If this shit happened in the West, you'd be able to go to the Human Rights Tribunal (or equivalent) and get a judgment in your favor in a few weeks, a compensation cheque and all it would cost you is the bus fare and a few hours of your time.

It doesn't bother me as much that a wrong was committed but that it will go unpunished.",8,1,1585488508.0,nummakayne,False,negative,negative,negative,negative
fltohsm,"Ah yes well done. Because there are dumbasses back home, we deserve Western racism. Excellent point.",-9,1,1585481593.0,KILLAQWUEEN,False,negative,negative,neutral,negative
flsz5j8,And expect an automated reply.,106,1,1585454613.0,irajputra,False,neutral,negative,neutral,neutral
flt0q5c,"This 2018 News should help
https://www.business-standard.com/article/companies/samara-amazon-bags-aditya-birla-group-retail-chain-more-for-rs-42-bn-118092000029_1.html",32,1,1585455849.0,DabanggSaanaad,False,neutral,neutral,positive,neutral
flt80xl,Share tweet here..,4,1,1585462313.0,quaglamel,False,neutral,neutral,neutral,neutral
flt1876,[deleted],-28,1,1585456259.0,,False,neutral,neutral,negative,neutral
flt1r75,[removed],57,1,1585456688.0,,False,neutral,neutral,negative,neutral
flt2dma,"You know what the guys behind are thinking :

"" Meh let him do whatever he wants. If i interfere i might not get an entry as well """,61,1,1585457194.0,waaaaaaduuhek,False,neutral,neutral,neutral,neutral
flsx0v8,Cowardice is in the DNA of the fucking middle classes. Fucking pieces of sht is what they all are. Spineless.,25,1,1585452993.0,notanothervoice,False,negative,negative,negative,negative
fltqxnz,"I wish ppl stop buying xioami and vivo phones, not only are they fulled with Chinese back doors, it's filled with fucking ads even in file manager.",1,1,1585484231.0,rohithkumarsp,False,negative,negative,negative,negative
flu2fe8,"These people are illiterate, they assume any asian to be chinese, they don't know about north east india, and there are many people like him. The situation will not change unless modi himself addresses this in his talks, i doubt he'll do.",1,1,1585493679.0,argon_palladium,False,negative,negative,negative,negative
flt25q8,They probably all feel the same anyways.,39,1,1585457014.0,DRTPman,False,negative,neutral,neutral,neutral
fltfl0g,"Scared, ignorant, uninformed guys rather than anything else.",-6,1,1585470742.0,mubukugrappa,False,negative,negative,negative,negative
fltoxzm,"You wish. I’ve not seen one such case taken seriously by the authorities. I’d be surprised if the police even showed up for something as “trivial” as this.

Edit: Looks like the police did take action on the store manager and the employee. Way to go! 👏",1,1,1585482101.0,iamramiyer,1585483275.0,negative,neutral,negative,negative
flte1t2,Thank you for writing your unique and insightful comment in bold and big letters. Would have been a shame had I missed this among all the other predictable generic comments.,20,1,1585468891.0,,1585503201.0,positive,positive,positive,positive
fltrsu1,"NE is to China as Kashmiris is to Pakistan. 

I hate most of India and most of Indians.",-4,1,1585485111.0,,1585496756.0,negative,negative,negative,negative
fltfgp5,This is one of the few comments here touching upon the core issue.,7,1,1585470596.0,mubukugrappa,False,neutral,neutral,positive,neutral
flt46h2,Somehow I don't think the police would be inclined to help.,12,1,1585458714.0,invictus1996,False,negative,negative,neutral,negative
fltolen,Lmao Indian police is a corrupt piece of shit.,1,1,1585481704.0,KILLAQWUEEN,False,negative,negative,negative,negative
flt4jaz,This is Mysore apparently. Some one has tweeted this addressing The DCM Mysore,12,1,1585459024.0,Beertard,False,neutral,neutral,neutral,neutral
flt92cw,[deleted],7,1,1585463366.0,,False,neutral,neutral,negative,neutral
flte3mu,[deleted],5,1,1585468950.0,,False,neutral,neutral,negative,neutral
flt72fq,"> We treat all Indians equally here in north east.

Hold on. About this part.

People in Assam like Punjab, Delhi or Maharashtra haven't exactly been welcoming towards migrants from Bihar. So since when have Assamese or other NE people been better at integrating people from Bihar which has the highest fertility rate in the country. Were NE people ever welcoming when Mumbai politicians were raising slogans against migrants from Bihar? 

At the end of the day there is not thing special since Human beings will always be territorial when it comes to limited resources especially in crisis.",6,1,1585461372.0,coldcoldnovemberrain,False,neutral,neutral,neutral,neutral
flte06a,"> your own country brothers

well to the racists - hidden or not - you're not",1,1,1585468838.0,Kemosahbe,False,negative,neutral,negative,negative
fltp1ez,"India is filled with peasant mentality. People like to pride themselves on being very educated, but their education consists of memorising shit to get them money. No critical thinking. And the government is filled with corrupt extremist beasts who present a beautiful image to the rest of the world while secretly getting their way with murder and what could be considered crimes against humanity. I don't think it's possible to reverse the decades of idiocy. You would have to delete everyone's memories then give them a proper education.",1,1,1585482205.0,KILLAQWUEEN,False,negative,negative,negative,negative
fltpc88,"First of all, for what it’s worth, apologies on behalf of all those who treated you badly just because you are from the NE. No doubt, you’re one among us. Let nobody tell you otherwise.

At the same time, religion, caste and all that is everywhere. That’s a problem for all of us. You shouldn’t have to do anything to be treated like an equal Indian. You’re right in that we’re in 2020 and we’re an educated generation. We should not be stooping so low. And I’ve never been to the NE, but if you guys truly treat everyone as equals, then that’s the right thing to do.",1,1,1585482536.0,iamramiyer,False,neutral,neutral,negative,neutral
flt5r3g,"Love frm TN💕 . Give love it will change people !
I think It happening more on BJP ruling states ? 
Correct me if I wrong!",1,1,1585460131.0,sharan480,False,positive,positive,positive,positive
fm1r7c8,I'm sure people in the North East are racist as well. The Khasis move to Assam but protest if the Assamese move there. The Assamese hate the Bengalis and so on.,2,1,1585683546.0,sanvin777,False,negative,negative,negative,negative
fm8cenm,"Just wondering as a foreigner (I am Dutch), would you rather join Myanmar, or if you could change history would you want the northeast to be a part of Myanmar? Or perhaps an independent country?",1,1,1585846834.0,wegwerpacc123,False,neutral,neutral,neutral,neutral
fltdv3o,"> even showed them their aadhar cards

Probably made it worse.",-1,1,1585468670.0,Kemosahbe,False,negative,negative,negative,negative
fltfi81,You is correct.,2,1,1585470648.0,mubukugrappa,False,neutral,positive,positive,positive
fltejls,Illiterate and uneducated doesn’t mean they don’t have morals. The most reprehensible people are usually the most educated.,1,1,1585469472.0,MrRabbit7,False,negative,negative,negative,negative
fm1riwp,"Don't shit on a state without knowing the poll dynamics at play. Karnataka has alternatively voted for the BJP, Congress and the local party JDS",1,1,1585683713.0,sanvin777,False,neutral,neutral,neutral,neutral
fltjmjt,U had me in the first half.,6,1,1585475723.0,,False,neutral,neutral,neutral,neutral
flts0a5,"That was swift.
Kudos",2,1,1585485313.0,kokofeshis,False,positive,positive,positive,positive
fltpf12,"The politicians right now are an extremist Hindu group called BJP who are hell-bent on the eradication of fellow Muslims and they go about it similar to China. Unfortunately these dumbasses think that if ur not brown and ur eyes aren't right that you aren't Indian. Sometimes I wish I could become Itachi or something and cast a genjutsu on the whole country to show them what they are, to show them that no one can be trusted and that no one gives a fuck about them.",2,1,1585482622.0,KILLAQWUEEN,False,negative,negative,negative,negative
flt4o0x,Its a cruel irony that people from NE part happen to be patriotic too (not saying this in the toxic nationalistic sense that our ruling party peddles).,1,1,1585459138.0,indi_n0rd,False,negative,negative,negative,negative
fltflfu,[deleted],1,1,1585470757.0,,False,neutral,neutral,negative,neutral
fluozon,worst human right system tbfh,1,1,1585507040.0,,False,negative,negative,negative,negative
flu1juu,Do you know where Karnataka is on the map?,0,1,1585493094.0,I_dont_get_it0_o,False,neutral,neutral,neutral,neutral
fltpjjt,Gotta say not all but alot.,3,1,1585482756.0,KILLAQWUEEN,False,neutral,neutral,neutral,neutral
fltxweh,Lol you're an idiot,0,1,1585490469.0,highertellurian,False,negative,negative,negative,negative
fltywfo,"Bangalore is a shit city, Karnataka is turning into a bigoted shithole. It's sad to see one of the more ""progressive"" cities in our country coming in the news for such stuff .",1,1,1585491222.0,,False,negative,negative,negative,negative
flt3u56,"LMAO, unfortunately this is the actual state of our country. Not saying that you and I are better and seeing this shit is fucking brutual. These people in the queue are probably more concerned about what all stock will be available and also rejoicing the fact that 2 people left the queue so they won't have to wait that much longer. 

I hope this could reach people with higher authority and a strict action is taken against the store.",15,1,1585458415.0,aj2704,False,negative,negative,negative,negative
fltlfcp,The only unity I can think of is in 'discriminating'.,1,1,1585477953.0,Fuido_gawker,False,negative,negative,negative,negative
fltooa4,It's more a travesty that many people in the same boat as you have not been exposed to the unfortunate truth that prevails in this country. They blindly parrot what they've grown up believing in and have no understanding of how deep the prejudices against diversity run in this country.,1,1,1585481798.0,,False,negative,negative,negative,negative
flte61y,"""GO KORUNA GO"" ?",1,1,1585469030.0,Kemosahbe,False,neutral,neutral,neutral,neutral
flti588,"That's only because of how isolated the NE is compared to other states. We don't have much traffic either with the exception of Assam and Arunachal which has improved its global and domestic connectivity through air travel. The other states like Nagaland, Manipur, Meghalaya, Mizoram, tripura have just one or two functioning airport. Tourism is not a major revenue generator for most of these states especially in Nagaland or Manipur because of the unrest and insurgency, and the negative perceptions and stereotypes. I don't have the official numbers for each state but in 2017 the entirety of NE had 77 lac domestic visitors in a year, compare that a single state like Karnataka  that generated over 2100 lac domestic visitors. Just imagine the numbers if it were foreign visitors.",5,1,1585473899.0,AcidHenny,False,neutral,neutral,neutral,neutral
flt6oyx,"They definitely would stop American-Indian or any one else they find different if the United States ever reaches food scarcity or resource scarcity. Human beings are tribal everywhere around the world. It is not like multi-racial marriages in the US are any more than inter-caste or inter-religious or inter-region marriage in India. 

Look up videos during the first few days of the pandemic closure at the grocery stores. People were feuding with each other over essentials. Same in UK. 

Just curious as to why you think the human behavior in similar situation of resource scarcity in the US would be any different than in India?",2,1,1585461012.0,coldcoldnovemberrain,False,negative,neutral,negative,negative
flup1cn,And they're getting dumber. Must be the gobar and mutra,3,1,1585507067.0,InterimNihilist,False,negative,negative,negative,negative
fltjq28,It's like they have it as their fetish,1,1,1585475846.0,,False,negative,neutral,negative,negative
fltdxrg,"Oh its already started. There have been protests in the recent past where people brought out signs like ""Hello China"" and maps of India with the seven sisters cut out.

Of course these are an extremely small minority of people and the sentiment of joining China is not that popular (because who in their right mind would actually want to be under the Chinese government). But these feelings of being ignored by the Indian government (whether it is Congress or BJP) as well as mainstream media on virtually everything and the non-ending racism faced everywhere is really nothing new.

I honestly wouldn't be surprised if we have a new youth led movement for some sort of autonomy coming in the next decade or so, especially if CAA-NRC gets enforced.",1,1,1585468759.0,pimpleface0710,False,negative,negative,negative,negative
fltel20,[deleted],-2,1,1585469521.0,,False,neutral,neutral,negative,neutral
flte8yi,and you did what ?,4,1,1585469125.0,Kemosahbe,False,neutral,neutral,neutral,neutral
flt7rfk,No fucking way!!❌,1,1,1585462056.0,sharan480,False,negative,negative,negative,negative
fltolrp,This is not the caste system. 🙄,1,1,1585481716.0,,False,negative,neutral,negative,negative
fltjp89,[deleted],1,1,1585475816.0,,False,neutral,neutral,negative,neutral
flt6t05,It's more.,1,1,1585461118.0,blerp_2305,False,neutral,neutral,positive,neutral
fltjpn2,More in mysore,1,1,1585475831.0,,False,negative,neutral,neutral,neutral
flu0x50,"If you want to experience (see) racism first hand go to India. You can see all types of racism such as cast, religion, region (north, east, south, west etc.), rich/poor etc. India is the finest example of racism in the world.",3,1,1585492661.0,hydra78us,False,negative,negative,negative,negative
flvtl44,Great news!,1,1,1585531800.0,SaykredCow,False,positive,positive,positive,positive
flt0lvc,He is holding a mask in his hand. He probably removed it while trying to talk to them,15,1,1585455754.0,roadtotitties,False,neutral,neutral,negative,neutral
flt0rof,He has mask in his hand.,6,1,1585455883.0,buzzkill96,False,neutral,neutral,neutral,neutral
flt6og2,"He was wearing a mask, but took it off to talk",4,1,1585460999.0,blerp_2305,False,neutral,neutral,neutral,neutral
flt4g8z,"It's more, I think.",1,1,1585458953.0,komedidoom,False,neutral,neutral,positive,neutral
flt6sht,"They were wearing masks, they took them off to talk",4,1,1585461105.0,blerp_2305,False,neutral,neutral,neutral,neutral
fltaild,"There have been a lot of videos in news in the past three weeks of people of Chinese origin who have been purposely spitting on fresh produce in grocery stores, applying spit on elevator buttons, or throwing spit on people’s clothes from behind. Chinese government published some videos it caught local Chinese doing it in China trying to spread covid. And then more recently grocery stores in a few large cities caught people of Chinese origin spitting on stuff or licking boxes and cans or food and cereal in markets. Police has arrested some such people and have been charging them. But generally given the anxiety and scare about CoronaVirus everyone is scared. 

And most people in India cannot differentiate a Chinese from a Korean or a Nepalese or Vietnamese or a North East Indian. Their behavior is based on fear.",4,1,1585464892.0,Indin_Dude,1585465150.0,negative,negative,negative,negative
fltbc8z,Check ur DM!,2,1,1585465793.0,sharan480,False,neutral,neutral,neutral,neutral
flteop2,"Because 'Apna kaam banta, bharr mai jaye janta"".",1,1,1585469642.0,k3times,False,neutral,neutral,neutral,neutral
fltoqed,One of the documents to prove your identity.,1,1,1585481866.0,,False,neutral,neutral,neutral,neutral
fltuae5,Paste the link on ripsave.com and download it.,2,1,1585487431.0,,False,neutral,neutral,neutral,neutral
fltb9ox,???,1,1,1585465715.0,,False,neutral,neutral,neutral,neutral
flsxin4,North Eastern,10,1,1585453361.0,desi_lion,False,neutral,neutral,neutral,neutral
flt0dla,At the beginning of the video you can see that the guy is holding a mask in his left hand,17,1,1585455569.0,dadadaitaly,False,neutral,neutral,neutral,neutral
fltls2g,"I just downvoted your comment.
 
# FAQ
 
## What does this mean?
 
The amount of karma (points) on your comment and Reddit account has decreased by one.
 
## Why did you do this?
 
There are several reasons I may deem a comment to be unworthy of positive or neutral karma. These include, but are not limited to:
 
* Rudeness towards other Redditors,
* Spreading incorrect information,
* Sarcasm not correctly flagged with a `/s`.
 
## Am I banned from the Reddit?
 
No - not yet. But you should refrain from making comments like this in the future. Otherwise I will be forced to issue an additional downvote, which may put your commenting and posting privileges in jeopardy.
 
## I don't believe my comment deserved a downvote. Can you un-downvote it?
 
Sure, mistakes happen. But only in exceedingly rare circumstances will I undo a downvote. If you would like to issue an appeal, shoot me a private message explaining what I got wrong. I tend to respond to Reddit PMs within several minutes. Do note, however, that over 99.9% of downvote appeals are rejected, and yours is likely no exception.
 
## How can I prevent this from happening in the future?
 
Accept the downvote and move on. But learn from this mistake: your behavior will not be tolerated on Reddit.com. I will continue to issue downvotes until you improve your conduct. Remember: Reddit is privilege, not a right.",-1,1,1585478379.0,proawayyy,False,negative,negative,negative,negative
flsz66t,[deleted],-11,1,1585454628.0,,False,neutral,neutral,negative,neutral
flt03e4,"Not Karma, racism is a vicious cycle. Someone has to end it.",9,1,1585455346.0,Krogan911,False,negative,negative,negative,negative
flt0eb9,">My uncle ran a electric appliance shop and was shot dead because he didn't give off those appliances to them for free.

The people who shot him dead - would you call them goons or North Easterners? I have met several folks from the NE, none of them have pointed a gun at me.",9,1,1585455585.0,MahaanInsaan,False,negative,negative,negative,negative
flt0emf,You can say karma is a bitch but that's not gonna solve anything but help nourish your ego. Its terrible what happened to your uncle but racism shouldn't happen anywhere. I hope you get that hate out your heart,9,1,1585455592.0,Atriann,False,negative,negative,negative,negative
flt0ma7,"""these people""

Way to generalize and be bigoted.",9,1,1585455763.0,cosmogli,False,negative,negative,negative,negative
flt0q64,For free? Abey BC don't mix undergrounds with the locals.,5,1,1585455849.0,roadtotitties,False,negative,negative,neutral,negative
fltcrsy,"that shouldn't matter anyway, if a person is in this country legally, and if they are paying for it in the correct manner like any other citizen then they have every fucking right to every basic necessity that any  ""Indian"" would need, Fuck these people.",4,1,1585467409.0,,False,negative,negative,negative,negative
fltgrga,Do you carry your passport to more store for Grocery?,3,1,1585472179.0,iamreid23,False,neutral,neutral,neutral,neutral
fltbdft,"May not be, buy does the government issue adhaar cards to Chinese nationals?",4,1,1585465830.0,timmySoComfy,False,neutral,neutral,neutral,neutral
fltfy4s,Lol wat?,1,1,1585471178.0,Thegreatone619,False,neutral,neutral,neutral,neutral
fltlt42,"I just downvoted your comment.
 
# FAQ
 
## What does this mean?
 
The amount of karma (points) on your comment and Reddit account has decreased by one.
 
## Why did you do this?
 
There are several reasons I may deem a comment to be unworthy of positive or neutral karma. These include, but are not limited to:
 
* Rudeness towards other Redditors,
* Spreading incorrect information,
* Sarcasm not correctly flagged with a `/s`.
 
## Am I banned from the Reddit?
 
No - not yet. But you should refrain from making comments like this in the future. Otherwise I will be forced to issue an additional downvote, which may put your commenting and posting privileges in jeopardy.
 
## I don't believe my comment deserved a downvote. Can you un-downvote it?
 
Sure, mistakes happen. But only in exceedingly rare circumstances will I undo a downvote. If you would like to issue an appeal, shoot me a private message explaining what I got wrong. I tend to respond to Reddit PMs within several minutes. Do note, however, that over 99.9% of downvote appeals are rejected, and yours is likely no exception.
 
## How can I prevent this from happening in the future?
 
Accept the downvote and move on. But learn from this mistake: your behavior will not be tolerated on Reddit.com. I will continue to issue downvotes until you improve your conduct. Remember: Reddit is privilege, not a right.",0,1,1585478414.0,proawayyy,False,negative,negative,negative,negative
flt1wxk,"If they’re terrified, they better be at home. This way they won’t trouble fellow citizens because of their ignorance.",12,1,1585456816.0,BesraSangram,False,negative,negative,neutral,negative
fluo8hl,"Wtf are you talking about?
If we are generalising then I can also say you drink cow piss everyday",3,1,1585506599.0,InterimNihilist,False,negative,negative,negative,negative
flt5mrz,"Your lack of education is showing...Hindi is not spoken in the northeast (except in certain areas of Assam). They are students who have been there for a couple of months or years. Northeast people speak English with that accent, I'm sure you have the best accent out of everyone so good job on that",17,1,1585460025.0,klm_wtf,False,neutral,negative,positive,neutral
flt7jve,Do you know you have an Indian accent in your speech when you speak English? How dare you accuse others of being fake when they have accents just as you do. Do you realise that Northeastern people exist with cultural differences that you may have grown up not knowing them or your ignorant mindset doesn't let you accept the difference?,7,1,1585461849.0,bedridden101,1585465674.0,negative,negative,negative,negative
