Comment ID,Comment Text,Comment Score,Comment Depth,Created Timestamp,Author,Edited,Semantic Label,Semantic Label 2,Semantic Label 3,Major_Semantic
flu2apm,"My brother (american) is stuck in siliguri. He tried to leave before the ban on international travel, but flight cancelled. Last week was mobbed by the locals when he went outside, because the media has been spreading the notion that any non native is the reason corona virus is happening in the country. He’s ok for the time being. Just stuck in a hotel room and cannot leave. Embassy and state department aren’t doing too much besides telling him to stay in place. 

I have some friend of friends trying to extract him now. I just wait and see how things work out.",2,0,1585493592.0,,False,negative,negative,negative,negative
flufrsk,"Update - The racist staff have been taken into custody after a FIR was lodged against them

[Source](https://twitter.com/MysuruMemes/status/1244191809758089216?s=19)",2,0,1585501719.0,anandvegaraju,False,negative,negative,negative,negative
flv110t,This is really upsetting. What’s even more shameful is people standing behind in the queue and watching it quietly and no one came to the rescue. This is one of the most educated and professional cities of India,2,0,1585514155.0,linux_devil,False,negative,negative,negative,negative
flt0j1g,These peoples are always racist towards other states,5,0,1585455690.0,,False,negative,negative,negative,negative
flszcqb,"At the start of the video , do I hear “Many Indians are not accepted “?  
While racism is bad I really would like to know the full story behind this .
The placard on the stairs , what do they read ?
Is it a possibility they were not accepted as they dint wear mask ?",5,0,1585454769.0,ViM3,False,negative,negative,negative,negative
fltewv2,"I’m not Indian or anything but from what I’ve seen online lately, India seems to be really struggling. The police are barbaric towards their citizens, people aren’t given practical steps to ensure a safe life during coronavirus, and there seems to be tons of racism, castism, and religious intolerance. Tbh it seems like the country is about to explode with tension.",2,0,1585469918.0,DuckingDuckDude,False,negative,negative,negative,negative
flt0nng,"isn't south supposed to be 'tolerant' according to popular opinion, two horrific cases already in hyderabad now karnataka.. wonder what other migrants would be going through 

until 99% of the country has no idea there are people w mongoloid phenotype native to india, this won't stop, they need more representation in government bodies and popular culture.. when all this is over, we need to some diversity and inclusion sensitization mandatory in schools and colleges",1,0,1585455793.0,,False,negative,negative,negative,negative
flt22oh,Disgraceful.,1,0,1585456945.0,fvh33m,False,negative,negative,negative,negative
flt2aqr,😡,1,0,1585457129.0,keshav174,False,negative,neutral,neutral,neutral
flt2jk7,This is so sad no body is taking a stand for them,1,0,1585457331.0,betterfillgig,False,negative,negative,negative,negative
flt2lgi,ngl this is outrageous,1,0,1585457374.0,FazinHan,False,negative,negative,positive,negative
flt2syg,u/vreddidownload,1,0,1585457548.0,,False,neutral,neutral,neutral,neutral
flt3k2f,Theses racists mother fuckers should definitely die of corona virus,1,0,1585458177.0,,False,negative,negative,negative,negative
flt3uer,Too bad he didn't show us the store's name. Let everybody know these racist assholes.,1,0,1585458422.0,invictus1996,False,negative,negative,negative,negative
flt4kuz,https://twitter.com/MysuruMemes/status/1244107248193789952?s=19,1,0,1585459061.0,Beertard,False,neutral,neutral,neutral,neutral
flt5l98,"I watched another video a few mins ago on some Bangalore based Facebook group. I do not know the whole picture, but it seems like a bunch of MMA guys were taken into police custody for working out on their terrace. There was a guy from Shillong in the group and he was called Coronavirus (the guy taking the video claims it at least).",1,0,1585459987.0,sleepygamer92,False,neutral,neutral,negative,neutral
flt5z1h,I saw this on twitter and there it was saying that as they were not wearing mask so they were not allowed to enter.,1,0,1585460334.0,samikguha,False,negative,negative,negative,negative
flt74r5,This is so not acceptable. WTF is wrong with people such kind of behaviour is inhuman no matter if they are foreigners or indians. It's racism to next level.,1,0,1585461434.0,Cassata_kiwi,False,negative,negative,negative,negative
flt7fdt,"No good deed goes unpunished smh.

[https://nenow.in/north-east-news/nagaland-government-offers-rs-one-crore-flood-hit-kerala.html](https://nenow.in/north-east-news/nagaland-government-offers-rs-one-crore-flood-hit-kerala.html)",1,0,1585461726.0,khebhumsa,False,negative,neutral,negative,negative
flt7lii,This should be reported to police.....,1,0,1585461895.0,slowpop82,False,negative,negative,neutral,negative
flt7otg,"First we saw racism during cyclone and now this. How can people be so shit even during these difficult times? People like these talk about bad western influence, while there own culture is so fucked up",1,0,1585461986.0,Amanitg10,False,negative,negative,negative,negative
flt8iz3,Let's share this and make it go viral. Let's get those racists kicked out,1,0,1585462816.0,sakthlaunda69,False,neutral,positive,negative,neutral
flt9h3y,#fucking inhumans,1,0,1585463793.0,Curositysucks,False,negative,negative,negative,negative
flt9hyo,I don't understand. Why are they not allowed to enter as 'customers' NE or not?,1,0,1585463817.0,dgupta654,False,negative,negative,negative,negative
fltawir,I think calling police would help.,1,0,1585465309.0,int_realm,False,neutral,neutral,neutral,neutral
fltb8fr,"Hi, can anyone share the facebook link?",1,0,1585465676.0,timmySoComfy,False,neutral,neutral,neutral,neutral
fltbb49,"what the fuck is up with this country! it's not just the govt you know, responsible for us still not being developed enough. It's the people. Who refuse to take up new beliefs.",1,0,1585465760.0,ashesofturquoise,False,negative,negative,negative,negative
fltbchj,What the fuck. This makes me so angry. What disgusting discrimination against fellow human beings in this difficult situation? Totally unacceptable.,1,0,1585465800.0,AlexSenAus,1585466010.0,negative,negative,negative,negative
fltbrfu,Morally corrupt society.,1,0,1585466256.0,ThrowAwayGilgamesh,False,negative,negative,negative,negative
fltby1c,u/vredditdownloader,1,0,1585466461.0,blitzebo,False,neutral,neutral,neutral,neutral
fltcjp9,they are doing wrong just stop doing the shut!!!!,1,0,1585467148.0,MAWA0001,False,negative,negative,negative,negative
fltcp35,"We are failing as human beings in these testing times. What the fuck is going on? Children eating grass, people starving and now this. I wish someone buys groceries on their behalf.",1,0,1585467321.0,,False,negative,negative,negative,negative
fltcpg3,Please tweet this to DGP with the store details.,1,0,1585467332.0,helios_csgo,False,neutral,neutral,neutral,neutral
fltd4gz,Why no one helped them?,1,0,1585467814.0,findravish,False,negative,negative,negative,negative
fltemcg,Shithole full of shitcunts,1,0,1585469563.0,,False,negative,negative,negative,negative
fltf1ha,"Racist people don't have hearts, how dare they did such a shameful act.",1,0,1585470074.0,hugeminister,False,negative,negative,negative,negative
fltf5eb,"The employees are pigs, yes, but I'm flabbergasted to see that out of so many people present there, not even one came out to their support. I so wish karma was real.
Not just racist and fascist, but outright inhuman.
And the fact that not much has been done about this situation.
I feel so fucking helpless and frustrated right now.",1,0,1585470208.0,,1585471201.0,negative,negative,negative,negative
fltfh23,"well I tweeted it and got an immediate tweet back from Aditya Birla group that they no longer own More.

So now I retweeted it to the more mega stores account. Lets see whats the reply.
https://twitter.com/Rishav_Sharan/status/1244175674027335680",1,0,1585470608.0,rishav_sharan,False,neutral,neutral,neutral,neutral
fltfx9c,I am really sorry brother. Day by day my faith in humanity lessens.,1,0,1585471150.0,HungrySennin,False,negative,negative,negative,negative
fltgbj8,Chutiye desi. I feel as if we Indians are the biggest racial discriminatory bigots.,1,0,1585471638.0,mamasilver,False,negative,negative,negative,negative
fltgi0c,The north east states have cases in fucking single digits. I think the total is like 2. The stupid fuckidity of  Indian people sometimes is beyond me.,1,0,1585471855.0,EverydayGravitas,False,negative,negative,negative,negative
fltgllv,Reminds me how an Indian guy called us all racist in class. When we were just chilling talking about stuff. And I’m married to someone from gujrat. LOL guess I’m too white.,1,0,1585471976.0,blairthebear,False,negative,negative,negative,negative
fltgoin,"Racism between own caste (sub-caste), by colour, between religion, between ethnicity, between state .. fking hell. Shameful that none of the other customers defended our own people.",1,0,1585472075.0,StannisSAS,False,negative,negative,negative,negative
flth9yq,"It's saddening but ironic that this isn't the first time they receive such hatred[Not surprised, way of life, say those from northeast over racist ‘corona’ attacks

](https://theprint.in/india/not-surprised-way-of-life-say-those-from-northeast-over-racist-corona-attacks/390673/)",1,0,1585472823.0,JyotsnaKumar_71,False,negative,negative,negative,negative
flthgc5,"I used to attending college (Srishti) in Bangalore, saw a lot of NE and African students around. Though the locals didn't say much; you could sense the racism almost everywhere.",1,0,1585473047.0,tanaysharma97,False,negative,negative,negative,negative
flthvev,Maaaad fucked up,1,0,1585473564.0,jakeperalta85,False,negative,negative,negative,negative
flthw4y,"Guys action has been taken. FIR has been lodged and the manager and the staff at the outlet have been taken into custody. 

Source - https://twitter.com/rohini_swamy/status/1244179427317047298?s=21",1,0,1585473587.0,sidbansal92,False,neutral,neutral,neutral,neutral
flti6ni,Are foreign nationals not allowed in a supermarket? This is pure racism. Police complaint must be filed against the store.,1,0,1585473945.0,partha51612,False,negative,negative,negative,negative
fltikwm,"Not an Indian, what exactly is an adhaar card?",1,0,1585474427.0,BigPappaFrank,False,neutral,neutral,neutral,neutral
fltiw72,This case is happening regularly. This shouldn't be done in the present situation. NE people always have to suffer this situation every where,1,0,1585474816.0,sangamduarah,False,negative,negative,negative,negative
fltl50g,"This is so wrong, these ""MORE"" staffs need to be suspended for such an act or their manager should held responsible such a stupidity",1,0,1585477605.0,aadirulez8,False,negative,negative,negative,negative
fltlbpr,"Well, they are damn stupid people, they don't even understand English, they got no clue of your English lecture.",1,0,1585477829.0,Mate_Bingo,False,negative,negative,negative,negative
fltlck7,/u/vredditdownloader,1,0,1585477859.0,AmulyaG,False,neutral,neutral,neutral,neutral
fltlp7c,Morons,1,0,1585478283.0,Sudroy,False,negative,negative,negative,negative
fltmh75,r/PublicFreakout,1,0,1585479210.0,sophisticated_meh,False,neutral,neutral,negative,neutral
fltmohs,I don't get it? Why would a store staff care if a foreigner or an Indian wants to buy something? What's the logic? Do they want the foreigners to not buy anything so that more is left for Indians? Seems to me they're just finding excuses to justify their discrimination.,1,0,1585479457.0,golu1337,False,negative,negative,negative,negative
fltmqnq,"Thanks, we need more people like you all in India. We should all join hands to combat racism and any kinds of inequalities happening in our day to day life. Not just in Karnataka but everywhere and in NE as well.",1,0,1585479530.0,bitsmaster,False,positive,positive,neutral,positive
flto4t4,How do I save the video to my phone?,1,0,1585481179.0,pranatichitti,False,neutral,neutral,neutral,neutral
flto88i,u/Vredditdownloader,1,0,1585481290.0,,False,neutral,neutral,neutral,neutral
fltt8iu,"That's same on our society , even no one atleast raised a voice for this fellow . North east people are mostly peaceful and quiet and they really shows respect when we people visit to hill station . That's same for our society .",1,0,1585486478.0,Mainaksonu,False,neutral,neutral,neutral,neutral
fltu0c2,This is crazy !,1,0,1585487182.0,,False,neutral,neutral,negative,neutral
fltuiqo,Saddest thing i saw on the internet today,1,0,1585487636.0,NinjaOnline1994,False,negative,negative,negative,negative
fltw3gu,classic more,1,0,1585488974.0,,False,positive,neutral,positive,positive
fltxqgg,Hit that upvote to END RACISM,1,0,1585490341.0,branflakes14,False,neutral,neutral,neutral,neutral
fltytxi,"Disgusting people. Even if these workers were ignorant, the Store Manager should be held responsible . He should be booked & jailed for this inhuman behaviour to our fellow Indians. 😡😠",1,0,1585491171.0,vforvipul,False,negative,negative,negative,negative
flu04pf,It is high time that we stand with the Northeast people as I consider them as Indians as they have every rights which are given to them as we rest of India as first of all it is time to delete racism in our society and everywhere that is it.,1,0,1585492109.0,CVAnkurSuresh,False,neutral,neutral,negative,neutral
flu06aq,Well I did see facemask and even gloves on every one else in line. Butttttt that winy guy up at the door yelling dint have it one,1,0,1585492140.0,ericjk1,False,neutral,negative,neutral,neutral
flu0e6m,These guys away from their families have to face this all so sad,1,0,1585492294.0,Stifmeister11,False,negative,negative,negative,negative
flu60w2,Uneducated Cunts,1,0,1585495988.0,DisgustingLogic,False,negative,negative,negative,negative
flu7gv9,Fuck that..walk in & just take the shit at this point.,1,0,1585496876.0,Base5ive,False,negative,negative,negative,negative
flu8lhx,More is owned by Amazon,1,0,1585497555.0,jai1611,False,neutral,neutral,neutral,neutral
flu9d8o,"The irony is the number of cases in the NE vs Karnataka.

Racism should become a criminal offence",1,0,1585498021.0,Djang0Unchained,False,negative,negative,negative,negative
fluehj6,Nothing to see here because only white people can be racist.,1,0,1585500993.0,LimeSugar,False,negative,negative,negative,negative
flug6p8,Seriously. Wtf.,1,0,1585501954.0,jioooppp,False,negative,negative,negative,negative
flugnex,Fuk this is shit man,1,0,1585502218.0,catblack8008,False,negative,negative,negative,negative
flut5i2,Action should be taken against this retail shop. I think it's a MORE outlet. Shameful!,1,0,1585509503.0,amanbindra10,False,negative,negative,negative,negative
fluvop4,"Whatever, more ppl in india eat dogs than people who drink cow piss. But anyways. Carry on with ur fool solidarity",1,0,1585511012.0,casziopeia,False,negative,negative,negative,negative
flvf647,"Desperate times, desperate measures",1,0,1585522515.0,naumank47,False,negative,neutral,negative,negative
flvpfgw,"After having lived in and travelled around Karnataka, I still consider it one of the most racist states in India. It's really disheartnening because you have all this rich history and great peopleyet also this disgusting mindset that all people who look even a little bit 'north eastern' are not Indians.
I put that in quotes because not all people who look north eastern are from the NE. It's just generally easier to explain.",1,0,1585529011.0,,False,negative,negative,negative,negative
flvz6gu,"Made a video explaining how this is wrong. [Stop racism against North-east Indians (YouTube)](https://youtu.be/vjUrjnhbzJE). I’m not sure how much this will help, but yeah. It has subtitles as well, so can be shared with non-Kannada-speaking people as well. I’ve not gone deep into racism, because … let’s take it step by step.",1,0,1585535615.0,iamramiyer,False,negative,neutral,negative,negative
flw0suv,its not good.,1,0,1585536747.0,bbaspring,False,negative,negative,negative,negative
flw210q,"r/JusticeServed
https://www.thehindu.com/news/national/karnataka/mysuru-supermarket-staff-arrested-for-refusing-entry-to-students-from-northeast/article31198143.ece",1,0,1585537626.0,1gopal23,False,neutral,neutral,negative,neutral
flx47i8,"Shame on More Store, boycott MORE Stores!",1,0,1585574683.0,Azqaadesigns,False,negative,negative,negative,negative
fm6fqhf,"First INDIANs Should Fight against PORNBAN a BASIC FIGHT.

Then They can PICK On HIGHER LEVEL FIGHTs like RACISM.",1,0,1585793054.0,Hell5x5x,False,negative,negative,negative,negative
fmh1so5,https://www.indiatoday.in/amp/india/story/rajasthan-doctor-refuses-to-admit-pregnant-woman-because-she-s-muslim-her-child-dies-after-delivery-1663352-2020-04-04 and also this..,1,0,1586064037.0,,False,neutral,negative,negative,negative
fmhierl,[deleted],1,0,1586081437.0,,False,neutral,neutral,negative,neutral
fmvi26n,RIP Kiren Rijiju,1,0,1586417739.0,ledepression,False,neutral,neutral,negative,neutral
g66qqgb,"I know this happens all the time . There are few NE students  in my area and one day I saw a gal (wearing shorts )and a dude buying groceries. I was with my mom and an auntie and the auntie starting blabbering how shameless these people are,going around with her boyfriend and whatnot .
So I kindly told her off saying that she doesn't know if it is her bf or brother and even if he was her bf,so what?
As for shorts , I wear them all the time in summers and so does your own daughter, so are you implying I am shameless too ?
It is so sad that we have to constantly remind people to treat their own people respectfully and not call them chinki-Chinese. 
I  have smaller  eyes then average people and even though I am not from NE , I got called names 
Says a lot about where we are going as a society",1,0,1600750780.0,wayletter,False,negative,neutral,negative,negative
flt2sl9,u/vredditdownloader,1,0,1585457540.0,,False,neutral,neutral,neutral,neutral
flt6dnq,"This is just heartbreaking, why are we so horrible to each other in times of such adversity",1,0,1585460714.0,kurithesheep,False,negative,negative,negative,negative
flt9bql,[deleted],1,0,1585463637.0,,False,neutral,neutral,negative,neutral
flsxfwj,Sorry but what does NE mean?,-4,0,1585453303.0,IOnceMetYourMom,False,neutral,negative,negative,negative
fltlq0x,The Uttar Pradesh of South India,0,0,1585478311.0,,False,neutral,neutral,neutral,neutral
flsxxv6,"Not saying they're not racist, but can it be possible that they were not allowed because they're not wearing mask? 

Shops here don't want to serve people who don't wear masks and don't practice social distancing.",-11,0,1585453681.0,manelrameshnayak,False,negative,negative,negative,negative
fltehea,"People saying that the bystanders are as bad as the guards, I agree. But there is this thing called the bystander effect. 

Most of us if we were in the situation, wouldn’t have helped too. We might think “omg this is so fucked” but we wouldn’t have helped. So stop with the moral superiority.",0,0,1585469403.0,MrRabbit7,False,negative,negative,negative,negative
flu4xvo,Woah woah woah....i thought only white people could be racist?,0,0,1585495309.0,xSandwichesforallx,False,negative,negative,negative,negative
fltxdle,Bcoz they're not wearing masks,-1,0,1585490055.0,,False,negative,neutral,neutral,neutral
flszxhb,[deleted],-9,0,1585455216.0,,False,neutral,neutral,negative,neutral
flt8gat,Just to play the devils advocate aadhar card is not the proof of citizenship.,-9,0,1585462741.0,jaskirat0105,False,negative,negative,negative,negative
fltdgca,why tf they want to be indian so bad.,-14,0,1585468197.0,Kemosahbe,False,negative,negative,negative,negative
fltpwnp,South Indians are so ignorant.,-4,0,1585483147.0,iamtrying_hard03,False,negative,negative,negative,negative
flt0vtg,"India has a mixed races, we find extremes of all. Try to see deeper than regular depths than ranting racist comments. We are all terrified now, probably the people maintaining the super market are more terrified because it puts them in risk also the visitors. Give it time.

Edit: https://i.redd.it/5zhmoad2oep41.jpg , she is a phd. Here we are talking about an uneducated working class employee. You can downvote. Doesn’t matter to me. Trying to elevate the pressured behaviour than the normal behaviour.",-17,0,1585455977.0,rusty_matador_van,1585459288.0,negative,negative,negative,negative
fltaqfd,STOP OXYGEN,-2,0,1585465128.0,Buns4Funz,False,negative,negative,negative,negative
fluki0i,[deleted],-8,0,1585504434.0,,False,neutral,neutral,negative,neutral
fltgwal,"Huh? He's not wearing a mask, gloves or anything. Looks like chinese, can't speak Hindi or any other regional language.

I would not have let him in either. Rather not take any risks.",-10,0,1585472348.0,,False,negative,negative,neutral,negative
flte64u,Issue was MAYBE absence of masks.,-4,0,1585469032.0,Right_Sin,False,neutral,negative,neutral,neutral
flt5117,[removed],-26,0,1585459462.0,,1585484109.0,neutral,neutral,negative,neutral
fltbzd0,"So after seeing this, I spoke to my sister-in-law who works in the corporate management of More Stores. She said one of these guys had a stamp on his hand that had been put at the airport indicating he was suspected of having covid-19 and should have been in self isolation. She also said the other guy wasn't following the distancing regulations the store had in place. She said they studied the cctv fottage to confirm this. 
The store is going to put out a statement on this incident as well soon.",-6,0,1585466501.0,Arj_toast,False,neutral,neutral,negative,neutral
fltbzou,"So after seeing this, I spoke to my sister-in-law who works in the corporate management of More Stores. She said one of these guys had a stamp on his hand that had been put at the airport indicating he was suspected of having covid-19 and should have been in self isolation. She also said the other guy wasn't following the distancing regulations the store had in place. She said they studied the cctv fottage to confirm this. 
The store is going to put out a statement on this incident as well soon.

Edit: Just also wanted to add I don't condone the ""not video"" and the aggressive behaviour of the other clerk at the end, that was not the way to handle the situation.",-4,0,1585466512.0,Arj_toast,1585466696.0,negative,neutral,negative,negative
fltcera,"Yaar bahut aasaaan tarika hi hindi aur thoda gali seeekh lo. Jaaa ke english peloge to bichara gareeb shayad padha likha bhi nai higa wo tumko kya bolega.... 


Jab jan rhe ho aisa hota hi pta nai tum log hindi aur gali kyun nai bhangte ho. 

Oh sorry i think you didnt understand hindi so let me tell you in english as well...


Try to use hindi and use allowable slang language and that to in limit and respect... 

As may me the person infront of you might not be e
Well educated and never seen people like indian like this. As he may me local and illetrate. 
.pls dont get offended to my reply but it is 100percent working use hi gmdi and that too in indian acccent....",-4,0,1585466990.0,omprakashkorba,False,neutral,neutral,negative,neutral
flsztsw,"People are scared after seeing videos of Chinese folks spitting or sneezing on open produce in multiple countries.

These kids can easily get their produce by asking someone else to buy for them.",-34,0,1585455136.0,Yum_T,False,negative,negative,negative,negative
flt07ob,[deleted],-23,0,1585455439.0,,False,neutral,neutral,negative,neutral
flt86pg,Exactly. So many people in line and not saying anything or defending another human being. Fuck!,71,1,1585462476.0,iamarunr,False,negative,negative,negative,negative
flt3mlp,I would have offered at least to go get the items he needs for him.,101,1,1585458238.0,jp_lolo,False,neutral,neutral,neutral,neutral
fltl8qn,"Exactly my thoughts on first seeing this. There will be a couple of morons but to see ppl just standing there like fucking zombies, father and son .. what the hell is the father teachin the kid",24,1,1585477728.0,senor_po,False,negative,negative,negative,negative
fluwoen,[Legal action was taken against the store employees](https://www.news18.com/news/india/northeast-students-denied-entry-at-mysore-supermarket-case-registered-against-outlets-manager-staff-2556131.html),19,1,1585511602.0,MisterDecember,False,neutral,negative,negative,negative
flulmqz,I’m not sure but this place looks VERY SIMILAR to a ‘More’ store in mangalore. I’m from mangalore and this places looks very very similar. Yes the stores name is ‘more’. The stairs and the area nearby looks similar.,7,1,1585505090.0,nabeel242424,False,neutral,neutral,neutral,neutral
flu7brn,Why can’t they get groceries? Because they don’t have masks?,1,1,1585496791.0,holdmyomg,False,negative,negative,neutral,negative
flt3h9c,Any possibility of lodging an FIR?,62,1,1585458112.0,Ginger_Bulb,False,neutral,neutral,neutral,neutral
flt1wjm,"If you find a way to reach out to them, let them know they are one of us, one with us.

So sorry they experienced this fucking ignorant bullshit.",67,1,1585456808.0,nomad80,False,negative,negative,negative,negative
flt4l2s,Help them out bro,17,1,1585459066.0,mcrniceni,False,neutral,neutral,neutral,neutral
fltnx1q,"If they’re from your college, ask them to drop me a message. I want to give these shopkeepers a mouthful.

Edit: /u/notanothervoice shared: https://www.livemint.com/news/india/covid-19-people-from-northeast-face-discrimination-in-karnataka-11585479540806.html",14,1,1585480926.0,iamramiyer,1585483465.0,neutral,neutral,negative,neutral
flu05nf,Nie college?,1,1,1585492127.0,ash12345678910111213,False,neutral,neutral,neutral,neutral
