Comment ID,Comment Text,Comment Score,Comment Depth,Created Timestamp,Author,Edited,Semantic Label,Semantic Label 2,Semantic Label 3,Major_Semantic
fltwl46,"Speak in HINDI...or some language they understand!!!
And WTF is that fake ACCENT???",-2,2,1585489364.0,mayurthakor,False,negative,negative,negative,negative
flt9mxd,[removed],-9,2,1585463959.0,,False,neutral,neutral,negative,neutral
fltasuf,"Think rationally with a calm mind. Everyone cannot differentiate a Chinese from a Korean or a Vietnamese or a Japanese or a Nepalese or a North East Indian. 

Every situation is not resolved with a fight. Sometimes calm rational approach solves problems better than screaming and fighting.",-8,2,1585465201.0,Yum_T,False,negative,negative,neutral,negative
flt6z4u,"Not Banglore, they're from mysore, studying in NIE",3,2,1585461282.0,blerp_2305,False,neutral,neutral,neutral,neutral
flteyg8,"> the video of the Chinese woman in the store coughing on products, 

link ?",1,2,1585469970.0,Kemosahbe,False,neutral,negative,negative,negative
fltr5bk,"I'm sure the people waiting to purchase from such a big store know English, come on now.",2,3,1585484452.0,,False,neutral,neutral,neutral,neutral
fltirkl,Its not a matter of English. Anyone with some common sense can understand the situation. They are all passive cucks.,0,3,1585474655.0,Stone_hyena,False,negative,negative,neutral,negative
flv2plh,He has a mask in his hand. He may have removed to let them check that he is Indian.,3,3,1585515136.0,slamdunk6662003,False,neutral,neutral,neutral,neutral
fm38x0r,WELL FUCKING SAID,0,3,1585716032.0,AshrafAli77,False,positive,negative,negative,negative
fltnuqi,"Article 15. 🙂

I’m no lawyer, though. SC/ST Prevention of Atrocities Act can also be looped in, but these guys would have to prove they are either SC or ST. But Article 15 should work in all cases. And that should probably do to teach them a lesson.",11,3,1585480850.0,iamramiyer,1585481268.0,neutral,neutral,neutral,neutral
fltb36s,SC/ST act maybe?,14,3,1585465513.0,k3times,False,neutral,neutral,neutral,neutral
fltev8o,"it's soon going to be ""Less""",82,3,1585469862.0,amrit-9037,False,neutral,neutral,neutral,neutral
fltecz6,"Birla group sold off the More chain I believe

Edit: found below. https://www.reddit.com/r/india/comments/fqymfj/_/flt0q5c",32,3,1585469258.0,chargingtriceratops,False,neutral,neutral,negative,neutral
fltdh5k,[removed],1,3,1585468224.0,,False,neutral,neutral,negative,neutral
flutbpz,"I knew it! The moment I saw it, I realised it's that store. We've got a decent chunk of NE student in our college nearby and tbh this is just painful to watch.",1,3,1585509608.0,addak01,False,negative,negative,neutral,negative
fltnpj4,"Edit: [here](https://twitter.com/CPMysuru/status/1244184723636629505?s=20)

Edit 2: Don't know why it's showing as unavailable while it's there on the Mysore police Twitter [Handle](https://twitter.com/CPMysuru?s=20)

Edit 3: [Trying again](https://twitter.com/CPMysuru/status/1244184723636629505?s=19)",12,3,1585480681.0,,1585481206.0,neutral,neutral,neutral,neutral
fltr0kn,https://twitter.com/CPMysuru/status/1244184723636629505,5,3,1585484314.0,Beertard,False,neutral,neutral,neutral,neutral
fltmkx7,Karnataka BJP social media accounts spew enough hatred.,-4,3,1585479336.0,munna_jazbaati,False,negative,negative,negative,negative
flt8xsq,"Quite the opposite. A typical Indian isn't an ideal human being filled with good morals from Amar chitra Katha, a typical Indian is ignorant, bigoted and lacks empathy",150,3,1585463235.0,penguin_chacha,False,negative,negative,negative,negative
fltq4zj,[deleted],2,3,1585483398.0,,False,neutral,neutral,negative,neutral
flt6rfa,Same here in Sikkim. The daily wage earners are being taken care of by the govt and civil society but they are mentally distressed and want to go back to their families.,21,3,1585461077.0,khebhumsa,False,negative,negative,negative,negative
fltt6ag,[removed],1,3,1585486421.0,,False,neutral,neutral,negative,neutral
flt9yzg,Who hurt you Dude?,3,3,1585464308.0,,False,negative,negative,negative,negative
flt1wf4,Angry about the racism. Its gotta stop,29,3,1585456806.0,whocoulditbe__,False,negative,negative,negative,negative
fm1qu5v,There are atleast Hindi and English billboards here. Most people in the North treat even English speakers like shit.,1,3,1585683359.0,sanvin777,False,negative,negative,negative,negative
flt26xf,[deleted],-33,3,1585457042.0,,False,neutral,neutral,negative,neutral
fltfww2,Never go full retard. You don't buy that? Ask Sean Pen!!,3,3,1585471138.0,,1585574039.0,negative,negative,negative,negative
flt530o,👏,7,3,1585459512.0,sharan480,False,positive,neutral,neutral,neutral
flz01ia,"[Source for those curious](https://abcnews.go.com/US/black-man-sues-detroit-bank-alleging-racial-discrimination/story?id=68484056) 

I don’t believe the second suit has been settled yet but yeah, that did happen to the dude. Can’t believe a bank can act like such idiots. If they thought it looked unusual for the account history, all they had to do is accept the cheque and hold funds for 7 business days before making funds available. If it turns out to be a bad cheque, investigate whether it was deposited in bad faith, decide whether to close the account, and report it to the credit bureaus and so on.

Calling the police is such a WTF way to handle it.",1,3,1585612620.0,nummakayne,False,neutral,negative,negative,negative
fltr1sp,You equally wonderful human. I can read well.,-2,3,1585484350.0,KILLAQWUEEN,False,positive,positive,positive,positive
flu93xf,What?,1,3,1585497866.0,KILLAQWUEEN,False,neutral,neutral,neutral,neutral
fltkaox,"What??? 

And I say this as a North East Native.",4,3,1585476559.0,Fuido_gawker,False,negative,negative,neutral,negative
flt0obk,I suppose but I have seen more cowardice than bravery in all my life by my middle class brethren.,6,3,1585455807.0,notanothervoice,False,negative,negative,negative,negative
flt1oic,"What they meant is that if me or you or them were the audience in this case, we probably wouldn't have done anything either. The majority of middle class folks would just go about minding their own business (especially during this time).",25,3,1585456627.0,drax-tic,False,neutral,neutral,neutral,neutral
flt6sx7,"If you earn around ₹50,000 per month it puts you in top 1% of the population, what makes you think you’re middle class in India?",0,3,1585461116.0,I_can_believe_that,False,neutral,neutral,positive,neutral
flt1d8p,Hit too close to home?,-3,3,1585456372.0,notanothervoice,False,neutral,neutral,negative,neutral
flt148u,"> calling a super market store worker middle class is a stretch

Comprehension skills don't seem to be your forte, regardless, I'll explain like you are 5. I am calling out the public just looking at the men being discriminated so blatantly and not the asshole who is discriminating.",6,3,1585456169.0,notanothervoice,False,negative,negative,negative,negative
fltl7ht,"Speak for yourself buddy. 

There are millions out there who stand up for each other because it's the right thing to do.

You do you though. Be selfish. Wouldn't want to be barred from a single store in the whole city. That sacrifice would be too much.",1,3,1585477687.0,notanothervoice,False,neutral,positive,neutral,neutral
flu7q5x,Ok bro lol bro ok bro lol.,1,3,1585497032.0,notanothervoice,False,neutral,neutral,neutral,neutral
flt8asq,Top contribution. Thanks for playing. Take your return gift while heading out.,1,3,1585462590.0,notanothervoice,False,positive,positive,positive,positive
fltobf8,"LOL yeah, there they’ll use the “right to admission” clause that protects private property.",1,3,1585481391.0,iamramiyer,False,neutral,neutral,neutral,neutral
fltn2l8,"Do you think, those people working in that shop are so well-educated or well-informed? Or are you simply dumb?",0,3,1585479926.0,mubukugrappa,False,negative,negative,neutral,negative
fltpgiz,"Wow, now that’s a surprise. How did you get to know?  Could you post a link, perhaps?",-1,3,1585482667.0,iamramiyer,False,positive,positive,neutral,positive
flu7aew,Edited,1,3,1585496769.0,,False,neutral,neutral,neutral,neutral
flt7ta5,I hope to hell you are right. They definitely should seek out the Police for help.,6,3,1585462106.0,invictus1996,False,negative,negative,positive,negative
flts78f,As a North - Indian who lived in assam. People are far more tolerant and non-judgmental.,2,3,1585485497.0,WANDERLS7,False,positive,positive,negative,positive
flt7g6g,"I never questioned the number of people form Bihar in Assam. No borders will stop people from Bihar from searching for livelihood, similar to Bangladeshi who cross into Assam for the same. 

Oh and I am sure there is a large population in Assam similar to how there is a large population in Mumbai as well. 
The question is how they are treated as in whether locals embrace them versus question their identity towards eventually belonging to that state.",3,3,1585461748.0,coldcoldnovemberrain,False,neutral,neutral,positive,neutral
fltrzya,Well we all know how you treated  the Bengali population in the North East.,0,3,1585485304.0,chalkrow,False,negative,negative,neutral,negative
fltf5ml,"do YOU do that ? show aadhar cards to grocery store ?

When they do that they put themselves in a lower position, a vulnerable position.",0,3,1585470216.0,Kemosahbe,False,negative,negative,negative,negative
fltoyey,I feel that Indians should not take proud in being a diverse heritage if they couldn't stand people from other provinces,2,3,1585482114.0,,False,negative,negative,neutral,negative
fluajfh,"Sorry man, I will remove the comment",2,3,1585498724.0,,False,negative,negative,negative,negative
flt0up8,"> of this country despite all the reservation and benefits from Central Government. These people are a liability to the country.

Showing our true colors now are we? Do you think people will have any iota of sympathy for your family after this statement? Way to go Mr. CEO of Bigotry.",8,3,1585455952.0,indi_n0rd,False,negative,negative,negative,negative
fltb8s4,What are you even trying to say? They didn’t let them inside even though it is their right to,7,3,1585465686.0,,False,negative,negative,neutral,negative
fltbgma,So basically you’re racist. Got it.,5,3,1585465928.0,,False,negative,negative,negative,negative
fltblkh,They showed their Aadhar card. It’s right there in the title. Please stop trying to defend racism,8,3,1585466079.0,,False,neutral,negative,negative,negative
fltf1at,"Even if they were Chinese that shouldn't mean they can't be let in, the entire 1 billion Chinese people didn't carry the virus",2,3,1585470068.0,Dankjets911,False,neutral,negative,negative,negative
fltsndw,People who don't english will be too poor to go into the store?,-3,4,1585485929.0,,False,negative,negative,negative,negative
flwpbib,"Check that he's Indian inside his mouth? You people are something else. 

Clearly this guy in the video is a fucking tool if he's removing his mask while talking to someone at close distances. 

I support discrimination against stupid people.",1,4,1585559657.0,MichaelScottOfReddit,False,negative,negative,negative,negative
fs08yrr,"Article 15 include everyone
SCST act is different",1,4,1590605598.0,I_am_not_here_got_it,False,neutral,neutral,neutral,neutral
fltfh5c,[deleted],5,4,1585470611.0,,False,neutral,neutral,negative,neutral
flu56th,"This is gonna ruin the life of the other party. Educate them, don't destroy lives.",3,4,1585495467.0,ettumahahanjaanna,False,negative,negative,negative,negative
fltot9m,"KOLKATA | MUMBAI: The Aditya Birla Group is selling supermarket chain More to Witzig Advisory Services, owned by Samara Alternative Investment Fund, in a deal that will eventually see Amazon picking up a 49% stake, according to people with knowledge of the matter.Sep 20, 2018
https://m.economictimes.com › ...
Samara-Amazon acquires Kumar Mangalam Birla's More retail chain",11,4,1585481956.0,MrAvidReader,False,neutral,neutral,neutral,neutral
fltdh7q,"Hi paranoidspook. It looks like your comment to /r/india was removed because you have been using a link shortener. Due to issues with spam and malware we do not allow shortened links on this subreddit. Feel free to re-submit using the full URL.

*I am a bot, and this action was performed automatically. Please [contact the moderators of this subreddit](/message/compose/?to=/r/india) if you have any questions or concerns.*",0,4,1585468226.0,AutoModerator,False,negative,neutral,negative,negative
fltqsgq,All 3 tweets unavailable.,0,4,1585484081.0,rohithkumarsp,False,negative,negative,neutral,negative
fltmlp6,True but no need to give that asshole statewide importance,1,4,1585479364.0,BadAssKnight,False,negative,negative,positive,negative
flt94r6,You have me there my friend. Nothing spots us from discriminating within the same state as well.,30,4,1585463436.0,MrAvidReader,1585482099.0,neutral,neutral,positive,neutral
flttlq1,True,2,4,1585486817.0,ajatshatru,False,positive,neutral,positive,positive
fltvfi8,honestly never thought this was even an issue untill left my State (I'm from UP).,2,4,1585488414.0,uzer4vedi,False,negative,negative,negative,negative
flu7t9h,"To take it a step further, replace Indian with Person.",2,4,1585497083.0,StillNotAClassAct,False,neutral,neutral,positive,neutral
fs094k2,Amar Chitra Katha was a bad example. Read about its criticism,1,4,1590605675.0,I_am_not_here_got_it,False,negative,negative,negative,negative
fltsoxe,Word.,0,4,1585485970.0,Silverpool2018,False,neutral,neutral,positive,neutral
fltsx6o,I was a kid and the manipuri students were living in a pg next to our home.,5,4,1585486188.0,i_Killed_Reddit,False,neutral,neutral,neutral,neutral
fltt6b5,"Hi tetea_t. It looks like your comment to /r/india was removed because you have been using a link shortener. Due to issues with spam and malware we do not allow shortened links on this subreddit. Feel free to re-submit using the full URL.

*I am a bot, and this action was performed automatically. Please [contact the moderators of this subreddit](/message/compose/?to=/r/india) if you have any questions or concerns.*",1,4,1585486422.0,AutoModerator,False,negative,neutral,negative,negative
flta36j,[deleted],-3,4,1585464429.0,,False,neutral,neutral,negative,neutral
flt1xfg,I agree.,7,4,1585456827.0,,False,neutral,positive,positive,positive
flt62iy,"I had some choice words but now's not the time, I understand your biases and experiences have probably led you down this path. 


I'd strongly suggest you educate yourself on this matter (the virus and people from NE in general). They're just like us, they have their own traditions locally but they identify as Indians, pushing them away like this doesn't do anyone any good. 


Please look into this and read about it, life's too short to be bigoted. 
Hope you and your family are safe. Take care.",12,4,1585460426.0,MarijuanaBiryani,False,negative,neutral,negative,negative
flt9pq2,You sad fucking piece of shit. Just because you're a shameless racist doesn't mean everyone is.,8,4,1585464040.0,Xanian123,False,negative,negative,negative,negative
flt3iy9,"I’m not the guy above. But yes, I can.",13,4,1585458151.0,SanskariBoy,False,neutral,positive,neutral,neutral
flt6swz,This just shows how you have never interacted with a person from NE. And that is just sad.,6,4,1585461116.0,ck_14,False,negative,negative,negative,negative
flt50vh,"Yes I can. And you should really stop justifying yourself now. You're in a hole, stop digging.",7,4,1585459458.0,Hawaichar,False,negative,negative,neutral,negative
flu02jq,"Even if there's no difference, does it really matter? Chinese or Pakistani or Indian, we're all human beings. Please stop treating people differently based on how they look or what gender they are or what caste/race they belong to :(",2,4,1585492068.0,Arkrothe,False,negative,negative,negative,negative
flts0o8,"And I’d also like to point out that being an NRI, there are a bunch of racist ass NRIs who act entitled in foreign countries and expect equal privilege while denigrating locals. The racism is not confined to the borders of the country. The point was nobody should be racist, and it’s hypocritical to demand something without adhering to it ourselves, as a people.",3,4,1585485324.0,,False,negative,negative,negative,negative
fltrvd0,"I was frustrated otherwise, I do apologise mate. Have a nice evening, sorry!",2,4,1585485179.0,,False,neutral,negative,negative,negative
flt13z2,"Ah, I get it. I just replied because I've been seeing some hate towards the middle class in the past few days. Who is really middle class? Does no one in the sub consider themselves middle class?",1,4,1585456162.0,drax-tic,False,negative,negative,negative,negative
flt1yj3,"Oh so if you were poor or rich you would? Come on. This is so stupid. Having this argument is already making me feel stupid. I mean how could you possibly generalise middle class or poor or rich when it comes to standing up for someone!? If you wanted to, you would. And if you didn’t, you wouldn’t. I mean where in this simple logic does class find It’s way into the picture?",26,4,1585456852.0,,False,negative,negative,negative,negative
flt1mcd,"so you’re implying you’re rich? And that makes you a brave, courageous human unlike people who have less money? shame on you. You’re freaking educated on top of it, and continue to be racist. Yeah, this is racism. You’re discriminating based on class. Next, you might just start with caste/colour/looks. You’re basically the security guy from the video",6,4,1585456579.0,,False,negative,negative,negative,negative
flt1gxi,[deleted],7,4,1585456456.0,,1591285794.0,neutral,neutral,negative,neutral
fltlpax,"Gaslight all you want buddy, doesn't change anything here nor is it going to in the real world.

Your reality and mine are not the same and neither is it for everyone else. If it was, we'd be living in a perfect society.",2,4,1585478286.0,Cynaren,1585478654.0,negative,neutral,positive,neutral
flt8w3b,"Nah. You don't tell me what to do. Even if I did hurt your little ego, I don't accept return gifts from people with superiority complex. Your sorry ass can fuck itself in pride.",2,4,1585463186.0,Saloni_123,False,negative,negative,negative,negative
flto2hq,"Well, time to educate them.",1,4,1585481102.0,iamramiyer,False,neutral,neutral,neutral,neutral
flvj4u0,People have to be well-educated to be racist? What are you smoking,1,4,1585524939.0,tetrarkanoid,False,negative,negative,negative,negative
fltpq94,"https://www.livemint.com/news/india/covid-19-people-from-northeast-face-discrimination-in-karnataka-11585479540806.html

There you go.",5,4,1585482954.0,notanothervoice,False,neutral,neutral,negative,neutral
flt7pkh,If we had not embraced them then there was not a chance of large population. Did any person from bihar told you that we did not allow them to buy veggies or anything at all? Do you have any proof of any bihari person getting tortured for their caste in assam? The person from whom I buy smoke is a bihari. My favourite shop for chai pakora also belongs to a bihari person. I always call him dada( big brother in assamese). They also always treated me well. I could also provide you proof if you need any.,1,4,1585462006.0,,False,neutral,neutral,neutral,neutral
fltfhhq,They did that cuz the employees were accusing them of not being Indian citizens. A simply proof to show them they're wrong isn't bad imo,3,4,1585470623.0,blerp_2305,False,negative,neutral,negative,negative
flt1aah,"""These people"" ah well.",6,4,1585456305.0,roadtotitties,False,negative,negative,neutral,negative
flticzd,"Not saying its not their right. Was trying to explain that At this kind of crisis times more mistakes will happen, lets not politicize for the sake of bigger things, focus on what is important and save these kind of head lines out of social media.",0,4,1585474161.0,rusty_matador_van,False,negative,negative,negative,negative
fltcay0,A lot of people in India believe aadhar card can be faked. So unless the store has a way to authenticate the aadhar card showing it is not going to help them.,-6,4,1585466866.0,Indin_Dude,False,negative,negative,negative,negative
fltt32r,I'm speaking practically most people shopping there will know English. Now you can extrapolate this however you like because i have a feeling you are not commenting in good faith.,5,5,1585486340.0,,False,neutral,negative,positive,neutral
flugcxg,"Article 14 and 15(Right to Equality and Right Against Discrimination) is only applicable against the Government or Institutions that can be broadly classified as government controlled. If a private person/corporation refuses to let you into his house, his restaurant or his shop, you can't do much. Unless you're an SC/ST and while denying entry he used casteist slurs. If he simply denied entry without citing any reason or calling you Chinese/Alien etc, you can't do much.",2,5,1585502053.0,emrys11,False,negative,negative,negative,negative
flv41x9,"He knows its wrong. Towards the end, you see him say 'not video, not video'. Just fucking haters, they are.",1,5,1585515924.0,sudutri,False,negative,negative,negative,negative
fltv3w1,"Check Mysuru City Police Twitter *@CPMysuru* they have twitted about it. 

[The Hindu reported it.](https://twitter.com/the_hindu/status/1244237904161001472?s=19)


Third attempt at the tweet: https://twitter.com/CPMysuru/status/1244184723636629505?s=19

Edit: Seems like I've failed again. So I'll just highlight the first sentence of this reply.",2,5,1585488142.0,,1585488529.0,neutral,negative,negative,negative
fs09ax0,I'm very curious now. Where can I read about it?,1,5,1590605759.0,penguin_chacha,False,neutral,neutral,negative,neutral
flta4nm,Does it matter?,3,5,1585464474.0,,False,neutral,neutral,neutral,neutral
fluagd3,"100% agree, respect has to be given to be received",0,5,1585498673.0,KILLAQWUEEN,False,positive,positive,positive,positive
flt17g3,I am one of them and I know the cowardice that is the backbone of our class.,8,5,1585456241.0,notanothervoice,False,negative,negative,negative,negative
flt1vxb,ok. that was big brain time. thank you for participating.,2,5,1585456794.0,notanothervoice,False,positive,positive,positive,positive
fltoimb,"While fighting racism, we hit an episode of classism. Beautiful. Slow claps.",1,5,1585481618.0,iamramiyer,False,positive,positive,neutral,positive
flt2388,">  people ensuring their families get fed instead of picking fights that might make them go home without basic necessities doesn't make them ""fucking piece of shits""

You really are slow, aren't you? You are making my point for me. Them not speaking up makes them what again? Burn those grey cells a bit more and you'll get the word. Go on.",0,5,1585456957.0,notanothervoice,False,negative,negative,negative,negative
flt8sel,[deleted],1,5,1585463081.0,,False,neutral,neutral,negative,neutral
fltm0f4,It sure isn't. In my reality I have a spine,1,5,1585478656.0,notanothervoice,False,neutral,negative,neutral,neutral
fltbdbq,Ok Saloni.,1,5,1585465826.0,notanothervoice,False,neutral,neutral,neutral,neutral
fltqkkv,You're correct.,2,5,1585483858.0,mubukugrappa,False,positive,positive,positive,positive
flw7cdx,"You people do not get it. They're ignorant and scared, that is all. It has nothing to do with being racist or anything.",1,5,1585541631.0,mubukugrappa,False,negative,negative,negative,negative
fltpz26,Fantastic. Thank you!,1,5,1585483218.0,iamramiyer,False,positive,positive,positive,positive
flt80a9,"Yup. Follow the DD news for past few years, unless the claim in DD news is biased, then I don't know. 

If it is indeed as you say then great, I hope more people from Bihar and Bangaldesh are aware of this, and will flock towards the NE state for better life than face the constant bereavement in Mumbai (where they are not denied veggies or such, but do face second-class citizenship at the level where term ""Bihari"" or ""Bangali"" is considered a slur in many ways).",2,5,1585462295.0,coldcoldnovemberrain,False,neutral,neutral,positive,neutral
fltplst,"FWIW, Aadhaar is not proof of citizenship. And I agree, that probably made it worse. There are claims going around that “everyone has an Aadhaar card these days.”",2,5,1585482823.0,iamramiyer,False,negative,negative,negative,negative
flunsk9,"> employees were accusing them of not being Indian citizens.

if that's in the video then I missed it.

BUT, even in that case **I** will not show it, but challenge him to tell me what makes him think I'm not citizen.",1,5,1585506343.0,Kemosahbe,False,negative,negative,negative,negative
fltf0kl,Seriously how many excuses will you make for the store?,5,5,1585470043.0,Dankjets911,False,negative,negative,negative,negative
fltvyk8,"This Tweet is unavailable

What are you even trying to link? Post a screen cap.",1,6,1585488862.0,rohithkumarsp,False,negative,negative,neutral,negative
fs0ase0,"https://www.thebetterindia.com/125306/amar-chitra-katha-stereotypes/

https://www.theatlantic.com/entertainment/archive/2017/12/the-comics-that-redefined-hinduism/539838/

http://www.khabar.com/magazine/tidbits/amar_chitra_katha_and_its_critics.aspx

https://www.indianwomenblog.org/getting-rid-of-stereotypes-amar-chitra-katha-gives-a-makeover-to-its-characters/",1,6,1590606470.0,I_am_not_here_got_it,False,neutral,neutral,negative,neutral
flt20j0,[deleted],2,6,1585456897.0,,1591285694.0,neutral,neutral,negative,neutral
flt6rzb,You ain't shit ... You insignificant speck of dust,0,6,1585461092.0,KingTheoz,False,negative,negative,negative,negative
flt2awa,[deleted],6,6,1585457132.0,,1591286752.0,neutral,neutral,negative,neutral
flt8y4k,"this,it's terrible that people someone is facing discrimination but everyone is just trying to survive.The Management could have easily warned  employees not to do this and prevented this situation",2,6,1585463244.0,UrbanCentrist,False,negative,negative,negative,negative
