Comment ID,Comment Text,Comment Score,Comment Depth,Created Timestamp,Author,Edited,Semantic Label,Semantic Label 2,Semantic Label 3,Major_Semantic
flt0oxq,"Its sad to see that nobody is standing up for these guys. Everyone is just standing there like 'as long as I'm let in'. If you're not standing against a crime you're part of the crime. 

Can someone please tell me which area this is? I live in Bangalore. I will help them buy groceries if they are in Bangalore.",409,0,1585455821.0,prnvbhrdwj,False,negative,negative,negative,negative
flt0wlr,"AFAIK, this happened at a MORE supermarket in Mysuru. These guys are from my college.",204,0,1585455994.0,wutamidng,False,negative,neutral,neutral,neutral
flsxlru,"Sorry my Northeastern friends. I live in Karnataka, I feel sorry for their behavior. Not everyone are like these guys though.",688,0,1585453426.0,sadar_pranam,False,negative,negative,negative,negative
flsvd1p,Wtf. They seriously are not able to understand difference between Chinese and NE. And in fact how can you even not allow Chinese.,824,0,1585451752.0,,False,negative,negative,negative,negative
flsz6fl,This just shows how many dumb fuck assholes we have in our country. Even if they were Chinese they don't deserve to be treated like that. And then we cry when we are treated like shit in the west.,121,0,1585454633.0,billydagent,False,negative,negative,negative,negative
flswkg9,This is More supermart. Aditya Birla retail. Ping the Birla guy on twitter to ask WTF is up.,339,0,1585452651.0,budbuk,False,negative,negative,positive,negative
flswf2p,Shocking... The guards should be arrested and the grocery store penalised for such shit... When will we learn?,157,0,1585452542.0,desi_lion,False,negative,negative,negative,negative
flsvzx1,[deleted],233,0,1585452228.0,,False,neutral,neutral,negative,neutral
flsxgt5,No one in the queue is speaking up as well.,83,0,1585453322.0,desi_launda,False,negative,neutral,neutral,neutral
flsy0lv,Racist fucks,126,0,1585453737.0,aypikillsu,False,negative,negative,negative,negative
flswuat,"Fucking shameless pieces of shits. 

Hope the Karnataka police goes and knocks some sense into these assholes thick skull.",55,0,1585452853.0,notanothervoice,False,negative,negative,negative,negative
flsy4ya,#This is very SAD to see such blatant Racism. And denying someone basic necessities.,132,0,1585453829.0,KissMyBBQ,False,negative,negative,negative,negative
flszfop,True nature of people comes out at times of crisis.,25,0,1585454830.0,gamma_professor,False,neutral,neutral,neutral,neutral
flt1fxw,"Damn, these people. This is sad. Just plain sad. Racism faced by NE people is already a sad case and now even in a situation as such; how can someone feel anything except solidarity for the fellows. Doesn't even matter whomsoever he is. Even if Chinese. It is so disturbing to realise that so much of our population is misinformed on most of the situation.",23,0,1585456433.0,mee-thee,False,negative,negative,negative,negative
flsz1b5,"Make this go viral guys ,it’s better to shut down these places ,these are dire times and nobody should be treated like this",85,0,1585454519.0,srys98,False,negative,negative,negative,negative
flt4w92,But why? If he was Chinese he's not allowed? This is bad on so many levels...,21,0,1585459343.0,p_ke,False,negative,negative,negative,negative
flt1zoa,The issue is not the uneducated shop guy... The issue is that no one else stood up for them. No one in the line stood up for them. Smh,19,0,1585456878.0,shen-I-am,1585464175.0,negative,negative,negative,negative
flt3d7o,"Why other people Standing in the queue are saying nothing,  just for the humanity . And  somebody please punch  ''naaat video'' guy in the face.😔😔",16,0,1585458018.0,keshav174,1585471383.0,negative,negative,negative,negative
flt0a0m,"Wtf, this is simply not acceptable. They really should file a complaint with the police.",31,0,1585455489.0,mohutmamodi,False,negative,negative,negative,negative
flsysbj,This should be posted along with the location/time details on Bengaluru Police Twitter acc. I am sure they will do something about it.,30,0,1585454327.0,neutralgr3y,False,neutral,neutral,neutral,neutral
flt5mh8,"And it's no surprise here tribal people burn the national flag. We also face xenophobia here so it'd be great if mainland Indians would stop being racist motherfuckers to indigenous NE people. Fuck this mentality, it's ingrained in the general public.",14,0,1585460017.0,Ryunysus,False,negative,negative,negative,negative
flt5282,"I am from north east. I have always faced racism in the other parts of India. We are also Indians and if someone's little brain can't accept it then shame on them. Why do you people always feel superior to us.
I am from assam which have glorious history and heroes.
We were independent of the other parts of India till British took it. We were never under Mughal empire. We have fought and defeated them 17 times. We treat all Indians equally here in north east. But some people always feel superior despite of having no solid knowledge. We provide oil and tea and other resources to the whole India. But you still treat us like shit. Why so racist? You see a foreigner and always try to make an impression on them while torturing your own country brothers. Someday someone will give a reply and then again you will blame us. Grow outside of shit holes. Treat people equally. You are not superior to us nor are we. Give respect and take respect. Otherwise we will have to do the same thing to all those non north east Indians living here. Live and let us live. Please🙏



Adding go my comment 
 All the people commenting on hatred about each other caste , state , religion I wanna ask you people what we should do? From your viewpoint I guess first we have to fight state wise. Then the winner state will get divided into religion and fight again. Then the winner team gets divided based on caste and fight again. Then I think all problems will be solved. I believe our elder generation had made some mistakes but do we have to follow them blindly? It's 2020 . Get out your mind from colour, religion , caste and try to see a person as a human being. 
We are the educated generation we should at least try to make a change and educate our elders. But no we like to argue, fight over baseless useless things. Busy sipping gao mut. Please I request again please see everybody as human do not judge by caste state religion.

After seeing all these things I suddenly don't regret corona.",34,0,1585459493.0,,1585470595.0,negative,neutral,neutral,neutral
fltmoq6,"I'm from North east and you guys know what? Every part of India I've been to regardless if it's the north the south ke west YOU pieces of shit are racist no matter fucking what. I've been called a chinese in Delhi metro, I've been called a NEPALI REFUGEE in my own GODDAMN college in Jaipur, I've been looked at as if I was an alien Down south( south indians are far more racists tbh ). But you know what guys? I'm fucking used to it now because no matter how much we try no matter how much some people take stand for us against the racism THIS COUNTRY is nothing but a shit hole. Me and my fellow north easterns are fed up. 
And Frankly we don't expect shit from the basic crowd of this country anymore",12,0,1585479466.0,rishavt99,False,negative,negative,negative,negative
flt6myl,"This happened in mysore, at the more store in chamundipuram. These guys are BE students from my college, NIE. They wanted to buy groceries but the guy wouldn't let them in. They had masks and everything and even showed them their aadhar cards but the store worker didn't budge.

EDIT: The police have filed a case against the store manager and the staff. [source] (https://www.news18.com/news/india/northeast-students-denied-entry-at-mysore-supermarket-case-registered-against-outlets-manager-staff-2556131.html)",12,0,1585460960.0,blerp_2305,1585509944.0,neutral,negative,negative,negative
fltd0mk,"Even if he is NOT an Indian, how the fuck does it matter?

He is a living being and we should help each other in crisis, shouldn't we?",11,0,1585467689.0,_Floydian,1585471019.0,negative,neutral,negative,negative
flt0vr6,Nat video,10,0,1585455975.0,Joshcrashman,False,neutral,neutral,neutral,neutral
flt32xs,And everyone around them did nothing...not a single person intervined ...that's the most frustrating thing ....illeterate uneducated people I can understand but not even a single person in the market or in the queue did anything...,10,0,1585457779.0,mr_crawlie,False,negative,negative,negative,negative
flt8mbq,"What a bunch of morons, I can't believe this. That too from Karnataka....well I guess you guys did vote BJP that explains a lot. I hope a shit storm is raised and someone is held responsible. r/moronavirus",10,0,1585462912.0,tboyacending,False,negative,negative,neutral,negative
flt9ohe,Chinese and NE are same. Muslims and ISIS are same. The kind of shit racist and bigoted shit Indians believe in.,10,0,1585464004.0,TendarCoconut,1585473049.0,negative,negative,negative,negative
fltomnx,There's an update. Apparently the store manager has been taken into custody.,11,0,1585481745.0,sleepygamer92,False,neutral,neutral,neutral,neutral
fltqvi7,[Looks like the store manager has been arrested ](https://i.imgur.com/fPoI7QQ.jpg),10,0,1585484169.0,D3MON130,False,negative,negative,negative,negative
fltbmg2,"Apparently, these people are Indians only when China is trying to encroach upon the NE. That's when the faux patriotism and brotherhood comes alive. Any other time they are just outsiders.",9,0,1585466106.0,heathenhead,False,negative,negative,negative,negative
flsyr9c,"What is India then? Sorry, I don’t understand what those in power thinking of. Those Politicians gave an impression that only Central India is India, rest of the country is foreign. They don’t accept the language, culture and race, anyone other than from Central India.",29,0,1585454305.0,Planz123,False,negative,negative,negative,negative
flszuc4,"Indians are the racist bunch ; we discriminate based on language , religion , caste and looks. 

Fuck us all 🤬",33,0,1585455148.0,evilkaiju,False,negative,negative,negative,negative
flt1x3e,"Honestly, fuck the bystanders too",18,0,1585456820.0,concordcresit,False,negative,negative,negative,negative
flt1evx,"This is more , if anyone knows which more this is I will literally go belt these fools . Please let me know",8,0,1585456410.0,KrabbyPraddy,False,negative,negative,negative,negative
flt2mg7,"Ok fine let's assume guards are dumbass idiots, what are the other people in the queue doing? No one's trying to support NE dudes.",14,0,1585457398.0,dronz3r,False,negative,negative,negative,negative
flt0pli,Can the name and location of the store be posted please.,7,0,1585455836.0,bitingsparrow,False,neutral,neutral,neutral,neutral
flt1l71,Incredible India,7,0,1585456554.0,BesraSangram,False,positive,positive,positive,positive
flt5uqd,"I'm truly sad looking at this. I used to feel proud growing up, writing the essay 'Unity in Diversity'. It's unfortunate that that bubble has been burst repeatedly in the past few months.",5,0,1585460223.0,modestfool,False,negative,negative,negative,negative
flt646c,"that's the same reason people were saying don't call it ""Chinese"" virus, people get need excuse to be racist",7,0,1585460468.0,,False,negative,negative,negative,negative
flszjoh,Veer sad and unfortunate,7,0,1585454917.0,Yum_T,False,negative,negative,negative,negative
flt1ite,"We deserve the current govt, we deserve the calamity, we deserve all the hate. I don't believe in god but if there is one, he is definitely punishing us for it.",5,0,1585456500.0,Nerevarine12,False,negative,negative,negative,negative
flt1x4z,[deleted],5,0,1585456821.0,,False,neutral,neutral,negative,neutral
flt4riv,Karnataka now officially qualifies to be part of Delhi.,5,0,1585459226.0,mubukugrappa,False,neutral,positive,neutral,neutral
flt68s2,"Northeast India has the lowest cases of coronavirus compared to the rest of India.

Not that that should make any difference, but just goes to show how difficult it is for us to accept people who are different than us and that we need only a tiny reason to spew forth our inner vitriol.",7,0,1585460590.0,kurithesheep,False,negative,negative,neutral,negative
fltdlxd,"You know the fucked up thing is that we have less than 5 cases across the 7 NE states so far. And people in Bangalore have given me these same looks when I go to grocery stores. You know, if you're gonna be racist about it, you'd think logically the possibility of a NE person being infected is actually lower than that of a non-NE person, right?",6,0,1585468374.0,pimpleface0710,False,negative,negative,negative,negative
flt3c0j,[removed],15,0,1585457991.0,,False,neutral,neutral,negative,neutral
flt7ty5,"If he'd have asked me to stop recording the video, I would've asked to him SUCK MY DICK, that motherfucker!",5,0,1585462124.0,dudebro__,False,negative,negative,negative,negative
fltdizl,"After the 14 day lockdown, We will probably see more cases what with all the ppl crowding up in the buses and moving to their villages, and crowding up in the markets for essentials. 🤦🏼‍♂️

I bet the last Saturday festivities with all the clapping nonsense would be another conduit too. 

In short, we fucked up mate, we ain’t no western country that has resources to take care of it’s citizens in a lockdown, we area third world country and lockdown is the last thing we needed. 

All we had to do was absolutely copy South Korea and Taiwan, masks for all, washing hands often, social distancing and making sure public transportation and malls have less thats 30% capacity at all times by extending work timings and last but not least preventing unecessary air travel like all the idiot tourists flying to Italy and London, and also enforcing strict quarantine measures for incoming passengers, indian or otherwise . 

Simple as that, instead with the cheap labour we have, we didn’t even have masks in spite of having all the time in the world( Jan was when this began) and now lockdown as if that that is the solution( it’s not)",7,0,1585468283.0,Sefffaroque,False,negative,negative,negative,negative
flt6a5c,Indians might must be the dumbest race on this planet. Fucking illiterate idiots,9,0,1585460625.0,grvupd1988,False,negative,negative,negative,negative
flt05fs,Retards,4,0,1585455391.0,,False,neutral,negative,positive,neutral
flt1s47,someone should punch those guys.,5,0,1585456709.0,tamal4444,False,negative,negative,negative,negative
flt3gs9,"These people are being Xenophobic but are unable to realise the difference between xenophobic and being racist to our own country natives. This is thought provoking as to what information these Karnataka dwellers have been given around who can't even help people of NE in such times even though they had Adhaar Cards.
This is shameful.",4,0,1585458101.0,Trashdesu_,False,negative,negative,negative,negative
flt658i,"I fucking hate this. True Patriots and nationalists only care about borders, but not the people living inside it. It is unbelievable that how many people are unable to think of northeast indians and Kashmiris as fellow countrymen.",4,0,1585460497.0,AyushPRS,False,negative,negative,negative,negative
flt699x,Racism is rampant everywhere.. but Karnataka does seem to have a special knack for this stuff. 🤦‍♂️,4,0,1585460603.0,thejesterhere,False,negative,negative,negative,negative
fltcgyg,"I really don't know what had happend to kannadigas? 
They had reached heights of racism & narrow mindedness. They blocked all the roads to the state by putting mud in the road,  Preventing the journey of other patients too",4,0,1585467063.0,reesji,False,negative,negative,negative,negative
fltcw5d,"I wanna know what happens after the police came (if it came).

These radical storekeepers have no sense of humanity. Even if a person is not an Indian and is not a suspect or a patient of covid-19 he/she shall be allowed to buy groceries.
Sorry to all NE people who have faced this racism, we stand with you.",3,0,1585467545.0,DastardlyThunder,False,negative,negative,negative,negative
fltdg5w,"This is not the way to treat customers, Let's bombard ""More"" and Aditya Birla group's Emails and twitter account.",4,0,1585468192.0,Shady_b0y,False,negative,negative,negative,negative
flte5tu,Madarchodo.. This country deserves fucking Corona because of people like these. Bhenchod I'm losing my mind.,3,0,1585469022.0,OptimumWaste,False,negative,negative,negative,negative
fltizx2,India is turning into America. People are getting dumber and racist...god help us all,5,0,1585474941.0,markisstrong47,False,negative,negative,negative,negative
flu0w13,"The current Hindu nationalist party ruling India was directly inspired by the German Nazi Party from the 1930-40s. 

https://www.aljazeera.com/indepth/opinion/white-supremacists-hindu-nationalists-alike-181212144618283.html

https://youtu.be/qVIXUhZ2AWs",4,0,1585492639.0,TheTwilightKing,False,negative,neutral,negative,negative
flt1vk2,Those store guys Don't even understand English and these guys are like ranting nd ranting 😅,8,0,1585456787.0,Sichips,False,negative,negative,negative,negative
fltbzw5,"Karnataka govt going nuts yesterday denied a serious patient in ambulance bfrom Kerala to enter Mangalore and the patient passed away today morning, what kinds of retarded are they?",7,0,1585466518.0,mohammedashker,False,negative,negative,negative,negative
fltca9a,Unpopular opinion but these discrimination towards our own citizens is what China is eyeing to invade Arunachal and other NE States. I wouldn't be surprised if locals there (in due time and discrimination) start to side with China. Most of these discriminators are pseudo-nationalist.,8,0,1585466844.0,propeller360,False,negative,negative,negative,negative
flt3guo,[removed],6,0,1585458102.0,,False,neutral,neutral,negative,neutral
flt0jf7,These rascists disgust me,3,0,1585455699.0,depressedfrog420,False,negative,negative,negative,negative
flt13bm,This shit is beyond fucked up!,3,0,1585456147.0,sohomcena,False,negative,negative,negative,negative
flt1yhc,"First racism and then assault. Even the police can’t stop a citizen from videotaping or audio taping while they’re on duty, and this racist bunch is trying to assault these people because they’re recording. I don’t have much hope for this country.",3,0,1585456851.0,GMOneyGucci,False,negative,negative,negative,negative
flt34kh,And the biggest Tibetan settlement in India is somewhere near Bangalore.,3,0,1585457818.0,,False,neutral,neutral,neutral,neutral
flt3i70,The sad thing is nobody else is speaking up for them,3,0,1585458132.0,schrutebucks666,False,negative,negative,negative,negative
flt750d,This is really sad. Action must be taken against the store owmers,3,0,1585461441.0,checrazzy,False,negative,negative,negative,negative
flt7j91,India back to the cast system it seems. Wow,3,0,1585461833.0,throwforward666,False,neutral,neutral,positive,neutral
flt82pd,"Despite cities like Bangalore with a vibrant startup ecosystem, Karnataka is still very openly jingonistic. These incidents of aggression towards outsiders have increased a lot in the recent years.",3,0,1585462362.0,sinsandtonic,False,negative,negative,negative,negative
flta5ek,"M****ch** yeh sirf youtube Facebook par proud of india likhte hain, par inhe india ka pura map bhi nhi pta hai.",3,0,1585464496.0,madara_sama,False,neutral,neutral,positive,neutral
fltlwjp,"This shouldn't surprise anyone. North Eastern people have been facing discrimination in the rest of India since for ever.

Besides, a country where the caste system is still widely practiced, it is but natural that there would be widespread discrimination. 

Dalits, Muslims, Christians, North Easterners.. Manu Smriti doesn't approve of any of them.",3,0,1585478528.0,iSalaamU,False,negative,negative,negative,negative
fltocte,I'm so sorry for you my NE friends. You are no less Indian than I am.,3,0,1585481436.0,,False,negative,negative,negative,negative
fltu4zr,Wow! So Indians don't even like Indians??,3,0,1585487297.0,nsktea76,False,negative,negative,negative,negative
flu3bpn,"I’m from NE and I reside in Bangalore. My neighbors and the vendors that I normally buy form have been extremely accommodating, going as far as offering me to pay later if I’m in sort of cash. 

I’m just writing this to let my fellow NE people and people of Karnataka to know that there are good local people out there; by saying this I’m no way denying the kind of racism we face. 

What happened to those guys is really sad. Someone should have stood up for them. I would have cried if I were them. Hope they found a way to get groceries.",3,0,1585494269.0,Lady-Roronoa,False,positive,neutral,neutral,neutral
fluvr52,"I genuinely do not understand what is the problem some Indians have with folks from North East.  
I went to school for a few years in Manipur and I can assure you they are like the coolest dudes out there - Great dressing sense and a dope taste in music.   
I am extremely apologetic you guys had to face such an unfortunate experience.   
Take care.",3,0,1585511052.0,,False,positive,positive,positive,positive
flt2lny,"Not surprising, Indians are the most bigoted and racist people in the world.",4,0,1585457379.0,test_twenty_three,False,negative,negative,negative,negative
flt2qxd,I swear this is the kinda thing I've started to expect from indians now.,2,0,1585457501.0,,False,negative,negative,neutral,negative
flt39hv,it begins huh,2,0,1585457932.0,,False,neutral,neutral,neutral,neutral
flt3m2e,I hope the people stopping these Indian students lose their fucking citizenship. Gaandu saale,2,0,1585458224.0,gremlinvil,False,negative,negative,negative,negative
flt4k98,Not video? I hope someone called the police on their ass.,2,0,1585459047.0,McFlurrY37,False,negative,negative,neutral,negative
flt60zz,Can anyone find the name of the store? Can out them on social,2,0,1585460385.0,punsnjabs,False,neutral,neutral,neutral,neutral
flt79qj,"I feel sorry for these people 

They’re our fellow Indians yet they’re treated as an outcast.",2,0,1585461572.0,,False,negative,negative,negative,negative
flt7eae,Name and shame,2,0,1585461695.0,Bazzingatime,False,negative,negative,negative,negative
flt8bgn,"Dont argue with  racist idiots. 

Call police and  make them listen .",2,0,1585462609.0,,False,negative,negative,negative,negative
flt8bpl,Racist piece of shits,2,0,1585462616.0,deviltamer,False,negative,negative,negative,negative
flt8wyt,Dumbass fuckers showing blatant racism openly!!,2,0,1585463211.0,ayyushsoolanki,False,negative,negative,negative,negative
fltczi1,Petty tyrants abusing their position! Shame on them!,2,0,1585467652.0,userat,False,negative,negative,negative,negative
fltddxh,Not video saaarrrrrr....,2,0,1585468120.0,,False,neutral,neutral,neutral,neutral
flte1nm,"It's sick to see this, I have faced such issues as well while visiting a hospital at Kolkata. Kids and their parents ask me and my mom the place we hail from and people keep staring at us. NE people never felt at home in their own country. SHAME",2,0,1585468885.0,Deadmou5___,False,negative,negative,negative,negative
flte7p1,"Naat vidio aeeeeee aeee!

But seriously it's a shame. We are in a country that refused to accept rs.10 coins because of some rumor that govt has deemed it invalid. Same thing happening again, illiterate stupid fucks thinking NE folks are from china and infected? Fuck these people!",2,0,1585469085.0,spot989ify,False,negative,negative,negative,negative
fltia07,No wonder people want to migrate out of this shithole of country,2,0,1585474059.0,Tradersperando,False,negative,negative,negative,negative
fltifcm,"Nat Video eh Nat Video. 

WTF.",2,0,1585474240.0,,False,neutral,negative,neutral,neutral
fltmjw6,Now peoples will show sympathy and forget about it after two three days and move on,2,0,1585479302.0,NorthEastHunter,False,neutral,neutral,positive,neutral
fltnsl0,"Not one person from that line came in support for this act of discrimination. Most of them are young Indians who just stand there for their own needs. Once we are done with religious discrimination we come to regional one. 

Will discrimination ever go extinct in our SOCIETY??",2,0,1585480781.0,patient_wave,False,negative,negative,negative,negative
flto16w,Wait.. I thought only white people can be racist? /s,2,0,1585481058.0,Deviantuc,False,negative,negative,negative,negative
fltsjkl,"I was talking about increasing instances of such offences rising in these times with a friend from NE. He said the entire community is scared and worried for how Indians have been treating them recently. I couldn't agree more with him.

You cannot treat a group of people like outsiders, be openly racist and expect them to be grateful for national integrity. The so called integrity is right there on the video. 

PS - If his 'Indian' term hits your nerve then its fair to say that for anyone being treated as an outsider in their country of birth pretty much makes the country a stranger for them too.",2,0,1585485828.0,Silverpool2018,False,negative,negative,negative,negative
fltxsbs,I don't know about you guys but lately I have been seeing a lot of racist and anti-chinese stuff on social media. From people blaming them for the virus to making fun of their food choices. These messages are really not helping. Specially in our country where ignorant fucks can't tell NEers from Chinese.,2,0,1585490380.0,billydagent,False,negative,negative,negative,negative
