Comment ID,Comment Text,Comment Score,Comment Depth,Created Timestamp,Author,Edited,Semantic Label,Semantic Label 2,Semantic Label 3,Major_Semantic
fsfu1kp,"You seem to be the kind of person who bristles at any idea YOU think is socialism or communism, regardless of whether the idea itself has merit even if it is from the economical and political bag of ideas you hate.

If slavery is adopted by capitalism, and socialists were fighting for freedom, you probably will be glad to be a slave rather than be a socialist.",6,6,1590945951.0,,False,negative,negative,neutral,negative
fsjeorb,"Ok if they dont come to India. You cannot be sure that the prices gonna increase. As far as the thailand example thats result of not having distributed hdd production. So you yourself can see the profits of having distributed production. 

For women rights and freedoms you have to blame the society not the govt. Please stop looking at everything from the same perspective. If society standard increases automatically women will have more rights and freedom. There is no rule in Indian constitution affecting their right or freedom. So please keep your leftist mind aside for a moment and then look at the picture. You and me have to change to make it better for women not the constitution.


Well what you know about china. The whole media is controlled and owned by government. They decide what to be released and what not to be. If any govt start filtering out the news being published. Even pakistan will start looking better than western and you will also start to believe that its way better than India. Coz the true picture is never released. 

We are digressing from the topic as we are looking what would we lose and what would we gain of productions are out of china. For me I do not want to see another such pandemic again. If a govt or a state sponsors such world wide event I want it to go down. If such state or govt is not draconian then god knows what is. It restricts information purposefully. At times of pandemic tries to take advantage by investing huge sums and trying to own companies. Cauing border issues to ruffle up the neighbours who are already suffering from their virus.",1,6,1591028482.0,moab911,1591028706.0,negative,neutral,neutral,neutral
fsf8vgt,Troy and Abed in a Lockdown!!,40,6,1590934213.0,silly_point08,False,neutral,neutral,neutral,neutral
fsfbqoy,We are streets ahead,14,6,1590936012.0,,False,positive,positive,neutral,positive
fsgen2b,I think their first phone was Mi3 and this was way back in 2014.,4,6,1590956533.0,Wicardobeth,False,neutral,neutral,neutral,neutral
fsgcojn,Missing word was never the problem.,2,6,1590955518.0,vijay-lalwani,False,negative,neutral,negative,negative
fsidf96,No it was the mi3,1,6,1591002119.0,rajwade695,False,neutral,neutral,negative,neutral
fsh11z9,"Brave is shady. Keep away. Use the original, Firefox.",1,6,1590968436.0,cosmogli,False,negative,negative,positive,negative
fsib750,"Correction: India has seen a modicum of what is considered capitalist, which forms the foundation of most modern states. In most ways, it is still socialist (state owned industries and government directives for production in the private sector).

You're wrong about 1993. It's 1991.

Also, please read the amendment to the preamble that, I believe Indira Gandhi brought about. It includes the adjective 'socialist' to describe India.

So yes, India is largely socialist, and speaking redundantly, statist.",2,6,1590999908.0,ImHopelesslyInLove,False,neutral,neutral,negative,neutral
fsj996v,"India is a classic example of Socialism.

By default we should consider India to be a socialist country.

Does India/did India engage in large amount of central planning? Check.

Does India have a majority of industry owned by the state? Check.

Does India tightly control the flow of imports and exports? Check.

Does India have state mandated labor laws? Check.

Does India strictly control the prices of various goods and services? Check. (For an example, UGC strictly sets the prices universities are allowed to charge as tuition fee as opposed to a free market. This is just one, price controls are pervasive within the Indian economy.)

Does India have an extensive welfare state? Check.

While we're at that, what does India prefer to call itself? As we see in the preamble, 'socialist'. Yet another reason

Whoever that presents India as a capitalist country is either being dishonest or simply ignorant. The reforms in 1991 were minor relative to the wider economy.",2,6,1591025739.0,ImHopelesslyInLove,1591026073.0,negative,neutral,neutral,neutral
fsf9eo8,All you as a consumer have to do is google where the company os from before buying. That’s about it.,-1,6,1590934567.0,sabreR7,False,neutral,neutral,neutral,neutral
fsfa0ef,"I am not talking about buying only Indian made products, I am saying products from Chinese companies should be avoided. Products from non-chinese companies cost the same and are more reliable. Take for example the TV market, almost all of them cost the same for the same features.",1,6,1590934961.0,sabreR7,False,negative,negative,neutral,negative
fsfoc0h,"Try Samsung note 10. I haven't done much research, but I think you can get double the storage capacity for a little more.",1,6,1590942990.0,sabreR7,False,neutral,positive,neutral,neutral
fsflt2s,"A start is a start. Worrying about small things won't get us anywhere. 

Buying a Samsung phone, Toshiba TV, Panasonic refrigerator (Non-Chinese companies with assembly in China) will still do a lot more than the choice in lighter could.",3,6,1590941657.0,sabreR7,False,neutral,neutral,neutral,neutral
fsfjxtd,">while you're thinking that the whole production is done there

I literally never said this. My whole point as I have stated multiple times is to avoid Chinese companies, not products assembled in China.",0,6,1590940639.0,sabreR7,False,neutral,negative,negative,negative
fsfnxxj,">inferior

You mean Chinese products right?",1,6,1590942785.0,sabreR7,False,neutral,negative,negative,negative
fshdcl6,Oh yeah buy micromax which is basically shit.,1,6,1590975450.0,_Porinju_,False,negative,negative,negative,negative
fsfe8y8,[deleted],0,6,1590937480.0,,False,neutral,neutral,negative,neutral
fsfdt4a,"This is an incomplete picture you are painting. Religious practices are extremely limited in China, buddhist temples are closely monitored, with photos of their president forced into the temples.",0,6,1590937225.0,sabreR7,False,negative,negative,neutral,negative
fsf7ljs,"Done more of what? The people have no freedom there. Until quiet recently they had people from a minority religion locked up for “re-education”. Most of China is poor, other than the SEZs.",7,6,1590933356.0,sabreR7,False,negative,negative,negative,negative
fshio7a,"Yeah it is true and we have to admit to the fact. But there is hope. For example good clothing companies like Allen Solly, Van Heusen and Louis Phillipe are owned by an Indian. So in the same way over coming Indian companies could soon catch up or do better than their Chinese counterparts.",2,7,1590978561.0,chitrapuyuga,False,positive,positive,neutral,positive
fshsxks,Awesome username,5,7,1590984932.0,zappinder,False,positive,positive,positive,positive
fsmfsil,"> As far as the thailand example thats result of not having distributed hdd production

HDD does/did have distributed production, the biggest blip was in 2011. Even when China had such a hold of supply lines a regional flooding in 1 part of 1 small country still ended up disrupting a global supply of an item for years on end. 

There is only so much you can stretch distribution before it becomes counter productive to even have supply chains like that. We have supply chain efficiencies for a reason to being with. If the argument is balance sure but people aren't arguing that, most people are arguing from an emotional angle on this debate which is impractical and won't work. 

> You cannot be sure that the prices gonna increase.

For all items across the board on all sectors, probably not since India still has decently high tariffs on Chinese imports already, as it does from those other countries where part of the supply chains are moving, meaning India isn't going to see the benefits of these companies moving out of China all that much. 

But for a lot of product classes not much will change since if Indian companies are in total hold of their own domestic market the prices will obviously rise because why not. There would be no competition (since West doesn't compete on low value chain classes) so why lower pricing. Jio is just the latest example, when there were 10-12 telecom players it disrupted the market, not that there are only 3-4 its raising pricing because people have less choice. 

> you have to blame the society not the govt.

This is only partly true. In China and basically most societies where Women's lives got better the change was top-down first. Which it was/is in India as well, Laws supporting women and minorities came first before society was ready. But these laws are ineffective because they are there in ink not spirit because the essence of them are not implemented in Govt policy.  

So yes it is on the State/Govt. 

> Please stop looking at everything from the same perspective.

Dude you were the one who made a ridiculously generic equivalence of China Bad because Liberty which missing the picture and nuance of WHAT Liberty ACTUALLY is in practice. 

Yes being able to vote or speak against the Govt is Liberty, of course it is.  
But so is being able to wear what you want, able to marry who you want, able to have opportunities in whatever field you want, able to eat what you want.  
Able to walk alone at 2AM in the streets as a women. THAT IS LIBERTY. 

No place on the face of the Earth has Absolute Liberty and never will because its an oxymoron concept. Meaning everywhere has a spectrum of it and China ain't lesser than India at this stage. That is a factual statement and not one which is looked at through to quote you, ""same/narrow perspective"".

> If society standard increases automatically women will have more rights and freedom.

You need to learn more history because your comments are coming off as highly ignorant. 

Mao under 4 years of PRC establishment upended China's 4000 year old Patriarchal dominated society. So yes it can happen right away and doesn't need so called society advancement even though 7 decades ought to have been enough for that anyway. 

> There is no rule in Indian constitution affecting their right or freedom.

Yes because whatever is written in Constitution are followed to the tea and everyone lived happily ever after. 

> So please keep your leftist mind aside

WTH, how did you attribute a political spectrum to me even when you don't know me and what my comment said was NOT leftist but common freaking sense.  
Unless you hold the position Liberty and Women's rights are Left issues. 

Utterly ridiculous. 

> You and me have to change to make it better for women not the constitution.

You and Me already are doing it, have done it, as did our parents generation. There is a ceiling, a limit to which social actors, individuals can affect change in Society. 
This is why human groups even make Govts & States to begin with, to make the hard choices across a wider scale at a faster timeline.  

It is the Govts which leads on this because they have the capacity to effect that. This is how it happened elsewhere and this is how it will happen in India when it eventually will, because it will, others have just gone ahead of India on this front, which  is not a trivial thing to ignore because India doesn't claim to be a no body, it claims to be a champions of Democracy and Liberty, meaning it will judged on that prism not on some antiquated lose marking board with free marks being handed for participation alone. 

> Well what you know about china. The whole media is controlled and owned by government. They decide what to be released and what not to be. If any govt start filtering out the news being published. Even pakistan will start looking better than western and you will also start to believe that its way better than India. Coz the true picture is never released.

And this media system is relevant why exactly? 

Do you think US media is accurate to the point it leads to better information and choices for its people and those around the world?  

Or are you of the view Indian media is good because its so free and thus by extension informs the public in a good and accurate manner? 

Chinese media being less free is trivial to their progress on all fronts, be it social, economic or strategic. 

We have enough body of knowledge on China from non-Chinese sources and research over years to know that what they have achieved is Real, it is not a facade. 

No one fake it for 40 years. NO ONE. 

> We are digressing from the topic 

Yes because your comment took it in that direction because you misunderstood the fundamentals of how these policy changes will affect in a cascading manner over time. 

> If a govt or a state sponsors such world wide event I want it to go down.

You've been reading too much nonsense media. China didn't not sponsor it any more than India sponsors TB and NDM bacterial strains. Others competencies are not China's fault.  

If poor developing nations like Vietnam can get a hold of this, so can others. Period. 

> If such state or govt is not draconian then god knows what is.

I already told you what that is. A State which allows 500 Million people across multiple generations to die in poverty and 200 Million CHILDREN to die in that same time as well. 

That is not draconian, that is intentionally malevolent, i.e. a much worse grading/classification.  

If you are informed enough, they you'll know which State is being talked about here. If not then you need to read more and gather more knowledge because at least the Chinese people have the excuse of, Hey we have a censored system. What's the excuse for rest of the world's people for not knowing basic history. 

> At times of pandemic tries to take advantage by investing huge sums and trying to own companies

Like Jio has gotten around $15 Billion from exclusively Americans corporations. Corporations having loyal Indian interest at heart, right. Sure buddy. 

> Cauing border issues to ruffle up the neighbours who are already suffering from their virus.

You mean the one where a large country tries that on a tiny neighbor like Nepal or you mean the one where so called ""Experts"" (even though they aren't that) in the media, OSINT satellite map readers (amateurs) and incompetent foreign think-tank commentators and anti-Govt former Lt Gen's all seem to be making contradictory statements while the Govt and the Indian Military seem to be keeping a calm, steady and consistent messaging. 

Sure, whatever floats your boat. 

I don't have time for this given I don't consider your domain knowledge space to be good enough to engage in a long back and forth on this, esp on top of that you not even aware of basic facts and fundamentals of how things work and what is a given (i.e. your comment just tried to excuse/argue its way to justify Chinese women's condition is not a big deal vis-a-vis Indian women's condition. The fact is if a 2 country choice was given to women before their eventual birth in India where to get born, nearly all will pick China, if they knew the reality. That is all there is to it and your attempt to use moral equivalence).",0,7,1591094433.0,iVarun,False,negative,neutral,negative,negative
fsfa2et,Niiigghtsssssss,25,7,1590934996.0,GrapeJuse,False,positive,neutral,neutral,neutral
fsfdlh4,r/unexpectedcommunity,11,7,1590937102.0,crazydiamondheart999,False,neutral,neutral,neutral,neutral
fsgf748,"yeah it was, but I got introduced to it by redmi 1S",-2,7,1590956829.0,,False,neutral,positive,neutral,neutral
fshhjd6,Pansexually gay vibes,3,7,1590977890.0,poisonmonger,False,neutral,neutral,positive,neutral
fsjbajp,"Your definition of socialism is wrong as there isn't supposed to be a state that controls production. India has socialist policies. It is not a socialist country (perhaps desires to be, which is impossible as long as there is the concept of state) since you are free to start your own business and set your own prices (under proper regulations that keep the free market open for small as well as big players, and prevent cronyism), you might as well consider it a proper version of a capitalist society that avoids pure capitalism like the U.S.",0,7,1591026790.0,,False,neutral,neutral,neutral,neutral
fsf9ug2,"Try it, it is very hard and limiting. Again, not saying it is not possible.",7,7,1590934854.0,KhalilMirza,False,neutral,neutral,negative,neutral
fshc2gc,Which non Chinese products cost the same as Chinese products?,1,7,1590974724.0,_Porinju_,False,neutral,neutral,neutral,neutral
fsfovr2,You know the Mi10Pro is cheaper than the Note10 right? And also that Mi10Pro has better specs than the Note 10?  Inferior.,3,7,1590943277.0,ChickenMayoRice,False,positive,neutral,neutral,neutral
fsfm4rc,"What are you so obsessed about a tv?

""Worrying about small things won't get us anywhere?""
You realise how big the market is for these small things?",2,7,1590941829.0,shitclay,False,negative,negative,neutral,negative
fsfm2ns,"that wouldn't have a dent in china's contribution to GVC and non availability of substitues for each chinese product means temporary loss in income until the other companies adjust their production according to shifting demands. There is simply no way around this. This has to come at a personal welfare sacrifice for some and it wouldn't even bring china in line.

What you're trying to do needs supra national entities and multilateral trade deals. Not shitty boycotts from privileged middle class for whom temp loss in incomes don't mean much.",2,7,1590941798.0,boiipuss,False,negative,negative,negative,negative
fshdir2,Lol.Chinese products are cheaper and of better quality when compared with other similar products in the similar range.I believe no one is dumb enough to buy a micromax over xiaomi,1,7,1590975548.0,_Porinju_,False,neutral,positive,positive,positive
fsfhjun,"That was in 1989 and the Kashmir crisis is happening today. Plus wiki leaks reports have shown that there were no deaths in Tiananmen square. Feel free to read through the links below.

https://wikileaks.org/plusd/cables/89BEIJING18828_a.html

https://www.telegraph.co.uk/news/worldnews/wikileaks/8555142/Wikileaks-no-bloodshed-inside-Tiananmen-Square-cables-claim.html

https://www.ibtimes.co.uk/tiananmen-square-massacre-myth-all-were-remembering-are-british-lies-1451053

http://www.globaltimes.cn/content/1081851.shtml#.WkEUa6pPD8U.facebook",1,7,1590939337.0,samelr19,False,neutral,neutral,negative,neutral
fsfho5m,"> Religious practices are extremely limited in China, buddhist temples are closely monitored, with photos of their president forced into the temples.

And this is based on what? A handful of isolated incidents? So lets apply the same standard to India. Here is one incident that happened in India. 

https://www.newindianexpress.com/states/odisha/2020/may/28/70-year-old-priest-beheads-man-inside-odisha-temple-after-victim-eats-his-dinner-police-2149283.html

Is it fair to go around saying that Indian temples perform beheading people? Are Indians hypocrites? Because only a hypocrite will apply on standard on others, and a different one to themselves.",3,7,1590939402.0,11greymatter,False,neutral,negative,neutral,neutral
fsf8iz1,Umm I don't like the IMF but even they say that poverty in China is at around 1.7% while india still has atleast over 12 % of its population under poverty. Education camps are for radicals. It seems bad and is obviously not ideal but compare that to what is happening to muslims all over India especially in Kashmir. The education camps are used to train uyghurs in vocational jobs and allow them get better paying jobs. Also seems like no islamic country has called them out because China has already explained the situation to them and they agree with China.,1,7,1590933983.0,samelr19,1590934707.0,negative,negative,negative,negative
fsho6ed,Yes I need to agree with this. Finally what we can say is let's for the best. Because there's lot of talents and expertise in India. The thing we lack is infra and hope govt solves this issue and India is too good to become #aatmanirbhar,2,8,1590981878.0,Souhardya_vintage,False,positive,positive,positive,positive
fsmjjbo,"Are we talking about women rights or pandemics and how to avoid other one. 
Whatevere examples of freedom like able to wear whatever, marry whomever, etc etc also exercised by Indian citizens. I do not know which part you belong to where this isnt allowed. 

Anyways it seems you are so much blinded by your hate for your own country that you even believe that the country would have been better off if it would have been ruled by an evil tyrant and mass murderee like mao.

I give up as you are blinded with hate and I do not want to waste my time reading such huge comments filled with hate and love for a tyrant. 

I'm happy as I'm not as intellect as you are I could see the affect of it. I do not want to be filled with such hatred for my own country and fellow people. You probably need to recheck the sites and books you read to quench your thirst as it seems as per them mao was a good leader. Tomorrow you might even say Hitler was good leader, today whatever Germany is its because of him.

✌ peace.",0,8,1591097808.0,moab911,1591102346.0,negative,negative,negative,negative
fsfssca,Now I am waiting for someone to Britta this reference chain.,11,8,1590945305.0,iamzeN123,False,neutral,neutral,neutral,neutral
fsfaioa,Not at all. I always do it. Just look for TVs under 20k on Amazon. Most are non-chinese.,0,8,1590935277.0,sabreR7,False,neutral,neutral,neutral,neutral
fsfq1iu,"You get double the storage. More GHz does not make a faster phone, neither does more megapixel a better camera. I doubt the 108MP on Mi pro means anything more than the number itself.",1,8,1590943884.0,sabreR7,False,neutral,neutral,negative,neutral
fsfmhph,"Haha, TVs are one of the highest margin electronic products. So I took that example. 

I do realize the market for little things is huge, but the margin is very little. And moreover we should start somewhere right? Why not begin with the easy choices.",5,8,1590942019.0,sabreR7,False,positive,neutral,positive,positive
fsfntou,">non availability of substitues for each chinese product

What? You do know China controls only the assembly, there are tons of competitors for every industry even if their assembly is in China.

>What you're trying to do needs supra national entities and multilateral trade deals.

Nah, we first begin with boycotting products from Chinese companies.

>Not shitty boycotts from privileged middle class for whom temp loss in incomes don't mean much.

Then you shouldn't have a problem with the said boycott.",1,8,1590942724.0,sabreR7,False,negative,negative,negative,negative
fsfiy3p,">A handful of isolated incidents

No, not at all. But I can't change your beliefs.",0,8,1590940101.0,sabreR7,False,neutral,negative,neutral,neutral
fsf9mlw,And the WHO says China handled the pandemic really well. No matter what you say you can’t convince me or anyone that China values freedoms.,4,8,1590934712.0,sabreR7,False,neutral,neutral,positive,neutral
