Comment ID,Comment Text,Comment Score,Comment Depth,Created Timestamp,Author,Edited,Semantic Label,Semantic Label 2,Semantic Label 3,Major_Semantic
fsey1yu,China playing 5d chess and we are stuck with ludo.,1136,0,1590925907.0,,False,negative,neutral,negative,negative
fsey93w,"Yup, main issue with this is the traders, they would just import Chinese goods repackage them as ' made in India ' and sell them. Without some sort of trade restrictions and improving the business atmosphere this might not be successful.",362,0,1590926086.0,,False,negative,negative,negative,negative
fsf9jdx,">When Pakistan attacks us, we retaliate with a surgical strike.  When China encroaches on our territory, we uninstall Chinese apps from our Chinese phones. 

Copied from Twitter.",242,0,1590934653.0,Pavandgpt,False,negative,negative,negative,negative
fsf09ux,An uncle posted a status asking to boycott Chinese products and when I asked which phone he is using he said that I don't know how to respect elders. 😂,738,0,1590927866.0,,False,negative,negative,negative,negative
fsf9whj,Boycott the 'boycott China' to boycott China .,39,0,1590934891.0,pridude,False,negative,negative,negative,negative
fsf2f7b,Primary distributor: Ironic Enterprises Pvt. Ltd.,72,0,1590929602.0,,False,neutral,neutral,neutral,neutral
fsf3c52,"China right now: ""Just like the simulations""",67,0,1590930296.0,,False,neutral,neutral,neutral,neutral
fsf5nj5,"Does anyone remember ""Indian browser"" made by someone from middle East ?",88,0,1590931976.0,,False,neutral,neutral,neutral,neutral
fsewv0m,"... with a ""made in India"" tag",120,0,1590924800.0,,False,neutral,neutral,neutral,neutral
fsf6inj,"We cannot stop using Chinese products at all because we don't have other substitutes . But yes one thing we can do and should do is minimise it as much as we can . I never had TikTok , played Pubg a lot last year and used UC Browser until now . We can only substitute things if we are given alternatives . Otherwise , we literally have no other option",66,0,1590932576.0,,False,negative,neutral,neutral,neutral
fsf8j7e,this is like the pune flagmaker making paki flags after pulwama attack...,14,0,1590933987.0,ImpulsiveTeen,False,negative,negative,neutral,negative
fsf5dpt,We stuck here in 2020 while China's there in 3020,41,0,1590931782.0,awildboyappeared,False,neutral,neutral,negative,neutral
fsf6ijl,Jst like 'I hate elvis' thing,12,0,1590932574.0,CaptainMimoe,False,negative,negative,negative,negative
fsf9kxp,Big Brain Time,11,0,1590934681.0,MN_Z,False,neutral,neutral,neutral,neutral
fsf0lov,Big oof,13,0,1590928142.0,Empty_Damage,False,negative,neutral,negative,negative
fsfcnya,"Why can't we boycott corrupt indian politicians ?
Matlab jad ko hi ukhaad fenko na.",27,0,1590936556.0,sleepyheadyeah,False,negative,negative,negative,negative
fsf28r0,"China also manufactures “Wah, Modi ji Wah”",26,0,1590929459.0,decipherseattle,False,neutral,neutral,neutral,neutral
fsffsz7,I never understood what effect it'll have we're harming both the included parties with this,5,0,1590938364.0,,False,negative,negative,negative,negative
fsfa9qu,"I highly doubt boycotting China will lead to anything at all. Even if we do boycott China, a huge part of Indian Economy will go down as well. Chinese Investments in Startups will stop and many startups will suffocate due that leading to higher unemployment.

Patriotism and Economy are not a good mix.",31,0,1590935123.0,brownpikachu08,False,negative,negative,negative,negative
fsf1ycs,"Slightly off topic, but I'm sick of seeing that particular IGTV video being reshared, again and again. Tbh, I hate that account, and people don't seem to stop the virtue signalling.",13,0,1590929232.0,poisonmonger,False,negative,negative,negative,negative
fsg3z5v,"It's difficult to untangle your countries reliance on China. We are dealing with the same problems here. Good luck India, you guys can do it. Greetings from the Netherlands.",5,0,1590951013.0,existential_plant,False,negative,neutral,positive,neutral
fsf9dvd,[deleted],13,0,1590934552.0,,False,neutral,neutral,negative,neutral
fsfd7qj,With regards to deleting apps shouldn't it be dictated as free market the reason why so many of us have chinese apps installed is because they are usually the best apps for their niche and indian apps are often lacking. Rather than boycotting shouldn't we try to make a better product so that we dont need these chinese apps anymore,4,0,1590936878.0,,False,neutral,neutral,neutral,neutral
fshe7df,These hashtags and videos would last for 2 months and then it gets washed away.These kind of hashtags trends occur when the people are in the peak of patriotism,3,0,1590975943.0,_Porinju_,1590984449.0,negative,neutral,neutral,neutral
fsewpr6,[deleted],29,0,1590924662.0,,False,neutral,neutral,negative,neutral
fsf03bu,U have outmasterd my smartness,8,0,1590927711.0,sureshr21,False,positive,positive,positive,positive
fsf6ysj,"After Markaz incident there were forwards in a family WhatsApp group to boycott all Muslims, followed by a forward on do’s and Dont’s for corona by a doctor (Muslim from Pakistan) 
My respect for that cousin sister increased! She showed how to say Shut up without disrespecting the elders ;)",19,0,1590932903.0,MadGo,False,neutral,positive,negative,neutral
fsf6tl6,"But Bro ""YoU cAn UnInStAlL tHeIr ApPs""",9,0,1590932782.0,wizzbang69,False,negative,neutral,neutral,neutral
fsf75ta,"Asking because I really do not know- is there any rhyme or reason to uninstall Chinese apps? 

Pubg ke bina din nahi dhalta but I'll do it if necessary",8,0,1590933053.0,Lady__stoneheart,False,negative,negative,neutral,negative
fsfeort,Time to r/avoidchineseproducts,3,0,1590937730.0,QuantumBuzz,False,neutral,neutral,neutral,neutral
fsfh0nz,"Lack of entrepreneurship on our side

why did anyone not think of this idea in India before ?",3,0,1590939043.0,,False,negative,negative,negative,negative
fsf5uhb,"So what does /r/India have against boycotting Chinese goods?(serious question) I think it’s high time we avoid products from Chinese companies at least, and lobby other companies to move their manufacturing out of china.",16,0,1590932114.0,sabreR7,False,negative,neutral,negative,negative
fsfgpo9,I hope the world seriously boycotts Chinese products and softwares.,2,0,1590938874.0,sarangifiedd,False,negative,negative,negative,negative
fsfgugg,People start with softwares first and then we can find a resolution for hardware.. Boycott made in China apps..,2,0,1590938948.0,ashishrawat1985,False,negative,negative,negative,negative
fsfs96q,"Why are citizens asked to boycott stuff, the government should play a role in limiting relations with china.",2,0,1590945029.0,,False,negative,negative,negative,negative
fsfswr3,People don't talk about what next after ban. Are there any alternatives of Chinese products which are equally good and at same price.,2,0,1590945370.0,,False,neutral,neutral,neutral,neutral
fsgxlur,source: trust me bro,2,0,1590966545.0,yiyo999,False,positive,neutral,neutral,neutral
fshgegu,That's like posting banned Chinese product from Chinese phone...,2,0,1590977218.0,N0RAH,False,negative,negative,negative,negative
fshp1oz,"I can hear Mr.Robot speak. 

They’ve packaged our fight into product, turned our dissent into intellectual property, televising our revolution with commercial breaks.

They’ve backdoored into our minds and robbed our truth, refurbished the facts, then marked up the price.

This is what they do. This is what they’re good at. This is their greatest trick.",2,0,1590982425.0,instagramisdumb,False,neutral,negative,negative,negative
fsiiegv,"Bycott china products !!...

.... Buycott china product by buying china products with made in india tag.

..... Buy cott china products !!!

...... Buy buy china products !!!..",2,0,1591007144.0,d4dhur,False,neutral,neutral,neutral,neutral
ful23yh,"Real life implementation of ""When life gives you lemons, make lemonade.""",2,0,1591957851.0,adityadasgupta99,False,neutral,neutral,neutral,neutral
fsezl2q,"I have never seen anyone wearing Tshirt like that, this is not the first time Boycott China shit has been spread across.",5,0,1590927276.0,,False,negative,negative,negative,negative
fsfcuu9,"Will these people continue to boycott China when (not if, when) they'll be the first to develop and mass-manufacture the COVID vaccine?",3,0,1590936668.0,reeram,False,negative,negative,negative,negative
fsf42bv,"In the meanwhile in Yorkshire, Geoffrey  Boycott is wondering ""Why the fooking Indians think that I am Chinese? I never bowled a Chinaman. Did I?""",4,0,1590930836.0,B_W_Rainbow,False,negative,negative,negative,negative
fsfdsf0,"I was expecting ‘we are already censored’ comments. 

Again, I’m not saying India is perfect and it is leaning towards authoritarian policies. But here’s the thing

1. Is Indian currency manipulated for decades?
2. Are we under communist rule where there are no elections and party is above people? That’s the key. Because you can’t have states and diversity blocking progress
3. From Facebook to google to Netflix to many other popular social, news sites are banned in China . Hell, gaming consoles were banned until 2015
4. There is 0 opposition to what govt does. Good luck with protesting, online or otherwise. So if they want to build the high speed network, no one will whine about it.
5. Oh, we need polices enforcement like one-child policy too, enforced like terrorism. 



So yea, if you’re looking for China as the model , India needs Modi x 100. You want it, good for you. But know the difference 

Make an informed opinion please.",2,0,1590937214.0,thebat85,False,negative,negative,negative,negative
fsf5wo4,Lol,1,0,1590932157.0,demo_crazy,False,neutral,positive,neutral,neutral
fsfcib1,What happened,1,0,1590936464.0,DestroyerOfDoom29,False,neutral,neutral,neutral,neutral
fsfdd1c,Source?,1,0,1590936964.0,YTAftershock,False,neutral,neutral,neutral,neutral
fsfgiaq,lol imagine the irony.,1,0,1590938761.0,AdudeFromIndia,False,negative,neutral,neutral,neutral
fsfgsty,Reverse uno.,1,0,1590938923.0,,False,neutral,neutral,positive,neutral
fsfmtz1,"*You may have outsmarted me, but I have outsmarted your outsmarting··*",1,0,1590942199.0,LogangYeddu,False,neutral,neutral,neutral,neutral
fsfn73f,Aren't t-shirts made in India and Bangladesh though?,1,0,1590942393.0,NinkuFlavius,False,neutral,neutral,neutral,neutral
fsfo7zx,Printed on a Chinese imported Tshirt😂,1,0,1590942932.0,mohammedashker,False,neutral,neutral,neutral,neutral
fsfpm99,Stealing this :P,1,0,1590943663.0,palashbehra5,False,positive,neutral,negative,neutral
fsftykl,"I think this whole approach is wrong. If you boycott China made, china will route it through Vietnam, Malaysia, Sri Lanka (which are now in debt to China) and label them as made in those countries. 
They infact did this for their Shrimp trade, when USA banned China shrimp imports as they were feeding them with some not-ok stuff. China set up a shell company in Malaysia and routed through that as made in Malaysia. And taders in USA only care about profits as long as label is legal and makes money. They know their shit

Right idea is to support Made-in-India. And train resources to be able to make stuff, than just use or service them",1,0,1590945910.0,myReddltId,False,negative,negative,negative,negative
fsfzsrg,For hardware it is almost impossible but I sincerely believe that India can live without Chinese apps. Alternative need not be Indian. If all of India quits Chinese apps it will have a noticeable impact.,1,0,1590948863.0,New_G,False,neutral,positive,neutral,neutral
fsg0vgp,I am dead. :D,1,0,1590949415.0,angrylonelyguy,False,positive,neutral,negative,neutral
fsg60k3,What a business model...,1,0,1590952072.0,howispendmyday,False,neutral,neutral,neutral,neutral
fsg7d27,China: I play from both sides so I always come out on top.,1,0,1590952776.0,lordknight96,False,positive,positive,neutral,positive
fsg8oti,"Marketing Forces

Anticipation of demand",1,0,1590953465.0,davidmlewisjr,False,neutral,neutral,neutral,neutral
fsgazqh,I support this boycott ... It may help Uighur Muslim....,1,0,1590954648.0,americandream123,False,positive,neutral,neutral,neutral
fsgbv6z,Ironic,1,0,1590955097.0,Madd_Prashant,False,negative,neutral,negative,negative
fsggom5,"What's India's beef with China right now?

Looks like China became the unpopular kid on the block real quick lately.",1,0,1590957615.0,etetepete,False,neutral,negative,negative,negative
fsgnq7c,Money is money.,1,0,1590961289.0,HummingArrow,False,neutral,neutral,neutral,neutral
fsgsgf5,Lol,1,0,1590963798.0,zen_veteran,False,neutral,positive,neutral,neutral
fshkkct,"This whole movement is too childish imo , that too when the trades and economy so much internationalized ..

Wasnt this because of some youtube - tiktok war ?",1,0,1590979688.0,naveen_reloaded,False,negative,negative,negative,negative
fshqlkn,"सभी काबिल और महान देशप्रेमी लोग जिनको चीन से बदला लेना है, सबसे पहले अपना फोन टॉयलेट में फेंक दें। शुरुआत अच्छी होगी।",1,0,1590983414.0,7sikander,False,neutral,neutral,neutral,neutral
fshtl6m,i\`ve won... But at what cost?,1,0,1590985371.0,awkward_guy92,False,neutral,neutral,positive,neutral
fshud9n,"One may not substitute everything but prevent takeover of Indian institutions by China. We can stop using companies with Chinese investments when there it’s not about money but convenience. Eg: Credit cards instead of Paytm, local shop instead of flipkart/Amazon.",1,0,1590985907.0,huhulala,False,neutral,neutral,positive,neutral
fshva3g,We should not only boycott china. But we should now start manufacturing the goods. This is the right time for Indian entrepreneurs to do something. This is a very crucial time.,1,0,1590986538.0,ankit213506,False,neutral,positive,positive,positive
fshytpb,"I'd give it one week time and everything will be forgotten. 

This has happened before and will happen again in future. The hate cycle continues.",1,0,1590989157.0,,False,negative,negative,negative,negative
fsi0k8p,"Imagine having a t-shirt of boycott China which has a tag with made in China 
Also, how is the communist party allowing this to happen ?",1,0,1590990506.0,,False,negative,negative,negative,negative
fsi2gph,We should boycott US made products as well. Made in India or elsewhere if we must,1,0,1590992024.0,drum_master,False,negative,negative,negative,negative
fsi3t7w,Master Player China. But India knows all the Tricks.,1,0,1590993161.0,rajatrajput28,False,neutral,neutral,positive,neutral
fsi5mfd,"IQ test pass.
now really boycott.😆",1,0,1590994740.0,Rohitss323,False,neutral,negative,negative,negative
fsibjo1,Is there a source for this?,1,0,1591000247.0,deathmetal27,False,neutral,neutral,neutral,neutral
fsieilh,"Latest News. 

China started Mass  production of stickers with slogan written on them "" BOYCOTT CHINESE PRODUCTS "" and exporting to India as there is a huge demand for the same here in India.",1,0,1591003219.0,hrishidev,False,neutral,neutral,negative,neutral
fsih680,Tell people to uninstall pubg mobile and see riots starting here,1,0,1591005917.0,dant3s,False,negative,negative,negative,negative
fsiigho,I understand that completting boycotting china is impossible. But lets  start at something than nothing honestly.,1,0,1591007200.0,thereisnosuch,False,negative,negative,negative,negative
fsilg61,At least credit the source!,1,0,1591010082.0,whycanttherebepeace,False,neutral,neutral,neutral,neutral
fsiq5qa,Modern problems require modern solutions,1,0,1591014075.0,,False,neutral,neutral,neutral,neutral
fsiv71w,Are those T-Shrits made in China?,1,0,1591017584.0,blitzkreig31,False,neutral,neutral,neutral,neutral
fslq996,"To people who think that these steps won't make any impact and we can't really avoid chinese products as they own nearly every company:

Taking small steps is better than doing nothing mate. You are waiting for a ""perfect revolution"" that is not feasible at this time. The idea is to target where it hurts the most ie companies with majority shares owned by Chinese government.",1,0,1591072579.0,,False,negative,neutral,neutral,neutral
fso1jkp,Boycott China is not going to happen in a day ! China has strong roots across the world.world is dependent on China due to lot of thing on of the most is cheap labor. To boycott u need to support your local brands / apps/ services etc.. for example this article are we going to leave without their pass ? Before deciding anything ( https://ibandhu.com/2020/05/31/list-of-chinese-apps-world-vs-china/ ). Start step by step . One more thing most of the electronic devices are made in China . Will all of us will leave without mobile phones in current time ?,1,0,1591126410.0,anand11987,False,negative,neutral,negative,negative
fsq332f,yes but ppl of r/india like to downvote when ever someone mentions stopping using xiomi and Vivo phones....,1,0,1591169085.0,rohithkumarsp,False,negative,neutral,positive,neutral
fsroatz,We really need to stop buying Chinese mobile phones.. atleast buying nokia kg samsung etc. (despite made in china) the money would go to other countries.. atleast we must start there.. else... We will be forfeting a lot... Aur ye tiktok... Mc.. ko band karo.. f#+&#,1,0,1591205914.0,anirudhsky,False,negative,neutral,negative,negative
fsxtex1,I will buy from who ever provides me the best value for my money. That's how competition and innovation works.,1,0,1591330941.0,,False,positive,positive,positive,positive
ftddqsr,First of all throw your chinese cellphone,1,0,1591626064.0,aatif667,False,negative,negative,negative,negative
fvhxouk,Hahaha!,1,0,1592704173.0,,False,positive,positive,positive,positive
fy1oo76,Modern problems require modern solutions,1,0,1594741797.0,,False,neutral,neutral,neutral,neutral
fsf3aye,Stop buying Xiomi and other Chinese based phones.,-1,0,1590930271.0,rohithkumarsp,False,negative,negative,negative,negative
fsfg8gg,"Boycotting China is really not a practical long term solution. In my opinion India has to do better than China and beat them in their own game on our home ground.

If we win this way then India would become a far more stronger country and probably would be able even beat China in China. We might not know how well Indians can do.",1,0,1590938605.0,chitrapuyuga,False,neutral,neutral,negative,neutral
fsfityl,"Hypocrisy is that most of the people who writes boycott China are writing from a phone which belongs to a Chinese company or is manufactured in china, people don't know that we can't boycott China  because we import essential stuff  from them the only thing we can reduce their influence in our markets is by manufacturing and strengthening of economy which by looking at today's standards is a diificult route.",1,0,1590940037.0,PGGamer21,False,negative,negative,negative,negative
fsh35jx,targeting the wrong country.,1,0,1590969615.0,,False,negative,negative,negative,negative
fsfg3p8,"So are a dozen Indian tshirt companies. Typical r/india material, against the mainstream sentiment masquerading as logical opinion. Not everything is nationalist jingoism. If it's not possible for an individual to boycott Chinese products, then don't. 

For the sake of few laughs and karma, please don't indulge in mocking our own manufacturing sector. This is the last thing that we require in the present situation. 

If not atma nirbhar, atleast have a bit of atma samman.",-2,0,1590938530.0,skaduush,False,negative,negative,negative,negative
fsf2qsk,"Simple put 1000% tax on any import from China 😎

Watch fireworks 😎",-1,0,1590929850.0,,False,neutral,neutral,negative,neutral
fsgwhly,India will get its ass handed over by China. Indian leadership is so corrupt and stupid that they think making rhetorical speeches is the road to salvation. China is the superpower of the world. Winne the flu would fuck india for breakfast.,0,0,1590965929.0,foxam1234,False,negative,negative,negative,negative
fsh2crk,Genius,0,0,1590969168.0,MarshawnDavidLynch,False,positive,positive,positive,positive
fshohmk,What about the Chinese vaccine that the world is about to implement?,0,0,1590982075.0,HChowky,False,neutral,neutral,neutral,neutral
ftp4uw4,Wow. How do you carry so much hatred!?!,0,0,1591885160.0,Soumikp,False,negative,negative,negative,negative
fsf7iev,[deleted],-1,0,1590933297.0,,False,neutral,neutral,negative,neutral
fsfiz75,Ya good luck,-1,0,1590940117.0,AnandhuBalan,False,positive,positive,positive,positive
fsf5vce,Source?,-2,0,1590932131.0,nigglebit,False,neutral,neutral,neutral,neutral
fsf3l2f,How ironic,-5,0,1590930481.0,footballisrugby,False,negative,neutral,negative,negative
fsf9nry,We are bunch of laudus,321,1,1590934733.0,Captain_Banana_pants,False,negative,negative,negative,negative
fshfxdb,[deleted],36,1,1590976942.0,,False,neutral,neutral,negative,neutral
fsfgwvw,"China is equally afraid. It is not playing 5D chess. India over the time is trying to boost its own game by rapid infrastructure development. So it is a bad game for China which largely depends on exports. 

India on the other hand has never been an exporter so our manufacturing supply would be mostly for our domestic customers. Thus the entire ecosystem in itself would be rewarding for consumers and producers equally. 

So either China has to invest in India to boost its revenues or the Indians, Europeans and Americans themselves would enter the game.",-27,1,1590938986.0,chitrapuyuga,False,neutral,neutral,neutral,neutral
fseypg8,"Why would you manufacture when China is selling everything dirt cheap.
U know, all lighters (cheap plastic ones) are made in china. For soo many years not even a single one has been made in india and why would they when Chinese are selling thema at ₹5",146,1,1590926492.0,thickestthicc,False,negative,negative,negative,negative
fsffkcg,"Exactly, you cant put cheap good quality stuff and expect people not to buy it",16,1,1590938226.0,,False,negative,negative,neutral,negative
fsgko02,"I think in the US, whenever something says made in USA, that means that only the end product assembly has to be completed there. So they start the product, ship it to China, and then bring it back to the US to finish. Or even if it is made in the US, they're using parts they've sourced from places like China. 

We don't live in a world where we can be fully self-reliant anymore. We never really did. No country has 100% of the resources to do everything on its own. There has to be a balance between being able to manage your own manufacturing to an extent and not being held hostage by having to import certain things from other countries.",13,1,1590959690.0,MissionStatistician,False,neutral,neutral,neutral,neutral
fsfdt8q,"Just got my USB hub. Check this out.
On the packaging: [Outer packaging](https://imgur.com/ZtV9Rfy)
On the hub: [Hub](https://imgur.com/cBvUP7U)",32,1,1590937227.0,,False,neutral,neutral,neutral,neutral
fsfnvsm,"A family friend had built a tech park some time, back pretty much all the furniture was Chinese  since a factory in China was willing to supply furniture directly for dirt cheap.",9,1,1590942754.0,Notsogoldencompany,False,neutral,neutral,neutral,neutral
fsfeqw3,"Traders and their Unions are the ones who have been pushing for Chinese product boycott for years since it hurts their business because they can't compete with Chinese cheap products ranging from diwali lights to those tiny god figurines to even freaking Agarbathis now. 

And since even lobbying the Govt isn't working because Govt knows boycott is stupid since not only might that entail WTO case lasting years but these cheap items sell because a broad section of Indians are buying them because its making their lives better than would otherwise be and third Indian trade is trivial from Chinese trade pie but Chinese trade is much bigger from Indian trade pie meaning retaliation may come from China which is currently unknown and Govt barely has a plan for that or any leverage because in reality, India-China trade isn't really what it could be. 

We need more trade with China to balance against them otherwise it will become like US-Soviets and India-Pakistan because both sides end up with the same conclusion when things get tough, i.e. *Who gives a crap, it doesn't really affect us, so go ahead do this XYZ stupid thing something decided we should do.*

But if there is tight trade relations both sides think multiple times and this is why US still hasn't broken economic relations and neither has China with US because it would wreck both. Imaging if both had already split, US would have hit back much harder like it does against Cuba, Venezuela, Iran, NK. 

Meaning Boycott China or any other country is not only anti-people but also anti-national in long term by practical resurrections.",20,1,1590937763.0,iVarun,False,negative,negative,negative,negative
fsg89gw,"The main issue is with Consumers. As long as consumers don’t demand something, status quo will remain.",1,1,1590953245.0,distinct_name,False,negative,negative,negative,negative
fsj4cxz,"It's not possible to completely boycott Chinese goods immediately. But we can start with not using their softwares, using indian lanterns,etc. And eventually boycotting parts/raw materials. Sonam wangchuk has explained all this brillantly in his videos. I mean china is profitting a lot from Indians using their apps and fancy lanterns. This will definitely be a good start.",1,1,1591022994.0,edgyguy77,False,neutral,neutral,negative,neutral
fsh7izl,I heard that china had invaded your border or something is that true,1,1,1590972104.0,Braydox,False,negative,neutral,negative,negative
fsg8l4m,"When pakistani pigeons enter our airspace, we run probes and interrogate them.

/s?",29,1,1590953412.0,shady797,False,neutral,neutral,neutral,neutral
