Comment ID,Comment Text,Comment Score,Comment Depth,Created Timestamp,Author,Edited,Semantic Label,Semantic Label 2,Semantic Label 3,Major_Semantic
fsfbft5,"Nope, the business owners just supply the goods that are in demand. If you stop using the goods, then why would a shop bring something that isn't being sold?
And alternatives are there, it's just that it's a bit more costly. 
Dude, don't talk bullshit, a citizen is a person who creates a demand, according to which trade is done. Now the govt can't straight up refuse trading things with China, as it would result many diplomatic problems, but we as citizens can stop the flow of Chinese products. Agreed, it'll take time, but i would give it a couple of years for the supply rate to come down by 50%. And that is more than enough for China.",2,2,1590935833.0,13_chan,False,neutral,neutral,negative,neutral
fsfs6cz,"My friend said he heard someone on insta discussing about how to boycott Chinese products and a mention about Indian government keeping an eye on China's share market. If this is the same guy, can you link me his video?",1,2,1590944989.0,sumedh0123,False,neutral,neutral,negative,neutral
fsf7xw6,"First you have to start seeing things for what they really are. Most of the electronics are “assembled“ in China. The chipsets are a rather niche market which China has gotten into only recently. Most chips in the world are made in Taiwan. I understand one can’t avoid electronics “assembled” in China, but they can buy from companies that aren’t Chinese. So buy a Samsung instead of Xiaomi.",10,2,1590933590.0,sabreR7,False,neutral,neutral,positive,neutral
fsft63v,"Although you make some accurate points but just flashing ROM doesn't solve the problem. The problem is not just privacy but the product itself. You are helping China just by buying Xiaomi phones.

So you flashed ROM. BOOM problem still remains. Unless some other countries push in this competitive price bracket, the problem will persist.",1,2,1590945503.0,sumedh0123,False,negative,negative,negative,negative
fsfargd,I am just saying don’t buy from chinese companies. Buying from non-Chinese companies even if their assembly is in China is all right for now. I understand we can’t go all local. But buying from non-chinese companies is the first step.,6,2,1590935425.0,sabreR7,False,neutral,neutral,neutral,neutral
fsfb8em,"And yet they can’t seem to figure out something as simple as the IC engine. Look it up, Chinese companies suck at making engines. You speak of them too highly, they are in fact on a similar intellectual property development position to India, possibly even lesser. They work hard I agree, but working hard is not everything. They are good at “assembling” stuff. While I do agree India wouldn’t make the best “assembly” plant. There are other models of moving “assembly” away from China.",3,2,1590935707.0,sabreR7,False,negative,negative,neutral,negative
fsfd39u,Read what I wrote again. I am simply suggesting not buying products from Chinese companies. Boycotting “Assembled” in China products maybe very difficult. But we can buy from non-chinese companies even if their assembly is in China.,4,2,1590936806.0,sabreR7,False,negative,neutral,negative,negative
fsf882w,"Most products people refer to, are only assembled in China. Companies choose to have their assembling plants in China, because of lower net movement. Agreed this is hard to simulate, but a distributed model is not the difficult with a little bit of determination on the company’s part.",1,2,1590933780.0,sabreR7,False,neutral,neutral,neutral,neutral
fsf8ah9,"The biggest problem is the red tape.  


Lots of countries have skilled labours.",0,2,1590933825.0,KhalilMirza,False,negative,negative,neutral,negative
fsffmbk,">don't want to voluntarily decrease it

There are competing products from non-chinese companies (assembled in china), which offer the same pricing.",0,2,1590938258.0,sabreR7,False,neutral,negative,neutral,neutral
fsf65tp,Even the most non Chinese phone company Apple has its parts made in China. Every fucking product has some if not all components made there.,15,2,1590932332.0,,False,negative,negative,negative,negative
fsf5k52,Why not?,0,2,1590931909.0,sabreR7,False,neutral,neutral,neutral,neutral
fsjfmo2,Yes talking about these things just tells the whole world that we are anti FDI and do not take the route the route of diplomacy as are primary contact.,1,2,1591028952.0,PGGamer21,False,negative,negative,negative,negative
fsf722i,Sivakasi ???,9,2,1590932980.0,,False,neutral,neutral,neutral,neutral
fsf8026,"What??!
As far as I remember all fireworks I bought were made in Sivakasi",3,2,1590933629.0,SA141299,False,neutral,neutral,neutral,neutral
fsfigvk,"Actually India is already on track for this smartphone thing as we speak. Over then years we have forced companies to come to India to assemble the smartphone if they want to sell here and be competitive. Thus you can see a host of companies either lined up or already set base here. 

I hope things extend further for other items too.",5,3,1590939840.0,chitrapuyuga,False,positive,neutral,positive,positive
fsfjq47,"We need to focus on complex manufacturing as well such as silicon fabs, or high-end watches, mechanical tools, etc.",3,3,1590940523.0,souvik234,False,neutral,neutral,neutral,neutral
fsfiwc7,"Yeah true, but the problem here is globally the consumption is going down. India is one of the only places where consumption is increasing. So it is a matter of time other companies come to India. 

I feel with access to foreign technology and their expertise coupled with our own experience we would first contribute to our people first and then slowly improve it further for global standards good enough to export it outside",3,3,1590940074.0,chitrapuyuga,False,neutral,neutral,positive,neutral
fsfh3et,Oh 🤣🤣🤣🤣,1,3,1590939084.0,chitrapuyuga,False,positive,neutral,neutral,neutral
fsfvspv,Plus doing these is going to hurt the poor section of the population (not made in china stuff is going to be expensive) and we have a lot of poor people in India. A similar situation arose during the swadeshi movement too.,41,3,1590946840.0,retard_seasoning,False,negative,negative,negative,negative
fsfu7tw,"In order to do that, Government needs to fund local businesses.. it takes time to grow such ideas. Can't have that, that's communism right? :P Yet the very same ideas are followed by other countries.",14,3,1590946040.0,,False,negative,neutral,negative,negative
fsfcjvm,"Yes these overly patriotic stupids don't know basic economics

Trade is bi-beneficial ALWAYS",57,3,1590936489.0,,False,negative,negative,negative,negative
fsh607w,"Exactly what went through my head when I read about these ban Chinese products trend on Social Media. 
This point is debatable but I think it would be bad for us if we ban Chinese products we aren't at that stage.",4,3,1590971237.0,Fahadali789gem,False,negative,neutral,negative,negative
fsfunp8,"American expat here. India needs massive work to become business friendly on a larger scale. In China, Vietnam, Indonesia deadlines can be met and the bureaucracy isn't insane like here. 

Here something is failing all the time. Worse, there is a serious lack of investment in the skilled workforce to solve the problems.

The prevailing attitude in the work culture here is often ""Do this work."" It is rarely the more useful attitude of ""Get this done."" India will continue to struggle to win work over from it's neighbors until this changes.",76,3,1590946263.0,FFF_in_WY,False,neutral,negative,negative,negative
fsffovh,"Also restricting chinese imports is kind off a power move, we can always say we don't want to be feel like we owe something but it'll be a spark for something or the other",1,3,1590938300.0,,False,neutral,neutral,negative,neutral
fsf2bz3,[deleted],-9,3,1590929531.0,,False,neutral,neutral,negative,neutral
fshzzyz,"With so much red tape and no help from the government, Yes.
Maha govt. was leasing land for ₹1 and this actually industrialized the area (MIDC)",3,3,1590990066.0,thickestthicc,False,neutral,neutral,negative,neutral
fsgksv6,"It depends. I'd suggest people check out the guidelines for what counts as a product made in India, if those exist. That would probably give an indication about how much of a product actually needs to be made in India and how much is not.",6,3,1590959760.0,MissionStatistician,False,neutral,neutral,negative,neutral
fsg89lu,They'll just say the box was made in India.,1,3,1590953247.0,shady797,False,neutral,neutral,neutral,neutral
fshg5o3,"So basically pre 1991 economic liberation, I wonder whether these #boycottchina kids know even the basics of economy, 

They are forgetting the goal's to hurt ***them economically*** and not to trap India into a trade-war with China and forcing Indians into buying inferior product, totally going against the free market principle.",2,3,1590977076.0,InsanePheonix,False,negative,negative,negative,negative
fsiqfbm,"This often comes up in Indian print news. Now naturally Traders union won't all come out and say it like this because that compromises their position and allows China to argue their case if this ever went to WTO trial (which are pretty common though and happen all the time, US is engaged in them the most). 

A few links over the recent years. 

2016 Oct -  [Traders in the Diamond City, Surat have decided not to sell the Chinese crackers owing to China's support for Pakistan](https://timesofindia.indiatimes.com/city/surat/Diwali-2016-Surtis-boycott-Chinese-crackers-this-Diwali/articleshow/55085968.cms)

It eventually led to 60% reduction as per [this article](https://www.thehindubusinessline.com/economy/chinese-goods-sale-dips-60-during-diwali-cait/article9288413.ece)

2016 Dec - [Among the groups leading the call was the Swadeshi Jagaran Manch \(SJM\), the economic wing of the Rashtriya Swayamsevak Sangh](https://www.indiatoday.in/magazine/the-big-story/story/20161226-chinese-goods-products-imports-india-830049-2016-12-15)

2019 Mar - [Indian traders burn Chinese goods in protest over blacklisting veto, trade](https://www.livemint.com/politics/news/indian-traders-burn-chinese-goods-in-protest-over-blacklisting-veto-trade-1553002922806.html)

2019 Aug - [Traders body CAIT calls for boycott of Chinese products, 500% Duty Hike](https://inc42.com/buzz/traders-calls-boycott-chinese-products/)

2019 Oct - [No takers for Chinese crackers in Vijayawada, Andhra](https://www.thehansindia.com/andhra-pradesh/no-takers-for-chinese-crackers--576116)  

Similar things happened in early to mid 2010s when e-com sites in India were giving those massive discount coupons and every 3rd month there would be some sort of Sale Bonanza and different Traders bodies would cause drama and write to Govt about how its illegal and undercutting the market and so on. 

Then there is the fact that Traders Unions in India do have power, sometimes official and sometimes underhanded. This is apparent in the APMC farmer-agri sector and the role of middle-men. 

Now agri produce sector isn't linked to China issue that much but the pattern is similar because its operating on a similar layer in India just linked to things which are connected to China and imports from there. It just so happens these traders can't control the input from China like they do in many other sectors in India (like agri) so they feel a loss of power and combine that with loss of revenue & greater profit and it is natural to see why they would be pissed and demand tariff hikes or bans on Chinese imports and since Govt won't do that, use Boycott calls often with Govt its ruling parties and their affiliates approvals.",2,3,1591014275.0,iVarun,False,neutral,neutral,negative,neutral
fsj8tsg,"> It's not opening it's pharma and IT services sectors for us.

Its true China has restrictive policies but they still exist on a curve/spectrum.  
Meaning in relative terms they are less than the respective Indian tariffs across multiple domains.  
Chinese tariffs were higher relative to many Western/OECD states NOT India, hence partly why Trump used raising US tariffs as a tool in his Trade War.  

There is a reason India backed out of RCEP, because India can't compete with Asian Tigers, SEA and Chinese economy on low/even tariff system. Or maybe it could(and we underestimate ourselves) but politically it can not because of the power of these trade and other unions which will be decimated at first before this destruction leads to more competitive Indian productivity (assuming everything goes according to plan, but India is too chicken to risk it, for now at least). 

> China doesn't give a shit about WTO

Patently wrong, it gives a lot of care both in terms of the commitment given to it in terms of technical change in recognition after 15 years of WTO membership but also because it engages in plenty of WTO dispute cases (US leading in this). Meaning it cares or else it wouldn't be taking part in them. 

Even the current Australian Beef & Barley sanctions are based technically on WTO guidelines, meaning it cares. 

>  India should do the same even if leads a case at WTO. Fuck WTO.

This is sort of silly takes which leads to condition countries in Africa or likes of Pakistan finds itself. 

China is here today because it played the Global system it didn't say to heck with the Global System. There is a vast difference between managing something and saying FU to that. Former is mature, latter is juvenile. And Govt knows this and why it hasn't officially supported the calls for Boycotting even though we know its affiliates like the RSS wing bodies and many Trade Unions (which had long BJP support links) are used as proxies. Meaning India is deploying asymmetric Trade War with China because an overt one hurts India because if India loses at the WTO it will be worse for India. So why do it officially when unofficially it is being tried. 

> at the same time it's making life worse for many many people who could have been employed in manufacturing these items imported from China.

This is a gross fallacy and devoid of any grounding proof.  

Do you know the numbers regarding firms which relocated out of China to other developing countries and what share did India have in them?  
https://www.livemint.com/industry/manufacturing/why-manufacturers-are-not-rushing-into-india-11570429217983.html

Meaning India can't even compete with countries which are multiple orders smaller, potentially less capable than them and one is to buy the argument that ONLY IF, there weren't these cheap Chinese products lives would have been better. 

This is a fantasy. India had first mover advantage in terms of local mobile OEMs with half a dozen of them being relevant and yet they squandered that when the Chinese OEMs finally came like a decade later to the scene. 

If even a decade head start is not enough your statement is unfounded and a fallacy. 

> Everyone of these labour intensive products imports lead to unemployment in India.

See the report from Oct 2019 above. There is plenty to make in the world and Indian internal market is big enough itself given that Chinese items across a wide range are still highly tariff-ed just like others. This statement would be valid if India wasn't getting out-competed on certain low level sectors by Bangladesh, Pakistan and Vietnam.  

Even the Pharma sector of India is reliant to Active Pharmaceutical Ingredients from China (which China supplies close to 80-90% on a global scale) and Chinese own Pharma & bio-sciences sector is much more advanced. 

The only 2 things which India had better was the IT sector because it started earlier on it and because of the English language proficiency being taught earlier in India relative to China where it picked up in 2000s so the first generation of graduates who are proficient are only now joining their workforce.  

And as seen over the 2010s, Indian IT no longer has that edge over Chinese IT stack either, they have enough domestic players of quality.  
The other was Banking finance modernization like IMPS (upon which UPI is made), it is THE premier stack in the world bar none, meaning no other country has a better system than this. But Chinese have enough to not require an alternative and neither does India require Chinese solutions on this sector, let alone Western who are decades behind on this. India doesn't allow Chinese Banks and China doesn't have Indian banks even of the scale that other Western countries have, meaning its not even a fair comparison because India at least first has to match Western companies level before it can cry Chinese are blocking. Clearly they weren't blocking when opening up to those Western countries, or else who did they end up there. Something would have happened, its obvious. 

Meaning it is a sector wise issue. Those saying China blocks Indian investment are missing the point of India barely has anything to offer of much value which China already doesn't have. Plus on top of that its moving up the value chain. And its a myth that Indian labor is cheapest in the world, in reality when PPP considerations are made India labor system creates a dynamic where labor is not cheap enough to be globally competitive, hence the outcome of that Oct article above.  
 
Although Oyo did expand like crazy and its Chinese operations became bigger than even Indian ones before its expansion issues started to cause its problems. So success can happen but it also requires daring because Chinese market is much more ruthless and mature than Indian one because they have had that destructive productive cycle already decades ago. China competes with the world, meaning its playing a different game and India can only match this IF its players match their level in their market and that is not easy because why would Indian companies even try that when their Indian operations alone are so massive or in many cases under threat from other Non-Indian vectors.  
Indian e-com sites for example, kept fighting each other and then had to deal with Amazon like a behemoth and now they can't focus on expansion elsewhere because they'd get walloped by Amazon of the little they do have going for them.  


> It's the government's fault for behaving as if this country is some middle income country and choosing a consumption led economic policy.

This may be a fair critique but it also is not so simple, because of PPP dynamics, India actually does have a internal consumption economy which is massive and unusual for its stage of development. Plus it becomes political because this class of people are politically powerful as voters. Meaning Party in Govt sort of becomes a passenger rather than some deliberate actor.  
The only thing that could be said of current Govt is that they had a clear majority so the agency they have is much different, they can get away with hard pills which other Govts can't.",2,3,1591025497.0,iVarun,False,negative,neutral,negative,negative
fshjy17,This is surely a long term effect. But people of India are sort of addicted to cheap Chinese Products including the major product: SmartPhones. So it's going to be very tough in this context.,2,3,1590979319.0,Souhardya_vintage,False,negative,negative,neutral,negative
fsiqu3j,"> it wont be cheap but as demand increases it can reach the standard both quality and price wise.

Name a country which did this? Not even Japan and S Korea did this since Americans forced their economies to open since they were/are basically protectorate nations post WW2. 

India could compete even now with China, why isn't it. Why can't it make freaking Agarbathis and god-figurines at scale and similar quality for similar or cheaper price? 

> If all countries come and decide on this then ccp can really be made to pay. 

And why would all countries do this when the first thing a country looks after is its self-interest. What is the self interest of 130 countries who have China as their No 1 trading partner which aligns with India? 

And not sticking it to the CCP ain't it, it needs to concrete.  

> enjoyed by everyone including the chinese people.

Yes, the Chinese people (who like most other in the world, if not even more than anyone being the Nationalists they are) will welcome other countries hurting the Chinese economy and they will welcome it. 

What an utterly ridiculous notion.",1,3,1591014583.0,iVarun,False,neutral,neutral,negative,neutral
fsf7tz1,Well I mean we did kill most of them,15,3,1590933516.0,the_Sideburner,False,negative,negative,negative,negative
fsf2p3d,Hello Abed Nadir,85,3,1590929815.0,,False,neutral,neutral,neutral,neutral
fsf5zrw,It's a meme at this point,11,3,1590932218.0,randomguy3993,False,negative,neutral,positive,neutral
fsf4kc4,https://www.reddit.com/r/india/comments/fm7yps/elders_must_be_respected_in_group/,26,3,1590931199.0,potatohime13,False,neutral,neutral,positive,neutral
fsh0seu,Cutting off your finger is the ultimate obedience. Or one of the ultimate obediences.,8,3,1590968290.0,cosmogli,False,neutral,negative,neutral,neutral
fsgkwlq,"This, but unironically is what my mom said to me last night.",1,3,1590959816.0,Yeezy350824,False,neutral,neutral,neutral,neutral
fsh6jcq,How much would the revenue be  20 -30 Rs a year ?,1,3,1590971537.0,Fahadali789gem,False,neutral,neutral,negative,neutral
fshf8x1,I am well aware and not an customer of any of them. Do what you can.,-1,3,1590976547.0,distinct_name,False,neutral,negative,positive,neutral
fsr5fdw,"This is too big brain, my brain can't handle this.",1,3,1591197052.0,Dotard007,False,negative,negative,negative,negative
fsi0krr,"It's a little more complicated than that.

The Indian developer bought some of the source code from a Pakistani developer who makes cheap ripoffs of famous apps and sells them to startups. Then they built the rest of the app themselves.

So people are claiming that the whole app is pakistani.",3,3,1590990518.0,,False,neutral,negative,neutral,neutral
fsfgrnn,"That's illegal, damn the bar is low",4,3,1590938905.0,Promethazine163,False,negative,negative,negative,negative
fsirfc5,They already do that,1,3,1591015011.0,inside-insight,False,neutral,neutral,neutral,neutral
fsfaer7,Modern problems require modern solutions,17,3,1590935211.0,not_a_normie100,False,neutral,neutral,neutral,neutral
fsf8if0,Aatma nirbhar,38,3,1590933972.0,orus,False,neutral,neutral,negative,neutral
fsfh44u,"iPhone 11 Pro Max. Costs about as much a decent motorcycle in India. 

Designed in California. Made in China.",12,3,1590939095.0,Promethazine163,False,neutral,neutral,neutral,neutral
fsffqmh,"I can see that argument for javaphones with 2g networks (that was the reason I used it back in 2012-13 in the first place), but that does not bode in android phones tbf.",18,3,1590938326.0,XpRienzo,False,neutral,neutral,neutral,neutral
fsffcue,"No it isn't, Xiaomi uses its own browser as default. I am a Xiaomi user since it came.",29,3,1590938108.0,,1590944928.0,neutral,neutral,positive,neutral
fsffm7m,I am having an OPPO phone,2,3,1590938256.0,,False,neutral,positive,positive,positive
fsfauml,"Ah, never used a MiUI phone",2,3,1590935477.0,XpRienzo,False,neutral,neutral,neutral,neutral
fsfrv5x,"China is way, way worse my dude.",0,3,1590944828.0,itsnachikethahere,False,negative,negative,negative,negative
fsfuxzl,"Appreciation is easy to take, Criticism is easy to give, and acting correctly when given either is difficult.",8,3,1590946406.0,,False,neutral,neutral,positive,neutral
fsghatp,"Repeat after me, criticizing government =/= hating India. It is basic democracy.",7,3,1590957936.0,LostFalcon5,False,negative,negative,negative,negative
fsfli33,How can you LOGIC?,-1,3,1590941493.0,lovejackdaniels,False,neutral,neutral,neutral,neutral
fsib31q,"Its not that people won't choose corrupt leaders, It's that they won't accept that their chosen leader is corrupt..",4,3,1590999797.0,,False,negative,negative,negative,negative
fsi8ftq,"Everyone is corrupt, so you choose the least corrupt.",1,3,1590997283.0,AiyyoIyer,False,negative,negative,negative,negative
fshbdxo,"Yeah, India is crony capitalism.",1,3,1590974336.0,cosmogli,False,negative,negative,negative,negative
fsiav0y,As if that's in anyway something that we should strive to consider as default,1,3,1590999581.0,,False,neutral,neutral,positive,neutral
fsiayed,"Well, without those protections you will have only crony capitalism which you seem to describe by using ""capitalism"". Only the rich guys have power in your version of it.",1,3,1590999674.0,,False,negative,negative,neutral,negative
fsf9ose,*auntynashunal,13,3,1590934751.0,,False,neutral,neutral,neutral,neutral
fsfg20q,"Tamilians are prejudiced against North Indians. Indians call South Indians Madrasis.  Northeast Indians are called c***kies.... need I say more? 
The concept of India has become 72 years old, and yet, we neither see unity nor pride, when we talk about India.

Voices like yours are the reason for the need of Nationalism.",6,3,1590938504.0,thugge,1590938794.0,negative,negative,negative,negative
fsg4unr,"It used to be Korean and that the problem. You shift to a new app and then seeing the apps popularity, Chinese investors buy it up. You can't boycott if there's no alternative and government support for industry in the country.",2,3,1590951469.0,BuddingBodhi88,False,neutral,neutral,neutral,neutral
fsf8ica,"You have to understand consumer economics, people will buy quality products that they can afford, to avoid buying something by a Chinese company there must exist an equally good or better product for the same price, even then the money will be going to some other country and not India unless we own up to supply our own market with high quality products.",26,3,1590933971.0,meanderingMaverick,False,neutral,neutral,neutral,neutral
