Comment ID,Comment Text,Comment Score,Comment Depth,Created Timestamp,Author,Edited,Semantic Label,Semantic Label 2,Semantic Label 3,Major_Semantic
fshvjsr,"> When Pakistan attacks us, we retaliate with a surgical strike

*citation required",12,1,1590986728.0,Froogler,False,negative,negative,neutral,negative
fshy0j2,China are much more badass than Pakistan tbf.,3,1,1590988544.0,ClintonDsouza,False,positive,positive,negative,positive
fsi0yca,">surgical strike

c'mon, it's obvious. The last thing this year needs is a WW3.",1,1,1590990816.0,,False,negative,negative,neutral,negative
fsf193g,*Elders must be respected in the group*,493,1,1590928673.0,darthvader9840,False,neutral,neutral,positive,neutral
fsf2goq,Special rules for me but not for thee.,26,1,1590929634.0,,False,neutral,neutral,neutral,neutral
fsf0rll,LOL. Even an innocent question is seen as disrespect.,65,1,1590928276.0,arinthum_ariyamalum,False,negative,negative,negative,negative
fsf4y4u,"You should have told him that you respect elders, hence why you asked nicely. If it was one of the friends, then called out their hypocrisy and stupidity with some crass words.",16,1,1590931473.0,sahit24,False,neutral,negative,negative,negative
fsf42zo,Starting to boycott chinese apps and product without throwing away existing phone is also an option.,29,1,1590930848.0,quaglamel,False,negative,negative,negative,negative
fsf7bc0,"People should be respected for what they do, not for their age or position. Of course, no point in telling them.",7,1,1590933161.0,fewstepsahead,False,neutral,neutral,positive,neutral
fsfdiya,"Oh oh, same happened with me. Except the exchange was with a person my age, and he called me a ""termite"" and ""such a negative person"" :(",3,1,1590937061.0,Nsci,1590937287.0,negative,negative,negative,negative
fsfycsw,Uncle ko bolo apna respect leke gaand mein daale.,4,1,1590948125.0,iphone4Suser,False,neutral,neutral,positive,neutral
fsf4ltu,"A curious question, already bought phone would increase the revenue of china or not.",3,1,1590931229.0,qnx24,False,neutral,neutral,positive,neutral
fsf6z0b,"a friend posted boycotss chinese phones and electronics, out of curiosity i asked which phone should i buy now? pat comes the reply ""bro atleast you can delete the apps and then eventually not use the phones made in china""",-2,1,1590932907.0,wizzbang69,False,neutral,negative,negative,negative
fshzx1m,"I dunno, maybe he does not has a say in his brand of phone as he might be using 2 yr old phone junked by his son and he will proudly use it for 2 more years.",0,1,1590990002.0,,False,neutral,neutral,neutral,neutral
fsg8jx3,"Should start with where alternate is available. May be not a phone but be conscious about where your shirt, food is coming from. China exports food to India too in case you are not aware.",-1,1,1590953395.0,distinct_name,False,neutral,neutral,neutral,neutral
fsgcpk7,"Because you were being a condescending bitch. Had you said that he should not buy a Chinese phone in the future as he is using now, he might have respected your opinion. But guess what, maybe you don't know how to respect elders.",-2,1,1590955532.0,mohitmayank,False,negative,negative,negative,negative
fshge79,Boycottception,10,1,1590977214.0,InsanePheonix,False,negative,negative,negative,negative
fsgq4ny,You have right idea.,3,1,1590962563.0,Groogey,False,positive,positive,neutral,positive
fsfd3b1,Which one was it I wanna know,14,1,1590936807.0,,False,neutral,neutral,neutral,neutral
fsfmuv1,Peperidge Farm remembers,22,1,1590942212.0,bootylover81,False,neutral,neutral,neutral,neutral
fsgm2mv,"Mitron, the Indian alternative to TikTok, has been developed by a Pakistani.",6,1,1590960424.0,compulsiveranter,False,neutral,neutral,neutral,neutral
fsg2w2u,"Anyone remember Telegram called a ""Made in India"" alternative to WhatsApp?",1,1,1590950447.0,,False,neutral,neutral,negative,neutral
fsgvqd6,Just use firefox lol. It's open source,0,1,1590965527.0,CuntfaceMcgoober,False,positive,positive,positive,positive
fsf4dvn,And only the tag is made in India. This actually happens and is completely legal.,89,1,1590931069.0,Promethazine163,False,neutral,neutral,neutral,neutral
fsf8y23,">used UC Browser until now

Any particular reason why? It's one of the shittiest and shadiest browsers in existence in my experience. Genuinely curious why someone would deliberately use it",126,1,1590934260.0,XpRienzo,False,negative,negative,negative,negative
fsf9jt8,"Yes that’s true. But if you’re ok to pay the price with stranglehold on social liberties, trade malpractices and extreme censorship  , India can be there too. 

Not trying to disregard China’s rise, but that model is hard to replicate without an authoritarian regime.",27,1,1590934661.0,thebat85,False,negative,negative,negative,negative
fsfv8ms,can't... politicians are the average of all the common people's ideas. Only by changing the populace can we change it's politicians.,9,1,1590946557.0,,False,negative,negative,negative,negative
fsfem6k,"Foreshadowing , that’s one of the downside we all need to addressed . Investors will run away, no better substitutes for poor,unemployment from business and economic will drown. 

One solution is to work on Regionalism and it will be a hard and long path to move there from globalization",18,1,1590937688.0,Bingobango20,False,negative,negative,negative,negative
fsfzzzp,">Patriotism and Economy are not a good mix.

Correction if I may, Patriotism when combined with Economy is the best combination what a country can hope for, look into the history of any, if not all, developed country. It is the Nationalism, where problem arises.

The underlying differentiation between Patriotism and Nationalism turns out to reason behind most of the problems or inability to see the problem. 

While both may seems to similar even synonyms for a same feeling. One at it heart is putting the well being and the interest of it and by extension its people at priority and other just putting the borders it define on a pedestal blundly, second to none.",1,1,1590948968.0,jimmyjee,False,negative,neutral,neutral,neutral
fsf612d,He mentions how we must boycott China but says nothing about the lacklustre Indian companies or the lack of infrastructure and technologically driven solutions in our country which is how China has become a huge player.,19,1,1590932243.0,,False,negative,negative,positive,negative
fshgzh0,"Yup , that igtv video is just manipulating minds now , rather than giving solution

 doesn't even talk about how worse the Indian brands are(or rather how non-existent they are)",2,1,1590977564.0,InsanePheonix,False,negative,negative,negative,negative
fsfv2l0,">The problem is doing business in India is VERY TOUGH. Cut throat competition everywhere

But competition is the basis of a good capitalist economy isn't it?",4,1,1590946472.0,,False,negative,negative,negative,negative
fsf1r58,r/thatsthejoke,37,1,1590929074.0,masprocas,False,neutral,neutral,neutral,neutral
fsf72s0,"Welcome from Facebook, I guess?",7,1,1590932993.0,SiRaymando,False,positive,positive,positive,positive
fsffoze,How is this related to the topic under discussion?,14,1,1590938302.0,thugge,False,neutral,neutral,neutral,neutral
fsf8u85,Because Fuck China. 'Aatmanirbhar Bharat',14,1,1590934190.0,,1590934772.0,negative,negative,negative,negative
fsftquc,"There are at least three reasons behind this call

1. Revenue to China from India: To reduce the revenue generated by Chinese apps in India. Because, it's Indian money some of which eventually goes into CCP's pockets, and they bully us at borders.

2. Privacy of Indians: CCP forces the Chinese companies to share data with them. So, lot of Indians' privacy at stake.

3. Puts our democracy at threat: And they can use this data to manipulate our democracy (by targeted ads or other unknown tactics), and they can get a relative advantage during conflict (for example, TikTok censors posts critical of China by Indians and doesn't show it to other Indians; they can use their platform to peddle CCP's propaganda).",4,1,1590945799.0,IdeasRealizer,False,negative,negative,negative,negative
fshgqzu,"If not economic then privacy concerns , I guess we chose Google/fb to be the lesser of the two evils.",1,1,1590977425.0,InsanePheonix,False,negative,negative,negative,negative
fsfbnrm,Isn't pubg Korean or something?,-1,1,1590935964.0,YamnaT777,False,neutral,neutral,neutral,neutral
fsf6lob,"It’s not possible to stop using Chinese products. It’s not just india, so many countries use Chinese manufactured products. Look around your room and most of those things are either made in China or assembled there. At citizen level we can’t create a trade war with China because we just don’t have any good alternative. Indian products can’t match the quality. 

I’m not saying we should use Chinese products but only the business owners and government can create a stop to the Chinese products. On a personal level it will take decades to completely stop using their products and that won’t happen with an instagram video of someone obnoxiously shouting at you.",48,1,1590932633.0,abhi1260,False,negative,negative,negative,negative
fsf7ifz,"Yes. I'd love to boycott China. But what other alternative do I have? Let's say I want to buy a new phone. Why tf should I boycott Xiaomi which gives me a decent mid ranger and go for a shitty  Micromax? (who btw actually import Chinese phones and just put up their logo lmao) And please don't give me the privacy factor. I flashed a custom rom. Boom solved. I don't think Micromax phones even have any sort of developer support. 


Almost all the electronics that are made use chips made in China. How do you plan on boycotting that? India is a country which can't even feed it's poor and you expect this country to start mass producing something as complex as a computer chip?",30,1,1590933298.0,pm_mi_lou,False,negative,negative,negative,negative
fsf9qql,[deleted],14,1,1590934787.0,,False,neutral,neutral,negative,neutral
fsf9ojz,"You can’t match the cost efficiency of China , they have got economies of scale, they are not stringent on labour laws , and frankly they have a much better ecosystem and innovation than India . 

There are clusters of districts that are strategically developed in a hub and spoke model to build products. Google “ China’s shoe district “. You simply can’t beat their economics anytime soon.",11,1,1590934747.0,milk_runner,False,positive,positive,neutral,positive
fsfcjxw,"https://qz.com/india/1079903/india-simply-cannot-afford-to-boycott-made-in-china/

Le ye padh le lodu.

You don do business like this in this massively globalised world, you prove yourself as a viable option, setup manufacturing plants, educate people important skills and build better cheaper products than your competitors..... you don’t fight like muhalle ki aunties.

Last time Indian ministers spoke something about boycotting Chinese products, China sent a threat letter to Indian government threatening to stop all imports saying “India’s export to China is a big percentage of its total export, while Chinese export to India is not that substantial”, in other words “FUCK YOU”",11,1,1590936490.0,UserameChecksOut,False,neutral,negative,negative,negative
fsf6zit,"To lobby other companies to shift production to India we would have to compete against China by providing them ease of doing business in India, access to skilled labour (we have a dire shortage), unquestioned environmental clearences etc.   


This is something we cannot over haul in a year but slowly maybe in a decade or two with good policies and equally good implementation.",4,1,1590932926.0,meanderingMaverick,False,neutral,neutral,neutral,neutral
fsff6oi,"i love my income and don't want to voluntarily decrease it :)

Also ISI has failed for the most part.",3,1,1590938010.0,boiipuss,False,neutral,neutral,neutral,neutral
fsf6mlq,You need proper replacement/alternative for Chinese products at similar prices for that to happen making noise on social media won't make people abandon their products.,3,1,1590932650.0,,False,negative,negative,neutral,negative
fso1jqc,"**I found links in your comment that were not hyperlinked:**

* [world.world](https://world.world)

*I did the honors for you.*

***

^[delete](https://www.reddit.com/message/compose?to=%2Fu%2FLinkifyBot&subject=delete%20fso1jkp&message=Click%20the%20send%20button%20to%20delete%20the%20false%20positive.) ^| ^[information](https://np.reddit.com/u/LinkifyBot/comments/gkkf7p) ^| ^<3",2,1,1591126412.0,LinkifyBot,False,neutral,neutral,neutral,neutral
fsf432y,No,6,1,1590930850.0,samelr19,False,neutral,neutral,negative,neutral
fsfle06,I will continue to buy it. Now go cry.,2,1,1590941432.0,k3times,False,negative,positive,negative,negative
fshdzsl,I think no one can boycott anything from other countries in this modern world.,2,1,1590975821.0,_Porinju_,False,neutral,neutral,negative,neutral
fsf3r7g,"Not possible, all fireworks are made in China",16,1,1590930610.0,Corporal_Cavernosa,False,negative,negative,negative,negative
fsfajd0,*cough* Belt and Road Initiative *cough*,2,1,1590935289.0,samelr19,False,neutral,neutral,negative,neutral
fsi0deg,"Wo lodu+
Khush?",6,2,1590990357.0,Alt_578,False,neutral,neutral,neutral,neutral
fshxf22,"Done....

*Mission passed* 

*Respect +*",3,2,1590988093.0,axlrose96,False,positive,positive,positive,positive
fshpd7j,[deleted],1,2,1590982626.0,,False,neutral,neutral,negative,neutral
ftp4xj6,Oooofff,1,2,1591885199.0,Soumikp,False,neutral,neutral,neutral,neutral
fsfi67n,"China's consumer market has evolved drastically in the past decade. It's no longer solely depended on exports , but you do make good point about India. It's high time we amend our laws regarding manufacturing and attract more investors. If anything, we need to capitalise on the current situation. It's electronics we need to focus on first. Example: smartphones. Either it's made in china or made by a  Chinese company in India.",29,2,1590939678.0,,False,positive,positive,positive,positive
fsfilud,"Problem with India not being an export oriented nation is that we are much poorer than China. As a result, our infrastructure and standard of living is way behind China's. And it can't improve unless India also increases it's exporters.",5,2,1590939914.0,damn_69_son,False,negative,negative,negative,negative
fsfi5yq,"NGL, this information holds value, thanks ;)",1,2,1590939674.0,iiexistenzeii,False,positive,positive,positive,positive
fsfh17v,[deleted],0,2,1590939052.0,,False,neutral,neutral,negative,neutral
fsfhxy5,r/iamverysmart,-2,2,1590939553.0,shreyansh_suvin,False,neutral,positive,neutral,neutral
fsf6crz,"It's not just the cheap selling point (it's one of the big ones sure), Indian products are shit quality in the same price point. We want to be self reliant without understanding the basics of consumer behavior.",156,2,1590932464.0,Sharchomp,False,negative,negative,negative,negative
fsez3bk,We need to look at the industries and businesses exiting China and try to make them manufacture in India. But most importantly improve the condition of Indian businesses so that they we can create an economy that is driven by domestic consumption.,48,2,1590926840.0,,False,neutral,neutral,positive,neutral
fsfl2i6,"I think point here is to start manufacturing on our own. We can make things cheap too, it's not like we don't have unemployment / poor labour pool. We need to setup efficient manufacturing with the express intention to compete with China. It has to be a serious endeavor, spanning decades, but it's not impossible. Can we as citizens too start making conscious choices?

Also, remember, lowest price does not always win. Mostly, yes, but not always.",6,2,1590941258.0,newplayerentered,False,neutral,neutral,neutral,neutral
fshzqxy,"So basically, nobody should even try",1,2,1590989870.0,,False,negative,negative,negative,negative
fsfhcmv,Probably the 'package' was made in india! :p,29,2,1590939227.0,KryptoniteDong,False,neutral,neutral,neutral,neutral
fsfsgz5,Isn't that a clear case of fraud and malpractice?,10,2,1590945142.0,velocity_v50,False,negative,negative,negative,negative
fsg4tud,">Traders and their Unions are the ones who have been pushing for Chinese product boycott for years since it hurts their business because they can't compete with Chinese cheap products ranging from diwali lights to those tiny god figurines to even freaking Agarbathis now.

Or may be they want to restrict the ability of the general public to import items cheaply so that a select few can  import,  rebadge with their own branding, and then sell with a fat markup. They have a problem right now because if they do too much of this, people import from the source directly. 

Personally, I don't think traders care about Make in India or Indian manufacturing.",14,2,1590951458.0,puneredditor,False,negative,negative,negative,negative
fshngpo,Do you have any articles or stuff on this topic? Would love to read more about it. Thanks.,2,2,1590981442.0,pm_mi_lou,False,positive,positive,positive,positive
fsis0is,"> We need more trade with China

Blame China. It's not opening it's pharma and IT services sectors for us. China doesn't give a shit about WTO. It does what's good for it's people. India should do the same even if leads a case at WTO. Fuck WTO. 

> cheap items sell because a broad section of Indians are buying them because its making their lives better

at the same time it's making life worse for many many people who could have been employed in manufacturing these items imported from China. Everyone of these labour intensive products imports lead to unemployment in India. It's the government's fault for behaving as if this country is some middle income country and choosing a consumption led economic policy. This has only become worse under Modi.",1,2,1591015432.0,Ultimate-Taco,False,negative,negative,negative,negative
fsfpfxk,"This is not helping the cause. As more trade means more money to ccp. More money means more investment in virus research. We already are seeing the results cannot go through another one in coming ten years. 

Its difficult but its not impossible. There will be substitute, it wont be as good, it wont be cheap but as demand increases it can reach the standard both quality and price wise. Also if public stops or avoid buying soon companies will have no other option but to move their production out of china. 

If all countries come and decide on this then ccp can really be made to pay. It will take many years but the fruits will be enjoyed by everyone including the chinese people.",-3,2,1590943571.0,moab911,False,negative,negative,negative,negative
fsf2npx,Even Elder Dragons don't demand this much respect,52,2,1590929785.0,,False,negative,negative,neutral,negative
fsf2hst,"M E T A

E

T

A",154,2,1590929658.0,sparoc3,False,neutral,neutral,neutral,neutral
fsf2rlx,Do you have the link to the original post which started this meme?,17,2,1590929867.0,shinchan_pyara_pyara,False,neutral,neutral,neutral,neutral
fsffrl2,Questions are a western constructs. Blind obedience is our great Indian Culture. ^(/s),67,2,1590938342.0,sleepygamer92,False,negative,positive,neutral,neutral
fsfd7c1,"Those are ""sedition charges"" against you.",7,2,1590936872.0,bustedbulla,False,negative,negative,negative,negative
fsf5qs5,One modern idiom and they cry.,13,2,1590932041.0,Pro_M_the_King52,False,negative,negative,negative,negative
fsfudjb,because they can't answer. They would rather avoid the situation by invoking authority.,3,2,1590946122.0,,False,negative,negative,negative,negative
fsf5qed,Uncle is also a frequent Ola user and promotes PayTM as a part of Make in India movement.,19,2,1590932034.0,,False,neutral,positive,neutral,neutral
fsfangg,They know this. You think these people genuinely care? They're just desperate to show how smart they are,10,2,1590935357.0,SoulsBorNioKiro,False,negative,negative,neutral,negative
fsfuihi,data being collected without knowledge and ads shown on the UI will definitely increase revenue.,1,2,1590946191.0,,False,neutral,positive,positive,positive
fsf8hth,"He's not wrong. No sane person is advocating throwing away everything Chinese in origin. Entire countries would fail. Start somewhere, maybe give them less data. Next time you upgrade, try using phones not made completely in china",14,2,1590933961.0,AnotherAltiMade,False,negative,negative,negative,negative
fsf798a,Hahahahah hypocrisy ki bhi seema hoti hai 😂,2,2,1590933120.0,,False,negative,negative,negative,negative
fsfhbyp,BuT iT's AlL oR nOtHiNg,1,2,1590939216.0,SreesanthTakesIt,False,neutral,neutral,positive,neutral
fsh6jss,"China also invests in Ola, PayTm and BigBasket in case your hypocrite ass wants to take the easy route.",4,2,1590971544.0,,False,negative,negative,neutral,negative
fsfirda,"It literally was ""Indian browser""",38,2,1590939999.0,shitclay,False,neutral,neutral,neutral,neutral
fsgv0bw,Some Android app with Indian flag in icon. The dev address showed middle east.,3,2,1590965149.0,TendarCoconut,False,neutral,neutral,neutral,neutral
fshf5ji,"Lol, seriously?",2,2,1590976493.0,Qyuk,False,negative,neutral,neutral,neutral
fsg82wt,Wasn't that supposed to be Hike?,8,2,1590953150.0,PraneethRed,False,neutral,neutral,neutral,neutral
fsg404k,I do lmao.,2,2,1590951027.0,ajhunter99,False,neutral,neutral,neutral,neutral
fsg8es5,Wtf? Was this really a thing? This actually explains the large number of uncles who suddenly joined telegram and i started getting notifications,1,2,1590953322.0,shady797,False,neutral,negative,negative,negative
fsfgpd1,Imagine if China starts to make 'Made in India' tags.,19,2,1590938869.0,gptz,False,neutral,neutral,neutral,neutral
fsf5l58,[deleted],62,2,1590931928.0,,False,neutral,neutral,negative,neutral
fsfgf9o,"Happens with everything, if you have a hammer you can remove the rubber handle and it will probably say ""made in China"" there.

They just make the rubber handle in whatever country they are sold with stamped ""made in xxxx"" instead.

found out that when i was buying tools, people actually paid more to have it stamped ""made in US"" for example, even if it was the exact same tool.",5,2,1590938713.0,,False,neutral,neutral,neutral,neutral
fsgnj7k,So are most computer parts made in China,1,2,1590961187.0,,False,neutral,neutral,neutral,neutral
fsf9cj9,Literally my exact thought,27,2,1590934529.0,anshumanacharya,False,neutral,neutral,negative,neutral
fsffldy,It was good for downloading movies and large sized files imo .,15,2,1590938244.0,,False,positive,positive,positive,positive
fsfnhz6,I used to use it on my 2g keypad nokia phones back in the day but never after i upgraded to Android....Chrome is just smooth and free of the useless junk it has,6,2,1590942553.0,bootylover81,False,neutral,positive,positive,positive
fsfalir,It's the default browser on Xiaomi phones IIRC,6,2,1590935325.0,not_a_normie100,False,neutral,neutral,neutral,neutral
fsftg4y,I've noticed many who Allow notifications from the shitty spyware ad sites say yes to installing UC bullshit.,1,2,1590945647.0,didnotreddit12,False,negative,negative,negative,negative
fsgvafi,Inbuilt video downloader. UC Browser is great for piracy.,1,2,1590965295.0,TendarCoconut,False,positive,positive,neutral,positive
fshgbzq,I guess it gave easy access to *those websites*,1,2,1590977178.0,InsanePheonix,False,neutral,neutral,neutral,neutral
fsf9vsm,"Unfortunately India is also turning into mini-china under the rule of extremists, only without the economy and global power.",35,2,1590934879.0,,False,negative,negative,negative,negative
fsfamva,"We already have a stranglehold on social and civil liberties, trade malpractices and censorship, just not the economic growth and development to go with it.",10,2,1590935347.0,itsybitsymayfly,False,negative,negative,negative,negative
fsfahda,"Tbh ""social liberties"" doesn't mean anything when more than half the population can't get food on their plates",10,2,1590935255.0,not_a_normie100,False,negative,negative,negative,negative
fsffdn7,"Welcome to r/india, where any appreciation for India will receive the highest downvotes.

Edit: It looks like -5 became +2, so I stand corrected.",0,2,1590938120.0,thugge,1590949660.0,neutral,neutral,positive,neutral
fshkgbb,"In a perfect democracy sure, but in real life democracies can be unrepresentative for a ton of reasons. I'm not going to pretend I know the exact situation in all of India, but I would bet most people would not chose a corrupt person as their ideal politician.",4,2,1590979621.0,Bobzilla0,1590980053.0,negative,negative,negative,negative
fsgtsm6,Yeah India ain't capitalist doe,3,2,1590964507.0,ImHopelesslyInLove,False,neutral,neutral,neutral,neutral
fsgw8d3,[deleted],2,2,1590965792.0,,False,neutral,neutral,negative,neutral
fshgjxb,"If not capitalist then atleast the basis for a good economy or even a ""free market""",1,2,1590977308.0,InsanePheonix,False,neutral,neutral,negative,neutral
fsfqqt5,What did he say?,1,2,1590944244.0,sumedh0123,False,neutral,neutral,neutral,neutral
fsfn5r1,I was commenting under a comment about WhatsApp groups and elders asking to boycott things ... Didn’t realize it got posted under the main discussion,9,2,1590942373.0,MadGo,False,neutral,negative,negative,negative
fsf9nb4,No. Fuck India. Be vocal about local. Don't be antinesnal,11,2,1590934725.0,Lady__stoneheart,False,negative,negative,negative,negative
fsfs91y,"It's owned by Tencent group iirc, they're one of the largest Chinese companies",3,2,1590945027.0,itsnachikethahere,False,neutral,neutral,neutral,neutral
fsf7ctw,"I understand it’s not possible to avoid products made in China. As most electronics are assembled in China. But we can avoid products from Chinese companies relatively easily. So, instead of buying a Mi TV, buy from a company that isn’t a Chinese company even of their assembly is in China.",2,2,1590933189.0,sabreR7,False,neutral,neutral,positive,neutral
