Comment ID,Comment Text,Comment Score,Comment Depth,Created Timestamp,Author,Edited,Semantic Label,Semantic Label 2,Semantic Label 3,Major_Semantic
fuse792,Thanks for checking on them. You're nice. :),6,2,1592129579.0,AtomR,False,positive,positive,positive,positive
fuvh7b3,Yeah better. Thanks for checking. :),2,2,1592199061.0,AiyyoIyer,False,positive,positive,positive,positive
fuvh841,Yeah better now. :),1,2,1592199079.0,AiyyoIyer,False,positive,positive,neutral,positive
fuskau9,Yes. And the guy is arguing with me when i told him to have some respect. I didn't know people lacked so basic decency.,10,2,1592135536.0,,False,negative,negative,negative,negative
fuslbui,Maybe. But my main focus was on the leak part. How people are circulating it without shame.,9,2,1592136472.0,,False,neutral,neutral,negative,neutral
fusc9m9,[https://www.indiatoday.in/movies/celebrities/story/sushant-singh-rajput-s-ex-manager-disha-salian-dies-at-28-unreal-says-bollywood-1687502-2020-06-10](https://www.indiatoday.in/movies/celebrities/story/sushant-singh-rajput-s-ex-manager-disha-salian-dies-at-28-unreal-says-bollywood-1687502-2020-06-10),8,2,1592127598.0,heterosexualcucumber,False,neutral,neutral,negative,neutral
fusc5ws,[Here's a link](https://www.india.com/entertainment/tv-news-disha-salians-death-case-update-mumbai-police-questions-beau-rohan-rai-and-friends-at-the-party-4055891/),2,2,1592127493.0,nihalmahesh,False,neutral,neutral,negative,neutral
fusduuz,[removed],2,2,1592129226.0,,False,neutral,neutral,negative,neutral
fuse33h,[deleted],1,2,1592129462.0,,False,neutral,neutral,negative,neutral
fusdtlg,[removed],1,2,1592129191.0,,False,neutral,neutral,negative,neutral
fuse8hb,[removed],-2,2,1592129613.0,,False,neutral,neutral,negative,neutral
futrllo,I actually had some blackouts where i couldn't remember what happened. Its funny now but i don't remember driving once. I just reached my destination.  It was weird. And my schizophrenia was mild but i kept writing in my diary what my thoughts were. I still go to therapy sometimes and the diary helped a lot. I am sorry if i wasn't able to help much but those times are like a bad dream to me. A bad dream that i have mostly forgotten. I am good now and studying vigorously for my exams. Mostly my friends helped me through this.,1,2,1592162115.0,Wizard_Eternal,False,negative,neutral,neutral,neutral
futp4vm,[deleted],1,2,1592160759.0,,False,neutral,neutral,negative,neutral
fusxv1o,I’ve received at least 5 messages of it from different groups.,2,2,1592145529.0,sam-sepiol,False,neutral,neutral,neutral,neutral
fut02zm,Yeah. True. It has something to do with the population factor and inefficient decentralisation as well. US has same problem of stress issues while smaller countries like NZ or European countries may be better.,5,2,1592146864.0,pentacle555,False,negative,neutral,neutral,neutral
futj4kp,"Thanks a lot ) I was planning to delete social media indeed
Will do so",2,2,1592157472.0,11mm03,False,positive,positive,positive,positive
fut5wd4,Thanks a lot for this it will help me.:) However I didn't understand what disorder you are talking about?,1,2,1592150194.0,11mm03,False,positive,positive,neutral,positive
futiey4,"Thanks a lot :)  Your advice was really helpful 
Will continue to work on myslef",1,2,1592157081.0,11mm03,False,positive,positive,positive,positive
futhwno,Thanks a lot :) yes I have forgiven some of my friends as I understand everyone deserves more than one chance,1,2,1592156805.0,11mm03,False,positive,positive,positive,positive
fuv5wgg,Thanks a lot for your advice :),1,2,1592190916.0,11mm03,False,positive,positive,positive,positive
futjbq6,I very much agree  thanks a lot for your advice:),2,2,1592157581.0,11mm03,False,positive,positive,positive,positive
futiq9a,Thanks for the advice :) will do so.The only problem is that parents may overreact ti this situation,1,2,1592157256.0,11mm03,False,neutral,neutral,positive,neutral
futl254,"Thanks a lot :) will continue to work on myself
All do your replies are inspiring me",1,2,1592158523.0,11mm03,False,positive,positive,positive,positive
futeyau,:) thanks,1,2,1592155207.0,11mm03,False,positive,positive,positive,positive
futfgdv,"Thanks a lot I am going to take your advice as you have been through worse 
Thanks a lot:)",1,2,1592155474.0,11mm03,False,positive,positive,positive,positive
futf3td,Thanks a lot  :) really hope it all gets better for everyone.,1,2,1592155287.0,11mm03,False,positive,positive,positive,positive
fut9dlk,"Thanks a lot:)
Just these circumstances force people to get depressed
Yes music helps me a lot to cope up
However in india marks are the criterion through how people judge children so you have not other option than to study",1,2,1592152145.0,11mm03,False,neutral,neutral,neutral,neutral
fut82st,"Thanks a lot :)  yes any time I require help I will dm you 
Thank for your advice will try from tomorrow itself)",2,2,1592151416.0,11mm03,False,positive,positive,positive,positive
fut77j1,Hi thanks a lot:) I totally agree to the points you have stated above . Yes I have started to work out since last week. Thanks a lot for providing me with solutions . I am sorry  that one of your classmates committed suicide. This proves that pressure on students from all generations has been the same amount maybe even more earlier. I will spread the same positivity to my struggling mates as you just did:),1,2,1592150936.0,11mm03,False,positive,positive,neutral,positive
futlytk,Thanks a lot for your advice will work on myself:),1,2,1592159019.0,11mm03,False,positive,positive,positive,positive
futlv8w,"Thanks a lot:) like I said I stopped all of it as it really wasn't helping me in anyway.I will continue to work hard to achieve in life
Parents either start overreacting to situations like these or dint even bother ,that's the reason why I don't soeak tk my parents about what I am facing plus everyone is facing their own problems and I don't want to burden other people with my problems be it my parents or anybody",1,2,1592158964.0,11mm03,False,positive,negative,neutral,neutral
futecpa,Thanks a lot . Ngl this video will really help me :)I already stopped all those bad things:)Really happy to see ppl I dint even know helping me out .,2,2,1592154882.0,11mm03,False,positive,positive,positive,positive
fut8jdm,"Will do so :)
Thankyou",1,2,1592151672.0,11mm03,False,positive,positive,positive,positive
fusjs10,"Yep. This is what I meant when I said to look into resources, at least. Just don't ignore the problem. This is a good list. Thanks for sharing!",2,2,1592135046.0,mr-cory-trevor,False,positive,positive,positive,positive
futin1q,"Literal translation below 

Why did sushant become hit wicket?

And why did patna's sushant fail in Mumbai?",9,2,1592157208.0,banjowashisnameo,False,neutral,negative,negative,negative
futiqss,"It says  ""how did Sushant become a hit wicket this way?""",7,2,1592157264.0,Beers_and_Cheers_,False,neutral,neutral,neutral,neutral
futimro,How did Sushant become 'hit wicket'?,1,2,1592157203.0,tafun,False,neutral,neutral,negative,neutral
futy18r,I seriously can't imagine who approved this and then non of the dumb fucks decided to oppose it.,1,2,1592165689.0,anonbutler,False,negative,negative,negative,negative
fuss0zh,[manja](https://youtu.be/BbD0PJSus3o) indeed this the best song,1,2,1592141688.0,Kratos3301,False,positive,positive,positive,positive
fusyujj,"Sometimes people feel more comfortable talking to a stranger on the internet (less judgemental) than family/friends. Even if people won’t dm out of blue, just knowing that there are strangers willing to listen can be comforting.",7,2,1592146129.0,icecreamz,False,positive,positive,neutral,positive
fuu52cn,"Sometimes it's better to do a career suicide before the career kills you.

I'm sure he'll find his place somewhere else, where he enjoys working and his mental health isn't affected too much. Nobody should stay in a place that suffocates them if they can afford to get out of it.",4,2,1592169546.0,callmerush,False,negative,negative,negative,negative
fuu9pl7,"Not an easy decision, trust me. I have been questioning this myself. But there had been many extremely hard days, when I just wanted to disappear, never to return to office. I cannot even function properly due to anxiety and constant fear of rejection. It's better to let it go and look forward to some healthy work",2,2,1592172049.0,tanzoo88,False,negative,negative,negative,negative
fuu6etc,"We are funny creatures to be honest. We are so unique and complex and don't forget strong, yet could be so delicate and fragile to something that is unique to everyone, that literally Anything could be our Rock Bottom, or our reson to Stay Strong.",2,2,1592170278.0,wollowitzz,1592170865.0,positive,positive,positive,positive
fusj4qu,Their is no boundary at all when it comes to sensitive issues. The media should definitely face some type of consequence once in a while. Its beyond insensitive.,9,2,1592134432.0,JustSuckItUp_,False,negative,negative,positive,negative
futd0wc,"No. He was with his family. Father downstairs and his brother, my friend sleeping in other room because he was on night shift. My friend broke his door down to find him hanging. His friends said he was happy on the trip, was talking about his new job with ongc and was excited about moving to another city.",7,2,1592154155.0,Radkeyoo,False,neutral,positive,neutral,neutral
futch0c,Or something happened on the trip he couldn't live with.,1,2,1592153856.0,willowhawk,False,negative,negative,negative,negative
fuu56yf,"And then we also have people who say, Depression is overrated. Like seriously?",1,2,1592169616.0,wollowitzz,False,negative,negative,negative,negative
fusd7he,"I sure as hell know there won't be another brand new pandemic, we might only witness a 2nd season",2,2,1592128562.0,Liberal__af,False,negative,negative,negative,negative
futmt5d,"Its alright bro, I have recently redefined my priorities and I feel I am on my way of healing myself.",2,2,1592159481.0,amanagarwalx,False,positive,positive,neutral,positive
fusg85z,[deleted],3,2,1592131615.0,,1625662961.0,neutral,neutral,negative,neutral
fusgdn0,"On the big screen: Chichhore
Netflix : Drive
Was Upcoming : Hindi fault in our stars",4,2,1592131764.0,halfbloodnv15,False,neutral,neutral,negative,neutral
fusgdzm,Chichore,2,2,1592131773.0,SmilingAlpha,False,neutral,neutral,neutral,neutral
fusg8gd,Chicchore,1,2,1592131623.0,OptimumWaste,False,neutral,neutral,negative,neutral
fusg90e,Chichore,1,2,1592131637.0,Hardik6190,False,neutral,neutral,neutral,neutral
fusgubs,[deleted],5,2,1592132220.0,,False,neutral,neutral,negative,neutral
fusnfth,You are over-estimating the intellect & maturity of college students.,1,2,1592138274.0,psnarayanan93,False,negative,negative,neutral,negative
fusbrgd,[removed],21,2,1592127071.0,,False,neutral,neutral,negative,neutral
fusbjy1,"I can personally vouch for this. Work your way outta useless overthinking and shit !

EDIT - I by no means am implying you shouldn't seek professional help and just lift. Endorphins do help ease the symptoms.",35,2,1592126853.0,SilasNashh,1592127669.0,positive,neutral,negative,neutral
fusbz5l,"It still depends on person to person's mental state though. If you go jogging and are still lost in your own thoughts, it won't matter much. I have had my worst panic attacks after cardios and after that follows a soul-draining depression.",3,2,1592127296.0,Shahrukh_Lee,False,negative,negative,negative,negative
futq8lm,"I've been working out for almost 5 years, I was close to going into depression about 18 months back, kept working out, ate healthy, didn't help.  


Another guy I knew - instagram model like physique, one of the top powerlifters in the city (for his size, short guy) - had depression for almost a decade.  


There's no silver bullet unfortunately. Depression and it's treatment is personal, exercise may or may not help you.",1,2,1592161367.0,manoj_mm,False,negative,neutral,negative,negative
fusbuov,"It's helpful, but it's not a golden bullet as people take it to be. You have plenty of athletes committing suicides.",12,2,1592127165.0,phantom_97,False,negative,negative,neutral,negative
fusc5ae,That like saying because your stage 1 cancer got cured by certain means stage 4 can also be cured by the same,1,2,1592127476.0,banjowashisnameo,1592128833.0,neutral,neutral,neutral,neutral
futuiba,[deleted],0,2,1592163730.0,,False,neutral,neutral,negative,neutral
fusbt9s,r/wowthanksimcured,2,2,1592127123.0,tralfamadelorean31,False,neutral,positive,positive,positive
fuse0ch,No. Most Indians have never heard of it.,7,2,1592129384.0,hello_friend_,False,neutral,neutral,neutral,neutral
fuseggb,tere ko survey karne bheja hai kya?,3,2,1592129839.0,yamashiro69,False,neutral,neutral,neutral,neutral
fuu0ubg,You better go to a doc tomorrow..be the change..their is stigma in the society but fuck it..be selfish for yourself to be happy more than anything else,2,2,1592167230.0,silversurfer9909,False,positive,neutral,negative,neutral
fusu88c,He always struggled with this. I recommend everyone to read this [http://www.metastatic.org/text/This%20is%20Water.pdf](http://www.metastatic.org/text/This%20is%20Water.pdf),2,2,1592143219.0,tumseNaHoPayega,False,neutral,neutral,neutral,neutral
fusfdiy,"One factor people don't talk about is the lack of sunlight which leads to problems with our circadian rhythm and also vitamin D deficiency which has strong links to a variety of health issues especially depression.

85% Indians were already deficient to begin with, this lockdown has probably made it much worse.",2,2,1592130775.0,Aarkay,False,negative,negative,negative,negative
fuslyhf,"I didn't watch it. I'm not interested in biopics, that too of someone who's alive and still working",13,2,1592137028.0,,False,negative,negative,negative,negative
fussr58,I'm not _blaming_ anyone or anything per se,1,2,1592142180.0,,False,negative,negative,negative,negative
fuskxam,Text me or people like me on reddit. We are there.,8,2,1592136107.0,dmndoodles,False,neutral,neutral,neutral,neutral
fusnezz,Hey buddy! I am here for you :),4,2,1592138255.0,,False,positive,positive,positive,positive
fustoy1,"There’s a few different [hotlines](https://lbb.in/delhi/suicide-helplines-india/)  you can call that might be helpful.

But also feel free to message any of the other commenters who responded.

There are always people willing and able to listen and help.",1,2,1592142860.0,,False,neutral,neutral,neutral,neutral
fuu0wqq,"These mind matters are very personal and people just don't open up right away to anyone. But I'll keep trying and hopefully, help someone keep away from these thoughts.",8,2,1592167266.0,jerrie86,False,neutral,neutral,neutral,neutral
fuw42fa,"If the side effects are intolerable ask your doctor to switch you, there’s a lot of alternative medications and one of them is bound to work",1,2,1592220278.0,Yodlingyoda,False,neutral,neutral,neutral,neutral
fuv5dbl,Cold turkey is when your taking some sort of drugs regularly and then quit taking any immediately,3,2,1592190561.0,hamiz16,False,neutral,neutral,negative,neutral
fuv5h55,Quitting cold turkey means you just quit something abruptly.,4,2,1592190630.0,cermsNtenditions,False,neutral,neutral,negative,neutral
fuvwmym,"The term is  attributed to piloerection or ""goose bumps"" that occurs with abrupt withdrawal from opioids, which resembles the skin of a plucked refrigerated turkey..it became of common use after people who have opiate withdrawl and soon it became synonymous with abruptly stopping any psychoactive medication",2,2,1592213074.0,Shivamn666,False,neutral,neutral,neutral,neutral
fuvd985,This does not sound right.,2,2,1592196048.0,PepLovesJose,False,negative,negative,negative,negative
futl4l1,"I freaking am, man!! So are you. Appreciate the words.",6,2,1592158560.0,,False,positive,positive,positive,positive
futkooc,Thanks man!,1,2,1592158319.0,,False,positive,positive,positive,positive
futkwni,Thanks for the kind words man.,1,2,1592158438.0,,False,positive,positive,positive,positive
futkvet,"Things are getting better, slowly, but who cares. Now I truly know I will never put myself in the same position I was in before.",2,2,1592158419.0,,False,positive,positive,positive,positive
fuuatxe,It really is man. Appreciate the words.,1,2,1592172656.0,,False,positive,positive,positive,positive
futkqm6,"Appreciate it man! I'm doing good, thanks.",3,2,1592158348.0,,False,positive,positive,positive,positive
futs5pf,"Language and society evolve over time.

The more we know, the less acceptable it is to use certain terminology and descriptors for socially relevant situations.

It used to be ok to refere to black people as Negroes  in headlines and news articles.

Then knowledge was spread that usage of such a descriptor, was in fact a negative one, and all journalistic papers slowly got rid of the usage over time.

Same went for the stigma of AIDS, when particularly  the LGBTQ community were highlighted (even though the disease doesn't care about gender or orientation) . Reporting standards too have changed in that regard. 

Times and language change. That is the constant.",1,2,1592162426.0,mrrahulkurup,False,neutral,neutral,negative,neutral
futo988,[removed],-3,2,1592160277.0,,False,neutral,neutral,negative,neutral
futoiqz,"That's unfortunate.

Well at least we have this discussion.",2,2,1592160423.0,mrrahulkurup,False,negative,negative,negative,negative
futqyuw,"Technically yes.

But holistically,  technically delivered reports about famous people in such incidents have far more negative repurcussions on society, especially the vulnerable sections, and it is important that we use the right kind of language to convey the same.",1,2,1592161767.0,mrrahulkurup,False,negative,negative,neutral,negative
futof40,"I have no trouble reading words, thank you for your concern.",6,2,1592160368.0,mrrahulkurup,False,positive,neutral,positive,positive
futoh4u,"There is a difference between describing an incident and being grammatically or technically correct.

Describing incidents is a huge social responsibility, and suicide contagion is a real thing.",4,2,1592160399.0,mrrahulkurup,False,negative,negative,negative,negative
fusg9sg,"that’s true. that’s the thing, there’s the better sources not avoiding the truth, that is his depression; then there’s others (like indiatv) which skirt around it.",2,2,1592131659.0,wingednova,False,neutral,neutral,negative,neutral
fux34pw,I don't think these are rumours because Bollywood is full of nepotism and He was the outsider.,2,2,1592240562.0,fbfaran,False,neutral,negative,negative,negative
fuu3zj5,It doesn’t cost them anything to respect the deceased. Regardless of one’s manner of passing.,6,2,1592168953.0,humdrum_humphrey,False,neutral,neutral,positive,neutral
futv2n3,life imitates art :/,2,2,1592164040.0,dramallama69420,False,negative,neutral,positive,neutral
fusgnlj,Check the Bollywood blinds sub. They are the most irresponsible and deluded bunch naming and blaming people for his death without any burden of proof at this moment of heightened emotions. Can't believe such things are allowed on reddit of all places. Deplorable!,2,2,1592132038.0,LegGlance,False,negative,negative,negative,negative
fusga8z,"So true. The deeper you dig the harder it becomes for you to get out. I spend a lot of time on the internet reading about various stuff; about life, death, life after death etc and get depressed sometimes. Then i see my friends who don't even care about these and i see them quite happy most of the time, no stress about anything. Sometimes i feel if all this knowledge comes with a price. To the peeps reading this, just be happy and grateful for what you have.",2,2,1592131672.0,Danksterrr,False,negative,positive,positive,positive
fusflug,"When did I said a thing like this? Existential crisis is a real thing and not all cosmologists have it. I am a optimistic nihilistic. I am very grateful to born in this universe and experience it. As many has said. If life has no meaning, then we have the right to give meaning to it. Once again, I am grateful for all this",1,2,1592131003.0,SiD_HaRtH,False,positive,positive,positive,positive
fusx10d,"Hey, I am also a Fan of Matt, the way he deliver science is one of a kind. Also to clarify, I did not say I am 100% sure he suicide because of existential crisis. Also, I also did not say that cosmology = existential crisis. But you got to understand that all persons who suffers for existential crisis are cosmologists but not all cosmologists are suffering existential crisis, there is a thin line. Also if you have another reason why Sushant did what he did, Please share. In the end  it's speculation just as you said. 
Also while I am here I would also recommend you to watch exurb1a and pursuit of wonder channel if you haven't done so. Peace.",1,2,1592145016.0,SiD_HaRtH,False,positive,positive,negative,positive
futvnsn,It definitely makes it a little easier if you are surrounded with love and care.,-1,2,1592164368.0,Fuzzy_Peach_Butt,False,positive,positive,positive,positive
fusg7ti,"What do you mean too soon,it is actually too late to conclude it as a mental health issue.",3,2,1592131606.0,ritzk9,False,negative,negative,negative,negative
futb9b4,Did something happen to him?,5,2,1592153188.0,iamiNSOmaniac,False,neutral,neutral,neutral,neutral
fut4vsg,"Omg bro 15 years is a long time 
I too was depressed for 2 years but now I am fine. Did you take medication for treatment? 
I recovered just through CBT and meditation. I am curious about you because maybe I am vulnerable to it and might fall in the hole again. How did you finally recovered?

What's your story?",2,2,1592149619.0,alsu2launda,False,neutral,neutral,neutral,neutral
fut4l7s,"Sorry to diverge. 
But did you get better when you take medical treatment?

I got harmed",1,2,1592149457.0,bhasski,False,negative,negative,negative,negative
fut63uy,">Tanmay Bhat of AIB knew that Utsav Chakraborty was sexually harassing female colleague but ignored it and never cared about it

It was a fake case",17,2,1592150313.0,,False,negative,negative,negative,negative
fusndwt,You're right. It's an ugly thing to do too.,8,2,1592138231.0,,False,negative,negative,negative,negative
fuspbmq,"I just don't see a successful man committing suicide over a 3 month old relationship, that he refuses to confirm, unless he's still hung up on his previous one. Nevertheless, you're probably right too.",6,2,1592139744.0,,False,negative,negative,neutral,negative
fusprvf,What issues?,1,2,1592140081.0,trakk2,False,neutral,neutral,neutral,neutral
fusncog,Ankita Lokhande,8,2,1592138202.0,,False,neutral,neutral,positive,neutral
fusosr0,"As of 10 minutes ago, it's 56,831.",12,2,1592139349.0,,False,neutral,neutral,neutral,neutral
futgb1r,"Considering that he was living in Mumbai, a fair distance away from his parents, it could very well be a case of Suicide we just don't know",2,2,1592155936.0,HiveMynd148,False,neutral,negative,negative,negative
futprdd,"Damn, this is exactly what I meant.  It's so much more common than people think and it's even worse that it sounds like the cycle is going to continue with the next generation. Having a parent with untreated mental health issues can be hell on earth for a kid. 

Are you able to to talk to the other one and convince her to get help? Is she able to do so without her father's support/help? Which country do they live in?  People say a lot of negative things about medication but for some it really can make a huge difference.",1,2,1592161104.0,Athos92,False,negative,negative,negative,negative
futc1sx,"I am going through the same pressure right now.

 My results were supposed to come out last month . But , it has been delayed to July due the pandemic. And everyday , i am always scared shitless thinking what if I don't get enough numbers to study science? 
My father told me that if I don't get good enough numbers he and my mother  will have to commit suicide . And because of that , i am always praying to God. 
And if I don't get good enough marks , i don't know what i’ll do.",8,2,1592153625.0,,False,negative,negative,negative,negative
futb53l,Exctly,5,2,1592153123.0,Adamgenalanezh,False,neutral,positive,positive,positive
futbu3z,"Before people judge you, are you an Indian citizen with commentary about their own country?",2,2,1592153507.0,GenreNeutral,False,neutral,neutral,neutral,neutral
futjcv9,You must be joking. He was my alumnus at DTU what are you talking about.,1,2,1592157599.0,RockieRockie,False,negative,negative,neutral,negative
fuu45r2,Your dad sounds awesome!,3,2,1592169048.0,humdrum_humphrey,False,positive,positive,positive,positive
fuu328x,Wonderful!,1,2,1592168442.0,Mademan84,False,positive,positive,positive,positive
futnury,"Money is for sustenance, once those basic needs are met, there is literally no correlation between money and happiness. Once you have money, then you think of ""ek partner mil jaaye"", when you get the said partner you think of something else and want that. And when you don't get something you want, you're unhappy. Money isn't even the issue then yet you're unhappy",6,2,1592160055.0,GeeUWOTM8,False,negative,neutral,negative,negative
futngvu,I am angry on you. But you're correct.. :/ Take my Upvote!!,1,2,1592159844.0,C0R0NA_CHAN,False,negative,negative,negative,negative
futmxm3,Couldn't have agreed more.,4,2,1592159549.0,Mademan84,False,positive,positive,neutral,positive
fusd7aa,thanks for pointing that out man.,1,2,1592128557.0,Hariii_,False,neutral,positive,positive,positive
fuseb5i,"Others say , its was an accident . She died",1,2,1592129688.0,Armag3ddoncx,False,negative,negative,negative,negative
fusec9q,Source?,1,2,1592129720.0,Armag3ddoncx,False,neutral,neutral,neutral,neutral
fushsy5,"Yes, it is.",2,2,1592133161.0,rucjos,False,neutral,neutral,neutral,neutral
fut7t6v,Probably rishi kapoor and Irrfan khan,2,2,1592151269.0,RockieRockie,False,neutral,neutral,neutral,neutral
