Comment ID,Comment Text,Comment Score,Comment Depth,Created Timestamp,Author,Edited,Semantic Label,Semantic Label 2,Semantic Label 3,Major_Semantic
futw40z,"I agree. Our society and the people in general are not yet receptive to seeking mental support and share what's on their minds. Be it hypertension or depression, all are outcomes of not being able to alleviate the mental stress. As an insurance worker, I've seen death claims from so many Indians in their 20s and 30s dying due to stress/ hypertension that it's sickening and alarming...and a wake up call to improve mental health before it's too late",1,1,1592164621.0,ssuhasini,False,negative,negative,negative,negative
fustu5n,And he died by suicide as well :(,3,1,1592142957.0,zenneutral,False,negative,negative,negative,negative
fusr1yt,[deleted],1,1,1592141011.0,,1618245689.0,neutral,neutral,negative,neutral
fusd4hp,"Yep, This Covid-19 situation is only acting as the final straw that will break the back of many individuals who would've already been facing such issues.",6,1,1592128477.0,VarunDM90,False,negative,negative,positive,negative
fush8vc,Almost forgot that he was in it. Loved that movie.,3,1,1592132615.0,diabapp,False,positive,positive,neutral,positive
fusi9n9,I had always hoped for a sequel. Damn,1,1,1592133612.0,maxcool007,False,negative,negative,neutral,negative
fuslwrf,how can you forget ms dhoni ?,5,1,1592136986.0,,False,neutral,neutral,neutral,neutral
fusq38r,I believe Dibakar Banerjee brought out the best in him in Detective Byomkesh Bakshi.,4,1,1592140318.0,Jaded_Alternative,False,positive,positive,positive,positive
fusqp8h,[deleted],-8,1,1592140761.0,,False,neutral,neutral,negative,neutral
fusko5q,What if i dont have close friends or family?,4,1,1592135877.0,stikenval,False,neutral,neutral,neutral,neutral
fuuccil,Hope in future they develop some kind of mental test to rule out depression it would save many lives,1,1,1592173490.0,godofthunder450,False,positive,positive,positive,positive
futyt6j,I am curious did anyone text you?,6,1,1592166120.0,daxedluffy,False,neutral,neutral,neutral,neutral
fuvldns,Same but I went cold after taking pills one or two days. Anti depressants have nasty side effects. I am not used to pills and I hate side effects but I guess I'll have get back on it.,2,1,1592202453.0,randomguy3993,False,negative,negative,negative,negative
fuv4fq8,what's cold turkey and can u plz share a source for this info.,2,1,1592189945.0,le_shivas,False,neutral,neutral,neutral,neutral
fuv5tiq,"Medicine dose not help much , emotional support from outside to enlighten the inside flame is what it needed.",0,1,1592190860.0,Grimmer_wolfgang,False,negative,negative,neutral,negative
futkern,You survived it and now writing about it. You are strong :),8,1,1592158169.0,dunno1211,False,positive,positive,positive,positive
futj1sy,We are glad you are still here with us to share this very important piece of perspective with others who might be feeling this way. Thank you so much!,3,1,1592157431.0,Hazel1002,False,positive,positive,positive,positive
futih3i,"Hey buddy, sorry to hear that. I am glad that you are with us.",2,1,1592157114.0,,False,positive,neutral,neutral,neutral
futih70,Hey man sorry to hear that. Hope everything is ok for you now.,2,1,1592157116.0,rajasimha,False,neutral,neutral,neutral,neutral
futwsgs,"What you said was apt. It's not the hope for future that'll get you going but the faith that you can prepare yourself to fight the fight.

Glad you made it out alive and hope that life as it is right now is better than what it was back then.",2,1,1592164993.0,ssuhasini,False,positive,positive,positive,positive
futitmu,"Hey buddy, I am glad you are with us today and I hope you're doing okay",2,1,1592157307.0,okiedokiesupersmokey,False,positive,positive,positive,positive
futv40v,"I hope you’re better now. Sending you love, healing and light. Take care.",1,1,1592164061.0,sscc27,False,positive,positive,positive,positive
fusy143,Ikr. Immediately scolded the grp members when i saw the pic in my family grp. No peace even in death,8,1,1592145631.0,timeforaroast,False,negative,negative,negative,negative
fuszpep,I remember when Chris Farley died and people were sharing pictures of his dead body. (It was the 90s so it was harder to circulate it than it is now. ) At one point a few years later I googled him and the first image to pop up was his corpse. Fucking heart breaking. I was just a kid and that image is burned in my memory. I cant imagine seeing pictures of a loved one who committed suicide circulating on my news feed.,5,1,1592146641.0,BureaucratDog,False,negative,negative,negative,negative
fut550j,Why do these chutya do that. Fuck these people.,5,1,1592149763.0,anonbutler,False,negative,negative,negative,negative
fusy0xd,Just mentioning that there are pics makes people want to look for them. It's human nature.,6,1,1592145628.0,Tavli,False,neutral,neutral,neutral,neutral
futrlv8,">Hey OP, can you change the comment to "".. dies of suicide.. "", rather than "".. commits suicide.. ""?

Dies is a weak verb, commits is an action verb and it grabs attention in headlines. Go to worldnews they always use 'slams' etc instead of 'tells' because its more attention grabbing. And it's not outdated, it's how English works.",7,1,1592162119.0,,False,negative,negative,negative,negative
futm8dy,I agree! This is so important especially to those that struggle with suicidal thoughts. It's the difference between understanding and a trigger. I'm glad you pointed this out!,4,1,1592159163.0,ChooChooMoFo1,False,positive,positive,positive,positive
futnsgc,Can't change the title once it's there...,2,1,1592160020.0,SmokeyGreenEyes,False,neutral,neutral,neutral,neutral
futrlh6,"Oh and just to clarify.

Not knowing the right words to convey feelings and incidents of sociallly important situations is OK. You should not never have to feel bad about using 'wrong words' as it were. 

The correct things to do is to take the effort to know and use them as humanly possible afterwards. 

And hey, it is ok to still fumble after that, because you are fighting to change the fixed language code that your brain has been used to all these years for such situations in your head. 

Unlearning and relearning are hard skills to acquire, ask anyone.",2,1,1592162113.0,mrrahulkurup,False,neutral,neutral,neutral,neutral
futmovk,[deleted],-4,1,1592159416.0,,False,neutral,neutral,negative,neutral
futnuc9,[deleted],-2,1,1592160049.0,,False,neutral,neutral,negative,neutral
futnsts,[deleted],-3,1,1592160026.0,,False,neutral,neutral,negative,neutral
fusf41e,May be his manager who died recently was his go to person to talk to when he was really depressed. Her committing suicide might have pushed him even more into depression.,4,1,1592130512.0,FairyEnchantedDildo,False,negative,negative,negative,negative
fuscz82,[deleted],2,1,1592128329.0,,False,neutral,neutral,negative,neutral
fusl4ne,Don't speculate.,0,1,1592136290.0,,False,neutral,neutral,neutral,neutral
fusg39v,In the news I heard he had depression since 6 months,4,1,1592131481.0,samshawe,False,negative,negative,negative,negative
fusop8z,Indian media are all bunch of assholes. They only knows how to lick politicians.,2,1,1592139275.0,rayvictor84,False,negative,negative,negative,negative
fuw5vaa,">Karan Johar and Salman Khan banned him for what reason?

They are all rumours buddy.",0,1,1592221821.0,notanothervoice,False,negative,negative,neutral,negative
futz3ep,[removed],-19,1,1592166277.0,,False,neutral,neutral,negative,neutral
fusgltj,I can't even imagine how much that must have affected him,15,1,1592131987.0,Abheeshta,False,negative,negative,negative,negative
fusgz3s,"CAN WE PLEASE STOP WITH THIS FOR A WHILE?

I'm watching the TV and journalists are pushing mikes towards the family of Sushant and asking them exactly this. This is not a crime show. We are talking of real people here. This is not the time to be pushing wild conspiracy theories. 

Let them have their privacy. If they want to share something with us, they'll do it themselves.",21,1,1592132350.0,,False,negative,negative,negative,negative
futuys5,Which ironically is about suicidal tendencies,7,1,1592163981.0,redfilmflow,False,negative,negative,negative,negative
fusesvf,Existential crisis is more common that what people think it is.,12,1,1592130194.0,AtomR,False,negative,negative,neutral,negative
fusf4w2,"Sushant was going to play the role of Rakesh Sharma in the upcoming movie, 'Chanda Mama Door Ke'. That's why he was interested in Space and Astronomy.",11,1,1592130536.0,trickletan,False,neutral,positive,neutral,neutral
fusf9ba,"If you become depressed by going down the existentialism or nihilism rabbit hole, it's probably not the ideas that caused your depression, rather that you had depression already. 

I used to turn a blind eye to nihilism or existentialism back when I was depressed because it could EASILY lead to me making some dumb moves. Now that I'm out of depression, I can see a dark beauty behind the ideas of nihilism. 

But I feel good most of the time, and I'm excited about what the future holds for us (whether good or bad), about travelling and doing good things for myself and for others. 

Sure, you might ask what's the point of all this? I personally would say the point is to feel good and happy and make a positive contribution to our existence. Maybe that's too banal of a thought but I have no problems with it.",11,1,1592130657.0,Bhosdi_Waala,1592131595.0,negative,positive,neutral,neutral
fusf7cv,This is why reddit is best .. all other media is absolutely haywire with no content.. they can't even mention mental health now. Also adding up his last post was him being in dilemma about choosing between two things .. he mentioned his mother .. idk but depression does grows into rationalising the death and taking that leap.,7,1,1592130603.0,Kinky-Monk,1592132097.0,negative,negative,negative,negative
fusey7b,"I too had suffered from an existential crisis and had become a nihilist..i was having suicidal thoughts, also finding no meaning in life....but slowly I realized that it's toxic and got out of that... So yeah belief is necessary for human to survive... Rip sushant",3,1,1592130345.0,intrestingusername57,False,negative,negative,negative,negative
fusf30k,[deleted],1,1,1592130484.0,,False,neutral,neutral,negative,neutral
fuseyt4,"This is stupid, according to you then all cosmologists should have committed suicide by now. Existential crisis, depression cannot be compartmentalised by relating this to posts like these!",3,1,1592130362.0,,False,negative,negative,negative,negative
fusgaek,"What has being interested in Cosmology got to do with Existential crisis? The channel ""PBS SpaceTime"" has 2 million subscribers. Do you think all of them have existential crisis? No, it is simply that cosmology is very interesting. I suggest not speculating randomly.

Edit: You can can downvote me for all I care. All you are doing is speculating and spreading rumours. The only fact in your post is that he quoted ""PanPsychism"". He did not admit or allude anywhere to Existential crisis or Nihilism.",3,1,1592131676.0,--northern-lights--,1592132459.0,neutral,neutral,neutral,neutral
fusga5r,"I have been clinical depressed in past and I had became ""extremely"" interested in philosophy at that time.",1,1,1592131669.0,BanannaBhaiya,False,negative,neutral,neutral,neutral
fusmi3j,"For everybody, sadly.",11,1,1592137495.0,AtomR,False,negative,negative,negative,negative
futugtx,"When a person is deep down in depression, as it's a mental illness, it becomes hard to live with the pain and the thoughts. Depressions kills all the hope and it becomes extremely difficult to find hope. We can not imagine what his demons were like and hence it's not a question of whether he did the 'right' or 'wrong' thing. Of course, it's not an answer and seek help, however we have to remember how it's disorder at the end and a lot of factors in the society prevent people from reaching. He was seeking treatment too. It's not like he was not doing anything about it. It's really hard.",8,1,1592163706.0,ck_14,False,negative,negative,negative,negative
fuv0pvo,❤️,2,1,1592187613.0,falcoraptor,False,positive,neutral,neutral,neutral
fusevc1,too soon to conclude it as a mental health issue. His manager also had committed suicide 3-4 days ago. Might be related.,7,1,1592130264.0,sadzeeb,False,negative,negative,negative,negative
fusbux5,It's community-based.,9,1,1592127172.0,warfighter_rus,False,neutral,neutral,neutral,neutral
fusd6qj,Wikipedia is literally the best site on the Internet. And I'm not even being hyperbolic.,2,1,1592128541.0,Raijin_Thund3rkeg,False,positive,positive,negative,positive
fuseyer,"Make sure to exercise and meditate everyday. And try to stay away from social media website like FB, Twitter and whatsapp.",9,1,1592130350.0,abstergofkurslf,False,neutral,neutral,neutral,neutral
fusewt3,"Hey mate, the very first step is to seek help by asking it aloud which you just did and I am really glad to hear that you are asking for help.
I will dm you so that we can have conversation there. I am here for you.",6,1,1592130306.0,loflet,False,positive,positive,positive,positive
fusexoq,Listen to the kind of music you learn. Journal to work your thoughts out around what is happening. Exercise. Meditate. Do something creative.,3,1,1592130330.0,witchy_cheetah,False,neutral,positive,neutral,neutral
fusf3uz,"Talk to your friends/family about your sense of despair. It's likely that many of them are feeling the same way. You bringing it up may help everyone vent a little. Try to find out if there are any therapist helplines you can call for where you live. 

I'm not that much older than you are and I relate to what you're feeling. I remember being in 12th standard not long ago. It's a shitty world we've been dropped into, but we won't be able to change it for the better if we don't stick around.  Endure and survive, my friend. Endure and survive.",7,1,1592130507.0,AFullmetalNerd,False,neutral,neutral,neutral,neutral
fusew23,Reach out to someone you know & love. Talk to family & discuss whatever it is that's bothering you. Most importantly know that you matter to someone and that this period of time riddled with difficulties shall pass. My DMs are open if you ever wanna talk about anything. Stay safe & healthy bro.,4,1,1592130284.0,akdsouza,False,neutral,positive,positive,positive
fusf8uj,"Hey, It's going to be okay. Take some deep breathes. I know how overwhelming everything can be especially if you are in 12th. I know right now your entire life is depending on this one year, but there is a whole world out there apart from this one year. Whatever happens, even if it's not okay, you can make peace with it. It's the human power of resilience. 

First of all , every person and their situation is different. There is no one size fits all in mental health. But there are some basic steps you can take, to take care of yourself. Try guided meditations, it won't make your problems go away , but it will give you a better perspective to them. Eat well, sleep well. Try to keep your surroundings clean. Do something just for fun , even if it's for 10 mins.",6,1,1592130644.0,,False,positive,positive,positive,positive
fusevoi,"Buddy just hang in thr ... Bad time wont stick around as good times don't.
Mediate .. pray whatever helps u .. i know its too much to grasp ... Too much to take in .. but hope .. cz hope is what keeps us alive. 

Hang in thr buddy !",3,1,1592130274.0,zubairfouzan,False,neutral,positive,neutral,neutral
fuseymw,"Honestly, just do things that give you the most joy man. Talk to your friends, your family, relive old memories you have together, play games, learn a new hobby.. 


These things really help",5,1,1592130357.0,vpsj,1592131392.0,positive,positive,positive,positive
fusf7a4,"Please try to take care of yourself. Write down the reasons why you value yourself, and read them every night before going to bed. If you have a good relationship with your parents, involve yourself in multiple activities with them. If not, try and keep in touch with friends who understand the problems with the world, and don't just make jokes about it. And most importantly, please contact mental health helplines at least once a week. There are various government organisations and NGOs, where you can reach out and just talk to medical professionals in the field of mental health.",3,1,1592130601.0,IamFluffy94,False,positive,neutral,positive,positive
fushfws,"Dude if you want to talk my dm is open.

While the lockdown and pandamic has all of us worried, there are silver linings - the air has been significantly better, noise levels are down and roads are not as crowded.",3,1,1592132810.0,,False,positive,positive,neutral,positive
fusg2a2,"Dude, there is no age limit to mental health issues, I've been in and out of issues for most of my life, I got 26 last month and as long as I can remember I've been going to phycs and getting doctors help even medication. I'd suggest talk to your family specially your siblings if you have any and even friends or teachers. Persue counseling or phycologists help. It might feel weird at first but this is the only way to get out of it. If you need help contact me personally.",2,1,1592131453.0,JackHammer001,False,neutral,neutral,neutral,neutral
fuskiq6,"If you're spending too much time on social media(I don't count Reddit in, mainly Instagram/Facebook/Twitter?), cut down to minimum bare. They induce toxic thoughts and could drive you to another low easily.

I feel you at the pandemic and lockdown issues. Being at a gap year, this hasn't changes drastically for me, but I realized that consuming a lot of news related to deaths and impact of covid throughout the world is something that makes me low. I tend to not anything other than worldometer, so if you're a news junkie(specially Indian news channels which are toxic asf), cut it down. If your family watches them, you try not to.

Yes, losing big names you just knew from a screen is a big loss, but it isn't something you should stick to it for longer. Try to move on. And know that it's completely normal to feel sad over demises of big names, but also know that, much worse could happen. This is atleast not the worst situation right?


Listen to some good music. I recommend some uplifting music. Being mainly into metal, Linkin Park's songs really help me through, but could push you instead more deeper, so look out for that too. You could also try soothing music by some foreign artist's non English songs. Mabel Matiz is one great indie guy who produces amazing Turkish music. Try it out.


Watch a new movie/series/sitcom, if time permits you that. By the time you get engaged in the storyline, you unintentionally forget a lot of things that were making you low. I'd recommend sitcoms, one episode of The Office/Friends could be great!


Hope this helped, take care :)",1,1,1592135737.0,AverageBrownGuy01,False,negative,negative,negative,negative
fusmy48,">Buddy just hang in thr ... Bad time wont stick around as good times don't. Mediate .. pray whatever helps u .. i know its too much to grasp ... Too much to take in .. but hope .. cz hope is what keeps us alive.

You have to understand life is really difficult ,  it ain't easy to live , no whatver what they tell you , there will be times where you will feel its you against the world I think its necessary to have prespective, how you see this world  you gotta  read some philosophy. figure out something you love like hobby or something ,  just make sure you get out of your head when you are dealing with pain.",1,1,1592137867.0,0xjustatech,False,neutral,positive,neutral,neutral
fusfl1v,"Yes this year is going really hard on everyone, but please do not let yourself down. Find some to talk to openly. If you don't any such friend or family member with whom you can talk to, don't hesitate to drop a DM. But please do't let any bad thoughts cross your mind",1,1,1592130982.0,bhplover,False,negative,neutral,negative,negative
fusfll4,"Hey.. just take one day at a time.. this phase will too paas.. don't get overwhelmed.. try to divert attention from things that bother you.. spend time to read.. try to meditate.. 
Never lose hope..",1,1,1592130996.0,throwawayforlols1,False,neutral,neutral,neutral,neutral
fusftl2,I'm sorry I don't have any recommendations. I'm in same boat with you. But the comments on this post are so wholesome that it gave me smile reading em.,1,1,1592131215.0,chait100,False,positive,positive,neutral,positive
fut4qcl,"At my previous job, there was this dude working with me.  


Powerlifter, bodybuilder, he had a proper instagram-model like physique complete with a thick V-taper and six pack abs. Also ate like it every day (multiple super healthy protein rich meals).   
Kept a thick good looking beard.   
Rode on a bullet, was fond of travelling and would often travel to different places on his bullet.   
He was also great with dressing sense. Wore custom-tailored shirts and trousers which would highlight his V-taper physique and shapely lower body (without being too tight). Had his sleeves folded, strong forearms popping out, high-quality good looking shoes on his feet.  
He was also absolutely killing it at work - insanely passionate product manager who simply got shit done and became the go-to guy for both the CEO and CTO, over-shadowing senior PMs who had 10+ years of experience over him.  
He was also incredibly humble, shy and down to earth - someone you can easily approach and openly speak to.  


He was the epitome of everything I wanted to be in life - someone I used to look up to.  


I found out that he had been suffering from depression for almost a decade.  


It's very very hard to identify someone in depression - only someone who has experienced it personally, via friends/family or someone trained in it can identify.",53,1,1592149535.0,manoj_mm,False,positive,positive,positive,positive
fut48mr,[deleted],23,1,1592149259.0,,False,neutral,neutral,negative,neutral
fut4ew6,"People saw alright but didn't care enough or weren't close enough.

Source - Mukesh Bhat saying he met SSR before lockdown to discuss projects but felt that though SSR was physically there, he seemed lost in his own world. MB's exact words - I could see him going the Parveen Babi way! But I didn't interfere because I knew he was seeking psychiatric help and I wasn't that close enough to him.

This was today on Times Now World around 3 P.M. ish today.",10,1,1592149357.0,pratyd,False,neutral,neutral,negative,neutral
futdank,"You can be with a 100 people on set and feel alone i guess . I personally don't think putting the onus on people around him for taking care of him is wise, its a busy world and anyways I heard people say that depressed people also smile and act like everything's normal, like you can't tell just by looking / even knowing them very closely .",2,1,1592154305.0,abby_yogi,False,negative,neutral,neutral,neutral
fut5d7u,[deleted],-22,1,1592149892.0,,False,neutral,neutral,negative,neutral
fut11oy,Being an outsider and loney is tough. Is relatable for many. Fuck this bollywood shit,7,1,1592147431.0,,False,negative,negative,negative,negative
fut1ulq,Vultures.,5,1,1592147894.0,killing_time,False,negative,neutral,neutral,neutral
fute18y,R/outoftheloop  can you please tell us clueless ones?,2,1,1592154707.0,kungfubellydancer,False,neutral,neutral,neutral,neutral
futc01f,[removed],1,1,1592153598.0,,False,neutral,neutral,negative,neutral
futebi5,Could you please elaborate on that?,1,1,1592154864.0,anony212325,False,neutral,neutral,neutral,neutral
fusn50a,Imo it's too soon to speculate why he did what he did.,19,1,1592138023.0,pandas795,False,negative,neutral,neutral,neutral
fusoqal,"None of the reasons you mentioned are statistically as likely as the #1 most likely reason: issues with his current girlfriend, Rhea Chakraborty. As this develops, this will shine into the spotlight more. Ankita and he have been completely separated for several years now. I just don't see the connection between his ex-manager committing suicide and him doing the same, though it is quite the coincidence. And I don't think that corona virus had anything to do with this either, though I concur that it may not have particularly helped.",18,1,1592139297.0,mostisnotalmost,False,negative,negative,negative,negative
fusnbjx,Who got engaged?,4,1,1592138176.0,kamikazechaser,False,neutral,neutral,neutral,neutral
fusooh3,[deleted],6,1,1592139259.0,,1644526941.0,neutral,neutral,negative,neutral
fusbj4v,Not crossed half yet!! 16 more days left!,10,1,1592126831.0,amreddish,False,positive,neutral,neutral,neutral
fusbn3q,I opened insta to see some dumb memes and got this news at front,2,1,1592126946.0,bootylover81,False,negative,negative,negative,negative
futf7xt,the investigation is going on. currently all evidence goes towards suicide.  but family has said that they don't believe he would commit suicide and asked CBI investigation,2,1,1592155350.0,,False,neutral,neutral,negative,neutral
futl1fo,My husband's father is Persian and he is dismissive of his two daughters' very obvious mental health issues. One finally got help and it's like night and day with her. Took her til she was 25 to go. The other lives with such crippling anxiety that she scratches her skin until it feels and looks like scales. Really sad as she has a four year old who basically has to watch his mom unravel a little more each day.,1,1,1592158512.0,Jackattack009,False,negative,negative,negative,negative
futasax,"Maybe if india puts less focus on things like exams, depresson wouldnt be such a big thing",27,1,1592152926.0,,False,negative,negative,negative,negative
futgmlx,[deleted],2,1,1592156111.0,,False,neutral,neutral,negative,neutral
