Comment ID,Comment Text,Comment Score,Comment Depth,Created Timestamp,Author,Edited,Semantic Label,Semantic Label 2,Semantic Label 3,Major_Semantic
fusd6qw,News 18 India's reporters have gone into his house and questioning family members now. Motherfucking assholes.,422,0,1592128541.0,Alt_578,False,negative,negative,negative,negative
fusc470,"The news anchors have gone apeshit, omg they are already putting it as a love triangle or what not. Like have a little respect ? Suicide is terrible as it is.",606,0,1592127445.0,ihatemondaynights,False,negative,negative,negative,negative
fusbqgu,"I was going to link to the National Suicide Helpline. But it's not very helpful. 

So, if anyone needs to talk, please message.

r/SuicideWatch helps too. 

There will be many who will offer to talk to you. Even if it feels silly and pointless, give it a shot? What's to lose, right?

I know this will sound hollow, especially if you're going through what you're going through, but I'll say it nonetheless. 

You aren't as insignificant as your mind likes you to believe. You matter. And usually, things do get better. And people care for you. I don't care if this sounds fake, but I promise I care for you. So, that's one person right here. 

If you look for a moment, you'll find reddit full of cunts like us, ready to talk. 

We love you. 

If you're on reddit, you're most likely a cool person to begin with. Nerdy and smelly, sure. But cool. 

Yes, it's vain and masturbatory. But it's nice.

Don't let the annoying parts of your mind win, if you can. You've been dealt a bad hand. I know! I believe you. Life can be incredibly unfair. And you don't deserve this horrid shit. And Covid is making it worse. I,100%, get it.

But let's try giving it another shot or two. (I know you've given it plenty. But you're on r/India so give it another just to be a pain in the ass to your own mind, you petty, spiteful bastard.)

This place can seem awfully polarizing and political at times. But trust me, it's full of some of the most beautiful people you'll ever meet. People who are equally weird, sad, smelly, nerdy, argumentative. But really very nice to talk to. 

I'll be here, every day, between 9 pm to 11 pm for a week. And I will 100% reply. 

I love you. Take care.",328,0,1592127043.0,-n0x,1592128695.0,negative,neutral,neutral,neutral
fusb8xn,This is getting worse. His last film “Chhichhorey” was about fighting through the worse life throws at us. Such a loss.,417,0,1592126541.0,bhodrolok,False,negative,negative,negative,negative
fusf0ef,[deleted],123,0,1592130408.0,,False,neutral,neutral,negative,neutral
fusf01c,"I still remember how shocking it was on 20th July 2017 night when I herd the news of Suicide by hanging of my favourite singer Chester Bennington (lead vocal of Linkin Park). It was 48th anniversary of the moon landing and was also my dads birthday. 
It’s weird how we are so much affected by death of a person who had influenced our life but never met them. 

Sushant seemed like a nice guy even though I’ve not seen any of his movie. Condolence with his family",110,0,1592130398.0,Vince_vishal96,False,negative,neutral,negative,negative
fusf7hv,"""When life gives you lemons,it becomes very difficult to create lemonade"" -- irfan khan",109,0,1592130607.0,Mogh9,False,neutral,neutral,positive,neutral
fushln3,"I've had suicidal thoughts since 18. Now, I'm 24. I'm going to live with it. Failures have degraded my soul. But sometimes, I feel motivated to do stuff; to build stuff. Once the lockdown gets over, I'll probably have a job or something. I'm not sad or desperate, nor I have financial trouble at this time at home, but it's just I want to grow myself, stand on my feet, and not depend on parents. I have the skills too, and I believe, before turning 25, I'll get a job, for sure. Sometimes, it feels like trash when everyone starts earning at 20-22. I think it's just how life it is. Feel like shit and hit back.",97,0,1592132966.0,,1592135360.0,negative,neutral,positive,neutral
fusbit5,"This has to be lesson for the depression which people suffer even when they might have everything. 

I remember being in Bansal Classes , kota and my father talked to PK Bansal and he replied - “Hatta katta toh dikh rha hai , Kya depression” 
I was depressed. 

This is one of those events where older generation doesn’t understand the younger ones.",411,0,1592126822.0,,False,negative,negative,negative,negative
fusdvol,"He was deleting his Instagram pictures, posting about philosophy and stuff like that. Hard to imagine him being desperate to find something to live for. Just terrible, man.",89,0,1592129250.0,dad_is_that_you_,False,negative,negative,negative,negative
fusb2sh,[removed],88,0,1592126364.0,,False,neutral,neutral,negative,neutral
futde9p,"People saying things like 'he should have realised how talented he is and how much talent he's letting go of by killing himself', are you kidding me? Is that all he was?
Even someone with zero talent and wealth has the same value as someone who has everything the world has to offer. It's not like he had an obligation to fulfill towards the world. What about his own well-being, you selfish assholes?

Posting one picture, blaming 2020 and forgetting about it isn't called talking about it. It's called riding the social media wave. Everything is a meme to these people. 

Those who actually do end up talking about it go on about how people should be kind to each other and how the world is better off if everyone treats each other with some basic human decency, but they can't treat the person in front of them with even a quantum of kindness. 

Everyone wants to blame everything but their own behaviour and everyone but themselves.

Give it two days; maybe a week. Everyone will forget the event and nobody will change their ways of how they treat people.

It pains me to say this. This man's death, however tragic, was in vain.",85,0,1592154360.0,Fa11en0ne,False,negative,negative,negative,negative
fushf0t,Irony is people contributing to my depression are now posting about mental health. These people absolutely don't care when the person sitting right next to them is depressed but some celebrity commits suicide everyone is deeply hurt and devastated,241,0,1592132786.0,,False,negative,negative,negative,negative
fusdoyw,#Mental health is a real issue,80,0,1592129062.0,scribbbblr,False,negative,negative,negative,negative
fusd2hc,"Fuck. I'm still processing the fact that he passed.

Sushant seemed like a really fun guy with a really promising future down the road. I absolutely loved him in Detective Byomkesh Bakshi & Chichhore. Also, his workout videos for the Ms. Dhoni biopic was ridiculous and it really showed his commitment towards the role.

Sad that it's ended but hey, his little legacy of creating Good content with *Ms. Dhoni the untold story*, *Chichhore*, *Kai Po Che* & *Detective Byomkesh Bakshi* will long in memories of millions.

RIP Sushant. You were a good man.",64,0,1592128420.0,Prams35,False,positive,positive,neutral,positive
fusc47s,"I'm shocked, mental health is a serious issue and the taboo associated with it should end, every 40 seconds someone loses their life by committing suicide. Its so sad that we lost someone so young in such a terrible manner.",68,0,1592127445.0,juancorleone,False,negative,negative,negative,negative
fusb472,"Okay what the hell!!
RIP

Didn't his ex manager also commit suicide recently?",64,0,1592126404.0,random_saiyajin,False,negative,negative,negative,negative
fusddy0,"I’m watching the news, still unable to absorb the fact that we lost such a young and talented actor to mental illness. the achor is going on and on about how his ex-manager also committed suicide and the possibility of a romantic relationship gone wrong or that he didn’t get enough movie offers, while my parents and relatives in the family group chat are cursing him because he did drugs and had no reason to commit such a heinous and devilish act. 

I understand that it will take eons until this country starts considering mental illness a valid disease but what about having sympathy and respect for the dead? everyone around me is just trying to dissect how he died. Disgusting.",203,0,1592128750.0,pantachorei_,False,negative,negative,negative,negative
fusbuc2,And he just portrayed a character who taught his why he was wrong to attempt suicide in Chicchore. Just fuckin sad....,161,0,1592127154.0,aman92,False,negative,negative,negative,negative
fuscald,"I’ve become so desensitised to news this year, but this really shook me for some reason. Someone, who from the outside was successful and “had it all”.",55,0,1592127625.0,nolinkinbio,1592127737.0,negative,neutral,neutral,neutral
fuse02j,Mental health is no joke.,52,0,1592129375.0,AdudeFromIndia,False,negative,negative,negative,negative
fuscgzf,This is deeply saddening. People in India should take mental health issues seriously. Anyone could be struggling inside and we never know it. We should preach that it is okay to ask for help and it is okay to be vulnerable.,50,0,1592127805.0,thani_oruvan,False,negative,negative,negative,negative
fusg3l4,"

""The so-called ‘psychotically depressed’ person who tries to kill herself doesn’t do so out of quote ‘hopelessness’ or any abstract conviction that life’s assets and debits do not square. And surely not because death seems suddenly appealing. 

""The person in whom its invisible agony reaches a certain unendurable level will kill herself the same way a trapped person will eventually jump from the window of a burning high-rise. Make no mistake about people who leap from burning windows. 

""Their terror of falling from a great height is still just as great as it would be for you or me standing speculatively at the same window just checking out the view; i.e. the fear of falling remains a constant. 

***""The variable here is the other terror, the fire’s flames: when the flames get close enough, falling to death becomes the slightly less terrible of two terrors.***

""It’s not desiring the fall; it’s terror of the flames. And yet nobody down on the sidewalk, looking up and yelling ‘Don’t!’ and ‘Hang on!’, can understand the jump. Not really. You’d have to have personally been trapped and felt flames to really understand a terror way beyond falling.""

~David Foster Wallace (author of *Infinite Jest* who committed suicide in 2008 and unfortunately lost his fight).",93,0,1592131490.0,,False,negative,negative,neutral,negative
fusdpin,Saw him few months ago in our college. He was our beloved alumni. This is sad.,44,0,1592129077.0,PDROJACK,False,negative,negative,negative,negative
fusdjoe,I just started seeing a therapist. Please everyone take care of yourself mentally.,42,0,1592128911.0,diabapp,False,neutral,neutral,neutral,neutral
fusf4pl,"How shitty is Indian media while handling this issue. I know that these corporate houses are good for nothing but you can be a little sensitive.

Aaj Tak and India TV reporters are at his house in Patna. No more social distancing. Wtf",94,0,1592130530.0,,False,negative,negative,negative,negative
fuulacu,"For everyone speculating why he did what he did:

I’ve struggled with suicidal thoughts in the past. If I had actually gone through with it, I assure you, even my closest friends and family would have had no idea why I did it. They could speculate, much like we all are doing here, but I’m fairly confident nobody would have been able to pinpoint the exact reason why I had done it.

Parents, significant others, friends, colleagues almost always come out and say, “We had no idea this was their state of mind.” 

If they don’t know for sure, you won’t either.",86,0,1592178478.0,nummakayne,False,negative,neutral,positive,neutral
fusdaxy,"Make your mental health a priority guys. 
Everything else can wait.",42,0,1592128664.0,Naankhataii,False,neutral,neutral,neutral,neutral
fusff01,"WTF

I'm really shocked atm. As someone who rarely watches Bollywood movies, he alongside Rajkummar Rao and  Ayushmann Khurrana were among my favourite actors. I liked his acting and actually gave me vibes of a genuinely good guy.So heartbreaking. For his family and for himself, god knows what struggles he was going through.

Take care of your mental health guys...don't hesitate to reach out for help. I'm not a psycologist but my DMs are also open if you want.",36,0,1592130816.0,harschil,1592131164.0,negative,positive,positive,positive
fuseipe,"He was Suffering from depression from past six months , this is the time when behaviours of family and friends matter. Depression is stigma in India people treat you badly.

Edit: He was",38,0,1592129905.0,Sushantnaik21,1592130871.0,negative,negative,negative,negative
fuu6qrq,The people posting pictures of his dead body on Twitter are being disrespectful and is a really bad thing to do imo. Suicide is never an answer either. Anyone thinking of this should get help.,38,0,1592170455.0,mysticsan,False,negative,negative,negative,negative
fusc1zl,"Such a successful and inspiring person commiting suicide screams that it's high time and we must get serious with mental health and caring about the people around us. No money can buy mental health.
I just can't get over with this.",107,0,1592127380.0,Shubham7616,1592127462.0,negative,negative,negative,negative
futjtso,"Still remember the day I tried to jump off. Such incidents revives those memories when I see someone go through this, that suicidal thoughts and feelings are the worst of your life.

People here say ""depression ammero ki bimari hai""  I mean WTF .... To kisan jo apne se suicide kar raha hai wo kya hai? ... They didn't took me seriously and I never tried to make them understand but these shit is real and society should look up to these issues.",37,0,1592157851.0,,False,negative,negative,negative,negative
fuubck9,[removed],38,0,1592172939.0,,False,neutral,neutral,negative,neutral
fusb8bl,I hope we start taking mental health seriously in India. We lose a lot of people just like that,40,0,1592126522.0,chutiyamadarchod,False,negative,negative,neutral,negative
fushn1a,"seek help guys, depression is no joke, talk to parents and friends",35,0,1592133002.0,Pb9ZWC2arlBd,False,negative,negative,neutral,negative
fusei9k,"On his Instagram, he used to post countless texts/pictures of universe & other seemingly high level concepts. 

He was learning about game development basics from Khan Academy a month back. I made fun of him in my mind saying, ""trying to be over-smart, I guess"". Now I feel bad. :(

He used to reply to his fans in comments, and he followed them.",101,0,1592129893.0,AtomR,False,negative,negative,neutral,negative
fusg6la,"####If you need support or know someone who does, **Please Reach Out to Your Nearest Mental Health Specialist**
* Helplines: AASRA: 91-22-27546669 (24 hours)
* Sneha Foundation: 91-44-24640050 (24 hours)
* Vandrevala Foundation for Mental Health: 1860-2662-345 and 1800-2333-330 (24 hours)
* iCall: 9152987821 (Available from Monday to Saturday: 8:00am to 10:00pm)
* Connecting NGO: 18002094353 (Available from 12 pm - 8 pm)",1,0,1592131572.0,IAmMohit,False,neutral,neutral,neutral,neutral
fusd1is,[removed],31,0,1592128393.0,,False,neutral,neutral,negative,neutral
fusku8l,Wow! The same people who were posting 'depression is no joke ' an hour ago are now forwarding and even some put status of his dead body. These people have no heart.,30,0,1592136032.0,snappywolf1,False,negative,negative,negative,negative
fuscy28,"I swear if any fucking unkill says that depression is nothing and it can be cured by yoga and positive thoughts, I will lose it. Our society has failed to build a support system for people going through mental illness.",80,0,1592128297.0,juancorleone,False,negative,negative,negative,negative
fuseynj,"Take care of your mental health guys, this goes on to show how mental illness doesn't care about your status before affecting you. R.I.P Sushant Singh Rajput 💔",27,0,1592130357.0,letmeeatcake97,False,negative,neutral,negative,negative
fuscbmh,"If this doesn't change the mental health scene in India, nothing will.",58,0,1592127654.0,AtomR,False,negative,neutral,negative,negative
fuscsec,"My family members used to watch his tv show Pavitra Rishta, I think it could have been his very 1st show I don't exactly know, but he got really popular for that part, even though I didn't follow that serial regularly still during dinner time I used to watch that sometimes because everyone else were watching.

Later he left the show and then few years later I saw him working in movies, and I kinda felt good for him and then he delivered the masterclass performance in Dhoni's biography.

Even though I wasn't exactly a die hard fan of him, but I had this kind of familiarity with him, everytime I saw him in a movie I felt like, hey it's him from the TV show.

Still can't believe this news, my first thought was how can he do that, it can't be him.

R.I.P brother, hope you find eternal peace away from whatever made you suffer in this world.",27,0,1592128132.0,,False,positive,positive,positive,positive
fush1b3,Countless people would have probably been inspired by that running to catch the train scene in MS Dhoni. And this happens to that actor. Life is really weird. RIP.,27,0,1592132410.0,arcygenzy,False,negative,neutral,negative,negative
futpdw0,"I feel very fortunate to not suffer from depression. I can't even fathom how people like Sushant, Robin Williams and Anthony Bourdain decide to end their life when from the outside it looks like they have everything. Depression and mental illness must be a bitch.",28,0,1592160898.0,anonbutler,False,negative,positive,negative,negative
fusbhrd,"WHAT THE FUCK!! like seriously This guy recently made a movie about how suicide is not the answer in his movie  Chhichhore and now... Man he was only 34 years old!! :,(",26,0,1592126793.0,,False,negative,negative,negative,negative
fusc1hj,"Literally the only actor I used to find talented and amazing as a person. Even as a person who doesn't watch much Bollywood movies, I feel sad for this one time.",26,0,1592127365.0,AJ65536,False,negative,negative,negative,negative
fusdbs1,"I am beyond shocked!! I have only seen one of his movies but he's just one of those Bolly people who'd pop up in the news every now and then, so for someone who digs Bollywood even a little bit, you can't help but recognize him.

I checked his Instagram handle and my intuition tells me he was contemplating death from quite some time - which is something that I find even more terrifying. You *never* know what a person might be up to as they're scrolling to through social media, presenting a happy-face, all in the while conjuring up the most devastating deeds in their minds.

May he rest in peace, and I'm sorry that the world couldn't be better..kinder to Sushant, which is what made him do this.",27,0,1592128689.0,bishybishhh,1592128813.0,negative,negative,neutral,negative
fusby2v,His last post on Instagram was about his mother. Rip.,68,0,1592127264.0,DarkBlaze99,False,negative,neutral,negative,negative
fusylla,Everyone who's blaming the victim can go fuck themselves with a cactus.,71,0,1592145977.0,hashedram,False,negative,negative,negative,negative
fuu7qli,[deleted],71,0,1592170990.0,,False,neutral,neutral,negative,neutral
fusogwp,His last movie would be Fault in our Stars remake. How will people watch this emotional movie knowing he has passed away irl.,23,0,1592139096.0,djbobby97,False,negative,negative,negative,negative
fuu76zw,"This is sad. I liked him in PK, even though it was a minor part.",25,0,1592170697.0,hotamericanarain,False,negative,negative,neutral,negative
fuscufm,"The saddest part is that he was not one of the ""typical"" bollywood actors whose life revolved around social media, advertisements, and acting success. I think he was the only bollywood actor who was so involved in science and spirituality. Most of his ig posts were not about bollywood or product ads, but of his involvements in his passions. 

Also, what's breaking my heart is we'll never know what was really going on with him that took him to this event. I'm not expecting much from police investigation and mainstream media tbh. 
RIP♥️",44,0,1592128191.0,GONEfreaky,False,negative,negative,negative,negative
fusd8q7,"He was not only a good actor but also a man from humble beginnings and with intellectuality which majority of Indian millenials could relate to. I had recently watched a YouTube video where he was giving a tour of his new apartment. His taste seemed very refined and he seemed very philosophical person with depth. It's really shocking news. One can never tell what's going on in someone's mind and what's one's breaking point.

I have been suffering from anxieties and moderate depression (both self-diagnosed) for past few years which has aggravated since covid-19 (just graduated, job issues). These are very tough times for everyone. Most of the world population are worrying about something or the other this year. WHO has a report saying mental health will get decimated this year for many. 

Stay safe people, stay in touch with friends and family. Once a while, everyone needs a reminder that there are people who care for them.",49,0,1592128600.0,,1592128908.0,positive,positive,neutral,positive
fusml7i,"On a side note, if you see someone who might be having suicidal thoughts, don't be heartless and tell them that it is wrong, try to understand their problem genuinely and then offer advice in a calculated manner. It might save a life.",50,0,1592137570.0,naughty_ningen,1592138325.0,neutral,neutral,positive,neutral
fuscg1j,"I actually liked his acting in Sonchiriya, chichore and m s dhoni.
He was a talented actor.

It's strange how appearances can be deceiving. He looked so happy on the outside..",23,0,1592127779.0,,False,positive,positive,neutral,positive
fusdsvm,This year is taking everyone down,24,0,1592129171.0,XLazer4,False,negative,negative,negative,negative
fush0ti,"In response to deaths of Sushant Singh Rajput, Jiah Khan & all other people who are depressed & suicidal.

Dear reader, I don’t know you and you don’t know me. Probably we are not even living in the same city. We look different. You may be older than me or younger. We are just completely strangers. But there are a few things which connects us. We are humans. We have emotions and feelings. A personality which defines us. And we are both on Reddit. If you read this, no matter what’s going on in your life at the moment, you can do it! You can manage out of it, you will stay strong because there are people who love you. And these people are worth it. Yes, we are strangers but not too far away from each other to not say that you are a great person !! Because you are ! I hope even if it’s just one of you, that I could help or support you in a way. This comment is for all the lonely people out there. Heaps of love.",68,0,1592132396.0,jprbruce,False,neutral,neutral,negative,neutral
fusdent,I always felt optimistic about the possibility of a second byomkesh Bakshi movie with Sushant. This is not sinking in.,43,0,1592128770.0,princesskinomoto,False,neutral,neutral,neutral,neutral
fusbglp,"These things make me feel mental health is way important compared to any success you can get , lost my friend few years back and now we lost such a talented person.",21,0,1592126760.0,ViccySD,False,negative,negative,negative,negative
fusfegj,[removed],21,0,1592130801.0,,False,neutral,neutral,negative,neutral
futkcnl,Who leaked pics of his dead body. He died in his flat so how many accessed the flat with the police.,23,0,1592158138.0,NigelBrady,False,negative,negative,negative,negative
fuu7jp9,"Who tf gave this post award which says “I am deceased”. People lack logi.
But honestly that person had the spirit",22,0,1592170886.0,,False,negative,negative,neutral,negative
fuslv4z,"In the photo of his dead body, a leg of policeman can be seen. So, it's possible that cameraman was someone from police as well. What a disgusting soul whoever taken the picture is.

And people who are sharing it on their Instagram stories, retweeting the tweets are soul-less creatures. That's why Indian media is scummy, because people on average are same. 

I can understand the morbid curiousity of someone who would want to see the picture. But the decision to share it with thousands of others on social media platform? Wow.",60,0,1592136947.0,AtomR,1592136995.0,negative,negative,negative,negative
