Comment ID,Comment Text,Comment Score,Comment Depth,Created Timestamp,Author,Edited,Semantic Label,Semantic Label 2,Semantic Label 3,Major_Semantic
fuscbsl,In today's scenario news channels are becoming more and more openion based rather than fact based. Only way out is to stop watching shitty news channels only to get filled with their shitty openions.,49,1,1592127659.0,Shubham7616,False,negative,negative,negative,negative
fusc9uu,Corona k alawa kuch toh mila hagnw ke liye,65,1,1592127605.0,IntraspeciesFever,False,neutral,neutral,neutral,neutral
fusfvjl,"For real, Mum turned to aaj tak and this crazy ass woman is just going on about how it was a selfish move and cared about no one. Like bitch if anyone's being selfish is you trying to fill your goddamn pockets.",6,1,1592131269.0,PanickedSerenity,False,negative,negative,negative,negative
fusl6r7,"Dude just ignore those dipshit low life news anchor, don't even give a slight recognition",2,1,1592136342.0,kbrunner69,False,negative,negative,negative,negative
fusj75q,"After beautiful portrayal and groundbreaking investigation by the high IQed news reporters on Sridevi's death, it is safe to say they'll end up with 3-4 apparent 'suicide notes' from Sushant by the end of the day",1,1,1592134496.0,AverageBrownGuy01,False,positive,neutral,neutral,neutral
fuv7g0q,The cameramen clearly didn't give a shit for the ambulance.They were literally pushing through each other to block it.,1,1,1592191954.0,BigChingus77,False,negative,negative,neutral,negative
fuv8lou,"Seriously, on the news bulletin of aaj tak, the headline was how did Sushant Singh Rajput get run out by life (in hindi), what the fuck, someone just died and their making humour out the his professional career. Seriously, I wish the person making those news bulletins hanged himself instead of Sushant. Would've been a huge favour to all of India.",1,1,1592192729.0,ujjwal_k1,False,negative,negative,negative,negative
fuviw4u,"They all are robotic machines, optimised to increase the TRP of their channels.",1,1,1592200402.0,,False,negative,negative,neutral,negative
fuvnctq,"News media that covers bollywood is absolute garbage. They're just a bunch of ""masala"" mongering whores (men included), who have no respect for artists and their lives. Publish whatever sells to the dysentery ridden populace that consumes such BS, no questions asked because we ""expose"" the truth.

Indian news outlets aren't very far behind, just hold one god damn debate without three morons screaming their way towards an apparent win in an argument.",1,1,1592204159.0,-KrAnTZ-,False,negative,negative,negative,negative
fusd1ru,this means a lot to me. Thank you for this.,54,1,1592128400.0,Hariii_,False,positive,positive,positive,positive
fusecnm,"I was suicidal for a while, 2 yrs before. I called a helpline. A lady talked with me. I was kinda bawling my eyes out, and ahe just straight up told me to book an appointment with a doctor from that organisation and told me the cost. I was.... Fukin mind blown dude. Fukin cried myself to sleep, smoked a joint next day, and never thought abt suicide thereafter. So it kinda helps ..i think.",37,1,1592129731.0,BrokenwolfeZ7,False,negative,neutral,neutral,neutral
fuscywb,+1,5,1,1592128320.0,ihatemondaynights,False,neutral,neutral,neutral,neutral
fusdsmu,You're an amazing human being! <3,5,1,1592129164.0,littlekiddolover,False,positive,positive,positive,positive
fuse0ot,You're awesome my man. Love you too.,3,1,1592129394.0,chengiz,False,positive,positive,positive,positive
fut4sk2,[deleted],2,1,1592149569.0,,False,neutral,neutral,negative,neutral
fut1pmf,People like you give us hope for humanity :) Shows us how good we all can be.,1,1,1592147813.0,potter_boltz,False,positive,positive,positive,positive
fusbyu2,Goes lengths to say about how a seemingly happy and healthy person mightn't be anywhere close to it,119,1,1592127286.0,Tomatoketchupghost,False,negative,neutral,positive,neutral
fusbjdb,His last film was actually Drive. But it's good if people don't remember the film or Sushant for that.,65,1,1592126838.0,idhunammaCSKda,False,positive,positive,neutral,positive
fuvy804,"So true. Even some of the people in depression who manage to muster courage to talk about their problems (even with someone they can confide in) are just considered as attention-seekers, and are thought of as ""abnormal"". Hence, they are sidelined completely by the society, which leads them into further depression. As someone who had been through depression myself (for 6 years), I know how it feels to keep all the pain within yourself, when you always have to put up a fake smile in front of the society.

Depression is still considered as a taboo by many. Hope things will change.",3,1,1592214691.0,ellenbogen-99,False,negative,negative,neutral,negative
fushet0,[removed],-11,1,1592132780.0,,False,neutral,neutral,negative,neutral
fusg3f7,"Aah, I still remember that day. I was about to book tickets to attend their concert for which I waited for almost 10 years and this happened. In the end I went to his memorial concert, but what an emotional night it was. Can never forget that concert.",13,1,1592131485.0,kay-nyn,False,positive,positive,positive,positive
fush11s,Man I miss Chester..his songs really pulled me out of misery. There was a time when all I had was his songs which really helped me.,7,1,1592132403.0,deusxmachine8,False,positive,positive,negative,positive
fusfoho,"Damn, I thought of same and somehow I went back and saw his random interviews and some songs.Tbh I wasn't a LP fan back then, but heard more of them after Chester's Suicide and for some reason today I can feel that pain.",5,1,1592131072.0,weirdhooman0410,False,negative,negative,negative,negative
fuu0ikm,I was devastated and spiraled into depression for two years. Glad I made it out. I miss him though.,1,1,1592167055.0,hritik_reddit,False,negative,neutral,neutral,neutral
fuv7neo,"Who cares one more light goes out in sky of million Stars,
I DO !!!",1,1,1592192092.0,,False,neutral,negative,neutral,neutral
fuva3y0,I miss Chester :(,1,1,1592193777.0,InSpaceAndTime,False,negative,neutral,negative,negative
fusjume,I highly recommend Detective Byomkesh Bakshi (2015),1,1,1592135114.0,AverageBrownGuy01,False,positive,positive,positive,positive
fusinoo,Wait what.,5,1,1592133988.0,Tejanbs,False,neutral,neutral,neutral,neutral
fuzpvmw,I have always known that life is not worth it.,1,1,1592294956.0,time_is_valuable,False,negative,negative,negative,negative
fv32bry,"You need sugar for lemonade too, but life only gave you lemons.",1,1,1592362945.0,,False,neutral,neutral,neutral,neutral
fusi38b,"Bruh I landed a job when I was 25. My father had retired and I was under tremendous pressure internally (parents didn't pressure me). In fact my younger brother got his appointment before I did. Imagine my situation. 

Anyway I'm 29 now, 4 years into being financially independent. Trust me it'll fall into place. Do not lose hope and always remember that your family is everything. Always think of them before taking any drastic measures.

Cheers.",54,1,1592133441.0,Tensor_,False,neutral,positive,positive,positive
fusj5tq,"Listen my man. I can't stress this enough. Go. Get. Help.

Depression, if indeed it is clinical, is not something you can snap out of. It is a pernicious blot, a gooey symbiote that resides in the deepest darkest crevices of our mind. Our society doesn't understand it fully, no one does. As a fellow struggler, the only thing we understand about it is that it needs to be addressed, actively. And that you're no less than another bcos you have it. 


Do. Not. Believe. That. Lie. 


Meet a psych, get medication if required. 
Go for therapy.
Get a crap load of gainful exercise. 
Get sunlight. 
Ask yourself what you can do to actively make another person's life better. And dive into this. 

And let me tell you. You'll be golden. Reach out to this band of faceless keyboard warriors. As Samwise Gamgee said, there are things worth fighting for. Your happiness, my man, is one of them.",10,1,1592134461.0,fatarabi,False,negative,negative,negative,negative
fusjwk0,[deleted],8,1,1592135164.0,,False,neutral,neutral,negative,neutral
fushv7h,"Don’t you ever give up man. I know it’s easier for me to tell you this as a stranger on the internet. But believe me whatever little(or large) you achieve in your life has a chain effect on so many people known and not known to you. Keep on fighting, keep on surviving. ✌🏼",6,1,1592133223.0,shadilal_gharjode,False,positive,positive,neutral,positive
fusi2ep,"Dude, I can relate. I've made some stupid mistakes which have set me back in my professional life and my earning level at the moment. What I find, however, is if you're learning something new everyday and your work gives you the opportunity to have variety in what you do, then it helps a great deal to offset the irritation with earning less than you ""should"" be.  
  
I hope you figure things out soon and if not, don't worry. Keep at it. I'm sure you'll come out the other side healthy and happy.",5,1,1592133418.0,,False,negative,positive,positive,positive
fushxaq,"Worry, but not fret dude. 

You can definitely earn enough to eat and live. Ping me if you ever want to talk. 

Remember, the world is stupid.",3,1,1592133280.0,awkward_pause_,False,positive,neutral,negative,neutral
fusi1ni,"That sucks to feel that way. I have no idea who you are but I know that I don't want you to die. I love you and God loves you (I know a lot of people don't believe that I didn't either for a long time). Reach out. Talk to someone. There's a lot of love out there for you, my fellow human.",3,1,1592133397.0,CameHere4Cats,False,negative,positive,neutral,neutral
fusi91k,Same boat.,3,1,1592133595.0,crazyb14,False,neutral,neutral,neutral,neutral
fusigzx,Best of luck! Stay strong!,3,1,1592133805.0,lolroflank,False,positive,positive,positive,positive
fushvmt,[deleted],4,1,1592133235.0,,False,neutral,neutral,negative,neutral
fuv94dr,You can tell us here what kind of job you need and we all can help by referring you or giving you some pointers on how to go about it,2,1,1592193084.0,lovefun8in,False,neutral,neutral,positive,neutral
fuxn1cb,"Congrats man. Everyone feels useless at some point of time when they are at their lowest

But if we get through that phase by medication or family support then we can get on with our lives ..

We can't let weak phases of our life spoil the whole life journey or make it seem unnecessary # existential crisis",1,1,1592249865.0,Spideyocd,False,neutral,neutral,negative,neutral
fusc2m4,[deleted],306,1,1592127399.0,,1686332878.0,neutral,neutral,negative,neutral
fusc33z,The older generation need a radical shift in their basic understanding of things,99,1,1592127413.0,DopeLastname,False,neutral,neutral,neutral,neutral
fusckcg,"That guy (VK Bansal) was in general a douchebag. Had attended his classes for a couple of months. Multiple insensitive remarks towards female students. We were not old enough to realize it then - seemed cool at that point.

Edit: I misread it as VK Bansal. No idea about PK, but VK was a douchebag. An intelligent and a rich douchebag - but a douchebag nonetheless.",80,1,1592127900.0,rahulBatmanDravid,1592135153.0,negative,negative,negative,negative
fuscsvx,Who tf is PK Bansal? VK's son is Sameer afaik. Is that the manager guy?,30,1,1592128148.0,trollpunny,False,negative,negative,neutral,negative
fusda3f,Is that VK Bansal you're talking about?,6,1,1592128640.0,SirBaes,False,neutral,neutral,negative,neutral
fusnji1,"As someone going through depression right now and classified as a ‘serious case’, this attitude irks me.   
I took my first therapy session and my dad asks, “ theek ho gaya ab?” Like, wtf? I said no, this takes a lot of session and he just said I am wasting my money and he can do the therapy sessions himself, no need of these quacks.",6,1,1592138358.0,A_C_A__B,False,negative,negative,negative,negative
fusxozo,"This brings back some really unpleasant memories. I already don't remember much of those 2 years of my life(something about brain suppressing memories of most stressful/depressing periods of your life), but holy shit, people at Bansal classes were some of the best instructors and most insensitive assholes I have had the displeasure to come across. I was too young then to understand the deeply problematic and sexist remarks they used to make. 

I have been out of Kota for 6 years and I still can not relax without feeling guilty. I still feel guilty about falling sick or something. I was told on my first day at Bansal classes that if I am able to go to doctor, I am not sick enough and should attend the classes instead. I haven't taken a sick leave in 8 years.

God that place fucked me up good.",3,1,1592145427.0,psychoKlicker,False,negative,negative,negative,negative
fusbb0w,[removed],38,1,1592126600.0,,False,neutral,neutral,negative,neutral
fusbf2s,[removed],-78,1,1592126715.0,,False,neutral,neutral,negative,neutral
futf0m3,I wish more people had this mind.  It's so simple yet people go for their own entertainment,5,1,1592155241.0,josephdesousa,False,negative,negative,positive,negative
futq6lv,"My facebook is filled with such people, including one person who said - ""Don't share or celebrate people who give wrong message to kids, instead talk about celebrities who went through hardships successfully.""


I don't understand how these people lack basic compassion and humanity. I've tried sharing on my wall with messages with positive messages about mental health visibility, ending stigma and not to victim-blame.

But I'm not sure how else to convince these people, some of them happen to be friends and family (although I'm beginning to see some people sharing positive messages).",7,1,1592161337.0,IndianPhDStudent,False,negative,negative,negative,negative
futh0me,"Thank you. 

We really need more voices like yours.",4,1,1592156323.0,Athos92,False,positive,positive,positive,positive
fvjr2e1,"Even his death is portrayed as something that he has offered the public as a message or whatever. Like no, this man's life and death are not merely for public consumption. He doesn't need to answer to anyone in life or in death and neither does anyone else.",2,1,1592755852.0,AshMeAQ,False,negative,negative,negative,negative
fusk517,"I'm getting messages from people saying 'if you ever wanna talk or need help, I'm here'

When I do reach out, they're never free.",74,1,1592135385.0,Frizerra,False,negative,neutral,negative,negative
fushiha,Take care bro. My DM is open if you ever wanna talk about anything.,27,1,1592132881.0,akdsouza,False,positive,positive,neutral,positive
fusi6b3,"Have you mentioned to your friends and family that you're having trouble with mental health? If not, I sincerely hope you're able to do that soon. Take care.",13,1,1592133521.0,,False,neutral,neutral,positive,neutral
fusjlwt,I feel you. It's not like they even cared for the said celebrity. This is just that bubble that makes them to be woke for a day or two to be aware of the dangers mental illnesa do.,10,1,1592134883.0,AverageBrownGuy01,False,negative,negative,negative,negative
fushmip,"I stopped using social media, and it helped my mental health a lot.",17,1,1592132988.0,crazyb14,False,positive,positive,positive,positive
fushwx0,If this ain’t the truth lol,8,1,1592133270.0,kapilsc,False,negative,neutral,neutral,neutral
fusjlxo,"Please , hit me up if you want to talk about anything. Anyone fighting with depression please  DM if you are not feeling well. Always open to talk.",7,1,1592134884.0,auctus10,False,neutral,neutral,neutral,neutral
fushnma,"But they DO! Its just that, Sometimes its late.",3,1,1592133017.0,ActiveFormality,False,neutral,neutral,neutral,neutral
fuvfzkn,"A large portion of people posting these msgs on social media are doing this to earn browny points and appear woke. They don't give a fuck and don't fucking know what depression is.

Few years ago, one of my colleague had committed suicide in his apartment and when the news was conveyed to our office, everyone started the ""oh, we should be sensitive to our co-workers, take care of them, keep our minds open"" etc etc... And those same motherfuckers turn around and go on bullying and humiliating other coworkers without batting an eye.",2,1,1592198108.0,iWizardB,False,negative,negative,negative,negative
fut1hyk,Well he was famous. Commenting and posting doesn't take time and effort but reaching out does . You got to look out for yourself and only people who will ever love you are your parents.,1,1,1592147690.0,,False,neutral,neutral,neutral,neutral
futdvg2,"You're so fucking right I wanna hug you. I was deeply depressed last year(still am, but much better condition) and no fucking one came to help me except my family(of course).",1,1,1592154620.0,geniusn,False,negative,negative,negative,negative
fv89y49,"Actually there ia truth in your saying.. I am deeply affected by sushant's death not because I liked him or something but I was unable to believe he would do something like this... also it brought back memories from the past... lost my father 22yrs ago to depression and suicide. I was legally diagnozed once 15 years back which my family realized after 8 years of my father's death... twice more I was under depression for 3 years and 1 year again but then my husband refused to get a psychiatrist on board... and luckily my father's death inbibed one rule in me, I will never attempt suicide coz I saw people who were alive like corpses after he left. I pushed myself and started talking to any friend who came across and tried to divert myself but I guess it stays in there and resurfaces after sometime.... initially I knew why I had depression, now I don't even know the reason.",1,1,1592486305.0,Phoenixedthoughts,False,negative,negative,negative,negative
fuscze5,Lol. Did you see the migrants losing their lives a few weeks back? Nobody cares in this country.,6,1,1592128333.0,,False,negative,negative,negative,negative
fusbvj5,[removed],22,1,1592127191.0,,False,neutral,neutral,negative,neutral
fusdg27,mental health is just as important as physical health,68,1,1592128810.0,lambda0101,False,neutral,positive,neutral,neutral
fusduka,"Same shit is happening here. Mom is talking shit like only cowards do this and that, you know all that shit Indian parents say.
And here I am with 3 year lags in college trying to get better, why? Can't be depression, I am lazy and not working hard enough. How can I get better when there is so much toxicity in the house. I have to listen to their shit all the time, in every aspect of my life.",49,1,1592129218.0,suppressed_howl,False,negative,negative,negative,negative
fusdv6t,"It is a shame that people do that especially elders who think they know everything. Please, if you can, whenever they speak bad of the passed, tell them to respect and mourn instead of talking ill of them.",7,1,1592129235.0,chocolatesAtMidnight,False,negative,negative,negative,negative
fuse98h,"According to Indians, our elders obviously, either you are mental or you are ill. And due to the stigma attached to mental health, I don't think anyone could be saved from this. More and more people are going to die but there will always be some shitty remark that is available as an excuse!
It's just rooted in the society! We can't even blame my or your family for it! It goes beyond that. 
He was a lovely soul and I hope he knew that he was loved!",5,1,1592129634.0,,False,negative,negative,neutral,negative
fusfogz,"Do yourself a favour, quit that group chat irrespective of how much you love your family.",7,1,1592131072.0,iphone4Suser,False,negative,negative,positive,negative
fut5wt2,"The older generation will just die off , don't worry the new generation knows it's problems and isn't a hypocrite about society, sex and racism.",2,1,1592150202.0,alsu2launda,False,negative,negative,negative,negative
fusjswq,Everyone in (mine as well and most indian houses) is instantly an investigative expert ready to jump to conclusions. Because real talk is uncomfortable,2,1,1592135070.0,UglyDucklingTaken,False,neutral,negative,positive,neutral
fusn6mp,"Your belief about depression being the true killer behind his move is also nothing but an opinion. It probably was an accident, cuz he didnt leave any notes behind",0,1,1592138061.0,Starkboy,False,negative,negative,negative,negative
fusciyv,"This reminds me of Chester Benington. Guy saved a lot of souls, only for his to be taken away.",73,1,1592127860.0,RishRamsey,False,negative,positive,neutral,neutral
fuw357q,"Idk but I read there was some smear campaign against him, people were trying to bring him down.",1,1,1592219450.0,Nice_boy69,False,negative,negative,negative,negative
fuse49k,Mental health problems is not taken seriously in our country join r/IndiaMentalHealth to start taking steps towards saving others life and yours,6,1,1592129496.0,MOHIBisOTAKU,False,negative,neutral,negative,negative
fuscx81,"Couldn't agree more. I've seen that the people who actually attempt to take care of their mental health through therapy getting judged by the others. So many people believe that seeing a therapist makes you some kind of a weird insane nut, and it's quite unfortunate since it discourages seeking professional help.

Hope this mentality gets eradicated soon. If you're suffering from anything, please seek professional help. There's always someone for you.",6,1,1592128272.0,loose_noodle,False,negative,negative,negative,negative
fusga4w,"When I informed a doctor about my depression, he replied saying that he would beat me up if he was my father. People in India still far from learning about these issues. My declining academic performances were clear indication of my depression as a teenager, but now I somehow recovering in my early 20s.",3,1,1592131669.0,,False,negative,negative,negative,negative
fusg7yk,This news just made me think of DFW. They both went in a similar manner. I have been going through his old posts just I could just understand what went through his head.,12,1,1592131610.0,,False,neutral,neutral,negative,neutral
fusi9ek,So many people need to realise this.,5,1,1592133606.0,Harmless_Pirate,False,neutral,neutral,neutral,neutral
fusinq7,">""As, however, it was just the suffering which it so shuns that was able,  as mortification of the will, to bring it to the denial of itself, and  hence to freedom, so in this respect the suicide is like a sick man,  who, after a painful operation which would entirely cure him has been  begun, will not allow it to be completed, but prefers to retain his  disease. Suffering approaches and reveals itself as the possibility of  the denial of will; but the will rejects it, in that it destroys the  body, the manifestation of itself, in order that it may remain unbroken.  But if a human being was ever restrained from committing suicide by  purely moral motives, the inmost meaning of this self-conquest was this:  “I will not shun suffering, in order that it may help to put an end to  the will to live, whose manifestation is so wretched, by so  strengthening the knowledge of the real nature of the world which is  already beginning to dawn upon me, that it may become the final quieter  of my will, and may free me for ever.”  
>  
>\-Arthur Schopenhauer, The World as Will and Representation",4,1,1592133989.0,,False,negative,negative,negative,negative
fusjhdj,Reminds me so much of the jumpers of 9/11.,4,1,1592134765.0,,False,negative,neutral,neutral,neutral
fusdu2k,DCE?,16,1,1592129204.0,lovejackdaniels,False,neutral,neutral,neutral,neutral
fusdvrv,also evaluate if you're going to a good therapist.,7,1,1592129252.0,wrongdude91,False,neutral,neutral,neutral,neutral
fusfk8r,"His house is very close to mine. Some guys came here without masks and asked my father to come with them. Dad asked why they didn't have masks on and they said, ""oh let's hurry up, there's media there!""",20,1,1592130959.0,Tomatoketchupghost,False,neutral,neutral,neutral,neutral
fuuxzau,100% this.,11,1,1592185955.0,petersimpson33,False,neutral,neutral,positive,neutral
fuv4kdv,"I agree, suicidal thoughts is something you usually keep to your self and not tell others so the things that cause it is also known just by you. if you take the big leap your family and friends will be confused because keeping it hidden causes people around you who care for you to have no idea what is going on. If anyone who reads this has suicidal thoughts please talk with loved ones, I understand it may be hard but they care for you so they should know.",5,1,1592190029.0,supera088,False,negative,neutral,negative,negative
fusetbg,Sushant... Don't commit suicide,-18,1,1592130207.0,gandfatli3,False,negative,neutral,negative,negative
fuvp3kh,"Twitter is a fucking cesspool of unsympathetic attention whores, man. What did you expect?",3,1,1592205724.0,invictus1996,False,negative,negative,negative,negative
fuse505,[deleted],6,1,1592129516.0,,False,neutral,neutral,negative,neutral
fusds35,"True. We can do stuff about it. Schools should really talk about mental illnesses, so people can get comfortable with that, and can come close to understanding how it is dealing with them. I think it will make things way better.",3,1,1592129149.0,_-__-_-__-__-,False,positive,positive,neutral,positive
futmgd3,"I *really* hope you know what the phrase ""look up to"" means.",4,1,1592159285.0,fgoarm,False,neutral,neutral,positive,neutral
futm2bc,I always feel so silly trying to tell people about my suicidal moments. Like I feel like I’m being dramatic or maybe they think I just want attention.,3,1,1592159072.0,bspencer626,False,negative,negative,negative,negative
