Comment ID,Comment Text,Comment Score,Comment Depth,Created Timestamp,Author,Edited,Semantic Label,Semantic Label 2,Semantic Label 3,Major_Semantic
h6cdpdp,https://olympics.com/tokyo-2020/olympic-games/en/results/weightlifting/result-women-s-49kg-fnl-a00100-.htm,1,0,1627112018.0,msquarea,False,neutral,neutral,neutral,neutral
h6cashk,"From the official Olympics website:

> From lifting firewood as a kid to being elevated onto international podiums, weightlifter Saikhom Mirabai Chanu's story is one of a remarkable rise.

> Mirabai Chanu sprung to international prominence at the age of 20, when she bagged the silver medal in the 48kg category at the 2014 Commonwealth Games in Scotland.
Then at the national trials for the Rio 2016 Olympics, Mirabai Chanu broke a 12-year-old national record held by seven-time World championships medallist Kunjarani Devi to book her place in the Indian team for the Games.
The record aside, her total of 192kg at the selection trials would position Mirabai Chanu as a medal contender at the Rio Olympics.
But in Brazil, Mirabai Chanu failed to flourish, unable to execute any of her three attempts in 'clean and jerk' and only one correct effort in the 'snatch'.

> Returning home with a DNF (Did not Finish) against her name, was not what Mirabai Chanu had in mind - but the Indian weightlifter has always had to show her mental fortitude alongside her physical strength.

> Born in a family with limited means and the youngest among six siblings in Nongpok Kakching, a village in Imphal, Chanu’s lifting prowess was first noted when she was around 12, able to lift and carry home a bundle of firewood that was way too heavy for her brother, four years her senior.

> Always drawn to sports, Mirabai Chanu had initially wanted to take up archery until stumbling into a weighlifting hall at a local sports hall in Imphal.

> The firewood she carried would prove fuel for her ambitions - a natural at the sport, she quickly had an idol to try and emulate, finding inspiration from the exploits of India's most decorated female weightlifter, Kunjarani Devi.

> At the 2017 World Weightlifting Championship in Anaheim, USA, Mirabai Chanu became the first Indian weighlifter in over two decades to claim a gold medal. Her effort in the 48kg category was the first since Sydney 2000 bronze medallist Karnam Malleswari’s title runs in 1994 and 1995.

> She followed that up with a gold at the 2018 Commonwealth Games, an event that saw her smash the Games record in ‘snatch’, ‘clean and jerk’ and ‘total’. But an injury to her lower-back would draw curtains on what was shaping up for a spectacular season.

> It meant that Chanu had to sit out of the Asian Games and the World Championships in 2018, and then spend nearly a year away from the floor, recuperating from the injury.

> It was only in 2019 that Chanu returned to compete at the World Championships in Thailand. She could only manage a fourth-place finish, but it was a memorable outing at the Pattaya event as she breached the 200kg mark for the first time in her career.

> At the 2021 Asian weightlifting championships in Tashkent in April, Mirabai Chanu set a new world record in the clean and jerk with a lift of 119kgs. However, a below-par show in snatch meant Mirabai Chanu had to settle for a bronze medal at the Asian meet.

> The performance, however, was enough to confirm her Tokyo 2020 berth based on rankings. She'll be the only Indian weightlifter in action at Tokyo.

Special appreciation for the strong women of Manipur with the likes of Mary Kom, Kunjarani Devi and others. And today, Miss Mirabai bagged India’s 1 silver medal from this Olympics! 🥈",538,0,1627109457.0,Aggressive_Patient57,1627118161.0,positive,positive,positive,positive
h6cbbvi,"India currently at second in total medals tally!

Stop the count!",700,0,1627109922.0,Jetlite,False,neutral,neutral,neutral,neutral
h6ca8vn,Go Girl!!!🙌🏼,132,0,1627108999.0,sudden_dust,False,positive,positive,positive,positive
h6cc21b,"Right when they were on podium, sony showed the trailer of a South Indian movie on split screen -_-",312,0,1627110556.0,ad_taway,False,neutral,negative,neutral,neutral
h6cc3mj,I was about to post the same!.. Manipuri girls at its best! And more 🏅 are expected!,61,0,1627110595.0,nei_lei,False,positive,positive,positive,positive
h6cbki2,"In Manipur, the betis do all the saving 🥈",258,0,1627110131.0,deboo117,False,neutral,neutral,positive,neutral
h6cabkw,Bhai bhai bhai,44,0,1627109062.0,shmakn,False,neutral,neutral,negative,neutral
h6cb37b,"We only support them after they win the medal.

Now bollywood will make a biopic on her and her struggles. There are many athletes who had worked equally well.",245,0,1627109712.0,,False,positive,neutral,negative,neutral
h6cb8sh,"""...Sail on SILVER girl...""",38,0,1627109846.0,Gooner_14_Highbury,False,neutral,neutral,neutral,neutral
h6ccl10,Girl make India proud!,32,0,1627111020.0,bamboo_circle,False,positive,positive,positive,positive
h6cjh3h,Wish there was better development and sports facilities in the north east. I know many people who were very athletic but could never hope to do sports and very few actually have the means to achieve their dreams.,61,0,1627117385.0,technardo08,False,negative,negative,negative,negative
h6cakmb,Let's fucking goooo!!!,56,0,1627109275.0,novoc4ne,False,positive,positive,negative,positive
h6cgl43,"I love this coz whenever someone bags a medal in a game it's popularity increases and so many get inspired.  
   
Also last time she totally failed this shows how much effort she has put into the game to straight bag a silver.",44,0,1627114649.0,charismaticEVIL,False,positive,positive,positive,positive
h6car1v,Epic,21,0,1627109424.0,Disastrous_Thing_733,False,positive,positive,positive,positive
h6d1jft,It's good that all Indians are celebrating this but mainland Indians should take this moment to reflect upon how we have treated north easterns. It's no good celebrating this today if tomorrow when she's in civilian garbs she's going to be asked to go back to china.,19,0,1627132244.0,restarted_mustard,False,neutral,neutral,neutral,neutral
h6cwdsy,Priyanka Chopra : _📞Hello Omung you there?_,18,0,1627128801.0,professor_curry,False,neutral,neutral,negative,neutral
h6carqt,Woohoo,13,0,1627109441.0,,False,positive,positive,positive,positive
h6cbh87,[deleted],38,0,1627110052.0,,False,neutral,neutral,negative,neutral
h6cbdkd,Yay :'),13,0,1627109964.0,Rosasenensis,False,positive,positive,positive,positive
h6cfsg0,👏👏 CONGRATULATIONS !! 1ST MEDAL FOR INDIA !! 👏👏,12,0,1627113910.0,COOL_GEEK_010506,False,positive,positive,positive,positive
h6cgsap,She has inspired another generation of athletes today. An incredibly brave story of grit and determination.,13,0,1627114827.0,therealwarriormonk,False,positive,positive,positive,positive
h6cdas6,"Finally, that too in the first day less goooo.",12,0,1627111652.0,Naren_the_747_pilot,False,positive,positive,neutral,positive
h6ce3rr,Yaay her! You go girl. So happy for her! Heartiest congratulations <3 <3,12,0,1627112374.0,Hijikata_san_mayo13,False,positive,positive,positive,positive
h6chqy8,"Good show!  For the first time, we have a medal at the beginning of the games itself. I dont remember winning like this earlier.",10,0,1627115733.0,sanwfa,False,positive,positive,positive,positive
h6cm5ra,She's continuing to win more medals in reddit now🤍,12,0,1627119996.0,akashlanka,False,positive,positive,positive,positive
h6e1fhn,"Somehow after the win, I can see some facial similarities with Priyanka Chopra",7,0,1627150475.0,msinghmsn,False,positive,neutral,positive,positive
h6cgp3v,You go queen,6,0,1627114747.0,Jay9dec,False,positive,positive,positive,positive
h6cpvla,"soooo proud of her! A pride of India. 🇮🇳 

and also, STOP THE COUNT!!!! we're 2nd in the board.",5,0,1627123484.0,HuckleberryThick9372,False,positive,positive,positive,positive
h6dds7m,"Aye, so many athletes from North East India winning us medals. Hope our leaders are affording them with the best of everything!",7,0,1627139033.0,D-3-V,False,positive,positive,positive,positive
h6ce9cc,Go girl!!!Just Woow!!!,6,0,1627112512.0,shifanamuhammedali,False,positive,positive,neutral,positive
h6cg4hy,You go girl,5,0,1627114219.0,oopsie_loopsy,False,positive,positive,neutral,positive
h6clz79,Queen🔥 Congratulations,4,0,1627119816.0,animesh__zlatan,False,positive,positive,positive,positive
h6cqxph,Can't wait for the movie.,6,0,1627124418.0,MysticSkies,False,positive,positive,neutral,positive
h6d5cr7,India has so many people. Why do they suck at sports?,5,0,1627134529.0,Hondipo,False,negative,negative,negative,negative
h6cc39y,POG,7,0,1627110586.0,PM_ME_BIG_CHUNGI,False,neutral,neutral,negative,neutral
h6cfhrw,Woot woot,5,0,1627113642.0,newinvestor0908,False,positive,positive,neutral,positive
h6cj1z2,Let's goo :),4,0,1627116978.0,Illustrious-Spray-87,False,positive,positive,neutral,positive
h6cjy85,You go girl!!! 🏋️💃🍾,4,0,1627117847.0,sarcaastik,False,positive,positive,neutral,positive
h6cwhfc,We have a good chance of winning Gold in Archery and Shooting this year. Those two are my favourite sports,4,0,1627128875.0,arpitdas,False,positive,positive,positive,positive
h6cyzzi,"GREAT!!! 

read an article about her this morning, it said she has the potential to win the gold if she resolves the issues she has with *snatch* (whatever that means).",4,0,1627130618.0,NotADodgyCat,1627131388.0,positive,positive,positive,positive
h6d21z5,Girl making India proud !!,4,0,1627132564.0,irresponsible_fellow,False,positive,positive,positive,positive
h6dpi7x,"She made India proud, but some would question her if she is Indian or not and call her names",4,0,1627144692.0,Few8232,False,neutral,positive,positive,positive
h6cfnp0,One thing is clear that Kiren Rijiju has been a great sports minister.,22,0,1627113792.0,kartikeyas00,False,positive,positive,positive,positive
h6cctwv,GOAT 👏,7,0,1627111235.0,,False,positive,neutral,neutral,neutral
h6cczu9,POG,7,0,1627111381.0,macaditya444,False,neutral,neutral,negative,neutral
h6ce1zc,POGGG TEAM INDIA,8,0,1627112330.0,,False,positive,neutral,neutral,neutral
h6chjmf,Let's gooooo!,3,0,1627115547.0,Maraudogs,False,positive,positive,positive,positive
h6cnww1,congratulations. So amazing,3,0,1627121684.0,Akki8888,False,positive,positive,positive,positive
h6cre0c,Wow that was quick. Let's hope there is a lot more this time,3,0,1627124805.0,prankored,False,positive,positive,positive,positive
h6cs502,congrats!,3,0,1627125443.0,,False,positive,positive,positive,positive
h6cxpm3,Wow Amazing,3,0,1627129744.0,Amrit2206,False,positive,positive,positive,positive
h6d1dr9,Great job,3,0,1627132146.0,Beneficial-Carob-853,False,positive,positive,positive,positive
h6dsrk8,So inspirational.,3,0,1627146263.0,onlinesupport365,False,positive,positive,positive,positive
h6e6jh7,Manipur be giving birth to some strong women ey,3,0,1627153007.0,jjangjjangmanboom,False,positive,positive,neutral,positive
h6esf62,Proud of you ! Keep it up,3,0,1627164178.0,World_peace_18,False,positive,positive,positive,positive
h6ck5z6,Who won gold?,5,0,1627118058.0,Physched,False,neutral,neutral,neutral,neutral
h6cmp4y,Let's gooooo Queen,5,0,1627120522.0,spicyyedgelord,False,positive,positive,positive,positive
h6cp5a9,"But North Eastern are not real Indians they are Chinese and she purposely lost to Chaina. /s

Seriously i hope that such events happen more and stop the bigotry. North East India need some mainstream recognition.",17,0,1627122824.0,Cpz1_,False,negative,negative,neutral,negative
h6cp0da,Excellent. Congratulations to her.,2,0,1627122699.0,ReasonableCost3,False,positive,positive,positive,positive
h6cprox,You go girl !,2,0,1627123387.0,problem_solver1,False,positive,positive,positive,positive
h6cw1ci,Good,2,0,1627128543.0,Indianmentalhealth,False,positive,positive,positive,positive
h6d1qkd,Yes.This is nice getting medal on day one. The pain of seeing zero in medals tally for days is awful.,2,0,1627132365.0,eminem_beautiful,False,positive,positive,negative,positive
h6dsx3n,"Yesssssssssss
Go India",2,0,1627146338.0,flyingjat,False,positive,positive,neutral,positive
h6dw7ag,Another biopic bollywood movie ON THE WAY..,2,0,1627147927.0,MovePuzzleheaded4959,False,positive,neutral,neutral,neutral
h6e5f7v,I really really want India to bring good number of medals home this time!,2,0,1627152451.0,,False,positive,positive,positive,positive
h6e9500,Her personality stood out really today.  Amazing,2,0,1627154318.0,prosperousdoggo,False,positive,positive,positive,positive
h6ecvcg,Awesome,2,0,1627156212.0,Eisohra,False,positive,positive,positive,positive
h6efn9q,WOW!,2,0,1627157627.0,arnott,False,positive,positive,positive,positive
h6ejv8h,Kabaadi should be a Olympic sport,2,0,1627159776.0,Tutslal,False,neutral,positive,neutral,neutral
h6ep0gr,Congratulations,2,0,1627162425.0,powerofreason,False,positive,positive,positive,positive
h6ez6hq," Congratulations, everyone!",2,0,1627167764.0,phoney_user,False,positive,positive,positive,positive
h6f23y7,dont look indian...,2,0,1627169355.0,theZiMRA,False,neutral,negative,negative,negative
h6f44tj,i thought she has 1 leg and 1 arm wow her left hand is long,2,0,1627170474.0,,False,neutral,neutral,neutral,neutral
h6f8zn2,Is Sony showing the Olympics? I have SonyLiv and do not find anything related to Olympics there,2,0,1627173197.0,SlightPirate9863,False,neutral,neutral,neutral,neutral
h6fecwv,WOOOOHOOOO! 🎉,2,0,1627176200.0,,False,positive,positive,positive,positive
h6ftwxb,"Should we consider her religion and celebrate accordingly?

Asking for a Govt.",2,0,1627185472.0,Bunroti,1627187365.0,neutral,neutral,neutral,neutral
h6fudh5,Cool.,2,0,1627185772.0,Particular_Caphuh,False,positive,positive,positive,positive
h6g2gzc,Proud of her. Jai Hind,2,0,1627191497.0,Eksalar,False,positive,positive,positive,positive
h6gnds2,"True but even so, their team size is still huge. The US is also an amazing sporting country but they also have over 10 times the people.",2,0,1627210197.0,Kitchen-Fondant-972,False,positive,positive,positive,positive
h6hr2ny,meanwhile the gold winner set WR,2,0,1627233692.0,Kemosahbe,False,neutral,neutral,neutral,neutral
h6jep4a,Congratulation,2,0,1627263869.0,jakisun,False,positive,positive,positive,positive
h6lbytr,Awesome!!,2,0,1627311171.0,Azqaadesigns,False,positive,positive,positive,positive
h6wzlqq,This is insane especially considering how little support weightlifting gets in India.,2,0,1627530261.0,,False,negative,negative,negative,negative
h7cnhqw,Congratulations to her,2,0,1627849211.0,niram24,False,positive,positive,positive,positive
h8i11zu,She would lift her husband like a Sack of rice 😂,2,0,1628657931.0,Craningtubes_lots,False,neutral,neutral,neutral,neutral
h6dbtoh,"Genuinely curious, but I didn't know parts of India had people that looked like that. I would think she's Thai if I didn't know.",3,0,1627138028.0,RzK,False,neutral,neutral,neutral,neutral
h6cke9r,why i can't find the video of her winning on youtube or anywhere easily without paying and watching 20 ads. welcome to india.,6,0,1627118285.0,Basic-Climate-5409,1627118502.0,negative,negative,positive,negative
h6ckoww,"When it seems..

so wrong to be a woman pursuing career in sports

so wrong to choose a sport which has spelling altogether different from cricket

so wrong not to give up when you are passionate about brutal sport of weightlifting

so wrong when no corporate steps forward to sponsor you as you do not play cricket

so wrong when nation full of idiots is not ready to consider weightlifting as a sport

THIS BRAVE WOMAN WINS SILVER IN OLYMPICS AMID ALL CHAOS, STRUGGLE, AND INJUSTICE.

WOULD BE GLAD IF SHE AND OTHERS OF HER ILK ARE SPONSORED AND NO LONGER WE HAVE TO WATCH MONKEYFACE KOHLI IN ANY ADVERTISEMENTS.",6,0,1627118568.0,brooktherook,False,negative,negative,negative,negative
h6d0k45,Hell yeah new movie script for Akshay Kumar!,2,0,1627131630.0,nazisonmoon,False,positive,positive,neutral,positive
h6d04cg,"Saw a few bjp handles tagging pmo for the congratulations msg.
Weird that they have themselves become a high command culture which they hated in Congress .",0,0,1627131350.0,Crazy_Revenue_832,False,negative,negative,negative,negative
h6da3is,Osm,1,0,1627137126.0,Tgrai123,False,neutral,neutral,positive,neutral
h6dw4dy,"LOL thread going crazy.
reminds me of the eruption of delirious hubbub when PV Sindhu got the silver",1,0,1627147888.0,Kemosahbe,False,neutral,neutral,negative,neutral
h6d0r4w,"Chanu Saikhom Mirabai wins India's first medal in Tokyo Olympics 2020 under the visionary leadership of our honorable prime minister Narendra Modi ji. Thank you Modiji! 

/s",-4,0,1627131752.0,extra_gobi_kodi,False,positive,positive,positive,positive
h6cn8nt,[deleted],-4,0,1627121043.0,,False,neutral,neutral,negative,neutral
h6dkk5q,"Any time now, there should be a post emerging about how HE made it possible by sleeping only 4 hours a day",-2,0,1627142311.0,p_venkatraman,False,neutral,neutral,positive,neutral
h6eravf,https://discord.gg/r4gVkG9c,0,0,1627163599.0,Best-Property-5784,False,neutral,neutral,negative,neutral
h6cgb6l,Ruk jaa bhai patriarchy smash karke aara hoon 😅,-4,0,1627114393.0,hackey7000,False,neutral,neutral,negative,neutral
h6duc0w,[deleted],-2,0,1627147020.0,,False,neutral,neutral,negative,neutral
h6cs8s7,"Hope she enjoys the moment.  Very likely that she will be selling vegetables from a cart in a few years, given how India treats its sportspersons.",-23,0,1627125531.0,bannedbutstillhere,False,positive,positive,positive,positive
h6dwmxr,[removed],-13,0,1627148134.0,,False,neutral,neutral,negative,neutral
h6cng4v,And she is rich. Feels like I also should have tried playing sports,-7,0,1627121240.0,VidShala,False,positive,positive,neutral,positive
h6cvt27,"If old Punjab became Khalistan and The North East became its own state India would have 0 chance in any sport except cricket lmao 

It’s funny cause they are the two groups who face discrimination",-19,0,1627128371.0,NovelExplanation3299,False,negative,negative,neutral,negative
h6e7rrx,"Alrite I'll be the a-hole.. You don't win silver, you lose gold. Stop saying she won silver pls. Am sure she was aiming for gold all along but had to settle for 2nd place at the end. Bring on the down votes!",-7,0,1627153622.0,greyasshairs,False,negative,neutral,negative,negative
h6cno7c,First and last,-29,0,1627121453.0,pvdsan,False,neutral,neutral,neutral,neutral
h6cowjk,second best just like virat after sir steve smith,-27,0,1627122603.0,Scratch_Natural,False,positive,neutral,positive,positive
h6gp60d,She is from my state,1,0,1627211822.0,Crimson_Excalibur,False,neutral,neutral,neutral,neutral
h7bf2ii,India will win at least 5 medals,1,0,1627828295.0,confused_sahil1999,False,positive,positive,positive,positive
h6cc254,Voot voot.... yaay!!! She seems like an such an awesome and motivated girl. She didn't give up after her lower back injury which is enough to threaten any decent weightlifters career!,156,1,1627110559.0,,False,positive,positive,positive,positive
h6cjsgu,FYI Kunjarani is from Manipur too,50,1,1627117691.0,kirasama66,False,neutral,neutral,neutral,neutral
h6cna6t,Amazing. So inspirational,27,1,1627121084.0,Daggy1234,False,positive,positive,positive,positive
h6ct5yh,Love stories of improvished people doing something great.,16,1,1627126300.0,sinmantky,False,positive,positive,positive,positive
h6e0tae,Congratulations to her.,2,1,1627150170.0,space_looper,False,positive,positive,positive,positive
h6dfjjn,[removed],0,1,1627139891.0,,False,neutral,neutral,negative,neutral
h6ce009,[removed],177,1,1627112281.0,,False,neutral,neutral,negative,neutral
h6cn61w,"Like Mr. Nags said, Stop the IPL tournament when Bangalore is top...",64,1,1627120976.0,Untrue_Mercy,False,neutral,negative,neutral,neutral
h6cnopc,"It's always Britain, USA and China man! Olympics is loot for 'em. the last gold medal we had was in 2008. Abhinav bindra for 10m rifle shooting.",47,1,1627121467.0,demnfedora,False,negative,negative,positive,negative
h6cnt2y,It's like that ad... How many were in the race the kid smiles and tells 2 after his mother had prepared jamoon as he was placed second in running race......,34,1,1627121583.0,shakeLama,False,neutral,neutral,positive,neutral
h6cvn8t,STOP THE COUNT!,11,1,1627128249.0,Tight-Example-2826,False,negative,negative,negative,negative
h6clmem,THEY ARE COMMITTING MEDAL FRAUD!! STOP THE COUNT,40,1,1627119464.0,Meerkat_Initiate7120,False,negative,negative,negative,negative
h6cfbdv,"Sony is notorious for doing such things. Even during IPL, they show ads mid overs sometimes. r/cricket has a hate boner for sony",129,1,1627113480.0,rigorous_walrus,False,negative,negative,negative,negative
h6cc6os,Should’ve taken a screenshot,73,1,1627110668.0,deboo117,False,neutral,neutral,neutral,neutral
h6cppcy,Link?,2,1,1627123329.0,charsi-95,False,neutral,neutral,neutral,neutral
h6da4ab,India*,11,1,1627137138.0,Brave-Wave932,False,neutral,neutral,neutral,neutral
h6cbnl8,Featuring any actor outside the northeast of course!,211,1,1627110206.0,Aggressive_Patient57,False,neutral,neutral,neutral,neutral
h6cn7pv,"Yeah...it's sad that it takes an Olympic medal for us to recognise that we have a North-East.

Guys please watch Axone. It's on Netflix. The film shows the biases the people of North east face from the rest of India. AMAZING film.",48,1,1627121019.0,succubus_me,1627138246.0,negative,neutral,neutral,neutral
h6cbimc,[deleted],55,1,1627110086.0,,False,neutral,neutral,negative,neutral
h6cdh88,"Even though that's sadly true, but it's not only limited to Olympics, it's a requirement for recognition most times, winning the ultimate prize. Sadly the pioneers will be ones to struggle the most but hopefully the path for the future generations is easier (which seems to be the case in wrestling and shooting for example)",12,1,1627111815.0,doxypoxy,False,negative,neutral,positive,neutral
h6cl7zh,Bollywood is cancer,17,1,1627119079.0,Repulsive-Prior-398,False,negative,negative,negative,negative
h6cnc88,"Actually, most states support Athletes who participated in International events by giving them Govt jobs or in Atheletic training institutes.",6,1,1627121137.0,Untrue_Mercy,False,neutral,positive,neutral,neutral
h6cjtgc,Sad username,2,1,1627117718.0,ad_taway,False,negative,negative,negative,negative
h6dreg9,And they will earn more money as compared to her,2,1,1627145607.0,inferno_444,False,neutral,neutral,positive,neutral
h6cfff8,Yeah dude. You can’t make stories about people who don’t win. It doesn’t matter how hard you work. Results are what matter. We don’t go there for participation trophies,8,1,1627113584.0,Live_Ad_6361,False,negative,negative,negative,negative
h6cdaqz,And there is nothing wrong with that,-11,1,1627111651.0,LiberandusGoBack,False,neutral,neutral,positive,neutral
h6co6hv,Mirabai was in America for quite a while for training and injury prevention before the olympics. You can see her on Squat University youtube channel if you are interested in behind the scenes of her prep.,29,1,1627121936.0,DeadNoobsbhai,False,neutral,neutral,neutral,neutral
h6ck4om,"[she is an inspiration, really](https://www.reddit.com/r/india/comments/oqkqvo/chanu_saikhom_mirabai_wins_indias_first_medal_in/h6cashk/?utm_source=share&utm_medium=ios_app&utm_name=iossmf&context=3)",12,1,1627118022.0,deboo117,False,positive,positive,positive,positive
h6d3nho,"Just this week, [2 Northeastern girls outside a Delhi pub were molested and asked ""What's your rate?' ](https://youtu.be/gnmup6YcBvU)",11,1,1627133539.0,deboo117,False,negative,negative,negative,negative
h6cbvtl,All Sony Ten channels and Sony Six,30,1,1627110404.0,_ronty12_,False,neutral,neutral,neutral,neutral
h6cc31q,"I watched the whole event and they aired all of the rounds of everyone (not sure if it was six, ten1, ten2 or ten3 tho cuz they have so many channels). Also watched archery and badminton. Sad Indian archers always crack under pressure even when they are so talented",17,1,1627110580.0,KidnappingNemo,False,neutral,neutral,negative,neutral
h6ciwrx, I watched all her attempts and medal ceremony on Sony six,3,1,1627116841.0,BlackWhiteAndColour,False,neutral,neutral,neutral,neutral
h6dle4c,"Unfortunately my cable had been cut for months as no one in my house watched TV.

Are there any links for watching it online free on PC?",2,1,1627142710.0,nalinpuri,False,negative,negative,negative,negative
h6e3sim,Underrated comment. [here’s a related discussion](https://www.reddit.com/r/india/comments/oqkqvo/chanu_saikhom_mirabai_wins_indias_first_medal_in/h6cbnl8/?utm_source=share&utm_medium=ios_app&utm_name=iossmf&context=3),3,1,1627151644.0,deboo117,False,neutral,neutral,positive,neutral
h6duhjl,Nice !,3,1,1627147094.0,dannylenwinn,False,positive,positive,positive,positive
h6d9136,"The system/culture in our country doesn't give importance to sports at all except cricket. Also, the infrastructure is just not there . Most of the people don't give a crap about sports until the Olympics and then it's suddenly like uh oh who are the athletes, who will give a medal. There is no proper system in place and these athletes put a lot on the line while playing for India since a lot of them come from poor backgrounds. If they win a medal then they will be rewarded and become well known else they will be thrown and forgotten until the next Olympics.  Also India hardly has any Student athlete culture compared to countries like US, China , UK, Australia etc . In Stanford 12% of the undergrads are athletes so most of the people in such countries don't give up on sports because they have a advantage in University admissions whereas in india......I need not say more :(",12,1,1627136553.0,Brave-Wave932,False,negative,negative,negative,negative
h6ec0cu,Money. The investment by government is less.,2,1,1627155779.0,neutron770,False,neutral,negative,negative,negative
