Comment ID,Comment Text,Comment Score,Comment Depth,Created Timestamp,Author,Edited,Semantic Label,Semantic Label 2,Semantic Label 3,Major_Semantic
h6fmifk,"Sony had TV rights, Hotstar had OTT rights. Now, Star has TV rights and Hotstar has OTT",1,4,1627180847.0,deba_ji,False,neutral,neutral,neutral,neutral
h6cg4rz,"Okay, could've clicked a picture. But it didn't strike me at that time.",14,4,1627114225.0,ad_taway,False,neutral,neutral,neutral,neutral
h6cfy29,UP se ho?,38,4,1627114054.0,PM_ME_BIG_CHUNGI,False,neutral,neutral,neutral,neutral
h6cg8a4,"How can any North Easterner become an established actor if even their idols are portrayed by people that look ethnically nothing like them. 
Especially at a time when they experience even more [racial discrimination](https://www.thehindu.com/news/national/other-states/northeast-citizens-faced-racial-discrimination-amid-covid-19-outbreak-says-govt-study/article34303162.ece) amid the COVID-19 outbreak.",51,4,1627114316.0,kingkillerpursuivant,False,negative,negative,negative,negative
h6chy85,It's a sad thing that people look for specific actors rather than an inspiring story.,3,4,1627115924.0,,False,negative,negative,negative,negative
h6cjuv5,">People like you think that the Hindi belt is the only part of the country that matters and is worth talking about

Wow calm down.
Your bias is visible.

I don't support Priyanka working in Mary Kom, that's the producer's and director's decision who to cast.",-37,4,1627117756.0,LiberandusGoBack,False,negative,negative,negative,negative
h6cj3yt,[Priyanka Chopra playing the role of Mary Kom was just dumb](https://www.reddit.com/r/india/comments/oqkqvo/chanu_saikhom_mirabai_wins_indias_first_medal_in/h6cipbo/?utm_source=share&utm_medium=ios_app&utm_name=iossmf&context=3),19,4,1627117030.0,Aggressive_Patient57,False,negative,negative,negative,negative
h6gffny,"no one in the US watches swimming , they win gold everytime , just bcuz a sport isn't popular doese't mean we can't do it",1,4,1627202631.0,Whores-are-nice69,False,neutral,neutral,neutral,neutral
h6qfii8,[removed],2,4,1627409330.0,,False,neutral,neutral,negative,neutral
h6doka7,"says the one, who calls monkeyface kohli the goat for no valid reason.",1,4,1627144240.0,brooktherook,False,negative,negative,negative,negative
h6cj5u1,[my point exactly](https://www.reddit.com/r/india/comments/oqkqvo/chanu_saikhom_mirabai_wins_indias_first_medal_in/h6cipbo/?utm_source=share&utm_medium=ios_app&utm_name=iossmf&context=3),11,5,1627117080.0,Aggressive_Patient57,False,neutral,neutral,positive,neutral
h6chb7w,Why depend on bollywood to make everyone's movies?,-11,5,1627115326.0,12BottledBadass12,False,neutral,neutral,neutral,neutral
h6cjqob,"That's how cinema works.
Very rarely a film full of debutant works well financially",4,5,1627117642.0,LiberandusGoBack,False,neutral,neutral,negative,neutral
h6qye4b,Thanks for the  recommendations!,1,5,1627417623.0,deboo117,False,positive,positive,positive,positive
h6dooqa,"He has dominated cricket (specially white ball cricket) like no other in his era, I don't see why he shouldn't be regarded as a GOAT.",1,5,1627144300.0,Ornlu96,False,positive,positive,neutral,positive
h6dp2yv,if that is the logic then mediocre agassi would be called goat of tennis as he dominated for few years in an era when nothing was pursued professionally.,1,6,1627144488.0,brooktherook,False,neutral,neutral,negative,neutral
h6drdqd,"Ah yes, what a bad comparison. Most days as rank 1 in ODIs, only 2 people are above Kohli (Viv and Bevan). Most weeks as rank 1 in tennis singles 8 people are above Agassi.",1,7,1627145598.0,Ornlu96,False,negative,negative,neutral,negative
