Comment ID,Comment Text,Comment Score,Comment Depth,Created Timestamp,Author,Edited,Semantic Label,Semantic Label 2,Semantic Label 3,Major_Semantic
h6ec5qb,https://www.google.com/amp/s/www.sportskeeda.com/amp/sports/indian-government-spends-only-3-paise-per-day-on-sports-china-spends-over-200-times-more,2,1,1627155855.0,neutron770,False,neutral,neutral,negative,neutral
h6d5xp0,They don’t. Indian born Samir Bannerjee [won the Wimbledon Boys’ singles title](https://indianexpress.com/article/sports/tennis/samir-barnerjee-indian-origin-wins-wimbledon-boys-singles-title-7399630/) but he’s essentially an American since he grew up there no matter how much we want to pretend he’s Indian. The problem is that the nation just doesn’t invest at all in our human capital.,5,1,1627134862.0,deboo117,False,neutral,negative,negative,negative
h6fdxjc,"Yeah, one of the actually decent ministers in corrupted BJPee cabinet.",5,1,1627175965.0,,False,neutral,neutral,negative,neutral
h6cp4f9,How come? Sometime back here people saying different types of gaalis to him. 🤔🤔🤔,6,1,1627122802.0,charsi-95,False,neutral,neutral,neutral,neutral
h6ckgtl,China,11,1,1627118352.0,sunnywayne,False,neutral,neutral,neutral,neutral
h6cuf4y,Thanks for speaking. This part has contributed a lot in the field of [sports & athletics](https://thecsrjournal.in/northeast-india-is-most-deserving-of-sports-csr-funding/) for years. Sadly India don’t care about any sport other than cricket in regular days. And let’s not forget the unique blend of cultural diversity in the region: try listening to some [great music](https://open.spotify.com/playlist/21uBCM64wmKVrgJDNsyFL5?si=ELz9EN1CTDKCY5dc0OVmWA&dl_branch=1) from this side of the country,13,1,1627127312.0,deboo117,1627142408.0,positive,positive,positive,positive
h6e3u5o,[People are already excited](https://www.reddit.com/r/india/comments/oqkqvo/chanu_saikhom_mirabai_wins_indias_first_medal_in/h6cbnl8/?utm_source=share&utm_medium=ios_app&utm_name=iossmf&context=3),2,1,1627151667.0,deboo117,False,positive,positive,positive,positive
h6hg6yv,Update the app immediately,1,1,1627228440.0,fredrogers16,False,neutral,neutral,neutral,neutral
h6hzhdl,"Good for her. She actually broke her own previous record, so she was in a different league altogether.",1,1,1627237724.0,deboo117,False,positive,positive,neutral,positive
h6dia8m,"Understandable because you're not an Indian, she's from the state of Manipur which shares a border with Myanmar. India is a big place with many ethnicities.",14,1,1627141216.0,Ornlu96,False,neutral,neutral,neutral,neutral
h6djlnn,"India has a population of 1.3 Billion spanning over a huge geographical area. We are culturally, ethnically and linguistically diverse. The representation of Indians in Western media is pretty limited (and flawed) so I can see where you're coming from. As for Mirabhai Chanu, she hails from the north-eastern part of India.",11,1,1627141843.0,Touristforlife,1627187579.0,neutral,neutral,neutral,neutral
h6ftjxz,Bruh 💀,3,1,1627185235.0,brown_keanu_reeves,False,negative,neutral,positive,neutral
h6dgtx3,Do you know that interest in sports is subjective? Which sports do you follow and why do you need to insult Kohli? Do you know that Kohli is so good that he'll be (and already is) considered a GOAT limited overs batter?,3,1,1627140520.0,Ornlu96,False,neutral,neutral,positive,neutral
h6d5z6u,"Why so hate against Kohli, mate?",4,1,1627134885.0,hungrypussy29,False,negative,negative,negative,negative
h6dur4n,Why is my comment being downvoted ?,2,1,1627147222.0,Crazy_Revenue_832,False,negative,negative,neutral,negative
h6d1bal,[just like Miss World ](https://youtu.be/JyA_738BaVU),5,1,1627132102.0,deboo117,False,neutral,neutral,negative,neutral
h6cob74,There are all kinds of people from all places. But one cannot just form an opinion of an entire group of people like that. Next time educate your friend on the [contribution of northeast in the field of sports in India ](https://thecsrjournal.in/northeast-india-is-most-deserving-of-sports-csr-funding/). You can also listen to [great music](https://open.spotify.com/playlist/21uBCM64wmKVrgJDNsyFL5?si=ELz9EN1CTDKCY5dc0OVmWA&dl_branch=1) from this side of the country.,21,1,1627122056.0,deboo117,1627127410.0,neutral,positive,positive,positive
h6g0mkt,Maybe tell them that 2 out of the 6 medals won by women in olympics have been from haryana.,2,1,1627190109.0,0uuwuu0,False,neutral,neutral,neutral,neutral
h6dchir,"While a few outliers have such terrible fate, if the atheletes follow a decentish path, its not that hard for them to get a pretty good government job due to the sports quota.    
Adding the that, connections can lead to ad deals, ease of opening a training academy etc etc    especially for an Olympic medalist because they're so rare.    
But sure, one can easily mess up and end up starving",2,1,1627138370.0,,False,neutral,neutral,neutral,neutral
h6fe6to,"There is no criteria for 'looking' Indian, it's not an ethnic identity, but a nationality.",4,1,1627176106.0,,False,negative,neutral,neutral,neutral
h6g0wup,"Bhai chutia ki tarah comment karne ke bad, ""bring on the downvote"" likhne se cool nhi ban jaye ga tu.",2,1,1627190318.0,Existential_Fella,False,negative,neutral,negative,negative
h6d0p5e,"As a Punjabi, I politely request you to stay quiet. We won our first silver medal and let us properly celebrate it, without going into political differences and other issues. 

You definitely sound like someone, who doesn't live in North East or Punjab. So please, for the love of god, stay quiet.",25,1,1627131718.0,,False,neutral,neutral,positive,neutral
h6d1brb,Ignore this idiot. He probably still belives that he is of Arab descent.,19,1,1627132110.0,Confident_Weird3353,False,negative,negative,negative,negative
h6cwlkw,[deleted],6,1,1627128959.0,,False,neutral,neutral,negative,neutral
h6cvzud,[case in point](https://www.reddit.com/r/india/comments/oqkqvo/chanu_saikhom_mirabai_wins_indias_first_medal_in/h6cuf4y/?utm_source=share&utm_medium=ios_app&utm_name=iossmf&context=3),-8,1,1627128511.0,deboo117,False,neutral,neutral,positive,neutral
h6eytxp,"Pretty much everyone who knew about her before the Olympics knew that she would win silver and the Chinese lifter would win gold, the margins in her weight category were just that big.",6,1,1627167577.0,HarshBoy16,False,neutral,neutral,neutral,neutral
h6cpml9,C'mon don't be pessimistic everywhere,8,1,1627123257.0,,False,negative,neutral,negative,negative
h6cy7c9,Lol ur so mad,1,1,1627130081.0,eatingmytoe,False,negative,negative,negative,negative
h6sc8lb,Oooo so many medals oooo.,1,1,1627441426.0,pvdsan,False,positive,positive,positive,positive
h6cq2kj,"no Virat is only bested by smith in tests, in the other two formats Virat is way way better than steve",14,1,1627123656.0,ZeusX20,False,positive,positive,positive,positive
h6gp6o1,Sorry I meant **OUR** country,2,1,1627211838.0,Crimson_Excalibur,False,neutral,neutral,negative,neutral
h6d4ox2,She never disappoints us. I hope she inspires the huge indian youth population to participate in different sporting events so that India also ramp up gold medals easily and be at the top of the medal tally in the coming olympic games.,12,2,1627134147.0,rajatilu,False,positive,positive,positive,positive
h6do7ze,Amazing,2,2,1627144075.0,flyingjat,False,positive,positive,positive,positive
h6ce33b,1,265,2,1627112358.0,nilosinal,False,neutral,neutral,neutral,neutral
h6ctvi9,"Yeah, it's a joke from when Donald Trump said the same thing (but genuinely) when he was leading in votes and about to lose the lead",23,2,1627126876.0,-Another_Redditor-,False,negative,neutral,negative,negative
h6d6ir0,"If [wiki's list of team sizes](https://en.wikipedia.org/wiki/2020_Summer_Olympics#Participating_national_Olympic_committee_teams) is correct, I think the US will take the most this year, they brought a whopping 613 athletes while China ""only"" brought 420. Russia is banned from participating this Olympics but will bring 328 athletes under *Russian Olympic Committee*. Japan is actually a strong contender for top 3 with 552 athletes. I'm surprised a country as small as Australia was able to bring 478 athletes, but my guess is that this number is inflated by team sports such as full rugby teams.",29,2,1627135187.0,BertDeathStare,1627143679.0,neutral,neutral,positive,neutral
h6ejtf5,Is rifle shooting even a sport ?  Weightlifting requires athleticism but rifle shooting ?,-1,2,1627159751.0,Tutslal,False,neutral,neutral,neutral,neutral
h6cg95k,"Ohh, I see. But isn't IPL shown on hotstar? Anyways, Olympics alag baat hai",22,2,1627114340.0,ad_taway,False,neutral,neutral,neutral,neutral
h6dsv72,Wrong word! Wrong word! ☢️☢️☢️,1,2,1627146312.0,Lauladance,False,negative,negative,negative,negative
h6cc7nk,Was watching on TV,42,2,1627110692.0,ad_taway,False,neutral,neutral,neutral,neutral
h6ci9ol,"Not any actor, Priyanka Chopra will play her role and Akshay Kumar will be the main lead",121,2,1627116230.0,lost-puppy-,False,neutral,neutral,neutral,neutral
h6cc3ik,This,26,2,1627110592.0,,False,neutral,neutral,negative,neutral
h6cfxld,Name some actresses from northeast in bollywood for me please,-47,2,1627114042.0,LiberandusGoBack,False,neutral,neutral,neutral,neutral
h6d447u,[case in point](https://www.reddit.com/r/india/comments/oqkqvo/chanu_saikhom_mirabai_wins_indias_first_medal_in/h6cuf4y/?utm_source=share&utm_medium=ios_app&utm_name=iossmf&context=3),6,2,1627133813.0,Aggressive_Patient57,False,neutral,neutral,positive,neutral
h6cfd0u,She’s actually a good actress lol. Terrible person though,27,2,1627113522.0,Live_Ad_6361,False,negative,negative,neutral,negative
h6cdc34,She's brilliant actress so no problem,-30,2,1627111685.0,LiberandusGoBack,False,positive,positive,positive,positive
h6cl0ug,"but we can still support our atheletes via funds and infrastrcuture,  right ?",6,2,1627118889.0,Whores-are-nice69,False,neutral,neutral,neutral,neutral
h6cc1w9,Sony Liv,13,2,1627110553.0,,False,neutral,neutral,neutral,neutral
h6chmm9,"Indian archers craking under pressure has been pain from 2004 olympics right from times of Dola banerjje and Bomdalya devi, starts with hope ends with a tear.",13,2,1627115622.0,Ok-Zombie4481,False,negative,negative,negative,negative
h6ccb5a,[deleted],8,2,1627110777.0,,False,neutral,neutral,negative,neutral
h6e1lj7,You can watch on Jio TV for free ig. Also sony liv is the official streamer but it's paid,2,2,1627150559.0,crapbag_3,False,neutral,neutral,neutral,neutral
h6dfzoq,As far as I know wrestling and kabaddi are pretty popular in the north.,7,2,1627140105.0,Ornlu96,False,neutral,positive,positive,positive
h6df99n,"1. Increased the prize money for National Sports Award Winners.
2. Increased the sports Budget.
3. During Covid he provided a lot of supports to the Athletes. Even to no so famous athletes who want to travel and play outside the country, he supported them. 
4. He also supported the para athletes and also increase their prize money. We actually had good performance in World para-athletics championship. 
5. Fit India Movement
6. Khelo India program
7. Target Olympics Podium Scheme. Majority of athletes/teams associated to it actually qualified to the Olympics. 
8. Also he helped our great athletes like Anju Bobby George and Gagan Narang to set up sports academies.",21,2,1627139756.0,kartikeyas00,False,positive,positive,positive,positive
h6d4yo4,The food is amazing too. And so underrated.,10,2,1627134304.0,succubus_me,False,positive,positive,positive,positive
h6fthb7,"Great playlist! But it's missing Manipuri songs tho
Check out Life in Limbo, The Koi, Solace her if you want to hear some",3,2,1627185187.0,BumaReddit,False,positive,positive,positive,positive
h6dlzfq,"i've already highlighted the reasons to appreciate the success of Ms. Chanu. there can't be a better joke than calling kohli a goat. has he faced the best bowlers in the history of cricket? no. has he played more matches outside india? no. has he scored really well on bowling pitches? no. has he played bouncers/bodyline bowling without helmet? no. only a man who knows nothing about the sport can get carried away by pr campaign run by kohli and his chimps and call him goat etc. if monkeyface kohli earns crores then other sportpersons deserve the earning at same scale. but hell, crores of fools in this country enable kohli and chimps to earn more than they deserve as cricket is followed so widely in india.",0,2,1627143000.0,brooktherook,False,positive,neutral,positive,positive
h6do89g,"today kohli has become representative of cricket in india and the system that promotes cricket. kohli is the biggest beneficiary of this corrupt and unjust system. as a representative, he deserves hatred and nothing else. have you ever heard that champs like vishwanathan anand, pankaj advani, pullela gopichand, p t usha, mary kom, nisha millet, dhanraj pillay are celebrated in india? modi and sonia may attend wedding of some humpty dumpty cricketer. but do you remember that anyone of the two invited chess genius Anand for dinner or something? attended wedding of Saina Nehwal?  this is hypocrisy and partiality.

last but not least, indians are categorically lazy ass and thus love the game of lazyass.  we are assholes of such epic level that we might recognize some rookie in ipl, but we would express ignorance when we are asked to appreciate achievements of guys and girls playing some other sport.",2,2,1627144079.0,brooktherook,False,negative,negative,negative,negative
h6ft2dy,No need to bring politics into everything,5,2,1627184920.0,,False,neutral,negative,positive,neutral
h6cosjo,Ok 👍,3,2,1627122504.0,charsi-95,False,positive,neutral,neutral,neutral
h6dksy8,"It is more than a few ""outliers"".  I follow this somewhat closely, the manner in which the Indian central and state governments treat sportspersons is atrocious.

Sure, if you win gold, you will be somewhat comfortable.  But winning a medal is what is an ""outlier"".  Most do not, and this is not typical for India alone.

We need sustained government support for our athletes - including infrastructure - in order to develop sports in India.  

We are a total failure, have a look at the medals table.  And then look at China.

Getting downvoted by dumbass, incel Indians - I am getting good at that.  Fuck y'all too!",3,2,1627142428.0,bannedbutstillhere,False,negative,negative,negative,negative
h6g0aqq,"Lol, correct analysis",1,2,1627189867.0,deboo117,False,positive,positive,neutral,positive
h6cx0bo,"They aren’t even good at that lol 
I can’t name 1 mainstream one",-5,2,1627129252.0,NovelExplanation3299,False,negative,negative,negative,negative
h6g05ai,Ikr. Hou Zhihui gave a ridiculously dominant performance for the gold,2,2,1627189756.0,deboo117,False,positive,positive,neutral,positive
h6cghq7,The pain!,94,3,1627114562.0,MiBoy69,False,negative,negative,negative,negative
h6da8uw,I bet he was not the first one to say it.,-4,3,1627137205.0,__little_omega,False,neutral,neutral,positive,neutral
h6dbauk,"Just fyi, Russian athletes are competing in this Olympics, but not under the Russian flag",12,3,1627137756.0,YouKnowTheRules123,False,neutral,neutral,neutral,neutral
h6dl2dt,Russia is named as ROC and has 328 athletes,7,3,1627142553.0,EnlargedVeinyBalls,False,neutral,neutral,neutral,neutral
h6d9dja,"Australia’s an amazing sporting country, per capita the world’s best.",18,3,1627136737.0,AdonisPanda27,False,positive,positive,positive,positive
h6fp1j4,"We love sports in Australia. We always do really well in swimming and water related events. 

There's a strong culture of sports engagement here, we have the weather, money and freedom for it. 

Hell we try to even compete in the winter Olympics despite the lack of snow we have.",2,3,1627182382.0,SnakesTalwar,False,positive,positive,positive,positive
h6eci4x,"How is the team size decided ? ( yup I am a total noob)

Does it totally depends upon the country to take whatever athletes that can participate? or there are certain qualifiers and only those athletes which clear it can apply.",1,3,1627156029.0,UnicornWithTits,False,neutral,neutral,neutral,neutral
h6cgdha,Sony had ipl for a very long time. Now it's on hotstar. india australia series was on sony.,41,3,1627114452.0,rigorous_walrus,False,neutral,neutral,neutral,neutral
h6dreyu,Sony us the absolute fucking worst in cricket broadcast. They always cut to ads for no reason. Sadly even star are going that way now.,7,3,1627145614.0,glorious_albus,False,negative,negative,negative,negative
h6cf3cf,Thats what he said shot the screen,77,3,1627113270.0,Destructors,False,neutral,neutral,neutral,neutral
h6cmxh6,"No, this time Akshay will play the role and Akshay will also be playing the support.",37,3,1627120747.0,magneto_ms,1627121678.0,neutral,positive,positive,positive
h6civof,[My point exactly](https://www.reddit.com/r/india/comments/oqkqvo/chanu_saikhom_mirabai_wins_indias_first_medal_in/h6cipbo/?utm_source=share&utm_medium=ios_app&utm_name=iossmf&context=3),22,3,1627116811.0,Aggressive_Patient57,False,neutral,neutral,positive,neutral
h6cddhr,[removed],-41,3,1627111721.0,,False,neutral,neutral,negative,neutral
h6cipbo,"[Andrea Tariang](https://indianexpress.com/article/entertainment/bollywood/pink-cast-was-incomplete-without-northeast-indian-character-shoojit-sircar-3044315/) from Pink and [Adil Hussain](https://www.hindustantimes.com/bollywood/adil-hussain-elated-with-international-emmy-win-for-delhi-crime-it-didn-t-resort-to-unnecessary-violence-or-cuss-words-to-capture-attention/story-Pe43NtNYl9NJjwJMsrRaDK.html) come to mind as recent big names. A simple Google search will show you [several](https://www.eastmojo.com/others/2019/12/05/7-actors-from-northeast-india-who-made-it-big-in-bollywood/). There are so many other actors in the regional film industries who find it difficult to enter the Bollywood industry due to lack of opportunities and [various other reasons](https://newslivetv.com/how-dare-she-barsha-rani-bishaya-on-indecent-offer-from-fashion-curator/). And when there comes a role on a character based in the northeast, where else are you supposed to look for casting? How do you expect a little girl from Manipur to relate to [Priyanka Chopra](https://www.scoopwhoop.com/inothernews/bollywood-mary-kom-priyanka/) when she looks so different from a Manipuri?

People like you think that the Hindi belt is the only part of the country that matters and is worth talking about.",59,3,1627116642.0,Aggressive_Patient57,False,neutral,neutral,negative,neutral
h6e9jzu,"Let's assume for one sec that there are no NE Indian actresses in ""Bollywood"". There are tons of movies that get made in NE, many of which are critically acclaimed,  with NE artists. These movies are selected at international platforms, are multilingual. So name some reasons why a casting director cannot choose these artists please. 

I assumed this would be true, and it took me 30sec to google.",2,3,1627154526.0,ajaxxx4,False,neutral,neutral,neutral,neutral
h6d4lhy,"Just saw. So if North easterners will not bring glory to India, we will not acknowledge them. Bhai wah.

Reminds me of this film called Guess Who is Coming to Dinner...the father of a white woman accepted his daughter's Black lover finally after some drama. Film critics have pinpointed that he rose above the bigotry probably because the Black man was too successful. What if he was an average Joe? Would he have been ""accepted""?",6,3,1627134092.0,succubus_me,1627137380.0,negative,neutral,neutral,neutral
h6chfrd,[deleted],39,3,1627115445.0,,False,neutral,neutral,negative,neutral
h6cpk3j,"Lol nice joke. She's a fake ""actress"". No talent absolutely. Don't know what she does but that doesn't count as acting. Maybe time pass, yes.",-3,3,1627123196.0,charsi-95,False,negative,negative,neutral,negative
h6dflar,People need to follow the sport 1st.,6,3,1627139913.0,Ornlu96,False,neutral,neutral,neutral,neutral
h6e56ov,"Honestly I only see complete privatization being the only way out of this mess, BCCI has shown that it can be done.",2,3,1627152334.0,doxypoxy,False,positive,neutral,neutral,neutral
h6cjlph,True :(,5,3,1627117507.0,KidnappingNemo,False,negative,negative,neutral,negative
h6cchm3,Yes. Better stick to Sony Six imo and maybe switch to Sony Ten 2 if there are 2 indian events clashing,5,3,1627110936.0,ValuableHire,False,neutral,neutral,neutral,neutral
h6fx62l,"Yeah, i have an app to watch olympics but need a program or site to watch on my laptop.

Do you know any?",2,3,1627187650.0,nalinpuri,False,neutral,neutral,neutral,neutral
h6dg8iq,Awesome. I hope people here don't throw gallis at him just because he's from BJP.,12,3,1627140226.0,charsi-95,False,positive,positive,positive,positive
h6dp8fj,let's just hope this pays off and we win more medals than we ever have!,4,3,1627144561.0,NotADodgyCat,False,positive,positive,positive,positive
h6g4i01,Thanks! Feel free to [suggest me as many songs you like](https://np.reddit.com/r/manipur/comments/or5z80/hello_there_im_from_assam_and_ive_recently/?utm_source=share&utm_medium=web2x&context=3). I’m always interested in a variety of music,3,3,1627193095.0,deboo117,False,positive,positive,positive,positive
h6dmeb0,Racist,1,3,1627143199.0,Ornlu96,False,negative,negative,negative,negative
h6dmiv2,And it seems that you don't know much about cricket.,1,3,1627143262.0,Ornlu96,False,negative,negative,neutral,negative
h6dxhx4,"but why hate Kohli, mate? He is just a guy who plays good cricket. He didn't ask for the media attention.   
Aren't you supposed to be angry towards the people who give him excess attention and doesn't give others? Is Kohli supposed to stop his game to make people support other sport?",2,3,1627148554.0,hungrypussy29,False,neutral,neutral,negative,neutral
h6dpfql,"All sports atheletes, even state level, get pretty easy government job quotas given they meet minimum education requirements (pretty sure there are reservations in both schools and unis too).    



While the sports investment in infrastructure, advertising and facilities is low and definately needs to be improved in order to win more medals , I totally disagree with you about the treatment of atheletes after acheiving something.     
I've seen even lowly state level atheletes get opportunities easily via quota.    
If an athelete prefers to become a bouncer or a vegetable vendor instead of completing 10th grade and networking a bit, its their fault truely.      




Meanwhile anyone at Olympics level who has decent education is at high positions like DSP(see Hima Das, Yogeshwar datt, Saina Nehwal), govt department managers(Sakshi Malik, PT Usha, Karnam Malleswari), IAS/collector(Gagan Narang, PV Sindhu), high army rank(Vijay Kumar), top sports admins(Abhinav Bindra, RS Rathore), member of rajyasabha (Mary Kom)    


To add on top of that, most states have cash prizes in crores along with award prices AND some have decent deals with sports brands/training academies. Some popular ones have also received political party memberships altho that isn't exactly from the government.           






>Getting downvoted by dumbass, incel Indians


Given you're calling people incel for downvotes on a thread about nothing related to incels, I don't think there is much talking to ya, you'll probably forward some articles about atheletes that fucked up themselves.



Edit: Added a few more atheletes to tell how wrong are you and how most medalists in past 20 years except 1-2 have extremely high standard of living",1,3,1627144659.0,,1627147400.0,neutral,neutral,neutral,neutral
h6cx4s2,[deleted],2,3,1627129339.0,,False,neutral,neutral,negative,neutral
h6ch7ra,What were you expecting? Even 1st day hasn't  yet,86,4,1627115234.0,TheMamoru,False,neutral,neutral,neutral,neutral
h6dc43y,"Probably not, but whenever anyone says ""stop the count"", it's a reference to that, because he repeatedly kept tweeting ""STOP THE COUNT!!!!"" without any explanation",8,4,1627138176.0,-Another_Redditor-,False,negative,negative,negative,negative
h6dn6lk,"Ah, thanks for the heads up. Seems Russia won an appeal last year.",6,4,1627143579.0,BertDeathStare,False,positive,positive,positive,positive
h6dnbgh,Thanks for the correction enlarged veiny balls.,11,4,1627143642.0,BertDeathStare,False,positive,positive,positive,positive
h6fn0w3,Didn’t know Russia was a part of Taiwan.,3,4,1627181149.0,millicento,False,neutral,negative,neutral,neutral
h6dfjfh,"True but even so, their team size is still huge. The US is also an amazing sporting country but they also have over 10 times the people. For AU to bring over 2/3 the team of the US is pretty incredible. I guess we'll find out if team size automatically means more medals though.",8,4,1627139889.0,BertDeathStare,False,positive,positive,positive,positive
h6eisu9,"I'm no expert either but there's a limit to how many athletes each country can send to each event. There are Olympics qualifiers and some countries that have plenty of athletes also have their own (higher standard) qualifiers/selection on top of that.

Qualifying for team sports gets a bit more complicated but teams with the [most points](https://en.wikipedia.org/wiki/2019_FIBA_Basketball_World_Cup#Final_standings) in tournaments [qualify](https://en.wikipedia.org/wiki/2020_FIBA_Men%27s_Olympic_Qualifying_Tournaments) for the Olympics. However, you can still qualify even if you didn't score enough points because there's a minimum of 1 team per continent. The US didn't make top 4 (automatic qualification), but they still qualified because they're the number 1 team in North America.

Oh and now I understand why Japan's team is so large; they qualified automatically because they're the host nation. So maybe it's not as strong of a contender for top 3 as I thought.",1,4,1627159228.0,BertDeathStare,False,neutral,neutral,neutral,neutral
h6cgkls,"Ahh, okay",3,4,1627114636.0,ad_taway,False,positive,positive,neutral,positive
