Comment ID,Comment Text,Comment Score,Comment Depth,Created Timestamp,Author,Edited,Semantic Label,Semantic Label 2,Semantic Label 3,Major_Semantic
g5obyj7,"If you've ever done lower level programming like C++, or Assembly, stay the hell away from Indian tutorials lol. They'll teach you incredibly old stuff that is no longer used, or just straight out bad practices. 

Sometimes it's better to just pay for classes from a reputable online professor.",1,0,1600406827.0,asd21123,False,negative,negative,negative,negative
g5o6m6x,"As an Indian, I feel humbled we help people far and wide.",1,0,1600402879.0,itsyashinhere,False,positive,positive,positive,positive
g5o6nvw,Thanks mate,1,0,1600402912.0,alphasierraunit13,False,positive,positive,positive,positive
g5o6oyi,"Thanks for your appreciation, but do you know that most of the youtubers are engineering graduates.",1,0,1600402932.0,,False,positive,positive,positive,positive
g5o6uu6,"That's really nice to hear, thank you so much!!",1,0,1600403043.0,_Dark_Crusader_,False,positive,positive,positive,positive
g5o7a8c,Yeah we like to keep our English simple,1,0,1600403346.0,,False,neutral,positive,positive,positive
g5o7cjr,You are welcome sir 🙏,1,0,1600403391.0,sirczechs,False,positive,positive,positive,positive
g5oa1ne,Anyone have this picture without texts?,1,0,1600405358.0,Mitchdotcom,False,neutral,neutral,neutral,neutral
g5oc8zr,"As an Indian , I Approve of that . People here ARE very helpful . Anything you need , you'll find it on youtube",1,0,1600407058.0,YouGottaGoHomeboy,False,positive,positive,positive,positive
g5ocega,Ofcourse Indian YouTube's  are beyond categories 🤣🤣,1,0,1600407177.0,,False,neutral,neutral,neutral,neutral
g5ofc50,"You won’t believe
My biotechnology degree exams I owe to youtube vids too.",1,0,1600409616.0,Meit_,False,neutral,neutral,neutral,neutral
g5ojoo1,"Oh please, don't give us all the credit .Free internet and rising unemployment did it.I'd much rather make videos than sell pakoras.",1,0,1600413640.0,voldemort_queen,False,negative,negative,negative,negative
g5okdhf,Feeling proud,1,0,1600414348.0,rahulRdd,False,positive,positive,positive,positive
g5okzoe,"If you ignore the morose tone or the dull like-share-subscribe pleas, you got yourself a winner.",1,0,1600415002.0,domraja5,False,neutral,positive,neutral,neutral
g5ody3j,There is literally a tutorial on how to wash your nickers by an Indian kid.,0,0,1600408444.0,WifParanoid,False,neutral,neutral,neutral,neutral
g5o7aqw,I know y'all being sarcastic...,-1,0,1600403356.0,vengat_aswin,False,neutral,neutral,negative,neutral
g5ol1d1,"You are right, but just make sure you don't use Indian youtubers for learning how to drive on the road or any civic sense related stuff. It doesn't exist in that area of the world.",-1,0,1600415051.0,infraninja,False,negative,negative,neutral,negative
g5o6hfz,[deleted],-4,0,1600402788.0,,False,neutral,neutral,negative,neutral
g5o718m,"On behalf of the Indian fraternity, I graciously accept your compliment and as a counterblast bow down before the exquisite Brazillian women|",-7,0,1600403168.0,alkish,False,positive,positive,positive,positive
g5o83ku,Someone needs to make a tutorial on how to send bolsonaro trump to outer space,0,0,1600403924.0,exmuslimcalcutta,False,neutral,negative,neutral,neutral
g5op3s3,"Lol I saw the top of the image and before scrolling down, I thought you were referring to our covid cases leaving yours behind 😂😂",0,0,1600419625.0,SolitaireKid,False,neutral,neutral,neutral,neutral
g5ovnmj,Unfortunately the accent often makes it impossible for me to understand them,0,0,1600426975.0,AnimeMeansArt,False,negative,negative,neutral,negative
g5o6qt8,[deleted],-2,0,1600402967.0,,False,neutral,neutral,negative,neutral
g5o98lc,I see. Society exists on tutorials of how to bhabhi patao,-3,0,1600404753.0,pramit123,False,neutral,neutral,neutral,neutral
g5o6piz,[removed],-9,0,1600402943.0,,False,neutral,neutral,negative,neutral
g5oe1lv,I guess there isn't a toutorial on how to remake PoP,-2,0,1600408526.0,toyhb,False,neutral,negative,neutral,neutral
g5o601p,on\* get your grammar right fam,-14,0,1600402455.0,,False,negative,neutral,positive,neutral
g5o8oev,As an Indian just want to say that I admire some of these brazilian ladies,-12,0,1600404344.0,humbleflam3,False,positive,positive,positive,positive
g5o2sr7,[removed],-49,0,1600400398.0,,1600404223.0,neutral,neutral,negative,neutral
g5o5kxs,"No one:

North Indians Youtubers: Hloo frnds tudey.... Snd Bobs and Vagene please",-31,0,1600402166.0,Narayan_22,1600403988.0,neutral,neutral,neutral,neutral
glmwfc6,Hard work,1,0,1612206729.0,Faisal520,False,neutral,positive,negative,neutral
g5o3wip,Lemme see a tutorial of greeting a stranger nicely and return.,385,1,1600401069.0,elric10,1600414789.0,neutral,neutral,positive,neutral
g5oevx9,WTF. I lived in India and watched a lot of YouTube videos from professors from the US for engineering courses. Haha!,24,1,1600409231.0,FettuciniGoldsmith,False,neutral,neutral,neutral,neutral
g5o79r0,"Thats coz we, Indians, are forced to go into either engineering or medical by our parents. And hence, there are a lot of unemployed engineers who start making YT vids. As an Indian, who is currently being forced to study engineering too, I kinda feel their pain.

Edit: Not only unemployed ppl do that, sometimes genuine good teachers also make vid for some extra cash.",110,1,1600403337.0,_blurr_99,1600404099.0,negative,negative,negative,negative
g5o9ocn,u should also see our engineering exam question paper sometime.,12,1,1600405079.0,,False,neutral,neutral,neutral,neutral
g5o9t21,Great. There is also [https://www.khanacademy.org/](https://www.khanacademy.org/),11,1,1600405178.0,FeralTitan,False,positive,positive,positive,positive
g5o7cer,"yeah, we like to push things to the Limits.",7,1,1600403388.0,amrit-9037,False,neutral,neutral,positive,neutral
g5o98h3,That's cuz we learn trigonometry and calculus .....10th and 12th respectively .,6,1,1600404750.0,Bongnazi,False,neutral,neutral,neutral,neutral
g5o6swg,The hindi videos are better. I'm a computer scientist and I'm usually reading from stackoverflow while listening to youtube.,5,1,1600403006.0,AnonyUwuswame,False,positive,positive,neutral,positive
g7vj18k,I've cleared most of my subjects because of those tutorials only,2,1,1601969591.0,tintinwhiskey,False,positive,positive,neutral,positive
g5ojqu7,You're welcome,1,1,1600413703.0,,False,positive,positive,positive,positive
g5oopyf,It's cuz every parent wants their child to be an engineer in India,1,1,1600419174.0,TommyVercitti69,False,neutral,neutral,neutral,neutral
g5qmfw1,I live in India and have watched a lot of Californians for movies/TV shows/porn. Thanks!,1,1,1600460822.0,,False,neutral,positive,positive,positive
g5otq1i,"Lmao that's kinda right, also because relationships work a little differently in India.",55,1,1600424948.0,tourist_fake,False,neutral,neutral,positive,neutral
g5np7pb,"I actually don't have any particular channel. It's more like having a doubt about some problem in my enginner major here in Brazil and ALWAYS is some indian dude who knows how to solve the problem.

And normally the guy explains so well that even I, who barely speaks English, can understand. I don't know what to say unless that I became a huge fan of your country hahaha

Edit: I answered the wrong comment. My bad!",419,1,1600392852.0,,1600396853.0,neutral,neutral,negative,neutral
g5owwfu,"It got to a point towards my senior year I'd pick tutorials from Indian YouTubers solely because they'd not only explain it better, they'd demonstrate it too.",1,1,1600428164.0,,False,positive,positive,neutral,positive
g5o6zvd,AHAHAHAH YES,46,1,1600403142.0,God_UnknownWorld,False,positive,positive,positive,positive
g5poit0,Legends say even Bill Gates used to consult Indian Youtubers,6,1,1600444667.0,ThatRandomGamerYT,False,neutral,positive,neutral,neutral
g5o6fw5,"Yeah, sometimes the teachers aren't good enough but these Indian YT teachers help a lot.",98,1,1600402758.0,Cowerful,False,positive,positive,neutral,positive
g5opnsz,You speak words of wisdom sir,21,1,1600420286.0,trashfacedfuck,False,positive,positive,positive,positive
g5pdk53,Helga Hufflepuff *aunty*!,4,1,1600439191.0,or9ob,False,neutral,positive,neutral,neutral
g76tusp,[deleted],2,1,1601484802.0,,False,neutral,neutral,negative,neutral
g5owcjc,"They should have a donate link for such cases. If anything worked for me, I would gladly pay a % of what it would have cost me to get it serviced.",25,1,1600427655.0,WhatsTheBigDeal,False,neutral,positive,positive,positive
g5oah5e,Neso academy saved my life countless number of times. Lol. Quality content.,70,1,1600405683.0,saprotropy,False,positive,positive,positive,positive
g5p580d,"""Learn engineering""",2,1,1600434405.0,perrygadu,False,neutral,neutral,neutral,neutral
g8ozbqs,"Physics galaxy, khan academy",1,1,1602598258.0,thrA363738,False,neutral,neutral,neutral,neutral
gegyvxh,"Piximperfect

Unmesh Dinda is a Photoshop legend!",1,1,1606986488.0,,False,positive,positive,positive,positive
g5of6nt,You just need to open the windows.,17,1,1600409483.0,Cascudo,False,neutral,neutral,neutral,neutral
g5o1va3,I am sad to say I have not eaten brazillian food,97,1,1600399830.0,datboi-reddit,False,negative,negative,negative,negative
g5o5xl2,As an Indian I have to say Brazil song is amazing.,42,1,1600402408.0,o7mkar,False,positive,positive,positive,positive
g5o70k5,As an Indian I want to say neymar and Brazilian football team is my favourite,20,1,1600403155.0,INFIGHT,False,positive,positive,positive,positive
g5o8o1n,not being rude but what food are you talking about afaik they have only one dish fezoada which is readily available,2,1,1600404336.0,moooooovit,False,neutral,neutral,neutral,neutral
g5osth6,[removed],2,1,1600423915.0,,False,neutral,neutral,negative,neutral
g5oz501,I would like to say Wagner Moura is fantastic,1,1,1600430063.0,de4th_metalist,False,positive,positive,positive,positive
g5p4bbx,Have never listened to Brazilian music tbh,1,1,1600433811.0,_ecthelion_95,False,neutral,negative,neutral,neutral
g5o2v1b,"Well, I just know about brazilian babe.",-49,1,1600400437.0,fucazy,False,neutral,neutral,neutral,neutral
g5o2rtr,Unless it's politics,358,1,1600400383.0,tourist_fake,False,neutral,neutral,neutral,neutral
g5o4uh2,Correction: We have a 'jugaad' for everything,52,1,1600401683.0,vpsj,False,neutral,neutral,neutral,neutral
g5oralx,No. You don't,1,1,1600422189.0,qroshan,False,neutral,neutral,negative,neutral
g5o5hlu,"Well if they start allowing, imagine the chaos... There should be dedicated sister channel for YouTube recommendation...",48,1,1600402105.0,AatmanirbharBerojgar,1600406456.0,negative,neutral,neutral,neutral
g5o7yvf,"They do
But like don't allow self promotion like if u say that 
Bhaiyo sub to my channel and all
Sadly you can post one link only once",4,1,1600403832.0,randomuser420_69,False,negative,negative,negative,negative
g5ohgzm,"Only if share links from one/few specific channel(s) without participating in the community or posting other sources (which makes the person a spammer). Its not restricted to YouTube but is applicable to any blog or website. This is a reddit rule:

> ""*It's perfectly fine to be a redditor with a website, it's not okay to be a website with a reddit account.*"" 

> Self-promotion is generally frowned upon, but if you want to have a presence on reddit you should fully read reddiquette and the FAQs so that you understand the culture and social norms. If you run a website, publication, blog, app, or other project and would like to participate on reddit, you'll need to first make sure that you're following all of the guidelines in the FAQ on spam.

> These guidelines are the same whether you run a major publication or brand or if you have a personal blog or project.

> https://www.reddit.com/wiki/selfpromotion

If you are a participant and occasionally share your content, there is no problem. If reddit did not have this rule, you'd have all YouTubers flocking here to post their videos.",3,1,1600411517.0,kash_if,1600411740.0,neutral,neutral,neutral,neutral
g5oo8wx,"There is a joke here in nepal, if u throw a rock in the sky, 90% chance it will land on an engineer or a nurse hahaha and yes...m also engineering student T_T",11,1,1600418628.0,tiktaktoe999,False,neutral,neutral,neutral,neutral
g5o6k6w,Hahaha there comes those unemployed who can't even do YouTube (insert cry for help),18,1,1600402841.0,Nowa_moee,False,negative,negative,negative,negative
g5o63gx,"As a fellow indian, I am glad and approve this too 😁",20,1,1600402520.0,hakuna22matata,False,positive,positive,positive,positive
g5o9f68,[deleted],37,1,1600404888.0,,False,neutral,neutral,negative,neutral
g5pb7p2,"Seriously bro?

We also have a lot of uneducated people much more than these countries.",1,1,1600437911.0,livefreeofdie,False,negative,negative,negative,negative
g5oahmi,"What the hell, that was informative and fun.",6,1,1600405694.0,ashbat1994,False,positive,positive,positive,positive
g5o2vvm,:D,5,1,1600400451.0,inboxhrishi,False,positive,positive,neutral,positive
g5oacb2,This is really nice.,4,1,1600405580.0,Potato_palya,False,positive,positive,positive,positive
g5oxpkl,Very informative and that guy is hilarious.,3,1,1600428867.0,AiyyoIyer,False,positive,positive,positive,positive
g5pc0w7,And I saw a cornetto ad just before this video started. I have seen his video on the lepulekh issue those were really informative,2,1,1600438356.0,Same-Cartographer488,False,positive,positive,positive,positive
g5qe56u,I want all the tutorials to be made by this guy .,1,1,1600456891.0,shiviam,False,neutral,neutral,neutral,neutral
g5sm06i,proof?,1,1,1600500987.0,junk_mail_haver,False,neutral,neutral,positive,neutral
g5pkdmi,Okay daddy,3,1,1600442679.0,alannair,False,positive,neutral,neutral,neutral
g5ok452,"Let me guess, from Gujarat?",2,1,1600414077.0,valence_electron_,False,neutral,neutral,neutral,neutral
g68ka3v,Haha thanks dude,1,1,1600798436.0,,False,positive,positive,positive,positive
g6pyhen,"About 12, but I'm not sure about this information haha",1,1,1601151795.0,,False,neutral,neutral,neutral,neutral
g5oa0je,[removed],3,1,1600405335.0,,False,neutral,neutral,negative,neutral
g5oob74,[https://imgflip.com/memegenerator/32257608/Atlas](https://imgflip.com/memegenerator/32257608/Atlas),1,1,1600418700.0,Ricksanchiz,False,neutral,neutral,neutral,neutral
g5q0svw,"I dont know about that. India holds some pretty good records in cricket.

But Australian cricket team is lit tho.

\- Guy who loves cricket",1,1,1600450141.0,Riozz707,False,positive,positive,positive,positive
g5oh1ae,[https://imgflip.com/memegenerator/32257608/Atlas](https://imgflip.com/memegenerator/32257608/Atlas),1,1,1600411111.0,CGIskies,False,neutral,neutral,neutral,neutral
g5oes8z,No one asked? He can tell the difference himself.,3,1,1600409149.0,,False,neutral,neutral,neutral,neutral
g5oa9z0,[removed],-2,1,1600405531.0,,False,neutral,neutral,negative,neutral
g5o3yo7,"Bro you're so funny, you used the same old ""joke"" for the 129383838th time, you're a comedic genius",23,1,1600401107.0,Fury_122333,False,positive,positive,positive,positive
g5o6xz7,Downvotes are because the joke is old and shit. No one is getting offended lol,6,1,1600403105.0,VaginalMatrix,False,negative,negative,neutral,negative
g5o6q7m,Are you one of those Dravidian Supremacists?,16,1,1600402956.0,,False,neutral,neutral,negative,neutral
g5o6tn0,Hloo frnd send your boob and vagina,-16,1,1600403021.0,fuzzyflaptrash,False,neutral,neutral,negative,neutral
g5o6lk3,"You gotta put both of your hands together flat like you're praying, then bring your head closer down to your hands. And now say ""Dhanyawad"" (Dhan-ya-vadh) Or even simpler ""Shukriyah"" (Shook + Ri + Yeah) 

P.S : Yes I'm Indian",312,2,1600402867.0,suyashve,False,neutral,neutral,neutral,neutral
g5o7nlq,Namaste!,5,2,1600403606.0,whitewolf_01,False,neutral,positive,neutral,neutral
g5oaofa,[removed],6,2,1600405836.0,,False,neutral,neutral,negative,neutral
g5ohbmh,"Sure! Come back in year 600.
 I've left some visual greetings here all over in INDIA.",0,2,1600411377.0,VikasDeChoko,False,positive,positive,positive,positive
g5okm3w,"Ay as long as Indian kids ain't shooting up schools, I'm fine with bad manners.

There's levels to this thing you know.",0,2,1600414602.0,zaftonn,False,negative,negative,neutral,negative
g5oc8il,"Every Indian parent - ""First you finish with engineering, then you can decide what to do with your life.""",38,2,1600407048.0,mymyreally,False,neutral,neutral,neutral,neutral
g5o8sc7,"Yup im pakistani only child, engineering or medicine for me",29,2,1600404423.0,Alienmade,False,neutral,neutral,positive,neutral
g5o8wgp,if u don't understand this i will give u  an example i am a 14 year old (i turned 14 lastt week) who is being forced to study the books that are hard to understand even if its read by a 17 year old,16,2,1600404507.0,M1a2yank,False,negative,negative,neutral,negative
g5okuhy,Our mentality is absolute garbage. People who don't want to be an engineer are forced to do engineering and those who really want to be one have to fight the terrible competition. It's so difficult to really get the profession you want.,7,2,1600414846.0,840ak,False,negative,negative,negative,negative
g5o7uc3,Cheers to that mate ;(,3,2,1600403740.0,Artistic_Living_3665,False,negative,negative,positive,negative
g5o8ajv,What would you rather study? Just curious.,1,2,1600404064.0,digiden,False,neutral,neutral,neutral,neutral
g5p1did,"Don't generalize everything into engineering. There are bunch of Indians doing amazing stuff in youtube from chess (chessbase india), (neuroscience (siddharth warrier), music production, writing, food, cooking.. in almost every category you can think of.",1,2,1600431767.0,tumseNaHoPayega,False,positive,positive,positive,positive
g5pc9k9,"Boy, am I glad my parents didn’t force either on me. Though I’m positive mom is still pissed at the fact I decided to opt for Commerce with Math rather than take PCBM like she wanted me to. And I completed my 12th last April. It’s been over an year woman, move on! Why do I know she is still upset? Her words after my results : “you could have scored more if you took medicine.” I got 97%....",0,2,1600438491.0,,False,negative,neutral,neutral,neutral
g5og536,Jee.   I messed it up.  :-(,4,2,1600410322.0,iamthequietkidd,False,negative,negative,neutral,negative
g5p17sn,And hence doing nothing productive in the end.,3,2,1600431650.0,obsoletelearner,False,negative,negative,negative,negative
g5oufq8,I know I know... I'm from around here,15,2,1600425723.0,VivDso69,False,neutral,neutral,neutral,neutral
g5o34gx,"It's awesome and hilarious that you use the word ""doubt"" like Indians do. Rock on!",127,2,1600400596.0,Jibaku,False,positive,positive,positive,positive
g5o5sfi,"YouTube tutorial, ""How to answer in the right comment"" in coming! /s",22,2,1600402309.0,katanabunny,False,neutral,neutral,neutral,neutral
g5ouwqe,"There's a reason India is having a very successful rocket launches developed exclusively inside it's own country. 

If you think about it, even USA had to recruit the best engineers and scientists from Europe to be able to successfully launch missiles to space.",3,2,1600426215.0,poopcasso,False,positive,positive,positive,positive
g5obfhp,They even help us indians bro,36,2,1600406416.0,Algok2001,False,neutral,neutral,neutral,neutral
g5ockw4,The secret behind my 4+ gpa,15,2,1600407320.0,devil1298,False,neutral,neutral,neutral,neutral
g5oxknd,The secret behind me getting through 12th grade lol,1,2,1600428750.0,mekhhhzz,False,positive,neutral,neutral,neutral
g5pdpms,hi Salazar Slytherin uncle,3,2,1600439274.0,No_Management5486,False,neutral,neutral,neutral,neutral
g7a8lb5,"You heard both correctly, yes",2,2,1601559591.0,morelike_amazin,False,positive,positive,neutral,positive
g5osqbp,Neso academy saved my 4th sem of B.tech entirely.,19,2,1600423815.0,geralt_of_india,False,positive,positive,negative,positive
g5ojjlc,bruh fr that channel saved my Electrical Science course in College,11,2,1600413495.0,hiroshiSama,False,positive,positive,negative,positive
g5ozqt3,Neso helped in logic design so much,7,2,1600430540.0,stfuandkissmyturtle,False,positive,positive,positive,positive
g5q69m4,Let me search how to open windows on Youtube,1,2,1600452827.0,,False,neutral,neutral,neutral,neutral
g5ocy9p,"As an american who has had both, cooked by the people from said country, I have to say you two need to get together and holyshit I love food.",19,2,1600407623.0,DarkwingDuckHunt,False,positive,positive,positive,positive
g5o2e93,It's rad! You should definitely try it out.,35,2,1600400151.0,VoldyPoldy,False,positive,positive,neutral,positive
g5p42ew,You have to try it out. But there's loads of Brazilian steakhouses that are not authentic you have to steer clear of those.,1,2,1600433649.0,_ecthelion_95,False,negative,negative,neutral,negative
g5o7j3c,"Yea lol. ""Brazil"" song was literally famous in India during like 2000-08, idk properly.",29,2,1600403519.0,Ashes2980,False,neutral,neutral,positive,neutral
g5oav2o,[Brazil la la la la la](https://www.youtube.com/watch?v=VbXNmIvWa1c),11,2,1600405978.0,abtam11,False,neutral,neutral,neutral,neutral
g5q3xca,"this is my favorite Brazilian song.
https://youtu.be/dc0Z02wqHPc

btw, I have only one Brazilian song on the list. looking for recommendations...",2,2,1600451644.0,sagarhe101,False,positive,positive,positive,positive
g5ob0xt,"Listen to bossa nova. Here’s an example. [Bossa Nova](https://youtu.be/FB1Ma4-fLhI).

You will not regret it.",1,2,1600406103.0,VoldyPoldy,False,positive,positive,positive,positive
g5ogd6x,Yeah. They lost 7-1 to germany.   :-),0,2,1600410518.0,iamthequietkidd,False,neutral,neutral,neutral,neutral
g5o9aww,"Pan de Queso is lit (cheese bread), and plantains too
If you're not vegetarian, then my God the steaks are amazing",6,2,1600404801.0,dep9651,False,positive,positive,positive,positive
g5o9jsc,"Mate, check out Brazilian steakhouses near you. Shit is delish.",3,2,1600404984.0,Mumbaibrat,False,positive,positive,negative,positive
g5of07f,"Feijoada is the most popular brazilian stew, but there are others like moqueca (made with fish). Also, Brazil being huge there is a lot of variety, in the north (Amazon) , fish is the king, in the south barbecue rules (churrasco). Between that, every thing goes, like coxinha, pão de queijo, bolovo...",1,2,1600409330.0,Cascudo,False,positive,neutral,neutral,neutral
g5oh4oi,Tbh feijoada is a very widely consumed dish here in Goa especially among the Catholics,1,2,1600411198.0,CoroIsMyDaddy,False,neutral,neutral,neutral,neutral
g5p1xmk,lol this guy is calling indians as termites on other sub,1,2,1600432171.0,moooooovit,False,negative,negative,negative,negative
g5p4gfm,It's the meat mostly the rice they cook the Feijoada is still my favorite tbh.,1,2,1600433901.0,_ecthelion_95,False,positive,positive,positive,positive
g5p4ddd,The BBQ meat and the rice they cook is the best.,1,2,1600433847.0,_ecthelion_95,False,positive,positive,positive,positive
g5o3a6q,[deleted],48,2,1600400691.0,,False,neutral,neutral,negative,neutral
g5o6116,"If this same thing was posted by someone who isn't an Indian, would have gotten upvotes.

I will ride the down vote train now, thank you.",4,2,1600402474.0,katanabunny,False,negative,neutral,positive,neutral
g5o79k0,Go to Horny Jail,2,2,1600403333.0,STARLORD_1401,False,negative,negative,negative,negative
g5o528o,I want to but  I can't give you an award. Take this instead 🏅,71,2,1600401821.0,dmishra333,False,negative,neutral,negative,negative
g5o6f0j,Take mine too🏅,23,2,1600402741.0,,False,neutral,neutral,neutral,neutral
g5o88f8,mine as well 🏅,15,2,1600404021.0,shobhit2002,False,positive,neutral,neutral,neutral
g5o6wuz,Take the gold medal. 🏅,14,2,1600403083.0,kratos_2909,False,positive,positive,positive,positive
g5o3g9f,Here's your gold🏅,19,2,1600400792.0,abhi1002,False,positive,neutral,neutral,neutral
g5pd0l7,Take mine too 🍆,6,2,1600438900.0,Y-Bakshi,False,neutral,neutral,neutral,neutral
g5pu61z,[deleted],2,2,1600447141.0,,1625097040.0,neutral,neutral,negative,neutral
g5o6nap,Just Not only of government and media 🤣,12,2,1600402900.0,shlokd99,False,neutral,neutral,neutral,neutral
g5o6e0o,Was waiting for this comment 😂,10,2,1600402724.0,,False,neutral,neutral,neutral,neutral
g5ock0z,Best suggestion so far,2,2,1600407302.0,csoldier777,False,positive,positive,positive,positive
g5occ2u,"Well, i tried once but without saying sub to channel. The deal is, you can post a vid after posting 10 comments here and there..",1,2,1600407125.0,csoldier777,False,neutral,neutral,neutral,neutral
g5oyy7e,As an Indian I think an Indian needs to make a video to prove this theory,3,2,1600429910.0,pasttimer234,False,neutral,neutral,neutral,neutral
g5pbhx7,"The ""kota ki kahavat"" (a saying which is popular in kota, a district in India) 😂",2,2,1600438068.0,Same-Cartographer488,False,neutral,neutral,neutral,neutral
g7rtz47,"My social studies teacher said the same thing before our 10th boards.
Yeah my class loved arguing about the flaws of India while she tried to defend it.
One time, it was the chapter where you learn about myths flaws, and that teacher went on such a rant, she scared the living daylights out of our 25 student class.
We stopped arguing as hard that day.",1,2,1601892856.0,childofthemultiverse,False,negative,neutral,negative,negative
g5o8j55,"We are in for real trouble now, aren't we?",7,2,1600404236.0,sumanthkulkarni,False,negative,negative,negative,negative
g5o80dr,"As an indian,
Hi",5,2,1600403862.0,randomuser420_69,False,neutral,neutral,neutral,neutral
g5o9gkw,"As a fellow indian , I will make a YouTube on how you are glad and approved this 😂",3,2,1600404917.0,Sundaram_Srivastava,False,positive,neutral,positive,positive
