Comment ID,Comment Text,Comment Score,Comment Depth,Created Timestamp,Author,Edited,Semantic Label,Semantic Label 2,Semantic Label 3,Major_Semantic
g5oa0y0,"If an overseas company wants starting-level engineers at an affordable salary package, we got them by the truckloads.",22,2,1600405344.0,MihirX27,False,neutral,positive,positive,positive
g5oe0mz,"True. Entirely true.

It’s kinda cringe, if you ask me.",8,2,1600408503.0,Y-Bakshi,False,negative,negative,negative,negative
g5so6il,check reply on my profile as nice to his comment,2,2,1600503221.0,moooooovit,False,positive,positive,positive,positive
g6orb0s,"He wrote in Portuguese, but the translation according to Google Translate is:

""Hahaha just today I made a post on r / india just to thank those termites that have saved me so much in engineering college. If there's a country that deserves to be a superpower, it's them. """,1,2,1601131320.0,SpectaSilver991,False,positive,positive,positive,positive
g5ok8kf,Bingo,2,2,1600414202.0,Jay4vaghela,False,neutral,positive,neutral,neutral
g636xu9,And 21 views,1,2,1600686479.0,peeing_yash,False,neutral,neutral,neutral,neutral
g5ooogq,Thanks mate!!,1,2,1600419124.0,kyool_,False,positive,positive,positive,positive
g5r01dw,I'm just busting their balls.,1,2,1600466948.0,HereLiesDickBoy,False,negative,neutral,negative,negative
g5oj4qi,Thanks!,2,2,1600413091.0,Mitchdotcom,False,positive,positive,positive,positive
g5oaihg,Bhai maine nai padha aapka comment,0,2,1600405711.0,humbleflam3,False,neutral,neutral,negative,neutral
g5oa7vr,Better than being an Aryan supermacist.,-9,2,1600405487.0,supermatt234,False,negative,neutral,neutral,neutral
g5o8ec5,Damn ur the pickup line guy. Thanks a bunch those have been really helpful lol,80,3,1600404140.0,ravoili_ravioli,False,positive,positive,positive,positive
g5obgqh,Instructions unclear. Post video tutorial please.,20,3,1600406443.0,,False,negative,neutral,neutral,neutral
g5o8for,"In Indian so, (puts hands together and bows head down)
Dhanyawad mera dost xD",12,3,1600404167.0,skiti_kakaka,False,neutral,neutral,neutral,neutral
g5ojxbx,Satshriakal,5,3,1600413882.0,i_will_be_king_3000,False,neutral,neutral,negative,neutral
g5o70h8,They weren't serious lmaooo,19,3,1600403154.0,Kushagra_Sharma_2609,False,negative,negative,negative,negative
g5o92zt,"Namaste, and Dhanyavad are Hindi words. 41.1% people in India knows Hindi. So, there is a 58.9% chance that you will be greeting them with wrong language if you use those two words.",22,3,1600404638.0,quicktry,False,neutral,negative,neutral,neutral
g6jhc6v,But dhayawad or Shukriya is not 'Indian' .. it's just Hindi.,2,3,1601046236.0,JayB_chennai,False,neutral,negative,neutral,neutral
g5onrvr,You do all of the above & say Dhanyawad or Shukriya  to say  Thank you,1,3,1600418085.0,Mukund_A,False,positive,positive,positive,positive
g5p7t3r,"Even better, just youtube it. Complete the circle",1,3,1600435981.0,savanrajput,False,positive,positive,positive,positive
g5raxac,"
🙏

Dhanyawad",1,3,1600472807.0,B0ssc0,False,positive,neutral,neutral,neutral
g6ulfqx,नाम रोशन कर दिया छोकरे ने भारत को,1,3,1601215545.0,MayankBabaji,False,neutral,neutral,neutral,neutral
g6yd4kj,samee namee,1,3,1601303293.0,Suyashhhhh,False,neutral,neutral,neutral,neutral
g8sp9ff,"Why would u greet someone saying dhanyawad what, I’m so confused",1,3,1602684470.0,Rryt_Nobody000,False,negative,negative,negative,negative
g9082sr,Re chora macha raha,1,3,1602859188.0,Internal-Driver9187,False,neutral,neutral,negative,neutral
g967q56,"Or ""Nandri""!  Or in the 28 other languages you feel comfortable!",1,3,1602988911.0,thatindianguy1992,False,neutral,neutral,positive,neutral
g981ghw,Hmm wouldn't work if he meets indian from other parts of india.they have no idea about hindi. English greeting might be enough.just say hello.,1,3,1603030671.0,ginko134,False,negative,negative,neutral,negative
g5o9rop,"Speaking those words is useless, because most people who don't speak or know Hindi, hate it because of the imposition and would rather prefer English. So it's useless to speak, especially in this sub where only 10-15% people know Hindi.

Also most people of this sub don't know meaning of Hindi etiquette words like 'Dhanyavaad', 'Sukriya', 'Namaste' etc. English 'Thanks' is the inly way.",-2,3,1600405150.0,Narayan_22,False,negative,negative,negative,negative
g5o70th,Lol are you brain damaged ?,-6,3,1600403160.0,BOOTY-SMASHER,False,negative,negative,negative,negative
g5o83u1,"Yes. Atleast learn our greetings.

Least you guys could do.",0,3,1600403929.0,hakuna22matata,False,neutral,negative,positive,neutral
g5ojhjo,Greetings is you do all of the above & say Namaste (North India)  or Namaskar (Central India) or Namaskaram (South India). 1st one works the best all over the country :-),0,3,1600413438.0,Mukund_A,False,positive,positive,positive,positive
g5o6sgv,are you dumb ? just use this emoji ( 🙏🙏🙏 ) 😂,-23,3,1600402998.0,PETWAL8899,False,negative,negative,neutral,negative
g5oexeh,0_0,4,3,1600409265.0,bonhaiver,False,neutral,neutral,neutral,neutral
g5omu7u,">>Every Indian parent - ""First you finish with engineering, then you can decide what to do with your life.""
>
>Every Indian parent - ""First you finish with engineering, then we'll decide what to do with your life.""",24,3,1600417024.0,kfpswf,False,neutral,neutral,neutral,neutral
g6uzkxn,"That day never comes bruh, never ever comes. Don't even hope for it 😂",1,3,1601223566.0,throwrajk,False,negative,negative,negative,negative
g5omr0r,"Divided by borders, united by the same desi parental pressure.",57,3,1600416926.0,kfpswf,False,neutral,neutral,neutral,neutral
g6fcoq5,Oh nooo! Sad to know the weight of expectations remains the same across the border as well 😅,2,3,1600956770.0,sonjavad123,False,negative,negative,negative,negative
g5ob29a,"If you are talking about Irodov, I don't fucking understand is even at 35 , but I had to solve the problems anyway for preps ....",20,3,1600406131.0,RevolutionRose,False,negative,negative,neutral,negative
g5oal7b,It is actually opposite for me i like studying  but my parents forces me to go out and play,10,3,1600405769.0,ChiragVarshney,False,neutral,negative,neutral,neutral
g5oajtl,"Dude. I have the exact same life as you, only difference I'm 15",8,3,1600405740.0,,False,neutral,neutral,neutral,neutral
g5o9019,indian parents literally push anything into their limits,6,3,1600404578.0,M1a2yank,False,negative,negative,negative,negative
g5o8stl,"Actually, I really wanted to study art or music. But I would have to fight with my parents and even if I did, there are not a lot of opportunities here. So I would have to go out of this country (which I'd like to) but I dont know if my parents could afford it",5,3,1600404433.0,_blurr_99,False,negative,negative,negative,negative
g5p2q77,~~Multitask~~,1,3,1600432740.0,AnonyUwuswame,False,neutral,neutral,positive,neutral
g5ova0t,"I'm not, care to explain?",8,3,1600426596.0,Loaatao,False,negative,neutral,negative,negative
g5o3ypn,"/uj Yeah, it's awesome. Stuff like that usually happens when you spend time around people who speak like that. 

/rj One of us! One of us!",49,3,1600401107.0,dudeimconfused,False,positive,positive,positive,positive
g5o5uzg,"TIL rest of the world doesn't use ""doubt"" as a noun.",69,3,1600402357.0,GilgameshJr,False,negative,neutral,neutral,neutral
g5pz85n,Hahahahaha nice,1,3,1600449406.0,,False,positive,positive,positive,positive
g5oepmc,Out of 4 or 10?,16,3,1600409088.0,yaserafriend,False,neutral,neutral,neutral,neutral
g5sgf6q,hello gryffindor kaka!,4,3,1600495991.0,thelielmao,False,positive,neutral,negative,neutral
g5oxyye,+1. Their Theory of Computation lectures are amazing. Really helped me.,4,3,1600429085.0,_thekinginthenorth,False,positive,positive,positive,positive
g5oalon,Well I am 14 so most of my food is home cooked so I don't really have a choice but thanks anyway,1,3,1600405779.0,datboi-reddit,False,neutral,neutral,positive,neutral
g5o7s1y,The DJs used to play it in any function/occasion to get the crowd go wild... And yes it did work,19,3,1600403696.0,o7mkar,False,positive,positive,neutral,positive
g7c7jk7,Try this one. https://youtu.be/F5R4zogEyRk,1,3,1601591672.0,Pitaqueiro,False,neutral,neutral,neutral,neutral
g5ogqsq,"Wow thank you for the honest link, I kinda expected a Rick roll there.",3,3,1600410850.0,Nisarg_Jhatakia,False,positive,positive,positive,positive
g5obrp8,[deleted],0,3,1600406679.0,,1600407229.0,neutral,neutral,negative,neutral
g5o9wks,"I assume India won't have many, cuz ""Steak""house lol.",7,3,1600405252.0,MihirX27,False,neutral,neutral,neutral,neutral
g5oh9s6,"Feijoada is a very widely eaten dish in a place in India called Goa where I live.

Makes sense tho since we both were Portuguese colonies. Is beef tongue also big in Brasil?",1,3,1600411330.0,CoroIsMyDaddy,False,neutral,neutral,positive,neutral
g5o3yr4,It was a meme reviewed by PewDiePie in probaly 2016...,-24,3,1600401108.0,Titan-JOck,False,neutral,neutral,positive,neutral
g5obsl2,"Can't afford the gold,so politics and economics.",24,3,1600406698.0,lazybitchylass,False,negative,negative,negative,negative
gals8pe,r/unexpected,2,3,1604069504.0,Andromeda_004,False,neutral,neutral,positive,neutral
g5pwu79,"Interesting, but why?",1,3,1600448328.0,tourist_fake,False,neutral,neutral,neutral,neutral
g5ocib9,Yeah ig,1,3,1600407263.0,randomuser420_69,False,neutral,neutral,neutral,neutral
g5o8qv4,Always have been,8,3,1600404393.0,ashesofturquoise,False,neutral,neutral,positive,neutral
g5o8prz,We are hahahahahahhaha (laugh nervously ),3,3,1600404371.0,Nowa_moee,False,positive,positive,neutral,positive
g5o8u5z,"As an Indian, nice pic dear",8,3,1600404461.0,vishakhaisweird,False,positive,positive,positive,positive
g5o9oui,And I will make a video to Thank you for that 😂,3,3,1600405090.0,hakuna22matata,False,positive,positive,positive,positive
g5orl0o,Literal truckloads if AIB are to be believed,8,3,1600422519.0,penguin_chacha,False,neutral,neutral,negative,neutral
g5soio9,"Alright, maybe it's meant to be endearing because we are many in number? I don't think it was meant to be offensive. Termites are dangerous, so I get it, I mean, maybe it is meant to be positive in Brazil. Strength in numbers kind of a deal?",1,3,1600503584.0,junk_mail_haver,False,neutral,neutral,positive,neutral
g6jdlul,"Although it feels like he's making a mockery of us, but there are still chances that what he meant by that could very well be lost in translation. Or maybe not. Would depend on what the original post said I guess.",1,3,1601044294.0,,False,negative,negative,neutral,negative
g6pvf9y,lmao and people here ate this up,1,3,1601150805.0,abstergofkurslf,False,negative,negative,neutral,negative
g5of7t4,Be it either an Aryan Supremacist or a Dravidian Supremacist. Both are signs of mental retardation and inaccomplishment of anything valuable in their lives. Imagine thinking you're superior based on your skin colour.,6,3,1600409511.0,,False,negative,negative,negative,negative
g5o9iz8,Wait what!? Since when did these cringe pickups made me famous *blushes*,48,4,1600404967.0,suyashve,False,negative,neutral,neutral,neutral
g5oj5wd,"> Thanks a bunch

Did you mean *Dhanyawad*?",3,4,1600413121.0,DrDewDrop,False,positive,positive,positive,positive
g5qqy6f,Or you can just emoji! 🙏,2,4,1600462833.0,kasarediff,False,neutral,neutral,neutral,neutral
g6njw7s,[deleted],1,4,1601114049.0,,1617681152.0,neutral,neutral,negative,neutral
g7ad13t,Dhanyavad means thank you in Hindi,1,4,1601561990.0,messedupProgrammer,False,positive,positive,positive,positive
g93sthl,They r Soo cheezy bt they surely work,1,4,1602944720.0,darkhumo_r,False,positive,positive,neutral,positive
g5plf1w,"You mean in Hindi?
Indian is not a language",5,4,1600443192.0,_Narsil_,False,neutral,negative,neutral,neutral
g7dfj8f,ਵਾਹਿਗੁਰੂ ਜੀ ਕਾ ਖਾਲਸਾ ਵਾਹਿਗੁਰੂ ਜੀ ਕੀ ਫ਼ਤਿਹ,2,4,1601617230.0,simrankaurgill,False,neutral,neutral,positive,neutral
g7ae2j1,[deleted],1,4,1601562454.0,,False,neutral,neutral,negative,neutral
g5o72wx,Ik,17,4,1600403202.0,suyashve,False,neutral,neutral,neutral,neutral
g5ochui,"Actually, the greeting words are similar in most Indian languages, like
""namaskaram"" in Malayalam
""Namaskara"" in Kannada.
Sometimes they are way too different,like
""Vanakam"" in Tamil 
But ""namaste"" works just fine in most languages...(just saying)",46,4,1600407252.0,,False,neutral,neutral,positive,neutral
g5o9eg7,Still those 2 words and the gesture is recognised by everyone so it doesn't really matter.,34,4,1600404873.0,suyashve,False,neutral,neutral,positive,neutral
g5pf3y9,"And for most of the 1.21 percent of Indians who live in Delhi, an appropriate greeting would obviously be 'behnc\*\*d'",10,4,1600440016.0,ki_odbhut,False,neutral,neutral,neutral,neutral
g5ofj2r,"One may not, as you say, understand the word but, I am sure each would understand graphic presentation ie. Joining of hands and bowing your head. 🙂 Of course, with a smile and keeping eyes straight.",5,4,1600409787.0,That_SEO_Guy,False,positive,neutral,positive,positive
g5ogiws,"I dont know Hindi. Namaste is pretty obviously everyone knows. I know half of second word because I remember someone saying ""Dhanyan"" to mean blessed one (may be i am wrong).",6,4,1600410659.0,zenmasterhere,False,neutral,neutral,positive,neutral
g5p49tb,"Even if a Japanese greets you (in Japanese), you will realise that he is greeting you.",7,4,1600433784.0,Akshyun,False,neutral,neutral,positive,neutral
g5o9znr,Literally everyone in India knows Namaste and Dhanyavad.,19,4,1600405315.0,altair222,False,neutral,neutral,neutral,neutral
g5ongfs,"Most Indian languages are SUPER similar so, don't worry m8
Ps. I'm Indian too",1,4,1600417725.0,,False,positive,neutral,positive,positive
g5ooh4z,"According to 2011 census 40% have Hindi in there mother toungue or as first language. 
So it is estimated that more than 61% knows and 58% can speak Hindi.",1,4,1600418887.0,Terrible-Source,False,neutral,neutral,neutral,neutral
g8spccr,Tru,1,4,1602684517.0,Rryt_Nobody000,False,neutral,neutral,positive,neutral
g5oeg1a,"Not exactly, Telugu word is Dhanyavadam and Kannada word is Dhanyavadagudulu (or something close). Only Kerala and TN have a different word.",1,4,1600408864.0,platinumgus18,False,neutral,neutral,neutral,neutral
g5oc6mk,"If you use any other Indian language, then the chance of using wrong greeting will be much much more than 58.9% !!!

I know a lot of folks will suggest using English greeting instead. How ironic would that be! A country that has so many rich and diverse languages needs a ""foreign"" language to be acceptable to all !!!",0,4,1600407006.0,zxasdfx,False,negative,neutral,negative,negative
g5odano,Namaste (namaskar) is a sanskrit word and same is dhanyawaad (ig)? Most of the languages in India use sanskrit words so ig most people in india know both of these,-1,4,1600407906.0,dmishra333,False,neutral,neutral,neutral,neutral
g5oduyt,But the thing is some languages here are similar to hindi and as hindi is our main language as most languages here are derived from devagiri(whatever that is) script. Most of us atleast know how to speak in it. So basically what I meant is everybody understands our gestures no matter what language they speak,-2,4,1600408371.0,ssjssdoraemon,False,neutral,neutral,neutral,neutral
g5obdjw,"As per the 2011 census, 43.63 percent of Indians speak Hindi as their mother tongue.Bengali, with 8.03 percent speakers, is second in the list, followed by Marathi at 3rd with 6.86 percent speakers, Telugu at 4th with 6.7 percent speakers. In all these languages the word for thank you is Dhanyawad/dhaunyabad/dhanyawadalu, and for greetings, the word is Namaste/namaskar/nomoshkar/namaskaramu. And I think that's enough to say that a good chunk of Indian population will understand these two words.",13,4,1600406372.0,Garuda1999,False,neutral,positive,positive,positive
g5ogj4u,You are right. The Hindi imposition drives people crazy and is actually hurting Hindi.,2,4,1600410664.0,quicktry,False,negative,negative,negative,negative
g5o73a0,Idk maybe,2,4,1600403208.0,suyashve,False,neutral,neutral,neutral,neutral
g5ocig3,No one is obligated to learn anyone's greetings!,3,4,1600407266.0,zxasdfx,False,neutral,negative,neutral,neutral
g5o74vq,Emojis aren't used in reddit,8,4,1600403240.0,dipanshu6,False,neutral,neutral,neutral,neutral
g5o7528,"Are you dumb, we don't use emojis in here.",5,4,1600403244.0,Ox_turner,False,negative,negative,negative,negative
g5o7xrg,That emoji was originally a high-five but indians use it as joined hands ;-;,1,4,1600403810.0,MuhsecalMan,False,neutral,neutral,neutral,neutral
g5o6yrv,[deleted],0,4,1600403121.0,,False,neutral,neutral,negative,neutral
g5ogh1u,I known it's quite crazy but that is how you greet and show respect to people >X],1,4,1600410613.0,Soniya-DX_649,False,neutral,positive,positive,positive
g5pcbri,Next step is marriage bro.,9,4,1600438524.0,,False,neutral,neutral,positive,neutral
g7b2bdw,And suppression of Minorities...,3,4,1601573101.0,sassybuds,False,negative,negative,negative,negative
g5onfj6,"f off, lol",9,4,1600417696.0,SuggehSai,False,neutral,negative,neutral,neutral
g5p3f01,[deleted],1,4,1600433213.0,,False,neutral,neutral,negative,neutral
g5panoj,I can relate!,1,4,1600437601.0,,False,positive,positive,positive,positive
g5ofoil,"Same, I was on a homework help discord server and saw 17-18 years olds posting questions that I'm doing rn (im15).
It was quite bizzare",6,4,1600409916.0,,False,negative,neutral,negative,negative
g5ommxh,"Bhai. Art or music padhke khaoge kya? Ghar ka rent bharne mein whaat lag jayegi. Saksham bano. Learn 3-4 skills. So that after an early onset of midlife crisis, you can do stuff that you like. 

Note: I quit my corporate job after 5 years, trained myself and now I write full time. I make a decent living too, so ny parents don't antagonize me anymore. 

P.S: Never stop learning.",-1,4,1600416798.0,domraja5,False,neutral,positive,neutral,neutral
g5owrff,Ohh you wanna know how things work in india?.. ohh basically about 60% is still arranged marriage.,44,4,1600428036.0,VivDso69,False,negative,neutral,neutral,neutral
g5o6pbt,"They do. It's just that they use it to mean ""uncertainty"", like ""I'm not sure about what you said"", not ""I don't understand what you said"".

In other words, ""I have a doubt about what you said"" is the same as ""I doubt what you said"".",31,4,1600402939.0,ksharanam,1600438576.0,negative,neutral,negative,negative
g5ozfqf,"ikr, that's so weird",2,4,1600430299.0,sibs_afro,False,negative,negative,negative,negative
g6kmsv9,"I think we use it because it's a relatively new word for someone who doesn't know too much English. 

So it became this fancy word to use when you have a question so that people realise that your question is genuine (because lots of questions people ask are condescending ones, at least in my culture). 

And they saw someone using that word during a serious conversation and they pick up from that and not from the grammar book. It's weird how we pick up words like that",1,4,1601067633.0,Sweet_drills,False,neutral,neutral,neutral,neutral
g5oolmf,"bruh he means out of 5.0  
Conventional use",4,4,1600419030.0,,False,neutral,neutral,neutral,neutral
g5oq25g,Out of 5,1,4,1600420761.0,devil1298,False,neutral,neutral,neutral,neutral
g5os5qr,Yes,1,4,1600423178.0,NedDeadStark,False,positive,positive,neutral,positive
g5ozhh3,Out of 3.99,1,4,1600430338.0,,False,neutral,neutral,neutral,neutral
g5sh0sz,aiyyo GRYFFINDOR KAKA! how ARE you?,2,4,1600496376.0,No_Management5486,False,positive,positive,neutral,positive
g5oat37,I had my first Brazilian dish at 24. You’re good. 😄,3,4,1600405936.0,VoldyPoldy,False,positive,positive,positive,positive
g5otszl,Enjoy 😄,1,4,1600425039.0,VoldyPoldy,False,positive,positive,positive,positive
g5ogysq,PUTA QUE PARIUUU,1,4,1600411051.0,CoroIsMyDaddy,False,neutral,neutral,neutral,neutral
g5oh6aw,Lots in Goa :),4,4,1600411239.0,CoroIsMyDaddy,False,positive,positive,neutral,positive
g5oieng,"I wouldn't say that beef tongue is a big thing in Brazil. There are dishes made with it, but it's not very popular, at least from what I know.

Also I didn't knew about this cousin feijoada stew from Goa. Searching some pictures, looks like its made or served with macaroni noodles, is this right? 

Here, almost every plate has rice in it, especially feijoada.",1,4,1600412386.0,Cascudo,False,neutral,neutral,neutral,neutral
g5o42rw,[deleted],17,4,1600401178.0,,False,neutral,neutral,negative,neutral
g5pxxj5,[deleted],3,4,1600448810.0,,1625096848.0,neutral,neutral,negative,neutral
g5o9jz2,[removed],4,4,1600404988.0,,False,neutral,neutral,negative,neutral
g5pbm8a,Mass recruiter everyone's messiah,2,4,1600438133.0,Same-Cartographer488,False,neutral,neutral,neutral,neutral
g6ordju,"He wrote in Portuguese, but here's the translation

""Hahaha just today I made a post on r / india just to thank those termites that have saved me so much in engineering college. If there's a country that deserves to be a superpower, it's them.""",2,4,1601131357.0,SpectaSilver991,False,positive,positive,positive,positive
g5oj5mt,You missed the joke their.,1,4,1600413114.0,supermatt234,False,negative,neutral,negative,negative
g5oamrq,Yeah dude my girl likes them lol. I see ur posts daily keep at it _pat on back_,31,5,1600405802.0,ravoili_ravioli,False,positive,positive,positive,positive
g5okpdy,Haa bhyi woi dhanyawad shukria all the thanks,3,5,1600414696.0,ravoili_ravioli,False,positive,positive,positive,positive
g6nmsl9,He posts pickup lines everyday i think he's been doing it for 300 days now,1,5,1601115708.0,ravoili_ravioli,False,neutral,neutral,neutral,neutral
g5psuh3,(puts hands together in hindi lmao),6,5,1600446533.0,skiti_kakaka,False,neutral,neutral,neutral,neutral
g7ae7ek,"I know
It is Punjabi
I live in Punjab",1,5,1601562515.0,i_will_be_king_3000,False,neutral,neutral,neutral,neutral
g5of8ww,Yes you are right. Namaste works in most places. But Dhanyavad and Shukriya are from it.,18,5,1600409539.0,quicktry,False,neutral,positive,positive,positive
g7olya9,Wait I thought that Vanakkam was in Malayalam and Namaskaram was in Tamil lmao,1,5,1601821900.0,DonutLord23,False,neutral,neutral,neutral,neutral
g6p0qxw,Really? I’m a Tamil speaking Indian and I know for a fact that most of Tamils I know don’t know those 2 words. Stop fracking imposing your stupid Hindi on every Indian bro!,1,5,1601136167.0,sonicmissile,False,negative,negative,negative,negative
g5pfflw,true that. There are two versions of Hindi. The one we speak to teachers and elders are highly respectful. The one we speak to friends are way too far from being respectful and is full of $&)@. 😄,1,5,1600440184.0,quicktry,False,neutral,neutral,positive,neutral
g6psnst,"Hey that's rude....we sometimes roll with ""bho***ike""",1,5,1601149884.0,CommanderRobotGoose,False,negative,negative,negative,negative
g8spdzu,Ofc ofc,1,5,1602684544.0,Rryt_Nobody000,False,neutral,neutral,neutral,neutral
g5ofsjx,Oh yes. This is true. That gesture was used by Air India as well.,1,5,1600410015.0,quicktry,False,positive,positive,neutral,positive
g5ogs4p,Dhanya/dhanyan is blessed and Daniya is coriander. So you need to be careful there 😁,10,5,1600410885.0,quicktry,False,positive,neutral,positive,positive
g5obdj9,Maybe namaste yes but 90% of chennai doesn't know Dhanyavad,15,5,1600406372.0,Parsnip-Mammoth,False,neutral,neutral,neutral,neutral
gq6vuyv,"travel more in India then lol if you really think this...Many places are not familiar with those terms
edit: also just to add 

>Sure, but the majority do.

Majority of Indians are monolingual (hundreds of millions of Indians only speak their village languages of Hindi or Bengali) does this mean ""Literally everyone in India is monolingual""? Just saying your wording is off",1,5,1615191217.0,prakitmasala,1615660205.0,neutral,neutral,neutral,neutral
g6ycz14,"That is completely not true that is false perception. North end has sanskrit polarity and southern states tamil polarity and everything in between is gradient of two completely different language family. In my opinion hindi words of welcome might work  in North India and Hello or Hi would be fine in South India because literacy rate in southern states are higher compared to Northern counterpart.So their proficiency in English would be greater. I assume most people in India when pickup a phone call they would utter hello. So that would be a reasonable word to greet in India. But if a person specifically want greet in Indian language, there are many Indian languages and it is hard to memorize all of them. India has many official language but no national language. It is a country but it is also a subcontinent.",2,5,1601303209.0,ginko134,False,neutral,neutral,neutral,neutral
g5ofi3o,">Dhanyavadagudulu

Legit read this as gulugulugulu 

Anyway, it is Dhanyavaad in Kannada as well, the plural form is Dhanyavaadagalu.",1,5,1600409763.0,Ohsnapitsnotme,False,neutral,neutral,neutral,neutral
g5od5a4,English is the cost you pay if you wanna be a union of states for economic and military benefits.,6,5,1600407784.0,,False,neutral,neutral,negative,neutral
g5of0rt,"With all due respect, Hindi is not India's main language my friend. Nothing against Hindi by the way. It's a beautiful language. At the same time, I want to recognize and embrace the diversity and unity.",6,5,1600409344.0,quicktry,1600409679.0,positive,positive,positive,positive
g5ocncg,"Not obligation, just being nice and friendly. It takes  days to make an hour long tutorials, takes 5 mins to learn a new greeting 😁",0,5,1600407373.0,hakuna22matata,False,neutral,positive,neutral,neutral
g5o7fa9,This whole thread was CRINGE,-3,5,1600403445.0,sandshetty,False,negative,negative,negative,negative
