Comment ID,Comment Text,Comment Score,Comment Depth,Created Timestamp,Author,Edited,Semantic Label,Semantic Label 2,Semantic Label 3,Major_Semantic
g5nwoiy,I live in California and have watched a lot of Indians on YouTube for help in my calculus and engineering courses. Thanks!,1129,0,1600396912.0,NovelNeighborhood6,False,positive,positive,positive,positive
g5o76uf,Anything other than relationship advise from Indian youtube is top notch,257,0,1600403278.0,VivDso69,False,positive,positive,positive,positive
g5nnji5,"Humble YouTubers please accept the gratitude , Just keep the background music low.",673,0,1600391956.0,shaheenbaaz,False,positive,positive,positive,positive
g5o2xvr,Behind every successful man there is an Indian Youtuber.,338,0,1600400485.0,inforgraphic101,False,positive,positive,positive,positive
g5ny4xx,As an Indian I am glad there are guys who post these videos.,331,0,1600397705.0,iamhunting,False,positive,positive,positive,positive
g5o77pg,We guide others to a treasure we cannot possess,142,0,1600403295.0,No_Management5486,False,neutral,neutral,positive,neutral
g5og13m,[deleted],64,0,1600410225.0,,False,neutral,neutral,negative,neutral
g5nnlyi,"OP

  


Please shout-out your favourite channels",124,0,1600391994.0,shaheenbaaz,False,neutral,neutral,positive,neutral
g5oavo4,Believe me I once uploaded a tutorial on how to refresh a computer and got decent views,36,0,1600405991.0,Dirk-Yeswitzki,1600417446.0,positive,positive,neutral,positive
g5o0bfs,As an Indian I have to say Brazilian food is amazing.,204,0,1600398932.0,_ecthelion_95,False,positive,positive,positive,positive
g5o3rr0,"OP, post your favourite channels please",22,0,1600400987.0,Cowz-hell,False,neutral,neutral,positive,neutral
g5od7te,"As an Indian, I just want to say that your footballers AWESOME",18,0,1600407841.0,Inferno1744,False,positive,positive,positive,positive
g5o1thj,We have solution for everything,73,0,1600399799.0,aamir_aaaa,False,neutral,positive,positive,positive
g5o2li0,[removed],67,0,1600400275.0,,False,neutral,neutral,negative,neutral
g5o602w,"70% of the future unemployed Indian engineers are dependent on these videos.

The other 30% get low paying railway jobs.",37,0,1600402456.0,,False,negative,negative,negative,negative
g5o5tbw,"*laughing unemployed-ly*

We have create our own jobs as we aren't able to get any help elsewhere.",55,0,1600402326.0,sumanthkulkarni,False,negative,negative,negative,negative
g5o3sa6,"And as an Indian, I approve of this.",40,0,1600400995.0,MrSpaceCosmos,False,positive,positive,positive,positive
g5o6431,"Lol. For engineering courses, of course we have lots of YouTubers. 

India produces more engineers per year than the total number of engineers in US and China combines.",38,0,1600402533.0,Y-Bakshi,False,neutral,positive,positive,positive
g5od7b8,"I am not Indian or Brazilian but Indians are some of the coolest, kindest, most welcoming people I've ever met. The myriad YouTube tutorials are just a nice bonus",19,0,1600407829.0,K_Furbs,False,positive,positive,positive,positive
g5ohuub,"We Indians are like that only, drama or nothing. - Seema Aunty",10,0,1600411872.0,cutestoner,False,neutral,neutral,neutral,neutral
g5o6qj5,I had learnt java by watching durgasoft tutorials which I was recommended to watch by my friend who went to some classes to learn java but these videos made him understand java far better than those coaching classes...,8,0,1600402962.0,o7mkar,False,positive,positive,neutral,positive
g5o5dyg,Obrigado! Learned a few Portuguese words while travelling abroad,6,0,1600402037.0,meemboy,False,positive,positive,neutral,positive
g5o3vol,"lol thanks for the kind words.....Our country has a lot of great talent, and I hope that through the internet, they can truly express their potential and skills!",18,0,1600401054.0,screechingzebra,False,positive,positive,positive,positive
g5or398,Love from Australia,6,0,1600421952.0,,False,positive,positive,positive,positive
g5nydq4,"There is a YouTube video which explain what types of food served in prison and other prison routine life. 

https://youtu.be/HxsQgukyqgE",24,0,1600397839.0,msareddit123,1600398913.0,neutral,neutral,neutral,neutral
g5p2dpu,lol this guy is calling indians as termites on other aub,6,0,1600432494.0,moooooovit,False,negative,negative,negative,negative
g5o6h6q,Thank you. Come again,8,0,1600402783.0,eb_fnx,False,positive,positive,positive,positive
g5o69d1,Thanks,4,0,1600402635.0,pavansinghbaitule,False,positive,positive,positive,positive
g5okrqj,NesoAcademy,4,0,1600414766.0,bojack_cowman,False,neutral,neutral,negative,neutral
g5p2e7p,"I read the title and for a second thought that it was about covid.


Please don't kill me.",3,0,1600432504.0,rfn0,False,negative,neutral,negative,negative
g5qrfr8,Bhai mai bhi bahar se hun mujhe bhi upvote do,4,0,1600463055.0,Mayank_j,False,neutral,neutral,neutral,neutral
g5o6ecb,As an Indian this does put a smile on my face.,6,0,1600402729.0,LaquzoEshiyasha,False,positive,positive,positive,positive
g5o76zd,I've passed all my semesters with those 15mins youtube lectures,3,0,1600403281.0,BOOTY-SMASHER,False,positive,positive,neutral,positive
g5oegg8,"as an Indian, i don't watch any Indian tutorial,instead make one 😂",3,0,1600408875.0,,False,neutral,negative,neutral,neutral
g5oijp3,Sometimes I look up on youtube for an obscure historical topic about my country in english and almost always found an educational video made by an hindi guy,3,0,1600412518.0,,False,neutral,neutral,neutral,neutral
g5p8uec,That is because our education system sucks so we students use youtube,3,0,1600436584.0,NoxiousBlaster,False,negative,negative,negative,negative
g5sqov5,We Indians made tutorial in the comment section also.,3,0,1600505979.0,kilby101,False,neutral,neutral,neutral,neutral
g904x7g,Dude we are beyond science 😎,3,0,1602857467.0,hahawithsneha,False,positive,neutral,neutral,neutral
g5o2m9d,I read that huge fires are currently scathing the forests in Brazil. Stay safe OP and let us know how we can bring that issue into focus. 🙏,8,0,1600400288.0,CrunchyHobGoglin,False,neutral,neutral,neutral,neutral
g5oeze0,This literally was an appreciation post for Indians and you ruined it,5,0,1600409312.0,,False,negative,negative,negative,negative
g5o7ram,"I'm an Indian, I don't have youtube channel but I help anyone on fb to understand topics from physics and maths. Sometimes it's difficult because I learnt some topics in my mother tongue, but I try my best. I love maths.",4,0,1600403680.0,Jay4vaghela,False,positive,positive,positive,positive
g5odlkq,As a Indian I have to say that sometimes it's so cringe but there are some tutorials which helped me a lot. Indian YouTube is the next best option if u could not find whatever u were looking for in google,4,0,1600408156.0,ssjssdoraemon,False,positive,neutral,positive,positive
g5oap7p,Maybe the only thing Indians are good at. I'm Indian,2,0,1600405852.0,roasted_cashews,False,positive,positive,neutral,positive
g5p8bje,There is a bigger burden above society I.e. unemployment. Society and unemployment are just the tip of the iceberg.,2,0,1600436282.0,prashant123098,1600436951.0,negative,negative,negative,negative
g5poq1t,Proud moment,2,0,1600444752.0,,False,positive,positive,positive,positive
g5ppq4j,"As an Indian, I too would like to congratulate my fellow countrymen on this matter - these Youtubers have helped me a lot with computer problems",2,0,1600445196.0,AudiQuattroZoomZoom,False,positive,positive,neutral,positive
g5q4ecc,Hello Friends!,2,0,1600451878.0,LukhaManus,False,positive,positive,neutral,positive
g5qqbg2,🙏,2,0,1600462546.0,nrnarayan5,False,positive,neutral,neutral,neutral
g5qxs1p,Thank you guys for my painting and Photoshop tutorials!,2,0,1600465903.0,0gma,False,positive,positive,positive,positive
g5z6krb,haha i thought youtube suggests me Indian youtubers' solution because I live in India. Seems like everyone gets the same search results.,2,0,1600608823.0,sweetpoision,False,neutral,neutral,neutral,neutral
g67r0ro,[deleted],2,0,1600783905.0,,False,neutral,neutral,negative,neutral
g6a6kkf,"Awww, thank you.",2,0,1600830036.0,Awpogon,False,positive,positive,positive,positive
g6jbiyd,Filling Peraud Indian armiiii,2,0,1601043192.0,SkinnySid1799,False,neutral,neutral,positive,neutral
g6jdxo9,We agree,2,0,1601044469.0,tis_monk,False,neutral,positive,positive,positive
g6jhur4,thanks,2,0,1601046509.0,thesseNuTTs,False,positive,neutral,positive,positive
g6onqpw,I have no clue why,2,0,1601129772.0,vindicatiiiooonnn,False,negative,negative,neutral,negative
g6op2yl,We are on another dimention😆,2,0,1601130342.0,UchihaClanMember,False,neutral,neutral,neutral,neutral
g6opufx,Thanks for acknowledging,2,0,1601130659.0,CLONIAN,False,positive,positive,positive,positive
g6opv60,Thanks for acknowledging,2,0,1601130666.0,CLONIAN,False,positive,positive,positive,positive
g6owox9,"Indians basically make tutorial so that even a layman can understand it, as it is a majority of population of india which is just entering in the tech savy world.

And for educational courses, it is commendable to a whole another level.",2,0,1601134045.0,,False,positive,positive,positive,positive
g6p3gh2,"Wow! Brazilian people hav watched Indian you tube videos.
Amazing.
Unrelated question... How many zeros are there in a Brazilian?",2,0,1601137734.0,Simplymanic99,False,positive,positive,neutral,positive
g6uzp5z,I am an Indian and I gladly accept this.,2,0,1601223626.0,SAUMYAROCKz,False,positive,positive,positive,positive
g6yb2v8,We are honoured. Thank you!,2,0,1601302140.0,lisa_hay,False,positive,positive,positive,positive
g6yggn3,OmG! 😂😂,2,0,1601305101.0,Shariyaaman,False,positive,neutral,neutral,neutral
g6yhojn,As an Indian I feel disappointed that I don't have a channel of tutorials!,2,0,1601305704.0,Shariyaaman,False,negative,negative,negative,negative
g70rdxw,They literally have tutorials on how to watch a YouTube video...on YouTube,2,0,1601346055.0,,False,neutral,neutral,neutral,neutral
g728bzq,"Hey , why not you go. Checkout my yt channel , in an Indian too and speak English, I just want a review on my contents,.  Channel Name:- BBMG Playz",2,0,1601389000.0,bb_playz,False,neutral,neutral,neutral,neutral
g7abt47,Thanks for bestowing us this award,2,0,1601561424.0,,False,positive,positive,positive,positive
g7ack8g,"Wow, this is so appreciated. Though I'm not one of those YouTubers but I'm really happy that their hard work is being recognised and appreciated.",2,0,1601561770.0,decorous_appellation,False,positive,positive,positive,positive
g7ajvr8,"I'm an Indian and I learn everything from those tutorials, YouTube actually is our school",2,0,1601565033.0,Niraj_177013,False,positive,neutral,neutral,neutral
g8odekk,Hello,2,0,1602579352.0,Simonfuch,False,positive,neutral,neutral,neutral
g8rflre,"I am an Indian Viner on youtube and need your little support Brothers and Sisters
https://youtu.be/wGbu558BZ5Y",2,0,1602644581.0,IndependentBull2274,1602654707.0,neutral,neutral,neutral,neutral
g8we79g,We are either so damaged or hyped by our parents that we need or make Tutorials respectively.,2,0,1602770792.0,DildarBegum,False,negative,negative,neutral,negative
g8whv5c,We all Indians would like to help anyone in all respects.,2,0,1602772794.0,Suspicious_Tone_950,False,positive,positive,positive,positive
g904jf9,Op bro,2,0,1602857257.0,Fair-Car-105,False,neutral,neutral,neutral,neutral
g980lup,That's Atlas holding the world as a punishment by Zeus for being at the side of titans in the titanomachy.,2,0,1603030172.0,menyor_,False,neutral,neutral,negative,neutral
g5o6zbp,Ahh that video telling tips and tricks to gain 100k subscribers.,4,0,1600403132.0,peeing_yash,False,positive,positive,neutral,positive
g5o4ogm,I am Indian and [Vengaboys](https://www.youtube.com/watch?v=fMKCkyHuHI4) To Brazil song is very famous in here,3,0,1600401572.0,kindofusername23423,False,positive,neutral,positive,positive
g5o70y5,"To be truthful, we just that many. There's bound to be some who are smart and helpful",2,0,1600403163.0,shnshty,False,positive,positive,positive,positive
g5o95dm,"I never knew we had anything like this 
But thnaks 😊",2,0,1600404686.0,abdullah2321,False,positive,positive,neutral,positive
g5ol0uo,Thank you so much buddy.❤️,2,0,1600415036.0,,False,positive,positive,positive,positive
g5o8514,"Quick question. 
Most of them are in hindi, do you guys understand it even after that?",1,0,1600403954.0,mysterious_46,False,neutral,neutral,neutral,neutral
g5o87nq,"Well of course it's that way, because most of them are unemployed, despite having those skills",1,0,1600404006.0,sumeet_x_agrawal,False,negative,negative,negative,negative
g5o8ewn,Anyone remembers Jaipal Vishwakarma ?,1,0,1600404151.0,Kratos3301,False,neutral,neutral,neutral,neutral
g5o8ig6,_mechanicsharkchannel_,1,0,1600404222.0,six6vi,False,neutral,neutral,neutral,neutral
g5obr7h,"Due to education system,it will remain under rated in India for atleast a decade, that's why indians are shifting in foreign countries to get whatbthey deserve.",1,0,1600406669.0,jainamkhara,False,negative,neutral,negative,negative
g5obrrj,My favourite is JAVA BRAINS!!!!!,1,0,1600406681.0,Thappadpethappad,False,positive,positive,positive,positive
g5oe8an,I don't know what to say.,1,0,1600408685.0,RoscoMan1,False,negative,negative,neutral,negative
g5oftgb,I heard and read Brazil is great country for tourism. Definitely I will try to visit.,1,0,1600410037.0,,False,positive,positive,positive,positive
g5ogd99,Atlas unshrugged,1,0,1600410519.0,SoundofLife123,False,neutral,neutral,neutral,neutral
g5ogziy,How do I search for this template??,1,0,1600411068.0,kyool_,False,neutral,neutral,neutral,neutral
g5oh13h,"We have excess amount of everything including unemployment, so lot of time for exploring and showcasing skills.",1,0,1600411106.0,anki30,False,neutral,neutral,neutral,neutral
g5oh314,I'm working on one for Rustlang. Thanks for the encouragement lol.,1,0,1600411156.0,hashedram,False,positive,positive,positive,positive
g5ohd3t,That's true. Literally everything.,1,0,1600411415.0,redundant360,False,neutral,positive,positive,positive
g5ohga3,"As an indian, I just want to say that your footballers are on another level!",1,0,1600411498.0,rafiki6633,False,positive,positive,neutral,positive
g5ohov0,Indian tutorial of how to grow a cherry tree from seed was awesome,1,0,1600411722.0,katnissanon14,False,positive,positive,positive,positive
g5oi73l,"When I saw the heading I thought it was about Corona, tbh",1,0,1600412187.0,RealStripedKangaroo,False,neutral,neutral,neutral,neutral
g5oinyh,i am an indian i and i can't find these tutorials pls help,1,0,1600412629.0,nitheeswar_1,False,negative,neutral,neutral,neutral
g5oj9bk,"Ah well, we do have the proper jugaad mindset! Too bad it cannot help us in politics",1,0,1600413212.0,,False,negative,negative,negative,negative
g5ojbb7,They are not a national party bruh,1,0,1600413266.0,dirtyviking1337,False,negative,negative,negative,negative
g5ojnrc,"I wish I could have understood the guy but the only tutorials I could find of a supposedly common gcode in video was only available in punjabi, or at least that's what youtube though it was",1,0,1600413614.0,ArconC,False,negative,negative,neutral,negative
g5okiac,Thank you,1,0,1600414491.0,,False,positive,positive,positive,positive
g5omgp9,Parraud indian background...,1,0,1600416604.0,kulkarnis009,False,neutral,neutral,neutral,neutral
g5onyk5,"I'm Brazilian and I want to use this post to express my gratitude,

Every time I stumble with problems while programming there always an Indian tutorial explaining how to do it.

Thank you very much guys!

Greetings from a friend from Brazil!",1,0,1600418298.0,Orangeman_17,False,positive,positive,positive,positive
g5op63z,Can someone upload a tutorial of getting a girlfriend?,1,0,1600419701.0,ledepression,False,neutral,neutral,neutral,neutral
g5opf1p,"As an Indian, I love Brazilian videos ...",1,0,1600420003.0,boyof_1987,False,positive,positive,positive,positive
g5oqgfe,I'm just a bit annoyed at the ppl who make good content but speak in Hindi so I don't understand a single thing they are talking and have to find another video.,1,0,1600421223.0,rohithkumarsp,False,negative,negative,negative,negative
g5or5c1,Thank you guys,1,0,1600422020.0,p_r_aj_w_a_l_1_6,False,positive,positive,positive,positive
g5oreje,They helped me fix my  gas scooter,1,0,1600422315.0,Dripdropop,False,positive,positive,neutral,positive
g5osgwo,I wish I had these videos in middle school/high school math classes.  They are a blessing.,1,0,1600423523.0,ronburger,False,positive,positive,positive,positive
g5ot89d,I see these memes everywhere but often I find the best tutorials are presented by americans and europeans. How am I missing out on good tutorials by my own countrymen is beyond me.,1,0,1600424386.0,vipul0308,False,negative,neutral,neutral,neutral
g5otc6v,Something to make me proud of india after a long time <3,1,0,1600424511.0,,False,positive,positive,positive,positive
g5ov2d5,Se tu nao entende ingles tu se ferra kk tenta entender uma palavra ou outra do tutorial,1,0,1600426373.0,Buda2,False,neutral,neutral,neutral,neutral
g5ovxme,Awesome!!,1,0,1600427254.0,Azqaadesigns,False,positive,positive,positive,positive
g5owptg,i started watching this indian guy teaching C++ he explained it in a such different way but more clear and interesting that it was easier to remember concepts plus in real detail too.,1,0,1600427995.0,BaghaBoy,False,positive,positive,positive,positive
g5oy0uc,I once came across a YT Tutorial HOW TO PICKUP A fuckin CHAIR..... not gonna lie m an indian lol,1,0,1600429130.0,annu_cool,False,negative,negative,negative,negative
g5p1ikm,Indian here. Indian youtubers explaining JavaScript and React JS is the reason I got hired 🙏🏻,1,0,1600431869.0,nanariv1,False,positive,positive,negative,positive
g5p6afo,"Tutorials which may seem trivial to most urban & sub-urban people, are very essential to a larger section of our Indian society. Hence, the views.",1,0,1600435073.0,rotikool,False,positive,positive,neutral,positive
g5p7782,Source of this picture? Looks like some old movie or comic picture.,1,0,1600435620.0,PrashnaChinha,False,negative,neutral,neutral,neutral
g5pcphh,"On just reading the title, I was expecting a shitpost on our Corona numbers. Will take this any day, thanks OP.",1,0,1600438733.0,hence_disproved,False,negative,negative,neutral,negative
g5pcpxt,Just posted a YouTube video today. Thanks.,1,0,1600438739.0,Anarchophobia,False,positive,neutral,positive,positive
g5pf35e,I see this as I am literally watching a YouTube tutorial video by an Indian,1,0,1600440004.0,RicketyJimmy,False,neutral,neutral,neutral,neutral
g5pfdv5,"If English content of physics and engineering is a drop then content in Hindi is an ocean, these guys are saviours for us",1,0,1600440160.0,,False,positive,positive,positive,positive
g5pimxe,Thanks mann,1,0,1600441819.0,INFO_MINE5,False,positive,positive,positive,positive
g5pimxl,"The Brazilians have been summoned, porra.",1,0,1600441819.0,,False,neutral,neutral,neutral,neutral
g5pjaya,Btw is this compliment or a satire.,1,0,1600442151.0,,False,neutral,neutral,positive,neutral
g5pk5oq,"Indian here,  and I love Brazilian music! Gal Costa is such a rad musician, everyone should check her out!",1,0,1600442571.0,alannair,False,positive,positive,positive,positive
g5pm29h,Honestly the videos professors at Stanford and MIT make help a lot more,1,0,1600443511.0,Glad-Work6994,False,positive,positive,positive,positive
g5pm4b7,Most  Indians are bilingual as well. some Urban populations are tri lingual!  Everything is good in India except for the politics.,1,0,1600443538.0,,False,positive,positive,positive,positive
g5pt7gn,"Not gonna lie... there’s a good chunk of Indian YouTubers that are very close to killing themselves every video.  One channel is called American tech.  If it’s not something completely fake, it’s something extremely dangerous that shouldn’t be done.

But they have some pretty good electrical engineers otherwise.",1,0,1600446695.0,Deyvicous,False,negative,negative,negative,negative
g5ptnnn,"This is One of our ""Jugaad"" Technique :)",1,0,1600446909.0,sellerhub12,False,positive,positive,positive,positive
g5pvv0u,"Looked at this while planning a Hindi JavaScript course.  

;)",1,0,1600447905.0,suttabar,1600448297.0,positive,neutral,neutral,neutral
g671vj9,"And some people say indians lack creativity ,like b*tch please ,some of you haven't been to India, don't say unless you've been here ,😏",1,0,1600761575.0,ThyInFaMoUsKID,False,negative,negative,neutral,negative
g6izhwr,"Yes, there is a tutorial for almost everything, the other day I could pull the tube of my LPG gas regulator. I looked up on YouTube there was an LPT level tutorial. On how to use hot water to remove a snug gas pipe!!",1,0,1601035585.0,happitor,False,positive,neutral,neutral,neutral
g6japxn,"Special thanks to JIO B-)B-)B-)B-)B-)B-)B-)B-)B-)
(+_+)",1,0,1601042751.0,kannadashitposting,False,positive,positive,positive,positive
g6jaqfg,"We strive to make life easier for others because we didn't have it easy ourselves.

P.S. I make videos on Graphics, 3D and Game design",1,0,1601042758.0,chattergenie,False,neutral,neutral,positive,neutral
g6ldlvk,South Indians on YouTube have tutorials on everything,1,0,1601082747.0,JagmeetSingh2,False,neutral,neutral,neutral,neutral
g6um7hw,https://encrypted-tbn0.gstatic.com/images?q=tbn%3AANd9GcTnCMhyScSgN26iJBUr_e3s0yvvTixM407Llg&usqp=CAU,1,0,1601216027.0,You_slash_name,False,neutral,neutral,neutral,neutral
g6umaxl,"Basically everything you need to know in life, you can find it from that Random Indian YouTube tutorial.

Everything except getting laid.
We Indians haven't found that out yet
😂😂😂😂
Let us know if you guys have found that one out",1,0,1601216085.0,TheGamerNgaihte,False,neutral,neutral,neutral,neutral
g6un5fg,How can you prove you aren't a BJP volunteer trying to please the younger generation?,1,0,1601216602.0,FantasticLord,False,neutral,neutral,negative,neutral
g6uncsi,18dg5823271.q.q67.32644 1A137,1,0,1601216727.0,GURUDAYAL12,False,neutral,neutral,neutral,neutral
g6une2x,This feels me with some pride.,1,0,1601216748.0,reddit_PIKS,False,neutral,neutral,positive,neutral
g6xjnwo,🤣🤣😂😂😂🤣🤣🤣🤣,1,0,1601276590.0,rob_576,False,neutral,neutral,neutral,neutral
g6ybw15,You know it gets really annoying when it comes to other stuff...  I'm fine with educational videos but when you only find indians on other tutorials you search .....,1,0,1601302601.0,StillAWeeb,False,negative,negative,neutral,negative
g732hjg,"And here pronounced an eternal debate.  Literally, there is no end in praising or criticising something.",1,0,1601401476.0,neil024u,False,negative,negative,neutral,negative
g75590s,I'm interested in knowing which particular Indians made you feel so!,1,0,1601440084.0,samkots,False,neutral,neutral,positive,neutral
g75bdr4,Dude some of our countrymen legit build pool houses in a day and most of us just wonder as to where they come from. Not all of us can build pools.,1,0,1601444883.0,Very_Big_Jeni_Tulls,False,negative,neutral,neutral,neutral
g75hzyt,Entao amigo. Eu sei. Owue vc quero fala. Eu fala portuguese Nd mais 11 linguas. Entao vem na minha inbox. Vamos ai gente conversa. Pode ser bom.,1,0,1601451441.0,mithiaman2215,False,neutral,neutral,neutral,neutral
g768lru,"you can literally find like any youtube tut. from quantum computers, nano tech,.... to 5mindesi home remedy (that do mostly nothing),..... Astrological 5G Conspiracy theoryist videos!!!

sadly my family's favourite videos are Later one",1,0,1601475350.0,_Megane-kun,False,neutral,negative,neutral,neutral
g7694j8,Bro india is the only country with no national language...we have over 30 major language with another 1500 local languages..,1,0,1601475637.0,sr_magnum,False,negative,neutral,positive,neutral
g7abcff,Are you guys refering to NPTEL?,1,0,1601561175.0,villkage,False,neutral,neutral,neutral,neutral
g7elfnh,Dhanyawaad ( meaning Thank You). Well there are many International Youtubers whose tutorials have also taught some amazing skills to a lot of people so unko bhi Dhanyawaad.,1,0,1601649186.0,Rukelele_Dixit21,False,positive,positive,positive,positive
g7haawe,"E,1w5is has 2^,3@3#",1,0,1601695544.0,nbhooshan,False,neutral,neutral,neutral,neutral
g7hrkau,"This post officially came from ""How to post a good subreddit"".. click bio for bobs and vegana",1,0,1601708933.0,wickedsage69,False,neutral,neutral,neutral,neutral
g7ij3m2,"AI COBRA VAI FUMAR, REUNITE THE LUSITANIAN PEOPLE!!!!",1,0,1601733896.0,MalujahAsgardia,False,neutral,positive,neutral,neutral
g7ilawn,Good one,1,0,1601735096.0,taxlagtahai,False,positive,positive,positive,positive
g8btwis,Here an Indian guy giving interviews watching canadian iranian Electroboom and Baltimore Knife and Swords vids.,1,0,1602342038.0,fraser0819,False,neutral,neutral,neutral,neutral
g8hmrkn,Aka tech support,1,0,1602426072.0,wonkybrain29,False,neutral,neutral,neutral,neutral
g8hwetk,Yeah we even have youtubers (small kid) who did a tutorial on how to wash underwear and came up on trending (viral).,1,0,1602431759.0,itsmohammedc,False,neutral,neutral,neutral,neutral
gavdkwv,✊🏾,1,0,1604295302.0,,False,positive,neutral,neutral,neutral
g5omwn7,"As an Australian, your cricket team is shit, but your lecturers got me through my studies. 😂",0,0,1600417103.0,HereLiesDickBoy,False,negative,negative,negative,negative
g5o7g8n,everything is ok .. but Indian adult film industry just is the worse ... I can barly watch some good quality videos here,1,0,1600403464.0,,False,negative,negative,neutral,negative
g5o55a5,Someone please make a climate change video for the politicians.,-1,0,1600401877.0,Devansh29,False,neutral,neutral,negative,neutral
