Comment ID,Comment Text,Comment Score,Comment Depth,Created Timestamp,Author,Edited,Semantic Label,Semantic Label 2,Semantic Label 3,Major_Semantic
g5o78hv,"i know the rules bruh ... but. "" in case of emergency press the emoji button"" XDXD",-7,5,1600403312.0,PETWAL8899,False,neutral,neutral,neutral,neutral
g5oaljh,"Well Android calls it a high five emoji while iOS calls it ""prayer hands"" emoji so depends which side you're on",1,5,1600405776.0,Minato_the_legend,False,neutral,neutral,neutral,neutral
g5o73f7,its ok bro no problem  : ),0,5,1600403211.0,PETWAL8899,False,positive,positive,positive,positive
g5onone,"I am not lying i weight like 40 kg and my parents think i will become more healthy if i go and some exercise 
Although i like gaming too and i am introveted and my parents are extroverted so that is a reason as well",5,5,1600417982.0,ChiragVarshney,False,neutral,neutral,neutral,neutral
g5p3ngc,I am fricking serious i am 17 and my weight  it 38,2,5,1600433371.0,ChiragVarshney,False,neutral,neutral,positive,neutral
g5on4b5,Thats the fuckin problem ki rent bharne mei whaat lag jayegi. There are no god damn opportunities here.,2,5,1600417344.0,_blurr_99,False,negative,negative,negative,negative
g5ozjv3,I love how that's enough of an explanation LOL,32,5,1600430388.0,sibs_afro,False,positive,positive,positive,positive
g5pqwq5,Haha 60% is too low a number dude.,22,5,1600445709.0,,False,negative,neutral,negative,negative
g5pqnrm,"No way, surely more than that.",7,5,1600445598.0,howinthebruh,False,neutral,negative,negative,negative
g5od44x,What's the recommended way to ask these questions then?,10,5,1600407758.0,chu-let,False,neutral,neutral,neutral,neutral
g5orgvz,Let's hope,7,5,1600422390.0,penguin_chacha,False,positive,positive,positive,positive
g5ob7w8,[deleted],14,5,1600406250.0,,False,neutral,neutral,negative,neutral
g5ol3rx,"We use red kidney beans and our local Goan choriço (never beef for feijoada, only pork)

Checked out some pics of Brazilian feijoada and it looks way different. But yeah we always eat it along with rice",1,5,1600415123.0,CoroIsMyDaddy,False,neutral,neutral,neutral,neutral
g5o45yh,Yes I am a pewdiepie fan so Ik lmao,-30,5,1600401235.0,Titan-JOck,False,positive,positive,positive,positive
g5qoyug,Thanks for breaking it down for me. Really nice of you.,1,5,1600461944.0,tourist_fake,False,positive,negative,positive,positive
g5p95as,As an Indian I assume u r an Engineer too bro,3,5,1600436754.0,DaRKTHoR000999,False,neutral,neutral,neutral,neutral
g5oki18,"In retrospect, I think I did. Unironically can you explain the joke?",2,5,1600414485.0,,False,neutral,neutral,neutral,neutral
g5od0bc,I wish I could say the same lol but thanks xD,30,6,1600407670.0,suyashve,False,positive,positive,positive,positive
g980ave,Bsdiwalo yaahan mahan ban rhe ho?,1,6,1603029983.0,,False,neutral,neutral,negative,neutral
g7aeoel,I am from Maharashtra and i messed up badly... Lol,2,6,1601562727.0,Curious_Guarantee_51,False,negative,negative,negative,negative
gduap7n,"Dude, I am a malayali.. you've got it wrong.",1,6,1606543031.0,,False,negative,negative,negative,negative
g76f6m5,[removed],1,6,1601478787.0,,False,neutral,neutral,negative,neutral
g5ogz7q,Thank you for your love. I know Daniya is a Tamil word.,1,6,1600411061.0,zenmasterhere,False,positive,positive,positive,positive
g5oc9jb,Not knowing Dhanyavad was major plot twist in a Tamil movie. I do not recall its name. It takes place in Russia. So initially the protagonist thinks it is russian :). So I believe your comment is completely factual :),16,6,1600407070.0,telecontor,False,neutral,positive,neutral,neutral
g5osujo,Agree with you,1,6,1600423949.0,Harish7778,False,neutral,positive,positive,positive
gq6y5g8,"Sure, but the majority do. If not, there are variations of namaste in itself. I'm not saying that it's the only greeting, far from it, but people know of it.",1,6,1615193442.0,altair222,False,neutral,neutral,neutral,neutral
g5swfnv,"Thank you for reiterating my view. It's unfortunate that we need to use a ""foreign"" language to achieve ""a union of states for economic and military benefits"".",1,6,1600512449.0,zxasdfx,False,negative,neutral,neutral,neutral
g5ofexa,We have many languages as national or official languages but as our capital speaks mostly hindi so some believe it's our national languages. For official work the government uses English. Basically my point is everybody knows what namaste means I am just bad at explaining LOL,2,6,1600409685.0,ssjssdoraemon,False,neutral,neutral,negative,neutral
g5od3p1,"> least you guys could do

Doesn't sound like nice and friendly",1,6,1600407747.0,zxasdfx,False,negative,negative,neutral,negative
g5o7m2u,Oof,0,6,1600403576.0,dipanshu6,False,neutral,neutral,positive,neutral
g5pfwa5,"ah i feel you bruh, being an intro and having extroverted parents >_<",3,6,1600440424.0,,False,neutral,negative,neutral,neutral
g5yjikd,"40 kg, lol i have 40 kg to lose damn. you must be a school kid or something. if youre 5'8"" you should be atleast 60-65 kgs.  you can gain weight easily, just eat protein rich foods (milk, eggs, chicken, soya chunks) that you like. for anyone to gain or lose weight  protein is must. people who lose weight reduce their carb intake but you should increase your carbs ex rice, rotis etc. since your young, im sure your parents will allow you to play any sport. its better to start early than regret later in life. youll thank me later.",1,6,1600597262.0,SuggehSai,False,neutral,neutral,positive,neutral
g5p4d2r,[deleted],1,6,1600433842.0,,False,neutral,neutral,negative,neutral
g5quj0m,"Try weight lifting.

It encourages bone thickness, as well as muscle growth.

You don't have to be olympic level to see benefits. A far less intense program with far more modest results is still going to help you be a little bigger.",1,6,1600464459.0,twintailcookies,False,positive,positive,positive,positive
g5opkpk,"Opportunity creator banna padega, ban paoge?
Yahi samasya hai, parents want opportunities not opportunity creators, only if they had a broader mindset..there'd be more creativity, job security and freedom in the society",2,6,1600420186.0,trashfacedfuck,False,neutral,neutral,neutral,neutral
g5prezo,I was just being optimistic. Nevertheless only solidifies the initial point,6,6,1600445932.0,VivDso69,False,neutral,neutral,positive,neutral
g5ojl60,"""I don't understand xyz""

""I have a problem with xyz""",10,6,1600413539.0,DarkStar0129,False,negative,negative,negative,negative
g5poe39,"""I had a question about what you said"".",2,6,1600444609.0,ksharanam,False,neutral,neutral,neutral,neutral
g5obdpm,Ouch. XD,3,6,1600406376.0,VoldyPoldy,False,negative,neutral,negative,negative
g5pl43l,"As an Indian, i have been forced to take science stream in 11th 😭😂",3,6,1600443042.0,vishakhaisweird,False,neutral,neutral,neutral,neutral
g5plaa2,"As an Indian
No bro I am still in school",1,6,1600443127.0,randomuser420_69,False,neutral,neutral,negative,neutral
g5okqof,Aryan supremacy is a theory propagated by the Nazis. The Nazis are considered the most evil people in the world.,5,6,1600414734.0,supermatt234,False,negative,negative,negative,negative
g98bu90,Yes,1,7,1603036267.0,ravoili_ravioli,False,positive,positive,neutral,positive
g7aeqw3,Lol,1,7,1601562759.0,i_will_be_king_3000,False,neutral,positive,neutral,neutral
ge5e9nk,"For now, I'll just say ""Namaste"" everywhere.",1,7,1606746169.0,DonutLord23,False,neutral,neutral,negative,neutral
g79s0xu,Wtf? Just because I don’t need your language we are rude and pathetic? Fuck you and your fucking Hindi asshole. Go fuck yourselves!,1,7,1601546352.0,sonicmissile,False,negative,negative,negative,negative
g5ofm8x,"Shukriya was an interesting part in one Malayalam movie  - Niram. They have a song with that as well. In that, a character thought it's the word for "" I love you""",13,7,1600409863.0,quicktry,False,positive,positive,positive,positive
g5p6v6v,I think we are talking about the movie Dhaam dhoom.,3,7,1600435424.0,Historical_Bat9392,False,neutral,neutral,neutral,neutral
g6jazl5,Let me know if this is the movie you're talking about. https://m.imdb.com/title/tt1388434/,1,7,1601042899.0,prashanthvsdvn,False,neutral,neutral,neutral,neutral
g5swvrl,"I don't know about the unfortunate part since it's fortunate that we chose english over some other language which would be pretty dumb. It's the language of science. So you would have people learn the language irrespective of their own tongue even where there isn't a need for a common tongue. 

For example it would be dumb to choose a language other than English. Example: Indonesia chose malay which is pretty dumb 'cause now they have to learn English, for its economic benefits, together with malay and their mother tongue (which they may stop learning). This could potentially wipe out their local languages in the longer run.",1,7,1600512939.0,,False,neutral,negative,neutral,neutral
g5og9s0,"No worries there, mate. ... and you conveyed your point very well and I totally agree with you. Hindi earns more brownie points in India any point of time. More power to you",1,7,1600410437.0,quicktry,False,positive,positive,positive,positive
g5p7cjo,It is not like i am not trying but my body just don't  want to gain weight me and my sister have same diet but she has more weight then me for no reason and there is only one year difference  in us,2,7,1600435706.0,ChiragVarshney,False,negative,negative,negative,negative
g5pjhq8,To my Indian ears that sounds a little aggressive.,5,7,1600442242.0,alannair,False,negative,negative,positive,negative
g5plb9u,Not forced but same,2,7,1600443141.0,randomuser420_69,False,neutral,neutral,positive,neutral
g5pneuq,Same bruh now years after that i became an engineer and then after some failed attempts for getting govt job I'm now doing the things I love....,1,7,1600444169.0,DaRKTHoR000999,False,positive,positive,positive,positive
g5ol4bu,"Oh, you meant that Aryans. I assumed you were speaking about the North Indians considering themselves superior because they're Aryans as per the Aryan Migration theory.",1,7,1600415140.0,,False,neutral,neutral,neutral,neutral
g5toeeo,"The unfortunate part is the ""foreign"" part. We have so much dissent and pushback for our own languages that we need to use a ""foreign"" language to unify us!!!",1,8,1600528642.0,zxasdfx,False,negative,negative,negative,negative
g5p92na,[deleted],1,8,1600436713.0,,False,neutral,neutral,negative,neutral
g5pno0i,Same.,2,8,1600444286.0,DarkStar0129,False,neutral,neutral,neutral,neutral
g5pohhe,Yeah that's because it *is* aggressive. See my other response for a different example sentence.,1,8,1600444649.0,ksharanam,False,negative,negative,neutral,negative
g5pwwzx,I am not sure if I understood that correctly.,1,8,1600448361.0,shhhhhhhhhh,False,negative,neutral,neutral,neutral
g5p9zpt,I have done it many times it just doesn't  dosen't  work my body just don't  want to gain weight and as for my mental health i am happy and healthy i am fine physically  as well it is just i am not fat enough,2,9,1600437229.0,ChiragVarshney,False,negative,neutral,neutral,neutral
