Comment ID,Comment Text,Comment Score,Comment Depth,Created Timestamp,Author,Edited,Semantic Label,Semantic Label 2,Semantic Label 3,Major_Semantic
gtl3miw,The whole scam is in their refund guarantee.They have to act like a teacher for the refund period. The child is told that they will get a tab. The child guilts his parents about getting the tab for education purposes which he will use for online gaming. They are not selling education. They are selling refurbished tab for 10 times markup,335,0,1617726679.0,SnooFoxes2411,False,negative,negative,negative,negative
gtkyvi4,"Bought a 3 year thingy from them when i was moving to class 10th. Recorded videos from 10th were decent but 11th and 12th videos are just trash. I haven’t used it in a year. Mentors are basically only for logistical stuff and communications. We were told mentors would help with doubts. That was a lie. Some videos are really crappy and just have a guy solving some problems on paper with trash audio quality. 

I payed 50k for the 3 year course and the tab. Have heard people are paying lakhs/year now. Biggest scam of the decade.",807,0,1617724612.0,piewala,False,negative,negative,negative,negative
gtkuvku,"Think of the long-term psychological impact this guilt could leave on the kid. And why are these BYJU's subscriptions are for multiple years? If their product is any good, make it monthly. Imagine paying for Netflix for multiple years at once and once payment is done, you CAN NOT cancel the subscription.  Then would they give any good movies/services?

Byjus now sell up to 6 years of course at once, earlier they even used to sell directly for 10 years!

This is just the tip of the iceberg, this issue of Byjus is way bigger. And again, the ENTIRE MEDIA is silent like nothing is happening at all.

If anyone of you or your known is trying to get a refund from Byjus, feel free to contact me, will do everything possible to get your money back.

UPDATE (3:00 am): Byjus took down this kid's profile.",908,0,1617722848.0,pooniahigh,1617745081.0,negative,negative,negative,negative
gtl41m7,Fuck BYJUs,315,0,1617726862.0,predicamental,False,negative,negative,negative,negative
gtkzdip,Well can't his parents approach Bank and cancel EMI ? If they had paid with Credit Card.,138,0,1617724831.0,,False,neutral,neutral,neutral,neutral
gtl5s7u,"Everyone use [www.khanacademy.org](https://www.khanacademy.org)

completely free and the creator Salman Khan (not selmon boi) is a bong 

please donate if you get the chance to do so",348,0,1617727618.0,,False,neutral,positive,positive,positive
gtl7fa3,"BYJU owns Aakash, WhiteHat Jr., Meritnation etc. and they're literal pieces of shit, making money out of people.",80,0,1617728316.0,nefariousbuddha,False,negative,negative,negative,negative
gtkymct,4000 Rs EMI. It's fucking debt trap.,192,0,1617724502.0,beard__hunter,False,negative,negative,negative,negative
gtl52pc,The B in Byjus stands for BHADVA,115,0,1617727310.0,BadSkinGoBrr,False,neutral,neutral,neutral,neutral
gtl3y3m,I can understand that...back then my parents also bought that same package and all was gud for a month or so after which it started getting worse and worse....it was just like they were not solving my problems but increasing them and when we asked the costumer care that we want to discontinue they said that there will be no refund after which i stopped watching those videos....now its been a year and a half sice we bought it and now also the mentor calls to know why am i not watching the videos...afterall the outcome is dont buy byjus its just waste of money which many parents dont understand and fall right into the trapof such companies..,54,0,1617726820.0,_GraFFiti_0,False,negative,negative,negative,negative
gtl9pik,"BYJU will probably be the shittiest and most toxic thing that will ever happen to India and Indian education. They had the opportunity to revolutionize our education system and bridge the education and digital gap in our country. Rather, they are utilizing every opportunity to capitalize on the broken system for their own profits. They're really not different from the very coaching institutes they say they're different from. Fucking guilt shaming parents and students on missing out on the 'big thing' or 'future CEO', making parents give up their savings so that their child can get 'quality education'. How is it not a scam? 

BYJU, White hat, and similar other 'Ed Tech' companies are all nothing but profit mongerers and I hope people, especially the younger generation, comes to senses quickly and wipe them out of this fucking business.",49,0,1617729309.0,POI_Mr_Singh,False,negative,negative,negative,negative
gtkupc8,Coulda done a better job hiding the school tho.,91,0,1617722770.0,Param_Stone,False,negative,negative,neutral,negative
gtl667s,"Indian parents, in general, are really gullible when it comes to their children's education. Especially the middle class spectrum. 

These kids will probably blame themselves their whole life for putting their parents through this misery.",91,0,1617727782.0,OverratedDataScience,1617736532.0,negative,negative,negative,negative
gtl6zgt,"in the era of youtube, khanacedmy and many others  talented, smart people who share their knowledge at free of cost then why people still buy this shitty app subscription?",41,0,1617728126.0,_alienmusk,False,negative,negative,positive,negative
gtm9nc1,UPDATE (3:00 am): Byjus took down this kid's profile.,36,0,1617745090.0,pooniahigh,False,neutral,negative,neutral,neutral
gtl7xcx,Wtf 53k for 9th and 10th! Bruh my gate applied course costs 31k for 2 years.,28,0,1617728532.0,0range_mask,False,negative,negative,negative,negative
gtl8rrv,[deleted],48,0,1617728899.0,,False,neutral,neutral,negative,neutral
gtl46bb,my friend had same issue with topper. Now he is about failing the exams,24,0,1617726919.0,Big_Cap_6139,False,negative,negative,negative,negative
gtl4qb8,It's a shame that when it comes to startups in India these are the names that are popular.,45,0,1617727159.0,Oldpotato_I,False,negative,negative,negative,negative
gtl3vod,I read byjus bought akash institute.. Guess where the money is coming from,57,0,1617726791.0,dpaak7,False,neutral,neutral,neutral,neutral
gtl5qya,"Idk about this but we had a random byjus worker come to our house for the demo trial and when we were not interested for it the guy said that he has to sit there for 30 mins and do the full intro cuz if they leave early their uber car timing will be seen and he will get scolded by his boss why he left early on the appointment   
actually we were not intrested cuz it was very costly and i was not sure to put in the time for the byjus thing cuz i was already going to allen which was far bore better than this",40,0,1617727602.0,,False,negative,negative,negative,negative
gtl9waq,Try to screw Byjus with https://consumerhelpline.gov.in and post the result,19,0,1617729390.0,phony_gridha_mallik,False,negative,negative,neutral,negative
gtl6xh1,Ye Poonia inn logo ko chhodega nahi.,18,0,1617728103.0,srijeet_patil,False,neutral,neutral,neutral,neutral
gtl4sc2,Sir Todd saaale byju wale kaa...,14,0,1617727183.0,fr3akonomic,False,neutral,neutral,neutral,neutral
gtlfj22,Is khan academy not a good option for Indian syllabus? It is free after all,15,0,1617731833.0,pattonyoda,False,neutral,neutral,neutral,neutral
gtl6g90,[removed],14,0,1617727899.0,,False,neutral,neutral,negative,neutral
gtl63xg,All Online courses are shit.. Best option are free YouTube tutorials.,13,0,1617727755.0,iro9man,False,negative,negative,neutral,negative
gtl8uvz,"My parents we're broke ass back then. They absolutely could not afford this 50k classes. This was when Byjus had launched this plan or something, one dumbass actually called my mom and tried to sell their shit. My mom said we are interested and I didn't know why she said evan tho we broke back then, but eventually it did. She said tht guy had said about some trial classes worth 4k that gives me a android tablet and 2 memory cards of 32 gigs. And beleive it or not mom actually did some research of how much these were worth on Amazon and as it comes out it was tab was alone worth 5k lol. 
I still remember when the dhl guy dropped of the package. There was a booklet , some stickers, and a fucking Lotte choko pie in it ,inside a seo hope , tht I din know y the fck . My mom picked up the tab , she had this big smirk on her. She was a fucking genius. We watched movies on tht together lol",25,0,1617728938.0,,False,negative,negative,negative,negative
gtl9lm4,PSA if you're in 11th or 12th just study from PhysicsWallah on YT or his app. Much better than this byju BS,13,0,1617729262.0,AlkalinePotato,False,positive,neutral,positive,positive
gtlggl6,"All said, it’s the counsellor that scammed them, Byjus might have mentioned this in their T & C, which people don’t know or don’t care. Byjus would easily avoid law suite for this. Investing 50k and not reading SLA is the problem here. The counsellor got his/her commission and pretty much doesn’t care about the effected family.",12,0,1617732234.0,1piece_forever,1617740650.0,negative,negative,negative,negative
gtl9bni,If this goes viral..that unicorn will sell corn,10,0,1617729140.0,,False,neutral,neutral,neutral,neutral
gtlhm23,"The problem with indian parenting(sorry,if i am offending anyone) is they just watch a bollywood junkie doing ad nd everything get solved, so far, saved many families from this trap.
For students nd parents, online learning is a good addition to conventional methods, dont assume it is superior than others,its just a trend.
try to goto consumer court, they will favor you.",12,0,1617732741.0,cdbd69,False,negative,neutral,neutral,neutral
gtl62t5,"Bruh. I scored one over byjus.  
.
.
.
.

-They came.     
-Gave tab as a trail for 1 month.    
-We gave them a check of 10k.      
-They told if I still don't want the tab after 1 month I can return it and the check will be given back.    
-Went to return.    
-Told me I have to return it myself.    
-Called the number they gave me.    
-Picked and they gave another number to call.    
-Called the other number they said they'll call back with the address to send the tab to.     
-Never called back.    
-I called them.    
-They told they'd call back.    
-Never called back.    
-I tried calling them again.    
-They didn't pick up.    
-Got a free tab.    
-Typing this from that very tab (FACT).    
-Got an instrument box as a gift on my birthday. (Thank you byju bro).      
ps if somebody from byjus reading this, feel free to call us and pick up the tab. peace out.        
Edit: They didn't cash the cheque, I got the check back.",47,0,1617727742.0,streetbrown,1617737638.0,neutral,neutral,neutral,neutral
gtl4u80,"class action lawsuit maybe ?  there have been numerous cases of byjus and whitehat jr defrauding consumers, high time the victims come together.",21,0,1617727206.0,ichbindoge,False,negative,negative,negative,negative
gtl7ti5,"I am really sorry to hear what you and your parents are going through. Why don't you file a criminal case of cheating and fraud against them? You definitely have a strong cause. I am telling you, you are going to win this and get a huge compensation.",10,0,1617728484.0,Recent-Enthusiasm,False,negative,neutral,negative,negative
gtl87r8,"If someone paid by credit card, one way to resolve this sort of misrepresentation is to attempt a credit card chargeback. Reach out to one's bank, and explain that you were fraudulently pulled into a transaction that is not being fulfilled. The bank is obligated to have the merchant provide evidence and you are entitled to counter this as well.

Its a feature few know about, but should be more aggressive about using.",10,0,1617728657.0,boringhistoryfan,False,neutral,neutral,neutral,neutral
gtlhjzj,"Damn thank god.  Im in 12th now , i scored very low in 11th due to my laziness during covid lockdowns i had to skip chapters and didnt had any tuition.
I was thinking of alternative ways to study 12th , BYJU is not in my mind anymore.",10,0,1617732716.0,kevin997131,False,negative,neutral,neutral,neutral
gtlho4b,"Byjus is soo trash man, now they even bought akash tutors. I don't what to say. News don't cover their guilts, no one in Indian society is aware of how trash byjus and it's all because no awareness. My relatives bought byjus  
Package for my little cousin who is in 6th and now they realise how bad it was. I told them about all the scams and story about our hero Pradeep ponia. I really think we should make close ones aware about this byjus real soon and stop them from expanding.",9,0,1617732767.0,koopa__troopa787,False,negative,negative,negative,negative
gtlktnj,I'm a victim of Byjus too. Paid 50K for a CAT course which was a tab with very outdated videos and no proper Mentor Support . Initially I had so much expectations and I thought I would be able to clear CAT by studying their material. As I was in a remote town I had no access to TIME or IMS then . So I chose Byjus as I believed it provided Online education and good personal mentor support. I was totally shattered after I began using it . The videos were pathetic and outdated and provided no clarity to concepts and there was no proper mentor support to clear my doubts. Still I tried to make maximum use of the material and tried learning sincerely for a whole month. But The material was simply of no use. Even a 300 Rs Arun Sharma book was way way better and very updated than this. It scarred me so much that I totally lost interest in CAT.,9,0,1617734158.0,realkoolkrish,False,negative,negative,negative,negative
gtl4pef,Fucking scam,9,0,1617727148.0,ALESTA1,False,negative,negative,negative,negative
gtl6egz,"Share this, Byju's entire network including WhiteHatJr. is scamming the shit out of Indian students",8,0,1617727879.0,HighRiseHomie,False,negative,negative,negative,negative
gtl4m2p,Man BYJUs is a dumbass,22,0,1617727108.0,Cali_Spidey,1619602414.0,negative,negative,negative,negative
gtl6dnc,"Side note, this teen will have a hell of a LinkedIn page in the next decade. The style of writing this entire post is rather.... grown up.

While it's not exactly wrong, i hazard a guess the parent wrote this on the child's behalf / page?

Not questioning you Poonia bhai, you keep fighting your good fight!",17,0,1617727869.0,vyrusrama,False,neutral,neutral,neutral,neutral
gtlcla8,"I am 14 (class 9th) and my parents bought me a package for 1 year even when I told them I didn't want it but they still bought it and the result was as expected. when we bought the package the counselor told us that the teachers will help 24/7 with my doubts and solve any questions I had.  the videos were plain garbage trashy mic, quality sometimes the videos won't even load.  I didn't acquire any knowledge from it a waste of time and money",16,0,1617730561.0,Majestic_Display5015,1617768758.0,negative,negative,negative,negative
gtl7sq2,He added please as if they care,8,0,1617728475.0,jangirakah,False,neutral,neutral,positive,neutral
gtl80ce,"Education should be free, ghor kalyug chal raha hai.",8,0,1617728569.0,icemansan,False,neutral,neutral,neutral,neutral
gtlawqy,Corporate greed will ruin this country education. Fuck byju,7,0,1617729830.0,prtkmantri89,False,negative,negative,negative,negative
gtleu5t,I don't hear any good reviews about byjus anymore.,7,0,1617731532.0,straightdge,False,negative,negative,negative,negative
gtlmhip,"the only thing i want to say to 9s, 10s, 11s, 12s.....dont get a tutor or a subscription to some websites......buy books.....construct your own concept.....spend time challenging your concept not on some website telling you why electrons move that way....because you will need this in your college....and.....dimt do this juslt before exam....do. it 4 to 5 month before exams....",6,0,1617734893.0,lemon_jump,False,neutral,neutral,neutral,neutral
gtlmq1r,I would rather buy my children lots of books or donate to poor children than give a single paisa to BYJU scum.,7,0,1617734997.0,Escudo777,False,negative,negative,negative,negative
gtn5kvj,Asshole square + bitch square = cunt square = byjus,6,0,1617761229.0,soup-andmoresoup,False,negative,negative,negative,negative
gtlc5pz,Byju’s ripping money from people and spending it on Indian cricket team.,13,0,1617730372.0,jamienexon,False,negative,negative,negative,negative
gtl6onr,Change your card number and let them keep asking for money.,6,0,1617727999.0,,False,neutral,negative,neutral,neutral
gtl7345,put the complain on PM window.,6,0,1617728169.0,Errorstotlle,False,neutral,neutral,negative,neutral
gtlc4b6,"And for a reality check, here you go: (there are many more connecting dots which reek of corruption till the top echelons of a certain political party, a short google search should suffice)

https://www.moneycontrol.com/news/business/ipo/byjus-plans-to-go-public-in-18-24-months-founder-raveendran-6734061.html",7,0,1617730355.0,jonstewartrulz,False,negative,negative,negative,negative
gtlhv66,"You should file a complaint at 
[https://www.consumerhelpline.gov.in](https://www.consumerhelpline.gov.in)
They take each case seriously and take it to a resolution.",5,0,1617732853.0,LastWatch9,False,neutral,neutral,positive,neutral
gtlxb9n,"Am an NRI and bought BYJU's for upto twelfth. I got qualified for a quiz and thus won a ""counselling"" session. Then we were treated to a huge speech by Byju himself on how he passed CAT twice 100%. There the agent convinced my parents to get it until tenth. It was kinda useful in the early days but later on it was just repeating stuff I had figured out for myself. So they gave out this shitty quality tab with SD cards every year for the lessons. Surprise, surprise, the tab stopped functioning, and then the card was transferred to a phone. It got wiped when we forgot to take it out when purging it. Turns out they don't give extras, so the agent just told ud to get the shitty online version instead, which isn't fast and the software is buggy af. Anyway it wasn't really helpful, and my parents consider it a huge waste of money. I had been getting, and still get very good grades. Don't fall for it. There's so many silent psychological tricks, like telling you how big of a deal Byju is, and that really... to this day, we're shocked that we decided to spend that much money on that shit. It really is sad seeing a corporation bait the fears of parents and students on the fear of failing. Fuck BYJU's. Although it may have not affected me financially, it has done so for so many else. Shitty corporate.",7,0,1617739581.0,enhawk_,False,positive,neutral,negative,neutral
gtl9p6i,When will these parents learn not to get scammed by these fucking corporates,11,0,1617729305.0,-Diplo,False,negative,negative,negative,negative
gtl3fod,Is this fuckin linked in?,16,0,1617726597.0,shivam4321,False,negative,negative,negative,negative
gtlb5tg,Fuck these damn bastards,4,0,1617729941.0,ninjaflyingarts,False,negative,negative,negative,negative
gtlcq6n,This is how they make profit,4,0,1617730620.0,73g10N,False,neutral,negative,neutral,neutral
gtlkek1,"God I feel for this kid so much, Fiitjee and other coaching gave me so much stress for the two years I attended.",5,0,1617733974.0,silver-stream1706,False,negative,negative,negative,negative
gtlycox,"Well, isn't BYJU a big sponsor of Indian cricket? The money spent on them helps Indian cricket. /s",4,0,1617740034.0,arnott,False,neutral,positive,neutral,neutral
gtm5k9f,"Remember Team India wears the jersey with Byju written in bold.

It shows the state of fair, overpromises and overall bad delivery. Like Modi.

When India wore jerseys with Sahara, we had the corrupt Congress. Like Subroto, corrupt.",5,0,1617743190.0,decipherseattle,False,negative,negative,negative,negative
gtl4svj,"BYJU's and white hat junior are fucking scams, don't waste your money on such shit",9,0,1617727190.0,,False,negative,negative,negative,negative
gtl5mth,Same with Toppr don't buy this shit,7,0,1617727552.0,marvelwalker,False,negative,negative,negative,negative
gtldln9,This shit is like Kota IIT coaching from my school days.,7,0,1617731003.0,saiborg7,False,negative,negative,negative,negative
gtliz46,Byju's is the official sponsor of the Indian Cricket Team. Every single International Indian cricketer is indirectly promoting this company.,8,0,1617733343.0,Hollywoostarsand,False,neutral,positive,neutral,neutral
gtlir0w,Someone fuking tl;dr this shit please,4,0,1617733244.0,bruh-KO9,False,negative,negative,negative,negative
gtlk57j,Meanwhile they just acquired Aakash lmao,3,0,1617733858.0,no_cap23,False,neutral,neutral,neutral,neutral
gtlka6f,Khan Academy > any other learning platform online.,4,0,1617733920.0,LackDeJurane,False,neutral,positive,neutral,neutral
gtlkgzv,"This is bound to happen. From a business point of view, the amount of advertisements, sponsorships and brand ambassadors that we see today, it's quite clear that BYJUs is spending A LOT of it's capital. In order to make profit or to even reach a break-even point, the company has to push aggressively in sales (those harassed salesmen audio recordings are ample proof) and revenue generation. It's very likely that they won't be refunding or returning a part of the customer's money.

Education or whatever, at the end of the day BYJUs is a business nonetheless that works with the sole aim of making profit.",3,0,1617734004.0,atanew,1617734224.0,negative,neutral,neutral,neutral
gtlroqp,Let a us take a moment and bow to the LEGEN-WAIT...FUCKING-DARY Khan Baba,3,0,1617737199.0,raghubeer123,False,negative,positive,negative,negative
gtlu8v1,"Don't you think that a lot of this is also made possible with somebody like SRK being their brand ambassador?  Isn't it ridiculous that somebody who has the resources he does should be mindful of their impact? Believe it or not, a lot of people are influenced by the ad campaign, else Byju's wouldn't be making new campaigns with him. He is an expensive resource.
It's strange to me that he hasn't been called out enough for it. Him stepping down would also make quite some noise. 
Same stands true for Hrithik and White hat Jr.",3,0,1617738276.0,_freddy_kreuger,False,negative,neutral,neutral,neutral
gtm31qj,Consumer court?,5,0,1617742079.0,doorpopper,False,neutral,neutral,neutral,neutral
gtmah2r,Why are 14yr olds on LinkedIn now?😯,5,0,1617745483.0,OutlandishnessRough3,False,negative,negative,neutral,negative
gtmy9in,Buju's and white hat Jr are the biggest scams of India in the name of learning,4,0,1617757498.0,shashank_yadav,False,negative,negative,negative,negative
gtn8ezg,"I once had a thought of buying byjus when I was in tenth grade, I'm glad I didn't. I've referenced the byjus website a million times since then for certain answers, and I'm telling you they just OVERCOMPLICATE _extremely_ simple stuff and even at times put in random bullshit not directly related to the topic so as to make the article look bigger.",5,0,1617762756.0,jon_t_fr,False,negative,negative,negative,negative
gtl8zsz,Can a good hacker from India attack these trash companies like byju and white hat jr. Taking some commission and refunding rest of the amount,8,0,1617728997.0,qlast65,False,negative,negative,negative,negative
gtlhgls,Fkn pathetic,3,0,1617732674.0,Samiwcrazy10,False,negative,negative,negative,negative
gtlia5m,All i think after seeing all the bijyus scandals is that coding shouldn't be mainstream every mainstream thing in india just becomes shit all they want is money ahh,3,0,1617733038.0,,False,negative,negative,negative,negative
gtln5iv,Bhai sab log byju chodo. Phaltu hai ye,3,0,1617735187.0,helloiamApandey2001,False,neutral,neutral,neutral,neutral
gtlns7p,People still fallin for Byjus and stuff????!!,3,0,1617735467.0,The_suspect69,False,negative,negative,neutral,negative
gtlnt2j,LinkedIn it,3,0,1617735478.0,After-Ad-4352,False,neutral,neutral,neutral,neutral
gtlo5an,There are many flaws of our Indian education system ([excellent book](https://www.amazon.in/dp/B07F3XJ2B7) & [video](https://www.youtube.com/watch?v=XQ0CG-HlvD0)) and BYJU's is adding to fire,3,0,1617735627.0,xelnagatower,False,negative,negative,negative,negative
gtlpfev,"I'm new to complaints and such things but can we go to court over this ? and we can win,

unless there's some terms and condition that prevents refund after some time, Even if something like that is there, Is it really fair? Is there no way to get over this?",3,0,1617736204.0,VISUALBEAUTYPLZ,False,negative,negative,neutral,negative
gtlv5wf,[removed],3,0,1617738660.0,,False,neutral,neutral,negative,neutral
gtm6yp8,[removed],3,0,1617743832.0,,False,neutral,neutral,negative,neutral
gtm6zfg,Did byjus course for year when I was in tenth back in 2014 they gave us all the tablet which I unlocked it as a normal tab and started downloading porn in it lmao,3,0,1617743842.0,,False,neutral,neutral,neutral,neutral
gtma371,"They a e not going away anytime soon,they just bought another giant in the industry. There should be stricter laws against these kinds of exploitation",3,0,1617745297.0,soHAam05,False,negative,negative,negative,negative
gtmax6s, UPDATE (3:00 am): Byjus took down this kid's profile. (LinkedIn profile),3,0,1617745696.0,pooniahigh,1617746791.0,neutral,negative,neutral,neutral
gtmbsdd,This is why I am building a free platform for learning and collaborating. Enough of these disgusting companies.,3,0,1617746110.0,,False,negative,negative,negative,negative
gtmfk5q,"If the policy of 15 days had been present onto the signing doca, then its hard to force for refund, but a class action suit can still work if more people sue them on the same groud of faulty and misleading product",3,0,1617747979.0,Nightpac,False,negative,negative,negative,negative
gtmn01u,"Lol I honestly wonder how it became so big? Who saw the ad of the guy cutting a square into triangles and thought, “yup that’s what’s gonna help me learn.”",3,0,1617751732.0,masalion,False,neutral,neutral,neutral,neutral
