Comment ID,Comment Text,Comment Score,Comment Depth,Created Timestamp,Author,Edited,Semantic Label,Semantic Label 2,Semantic Label 3,Major_Semantic
gtlipae,"Yup.. That could work too. No need to exaggerate though. Things like these can easily end up in courts, and that exaggeration part can then take you down. We already have huge number of such cases where people have expressed concerns regarding their business practices. Just a summary of those in a concise message should get things going. Then, it builds upon itself. We just need a catalogue of such cases.",17,3,1617733223.0,freakynit,False,neutral,neutral,neutral,neutral
gtnr7wh,"better add some facts and points, parents would not forget to emphasize them every time they share.",2,3,1617775267.0,Chance_Midnight,False,neutral,neutral,positive,neutral
gtli7oy,"Yup.. Proofs surely would be needed, but they need not be shown publicly. Original names can be hidden too. There are forums such as consumer complaints, but I guess we all know how they work out.",5,3,1617733007.0,freakynit,False,neutral,neutral,neutral,neutral
gtnlkmu,"People generally associate money with quality. Free stuff is regarded as inferior. Precisely the reason sites likes udemy makes millions despite khanacademy being present for longer. The courses should be paid, the earning margins should be thin. That's the hit point. Even better would be tie ups with reputed institutions. Certificate issuance would be a nice addon.",3,3,1617770852.0,freakynit,False,negative,neutral,negative,negative
gtnjqxv,Exactly what I mean,3,3,1617769594.0,D_chiller,False,neutral,neutral,neutral,neutral
gtnvnb9,"Lol BBCI isnt going to remove them as sponsors , they are money hungry .",3,3,1617779129.0,RandomRedditor1405,False,negative,negative,neutral,negative
gtm6sll,My cousin enrolled her 2nd standard daughter into whitehat programming lessons. Not sure if that’s good or bad since the mother did say her kid enjoys it.,47,3,1617743754.0,codehawk64,False,neutral,neutral,positive,neutral
gtnkg41,Also khan academy,5,3,1617770074.0,,False,neutral,neutral,neutral,neutral
gtn61pw,They along with vedantu compete with my friends for who calls me the most.,26,3,1617761480.0,,False,neutral,neutral,positive,neutral
gto5tqb,and themselves,4,3,1617789064.0,LiberalCouchPotato,False,neutral,neutral,neutral,neutral
gtnjc18,"Yup bought for 1Billion USD
Biggest acquisition in byjus  history",4,3,1617769315.0,Beast_Mstr_64,False,positive,positive,neutral,positive
gtl7dby,Upgrad will do that part for higher education,25,3,1617728292.0,SnooFoxes2411,1617729360.0,neutral,neutral,neutral,neutral
gtlgumo,"Few reasons. Primarily it will be cheaper. 

Secondly, they know your capacity to repay and that’s the credit limit, irrespective of what you spend on. 
When it comes to education, it depends on their assessment whether you can secure a decent job after it. 

Then there are things like the interest being higher than an educational loan. It’s practically like taking out a personal loan with the years of trust you’ve gathered with CIBIL or Experian.",12,3,1617732402.0,LastWatch9,False,neutral,neutral,neutral,neutral
gtl7r9y,">educational loan even after getting admission in a reputable institution and they will make you cross the seven seas to submit an application.

Because educational loans are way larger in amount compared to shitty small loans... hence higher risk for banks.

Having said that, at least for tier-1 institutes, you get educational loans quite easily... speaking from personal experience.",28,3,1617728458.0,Gideon_Nomad,False,negative,negative,neutral,negative
gugrwy8,The phoren tour bs is the worst,1,3,1618387488.0,ObservantMagic,False,negative,negative,negative,negative
gtnaw3j,"The Ball Poem.. cbse class 10, anyone?",12,3,1617764121.0,eirathicc,False,neutral,neutral,neutral,neutral
gtork2b,"His family is from Bangladesh and he was born in a Southern US state that borders the gulf coast called 'Louisiana.' 

If you don't know the difference between a person of Bangladeshi descent and someone actually *from* Bangladesh, then I guess you need to watch more Khan Academy videos on sociology.",1,3,1617803288.0,CarbonTail,False,neutral,neutral,neutral,neutral
gtns1tw,They meant Disney collaborated with Byjus's,9,3,1617775971.0,,False,neutral,neutral,neutral,neutral
gtl9xbw,Similar to how loan app gundas threaten,75,3,1617729402.0,SnooFoxes2411,False,neutral,negative,negative,negative
gtly1d1,I wouldn't expect any less... There's little protections in India for the hapless consumer,25,3,1617739894.0,gigibuffoon,False,negative,negative,neutral,negative
gtlshy7,Excuse me what!!! I dont believe it. Borderline impossible... WHATT,24,3,1617737543.0,AK47_Sushant,False,negative,negative,negative,negative
gtmyj9c,And they didn't lodge any FIR because?,3,3,1617757633.0,,False,negative,negative,neutral,negative
gtnier9,Pooniaji aapko bhi pareshan karte hain kya ye log aise?,2,3,1617768695.0,Chuttad_rao,False,neutral,neutral,positive,neutral
gtnt9al,But hasn't bank already paid byjus the amount in full?,2,3,1617777009.0,Chance_Midnight,False,neutral,neutral,neutral,neutral
gtm7ao2,JEE wale classes. Byju's ne acquisition kiya.,6,3,1617743987.0,yummy_butter,False,neutral,neutral,neutral,neutral
gtn5ilw,Please don't tell me cause I'm deciding to pursue it after 12th,0,3,1617761196.0,Clickbaiting_4_u,False,neutral,neutral,positive,neutral
gto3x7t,"ACCA is not bad but being desperate for society’s approval, forcing someone to do a course without inquiring if he is interested or not. Like is said.. decision like these should be taken in a relaxed mind. More desperation and panic can lead to poor decisions and cost more money. Indian parents are panicking more than required. Chill ffs.",1,3,1617787219.0,devilwearsleecooper,False,negative,negative,negative,negative
gtm8wd8,"This was in Bangalore... An organization called SIITJee... I believe it was like 10-12k per year? I feel like that was a lot of money for those days, at least to my parents

Fwiw, they were not some massive company like Byju's... It was a couple of people renting a classroom in a school. And to their credit, the teachers were really good and there wasn't a lot of flashy sales pitches... Just good old reputation and word of mouth. Also, they cared a lot about their students... Like my parents would receive a phone call each day that I bunked classes and I'd get in trouble with my parents for wasting money. I think the owner's name was Shyam Sundar

Edit: found them on the web... Doesn't seem like much of a presence though

 https://jsdl.in/DT-15PAKKKT",5,3,1617744739.0,gigibuffoon,1617746760.0,neutral,neutral,positive,neutral
gtn5eo0,"I think this is applicable only for those in remote places like me 

Lol.",1,3,1617761139.0,Clickbaiting_4_u,False,neutral,neutral,neutral,neutral
gtm7joi,"6-7 months back WHJ and Byjus took down my 18 videos, 2 YT channels, 2 Reddit accounts, quora account, 2 Reddit accounts, several LinkedIn posts. I kept on posting about all that, and now they get backlash if they take down anyone's content. Now you can post any video on Byjus and it won't be taken down.",53,3,1617744101.0,pooniahigh,False,negative,negative,negative,negative
gtla1w0,The money in india is always in scamming others.,21,3,1617729457.0,SnooFoxes2411,False,negative,negative,negative,negative
gtlop59,Whatt,5,3,1617735875.0,TheRealTwixyl,False,neutral,neutral,neutral,neutral
gtnjs9j,"For real tho , literally 95% of the things Byjus teach can be learned from Youtube FOR FREE",3,3,1617769619.0,rajagopal2001,False,positive,neutral,neutral,neutral
gtm2bsm,"so, you excluded the most important bullet point lol",19,3,1617741767.0,Kerisma123,False,negative,negative,positive,negative
gtnfyg7,">Withdraw from the product

you see as said in post you cannot cancel after 15 days",3,3,1617767122.0,Ranvir33,False,neutral,negative,negative,negative
gtmd9cf,"Wtf, why does BYJU's have such an influence on LinkedIn user accounts?",3,3,1617746822.0,Thunder_Volty,False,negative,negative,negative,negative
gtn4n24,"The families who are scammed are lower middle and poor class mostly. They don't even know English. So when for the first time someone comes to their home in well suit, speaking a couple of lines in English, saying your kid got a scholarship, and this tablet can make him a genius, they cave in. And when parents don't take the product, sometimes Byjus BDAs go for the ""leave the lead dead"" card. They insult the father right in front of mother and kids saying you can't even spend for your kids what kind of father you are, hurting his ego.",3,3,1617760735.0,pooniahigh,False,negative,negative,negative,negative
gtnyv2x,Oh. Man ! That's exactly what happened with me too. Fuck.,2,3,1617782187.0,Disastrous-Ear-3774,False,negative,negative,negative,negative
gto6tvd,"I don't know the kids family personally. From the conversation, kids mother was very scared. She leaves early morning for work, comes home, cook. She won't go though the legal thing. Croud fund sounds good to me.",2,3,1617790008.0,pooniahigh,False,neutral,neutral,neutral,neutral
gtoidh2,">If you didn't like classes within the trial period, you could always opt out.

Did you read his post? 

*The teacher used to teach properly earlier but now they only play videos and mentors are not present.*

Your problem is that someone is complaining about not getting the product that they were promised or shown during trial? 

I sell you a 100Mbps internet connection and give you a trial period of 1 month. You like the service and agree to get a 1 year contract because you save money on that compared to the monthly payment.

But after 2 month I drop the speed to 10 Mbps. Will that be okay? 

I cannot understand why people like you actually speak in favor of Byju. I mean yeah, the parents are stupid, and you are smart. We get it. Everyone on Reddit is super smart. But at least do not speak in favor of Byju when these guys are complaining about the product that they were promised but didn't receive. 

That is the minimum expected here. Nobody is expecting that they would be giving some state of art education. But the kid is complaining about the massive drop in quality but you somehow even have a problem with that. 

Matlab dimaag hai? Ki bhusa hai?",1,3,1617798491.0,shinchan_pyara_pyara,False,negative,negative,neutral,negative
gtnh4a1,"Having to cancel your card just to stop paying is a bit shady.

There's no way to actually stop paying that Byju's recognizes. As you may have guessed by now Byju's isn't exactly like a college. I would love to just stop paying but I have no idea what Byju's has up their nasty sleeves.",1,3,1617767860.0,dragonairregaming,False,negative,negative,negative,negative
gtlcaq5,"Yeah very similar story. Dude kept saying ‘the moment i walk out, the “discount” is gone’",71,4,1617730432.0,piewala,False,negative,neutral,neutral,neutral
gtm20p1,They should instead start marketing courses in only thing they're actually good,15,4,1617741633.0,PrateekPanwar646,False,neutral,neutral,neutral,neutral
gto273d,I initially accept their offer but coz of some computer virus at that time their server was hacked so they said we have to wait for 5 months or something so I rejected thank god otherwise my family would be in a huge debt now,1,4,1617785507.0,SRaG123,False,negative,negative,negative,negative
gv7dkdd,"I wish I had said no to those people. Totally regret it. I've seen my dad breakdown realizing that he lost nearly 50k to some scammers. btw, is there any other way we could go against them, like file a group complaint against them in consumer court?",1,4,1618928652.0,One_Following_1926,False,negative,negative,negative,negative
gtnj747,Some are good sure. But have you seen the videos for (from what I remember) topics like stoichiometry. It’s a guy droning over with bad audio.,2,4,1617769221.0,piewala,False,negative,neutral,neutral,neutral
gtlndxz,"Same, watching a lot of English movies/tv shows and now youtube helped me better my english cause I went to a small school and no one really spoke in English out of class.",7,4,1617735290.0,kakashi69696969,False,positive,positive,neutral,positive
gtlh1ex,[deleted],1,4,1617732485.0,,False,neutral,neutral,negative,neutral
gtnjgsb,[deleted],13,4,1617769405.0,,1622478832.0,neutral,neutral,negative,neutral
gtnm6wk,[deleted],2,4,1617771284.0,,1623774087.0,neutral,neutral,negative,neutral
gtm9ejc,"Every desi parent wants their kid to be the next prodigy... While it is fine if the kids develop interest on their own, pretty sure most are struggling to keep up and probably losing their childhood to these BS coaching classes",47,4,1617744976.0,gigibuffoon,False,negative,negative,neutral,negative
gtn678a,"Ok wait


What in the fuck.....",3,4,1617761564.0,,False,negative,negative,negative,negative
gtogzxz,Khan academy is free. Completely free. They have helped many students around the world. Don't compare shits like Whitehat Jr and Byjus with Khan Academy.,-1,4,1617797670.0,alishabbir7,False,neutral,positive,neutral,neutral
gtnvygf,"> Upgrad

That scam is at a different level. Let me reiterate, you will learn nothing new there and your 'degree'/'certificate' is useless.",7,4,1617779418.0,thelielmao,False,negative,negative,negative,negative
gtnxomk,"Finally, another redditor who got 'The Ball Poem' reference lol.",3,4,1617781041.0,tejas_sh23,False,positive,positive,neutral,positive
gtnb3ir,yooooo noice,2,4,1617764237.0,,False,positive,positive,positive,positive
gtosacb,So what? He's still a Bengali. Speaks Bengali probably too. I'm not from West Bengal but I'm Bengali. He is ethnically Bengali,1,4,1617803635.0,,False,neutral,neutral,neutral,neutral
gtm733m,"I am still in contact with the family. Finally, after a lot of efforts, they were off the hook from Byjus EMIs. If the father agrees will take his interview and post it on my channel soon.",36,4,1617743889.0,pooniahigh,False,neutral,positive,neutral,neutral
gtmzbwf,"The father lives abroad and his family was stuck here in India during pandemic. And while the Byjus guys were hounding his family here in India, the father was there outside, he got some medical complications and had to undergo surgery, alone.",2,4,1617758043.0,pooniahigh,False,negative,negative,negative,negative
gtm7cvn,Acha. Kyuki mai bhi jee aakash mai hu aur kismat se mujhe teeno pcm mai bahot ache teachers mil gye aur material bhi thik hi hai,4,4,1617744015.0,BuilderTime,False,neutral,neutral,negative,neutral
gtn0oyi,ab Aakash bhi gaya kachre mein,1,4,1617758722.0,,False,neutral,neutral,neutral,neutral
gtndsk2,"Don't let a stranger on the Internet influence your life decisions lil homie. Do what you feel like, everything has its pros and cons.",8,4,1617765794.0,,False,negative,neutral,negative,negative
gtmegql,"Thanks for sharing this. Actually till my iit jee coaching days, 07-08, kota city, bansal classes, ads were not a thing in coaching industry. Now ads everywhere.",3,4,1617747427.0,pooniahigh,False,neutral,positive,neutral,neutral
gtnconz,"You can literally do a Google search for whatever topic you have doubts in and enough videos will pop up.

If you can Google hot pics of alia Bhatt, you can definitely Google this.

It is still not late though. Would suggest that you start referring to khan academy and lots of other material which is there on youtube for your doubts.",1,4,1617765146.0,vrn_new,False,neutral,neutral,neutral,neutral
gtn8arp,Thank you for not giving up. Kudos to your fight!,17,4,1617762693.0,PM_MeYourBack,False,positive,positive,positive,positive
gto3q6b,Yaaassss let's goooooo,3,4,1617787027.0,dizzybear24,False,positive,positive,positive,positive
gtla94s,I hate how true this is,8,4,1617729544.0,funnythrone,False,negative,negative,negative,negative
gtnhcn1,Added a edit to my comment :),4,4,1617768010.0,streetbrown,False,positive,positive,neutral,positive
gtng8mg,"I'm not sure that's particularly relevant. Send an email, or even recorded post if they'd want, attesting that they are withdrawing from the service and will no longer be using it. Give them at best a couple of weeks to comply with your directive. If they don't, follow up saying you're cancelling the subscription and leave. And then order the bank to stop giving them payments.

You can't be forced to pay for something you are not interested in buying. And you cannot be bonded into accepting a service. Otherwise phone companies would bind you in perpetuity would they not? Its not a loan if you don't own the product in its entirety. If you are making recurring charges for a recurrent service, then its cancellable by law since its legally a subscription. Terms and Conditions can say what they want, they can't override the law.",2,4,1617767301.0,boringhistoryfan,False,negative,negative,negative,negative
gtmdxpn,Money. Thats it. They have money and they are doing what ever they want to do.,3,4,1617747160.0,pooniahigh,False,neutral,neutral,neutral,neutral
gto6whn,"I understand. Its tough but just in case she changes her mind. I bet there are plenty of good lawyers who would be more than willing to help.

More power to you man.
Good luck.",1,4,1617790078.0,chaudharysahib08,False,positive,positive,positive,positive
gtnk7xx,"No it's irritating. But cancelling a card is easy. And once you cancel, all Byju can do is ask for payment. If you send an email prior to cancelling that you want to discontinue the service, wait two weeks, and then cancel your card, they can't do anything. Be sure to mention that you want to return all devices that you have received from them. 

As for them not recognizing cancellation, that is irrelevant. You are the consumer, you can decide when you want to stop the service. Byju has nothing to do with that.",1,4,1617769918.0,TheHadMatter10,False,negative,negative,negative,negative
gtnmm3n,"That's a manipulative sales tactic, used to pressure people into getting stuff.",9,5,1617771582.0,,False,negative,negative,negative,negative
gtn4x4i,"Hey, it's better to use "" "" for quotes and ' ' for singular words, even within a double quoted sentence.",8,5,1617760881.0,NSGDX1,False,neutral,neutral,positive,neutral
gto2afk,"Very lucky man, I can't imagine the guilt I'd have to trap my parents into something like it, at the end ncert was the best friend I could get",1,5,1617785602.0,ArthurGKing,False,positive,positive,positive,positive
gtlh9v9,Uhh did I? What. See this is the sole reason why I use my computer for Reddit. Mobile just clicks anything anywhere. EDIT:I DONT KNOW WHY PEOPLE ARE DOWNVOTING UR COMMENT.,5,5,1617732589.0,mayank1206,1617734472.0,negative,negative,negative,negative
gtoglmb,Try Twitter campaign with same hashtag like #ByjuScam #WhiteHatJrScam #ByjusGhotala,3,5,1617797422.0,alishabbir7,False,neutral,neutral,neutral,neutral
gtnmxen,"That thing about khanacademy is right though. It does focus on foreign courses more.

But this frauding of people should stop really. Media seems completely soldout. Lawyers are costly. What option does it leave for common people too fight against billion dollar companies doing wrong things?",5,5,1617771803.0,freakynit,False,negative,negative,negative,negative
gtmubnl,">losing their childhood to these BS coaching classes

I wholeheartedly agree. I enrolled in coaching classes in class 11th, and it took a toll on my mental health. After 6+ hours in school, I had to go to the coaching centre in the late afternoon for 2-3 hours. I remember being bone-tired all the time, and my brain was saturated after school, so I couldn't retain much info, either. What a waste of time, money and energy.
Thankfully, I unenrolled from the coaching classes in 12th, and vowed never to recommend coaching classes to any kid, ever.",32,5,1617755484.0,-zf-,False,negative,negative,negative,negative
gtnrm61,this will only lead to an un-creative future generation.,2,5,1617775601.0,Chance_Midnight,False,negative,negative,neutral,negative
gtoskir,"On one hand, it's really questionable if kids really understand any of the joys of programming and it may simply be the parents desires projecting on their kids in the hopes of creating the next Elon Musk. Even majority of adults consider programming a dreadful chore.

On the other hand, this is an age where kids can easily absorb a lot of information easily compared to when they get older. Though, if one isn't truly interested, their minds can just forget everything as unimportant information later on.",1,5,1617803769.0,codehawk64,False,negative,negative,negative,negative
gtol7hk,I meant Khan Academy is much better than BYJUs shit,5,5,1617800080.0,,False,neutral,negative,neutral,neutral
gtotkdj,"Ugh. How do you know he identifies as one?

See this is the problem. You could've simply said 'he's an American of Bangladeshi/Bengali descent' and left it at that. But no, you had to go further in and put a 'Bengali' or a 'Bong' tag for him.

All I'm saying is, don't assume his identity for him. I'm sure Sal will not be bothered by the little bickering you and me are having here right now, but assuming people's identity for them is not the most respectful thing.

For example, I come from a TamBrahm family but grew up in a bunch of different places in a couple different countries and I feel far removed from the community I trace my lineage from and I don't identify as a part of that community anymore.",1,5,1617804241.0,CarbonTail,False,negative,negative,negative,negative
gtmc382,This is so fucked up. How can they get away with this?,12,5,1617746255.0,MightThrowAwayThis,False,negative,negative,negative,negative
gtmzb21,Poonia sir channel link ke dijiye ga,3,5,1617758031.0,AK47_Sushant,False,neutral,neutral,neutral,neutral
gtmwxer,"Bro I've joined Aakash too but their online platform, Aakash Live. I hope it's good too. Seeing this whole byjus shit, I got really worried",5,5,1617756816.0,Swebi,False,neutral,neutral,neutral,neutral
gtogydg,Yes sir!,1,5,1617797643.0,Clickbaiting_4_u,False,positive,positive,neutral,positive
gtmihwn,"Yeah IIT classes were just starting to be a thing in late 90s/early 2000s... Until like 1996, I remember that BASE was the only real coaching class for IIT in Bangalore... FIITJee was kinda catching up but certainly not as crazy as it seems now",1,5,1617749474.0,gigibuffoon,False,neutral,neutral,neutral,neutral
gto51oe,Actually I was wrong. BYJU's can still take down posts. They actually took down this kid's Linkedin account itself last night at 3 am,5,5,1617788317.0,pooniahigh,False,neutral,negative,negative,negative
gtlajqq,The success rate is high.Indori stock scammers are travelling in mercdes.Jamtara scammers are crorepati.This is why I tell that Indian upper middle class is at least 5 laks per month.A jamtara matric passout is able to earn 1 crore just by using his mobile.,11,5,1617729671.0,SnooFoxes2411,False,negative,negative,neutral,negative
gtnn52b,"saw that :) I have to appreciate you being kind in every response, when I am being lowkey rude. idk if I am getting too serious, but I think you have a special trait my man! Thanks for spreading kindness in this harsh world!",3,5,1617771955.0,Kerisma123,False,positive,positive,positive,positive
gtnggww,"one guy actually did.i learned this from this post.

he blocked his card.when byjus found out, they started harrasing him by calling him and his family at night around 12-3 am.if you do that they will harass you and your life will be shit

&#x200B;

&#x200B;

also are you a lawyer?? you seem to be one",1,5,1617767450.0,Ranvir33,False,negative,negative,negative,negative
gtnmtk8,Yep,5,6,1617771728.0,piewala,False,positive,neutral,neutral,neutral
gtnj83t,XD yes,2,6,1617769240.0,piewala,False,positive,positive,neutral,positive
gto2dbz,Yeah man would have been in the mud if I accepted back then,1,6,1617785684.0,SRaG123,False,negative,neutral,neutral,neutral
gtlqssg,[deleted],0,6,1617736809.0,,False,neutral,neutral,negative,neutral
gtn2zmb,I was enrolled in coaching classes from 9th grade onwards... Some chain called Gurukul and then into IIT classes in 11th... The only thing I gained from both of them was one girlfriend and a whole bunch of after-school time spent traveling across Bangalore,29,6,1617759883.0,gigibuffoon,False,neutral,neutral,neutral,neutral
gtnju73,"I am in coaching class rn, so wish me luck!",3,6,1617769655.0,,False,positive,positive,positive,positive
gtotkm2,"IMO, There's no harm in introducing the children to programming at an early age. The problem occurs when the children are being forced to sit through these classes against their will, just for the parents to be made happy about it",1,6,1617804244.0,gigibuffoon,False,neutral,negative,neutral,neutral
gtq08s6,Ok my bad. I didn't read your whole comment. Sorry.,1,6,1617822827.0,alishabbir7,False,negative,negative,negative,negative
gtovqsf,"Yeah Yeah I get it now. Btw, I identify as African Chinese",1,6,1617805265.0,,False,positive,neutral,neutral,neutral
gtow3u0,Also see this where he talks about Bangladesh being very close to him :- https://www.youtube.com/watch?v=MBgKSple8kA&t=79s,1,6,1617805436.0,,False,neutral,neutral,neutral,neutral
gtmcvuo,"Money. 
Btw latest update, the kid who posted this post on LinkedIn, his post got like 12.5k upvotes on LinkedIn. And since 3 am I can't find the post. I can't even find his profile. 
After 12.5 people had seen the post already, Byjus took down the account. See the audacity! 
FKkkk. And this BC media is silent.",42,6,1617746639.0,pooniahigh,1617748300.0,negative,negative,negative,negative
gtmzemi,https://youtube.com/channel/UCdv4_YNXrIQtGHSVXnY-1mg,2,6,1617758082.0,pooniahigh,False,neutral,neutral,neutral,neutral
gtn7ni0,And here I joined Physics Wallah JEE Lakshya batch. It's pretty good for only 4k I must say,3,6,1617762340.0,SSpotatoman,False,positive,positive,positive,positive
gtp5v45,Online matlab iTutor?,1,6,1617809814.0,BuilderTime,False,neutral,neutral,neutral,neutral
