Comment ID,Comment Text,Comment Score,Comment Depth,Created Timestamp,Author,Edited,Semantic Label,Semantic Label 2,Semantic Label 3,Major_Semantic
gtw2cm9,"My parents bought me a 1 year learning which is OFFLINE program from Byju's. I will only say that this offline program is just as like a demo where they do not cover some of the very important topics, they only want to sell their online course.",1,0,1617938032.0,,False,negative,negative,negative,negative
gu0ijcv,"Byjus is truly the worst.   
I have bought their subscription of class 8 to 12 icse.  And let me say this- they are lazy as f. Those video's are dating back to 2012 2013 when the syllabus was different. Meaning they hadn't made videos on the new topics, which happened to be the ones i couldn't understand.  And they always promote their byjus website for any doubts we have. And again, they are lazy as f. I almost never get a reply for my doubts. Byjus is practically useless for me, since their videos lack many concepts and tests are just plain stupid. On top of this, the byjus ""mentor"" calls me every single day to ask why am i not watching the video. BECAUSE THEY'RE FRICKIN USELESS, THATS WHY.",1,0,1618030712.0,,False,negative,negative,negative,negative
gu0wga7,"Thanks , I won't buy their product",1,0,1618043111.0,Lt_Mandar,False,negative,negative,positive,negative
gu9jh7m,"Guys this is not the reason. The difference between classes/ course available at byjus or any other institution with the cheap or free available courses at youtube is students does not have that will to study. They just study it for examination. In youtube there are lots of content available. Most students need checks and balances. I have seen this even you guys must have experienced this, during this pandemic all students have studied online. Either from BYJU’s or from youtube. And you also know that their regularities in studies is not there now. Even when students were a habit of going to schools and tuitions and hence are spending their a minimum of 7-8  hours.",1,0,1618241937.0,Frequent-Literature7,False,negative,neutral,neutral,neutral
gv7d4q9,"I feel the same. Whenever someone ask that if I recommend BYJU'S, I would reply to them saying, **""Stick to offline tuitions, BYJU'S is useless AF.""** I really feel bad for all the parents who fall for their fake promises.",1,0,1618928460.0,One_Following_1926,False,negative,negative,negative,negative
gvn8yrf,Truky heartbreaking and then you remember that the guys acquired Akash and now I can say that the Indian education system which was on life support shall now experience the final nail in its coffin. Someone once said that byjus is a slap on Indian education system. If anything they are a slap on us and our never ending fascination with obsessing over one profession to the point that other professions are deemed useless.,1,0,1619235818.0,theoneeyedking83,False,negative,negative,negative,negative
gvwiytd,"I was planning to enroll my daughter in Byju's. She is in 7th grade from CBSE board. After seeing that they were facing a lot of hate on the internet, I decided not to go for it. But during these Covid crisis I am desperately looking for a good online learning platform for my kid. Can anyone recommend any good platforms. I currently am on the free trial of [Tata Studi](https://tatastudi.com/). Other recommendations would help a lot.",1,0,1619418777.0,royy232177,False,negative,neutral,neutral,neutral
gwflrev,India is filled with this types of shitty companies.  This and white hat jr. Brain washing parents' and taking thousands of rupees,1,0,1619795253.0,S_N_I_P_E_R,False,negative,negative,negative,negative
gxdut8y,What will happen if you stop paying them and stop all contact with them ?,1,0,1620479871.0,ciel_sebastian,False,negative,negative,neutral,negative
gxfpoh5,upto date...all online aggregates r SCAM.LMPpp,1,0,1620513895.0,AggravatingDrive1415,False,negative,negative,neutral,negative
gtnxw1n,">They are not selling education. They are selling refurbished tab for 10 times markup

BYJUS' business model in a nutshell!",48,1,1617781243.0,UserSM,False,negative,negative,negative,negative
gtvy3n6,Wait wait wait. You have buy a tablet to use byjus??? Or is this for the particular package the student purchased? Either way what the fuck?,3,1,1617935647.0,bloomingtales,False,negative,negative,negative,negative
gtnlp9u,[deleted],4,1,1617770939.0,,False,neutral,neutral,negative,neutral
gtl5a15,Im 14 (idk how much my dad paid currently entered grade 10) my dad bought a package for 6th to 8th. 6th I would watch every video considering the obedient child I was. 7th I stopped using the quizzes and 8th I basically watched a video a week. All this time the mentor contacted us a total of 5 times. I remember this number because the absolute disaster of communication with them.,264,1,1617727397.0,mayank1206,False,neutral,neutral,negative,neutral
gtl8u7o,"Would it help to bring this to masses if a website is launched cataloguing all such occurrences? The more the people are on a common platform, the more voice they get.",72,1,1617728930.0,freakynit,False,neutral,neutral,neutral,neutral
gtljt24,Nothing can beat classroom teaching (or a separate tuition). They're really taking advantage of the pandemic to lure gullible people.,18,1,1617733708.0,swapgooner11,False,negative,negative,neutral,negative
gtnfnkm,"If they Keep it up and make enough money, people will make a movie about it in another 10 years and everyone will think byjus are so cool. Glorifying scamsters is something we are so good at",4,1,1617766930.0,D_chiller,False,positive,negative,positive,positive
gtnd8z7,Whitehat is also a scam.,4,1,1617765476.0,tanay2043,False,negative,negative,negative,negative
gtol3ip,"Why are people paying for these when Khan Academy, which is practically free, exists for classes 6 to 12?",1,1,1617800020.0,ExtroHermit,False,neutral,negative,neutral,neutral
gtkzij9,I have stopped trying to get a refund. What's the best way to connect with you?,192,1,1617724891.0,A10M92,False,negative,neutral,neutral,neutral
gtl2abz,[deleted],116,1,1617726099.0,,1626632282.0,neutral,neutral,negative,neutral
gtlmvtb,My niece is enrolled in Byjus and she is only in 1st standard. I'm just a helpless bystander. I have shared all these articles and news about Byjus but brother in law doesn't seem to care much. I think there's something about a child's future that makes an adult brain to stop functioning and equating more cash = more quality maybe. I don't have a kid so I won't know.,92,1,1617735066.0,Sorry_Door,False,negative,negative,negative,negative
gtlgkxr,A 10-year course? Who are they teaching? 3rd grade students?,21,1,1617732286.0,Pseudo_Nym__,False,neutral,neutral,neutral,neutral
gtlttj8,">And why are these BYJU's subscriptions are for multiple years?

There's no way people would renew after second month if this was a monthly subscription model... Clearly, they're in the business of pyramid schemes and not education",19,1,1617738098.0,gigibuffoon,False,negative,negative,negative,negative
gtlyhv0,"I know you, you're the guy from yt right ? I really appreciate you taking efforts on this thing man. Goodluck !",14,1,1617740099.0,deathawaits_01,False,positive,positive,positive,positive
gtlblh6,Just imagine the guilt he'd feel while watching an Indian cricket match (the jersey),16,1,1617730130.0,Clickbaiting_4_u,False,negative,negative,negative,negative
gtldr0v,**\^ my man! Keep fighting.**,8,1,1617731067.0,prakashanish,False,positive,positive,neutral,positive
gtnetbg,"We support you bro , just keep giving us updates about the case",3,1,1617766421.0,Spongta,False,positive,positive,positive,positive
gtnz9mv,"Yup , as a 15 year old. I can confirm they are annoying af . Trust me , they only want your money and I'm always infuriated at the parents who spends lakhs of rupees just for one year !!  


And if you're a child reading this , please abruptly end the calls if they ever call just say you dint want to take up their course , if you're a parent please don't choose Byju's or any other online platform for study , it's not worth the money .",2,1,1617782588.0,ThyInFaMoUsKID,False,negative,negative,negative,negative
gtnqdz2,Money in hand today is worth more than money in hand tomorrow.,1,1,1617774568.0,WANDERLS7,False,positive,positive,positive,positive
gtnz3hl,">ENTIRE MEDIA is silent like nothing is happening at all

We are watching the whole of India getting sold to corporates bit by bit in front of our very own eyes. Walking on a path to eventual destruction. We are the generation that is going to be blamed and hated for India's downfall for centuries to come.

Our future generations are going to live very shitty lives. But no one gives a fuck as long as mandir is being built.

BYJUS is just an experiment and a successful one. Just watch how such cronies pop up in every industry in India and still no one will be allowed to raise their voices.

First they came for the...",1,1,1617782420.0,UserSM,1617783029.0,negative,negative,negative,negative
guie249,Can you update us if you find out whether this kid ever got his money back?,1,1,1618421641.0,Fine_Economist_5321,False,neutral,neutral,neutral,neutral
gtl52dp,All my homies hate Byjus,198,1,1617727306.0,,False,negative,negative,negative,negative
gtl92ew,I hate Byju's so fucking much. I once made the mistake of signing up on their app to check it out. They called me incessantly for 2 years despite me pleading with them to take me off the list. Blocked like 20 numbers before they stopped. If this isn't harassment I don't know what is.,154,1,1617729029.0,Do_I_need_Numbers,False,negative,negative,negative,negative
gtnda5n,Fuck whitehat also,19,1,1617765496.0,tanay2043,False,negative,negative,negative,negative
gtlyhzx,We should stop watching indian cricket team until they drop Byju's as a sponsor... Hit them where it hurts,39,1,1617740100.0,gigibuffoon,False,negative,negative,negative,negative
gtm6wb4,Thats why i like Physics wallah platform. Joined lakshay batch for 999 a YEAR and he gave his 200% teaching.,25,1,1617743801.0,BuilderTime,False,positive,positive,positive,positive
gtmt5s9,"In case someone didn't knew, 
BYJUs recently bought Aakash institute",3,1,1617754885.0,Beast_Mstr_64,False,neutral,neutral,neutral,neutral
gtnie6n,All my homies use extramarks,3,1,1617768685.0,,False,neutral,neutral,neutral,neutral
gv7e3mz,"they're full of shitty losers and thieves, disguised as ""Educational Conuselors""! really hope that they would go down hard",1,1,1618928887.0,One_Following_1926,False,negative,negative,neutral,negative
gtl3z10,"These are ECS mandate. The loan company already paid to byjus. It is a very profitable business for tab companies to sell their waste tabs, third party NBFCs for selling lonas, and byjus for the premium.",148,1,1617726832.0,SnooFoxes2411,False,neutral,positive,positive,positive
gtn2yhj,Because it's a loan that parent had taken.,2,1,1617759868.0,,False,neutral,neutral,neutral,neutral
gtl7ccv,Khan Academy is on the opposite end of the spectrum. What an organisation! Respect to Sal Khan. He personally created nearly 6000 videos. That’s what edtech should be.,196,1,1617728280.0,pratikanthi,False,positive,positive,neutral,positive
gtlb4qz,its crazy how people think they should pay for tutoring with stuff like youtube and khanacademy avalible!,84,1,1617729927.0,Kerisma123,False,negative,negative,negative,negative
gtlcdtr,Single handedly carried me through 11th and 12th. Best place ever,64,1,1617730470.0,Moratata,False,positive,positive,positive,positive
gtlp0a0,"Khan Academy, MIT Ocw(for undergrads) , and good'ol YouTube. I don't understand why anyone would pay for a shitty ByJus course when you have access to world class education for free.",60,1,1617736012.0,_thekinginthenorth,False,negative,negative,negative,negative
gtlu69p,"I spend my money on byjus and really regret it, I spent over 1.6 lakhs for 6th to 12th+ jee and neet things, I am 14 now and I absolutely hate it, The videos seem to be a quickly edited mess, the microphone quality is shit, I paid 1.6 lakhs, the ad said it will make me fall in love with learning but I have not improved in math at all, I barely use the app, every night, I regret purchasing it, I honestly did not know khan academy was a thing, If I had known, it would have been so much cheaper, I love khan academy, best website, better than byjus.",30,1,1617738245.0,C0braboytnt,False,negative,negative,negative,negative
gtl995g,Sal is a real LAD. And the best teacher a newbie can ask for.,50,1,1617729109.0,Do_I_need_Numbers,False,positive,positive,positive,positive
gtnq8ti,Even the 'Organic Chemistry Tutor' is great. Search him up on Youtube. Respect to him and Sal Khan.,3,1,1617774448.0,,False,positive,positive,positive,positive
gtncgex,"And if you want some hardcore university level classes, go to edX or directly to Harvard's course website. They're all free if you don't want a certificate. Byjus has nothing on Harvard's CS 50",2,1,1617765012.0,TravelJunkie2017,False,neutral,neutral,neutral,neutral
gtnrtbr,"Or even [ncert.nic.in](https://ncert.nic.in) they have textbooks and extra sample problems. They also have a youtube channel, not the best quality but way better than online class from school. I was surprised Government resources would be good",0,1,1617775767.0,,False,negative,positive,positive,positive
gtnpgtc,"Even Elon Musk agrees that you can learn anything for free.

https://youtu.be/-0N3T5bGkyM",1,1,1617773801.0,boundtoberich,False,positive,positive,positive,positive
gtnssxg,They are there to provide education but not make money. Money will come in one way or another if your intention in the first place is good. Khan academy got donations from multiple sources due to their quality content in past years.,1,1,1617776615.0,Chance_Midnight,False,neutral,positive,neutral,neutral
gto60uq,"For anyone preparing for IIT or any similar exam I would advise Mohit Tyagi Sir's channel(He has everything on his channel just waiting to be utilised), PhysicsWallah and PhysicsGalaxy. They have all my respect because the entirety of my IIT prep. has been from their channel and other channels also which I didn't mention.",1,1,1617789248.0,ajaysassoc,False,positive,positive,neutral,positive
gto7rmw,What does bong mean in the context of this sentence?,1,1,1617790853.0,,False,neutral,neutral,neutral,neutral
gtoo00r,"> is a bong

He's not a bong. He's an American of South Asian descent. Please don't assume his identity for him.",1,1,1617801537.0,CarbonTail,False,negative,neutral,neutral,neutral
gtpnaui,[deleted],1,1,1617817289.0,,False,neutral,neutral,negative,neutral
gtlsotl,Disney,22,1,1617737627.0,Gahkxl,False,neutral,positive,positive,positive
gtl6ey6,[removed],53,1,1617727884.0,,False,neutral,neutral,negative,neutral
gtlgf36,And the S is for scam,47,1,1617732215.0,wah_modiji,False,negative,negative,negative,negative
gtlhepz,The A in Aakash will soon stand for Asshole.,38,1,1617732650.0,yummy_butter,False,negative,negative,negative,negative
gtkv4xb,There must be hundreds of schools with the same name. Although will take care of this in future.,98,1,1617722965.0,pooniahigh,False,neutral,neutral,neutral,neutral
gtl5jg2,"Isn't it posted on LinkedIn, a public platform? Why hide it while posting it here?",32,1,1617727513.0,anotheroverratedguy,False,neutral,neutral,neutral,neutral
gtl8llm,What's with your username btw,23,1,1617728824.0,Clickbaiting_4_u,False,neutral,neutral,neutral,neutral
gtlnsh2,"My mom got over excited and made do doACCA. Mind you, I’m weak in calculations but since ACCA has a lot of job opportunities and blah blah she signed me for ACCA in an institute which eventually got involved some fishy human recruitment fraud. Parents get desperate and in such process they don’t think logically. Education and future should be decided in a relaxed state of mind. People panic a lot and end up among poor decisions. I don’t see the need of desperation.",16,1,1617735470.0,devilwearsleecooper,False,negative,negative,negative,negative
gtm42m8,I still regret making my dad pay for my IIT classes when I was in 11th and 12th (back in 2001/2002)... Sooooo much money wasted when my dad was struggling financially,6,1,1617742524.0,gigibuffoon,False,negative,negative,negative,negative
gtl8god,"Before class 10, you are not able to know that there are other great stuffs too. You are just new to the internet and don't know many things",31,1,1617728764.0,Clickbaiting_4_u,False,neutral,neutral,positive,neutral
gto14a3,Because those shitty companies puts Millions of Dollars in marketing.,1,1,1617784424.0,datathecodievita,False,negative,negative,negative,negative
gtngwas,WTF. No way. How the fuck do we let this company exist.,12,1,1617767719.0,agentjob,False,negative,negative,negative,negative
gtlar5z,Now they can't. Things are changing.,32,1,1617729762.0,pooniahigh,False,neutral,negative,negative,negative
gto6vlm,"Can't we buy some domains like Byju'sfees and redirect them to Khan academy and other free resources? I am not big on web dev, but think it should be easy for other redditors here..  
u/pooniahigh",2,1,1617790054.0,Open_Priority_7991,False,neutral,neutral,negative,neutral
gtl5y67,idk but when ever i search any doubt i get topper doubtnut and brainly on top almost everytime,23,1,1617727688.0,,False,neutral,neutral,positive,neutral
gtncoe3,"i also took toppr, its been useless asf. physicswallah has really great lectures, their courses are affordable and quality is great",1,1,1617765142.0,eajwoo,False,negative,positive,positive,positive
gtntj2x,Byjus likes startup will find it hard to scale to become a global company. Such tricks and lies can't work in western societies.,1,1,1617777245.0,Chance_Midnight,False,negative,negative,negative,negative
gtl5cxs,What the actual F man! Aakash is a big organization.,40,1,1617727433.0,pichu-mani,False,negative,negative,neutral,negative
gtl6mwe,"Yeah they did. For 1 billion. Indian education was always bad, now it's becoming complete shit.",34,1,1617727978.0,TheIKnowItAll,False,negative,negative,negative,negative
gtl8x89,">I read byjus bought akash institute

Wait what the fuck? We were planning to get my younger sister enrolled in Aakash from 11th grade as a centre recently opened up in my city which I was excited about (Also because I had a good experience with Aakash myself) but that's not happening now",28,1,1617728966.0,supplementarytables,False,neutral,negative,neutral,neutral
gugsfu5,Dusra koi job nhi mila kya usko. That’s not your problem.,1,1,1618388007.0,ObservantMagic,False,neutral,neutral,neutral,neutral
gtlgwf4,There are WhiteHatJr / BYJU's salesman who are forced to sell their courses and get commission in return.,6,1,1617732424.0,xelnagatower,False,neutral,negative,negative,negative
gtnfrqy,"Khan academy is a good option but a lot of parents are gullible and fall for the trap.and they think KhanAcademy is useless and a trap since you dont pay for it.also they think that studying on device is useless if you are using khanacdemy but fine for byjus because money is paid and big name

&#x200B;

paid tuition = good

free tuition = bad",4,1,1617767002.0,Ranvir33,False,negative,negative,negative,negative
gtlak0n,Not that easy. They start calling and start abusing if you do that. And put alot of pressure.,23,1,1617729675.0,pooniahigh,False,negative,negative,negative,negative
gtnpxmo,"Are there any legal repurcussions for doing this? I mean, one can get out of any subscriptions/EMIs by simply disabling the card?",3,1,1617774188.0,biryaniwala,False,neutral,neutral,negative,neutral
gto33fs,Did you just describe your genius mom scamming byjus lol?,3,1,1617786399.0,FortunatelyGrowing,False,negative,negative,neutral,negative
gugsm08,You got scammed in turn. It was probably a refurbished tab worth 1-2k,2,1,1618388181.0,ObservantMagic,False,negative,negative,negative,negative
gto70ul,I didn't get this..someone explain,1,1,1617790191.0,ShowerProfessional25,False,negative,negative,neutral,negative
gtlq5y1,Khan academy?,6,1,1617736535.0,I-Broke-My-Old-Phone,False,neutral,neutral,neutral,neutral
gtlkmmf,Sad but true,7,1,1617734073.0,,False,negative,negative,negative,negative
gto77j7,"well, counsellor is legally an agent of Byju's, and a verbal contract is a vaild contract in India.

 Meaning, Byju's will have to either provide the service committed by the agent (counsellor, and htis includes refund within 30 days). Otherwise, the original contract is fraudulent and the parents can seek remedy through RBI who regulate all lending products.",1,1,1617790361.0,Open_Priority_7991,False,neutral,neutral,negative,neutral
gtlkkrx,I agree but byjus promotion is too much. When I was in school they had come our class and gave us a test. Three children were selected including me. We were called to a very big ( 5000+ ) show where byju himself gave a speech and gave us a free sim to use for 2 months. It didn't work at all.,10,1,1617734050.0,,False,negative,negative,negative,negative
gtlaas4,And the check?,25,1,1617729565.0,mubukugrappa,False,neutral,neutral,neutral,neutral
gtlbai5,you paid 10k for a tablet.,24,1,1617729996.0,Kerisma123,False,neutral,neutral,neutral,neutral
gtlhfb1,"How is it a free tab when you have paid 10k and never got the refund? 

Unless you missed that in your post..",10,1,1617732657.0,xAlias,False,negative,negative,neutral,negative
gtli7bo,Did you get your cheque back or did they encash it?,3,1,1617733003.0,--northern-lights--,False,neutral,neutral,neutral,neutral
gtlh5zl,Got a free tab lmao. They took 10k from you for the tab,3,1,1617732541.0,jjjj__jj,False,neutral,neutral,neutral,neutral
gtlg3f8,"Man, you stupid",3,1,1617732074.0,KoolAidSuperTramp,False,negative,negative,negative,negative
gtlo8qi,Free tab for you because your father paid for it?,2,1,1617735670.0,Sorry_Door,False,neutral,neutral,neutral,neutral
gtla6cj,">fraudulently pulled into a transaction

These are loans with ECS mandate.its not one time transaction.",7,1,1617729511.0,SnooFoxes2411,False,negative,negative,neutral,negative
gtlpnbk,Yikes man. That sounds bad.,5,1,1617736303.0,I-Broke-My-Old-Phone,False,negative,negative,negative,negative
gtlqogy,I laugh when people say that byju topped CAT twice,6,1,1617736760.0,SnooFoxes2411,False,neutral,neutral,neutral,neutral
gto3iu6,"# Fucking freaking betraying scam

...sounds better",1,1,1617786825.0,,False,negative,negative,negative,negative
gtlag6g,"The kid first posted this on our subreddit r/ whitehatsr last night. He himself wrote all this. Talked to him this evening, not just writing, his speaking style is also very mature.",16,1,1617729628.0,pooniahigh,False,neutral,positive,positive,positive
gtlhub0,"Trust me, you shouldn't be or don't have to pay for these online classes because anything you want to learn is readily available somewhere for free. For any topic of interest or subject, there's always atleast one guy giving out a course for free with materials. You maybe want to pay in Portals like udemy when they Provide heavy discounts but then again you can find that for free somewhere else, maybe not as detailed but sufficient enough. I've never been in support of tuitions but offline tuitions are still better than these so called education corpos",10,1,1617732842.0,Alligator52,False,neutral,neutral,positive,neutral
gtnghq1,Khan Academy???,1,1,1617767464.0,Ranvir33,False,neutral,neutral,neutral,neutral
gtnga06,Truer words have never been spoken,1,1,1617767325.0,dragonairregaming,False,positive,positive,positive,positive
gtlt6ma,Its amazing how cricket moved from one scam SAHARA to BYJUS. The top government level knows everything and just watches it happen.,12,1,1617737836.0,Gahkxl,False,neutral,neutral,positive,neutral
gtlgifk,Kota IIt coachings are mahatma gandhi in front of byjus.except career point.,7,1,1617732256.0,SnooFoxes2411,False,neutral,neutral,neutral,neutral
gtlkt3l,"bro kota people teach forcmore than the money you pay, although they maybe rutheless on children, byju's is just a scam",1,1,1617734152.0,ComplexTowel2448,False,negative,negative,negative,negative
gtltgq0,"Indian cricketers have no political spine tbh.

They are always bootlicking.


For the amount of influence they wield one would think they would be more proactive.",7,1,1617737951.0,Gahkxl,False,negative,negative,negative,negative
gtlk87g,Read the last line of the post itself,4,1,1617733895.0,,False,neutral,neutral,neutral,neutral
gtlpg8q,"Yesss! Plus, they do such a good job at explaining.",3,1,1617736214.0,I-Broke-My-Old-Phone,False,positive,positive,positive,positive
gtmbluu,"Well he isn't there anymore. I can't find his profile. I think they took down his entire profile. 
And Linkedin's minimum age is 14 I think.",2,1,1617746023.0,pooniahigh,False,negative,negative,neutral,negative
gtnvxpx,ikr they have a lot of typos too,1,1,1617779400.0,,False,negative,negative,neutral,negative
gtnmcfi,Too much hollywood bro. Thats not how anything works.,5,1,1617771394.0,Un13roken,False,negative,negative,negative,negative
gtn5wrz,"I have been coding for years and i decided to check my brother's progress on white hat jr., he learnt nothing in 8 months :/ and i learnt so much from Google and codingzen",2,1,1617761406.0,soup-andmoresoup,False,negative,neutral,neutral,neutral
gtm43h7,Because Byjus people are really cunning and scamming lower middle and poor class people.,3,1,1617742535.0,pooniahigh,False,negative,negative,negative,negative
gtmfmo7,This guy gets it,1,1,1617748014.0,Nightpac,False,positive,positive,positive,positive
gtmchmn,Took down the profile meaning? Did they cancel his payments and all?,2,1,1617746449.0,Thunder_Volty,False,neutral,negative,neutral,neutral
gtnhobc,BINGO. Its already been taken down. They took down the kids entire profile itself from LinkedIn at 3 am last night.,3,1,1617768217.0,pooniahigh,False,negative,negative,neutral,negative
