Comment ID,Comment Text,Comment Score,Comment Depth,Created Timestamp,Author,Edited,Semantic Label,Semantic Label 2,Semantic Label 3,Major_Semantic
gtnhkdz,"Probably the post will be taken down by Byjus.
They always do that!",3,0,1617768147.0,,False,negative,negative,neutral,negative
gtnywe5,"How do you think they became a deccacorn in the first place ??! 

Also YouTube is free and a really valuable resource for studies . Please consider youtube over Byju's . Also don't download the app ,  once they have  your number , they will call you untill Oblivion .",3,0,1617782223.0,ThyInFaMoUsKID,False,neutral,positive,positive,positive
gto42sk,This is their USP. Defrauding innocent families with the fear of education,3,0,1617787369.0,BLACK-SHEEPXxX,False,negative,negative,negative,negative
gtm8uuq,"If Byjus' services are bad, wouldn't it itself fizzle out in 2-3 years when it is unable to bring out the ranks and everything?",2,0,1617744719.0,goodgodlemon1234,False,negative,negative,negative,negative
gtmz95o,"How can one put so much money into some service which they haven't recieved yet? You pay after getting the service, not before.",2,0,1617758003.0,,False,negative,negative,negative,negative
gtn47vv,"Not to forget that the tab that byjus provides is complete bullshit
Mine stopped functioning in 6 months even though I took care of the tab well",2,0,1617760512.0,GladFeeling8074,False,negative,negative,negative,negative
gtn8dz5,I feel so sad that aakash's going under Byjus's.,2,0,1617762741.0,Sirilreddy,False,negative,negative,negative,negative
gtnfd7w,"all of the things ever supposed to taught on the BYJUs platform are available for free.  
If you want to learn, learn how to google things.  


please do not waste your time and money on this crap.",2,0,1617766755.0,naresh_bansal335,False,negative,negative,negative,negative
gtnfq1s,"So this happened with one of my cousins. He is class 10 right now and few months back someone from Byjus came to his house and told him that he won 25k scholarship. But it turns out that the scholarship actually was a pendrive with ""25k worth"" study materials. But if they had to continue they have to pay the remaining amount. Like most middle class families, they refused it the moment they were asked to pay money. After few days had passed, the father of the Byjus representative came to their home this time. He told my aunt that how his daughter had to complete her target or else she would loose her job or something. What happened next is something I had never seen or heard about and shows how shitty this company is. Her father was willing to pay for the Tablet. So they took the money and then bought the tablet from the girl kr through the girl or something like that.

Couple things I learnt from this:

*  Indian parents are very gullible and easily fall into Byjus trap of ""Your kid is special so buy our device""  They also get to boast how their child got a scholarship to their family and friends.

*  If this is how the employees are treated that they are forced to spend their own money just to keep their job then imagine the pressure on parents and students.",2,0,1617766974.0,d3xm0rg,False,neutral,neutral,negative,neutral
gtni4yp,"I used to work with Byju's as a Manager, I handled a team of sales people who report to me.  
I joined on October 20th and I got my hands on the study material in November 2nd week.

As soon as I saw the material I knew what we were selling was just useless shit and I put my papers down because I do not want to be a part of the biggest scam of this decade.

Trust me people all Ravindran cares about is the money and doesn't give a shit about the quality or the learning material.

Please stick to your books and the best sources can be found on Google and Youtube for FREE!!!",2,0,1617768513.0,Round_Net_5249,False,negative,negative,negative,negative
gtnlxkt,Why doesn’t someone just attack their IP? Record their videos and dump it all over the internet,2,0,1617771097.0,dramebaz,False,negative,negative,negative,negative
gtnmi6r,"Never ever lock-in services for years together. If you do this, more often than not the services will be poor (Hint: Club Mahindra).  Money is the leverage for people to work hard and satisfy your needs, and if you don't have this leverage at the \*end\* of the service term, the human and business psychology is against you.",2,0,1617771505.0,geodude84,False,negative,neutral,neutral,neutral
gtnnfvu,"And they just acquired Aakash, in the biggest deal ever in the educational services sector, guess where did the funds come from",2,0,1617772184.0,BarnacleFar7109,False,positive,neutral,neutral,neutral
gtnouze,"Agreed, I have BYJUS tablet and its shit as well",2,0,1617773311.0,Main-Construction-29,False,negative,negative,negative,negative
gtnp9b3,Many youtube channels are doing similar educational videos for the state/central bord children. I wonder why people flock to this company that is selling education as though it is some kind of goods.,2,0,1617773636.0,marimuthu96,False,negative,negative,negative,negative
gtnqf9t,And they just bought Aakash for $1B,2,0,1617774598.0,,False,neutral,neutral,neutral,neutral
gtnr3tl,"Byjus like edtech's are taking advantage of the mentality of Indian parents. Most parents wants their children to score well and want to provide the best of all education. But in that process, they easily fall prey to the clever persuasive tricks of a sales representative of this business. Most of this edtech are in market only to loot money from middle class parents.",2,0,1617775169.0,Chance_Midnight,False,negative,negative,neutral,negative
gtnr683,Byju is shit,2,0,1617775226.0,anuradhaibsg,False,negative,negative,negative,negative
gtnszdt,"There is a guy's channel named ENGINEERING4FREE on youtube. It has playlist on subjects like calculus , algebra , statics, mechanics of materials. They are really good and concise videos covering the basics of each subject very well.",2,0,1617776771.0,Chance_Midnight,False,positive,positive,positive,positive
gtntpye,Edutech industry of india are becoming scam of the decade.,2,0,1617777407.0,Redpoison11,False,negative,negative,negative,negative
gtntrvl,We should nudge Newslaundry /Quint / Scoop Whoop unscripted to do a story on Byjus and whitehat junior scams.,2,0,1617777452.0,neutrinome,False,neutral,neutral,negative,neutral
gtnucex,"Pro tip. Whenever a BYJUS salesperson approaches, act like you are retarded and have dyslexia.
Dude, wherever you stay there will be many private teachers who will help you out with studies. The satisfaction you get when someone teaches you the concepts in real time and with care is totally on a different level.",2,0,1617777956.0,duckmeatcurry,False,neutral,neutral,neutral,neutral
gtnva25,they're a complete scam. just like white hat jr.,2,0,1617778794.0,,False,negative,negative,negative,negative
gtnvht1,"They are just trying to increase revenue and sales by making parents fall prey to their batshit products .
Honestly so disappointing!!",2,0,1617778991.0,ornamental_thong69,False,negative,negative,negative,negative
gtnwana,"Hi, I used to be a salesperson at Byjus. They call because we used to face immense pressure. Everything from calls to daily pitch was audited and feedback done. There is attendence criteria regarding talktime and demos. 

I sometimes feel sad to call parents but i have no other choice not to. Anyway glad to report that i have successfully cancelled all the sales I made and got their refund. 
I know this is shitty. I know the pitch is shityy but no choice",2,0,1617779737.0,Note-Full,False,neutral,neutral,neutral,neutral
gtnwq9i,"Khanacademy has everything you need to learn, even if you compare Byju's content with khanacademy it is better.Byju is expensive.however if u want to learn everything is free on internet what I think about byju is they do spoon feeding.",2,0,1617780131.0,lustySnake,False,neutral,neutral,neutral,neutral
gtnwy63,This is what happened with me too. I forced my parents to bought me that shitty thing for 9th & 10th grade. My grades degraded. There was so much communication gap. My parents told that counselor to refund the money but she never called back. I still feel guilty while watching cricket.Byjus is shit. Fuck u Byjus!,2,0,1617780334.0,Disastrous-Ear-3774,1617780662.0,negative,negative,negative,negative
gtny2mr,"This company is a fraud. 

I have many friends working there as BDE and some other posts. It has the worst work culture and is a toxic place. They are not even delivering the product they promise to and are duping innocent people who have set money aside for education.",2,0,1617781423.0,,False,negative,negative,negative,negative
gtnybfm,"This whole country is running on scams, shame!",2,0,1617781663.0,iamscr1pty,False,negative,negative,negative,negative
gto0237,"They must absolutely allow for a cancellation of their subscription at any time! That ensures they keep up the quality and customer care even, this isn't done.",2,0,1617783378.0,WavesKraft,False,negative,neutral,positive,neutral
gto3f6w,"That said, here are two things you should always remember:

1. BYJU’S has betrayed it’s customers (and no one gives a fuck because BYJU’S has monopoly)
2. Read the terms and conditions yourself instead of blindly trusting the customer service",2,0,1617786722.0,,False,negative,negative,negative,negative
gto3yrm,Is there anything we can do against companies like these? There has to be some regulations right,2,0,1617787260.0,nikhilccccc,False,negative,negative,neutral,negative
gto4x2k,"As an FYI, LinkedIn took down the kid’s account.",2,0,1617788199.0,randomshittinMe,False,neutral,negative,neutral,neutral
gto5z5z,Why is no body offering this kid help? Who is the OP?,2,0,1617789204.0,chaudharysahib08,False,negative,negative,negative,negative
gto6bjg,"How come something like class action lawsuit not an option here?! There are WAY too many negative experiences and harassments to just ignore! 

I'm not a lawyer, so I don't know that will work out in India...",2,0,1617789532.0,an_iconoclast,False,negative,negative,negative,negative
gto8la6,They got the kid’s post and account deleted. What a shame .,2,0,1617791576.0,KN-21,False,negative,negative,negative,negative
gto8ypw,Fuck byjus,2,0,1617791890.0,Moist-Technology-278,False,negative,negative,negative,negative
gtponlu,"I think Byju's have taken down this post and this kid's account  
It is not showing in LinkedIn",2,0,1617817871.0,,False,negative,negative,neutral,negative
gu90nor,"recently, a byjus salesmen took an interview with my parents( im in 10th) , THEY DELIBERATLY ASKED TOUGHEST QUESTIONS(11TH AND 12TH LEVEL) AND WHEN I COULDNT ANSWER , THEY GUILT TRIPPED ME BY SAYING WE EXPECTED MORE FROM YOU AND ASKED MY PARENTS TO ENROLL SO I COULD "" CATCH UP""??",2,0,1618232861.0,qwertypad1,False,negative,negative,negative,negative
gtl5qz2,Capitalism Friends....,3,0,1617727603.0,FidelCatto1718,False,neutral,neutral,neutral,neutral
gtlp6zo,BYJU's is basically Kota but on a much larger scale,1,0,1617736097.0,thomas_blanky,False,neutral,neutral,neutral,neutral
gtnpzn3,"I am not commenting on Byjus, but is it really easy to get credit in India? Without a proper income & expenditure assessment the banks are providing credit? No banking regulations on this?",0,0,1617774235.0,bilby2020,False,negative,neutral,positive,neutral
gu9ihtr,"Sorry guys I read most of the comments that I could.
I am in final year of my graduation. I had also purchased BUJU’s subscription. I am satisfied with the kind of knowledge I got from BYJU’s.
After watching those videos, I came to know that the way we studied is not the way to study. And I don’t know about you guys, but I have asked most of the students or my classmates too, some logical question which they were not able to answer.

I know schools are not just for studies, but lets talk just about the study part. The fees that private schools and private tutors are having, and the kind of knowledge most students have, I feel paying Rs. 23000 for studies will definitely benefits you. I have seen most students using an iphone in a age where they used it just for either showing off or for using social media applications only.

Yes one more thing I have seen most students making their parents fool by showing their report cards and also showing them the percentage they have scored. And when they sit in a competitive exam, then they starts knowing about themselves.

Whatever happens with the girl was very unfortunate, but there are a millions of downloads of BYJU’s application. Why we are just  making judgements based on one side.
Let’s see may be it would have happened mistakenly and she will get back her money.

Guys I just want to say that it would have happened mistakenly. 
Thanks",0,0,1618241500.0,Frequent-Literature7,False,neutral,neutral,negative,neutral
gtnlvs7,Today's kids are Idiot,-2,0,1617771063.0,grumpy_hooman,False,negative,negative,negative,negative
gtn2pvz,"I don't get this outrage against byjus.

It is a shit company that charges people for something that is already available for free and in better quality over the Internet.

But it is a free market. It is not forcing anyone to sign up.

What is the issue?",-10,0,1617759746.0,vrn_new,False,negative,negative,negative,negative
gtn8gy9,Not trying to be an A hole but all of these issues will be fixed if ppl just have less children.,-15,0,1617762786.0,greyasshairs,False,negative,negative,neutral,negative
gtlr5x2,It's a scam in which all parents are being trapped . It's gonna be all good until trial class or demo classes but after buying course they don't give ao much attention to your ward.,1,0,1617736970.0,lazylast,False,negative,negative,neutral,negative
gtmeaxw,"The problem is innocent parents who get in these sort of traps 

Mine almost fell but it was me who rescued em 

The education services these byju's and vedantu provide is shit compared to what sort of quality content is freely available on YouTube

I seriously wonder how can parents be so dumb to believe these things
The one who scream a lot and boast of how good they are .. are generally bad at the service

It's a general rule of thumb for me if any one here needs coaching advice for jee/neet just listen to a decent senior who knows what one should do for cracking and just build up on those fundamentals

Coaching as a whole is just hyped up advertised BS i.e. that gives unnecessary pressure",1,0,1617747346.0,HostileCornball,False,negative,negative,negative,negative
gtn5fwz,BYJU has done so much good marketing but they have dropped their standards for offering quality services.🤦‍♂️,1,0,1617761157.0,bjason__,False,negative,negative,neutral,negative
gtn7042,https://tatti.company,1,0,1617761997.0,wwww00000,False,neutral,neutral,neutral,neutral
gtnbajc,"All these online schooling are mostly frauds, trust online schooling of the institute which takes offline classes also",1,0,1617764348.0,Psychological_Ant671,False,negative,negative,negative,negative
gtnbf26,Almost every coaching institute in india takes 2 years fees in advance and you can't discontinue because they won't return your money . It's pretty shit .,1,0,1617764420.0,itsnotmine679,False,negative,negative,negative,negative
gtnefqb,"I have said it before, a society build on the sole aim of profit maximisation and trade will inevitably create monstrosity such as this one. 

BYJU's is just another corporation doing what they think they are supposed to (profit above all). They get away with it because system not only allows that but rewards their behaviour.",1,0,1617766187.0,Garv93,False,negative,negative,neutral,negative
gtnf4bv,[removed],1,0,1617766605.0,,False,neutral,neutral,negative,neutral
gtnfoh8,"byjus is dogshit , we always knew that but never really spoke about it.",1,0,1617766945.0,abmasterisonreddit,False,negative,negative,negative,negative
gtngfx6,Why not tell your dad to stop paying for Byju's classes when you already know they are scamming you.,1,0,1617767431.0,Yalla6969,False,negative,negative,negative,negative
gtngfzb,"This is as usualy activity when someone get the full amount upfront. 

Avoid paying upfront for any services. That's the only solution.

Very bad",1,0,1617767433.0,rti_11,False,negative,negative,negative,negative
gtngu88,Students beginning to realise on their own is the beginning of a good thing.,1,0,1617767683.0,agentjob,False,positive,positive,positive,positive
gtnhcd2,This is why I switched to Extramarks,1,0,1617768006.0,,False,neutral,neutral,neutral,neutral
gtnhxsx,"Vedantu is so good in comparison.  
\-Teaching is good  
\-Nicely made schedule  
\-Live Doubt Solving  
\- If you a higher package you get a PERSONAL Teacher and they can resolve your doubts  
\-Call from either Mentor or teacher almost daily maximum 3 days gap  
\-Feedbacks are worked on almost immediately   
\-Some students said they want a new batch where they would explain in Hindi but the content was in English, so they made a new batch  
And many more good stuff",1,0,1617768381.0,shubhbadonia,False,positive,positive,positive,positive
gtnihha,Once my dad gave me his phone and opened this app byjus to study when I was in 9th. I used it some days and I can say that it is trasssshhh. I closed it and unistalled it. Never gonna use it again.,1,0,1617768745.0,Aalsee34543,False,negative,negative,neutral,negative
gtnkddh,Did anyone else read ₹53000?,1,0,1617770022.0,wizeon,False,neutral,neutral,neutral,neutral
gtnkn0h,"Every time I see something about consumers suffering, I can only think about the consumer laws. Why is it so hard to sue them, is the law just don't care? Is it inaccessible to the uneducated? Why do you need to be sucking their balls when they are at fault? I hate to compare any other country with India, but Dubai has laws that threaten the very bones of the managers, it's a Karen hotspot. If the company is at fault then just install the [Consumer Protection apl](https://play.google.com/store/apps/details?id=dedc.app.com.dedc_2) and a person will register the case (not like a court case) and handover a notice of sorts that you give to the company. It basically says do what he asks or your company is going to be ruined.",1,0,1617770204.0,_DEDSEC_,False,negative,negative,negative,negative
gtnlenq,"In general, this is why I'm distrusting of coaching classes.",1,0,1617770734.0,inTsukiShinmatsu,False,negative,negative,negative,negative
gtnlspb,53000? You should file a police case...,1,0,1617771004.0,predator1555,False,negative,neutral,neutral,neutral
gtnoqtf,"Also did same mistake to take akash classes after i drop 1 year after 12th for jee, paid about 90k for like 6 months. It was mostly useless like they had the material but teachers were not interested in teaching properly, it was like mugging up. Now i am doing btech i understand that everything you need is on youtube, you can easily self study from youtube or books. And also there are much cheaper options which deliver the same things.",1,0,1617773215.0,Darkl0rd3322,False,negative,negative,negative,negative
gtnoul8,Go to Jago Grahak Twitter and the consumer online redressal govt website,1,0,1617773302.0,indian_tiger,False,neutral,neutral,negative,neutral
gtnpabs,"As someone who likes teaching and is absolutely opposed to this new age online form of teaching, I am glad that students are rejecting this notion of online learning methods being capitalised by BYJUs and WhiteHatJr and what not. Old school physical class teaching is always going to be the way forward. Because a physical interaction and the ability to captivate a student's attention is what is required to learn so that a student becomes curious. And this curiosity shouldn't be limited to science and mathematics only. We genuinely need the edtech sector to stop profiting from the lack of availability of good teachers by such cheap tricks.",1,0,1617773659.0,ignorantsoul,False,neutral,neutral,neutral,neutral
gtnr6lm,Can we bring this tyrant down?,1,0,1617775236.0,thegreatescape990,False,negative,negative,neutral,negative
gtnr7u0,"My motto is ""self study is the best study""",1,0,1617775265.0,Trick-Forever6426,False,positive,positive,positive,positive
gtnrkb3,"It has literally destroyed my childhood
I went into depression
I lost 10 kgs of weight
I had suicidal thoughts
It increased the pressure from my parents as they are now paying extra money on my education",1,0,1617775558.0,zekken0007,False,negative,negative,negative,negative
gtnufza,"This is just sad. One can see how this money whore company will take down the accounts of poor people and  remove any content against them, but abusing and threatening their parents is a step too far. Sincerely hoping the case goes in your favour. It is time to stop this sick mentality. Good luck.",1,0,1617778046.0,chetan_bhagat6969,False,negative,negative,negative,negative
gtnut5o,"I remember the days when Byjus had just started and used to teach things for free. Few things and videos were absolutely free to watch and they helped me a lot. I still remember the concepts.

But now it seems like they have become greedy. Ultimately people will suffer 😕",1,0,1617778369.0,Blue_Eagle8,False,positive,negative,neutral,neutral
gtnv366,If this is the future of education system childrens in our country are screwed,1,0,1617778621.0,Independent_Dog5496,False,negative,negative,negative,negative
gtnvr88,Damn,1,0,1617779229.0,porousasshole,False,neutral,negative,negative,negative
gtny5un,"I remember I was in 10th grade and there was something called the TOI Think and Learn challenge and it was sponsored by, no points for guessing : byjus. They conducted a “test” in school and almost everyone got selected for the city round and they claimed that all the kids who get selected were apparently the top 10 % of the crop lol.. so when we went there for the city round, byju raveendran went on the stage and started promoting his product LOL what a waste of time and energy and money.",1,0,1617781512.0,,False,neutral,neutral,negative,neutral
gtnyw3i,"See parents can spend 53k to buy some video lecture but they hesitate to give half of the money to a local or a tutor nearby, company like this are not only hampering the time and money of their students but also the tutors who work hard to teach and make living, because I remember techers of my time who used to put their 100% to make result and now a days teachers on these platforms are not techers they became more of a sales executive of these companies.",1,0,1617782215.0,ankitsingh8800,False,negative,negative,negative,negative
gto0wok,How long will this scam go on 👺,1,0,1617784212.0,meltingsage_,False,negative,negative,negative,negative
gto2k2m,It's all because the BDAs are very much forced into selling their product and clear all their leads. Every sales manager also is under pressure of a certain sales target. These assholes hire freshers from colleges baiting them with a 10lpa profile ( the in-hand is very less) and after a month or 2 fire them for not fooling the parents. And given byjus had a bad name they are finding it difficult to sell their products so they come up with all shitty schemes. Honestly there isn't a single sales person who is happy with byjus I can say that for certain and the top management are the real devils for giving such unrealistic targets for their salesmen and coming up with shitty schemes to rob the poor,1,0,1617785874.0,Shitsnoone,False,negative,negative,negative,negative
gto45tb,I wont how and why families are still falling for their shit,1,0,1617787453.0,BLACK-SHEEPXxX,False,negative,negative,negative,negative
gto4tmg,Education is one of the biggest scam of all time,1,0,1617788108.0,DennisD0_o,False,negative,negative,negative,negative
gto7rw7,"My sister was chosen by her school for the 'Toppr' education thing. Their employees came to our house, talked for about 2.5 hours about their program. In the end, they started talking about the fee. 1.8 lakh for 10th grade. When my dad said he wanted time to think, they told us that our 'free trial' was the visit and we had to make our minds up then and there. My dad couldn't get them out of the house fast enough.",1,0,1617790859.0,Starrs_07,False,neutral,neutral,negative,neutral
gto7y9u,Contact your card company and raise a dispute with them for this transaction.. Explain them that you have not received a product for this payment.,1,0,1617791015.0,mirchi0946,False,negative,negative,neutral,negative
gto9ao2,Why don’t you sue BYJU?,1,0,1617792171.0,amolpi,False,negative,negative,neutral,negative
gtojkea,"Sorry it's gonna hurt, but your parents are really stupid for buying that ""house study package"" in the first place.",1,0,1617799174.0,eambar,False,negative,negative,negative,negative
gtop04e,Education is only one part of life.,1,0,1617802035.0,santhoshkumar97,False,neutral,neutral,negative,neutral
gtov89k,"india has this sick education system and these relatives of ours just keep on talking trash in our parents ears and our parents put pressure on us kids, 'fish cannot be judged by its ability to climb a tree , there can be a monkey in class who can climb the tree and be topper',people are striving to get their ass to institution like nit but the reality is there are shitload of graduates comming out of there every year, 

&#x200B;

we the youth need to change this",1,0,1617805029.0,starboy_h9,False,negative,negative,negative,negative
gtpr1iw,Isn't Platforms/Apps like Byju's playing on parents/students herd mentality ?...Parents/Students might think that they are losing something because the other person has taken it and might get better marks because of it...,1,0,1617818891.0,saurav_sarkar,False,negative,neutral,neutral,neutral
gtprc8g,Fuck BYJUS,1,0,1617819020.0,KrishSkywalker,False,negative,negative,negative,negative
gtujchk,They even got on the cricket team jerseys BIG TIME! 😳,1,0,1617911066.0,deepakparyani,False,neutral,positive,neutral,neutral
