Comment ID,Comment Text,Comment Score,Comment Depth,Created Timestamp,Author,Edited,Semantic Label,Semantic Label 2,Semantic Label 3,Major_Semantic
hjmw8qh,That’s the best one you came up with in an AMA hosted by a Facebook whistleblower?,3,1,1636257000.0,benaffleckisaokactor,False,neutral,neutral,positive,neutral
hjkfim6,"I'm not sure what you mean by ""data revenue."" Facebook does not directly sell data, but effectively sells data access by selling ads that it sends to users based on data. In Q3 2021, Facebook officially publicly reported that it made 28.3 billion USD from advertising, and 0.7 billion USD from other sources. If we assume that advertising is 100% dependent on data and other revenue is 0% dependent on data, this would mean that 97.5% of FB's revenue is data-dependent.",25,1,1636216307.0,szhang_ds,False,neutral,neutral,neutral,neutral
hjks9rs,"I haven't - I think that would be an exceptionally stupid move for others to make, as they can probably surmise from my history that I would probably publicly release that communication.",30,1,1636221692.0,szhang_ds,False,negative,negative,negative,negative
hjl08m1,"I think it's a telling statement that I have been repeatedly asked this discussion in my India AMA, to an extent that I certainly did not receive in my global AMAs or my U.S. AMA.

&#x200B;

I am personally safe, but the frequency of this question asked by Indian questioners makes me fearful regarding the rule of law and democracy in India, and the situation for those who challenge the powerful and influential within India.",57,1,1636225165.0,szhang_ds,False,neutral,negative,neutral,neutral
hjkxvep,"1-2. My girlfriend and cats support me. They are very good cats.  
Right now I think Midnight is feeling ""Why isn't Sophie petting me? She usually pets me more at this time.""

3) Frankly, pretty stressful. But my work at FB was inextricable the whole time from the work I was doing as a side piece to uncover these sorts of networks. As anyone who's tried to hold two full-time jobs simultaneously can tell you, it's an exhausting endeavor that's ultimately unsustainable.

4) The people who I've spoken to are supportive. Which is probably a self-selection bias; if you think I'm an awful traitor, you're probably not rude enough to tell me to my face.

&#x200B;

I don't begrudge others the decisions they made. I chose to take this responsibility on from the start, in part because I could afford to do so. There are many others who are supporting family, who are working on H-1B visas and cannot afford to lose their jobs and be deported. It's easy for people to judge from a distance, but becoming a whistleblower is a thankless job that very few people will even consider. No one is obligated to torch their career in pursuit of an idea.

&#x200B;

6) I stay home and pet my cats. They are very good cats.",25,1,1636224129.0,szhang_ds,False,positive,positive,neutral,positive
hjlkstg,"Talk to others. Share news articles about the problem. Ask your member of the Lok Sabha to hear from me.

&#x200B;

You're just one person, but that applies to myself as well.",4,1,1636234291.0,szhang_ds,False,neutral,neutral,negative,neutral
hjkwrb4,"I did not work on misinformation/etc. personally. But Frances Haugen, a different FB whistleblower, has released documentation on a number of internal FB research proposals that would have reduced misinformation and hate speech but were rejected by FB.

&#x200B;

For fake networks, by far the largest difficulty is in finding them. As a result, it is deeply concerning to myself that when I did all the hard work for them, they still refused to act in a number of cases. 

&#x200B;

People can debate ""are the police good enough at catching criminals?"" If the police have completed an investigation that finds a criminal gang, but change their mind at the last minute when they discover the kingpin behind the gang is a MP, this shows a problem that has nothing to do with the police's investigative abilities.",6,1,1636223650.0,szhang_ds,False,negative,negative,negative,negative
hjl2es4,"It's certainly hard to say. Facebook has thus far been a bit like the Teflon company, where no criticism seems to stick. Its stock price has increased perhaps 10% since I came forward in April (even despite the drop from Frances Haugen coming forward in September.)

But past performance doesn't predict the future. I've never died, but I'm pretty sure it'll eventually happen one of these days.",6,1,1636226125.0,szhang_ds,False,neutral,positive,positive,positive
hjlgots,"If India imprisons a U.S. citizen who the Lok Sabha invited to testify, that would likely create a diplomatic incident that would make India a pariah nation. I do not believe this would occur if the invitation to testify is indeed issued (which I hold some doubts about), and I am willing to accept that risk if it happens.",16,1,1636232422.0,szhang_ds,False,negative,negative,negative,negative
hjl9fml,"1) I'm really not familiar with the deal between Reliance/Jio and Facebook. Especially not familiar with its relationship to WhatsApp.  


My immediate reaction is that the proliferation of cheap Jio smartphones in India coupled with a large population of digitally unsavvy users who haven't learned internet norms can make it easy for IT cells to operate on Whatsapp (both in easy acquisition of devices, and hiding among users whose behavior is already unusual because they don't know net etiquette.) But that certainly isn't to say ""we should make smartphones expensive and keep everyone new from getting internet access"" - absolutely not. It's just important to take the associated risks of the ecosystem into account.

&#x200B;

2) I don't have any special information on Cambridge Analytica, other than what you've read on the news. As a reminder, Cambridge Analytica technically violated FB's rules; the company's mistakes were in not providing enough oversight, rather than intentionally assisting them.

&#x200B;

3) Facebook has been suing NSO group (which is behind Pegasus spyware) for the past two years. I don't believe FB has facilitated Pegasus intentionally.

&#x200B;

4) That's what I'm doing in this AMA",9,1,1636229206.0,szhang_ds,False,neutral,negative,neutral,neutral
hjkjad8,"Facebook does use independent fact-checkers for assessing misinformation. They officially use the following in India (copy+pasted from their website):  


AFP  
  
Boom  
  
Fact Crescendo  
  
Factly  
  
India Today Fact Check  
  
NewsChecker  
  
Newsmobile Fact Checker  
  
The Healthy India Project  
  
The Quint  
  
Vishvas.News",24,1,1636217908.0,szhang_ds,False,neutral,neutral,neutral,neutral
hjk5rtb,"I made it, but thanks for asking these on my behalf. Also my questions were framed 6 days ago when this AMA was announced so, sorry for the questions regarding how FB deals with mis-information.

But I would like to add to my list of questions :

1. Are there separate teams for dealing with inauthentic behavior and fake accounts across Whatsapp, other Facebook owned services like Instagram and Messenger and Facebook itself ?
2. Do these teams co-ordinate in some manner ?",2,1,1636212125.0,,1636212534.0,neutral,neutral,negative,neutral
hjki3c8,"(I want to be clear that I don't have an opinion on the effect of FB on the 2014 elections.)

&#x200B;

A large part of the problem, as I see it, is that at Facebook the people in charge of public policy (and deciding what the rules are and how they should be enforced) are the same people as those tasked with lobbying governments and politicians. This creates a natural conflict of interest.

  
It's true that Facebook is a company - but so are the Times of India, the New York Times, the Guardian, and Der Spiegel. These news organizations usually keep a stringent separation between their editorial department and lobbying efforts. It would be unthinkable for Der Spiegel to kill an article because it made a German politician look bad; at Facebook this would be business as usual. And this is an organizational dynamic that is not common in technology companies as I understand it - Twitter keeps them separate. And so when I testified to the British parliament 3 weeks ago, I proposed regulation that would require companies over a certain size to keep these departments separate.

&#x200B;

But this would not solve all the problems. Twitter has also given in to political pressure from governments such as Russia and (unfortunately) India to make decisions that were arguably politically motivated. Ultimately, the Indian people have to be willing to stand up and demand a level playing field, a society where rules are equally enforced rather than having laws for the common man and impunity for the influential and powerful. That is the only outcome that can prevent governments and parties from exerting these pressures in the first place.",25,1,1636217404.0,szhang_ds,False,neutral,negative,negative,negative
hjkq219,"1) Facebook has chosen to fight against NSO group with lawsuits for the last two years - NSO a spying group paid by world governments to hack into and spy on their political enemies. S[ome of the spied on targets were revealed this year to include Indian journalists.](https://www.news9live.com/india/pegasus-leak-list-of-indian-journalists-snooped-by-israeli-nso-groups-spyware-48378.html)

I am critical of other decisions made by FB, but I am strongly supportive of this one.

&#x200B;

2) Misinformation that leads to populist destabilization has happened in a number of countries including e.g. Myanmar, which was a smaller developing country that was formerly a democracy (if deeply flawed.)",3,1,1636220729.0,szhang_ds,False,negative,neutral,neutral,neutral
hjkoeiw,"I think that it's important for the world to come together as a whole to regulate FB - going at it individually leads to disparate outcomes and lack of success as seen in Australia. But dictatorships will demand the right to treat social media in their home country as their own playground. Perhaps a group like the G7 + India, Brazil, Mexico would be best.",7,1,1636220030.0,szhang_ds,False,negative,neutral,negative,negative
hjkyjrf,"It is my personal belief that E2E encrypted messaging services should be regulated to limit mass messaging and mass forwarding. This would reduce the ability of e.g. Whatsapp to result in mass lynchings as have tragically happened in the past four years, without impairing user privacy.",2,1,1636224427.0,szhang_ds,False,negative,negative,negative,negative
hjksu81,"I have offered the Lok Sabha my detailed documentation which includes the answer to this question (among many others.) If the Lok Sabha is unwilling or unable to take it up, I will explore other options.",12,1,1636221936.0,szhang_ds,False,neutral,neutral,neutral,neutral
hjkrih4,"Well, I'm trying to do it right now. If you're concerned, you should try informing and educating them yourselves as well.",11,1,1636221366.0,szhang_ds,False,neutral,neutral,neutral,neutral
hjkrf4b,"I'm really not an expert on this. A number of people have discussed technological distractions in the classroom, including by social media. As a result, many classrooms prevent teens from using cellphones/etc. during class.",3,1,1636221327.0,szhang_ds,False,neutral,negative,negative,negative
hjkni39,"There isn't. It's an urban myth.

&#x200B;

To those who think that FB spies on your conversations, I'll just say that I discussed my plans to blow the whistle on FB in front of my personal phone. If FB didn't care about spying on that, what makes you think they'll spy on you for ads?",12,1,1636219650.0,szhang_ds,False,neutral,neutral,negative,neutral
hjl1v4s,"In Mexico, I found a large scale of activity (perhaps 10k accounts worth of IT cells) that were acting across the political spectrum, supporting all major political parties (PAN, PRI, MORENA.) The majority however seemed to support the PRI, which may be related to the much-rumored Penabots. 

&#x200B;

To be clear, I did not find any attribution to political parties here - actually, I'd stopped looking by this point because I discovered that finding attribution made it more difficult to have them taken down.",5,1,1636225879.0,szhang_ds,False,neutral,neutral,neutral,neutral
hjlg86z,"1) There are mixes of each. IT cells can be run 'in-house' by political parties - at the extreme, being personally controlled as a hobby by an MP (or someone with access to his personal account.) There are also mercenary-style IT cells which are effectively hired by others. In one unusual case I worked on, the same fake accounts were used to support the INC in Punjab and the AAP in Delhi - even while the Punjab AAP was protesting the Punjab INC over electricity hikes. I can't read minds, so I don't know if this somehow advanced a single political agenda, if the IT cells had hired access to the same fake accounts, or if it was a single IT cell hired by multiple people.

2) Sorry, no clue.

3) IT cells are tiny compared to overall activity on FB - several billion users. I do not think activity from IT cells is a consideration for FB. The hesitancy is presumably caused by political considerations which imposes a cost upon acting.",3,1,1636232213.0,szhang_ds,False,neutral,neutral,negative,neutral
hjli4rw,This was a great question.,1,1,1636233073.0,parlor_tricks,False,positive,positive,positive,positive
hjky7gk,I'm not familiar with IPAC. The pro-INC network in Punjab was established to be run by an outside mercenary-type group that also acted to produce fake e.g. google business reviews. We don't know who hired them.,2,1,1636224276.0,szhang_ds,False,negative,negative,negative,negative
hjl4t0e,"I'm not personally aware, and it's impossible to rule anything out, but most people and politicians are focused naturally on their own countries. Harassing random Pakistanis on the internet does nothing to help an Indian politician win elections. At the most, it might be used to spread hate speech to Indians for the purpose of nationalistic mobilization.",3,1,1636227177.0,szhang_ds,False,negative,negative,negative,negative
hjl54on,"1) It was pretty silly and awkward. I had a very nice manager. She was so nice that she didn't want to tell me that I was being fired herself and outsourced the job to HR. They essentially acted as a relay to tell me I was being let go.  


They also ordered me not to tell people I was being fired, which I was pretty bemused by. What were they going to do after all - fire me again?

&#x200B;

2) Sorry, I'm intentionally refraining from answering these technical questions because IT cell people read Reddit too, and I don't want to help them",8,1,1636227315.0,szhang_ds,False,negative,negative,negative,negative
hjliuo3,"Facebook has served to connect the world. In countries with robust internal institutions such as Britain, my belief is that Facebook's net impact is harmful. In countries with minimal internal institutions, such as the one-party dictatorship of Azerbaijan, Facebook likely has a net benefit simply because the situation was even worse before the company's advent.  


I was surprised by the official statement made by Ali Karimli, the Azeri opposition leader, after I came forward with FB's unwillingness to act on the Azeri governmental network that was harassing him and his political cause. He would have had every right to castigate Mark Zuckerberg for failing himself and democracy in Azerbaijan. But instead he gave a very measured statement, that went something like this (paraphrasing): ""I thank Mark for creating Facebook, which allows the opposition to connect and have their voices heard in dictatorships. But he should hire someone who speaks Azeri."" Because in the end, the alternatives were worse. It's likely for this reason that the PRC has banned Facebook, why I believe Weibo to be worse than FB for all the company's flaws",7,1,1636233403.0,szhang_ds,False,negative,negative,negative,negative
hjleooh,"1) Well, 100% of the fake accounts I've found have been fake... not entirely sure what you mean  


2) I would ask him to resign. But not like he'll listen to myself. It's like asking ""If you could shout something at the sky, what would you shout?""",2,1,1636231527.0,szhang_ds,False,negative,negative,negative,negative
hjl31qu,"I consider myself cautiously optimistic on the Oversight Board - they're in a difficult position as FB has set them up as effectively a puppet organization. Fundamentally, they focus on very few cases to try and set precedents (just as the vast majority of court cases do not end up before the Supreme Court of India.)

&#x200B;

Ultimately, FB responds to public pressure - my suggestion would hence be attempting to raise the issue to the news if you are convinced that this content should not be allowed.",6,1,1636226408.0,szhang_ds,False,negative,neutral,neutral,neutral
hjlc3zz,"1) I was hired in January 2018. In the summer of 2018, I started working on this in my spare time. In January 2020, I was ordered officially to stop, told that this activity was not valuable for FB, and told that I was underperforming as a result. My performance did decline during the pandemic, and so they fired me.  


2) I was sort of unique at FB as far as I could tell in my willingness to take on responsibility for these completely new areas in my spare time. There were certainly many at FB who had concerns about the direction of the company. For instance, the whistleblower who came forward last summer about Ankhi Das' close relationship with the BJP. Many people in Civic Integrity considered themselves servants of the people, and felt an obligation to stay through the U.S. 2020 elections. But by now, most of the people who raised concerns within the company have left the company, and those who raised concerns over why those raising concerns left the company have also left the company...

4) There's certainly plenty of cases in which political pressure was alleged to have caused FB to fail to act - whether in India, or even the United States (both of which are democracies.) I cannot read minds, and so I don't know the truth of what motivated their actions.",1,1,1636230397.0,szhang_ds,False,neutral,neutral,negative,neutral
hjkvn94,"It depends on precisely what you mean by this. I would be strongly opposed to making public back-end code that e.g. explains precisely how tech companies catch fake accounts, for the same reason that it would be a terrible idea for India's Intelligence Bureau to publicly announce how they catch PRC/ISI/etc. spies - doing so would provide a perfect guide to adversaries of what to avoid.",9,1,1636223162.0,szhang_ds,False,negative,neutral,neutral,neutral
hjl3ef1,"I disagree strongly with Mark Zuckerberg's actions, but I don't think it's useful to attack him personally. He is as human as you or myself.",28,1,1636226561.0,szhang_ds,False,negative,neutral,positive,neutral
hjm8bkb,"&#x200B;

Hahaha.",1,1,1636245018.0,naveenpun,False,neutral,neutral,neutral,neutral
hjkz36g,"well, have you used a tool called autoliker? It's pretty obvious. You should stop using it if you are. And if you did, you should go to account settings -> security -> active sessions to find the sessions that aren't yours and end them.",4,1,1636224660.0,szhang_ds,False,negative,negative,neutral,negative
hjkt4y3,"An economist would call this a market failure - something that occurs when the free market's imperfections have come to fore and regulation is necessary.

&#x200B;

Governments regulate cigarettes without destroying the system of capitalism. Governments have national banks and regulate financial institutions without imposing communism. So yes, I don't see how destroying the system of capitalism as you put it is necessary to avoid this",9,1,1636222064.0,szhang_ds,False,negative,negative,negative,negative
hjkoyrz,"I have not advocated censorship anywhere. I am advocating for the fair removal of fake accounts.  


Stopping politicians from setting up hundreds of fake accounts pretending to be their supporters is not censorship - it is protecting freedom of speech. Just as stopping politicians from stuffing ballot boxes is not voter suppression - it is protecting the right to vote and sanctity of the ballot.",11,1,1636220267.0,szhang_ds,False,neutral,neutral,neutral,neutral
hjl0tzr,I'm sorry - I'm not familiar with this other than what's been publicly reported in the news.,3,1,1636225425.0,szhang_ds,False,negative,negative,negative,negative
hjkaznb,Also like Iran in the late 70's. We are on a very similar path and look how that country is today!!,1,1,1636214349.0,,False,neutral,neutral,neutral,neutral
hjkitzm,"Absolutely not.  


I don't know why anyone would want to be a public figure. I just want to stay home and pet my cats.",9,1,1636217717.0,szhang_ds,False,negative,negative,negative,negative
hjkqm5b,"The nature of E2E encryption is that it is impossible for Facebook (and others not in the conversation) to read Whatsapp messages, unless of course conversation participants forward the messages (e.g. by reporting them to FB.) 

&#x200B;

My personal belief is that E2E messaging services should be regulated to limit mass messaging and mass forwarding capabilities to prevent incidents such as the tragic lynchings related to Whatsapp rumors that occurred in India in the past four years.",19,1,1636220976.0,szhang_ds,False,neutral,neutral,neutral,neutral
hjkzjtd,"I found 2 pro-BJP IT cells, 1 pro-AAP IT cell, and 2 pro-INC IT cells... I don't see how this is a double standard. If anything, it seems very nonpartisan to me.

&#x200B;

It is however a double standard when a BJP IT cell is left alone. There exists an infamous quote from a Latin American dictator: ""For my friends, everything... for my enemies, the law."" Because the rule of law is perverted if laws are unequally applied - that is the hallmark of dictatorships such as the People's Republic of China. And now Facebook, it seems.",27,1,1636224862.0,szhang_ds,False,neutral,neutral,negative,neutral
hjkxbb1,"I've heard this sentiment a lot. But if everyone says ""I have no hope, what makes you believe that anyone can change anything"", then it becomes a self-fulfilling prophecy and you can congratulate yourself on how correct you were. 

I chose to act to protect democracy and discourse worldwide for countries that I've never been to because I rejected the idea that I was powerless. My message has been heard by millions worldwide.

What can you do?",15,1,1636223885.0,szhang_ds,False,neutral,neutral,positive,neutral
hjl5d4n,"I have offered detailed documentation on my work to the Lok Sabha, which includes the answer to this question. Should the Lok Sabha be uninterested or unwilling to take it up, I will explore additional channels.",5,1,1636227420.0,szhang_ds,False,neutral,neutral,neutral,neutral
hjllp6g,"this type of cynicism is precisely how democracy and the rule of law dies.  


""If I arrest a politician for ballot stuffing, I'm helping his opponents and taking sides""  


""Everyone ballot stuffs, what's the point of arresting one person for doing it?""",7,1,1636234691.0,szhang_ds,False,negative,negative,negative,negative
hjobt2o,it is a COUNTRY,1,1,1636294725.0,NS8821,False,neutral,neutral,positive,neutral
hjku4cb,"I am not a PRC agent. If I were a PRC agent, I would probably be a very stupid one who's about to be arrested for describing Taiwan as a country in my post.

&#x200B;

I do not hate India. India is the world's largest democracy, and I very much hope it remains the world's largest democracy.

&#x200B;

I am not an agent of the CIA. If I were, I would certainly not have spoken out against the right-wing U.S.-allied government of Honduras, which came to power after an allegedly U.S.-backed coup in 2009.",11,1,1636222494.0,szhang_ds,False,negative,neutral,negative,negative
hjkgdl9,"I did not work on FB Libra, and have no knowledge regarding it outside of the public statements and reporting.",1,1,1636216674.0,szhang_ds,False,neutral,neutral,neutral,neutral
hjktccj,"I think adversaries recognize that if I'm assassinated while preparing to testify against MLAs and MPs, they will only amplify my message of justice and fair treatment.",6,1,1636222155.0,szhang_ds,False,neutral,neutral,negative,neutral
hjkrnpi,I would be extremely surprised if FB granted the Indian government access to Indian opposition leader data. Such a move would be extremely controversial within the company and probably result in mass resignations if it did occur and were made public.,8,1,1636221430.0,szhang_ds,False,negative,negative,negative,negative
hjkp57i,"Frankly, I didn't hear about this bill until today.  


I'm sure others at FB discussed it, but I didn't experience it myself.

&#x200B;

Privacy bills are important, but naturally opposed to integrity enforcement efforts - just as police oversight and stopping crime are both important causes that are opposed to one another",3,1,1636220343.0,szhang_ds,False,negative,negative,neutral,negative
hjkwtm3,"I have never worked for Reddit, so I don't have any special knowledge on the area.",2,1,1636223677.0,szhang_ds,False,neutral,neutral,negative,neutral
hjkvvb1,"Whenever idealism encounters self-interest at Facebook, the latter usually wins out.

&#x200B;

It reminds me of how the Soviet Union proclaimed itself to be the vanguard of worker's rights, but wasn't shy about brutally suppressing uprisings by the actual workers.",5,1,1636223259.0,szhang_ds,False,neutral,neutral,negative,neutral
hjkue28,My profile picture is the default one that reddit gives that I haven't bothered changing. I never watched South Park.,2,1,1636222613.0,szhang_ds,False,neutral,negative,neutral,neutral
hjkuq58,"I think you are confusing Sophie's reddit ""avatar"" with that of iamMohit, a mod who left a pinned comment in the thread.",2,1,1636222762.0,anonymouse_2001,False,neutral,neutral,negative,neutral
