Comment ID,Comment Text,Comment Score,Comment Depth,Created Timestamp,Author,Edited,Semantic Label,Semantic Label 2,Semantic Label 3,Major_Semantic
hjkzz8r,"Who decides the severity of punishment?
like is there a fixed methodology to decide that?",1,0,1636225051.0,persona9991,False,neutral,negative,neutral,neutral
hjl00hd,What do you think is stopping this from happening in other countries? Especially with how the United States was bickering over the last few elections?,1,0,1636225066.0,,False,neutral,negative,negative,negative
hjl0c0z,"in regards to US law -- are you familiar with the former law called the Fairness Doctrine invoked during the New Deal? This put some limitations on ""news broadcasting"" corporations, unfortunately the Reagan administration repealed the Fairness Doctrine. 

My question is, do you see anyway to adapt the Fairness Doctrine to aim at large social medium platforms?

I also think something the definition between Free Speech, and Online Free Speech must be different. Online Free Speech is full of bots and trolls, unlike Freedom of Speech in person, I think there should be a profound distinction.",1,0,1636225207.0,eclecticApe,False,negative,negative,neutral,negative
hjl0qus,Who is the sitting MP who did this ?,1,0,1636225388.0,AkshagPhotography,False,neutral,neutral,neutral,neutral
hjl1b3o,Thank you for your actions. They are literally chaging the world.,1,0,1636225630.0,atroxima,False,neutral,positive,positive,positive
hjl2pv3,"Hi Sophie ,

First of all thanks for doing this and giving us an opportunity to actually interact with you as a true democratic forum , and IMO this is way better than going through loksabha.

If  i understand correctly,  Facebook involves in controlling content per request from the respective government of country (including India) 

If that's the case then it's safe to say that in a way,  Facebook is obligated to follow rules putforth by the political parties in India,  because it is  transitively dependant on GoI.(i.e ruling party) 

So, Do you think Facebook (and Social Media in general) should stop accepting requests that go across their own global bylaws ,and hence  risking ban, or come up with legislation pertaining to each country and then managing them country wise (there could be a potential problem when handling global issues)?",1,0,1636226261.0,Calm_Establishment29,False,positive,positive,positive,positive
hjl3gn7,"No questions, just came here to thank you!",1,0,1636226588.0,Batman_beyond123,False,positive,positive,positive,positive
hjl3s2j,"I have to ask this, does your background as a Taiwanese person had any effect on your decision to become a whistleblower? Like did you get any exposure about how the PRC uses surveillance and information suppression to control their people through old family or people in your community? ( If this is too personal please feel free to not answer) cheers!",1,0,1636226726.0,YaboiGobbels,False,neutral,neutral,negative,neutral
hjl3ts3,Hi! Thanks for helping expose FB but didn’t it occur to you when you started working for them that their whole business model is manipulation of people?,1,0,1636226747.0,criminalsunrise,False,neutral,negative,neutral,neutral
hjl3xl3,What can you tell us about Azerbaijan?,1,0,1636226792.0,10thunderpigs,False,neutral,neutral,neutral,neutral
hjl4jjc,People like you are an  inspiration.,1,0,1636227061.0,clumplings3,False,positive,positive,positive,positive
hjl4pd9,"How do fake accounts work exactly? As in how are they created and how do their handlers co-ordinated between thousands of such accounts? Also, are these accounts manually managed by a human or they have some in-built functionality which directs them towards the target content? Can you suggest me some sources where I can learn more about how these fake accounts originate and work? Thank you!",1,0,1636227132.0,Misterwellaware,False,neutral,neutral,neutral,neutral
hjl7ff0,"~~Was Facebook always this greedy? Or did something happen that forced them to allow destruction of human intelligence for monetary incentives?~~

That was my initial question, but I learnt that you started working after 2018, so here's a similar question that shouldn't be this pointless. 

Back when you found out about this malpractices, and questioned this behavior, did you get suppressed internally from your higher ups? Or did they behave as if nothing was wrong and everything they were doing were  legally justified?

Because in many countries, privacy laws were written before the age of the internet and were/are still not updated, this allows large corporations to make workarounds to use as they seem fit while still technically being within the legal bounds.

I hope my question is reasonable as I believe you are on a schedule and don't wanna use too much time or waste time on my question if it doesn't seem fit.",1,0,1636228320.0,xd_Avedis_AD,False,neutral,negative,negative,negative
hjl8hn0,I just want to thank you for exposing all this. i hope something good comes out of this,1,0,1636228793.0,f17starscream,False,positive,positive,positive,positive
hjl986n,"Really appreciate you taking the time to do this. 

If you don’t mind sharing, what has been the 
most significant personal learning during this process? Do you still feel that you should have done things differently like hiring a PR firm as you have previously mentioned?

Thank you for your bravery, wisdom and for the compassion you show towards others.",1,0,1636229115.0,ughsmugh,False,positive,positive,positive,positive
hjl9yof,Considering thousands of people working at Facebook. Do you think facebook is assigning enough resources to handle fake manipulative content?  BTW Thank you so much for your AMA,1,0,1636229442.0,avengers_endlame,False,neutral,neutral,positive,neutral
hjla4zv,"1. How has life changed for you after this experience?   
Are you working on any new projects right now that you can reveal to us - could be any side projects, or any new fun hobbies  

2. Are you single? :p  
I had to ask this, for a friend..",1,0,1636229521.0,pandu201,False,neutral,neutral,neutral,neutral
hjlag5s,How do you identify a network of fake accounts?,1,0,1636229660.0,royal_dorp,False,neutral,negative,negative,negative
hjlazbx,"So how dramatic has your perception of Facebook changed after leaving the company and how they have treated you after you became public?

(also thank you for doing this, ure work is v under appreciated)",1,0,1636229894.0,Alwayswatchout,False,neutral,positive,positive,positive
hjlbf8p,"Hi Sophie,

Firstly I would like to commend and thank you for the brave steps you have taken for the greater good at great risk to multiple facets of your life.

How does Facebook draw the line between malicious manipulation, shit posts, fake accounts, incorrect yet strong beliefs / views or simply opposing views?

Also how would you recommend we can educate the very invested audience to fact check or not fall for such manipulation? Whatsapp forwards are a plague and people using them to attest to their confirmation bias or views can't be really stopped without whatsapp's intervention.",1,0,1636230089.0,RedCherryPandaa,False,neutral,negative,neutral,neutral
hjlbluu,"Hi, thankyou for your good work, i had a que not regarding this political case but Facebook in general.
I usually report posts on Facebook that may seem offensive to me. Fb usually removes abuses comments very quickly and i receive a update that this comment has been removed.. I came across actual porno stuff a lot of times.. mostly its like a live video with comments turned off.. i make sure to always report it , since obviously i want fb to be a safer place. But the thing is i never receive update on these reports. What happens to these porno stuff ? Is it even taken down. Why am i notified the receipt that its taken down.",1,0,1636230171.0,texthulk,False,neutral,neutral,negative,neutral
hjlcyr2,[removed],1,0,1636230770.0,,False,neutral,neutral,negative,neutral
hjle6jo,Will all of this ever change?,1,0,1636231306.0,FaZeSmasH,False,negative,negative,neutral,negative
hjlfu5b,"Instead of using computerised scripted bots , if someone hires a team of people and makes them do the same thing , will it be tagged as fake accounts? 

Instead of using computerized scripted bots, if someone hires a team of people and makes them do the same thing, will it be tagged as fake accounts? em to avoid detection. If I start with bots, but then take it up a notch and buy a bunch of phones running a custom script that executes randomly and tries to mimic human behaviour (obviously there are multiple software solutions to execute this). And if this is not feasible hire a bunch of people and make them do the same. Given the task isn't that much (even though I do not know what type of activity they did) and the botnets are anywhere from 50 to 1000 it isn't that hard to get a populous working for as cheap as maybe $1 a day. How does Facebook or any other platform deal with a problem such as these?",1,0,1636232036.0,kawaiibeans101,False,neutral,neutral,neutral,neutral
hjlg0kq,"I am a person who is an introvert, but I exist on social media to learn and have intellectual discourse. However, I am disappointed as the conversations usually turn abusive and it ends up in name calling and threats. I have seen this across all platforms I have used.

Can an app be created from scratch which strictly monitors discourse. Where people can discuss anything except spreading hatred and violence. 

What are the hurdles? Maybe my question is not related to your expertise but I would like to hear from you on this.",1,0,1636232118.0,Scientifichuman,False,negative,negative,negative,negative
hjlgys8,You've talked about the non-removal of posts. But are there also instances where posts critical of the government are removed/suppressed? Can Facebook limit a posts reach based on the content?,1,0,1636232550.0,23point977,False,neutral,neutral,negative,neutral
hjlikml,"Were you worried that there would be legal repercussions against you for whistleblowing? 

Not sure how all of that works, but I’m sure there must have been some worries when you decided to make that move. (props to you for doing it anyways!)",1,0,1636233274.0,UpstairsIntention420,False,neutral,neutral,negative,neutral
hjlj8pz,Thank you so much for your efforts.,1,0,1636233581.0,Im_Savvage,False,positive,positive,positive,positive
hjljnit,What was the MP’s bot army saying? What kinds of issues have their narratives manipulated most by inauthentic activity?,1,0,1636233770.0,prof_mcquack,False,negative,negative,negative,negative
hjlk6kd,[deleted],1,0,1636234014.0,,False,neutral,neutral,negative,neutral
hjlo1hb,Please keep yourself safe. There is no telling when something can happen when dissent is public. Also beware Delhi cops,1,0,1636235734.0,TyshadonyxS,False,neutral,neutral,negative,neutral
hjlqb05,What do you think Facebook should do? Genuine question.,1,0,1636236742.0,dfrankow,False,neutral,neutral,positive,neutral
hjlt0sh,How is this FB's fault?  Why should I care if people form their opinions from strangers online?,1,0,1636237969.0,TheBaltimoron,False,negative,negative,negative,negative
hjlu09y,"Do you see the decentralisation  and autonomy that Web 3.0 would bring leading be to more efficient in policing of fake news?, if so what would be the new concerns that would arise?",1,0,1636238425.0,InsuranceDear714,False,neutral,neutral,neutral,neutral
hjluvi1,Please nail them to the wall,1,0,1636238809.0,Mighty_Zote,False,negative,negative,neutral,negative
hjlvb5m,"Was there any particular incident that could have been prevented if there weren't any of these accounts? Does any of this link to farm laws, CAA protests or anything similar regardless of which group it was?

Does Facebook actually delete all your account data? Like 100%?",1,0,1636239006.0,judcated_que,False,neutral,negative,negative,negative
hjlxvm1,Do you have any knowledge if Facebook owned apps Instagram and WhatsApp duplicate the same problems?,1,0,1636240206.0,dizzy_rhythm,False,neutral,negative,negative,negative
hjly6eu,"Hey /u/szhang_ds not sure if you're still around, I'm wondering a few things:

Was finding these account farms part of your official employ at FB or was that something you did on your own? If yes what is the company policy around handling the discovery of political figures being involved in such activities? It seems they seem to have completely dropped the ball once you did find what you clearly set out to find. So their official position looks really strange unless the whole point is to present a picture of fixing the problems without ever fixing them?

ETA: Do you have any tips for the general person to spot such activity in their own feeds? Not that I'm on facebook anymore but would be helpful for people to train this muscle during political discourse in general.",1,0,1636240348.0,scholeszz,False,neutral,negative,negative,negative
hjlyg61,"I see many people around me doing paid tweet (mostly useless, fake or spam), this might be similar for Facebook pages or groups too. Is there any future plan for this situation until it gets out of control?",1,0,1636240474.0,rabbittheracer,False,negative,negative,negative,negative
hjlztv1,Has the introduction of the GDPR made any differences to Facebook’s business model / policies  etc.?,1,0,1636241105.0,UJ_Reddit,False,neutral,neutral,neutral,neutral
hjm07u8,Is it possible India will fall into totalitarian rule?,1,0,1636241284.0,recoveringleft,False,negative,negative,neutral,negative
hjm0bl9,"   In a world where governments have always manipulated there people, how does this ever stop?",1,0,1636241333.0,KBro0ks,False,negative,negative,negative,negative
hjm3fzq,"If one wanted to personally tell the CEO of Facebook just how disappointed and angry one is with his handling of his immense power, where could one do so?",1,0,1636242741.0,,False,negative,negative,negative,negative
hjm6toe,Do you believe facebook manipulates american politics as well? (I am not doubting a word you say i just want to know what you think about the idea that they might),1,0,1636244318.0,RenegadeCapty,False,neutral,neutral,negative,neutral
hjmar7b,"Did you ever meet The Zuck, or the robot humanoid we all know as Mark Zuckerberg?

When does he plug into the wall? When does he fuel up on metalloids formerly known as Mercury? How does he think no one knows he's a robot?

And my last (actual) question, how was it working for one of the worst companies of our current history? Everything you hoped? Not at all? Give us a quick day-to-day in how awful FB work life was... pretty please?",1,0,1636246165.0,,False,negative,negative,negative,negative
hjmcrjz,Dude Facebook is the fucking devil,1,0,1636247122.0,Carbonnanolubes,False,negative,negative,negative,negative
hjmgv7p,Do you think the Indian government is given a little more leniency at FB because of the fear of losing their largest single base of users? Do you think there's a way to change this by incentivizing better moderation maybe?,1,0,1636249101.0,arygupta1,1636249617.0,neutral,neutral,neutral,neutral
hjmh51d,What reprisals do you fear?,1,0,1636249232.0,yutfree,False,neutral,negative,negative,negative
hjmi7lt,How difficult is it really to crack down on bots and fake account creation?,1,0,1636249744.0,IamTheDonviti,False,negative,negative,negative,negative
hjmie77,I apologize if this is off-topic but I'm curious and thought maybe you could answer.  Many FB friends have checked into their local movie theater to tell people they were catching the premiere of Marvel's Eternals and for some reason FB is hiding their post like what they posted was offensive.  Do you have any idea what's tripping FB's security bots?,1,0,1636249830.0,PatchouilRatatouille,False,neutral,neutral,negative,neutral
hjmimuy,Just really wanted to say Thank You for being honest ;). I wish more people were!,1,0,1636249946.0,PurpleKaleidoscope99,False,positive,positive,positive,positive
hjmugip,"I can possibly see it as fraud when talking about advertisements, or harassment when commenting on someone else’s post, but how do these actually *affect* political discourse in a meaningful way that’s wrong? Especially since as you’ve reiterated this is about false accounts, not false information",1,0,1636256004.0,AdvonKoulthar,False,negative,negative,negative,negative
hjn1cy6,Lady you're really brave,1,0,1636259978.0,Turbulent_Party_3056,False,positive,positive,positive,positive
hjnjrt5,"Stay safe, you have made some enemies out there, and thankyou for your the braveness that you have shown. Not many people have the courage to stand up against these horrible people.",1,0,1636275055.0,alcatraz_ind,False,negative,positive,neutral,neutral
hjo3fp8,Just be safe. Take care. And Thank You 🙏🏻,1,0,1636290440.0,r13k,False,positive,positive,positive,positive
hjogvwb,This is crazy,1,0,1636296949.0,TrippyVanNostrum,False,neutral,neutral,negative,neutral
hjpfgi4,I hope you're safe :). I feel bad that no action was taken on your asking multiple times. The organization needs to be held responsible as it seems the delays were malicious.,1,0,1636310761.0,A_random_zy,False,negative,neutral,negative,negative
hjsgohi,"Hey Sophie, do the employees in Facebook realise the monster they are are creating and keeping afloat or are there people who believe in the corporate propaganda?",1,0,1636369095.0,fatherofgodfather,False,negative,negative,negative,negative
hjunmfp,"RSS ki shamat
ITcell do your work …..Sophie zhang is coming",1,0,1636405330.0,Beneficial_Moment_56,False,neutral,neutral,neutral,neutral
hjunr9b,BJP will begin character Maligning you so be careful.,1,0,1636405385.0,Beneficial_Moment_56,False,neutral,negative,neutral,neutral
hjvfndj,Does this problem only get worse as social media evolves?,1,0,1636417122.0,greasylagoon,False,negative,negative,neutral,negative
hlazdq4,Thank you for your work.,1,0,1637355897.0,k_nali,False,positive,positive,positive,positive
hjk6381,"I don't believe anyone from the Indian government or any Indian agency were ever notified about discovery of these networks while I was employed at Facebook. Of course, since then, I have come forward publicly and thus notified the Indian government via the news and my offer of testimony and evidence to the Lok Sabha. 

&#x200B;

In terms of size, the smallest was \~50-60 accounts - the network connected to the BJP MP. This frankly would not be worth noting except for the fact that it appeared to be run by someone with access to the MP's personal account, and the fact that FB changed their mind on taking it down as soon as that fact became clear.

&#x200B;

The largest was \~1000 accounts for the pro-INC network in Punjab and for the pro-AAP network in Delhi.

  
Note that most of the time we don't know who's responsible - just who's benefiting, and so there's no guarantee that a ""pro-INC network"" has any attribution/responsibility for the INC. Just as if a bunch of reddit fake accounts start saying ""u/dukeDoDo is amazing"", there's no guarantee that you had anything to do with it.",258,1,1636212260.0,szhang_ds,False,neutral,neutral,neutral,neutral
hjk7ix4,"This in my view is the root of the problem. The purpose of a fake account is to not be seen. The better you are at not being seen, the fewer people will see you. The tools I used to find these networks required internal data access, which naturally are not present to outside tools.

  
I'll use an analogy. Suppose an average Indian decides to go out and look for PRC spies. They will not find any actual PRC spies - which is not to say that they don't exist in India. Rather, anyone that they find will be normal Indians who behave a bit oddly. Or Indians who celebrate Halloween and have dressed up as a PRC spy for the holiday. Or perhaps they'd suspect Chinese Indians who are actually loyal to India. But any PRC spies that they find would be utterly incompetent. And so this is why the Indian government does not (and cannot) rely on regular people to find PRC spies for them and instead needs highly trained and secretive IB operatives with to do so.

&#x200B;

To solve a problem, you need to understand and know that it exists. But the information asymmetry means that this question can only be fully addressed from within FB - which has no incentive to solve the issue. Imagine a world in which the Bhopal disaster occurred, but only Union Carbide knew who was responsible, and only Union Carbide had any chance of knowing who was responsible. In such a scenario, I think it would be exceptionally important for someone from within the company to come forward - which is precisely what I'm doing right now.",236,1,1636212874.0,szhang_ds,False,negative,negative,neutral,negative
hjklytq,Thank you - I appreciate it!,352,1,1636219015.0,szhang_ds,False,positive,positive,positive,positive
hjld7ks,"A well paying job is one of the smaller things she’s risking here in my eyes. Whistleblowers of serious scandals like this know exactly what they’re putting on the line, and you’re right: doing it anyway shows courage we can all only hope to have someday.",15,1,1636230875.0,knee_bro,False,neutral,positive,neutral,neutral
hjmqsxe,"I read about this story a month ago, I was surprised reading the post when I realized it was her. Was a ""damn it's her"" moment. Respect for standing up for truth.",7,1,1636254019.0,asusmaster,False,neutral,neutral,positive,neutral
hjn22s9,"It really is apllaudable. More than leaving a high paying job, it's the act of stepping into uncertainty and discomfort when the benefit to self isn't there. Kudos :)",3,1,1636260392.0,spiritualParkour,False,positive,positive,negative,positive
hjm2rts,"Fighting for what is right will barely make a dent in things though, while also robbing her from a comfortable life because of losing that well paying job.

This is absolutely unnecessary and pointless. Reckless even if she has a family to feed.",-5,1,1636242435.0,,False,negative,negative,negative,negative
hjk4595,"I assume you mean at Facebook?  


Internal leadership at Facebook is very clear and confident in their formal stance that they do not play political favorites, including in India. I think that saying anything else would be a good way to get half their Indian employees to quit on the spot.

&#x200B;

I don't know if this is especially unusual as companies go - I'm sure that Dow Chemical internally proclaims that Bhopal wasn't their fault when asked by employees. With that said, FB is fairly open as far as companies go in terms of letting employees discuss. 

&#x200B;

For instance, when the [WSJ articles on Ankhi Das's support for the BJP came out](https://www.wsj.com/articles/facebook-executive-supported-indias-modi-disparaged-opposition-in-internal-messages-11598809348), the official FB leadership response was that her comments were taken out of context. As a result, I decided that I would very helpfully provide the context that leadership said we were missing by assembling and organizing her other internal statements from the time period for the benefit of other employees. Alas, the additional context did not make her comments look any better, and FB chose for some reason to delete all of them by the next morning.  


I was half expecting to be chewed out or fired for doing this (I was already in the process of being fired, so was less cautious than usual), but no one did.",290,1,1636211416.0,szhang_ds,False,neutral,neutral,positive,neutral
hjkbxgt,"Thanks for these thoughtful questions  


1) It's absolutely true that disclosures carry certain risks. This is the reason why I don't provide any details about how I caught adversaries - attackers are perfectly capable of reading Reddit as well.

&#x200B;

I feel comfortable disclosing my work in India for several reasons:

a) Facebook already acted to take down most of the networks. As a result, the attackers know very well that they were caught (except the BJP MP.)

b) It is no secret that IT cells occur in India. Reporting on the work I conducted will likely not create any incentive for people to make more IT cells.

c) Because of the decision of FB not to act following discovery of the direct involvement of a MP, I believe it is societally important to India to disclose these details.

But there are also countries in which the considerations are different and so I have disclosed less detail as a result. 

&#x200B;

There are also additional considerations when it comes to disclosures from companies .Currently FB has made the commitment to disclose its takedowns for coordinated inauthentic behavior (CIB.) This has had the side effect that CIB investigations are very difficult, time-consuming, and politically sensitive (and hence potentially open to interference) because the company feels it is necessary to announce who is responsible and not be wrong. As a result, all of the work I did in India was not disclosed by FB, as it was taken down for inauthentic behavior rather than CIB - just as its easier for the Indian police to convict someone of ""culpable homicide not amounting to murder"" than for murder.

&#x200B;

2) It's very hard to say. I'd say that it's a fairly neutral balance, where attackers previously held the advantage.

&#x200B;

3) You can look up trainings on disinformation/cybersecurity/etc. But frankly I don't have a good idea because I never had any training in this myself (figured it all out in my spare time.)  


Cat tax: [here](https://pbs.twimg.com/profile_banners/1308909405665017856/1634007706/600x200) are Midnight and Shadow",52,1,1636214755.0,szhang_ds,False,neutral,neutral,positive,neutral
