Comment ID,Comment Text,Comment Score,Comment Depth,Created Timestamp,Author,Edited,Semantic Label,Semantic Label 2,Semantic Label 3,Major_Semantic
hjl25am,"Resources weren't allocated to specific areas for discovering these types of sophisticated political fake account manipulation campaigns. The employees worked globally.

&#x200B;

But resources were prioritized in response to PR risks and outside reports. And both of those are naturally much greater in the Western world. If MI5 sees something weird on British social media, it'll tell FB. The Azerbaijan government will never report its own crimes to Facebook.",3,1,1636226008.0,szhang_ds,False,neutral,neutral,neutral,neutral
hjl1kq9,"I think that mandated cooperation between social media companies is important and necessary. I'm going to use the activity I found in Azerbaijan and Honduras as an example:

&#x200B;

In [August 2018, I caught the government of Honduras red-handed running troll farms.](https://www.theguardian.com/technology/2021/apr/13/facebook-honduras-juan-orlando-hernandez-fake-engagement) In July 2019, FB took down the government's online troll farms, and informed Twitter. In April 2020, [Twitter took down the Honduran government's troll farms there as well.](https://www.theguardian.com/technology/2020/apr/02/twitter-accounts-deleted-linked-saudi-arabia-serbia-egypt-governments)

&#x200B;

Compare to Azerbaijan - in August 2019, I caught the Azeri government red-handed running an IT cell-style operation to harass their opposition[. In October 2020, FB finally took it down (in the midst of an Armenian-Azeri war.) The IT cells were also active on Instagram, so FB was able to take it down on Instagram without delay as well.](https://about.fb.com/news/2020/10/removing-coordinated-inauthentic-behavior-september-report/)

&#x200B;

Because right now, companies have no incentive to cooperate until they've already acted. If FB had purchased Twitter there wouldn't have been the year delay in action on Twitter. This is not to say that FB should own every company - certainly not. But right now, it's against FB's incentive to share information with its competitors until it's already made or about to make a public announcement. For the same reason, they likely didn't share information about the work I did in India w/ Twitter, as that was not publicly announced.",3,1,1636225748.0,szhang_ds,False,neutral,neutral,neutral,neutral
hjkwzux,"I'm of course no longer at Facebook, but I understand that FB has became considerably more vigilant towards employees since my departure",3,1,1636223750.0,szhang_ds,False,neutral,neutral,negative,neutral
hjlfpae,"Currently in India, an IT cell arms race is going on between political parties, as no party wishes to lose a tool by unilateral disarmament. This will continue until an IT cell banning/regulation is made, or the Indian people stand up to demand better.  


The chances that this get addressed depend on the responses of people such as yourself who are reading this AMA. If everyone assumes that it's pointless, then of course nothing will happen. But because I didn't assume it's pointless, I chose to speak out and try to make a difference, and so you're hearing about it today. 

&#x200B;

What can you chose to do?",7,1,1636231975.0,szhang_ds,False,negative,neutral,negative,negative
hjl0x3b,[deleted],1,1,1636225463.0,,False,neutral,neutral,negative,neutral
hjl39nx,"Societal norms and expectations. For all the troubles and imperfections that the United States experiences, IT cells are not normal in the United States the way that they are in India, and I very much hope they never become normal here.",6,1,1636226503.0,szhang_ds,False,negative,negative,negative,negative
hjl5bdc,"I have offered detailed documentation on my work to the Lok Sabha, which includes the answer to this question. Should the Lok Sabha be uninterested or unwilling to take it up, I will explore additional channels.",2,1,1636227398.0,szhang_ds,False,neutral,neutral,neutral,neutral
hjl4hwn,"I'm actually the descendant of immigrants from mainland China.

My father was an extreme Chinese nationalist who would likely be calling me a hanjian (race traitor) for doing this. But he also beat me as a kid, so I suppose I'm finding new and exciting ways to disappoint him.",24,1,1636227041.0,szhang_ds,False,negative,negative,neutral,negative
hjl4jp1,I joined FB because I wanted to help stop their worst practices. I never expected it to go this far.,1,1,1636227063.0,szhang_ds,False,negative,negative,negative,negative
hjl7vbi,"Well, they were using maybe 10k fake accounts with probably-paid employees who coordinated their shifts in FB messaging groups, started work at 9am in the morning, stopped for a lunch break at 1pm (Baku time), and petered out in the evening. They worked weekdays only, stopping on weekends, national holidays (e.g. New Years', Novruz), and when nonessential governmental employees were temporarily furloughed last spring due to COVID.

&#x200B;

They were focused entirely on harassing the Azeri domestic opposition - primarily the Azeri Popular Front Party and its leader Ali Karimli. Every time the Azeri opposition made a post, opposition Azeri news sources made a post, foreign news sources in Azerbaijan such as BBC Azerbaijan or VOA Azerbaijan reported on the opposition, they would immediately be deluged by a thousand carefully written unique comments on why the opposition was terrible traitors who were destroying the nature and why Ilham Aliyev was the great glorious leader or something like that.

&#x200B;

I'm sure this had a severe chilling effect on the few remaining outlets of opposition discourse in Azerbaijan",7,1,1636228516.0,szhang_ds,False,negative,negative,negative,negative
hjlb6ef,"The way I would describe it is that my higherups all agreed that the activity was terrible, but perhaps now isn't the time to act, perhaps we aren't sure what the right solution is, perhaps there are other priorities.... and so the problem gets kicked around for another year despite my best efforts.

&#x200B;

To be clear, I don't believe this to be a legal violation. To my knowledge, there's no law saying that ""Facebook cannot allow foreign governments to run fake accounts to break their rules."" India does not have a law saying ""If FB catches an IT cell, it needs to take it down."" No one considered this question before.",4,1,1636229980.0,szhang_ds,False,negative,negative,negative,negative
hjlahwn,"I was frankly too idealistic in assuming ""I'll get my story out and the news media can decide."" So yes, I should have hired a PR firm and considered better from the start how to pitch my story.  


By now it's probably a bit too late. I do find it funny to see how some people look at Frances Haugen and say ""she's too prepared and polished and has a team behind her, she must be a plant"", and then turn to myself and say ""she stutters, has an accent, and doesn't have a team, why would anyone believe her?"" Some people claim to distrust the messenger when it's really the message they hate.",5,1,1636229681.0,szhang_ds,False,negative,negative,positive,negative
hjlapz7,"It's not just a question of resources, but also of authorization and power. Facebook likes to present this as a resource-intensive question that can only be handled by hiring large masses of people, where it can point to its hiring efforts and brag about how many it has hired. But the fact is that in many cases, people within FB have made proposals to address clear harm, including myself, and the company has nevertheless refused to act.

&#x200B;

You could hire every single person in the world, and it wouldn't accomplish a thing if you refuse to give them the authority to act.",4,1,1636229779.0,szhang_ds,False,neutral,neutral,negative,neutral
hjlexkj,1) I'm watching the Untamed with my girlfriend so we can practice our Mandarin.,1,1,1636231637.0,szhang_ds,False,positive,neutral,neutral,neutral
hjlhcoz,"When I left FB, I was not certain that company leadership consisted of bad actors who had no interest in fixing their system. I believed there was still a chance that if I spoke up publicly with my meticulous documentation and detailing of the situation, they would listen and change course.

&#x200B;

It is now clear that Facebook has chosen to double down on internal repression and an attitude of wolf-warrior diplomacy towards any external criticism.",3,1,1636232728.0,szhang_ds,False,negative,negative,negative,negative
hjlhm2p,"Pornography is generally not allowed on FB. I don't know what happens to your reports - since you're not certain, I'd suggest recording the link and the date of report the next time it happens, and checking back in a few weeks.",2,1,1636232842.0,szhang_ds,False,negative,negative,neutral,negative
hjlmai8,"If enough ordinary Indians stand up to demand a change, anything can happen.",3,1,1636234956.0,szhang_ds,False,neutral,positive,neutral,neutral
hjlzsyd,"Manipulation is still manipulation, so logically what you're suggesting is still under the definition of ""inauthentic content"". Detecting it is an ever escalating arms race between trolls and companies however, which is why it's currently such a pervasive problem especially in spheres that are not directly under scrutiny.",2,1,1636241094.0,scholeszz,False,negative,negative,negative,negative
hjlgz63,"The hurdles are ""what counts as hatred and violence.""

&#x200B;

For instance, perhaps a staunch Hindu may proclaim that the cooking channel must disallow discussion of recipes containing beef, for it constitutes violence towards the Hindu religion. Perhaps a die-hard Catholic may proclaim that discussion of child abuse scandals constitute hatred of the Catholic church and religion and must be prohibited.",5,1,1636232555.0,szhang_ds,False,negative,negative,negative,negative
hjlyy7y,"Troll and brigading detection is an insanely hard problem. And the higher the stakes the more creative the trolls/bot farms become. It's one thing to sock puppet on say a football club's subreddit just to boost your karma and ego, quite another when you can use campaign funding to fuel an arms race against algorithmic detection.",2,1,1636240705.0,scholeszz,False,negative,negative,negative,negative
hjlj3fb,I understand that there have been a number of controversial cases in which social media companies have removed/suppressed certain posts in India under pressure from the government. This is public reporting - I don't have personal familiarity or expertise on the subject,2,1,1636233515.0,szhang_ds,False,neutral,neutral,negative,neutral
hjliz1b,"Facebook could certainly sue me for every penny I have.  


If they were more popular in DC, they could try to get me legally prosecuted and thrown in jail.  


I'm protected from that by the PR storm they would incur by trying to do so.",4,1,1636233459.0,szhang_ds,False,negative,negative,negative,negative
hjllt62,"Mostly, nice things about the MP, and liking+ sharing his posts.  


I assume he was a busy guy who for some reason had a very odd hobby.",2,1,1636234741.0,szhang_ds,False,positive,positive,positive,positive
hjllr1n,I sold all of my stock basically as soon as they gave it to me? What makes you think I got rich?,4,1,1636234715.0,szhang_ds,False,neutral,negative,neutral,neutral
hjk8j3y,Thank you. Not that I was surprised. Only one thing I disagree in your comment. u/szhang_ds is awesome. Not all heroes wear cape.,83,2,1636213293.0,dukeDoDo,False,positive,neutral,neutral,neutral
hjk9n5l,"Is there no way to deduce bot activity on Facebook without internal data?  On platforms like reddit, it is possible to identify bot activity and bot networks if you know what to look for.  This is because many bots rely on generic repost algorithms to build karma before engaging in content manipulation.  You can see the work of redditors trying to identify and track these bots over at r/TheseFuckingAccounts.",48,2,1636213759.0,woowoo293,False,negative,negative,neutral,negative
hjkn0r0,thank you ❤❤,1,2,1636219446.0,Veer_Bhagat_Singh,False,positive,positive,positive,positive
hjncocq,Why do you think it barely makes a dent?,2,2,1636268226.0,VishwaguruKaVikas,False,negative,negative,negative,negative
hjk5ch0,If FB's stance on paper is that they don't support any political parties then why wasn't the fifth network shut down ?,74,2,1636211943.0,,False,neutral,negative,negative,negative
hjl5z0h,"Yes, clearly their clear and confident stance that they don't interfere with politics and yet they didn't stop that whole Stop The Steal malarky...",2,2,1636227687.0,Wasphammer,False,neutral,negative,positive,neutral
hjkduzy,"Wait what? CIB is different from IB? Could you explain the definitional difference? From an outsiders vantage point they sound like the same thing.

Regarding 3, any public resources you can point to?




Content for the request on detail, no response needed - I see a reckoning for moderation and social media. 

Firstly, like cigarettes, there is inherent harm in any social media-esque product that depends on engagement. Secondly because even physical policing had improved as more rigor and science are introduced.


Midnight and shadow are aptly named, They’re gorgeous! Who is the friendlier of the two?",16,2,1636215589.0,parlor_tricks,False,neutral,neutral,positive,neutral
hjmge1p,"Just to confirm, it's Russia and Azerbaijan to are referring to in the first sentence, right?",31,2,1636248866.0,ohisama,False,neutral,neutral,neutral,neutral
hjni5ws,">	But I won’t be walking into any Azeri embassies anytime soon. And will be very careful not to fly over Azeri airspace as well.  

Lmao. I love you",3,2,1636273492.0,Chinpuku-Man,False,neutral,positive,positive,positive
hjl7dyy,[removed],1,2,1636228302.0,,False,neutral,neutral,negative,neutral
hjkl4cj,Do you believe the delays from FB's side happened maliciously? i.e they are internally speaking with the political parties themselves?,25,2,1636218668.0,RainmaKer770,False,negative,neutral,negative,negative
hjmkms1,"I feel like the cells gave up feb 7 because elections were 1 day later so their job was done. So sad, thanks for sharing…",2,2,1636250922.0,,False,negative,negative,negative,negative
hjlxmyx,">December 19, 2019: A decision is reached to take down all four networks of fake accounts. The first three networks of fake accounts are taken down. The fourth (found on December 10) is forgotten, which I point out.

>December 20, 2019: The fourth network of fake accounts is found to be tied to a BJP MP.

Given that the network related to the bjp mp appears to have been protected even before you became aware of it being related to bjp mp, do you think that people making decisions had access to this information before you did?",1,2,1636240093.0,charavaka,False,neutral,neutral,negative,neutral
hjnj3iy,"Democracy dies in the darkness. Thank you for shining a light on these practices. Take this, Queen:👑",1,2,1636274423.0,Chinpuku-Man,False,positive,positive,positive,positive
hjk7ech,"These so called IT cells, are these utilized by politicians in the west ? like in some European country or USA or Canada too ? I expect that the usual bot accounts for getting large number of likes and forwarding their posts and messages too many times is employed by politicians but do they use it for anything else ?",27,2,1636212821.0,,False,neutral,neutral,neutral,neutral
hjkts33,A simple workaround could be to track a user's report count. If the user has reported thousands of posts then they're probably doing it in bad faith. If the user has been a member since the last ten years and only reported one post......that post must have had some real shit lol.,17,2,1636222346.0,Schmosby123,False,negative,negative,negative,negative
hjlk66m,"FB had a number of byzantine rules in which definitions of what violated didn't agree with intuition and common sense. For instance, up until recently, the phrase ""men are trash"" was considered hate speech by FB, while holocaust denial was not considered hate speech - a combination of definitions that I believe very few people would jointly agree with.  


I don't know what happened in your case, but for these sorts of very low-level comments, I would blame incompetence rather than malice for the individual decision.",34,2,1636234010.0,szhang_ds,False,negative,negative,negative,negative
hjk67ma,Thank you so much for taking the time to reply in such detail!,15,2,1636212314.0,makapav,False,positive,positive,positive,positive
hjk6dks,">Anyone who confidently says that they know the answer is being overconfident

Or has access to the data of millions of Indians.",162,2,1636212385.0,ravishterabaap,False,neutral,negative,negative,negative
hjluba1,">They didn't need to shift focus from real issues in the country, just needed to make the citizens more aware. So most likely, they would have won in 2014 irrespective of social media manipulation.

Except,  the then CAG was manufacturing corruption using imaginary numbers, and ""spontaneous outrage"" movements like anna hazare/ramdev protests were artificially propped up. The very same people that were part of those protests don't seem to notice rafale corruption, the people lighting candles for nirbhaya never notice bjp protesting on favour of the rapists, and the people proposing fuel prices then think its Congress's fault that modi raised fuel taxes so much that fuel is much more expensive than then though crude prices are lower than then. 

You're right in saying that social media influence became more critical later,  but social manipulation by politicians was very much the main reason for the way 2014 elections went.",8,2,1636238561.0,charavaka,False,neutral,neutral,negative,neutral
hjkmak9,"Does it not worry you that powerful people can arrange ""unfortunate accidents"" for people they don't like? I too doubt it would happen, but I'd be paranoid. Be safe",25,2,1636219147.0,Dont_ban_me_bro_108,False,negative,neutral,negative,negative
hjldafe,Do you think Facebook executives may try to harm you somehow? It's not always a foreign government that does bad things. Sometimes it's the local companies in your own backyard.,1,2,1636230909.0,,False,negative,negative,negative,negative
hjkqbtp,">If Mark wants, he can change his name legally to Mahatma Gandhi, but he'll still be the same person.

Haha.. you must be making the people at Lutyen street very afraid. Take care of yourself as most fanatics don't like being cornered. Looking forward to live telecast of your testimony in Parliament.

In case you get stuck in some legal trouble, don't hesitate to start a crowdfund, in case you need it.",23,2,1636220849.0,poco_gamer,False,neutral,neutral,negative,neutral
hjl59wi,"Oh man, if I see you anywhere I'd come give you a hug! Thank you for doing this, you are nothing short of a gem of a person!",13,2,1636227380.0,pandu201,False,positive,positive,positive,positive
hjle1x1,"I can assure you that BJP is definitely not going to reveal the truth. They are extremely corrupt and horrible goons. They have no shred of virtue, morals or a conscience.

Don't place faith in Indian democracy, it died long ago. Don't place faith in politicians, they don't care about doing the right thing.",21,2,1636231248.0,,False,negative,negative,negative,negative
hjl2ll1,"I solute ur courage, Btw you should contact ramon magsaysay awardee and fearless journalists of NDTV “Ravish Kumar”. So that average population can know about it. 

Also it will give this matter enough attentions so that courts can acknowledge.",19,2,1636226208.0,guyno17,False,positive,neutral,positive,positive
hjnya4q,Thanks for answering. Media is silent on Snowden and is glorifying Frances Haugen and you. Isn't it strange?,2,2,1636287346.0,arnott,False,negative,neutral,positive,neutral
hjlup4g,"Thanks for answering.

Yes. It is quite possible you bumped into the Andhra Pradesh fake network as well. 

I used to see people who have no clue about the state and language commenting on social media criticising the then government. I was initially confused and then realized these are probably IPAC fake network.",1,2,1636238732.0,ohmyroots,False,neutral,neutral,negative,neutral
hjlgpax,"Beautifully explained. Propaganda, rumours and misinformation has existed in our society. But Facebook provides a medium to spread and provide feedbacks to the perpetrators.
Thank you for your work. 🙏",7,2,1636232428.0,,False,negative,positive,positive,positive
hjku6hp,The problem seems to be far deeper than most of us realise. Thanks for taking the time out to answer though.,13,2,1636222520.0,ScreenPotato,False,neutral,neutral,neutral,neutral
hjlfvv5,IT cell arms race is going to be one of the catch phrases from this AMA.,4,2,1636232057.0,parlor_tricks,False,neutral,neutral,neutral,neutral
hjkth0z,"Ah. The triple agent. The thrice agent? 

In any case, you're doing good work. Arguing with people over how easily all of us can be manipulated is made easier with work like yours.",17,2,1636222212.0,alihassan9193,False,neutral,positive,neutral,neutral
hjld29r,"😂 This reminds me of how various governments paint environmental activists as terrorists and infiltrate then with intelligence agencies at the behest of companies.

They claim all of these environmental NGOs are foreign spies from some other country trying to stop progress and development.

So, apparently environmental activists are, in the same way, accused of spying for and working for several countries at the same time.",1,2,1636230812.0,,False,negative,negative,negative,negative
hjmy3p4,More intelligent people asked better questions before me. I'm not stupid enough to waste someone's time with repeat questions.,0,2,1636258068.0,alihassan9193,False,negative,negative,neutral,negative
hjlfxat,Just stay away from Uttar Pradesh.,14,2,1636232075.0,GalactusRex,False,negative,negative,neutral,negative
hjlqk93,"Consider India as dead of a democracy as Russia.

What India had in relatively stronger institutions it makes up for it in the large submissive and democratically illiterate population.",12,2,1636236862.0,deviltamer,False,negative,negative,negative,negative
hjlglqp,"As an Indian, let me clarify the situation to you: democracy died in India long ago. It doesn't exist anymore. Those who challenge the powerful and influential in India have always been in a dire situation, but now more than ever.

Do not assume that Indian government and the law works as well as it does in the US - it does not.",16,2,1636232383.0,,False,negative,negative,negative,negative
hjm56r8,"Hi Sophie, thank you for being brave and taking a stand. You seem well read when it comes to India. Have you heard of the Bhima Koregoan case? Here is a [link](https://www.google.com/amp/s/m.thewire.in/article/rights/bhima-koregaon-case-trying-without-a-trial-is-the-intent-of-draconian-uapa-law/amp). Also check out Arun Ferreira's book 'Colours of the cage'.",4,2,1636243547.0,UniversalFreak,False,positive,positive,positive,positive
hjlkc76,"By the way, you are amazing at explaining things succinctly.",3,2,1636234085.0,johnnydozenredroses,False,positive,positive,positive,positive
hjlh9tb,"> invited to testify, that would likely create a diplomatic incident that would make India a pariah nation. I do not believe this would occur if the invitation to testify is indeed issued (which I hold some doubts about), and I am willing to accept that risk if it happens.

well they can always do the good old kidnap em'",3,2,1636232693.0,Dxuian,False,negative,negative,neutral,negative
hjmw6gu,"I doubt they will go through with the lok sabha invite. It's embarrassment all around for them. I would be very pleasantly surprised if they do.
I'm waiting for the other channels you mentioned to name the bjp mp.",1,2,1636256964.0,noooo_no_no_no,False,negative,negative,negative,negative
hjx0471,"I don’t believe you are at risk, for the very reasons you have stated. However, as someone who has testified before a Parliamentary committee, it may be a waste of time. I tested in 2015 (on net neutrality, just before Facebook’s Free Basics got embroiled) and the committee has *still* not released its report, six years later.",1,2,1636448898.0,jackerhack,False,negative,negative,negative,negative
hjmdia5,"It's funny how unheard-of websites like vishwas new show up, but not altnews.",3,2,1636247477.0,charavaka,False,neutral,neutral,positive,neutral
hjkmrfh,"\- To my knowledge, active human moderation can come in Facebook groups (akin to subreddits), but this is liable to abuse (compare to the subreddits who had to have moderators replaced or be banned for not doing their job.)

Human moderation by FB employees usually comes reactively rather than actively - e.g. in response to user reports. Most moderation at Facebook is carried out automatically by machine learning scripts. 

&#x200B;

\- I only joined Facebook in January 2018. As a result, I'm not directly familiar with events before then.

&#x200B;

\- Some teams are separate, some teams are the same. For instance, my own team worked on inauthentic engagement on both FB and Instagram, and intended to eventually expand to Messenger. However, there was a separate team intended to do this on Whatsapp.

&#x200B;

Meanwhile, the accounts integrity teams that caught fake accounts at registration/hacking attempts/etc. had different components for each platform e.g.

&#x200B;

There's some inter-team coordination when necessary. This is however one advantage gained from having FB own Instagram/Whatsapp - the shared expertise. I'm certainly not saying that FB should be a monopoly - simply pointing out that the ownership question is difficult, and that greater cooperation should be mandated with other social media companies. For instance, when I took down the networks of fake accounts in India, I would be shocked if that were relayed to Twitter to investigate themselves.",6,2,1636219339.0,szhang_ds,False,negative,negative,negative,negative
