Comment ID,Comment Text,Comment Score,Comment Depth,Created Timestamp,Author,Edited,Semantic Label,Semantic Label 2,Semantic Label 3,Major_Semantic
hjk3k38,Was someone from Indian government or any Indian agency was ever notified about discovery of these networks? What were their relative sizes? And thank you for exposing and wish you best for future.,197,0,1636211156.0,dukeDoDo,False,neutral,positive,neutral,neutral
hjk359b,How do you think common people take action if companies like Facebook don't do anything? What are some platforms or tools you believe help people understand if something is fake and something is not? Or are we waiting for people to build them?,137,0,1636210979.0,iam_waldo,False,neutral,neutral,neutral,neutral
hjk2lox,"No questions here. I just wanna commend and thank you for your actions. Blessed is an education system and society, which can produce people with moral courage like you. Who are ready to give up well paying jobs to fight for what is right for common good. Salut.",1051,0,1636210741.0,Enthusiasm_Unique,False,positive,positive,positive,positive
hjmpres,"This AMA has now ended. 

[Statement by Sophie:](https://www.reddit.com/r/india/comments/qo1ol8/i_am_sophie_zhang_fb_whistleblower_when_i_found/hjlo24e/)

> I've been answering questions for the past 7 hrs, the questions have died down, and it's 3:30 AM IST so I'm going to call an end to this AMA and get some lunch.

> Thank you very much for your questions; I hope you found this informative or useful. If you have questions that I did not answer, I sincerely apologize, but suggest you go through my responses in case I answered a similar question by another individual.",1,0,1636253473.0,IAmMohit,False,neutral,neutral,positive,neutral
hjk2lbe,What is the internal leadership’s stance on this?,184,0,1636210737.0,Similar_Tie_8678,False,neutral,neutral,neutral,neutral
hjk4val,"Hi! Thanks for doing this!

Discussing inauthentic behavior is hard - on the one hand exposing too much plays into the hands of predators who then simply evolve.

On the other, civil society, researchers are divorced from data, statistics and measures of efficacy and harm. Not to mention the incentives for Social Media firms to maintain this state of affairs - making matters even more complex and intractable.

So:

1) Given these contradicting imperatives, how can we thread the needle? What can be discussed, and how do you personally estimate where the lines in the sand can be drawn for disclosure.

2) According to you, who do you think holds the advantage right now in the inauthentic behavior cat/mouse game? The defenders or the attackers? 

( How do we even discuss this, if we have to worry about tipping the balance ?)


3) If someone wanted to study how to detect SUMA/Inauthentic behavior, is there a course or publicly available material to learn from? What would you suggest


On a lighter note, since this is reddit - Cat Tax!",71,0,1636211735.0,parlor_tricks,False,neutral,negative,neutral,neutral
hjkb8za,Are you okay? You're currently one of the most important and dangerous(to some) person on the planet. I hope you're given the security you need.,306,0,1636214459.0,,False,negative,positive,negative,negative
hjka0gz,What was the response from the company when you first brought concerns up? Was there any hesitation in acting?,48,0,1636213918.0,Weekly_Noodle,False,neutral,neutral,neutral,neutral
hjlo24e,"I've been answering questions for the past 7 hrs, the questions have died down, and it's 3:30 AM IST so I'm going to call an end to this AMA and get some lunch.  


Thank you very much for your questions; I hope you found this informative or useful. If you have questions that I did not answer, I sincerely apologize, but suggest you go through my responses in case I answered a similar question by another individual.",91,0,1636235742.0,szhang_ds,False,neutral,positive,neutral,neutral
hjk5297,"Thanks for doing this, really appreciate it.
What was the biggest case that you have seen or know of about politicians of any certain party utilising social media, and by extension - Facebook, to interfere in regional elections.
Can you tell of there was any influence or attempts at this this around the West Bengal elections in March?",75,0,1636211819.0,sildarion,False,neutral,positive,positive,positive
hjk9qwp,"I have reported several posts of hate speech and fake news, but the posts still circulate and the pages still exist. Is it because of the bias by Facebook?",37,0,1636213804.0,Nili9988,False,negative,negative,negative,negative
hjk4wqr,Please remember that top level comments are reserved for questions only. Thanks!,100,0,1636211753.0,IAmMohit,False,neutral,neutral,positive,neutral
hjk2r39,"I’n just catching up on all of the Facebook Papers coverage, and now I’m wondering whether Facebook has ever taken decisive action against misinformation networks in “first world” countries? 

Has their response varied in comparison to developing countries like India? 

Should companies like Facebook have separate policies on misinformation for different regions (like South Asia) based on laws and regulations?",25,0,1636210807.0,makapav,False,neutral,neutral,negative,neutral
hjk28dq,"How big of a risk, in your opinion, does Facebook pose to the globe as a whole?",22,0,1636210576.0,,False,neutral,neutral,negative,neutral
hjk46f7,"What do you think about countries like India were there aren't very specific data laws like US and anyone with access to internet here is unknowingly giving away their data for misuse? Except for a small chunk of English speaking people with decent IT knowledge, very few people are aware or care about data privacy and manipulation. What specific directions would you suggest for such countries, from citizens, activists, and goverment?",35,0,1636211431.0,SunSunny07,False,negative,negative,neutral,negative
hjk27vf,"Do you believe Facebook played a very important role in BJP regaining power ? To understand, would Congress have won if Facebook hadn't sided with BJP blatantly?",442,0,1636210569.0,Azorwhy,False,neutral,neutral,neutral,neutral
hjkhxjl,Do you have a security detail now? Seems there are very powerful people that don’t like your whistleblowing. (Fuck those people btw),36,0,1636217337.0,Dont_ban_me_bro_108,False,negative,negative,negative,negative
hjkgtp5,If Zuckerberg were to be deposed/step down how likely do you think that FB would still pursue Libra?,13,0,1636216866.0,Rockglen,False,neutral,neutral,negative,neutral
hjkea64,Can you please tell us Which sitting MP was running the accounts?,34,0,1636215767.0,vgdiv,False,neutral,neutral,neutral,neutral
hjk80u0,"Hi Sophie, what's your recommendation on how to deal with people who easily fall prey to fake news and propaganda? How do you think they can be taught to view things objectively?",10,0,1636213082.0,dicktionary101,False,negative,negative,neutral,negative
hjk5dz5,"Hey Sophie, one thing I always wondered was how do social media companies and Facebook in particular ensure that their policy makers maintain a semblance of neutrality in highly polarised countries like Indian and Brazil. It was revealed that Facebook’s India Policy head Ankhi Das’ was turned a blind eye to problematic content posted by handles affiliated to India’s ruling party and actively disparaged the opposition parties in her internal messages [Ankhi Das WSJ](https://www.wsj.com/amp/articles/facebook-executive-supported-indias-modi-disparaged-opposition-in-internal-messages-11598809348). Are there any checks on such meddling by executives?",18,0,1636211960.0,joecranium,False,neutral,neutral,negative,neutral
hjk5plt,"Question by u/modsbegae:

* What can we do to protect ourselves and how can we persuade other people to take this seriously who simply blow it all off saying, ""Well I'm not an important person so it doesn't matter?""",17,0,1636212099.0,IAmMohit,False,negative,negative,negative,negative
hjkfzxd,Any idea if something similar happens with other countries in South Asia? I only ask because they have similar press freedom rankings.,7,0,1636216516.0,Minuteman60,False,neutral,neutral,neutral,neutral
hjk5sue,"Question by u/arnott:

What do you think about the treatment you are getting compared to Snowden? Why is that? Is it because you are helping the current US leaders in power?",16,0,1636212138.0,IAmMohit,False,neutral,neutral,neutral,neutral
hjk3sx3,Does Facebook have a ethics team albeit just for show?,7,0,1636211267.0,Broke_Gam3r,False,neutral,neutral,negative,neutral
hjkqt9o,Do you have any advice for software developers who work at companies like facebook on how they can contribute to making things better and helping avoid situations where these companies can exploit their position?,13,0,1636221062.0,cosmic_h0rr0r,False,neutral,neutral,neutral,neutral
hjkt1zz,[deleted],5,0,1636222028.0,,False,neutral,neutral,negative,neutral
hjliw4m,"In the southern indian state of Andhra Pradesh, the 2019 elections were run on massive misinformation campaigns by YSRCP lead by Prashant Kishore. The IPAC owned by him recruits people and pays them Rs 5/- through paytm for every social media post made by them. Were you aware of this fake network? I can see they are getting activated again for the 2024 elections.",5,0,1636233422.0,ohmyroots,False,negative,negative,negative,negative
hjkdc1u,Do you think Facebook could have avoided ethnic cleansing of rohingyas if they had better fact checkers?,16,0,1636215364.0,dogofwars,False,negative,negative,neutral,negative
hjk47by,"Based on your experience during working at Facebook, how many of high ranking FB employees did you feel were biased towards BJP ? Surely Ankhi couldn't be the only one. Or was she?",20,0,1636211441.0,ScreenPotato,False,neutral,neutral,negative,neutral
hjk74ox,"Hey!

I’m an independent researcher working on connecting the dots on how a political strategy groups like I-PAC have helped parties like BJP, YSRCP to gain power. 

In 2019, few strategists created bias and used misinformation and propaganda in favour of YSRCP by creating 100s of networks and 1000s of fake profiles. The society is more divided than ever. Fake accounts with surnames of one caste abusing another caste and instigating one among another etc have took place.

This has been a worrying trend, What’s your opinion on regulating the bias on social media? Western institutions are working on products like OsoMe (indiana university opensourced few tools like hoaxy, bot slayer etc under this)! But do they work in developing countries like India?",18,0,1636212706.0,BrewHot,False,neutral,negative,negative,negative
hjk386r,"1. what part of hate we see on FB is due to it's inability to moderate content due to logistical constraints like language barrier? 


What part of it is driven by profits given people who engage on hate are profitable to FB?",4,0,1636211014.0,msquarea,False,negative,negative,negative,negative
hjk4g5a,Has the lack of a data protection law impacted Facebook’s efforts at tackling misinformation in India?,6,0,1636211549.0,makapav,False,negative,negative,negative,negative
hjk4ieq,"How scared are you of Meta? The whole concept seemed super scary without going as far as Sci-Fi. 

What do you think will be a proper way of public oversight on such a platform?",5,0,1636211577.0,paranoidandroid7312,False,negative,negative,negative,negative
hjkte71,"Do platforms like Facebook have the right amount of people and capacity to tackle the diverse content posted in India in multiple languages? 

I notice a lot of caste related, inciting violence type of content posted in native Tamil. Even if reported they don’t get removed. Which makes me wonder if they even have people to manually verify them in their native language.",6,0,1636222178.0,Bon_Koios,False,negative,negative,negative,negative
hjklzow,Do you think this post will be affected by the roaming squads who downvote anything criticising BJP or India?,34,0,1636219025.0,alihassan9193,False,neutral,neutral,neutral,neutral
hjk57sq,"Question by u/lemon_jump:

What is the share of data revenue (in percentage) in the total revenue of Facebook?",9,0,1636211888.0,IAmMohit,False,neutral,neutral,neutral,neutral
hjkryrm,"As of yet, did you receive any phone call or email or any communication from someone 'very high' and ask you to not testify?",8,0,1636221561.0,vpsj,False,neutral,neutral,negative,neutral
hjkyaov,I think there's one question that needs to be answered. Considering you've probably pissed off a lot of powerful people... are you safe?,7,0,1636224315.0,Kflynn1337,False,negative,negative,neutral,negative
hjk42q0,Thank you for your work and courage to help the world be a better place.,5,0,1636211386.0,Zen09D,False,positive,positive,positive,positive
hjk5owr,What papers/books/articles do you read? Anything in particular you’d like to highlight?,3,0,1636212091.0,parlor_tricks,False,neutral,neutral,neutral,neutral
hjkmjqg,More courage to you ᕙ(＠°▽°＠)ᕗ,4,0,1636219251.0,redditabbas,False,positive,positive,positive,positive
hjkvlg5,[removed],6,0,1636223141.0,,1636223850.0,neutral,neutral,negative,neutral
hjk719d,"How big of a network are we talking about? 100s of fake accounts, thousands or millions?",3,0,1636212665.0,Beast_Mstr_64,False,negative,negative,negative,negative
hjkmybu,"This is happening in the Philippines, too. Facebook is the fucking worst.",3,0,1636219418.0,MrJamhamm,False,negative,negative,negative,negative
hjkp07i,"Cats are adorable. I approve this message.

On a serious note, what do you think is the end game here ?

How can a common redditor help with the cause and movement you're deeply involved in?",3,0,1636220284.0,Noobchand,False,positive,positive,positive,positive
hjkp8wt,"Sophie, as an Indian, thank you for your courage. 

My question is : Does Facebook have a scalable solution that can at least partially solve deceptive behavior online (networks/misinformation), but they refuse to use it (either because it reduces profits) ? 

Or do they have no idea how to tackle this problem because it is too hard to distinguish between deceptive content (fake networks / misinformation) and reasonable content (genuine networks / valid information).

Are they afraid that they might anger the wrong people by censoring their posts even though they know the behavior is deceptive, OR, is it that on a technological level, the moderators/AI cannot keep up with the rate at which deceptive content is created.

For instance, earlier this year, in April, India was ravaged by Covid. On social media websites, you would see tons of posts like ""A Covid ICU bed is available at XYZ hospital. Contact so-and-so person"". It would be impossible to look at the post and decide whether it was a scammer targeting desperate people or genuinely heroic citizens trying to help their fellow countrymen.",3,0,1636220385.0,johnnydozenredroses,False,neutral,negative,negative,negative
hjkqdb1,"Hi Sophie. I don't have a question. I just want to thank you for your conviction and tenacity. I have been following the news stories and I'm truly in awe of your courage and simultaneously appalled by what is going on at Facebook. 

Thank you, thank you, thank you! May your tribe increase.",3,0,1636220868.0,Effective-Dig9660,False,positive,positive,positive,positive
hjkubc4,Your analogies and method of explaining stuff are supreme. Really appreciate all your sacrifice for the greater good!,3,0,1636222580.0,iam_ayushks,False,positive,positive,positive,positive
hjkum57,"Things clearly not going well for facebook at the moment, how do you see future of facebook",3,0,1636222713.0,Enough-Ad4608,False,negative,negative,negative,negative
hjlfvxa,don't come to India. They'll not let you once you come …laws are hardly followed stick to online conferencing. Same for other third world countries,3,0,1636232058.0,Dxuian,False,negative,negative,negative,negative
hjn1k4z,"I wish you good luck! A small request, kindly arrange the ama during day time in India, you would have gotten more questions",3,0,1636260090.0,vyper01,False,positive,positive,positive,positive
hjk4mhm,"Hi, sorry for the multiple questions.  
1. How does Reliance-Facebook deal affect Indian WhatsApp users?  
2. Does Cambridge Analytica feature on Facebook anymore? Maybe under a different name?  
3. Did Facebook facilitate Pegasus?  
4. Do you have anything of interest to share with us?",13,0,1636211627.0,r3a10god,False,neutral,neutral,negative,neutral
hjk3v6o,Why Facebook does not consider independent factcheckers? I think It would have been better if they did.,4,0,1636211295.0,amirraza8681,False,negative,negative,negative,negative
hjk5fyp,"Questions by u/Justaphysicsgeek:

* Does Facebook have active moderation on their platform like say Reddit which has moderators on every sub reddit or Discord which has moderators frequently making sure rules are not being violated ? Also how frequently do these mods do their work ? And is the moderation team at Facebook understaffed to deal with such a massive platform ?

* Has there been a rise in the number of bot accounts controlled by Indian Politicians since 2014 ? Because as an Indian, I feel like the amount of mis-information being spread has increased ever since the BJP won the 2014 elections.

* When did this preferential treatment of Indian Politicians on Facebook begin?

* Was there any change in the policies of Facebook in dealing with Indian Users or in general users worldwide after the Russian interference in 2016 US elections ?",4,0,1636211985.0,IAmMohit,False,neutral,neutral,neutral,neutral
hjk64xa,"* How many impressions did these fake accounts make?

* Was the halt in removal due to the network being associated with BJP or because it was a sitting MP?

* You joined in 2018 -  there was a huge election in 2019 - do you have any data on the networks of fake accounts by party affiliation?

* Do you have any data about the fake news/fake account network  targeting Kashmir?

* What outcome do you expect after testifying in front of Lok Sabha committee - given that all of their parties run fake accounts? Do you expect it to be more than lip service? 

* You were fired in September 2020, so way after COVID started - if you have/saw the data was there a correlation between party running accounts and accounts spreading of covid denial. 

* You have mentioned Russian influence in US, is there a similar thing in India? Influence of NGOs, foreign companies, Indian companies, other countries?

* Do you have a rough timeline of when all the accounts would get the most active so we could correlate it with specific incidents?",5,0,1636212282.0,Ok-Yak-2184,1636212552.0,neutral,negative,negative,negative
hjkessz,We know of Ankhi Das (Facebook India policy head) who blatantly sided with BJP and helped swing majority of votes in favour of BJP and eventually helped them win the election. What do you think are the measures which could've/can prevent people in positions like Ankhi Das from influencing future elections?,8,0,1636215991.0,notthatdramatic,False,neutral,neutral,negative,neutral
hjk3lyn,"Facebook has found itself a part of manipulating users by feeding them fake/targetted information even during the US polls and Brexit.

Politicians and deep pocketed business across the world are going to use Facebook increasingly to achieve their ends. 

What changes do u think are needed withing Facebook to prevent this from happening?",2,0,1636211180.0,migma21,False,negative,negative,negative,negative
hjk7a08,"Can you share some advice on how to recognise networks of accounts ? 

Perhaps being able to recognise them might help people have better context about their messaging.",2,0,1636212770.0,sarabjeet_singh,False,neutral,neutral,neutral,neutral
hjk9xct,"1.After recent developments of their plans to become a kids social media platform, political interference and META, and going by a minor trend, 

Is there anything Facebook got right in the recent times ?, 

Not in Product, functionality, feature side but specifically policy wise. 

2. Have Political phenomenons  like BJP, Brexit, MAGA et all been observed or aided in other globally less popular countries ? Ones with smaller population, other democracies or developing countries ?",2,0,1636213880.0,,False,neutral,neutral,neutral,neutral
hjkb3c1,"Hello Mam, thank you for conducting an AMA here and enlightening many of us. appreciate your courage and exposing the truth.

we are already seeing the influence of government in curbing free speech and having some sort of control over the media hosues. a vast majority of population still relies on print and tv media for their source of information. There is a need for an watch-dog authority to keep a check on spreading propaganda.

the internet had been a neutral media for a long time but as the adaption grows, there is a risk of influencing by the govt. especially the big corporate with poor morals. 

I would like to ask you how can we ensure our safety when our opinions do not align with the people in power? 

the most I believe in my powers is to create awareness and write articles, I am studying law and have a desire to create an impact and work towards free unrestricted source of information to common public. (only hurdle that is faced the information wouldn't be immune to propaganda and influence). any suggestions on where to start? thanks?",2,0,1636214392.0,divyad,False,neutral,positive,neutral,neutral
hjkd4z2,Should there be a global community which should handle something as big & Global as FB in this circuit of abhorrent misinformation.,2,0,1636215279.0,MikeRoss95,False,negative,negative,positive,negative
hjkemrv,"Thanks for doing this. My question is this --> What is the level of manipulation that a politician can do using Facebook? I have read the detailed report about cambridge analytica a few years ago, but felt it was overstating the levels of manipulation. I am not convinced that some Russian organization interfered in 2016 via FB to make sure that Trump will win ... similarly his loss in 2020 cannot be attributed to FB manipulation by Biden

My personal opinion (as of now and am open to change) is that yes, politicians can impact the results of their election to a certain extent, but it is far fetched to think that American Presidents can be decided purely based on Facebook campaigns ... Obviously you have an inside view and can state with more knowledge on how these fake accounts/likes actually impact the outcome of an election.

Thanks in Advance!",2,0,1636215919.0,anon_runner,False,neutral,neutral,neutral,neutral
hjkkx26,"In India, WhatsApp I think is a huge issue (just seeing all the forwards my family members get)?

How do you look at fake news when it comes to private channels? Facebook (the platform) at least is a public arena. Whatsapp has insane distribution and is private channels. Is there anything that can be done?",2,0,1636218584.0,cricketrules509,False,negative,negative,negative,negative
hjkls6y,">but everything suddenly went silent after we discovered they were connected to the account of the benefiting MP (meaning that someone with access to the MP's personal account was almost certainly running the fake accounts.)

Who's this MP?",2,0,1636218940.0,Johny_Silver_Hand,False,negative,negative,negative,negative
hjkmhjj,Is there any way you can educate and inform Indians about the dangers of auto likers? Coz most people on Instagram use it here.,2,0,1636219226.0,,False,neutral,neutral,negative,neutral
hjkmymg,"Sorry, if it is too late, but, is social media making teens work less harder? I've seen a few instances, like a friend of mine rewards himself by watching reels after half an hour of ""study"".  and another is following a fellow who did not clear an exam, but still earns quite well, so my friend has started taking things easy and is like this exam wont decide my future. Well if he isnt ready to work hard rn, m sure he wont do it in future either. And other is MLMs. This makes me think that social media is impacting teens in a way where they dont want to work hard at all, and demand rewards for doing most basic things. Do you think it is true? And what are other factors that are included?",2,0,1636219421.0,FamiliarMove873,False,negative,neutral,neutral,neutral
hjknbvr,"First, thank you so much for doing this AMA.

Is there any truth in the anecdotal stories where someone mentions a product or service out loud and then for days after, Facebook and other sites serve ads that are custom to that product or service?

If so, how does that work?",2,0,1636219575.0,HemetValleyMall1982,False,neutral,positive,positive,positive
hjkpbfd,I really think Facebook should be shut down. It's done more harm than good. The world will be a better place without Facebook. And what's app. These social media sites are the cesspools of false information.,2,0,1636220415.0,sns59444,False,negative,negative,negative,negative
hjkvkim,"Since México demagogue is similar to modi, you think they are doing the same here in mexico?",2,0,1636223129.0,ofteno,1636227531.0,negative,neutral,neutral,neutral
hjkxhlo,"Any idea on how the business model / value chain of entire fake account networks is designed?
1. Can same IT cell provide itself services to political opponents? Are they politically agnostic?
2. Can you guesstimate out the budget looking at the data? Pricing model? Through ads and paid promotions? 
3. Does it massively benefit FB, considering that the IT Cell owned account would be using more ads/paid content than regular users, making FB more inclined to allow them to exist?",2,0,1636223961.0,mer_sault,False,neutral,neutral,neutral,neutral
hjkxrvq,Any involvement of IPAC or other external companies acting onbehalf of parties? Considering both Punjab and Delhi elections for INC and AAP  were run by IPAC.,2,0,1636224087.0,realcul,False,neutral,neutral,neutral,neutral
